Outbreak,Pathogen etiology,Year(s) of outbreak,Date recorded,Disease/pathogen name,Event,Country,ISO code,Outbreak epicenter,Outbreak start,Outbreak detection,Outbreak notification,Outbreak notification to WHO,Outbreak verification,Laboratory confirmation,Outbreak end,Duration,Confirmed cases,Probable cases,Suspected cases,Total cases,Death count,Case-Fatality ratio,Public health intervention,Public communication,Mass gatherings,Community resistance,Notes,Link,DONid
1996-Cholera-BDI,5,1996,1/22/1996,Cholera,NA,Burundi,BDI,"Maramvya, Gatumba",NA,end August 1995,NA,NA,NA,NA,NA,NA,NA,NA,NA,>2300,NA,NA,yes,NA,NA,NA,NA,https://www.who.int/csr/don/1996_01_22f/en/,DON-1996-01-22f
1996-Typhoid Fever-DZA,5,1996,1/22/1996,Typhoid fever,NA,Algeria,DZA,Ain Taya,NA,NA,01/??/1996,NA,NA,NA,NA,NA,NA,NA,NA,NA,NA,NA,yes,NA,NA,NA,NA,https://www.who.int/csr/don/1996_01_22e/en/,DON-1996-01-22e
1996-Meningococcal Disease-BRA,1,1996,1/22/1996,Meningococcal meningitis,NA,Brazil,BRA,Rio de Janeiro,NA,NA,NA,12/28/1995,NA,NA,NA,NA,NA,NA,NA,1106,NA,NA,yes,NA,NA,NA,increase in incidence in past 10 years; numbers for 1995,https://www.who.int/csr/don/1996_01_22d/en/,DON-1996-01-22d
1996-Ebola-LBR,2,1996,1/22/1996,Ebola,NA,Liberia,LBR,Plibo Village,NA,NA,NA,12/6/1995,NA,yes,NA,NA,1,NA,3,NA,NA,NA,yes,NA,NA,NA,treated in Cote d'Ivoire,https://www.who.int/csr/don/1996_01_22c/en/,DON-1996-01-22c
1996-Dengue-Americas,6,1996,1/22/1996,Dengue,NA,Americas,NA,NA,NA,NA,NA,11/15/1995,NA,NA,NA,NA,NA,NA,NA,>200000,NA,NA,NA,NA,NA,NA,NA,https://www.who.int/csr/don/1996_01_22b/en/,DON-1996-01-22b
1996-Dengue-Americas,6,1996,1/22/1996,Dengue haemorrhagic fever,NA,Americas,NA,NA,NA,NA,NA,11/15/1995,NA,NA,NA,NA,NA,NA,NA,>5500,NA,NA,NA,NA,NA,NA,NA,https://www.who.int/csr/don/1996_01_22b/en/,DON-1996-01-22b
1996-Cholera-CPV,5,1996,1/22/1996,Cholera,NA,Cap Verde,CPV,all 9 islands,NA,NA,11/??/1994,NA,NA,NA,NA,NA,NA,NA,NA,12344,245,NA,yes,NA,NA,NA,NA,https://www.who.int/csr/don/1996_01_22a/en/,DON-1996-01-22a
1996-Cholera-CIV,5,1996,1/22/1996,Cholera,NA,Cote d'Ivoire,CIV,NA,09/??/1995,NA,NA,NA,9/18/1995,NA,NA,NA,NA,NA,NA,2027,150,NA,yes,NA,NA,NA,NA,https://www.who.int/csr/don/1996_01_22a/en/,DON-1996-01-22a
1996-Cholera-IRN,5,1996,1/22/1996,Cholera,NA,Iran,IRN,Kordestan,NA,NA,NA,NA,NA,NA,1/12/1995,NA,0,NA,NA,0,0,NA,NA,NA,NA,NA,declared cholera free,https://www.who.int/csr/don/1996_01_22a/en/,DON-1996-01-22a
1996-Cholera-IRQ,5,1996,1/22/1996,Cholera,NA,Iraq,IRQ,Sulaimaniyah,NA,NA,yes,NA,NA,yes,NA,NA,264,NA,NA,519,3,NA,yes,yes,NA,NA,NA,https://www.who.int/csr/don/1996_01_22a/en/,DON-1996-01-22a
1996-Cholera-SEN,5,1996,1/22/1996,Cholera,NA,Senegal,SEN,"Dakar, Pikine, Mbacke, Touba",NA,NA,8/15/1995,NA,NA,NA,NA,NA,NA,NA,NA,852,43,NA,NA,NA,NA,NA,unclear dates and numbers,https://www.who.int/csr/don/1996_01_22a/en/,DON-1996-01-22a
1996-Yellow Fever-LBR,6,1996,2/2/1996,Yellow fever,NA,Liberia,LBR,"Tubmanburg (Boma County), Salala (Bong County), and Greenville (Sinoe County), Margibi, Monserado and Grand Gedeh Counties",NA,NA,NA,NA,NA,NA,NA,NA,NA,NA,NA,NA,NA,NA,yes,NA,NA,NA,unclear case count,https://www.who.int/csr/don/1996_02_02/en/,DON-1996-02-02
1996-HPS-BIH,4,1996,2/5/1996,Haemorrhagic fever with renal syndrome (HFRS),NA,Bosnia and Herzegovina,BIH,NA,NA,NA,01/??/1995,NA,NA,NA,NA,NA,NA,NA,NA,367,5,NA,yes,NA,NA,NA,NA,https://www.who.int/csr/don/1996_02_05/en/,DON-1996-02-05
1996-Cholera-IRN,5,1996,2/8/1996,Cholera,NA,Iran,IRN,NA,NA,NA,NA,NA,NA,NA,yes,NA,0,NA,NA,0,0,NA,NA,NA,NA,NA,cholera free,https://www.who.int/csr/don/1996_02_08/en/,DON-1996-02-08
1996-Cholera-Africa,5,1996,2/15/1996,Cholera,NA,Africa,NA,"Burkina Faso, Cap Verde, Mali, Senegal and in the Americas in Argentina and Ecuador (mainly Imbabura Province)",NA,NA,NA,2/12/1996,NA,NA,NA,NA,NA,NA,NA,NA,NA,NA,NA,NA,NA,NA,NA,https://www.who.int/csr/don/1996_02_15/en/,DON-1996-02-15
1996-Meningitis-NGA,1,1996,2/19/1996,Cerebrospinal meningitis,NA,Nigeria,NGA,"Kano, Bauchi, Kebbi, Kwara, Niger, Taraba, Sokoto, Katsina, Cross River",NA,NA,NA,2/15/1996,NA,NA,NA,NA,NA,NA,NA,>3000,>400,NA,yes,NA,NA,NA,NA,https://www.who.int/csr/don/1996_02_19c/en/,DON-1996-02-19c
1996-Ebola-GAB,2,1996,2/19/1996,Ebola haemorrhagic fever,NA,Gabon,GAB,Makokou,NA,NA,NA,NA,yes,yes,NA,NA,9,NA,NA,20,13,NA,yes,NA,NA,NA,NA,https://www.who.int/csr/don/1996_02_19b/en/,DON-1996-02-19b
1996-Listeria-GAB,5,1996,2/19/1996,Febrile gastroenteritis,NA,Gabon,GAB,Mayibout,NA,NA,NA,2/13/1996,NA,NA,NA,NA,NA,NA,NA,19,10,NA,yes,NA,NA,NA,NA,https://www.who.int/csr/don/1996_02_19b/en/,DON-1996-02-19b
1996-Meningitis-BFA,1,1996,2/19/2996,Cerebrospinal meningitis,NA,Burkina Faso,BFA,"Yatenga, Bam",NA,NA,2/7/1996,NA,NA,NA,NA,NA,NA,NA,NA,1138,57,NA,yes,NA,NA,NA,NA,https://www.who.int/csr/don/1996_02_19a/en/,DON-1996-02-19a
1996-Ebola-GAB,2,1996,2/29/1996,Ebola haemorrhagic fever,NA,Gabon,GAB,NA,NA,NA,NA,2/27/1996,NA,NA,NA,NA,NA,NA,NA,24,17,NA,yes,NA,NA,NA,NA,https://www.who.int/csr/don/1996_02_29b/en/,DON-1996-02-29b
1996-Cholera-ECU,5,1996,2/29/1996,Cholera,NA,Ecuador,ECU,"Otobalo indigenous community, Imbabura",NA,NA,1/1/1996,NA,NA,NA,NA,NA,NA,NA,NA,416,4,NA,yes,NA,NA,NA,NA,https://www.who.int/csr/don/1996_02_29a/en/,DON-1996-02-29a
1996-Ebola-GAB,2,1996,3/1/1996,Ebola haemorrhagic fever,NA,Gabon,GAB,NA,NA,NA,2/29/1996,NA,NA,NA,NA,NA,NA,NA,NA,27,18,NA,yes,NA,NA,NA,NA,https://www.who.int/csr/don/1996_03_01c/en/,DON-1996-03-01c
1996-Meningitis-NGA,1,1996,3/1/1996,Meningococcal meningitis,NA,Nigeria,NGA,"Adamawa, Bauchi, Kano, Kaduna, Katsina, Kebbi, Kwara, Niger, Sokoto, Taraba Cross River States",Early January 1996,NA,2/29/1996,NA,NA,yes,NA,NA,4,NA,NA,8423,1181,14,yes,NA,NA,NA,NA,https://www.who.int/csr/don/1996_03_01b/en/,DON-1996-03-01b
1996-Cholera-NGA,5,1996,3/1/1996,Cholera,NA,Nigeria,NGA,"Kano, Kwara, Ondo, Oyo",NA,NA,2/19/1996,NA,NA,NA,NA,NA,NA,NA,NA,1487,99,NA,NA,NA,NA,NA,NA,https://www.who.int/csr/don/1996_03_01a/en/,DON-1996-03-01a
1996-Cholera-NGA,5,1996,3/6/1996,Cholera,NA,Nigeria,NGA,"Kano, Kwara, Ondo, Oyo",NA,NA,3/4/1996,NA,NA,NA,NA,NA,NA,NA,NA,2662,288,NA,NA,NA,NA,NA,NA,https://www.who.int/csr/don/1996_03_06c/en/,DON-1996-03-06c
1996-Meningitis-NGA,1,1996,3/6/1996,Meningococcal meningitis,NA,Nigeria,NGA,"Adamawa, Bauchi, Benue, Cross River, Kano, Kaduna, Katsina, Kebbi, Kwara, Niger, Sokoto, and Taraba",NA,NA,01/??/1996,NA,NA,NA,NA,NA,NA,NA,NA,15733,2411,NA,yes,NA,NA,NA,NA,https://www.who.int/csr/don/1996_03_06b/en/,DON-1996-03-06b
1996-Cholera-Global,5,1996,3/6/1996,Cholera,NA,Global,NA,"Cap Verde, Niger, Nigeria, Senegal and Somalia in Africa and in Mexico",NA,NA,yes,NA,NA,NA,NA,NA,NA,NA,NA,NA,NA,NA,NA,NA,NA,NA,NA,https://www.who.int/csr/don/1996_03_06a/en/,DON-1996-03-06a
1996-Meningitis-NGA,1,1996,3/7/1996,Cerebrospinal meningitis,NA,Nigeria,NGA,"Adamawa, Bauchi, Benue, Cross River, Enugu, Jigawa, Kano, Kaduna, Katsina, Kebbi, Kwara, Niger, Plateau, Sokoto and Taraba States",NA,NA,NA,3/5/1996,NA,NA,NA,NA,NA,NA,NA,17668,2550,NA,NA,NA,NA,NA,NA,https://www.who.int/csr/don/1996_03_07b/en/,DON-1996-03-07b
1996-Cholera-NGA,5,1996,3/7/1996,Cholera,NA,Nigeria,NGA,NA,NA,NA,NA,3/5/1996,NA,NA,NA,NA,NA,NA,NA,2836,299,NA,NA,NA,NA,NA,NA,https://www.who.int/csr/don/1996_03_07a/en/,DON-1996-03-07a
1996-Meningitis-NGA,1,1996,3/12/1996,Cerebrospinal meningitis,NA,Nigeria,NGA,NA,NA,NA,NA,NA,NA,yes,NA,NA,NA,NA,NA,NA,NA,NA,NA,NA,NA,NA,Neisseria meningitidis serogroup A confirmed,https://www.who.int/csr/don/1996_03_12b/en/,DON-1996-03-12b
1996-Meningitis-TCD,1,1996,3/12/1996,Cerebrospinal meningitis,NA,Chad,TCD,"Kumra, Dobba, Abeche",NA,NA,3/11/1996,NA,NA,NA,NA,NA,NA,NA,NA,244,19,NA,3/5/1996,NA,NA,NA,NA,https://www.who.int/csr/don/1996_03_12/en/,DON-1996-03-12
1996-Cholera-SEN,5,1996,3/15/1996,Cholera,NA,Senegal,SEN,"Louga, Mbacke, Touba, Fatick, St Louis, Thies, Dakar",08/??/1995,NA,NA,NA,NA,NA,NA,NA,NA,NA,NA,3031,188,NA,NA,NA,NA,NA,NA,https://www.who.int/csr/don/1996_03_15c/en/,DON-1996-03-15c
1996-Meningitis-BEN,1,1996,3/15/1996,Cerebrospinal meningitis,NA,Benin,BEN,NA,NA,NA,NA,3/13/1996,NA,NA,NA,NA,NA,NA,NA,251,34,NA,NA,NA,NA,NA,NA,https://www.who.int/csr/don/1996_03_15b/en/,DON-1996-03-15b
1996-Meningitis-BFA,1,1996,3/15/1996,Cerebrospinal meningitis,NA,Burkina Faso,BFA,"Bam, CHN-Yo, Yatenga",NA,NA,1/1/1996,3/13/1996,NA,NA,NA,NA,NA,NA,NA,8252,722,NA,yes,NA,NA,NA,NA,https://www.who.int/csr/don/1996_03_15b/en/,DON-1996-03-15b
1996-Meningitis-MLI,1,1996,3/15/1996,Cerebrospinal meningitis,NA,Mali,MLI,NA,NA,NA,NA,3/13/1996,NA,NA,NA,NA,NA,NA,NA,787,158,NA,yes,NA,NA,NA,NA,https://www.who.int/csr/don/1996_03_15b/en/,DON-1996-03-15b
1996-Meningitis-NGA,1,1996,3/15/1996,Cerebrospinal meningitis,NA,Nigeria,NGA,17 states in north,NA,NA,NA,3/13/1996,NA,NA,NA,NA,NA,NA,NA,22545,3889,NA,NA,NA,NA,NA,NA,https://www.who.int/csr/don/1996_03_15b/en/,DON-1996-03-15b
1996-Meningitis-TCD,1,1996,3/15/1996,Cerebrospinal meningitis,NA,Chad,TCD,NA,NA,NA,NA,3/13/1996,NA,NA,NA,NA,NA,NA,NA,244,19,NA,NA,NA,NA,NA,NA,https://www.who.int/csr/don/1996_03_15b/en/,DON-1996-03-15b
1996-Meningitis-CAF,1,1996,3/15/1996,Cerebrospinal meningitis,NA,Central African Republic,CAF,NA,NA,NA,NA,3/13/1996,NA,NA,NA,NA,NA,NA,NA,152,22,NA,NA,NA,NA,NA,NA,https://www.who.int/csr/don/1996_03_15b/en/,DON-1996-03-15b
1996-Meningitis-CMR,1,1996,3/15/1996,Cerebrospinal meningitis,NA,Cameroon,CMR,NA,NA,NA,NA,3/13/1996,NA,NA,NA,NA,NA,NA,NA,5,1,NA,NA,NA,NA,NA,NA,https://www.who.int/csr/don/1996_03_15b/en/,DON-1996-03-15b
1996-Meningitis-NER,1,1996,3/15/1996,Cerebrospinal meningitis,NA,Niger,NER,NA,NA,NA,NA,3/13/1996,NA,NA,NA,NA,NA,NA,NA,4808,503,NA,NA,NA,NA,NA,NA,https://www.who.int/csr/don/1996_03_15b/en/,DON-1996-03-15b
1996-Cholera-NGA,5,1996,3/15/1996,Cholera,NA,Nigeria,NGA,"Kano, Kaduna, Kebbi, Oyo, Kwara, Niger",NA,NA,3/11/1996,NA,NA,NA,NA,NA,NA,NA,NA,6117,487,NA,NA,NA,NA,NA,NA,https://www.who.int/csr/don/1996_03_15a/en/,DON-1996-03-15a
1996-Meningitis-BEN,1,1996,3/19/1996,Cerebrospinal meningitis,NA,Benin,BEN,NA,NA,NA,NA,NA,NA,NA,NA,NA,NA,NA,NA,362,46,NA,NA,NA,NA,NA,NA,https://www.who.int/csr/don/1996_03_19/en/,DON-1996-03-19
1996-Meningitis-BFA,1,1996,3/19/1996,Cerebrospinal meningitis,NA,Burkina Faso,BFA,NA,NA,NA,NA,NA,NA,NA,NA,NA,NA,NA,NA,9532,859,NA,NA,NA,NA,NA,NA,https://www.who.int/csr/don/1996_03_19/en/,DON-1996-03-19
1996-Meningitis-MLI,1,1996,3/19/1996,Cerebrospinal meningitis,NA,Mali,MLI,NA,NA,NA,NA,NA,NA,NA,NA,NA,NA,NA,NA,787,158,NA,NA,NA,NA,NA,NA,https://www.who.int/csr/don/1996_03_19/en/,DON-1996-03-19
1996-Meningitis-NGA,1,1996,3/19/1996,Cerebrospinal meningitis,NA,Nigeria,NGA,NA,NA,NA,NA,NA,NA,NA,NA,NA,NA,NA,NA,20982,3634,NA,NA,NA,NA,NA,NA,https://www.who.int/csr/don/1996_03_19/en/,DON-1996-03-19
1996-Meningitis-TCD,1,1996,3/19/1996,Cerebrospinal meningitis,NA,Chad,TCD,NA,NA,NA,NA,NA,NA,NA,NA,NA,NA,NA,NA,244,19,NA,NA,NA,NA,NA,NA,https://www.who.int/csr/don/1996_03_19/en/,DON-1996-03-19
1996-Meningitis-CAF,1,1996,3/19/1996,Cerebrospinal meningitis,NA,Central African Republic,CAF,NA,NA,NA,NA,NA,NA,NA,NA,NA,NA,NA,NA,155,22,NA,NA,NA,NA,NA,NA,https://www.who.int/csr/don/1996_03_19/en/,DON-1996-03-19
1996-Meningitis-CMR,1,1996,3/19/1996,Cerebrospinal meningitis,NA,Cameroon,CMR,NA,NA,NA,NA,NA,NA,NA,NA,NA,NA,NA,NA,5,1,NA,NA,NA,NA,NA,NA,https://www.who.int/csr/don/1996_03_19/en/,DON-1996-03-19
1996-Meningitis-NER,1,1996,3/19/1996,Cerebrospinal meningitis,NA,Niger,NER,NA,NA,NA,NA,NA,NA,NA,NA,NA,NA,NA,NA,5529,584,NA,NA,NA,NA,NA,NA,https://www.who.int/csr/don/1996_03_19/en/,DON-1996-03-19
1996-Meningitis-GHA,1,1996,3/19/1996,Cerebrospinal meningitis,NA,Ghana,GHA,NA,NA,NA,NA,NA,NA,NA,NA,NA,NA,NA,NA,18,0,NA,NA,NA,NA,NA,NA,https://www.who.int/csr/don/1996_03_19/en/,DON-1996-03-19
1996-Meningitis-TZA,1,1996,3/19/1996,Cerebrospinal meningitis,NA,Tanzania,TZA,NA,NA,NA,NA,NA,NA,NA,NA,NA,NA,NA,NA,99,8,NA,NA,NA,NA,NA,NA,https://www.who.int/csr/don/1996_03_19/en/,DON-1996-03-19
1996-Meningitis-TGO,1,1996,3/19/1996,Cerebrospinal meningitis,NA,Togo,TGO,NA,NA,NA,NA,NA,NA,NA,NA,NA,NA,NA,NA,183,33,NA,NA,NA,NA,NA,NA,https://www.who.int/csr/don/1996_03_19/en/,DON-1996-03-19
1996-Creutzfeldt-Jakob Disease-GBR,5,1996,3/21/1996,Creutzfeldt-Jakob Disease (CJD),NA,United Kingdom,GBR,NA,NA,NA,NA,NA,NA,NA,NA,NA,NA,NA,NA,10,NA,NA,yes,NA,NA,NA,differs from classic CJD,https://www.who.int/csr/don/1996_03_21/en/,DON-1996-03-21
1996-Meningitis-BEN,1,1996,3/27/1996,Cerebrospinal meningitis,NA,Benin,BEN,NA,NA,NA,NA,yes,NA,NA,NA,NA,NA,NA,NA,424,56,NA,NA,NA,NA,NA,NA,https://www.who.int/csr/don/1996_03_27/en/,DON-1996-03-27
1996-Meningitis-BFA,1,1996,3/27/1996,Cerebrospinal meningitis,NA,Burkina Faso,BFA,NA,NA,NA,NA,yes,NA,NA,NA,NA,NA,NA,NA,11866,1064,NA,NA,NA,NA,NA,NA,https://www.who.int/csr/don/1996_03_27/en/,DON-1996-03-27
1996-Meningitis-MLI,1,1996,3/27/1996,Cerebrospinal meningitis,NA,Mali,MLI,NA,NA,NA,NA,yes,NA,NA,NA,NA,NA,NA,NA,1404,227,NA,NA,NA,NA,NA,NA,https://www.who.int/csr/don/1996_03_27/en/,DON-1996-03-27
1996-Meningitis-NGA,1,1996,3/27/1996,Cerebrospinal meningitis,NA,Nigeria,NGA,NA,NA,NA,NA,yes,NA,NA,NA,NA,NA,NA,NA,30212,4346,NA,NA,NA,NA,NA,NA,https://www.who.int/csr/don/1996_03_27/en/,DON-1996-03-27
1996-Meningitis-TCD,1,1996,3/27/1996,Cerebrospinal meningitis,NA,Chad,TCD,NA,NA,NA,NA,yes,NA,NA,NA,NA,NA,NA,NA,505,53,NA,NA,NA,NA,NA,NA,https://www.who.int/csr/don/1996_03_27/en/,DON-1996-03-27
1996-Meningitis-CAF,1,1996,3/27/1996,Cerebrospinal meningitis,NA,Central African Republic,CAF,NA,NA,NA,NA,yes,NA,NA,NA,NA,NA,NA,NA,155,122,NA,NA,NA,NA,NA,NA,https://www.who.int/csr/don/1996_03_27/en/,DON-1996-03-27
1996-Meningitis-CMR,1,1996,3/27/1996,Cerebrospinal meningitis,NA,Cameroon,CMR,NA,NA,NA,NA,yes,NA,NA,NA,NA,NA,NA,NA,5,1,NA,NA,NA,NA,NA,NA,https://www.who.int/csr/don/1996_03_27/en/,DON-1996-03-27
1996-Meningitis-NER,1,1996,3/27/1996,Cerebrospinal meningitis,NA,Niger,NER,NA,NA,NA,NA,yes,NA,NA,NA,NA,NA,NA,NA,6518,676,NA,NA,NA,NA,NA,NA,https://www.who.int/csr/don/1996_03_27/en/,DON-1996-03-27
1996-Meningitis-GHA,1,1996,3/27/1996,Cerebrospinal meningitis,NA,Ghana,GHA,NA,NA,NA,NA,yes,NA,NA,NA,NA,NA,NA,NA,18,0,NA,NA,NA,NA,NA,NA,https://www.who.int/csr/don/1996_03_27/en/,DON-1996-03-27
1996-Meningitis-TZA,1,1996,3/27/1996,Cerebrospinal meningitis,NA,Tanzania,TZA,NA,NA,NA,NA,yes,NA,NA,NA,NA,NA,NA,NA,99,8,NA,NA,NA,NA,NA,NA,https://www.who.int/csr/don/1996_03_27/en/,DON-1996-03-27
1996-Meningitis-TGO,1,1996,3/27/1996,Cerebrospinal meningitis,NA,Togo,TGO,NA,NA,NA,NA,yes,NA,NA,NA,NA,NA,NA,NA,505,53,NA,NA,NA,NA,NA,NA,https://www.who.int/csr/don/1996_03_27/en/,DON-1996-03-27
1996-Meningitis-COD,1,1996,3/27/1996,Cerebrospinal meningitis,NA,Zaire,COD,NA,NA,NA,NA,yes,NA,NA,NA,NA,NA,NA,NA,69,5,NA,NA,NA,NA,NA,NA,https://www.who.int/csr/don/1996_03_27/en/,DON-1996-03-27
1996-Creutzfeldt-Jakob Disease-GBR,5,1996,3/28/1996,Bovine Spongiform Encephalopathy (BSE),NA,United Kingdom,GBR,NA,NA,NA,NA,3/20/1996,NA,NA,NA,NA,NA,NA,NA,10,NA,NA,4/2/1996,NA,NA,NA,same as CJD from 3/21,https://www.who.int/csr/don/1996_03_28/en/,DON-1996-03-28
1996-Cholera-COD,5,1996,4/2/1996,Cholera,NA,Zaire,COD,"Barumbu, Kinshasa, Limete/Kingaba and Kingwala",NA,NA,NA,3/29/1996,NA,NA,NA,NA,NA,NA,NA,147,33,NA,yes,yes,NA,NA,NA,https://www.who.int/csr/don/1996_04_04b/en/,DON-1996-04-04b
1996-Creutzfeldt-Jakob Disease-GBR,5,1996,4/4/1996,Bovine Spongiform Encephalopathy (BSE),NA,United Kingdom,GBR,NA,NA,NA,NA,NA,NA,NA,NA,NA,NA,NA,5,NA,NA,NA,4/2/1996,NA,NA,NA,WHO consultation held in Geneva,https://www.who.int/csr/don/1996_04_04a/en/,DON-1996-04-04a
1996-Buffalopox-IND,4,1996,4/11/1996,Buffalopox,NA,India,IND,Beed district,NA,NA,NA,NA,NA,NA,NA,NA,NA,NA,NA,NA,NA,NA,yes,NA,NA,NA,NA,https://www.who.int/csr/don/1996_04_11/en/,DON-1996-04-11
1996-Ebola Reston Virus-USA,4,1996,4/17/1996,Ebola-like Reston virus,NA,United States,USA,Texas,NA,NA,NA,NA,NA,NA,NA,NA,0,NA,NA,0,0,NA,NA,NA,NA,NA,outbreak in monkeys imported from Philippines,https://www.who.int/csr/don/1996_04_17/en/,DON-1996-04-17
1996-Ebola-GAB,2,1996,4/26/1996,Ebola haemorrhagic fever,NA,Gabon,GAB,"Mayibout II, Makokou Health District",NA,NA,NA,NA,NA,NA,3/12/1996,NA,NA,NA,NA,37,NA,NA,yes,NA,NA,NA,NA,https://www.who.int/csr/don/1996_04_26b/en/,DON-1996-04-26b
1996-Cholera-LBR,5,1996,4/26/1996,Cholera,NA,Liberia,LBR,"BTC district of Monrovia, IDP compound in Greystone",NA,NA,NA,NA,NA,4/22/1996,NA,NA,NA,NA,NA,>47,NA,NA,yes,NA,NA,NA,NA,https://www.who.int/csr/don/1996_04_26/en/,DON-1996-04-26
1996-Ebola Reston Virus-USA,4,1996,4/30/1996,Ebola-Reston virus,NA,Philippines,PHL,"Ferlite Scientific Research Inc. Monkey Farm (Calamba, Laguna)",NA,NA,NA,NA,NA,NA,NA,NA,0,NA,NA,0,0,NA,yes,NA,NA,NA,investigation of monkey fam in Philippines,https://www.who.int/csr/don/1996_04_30/en/,DON-1996-04-30
1996-Meningitis-MLI,1,1996,5/3/1996,Meningococcal meningitis,NA,Mali,MLI,"Dioila, Bamako",NA,Beginning February 1996,NA,yes,NA,yes,NA,NA,NA,NA,NA,2347,319,13.6,3/15/1996,NA,NA,NA,NA,https://www.who.int/csr/don/1996_05_03/en/,DON-1996-05-03
1996-Lassa Fever-SLE,2,1996,5/15/1996,Lassa fever,NA,Sierra Leone,SLE,Kenema,NA,NA,NA,NA,NA,NA,NA,NA,NA,NA,76,NA,46,NA,5/9/1996,NA,NA,NA,NA,https://www.who.int/csr/don/1996_05_15/en/,DON-1996-05-15
1996-Cholera-LBR,5,1996,5/20/1996,Cholera,NA,Malaysia,MYS,Penang,NA,5/10/1996,NA,NA,NA,5/11/1996,NA,NA,607,NA,NA,NA,NA,NA,yes,NA,NA,NA,NA,https://www.who.int/csr/don/1996_05_20/en/,DON-1996-05-20
1996-Lassa Fever-SLE,2,1996,5/28/1996,Lassa fever,NA,Sierra Leone,SLE,Kenema,NA,NA,NA,NA,NA,yes,NA,NA,9,NA,NA,87,47,NA,yes,NA,NA,NA,NA,https://www.who.int/csr/don/1996_05_28/en/,DON-1996-05-28
1996-Meningococcal Disease-ESP,1,1996,5/31/1996,Meningococcal infection,NA,Spain,ESP,Mallorca,NA,5/17/1996,NA,no,NA,yes,NA,NA,2,NA,2,NA,2,NA,yes,NA,NA,NA,NA,https://www.who.int/csr/don/1996_05_31/en/,DON-1996-05-31
1996-Meningococcal Disease-ESP,1,1996,6/3/1996,Meningococcal infection,NA,Spain,ESP,Mallorca,NA,NA,NA,NA,NA,yes,NA,NA,NA,NA,NA,NA,NA,NA,NA,NA,NA,NA,NA,https://www.who.int/csr/don/1996_06_03/en/,DON-1996-06-03
1996-Meningococcal Disease-GBR,1,1996,6/3/1996,Meningococcal infection,NA,United Kingdom,GBR,NA,NA,NA,NA,NA,NA,yes,NA,NA,NA,NA,NA,NA,NA,NA,NA,NA,NA,NA,higher season than normal,https://www.who.int/csr/don/1996_06_03/en/,DON-1996-06-03
1996-Cholera-LBR,5,1996,6/14/1996,Cholera,NA,Malaysia,MYS,"Penang, Kedah",NA,NA,NA,NA,NA,NA,yes,NA,NA,NA,NA,NA,0,NA,yes,NA,NA,NA,no new cases in Penang,https://www.who.int/csr/don/1996_06_14d/en/,DON-1996-06-14d
1996-Cholera-PHL,5,1996,6/14/1996,Cholera,NA,Philippines,PHL,Bganga,5/15/1996,NA,NA,NA,NA,NA,NA,NA,NA,NA,NA,214,4,NA,yes,NA,NA,NA,NA,https://www.who.int/csr/don/1996_06_14c/en/,DON-1996-06-14c
1996-Dengue-MYS,6,1996,6/14/1996,Dengue/Dengue haemorrhagic fever,NA,Malaysia,MYS,"Federal Territory, Selangor, Perak, Johor and Pahang",NA,NA,NA,NA,NA,NA,NA,NA,NA,NA,NA,2450,NA,NA,yes,NA,NA,NA,NA,https://www.who.int/csr/don/1996_06_14b/en/,DON-1996-06-14b
1996-Dengue-IND,6,1996,6/14/1996,Dengue/Dengue haemorrhagic fever,NA,Indonesia,IDN,11/27 provinces,NA,NA,6/1/1996,NA,NA,NA,NA,NA,NA,NA,NA,5000,117,NA,yes,yes,NA,NA,NA,https://www.who.int/csr/don/1996_06_14b/en/,DON-1996-06-14b
1996-Lassa Fever-SLE,2,1996,6/14/1996,Lassa fever,NA,Sierra Leone,SLE,"Kailahun, Kenema",NA,NA,01/??/1996,NA,NA,NA,NA,NA,NA,NA,NA,167,60,NA,yes,NA,NA,NA,NA,https://www.who.int/csr/don/1996_06_14a/en/,DON-1996-06-14a
1996-Cholera-COD,5,1996,7/5/1996,Cholera,NA,Zaire,COD,Bandunu,04/??/1996,NA,mid-April 1996,NA,NA,NA,NA,NA,NA,NA,NA,821,179,NA,yes,NA,NA,NA,NA,https://www.who.int/csr/don/1996_07_05b/en/,DON-1996-07-05b
1996-Cholera-TCD,5,1996,7/5/1996,Cholera,NA,Chad,TCD,souther part of N'Djamena + 7 villages on main route going south,NA,NA,6/3/1996,NA,NA,NA,NA,NA,NA,NA,NA,601,51,NA,yes,NA,NA,NA,NA,https://www.who.int/csr/don/1996_07_05/en/,DON-1996-07-05
1996-Meningitis-MOZ,1,1996,7/11/1996,Cerebrospinal meningitis,NA,Mozambique,MOZ,"Cabo Delgado, Namuno, Monepues, Balama",NA,NA,yes,NA,NA,NA,NA,NA,NA,NA,NA,18,4,NA,yes,NA,NA,NA,NA,https://www.who.int/csr/don/1996_07_11/en/,DON-1996-07-11
1996-Dengue-PHL,6,1996,7/18/1996,Dengue/Dengue haemorrhagic fever,NA,Philippines,PHL,NA,NA,NA,7/14/1996,NA,NA,NA,NA,NA,NA,NA,NA,1485,26,NA,yes,NA,NA,NA,NA,https://www.who.int/csr/don/1996_07_18/en/,DON-1996-07-18
1996-Dengue-MYS,6,1996,7/18/1996,Dengue/Dengue haemorrhagic fever,NA,Malaysia,MYS,"Federal Territory, Selangor, Johor, Perak, Pahang",NA,NA,7/13/1996,NA,yes,yes,NA,NA,20,NA,NA,4813,13,NA,NA,NA,NA,NA,NA,https://www.who.int/csr/don/1996_07_18/en/,DON-1996-07-18
1996-Cholera-NGA,5,1996,7/19/1996,Cholera,NA,Nigeria,NGA,"Kano, Kebbi, Borno, Oyo, Taraba, Yobe, Niger States",NA,NA,7/4/1996,NA,NA,NA,NA,NA,NA,NA,NA,11139,1165,NA,yes,NA,NA,NA,NA,https://www.who.int/csr/don/1996_07_19c/en/,DON-1996-07-19c
1996-Cholera-TCD,5,1996,7/19/1996,Cholera,NA,Chad,TCD,"N'Djamena, Chari Baguirmi",06/??/1996,NA,7/14/1996,NA,NA,NA,NA,NA,NA,NA,NA,1317,94,NA,yes,NA,NA,NA,NA,https://www.who.int/csr/don/1996_07_19b/en/,DON-1996-07-19b
1996-Diphtheria-LAO,1,1996,7/19/1996,Diptheria,NA,Laos,LAO,Sayabouri province,NA,NA,NA,NA,NA,NA,NA,NA,NA,NA,NA,72,4,NA,yes,NA,NA,NA,NA,https://www.who.int/csr/don/1996_07_19a/en/,DON-1996-07-19a
1996-Diphtheria-THA,1,1996,7/19/1996,Diptheria,NA,Thailand,THA,NA,NA,NA,NA,NA,NA,NA,NA,NA,NA,NA,NA,20,NA,NA,yes,NA,NA,NA,NA,https://www.who.int/csr/don/1996_07_19a/en/,DON-1996-07-19a
1996-EHEC-JAP,5,1996,7/26/1996,Enterohaemorrhagic Escherichia Coli,NA,Japan,JAP,Sakai City,7/12/1996,NA,NA,7/26/1996,NA,yes,NA,NA,287,NA,NA,6352,NA,NA,yes,NA,NA,NA,NA,https://www.who.int/csr/don/1996_07_26/en/,DON-1996-07-26
1996-Lassa Fever-SLE,2,1996,7/30/1996,Lassa fever,NA,Sierra Leone,SLE,NA,NA,NA,NA,Early May 1996,NA,NA,NA,NA,NA,NA,NA,246,73,29.6,NA,NA,NA,NA,NA,https://www.who.int/csr/don/1996_07_30a/en/,DON-1996-07-30a
1996-Typhoid Fever-TJK,5,1996,8/2/1996,Typhoid fever,NA,Tajikistan,TJK,10 districts,05/??/1996,NA,yes,NA,NA,NA,NA,NA,NA,NA,NA,4000,NA,NA,yes,yes,NA,NA,NA,https://www.who.int/csr/don/1996_08_02/en/,DON-1996-08-02
1996-Equine Encephalitis-MEX,4,1996,8/6/1996,Venezuelan Equine Encephalitis,NA,Mexico,MEX,Oaxaca,NA,6/16/1996,NA,7/31/1996,NA,yes,NA,NA,0,NA,NA,0,0,NA,yes,NA,NA,NA,found in horses,https://www.who.int/csr/don/1996_08_06b/en/,DON-1996-08-06b
1996-Typhoid Fever-TJK,5,1996,8/6/1996,Typhoid fever,NA,Tajikistan,TJK,"Kulyab, Gisar, Javan, Leninsky, Piandz, Shakrinau, Turun-Sade, Voseisky, Varzop",NA,NA,8/5/1996,NA,NA,NA,NA,NA,NA,NA,NA,7516,NA,NA,NA,NA,NA,NA,NA,https://www.who.int/csr/don/1996_08_06a/en/,DON-1996-08-06a
1996-Malaria-GHA,6,1996,8/12/1996,Malaria,NA,Ghana,GHA,NA,NA,NA,NA,NA,NA,NA,NA,NA,NA,NA,NA,NA,NA,NA,NA,7/31/1996,NA,NA,NA,https://www.who.int/csr/don/1996_08_12c/en/,DON-1996-08-12c
1996-Meningitis-CYP,1,1996,8/12/1996,Viral meningitis,NA,Cyprus,CYP,"Larnaca, Limassol, Famagusta, Nicosia, Paphos",7/5/1996,NA,NA,yes,NA,yes,NA,NA,NA,NA,NA,223,NA,NA,yes,NA,NA,NA,NA,https://www.who.int/csr/don/1996_08_12b/en/,DON-1996-08-12b
1996-Food Poisoning-IND,5,1996,8/12/1996,Food-borne intoxication,NA,India,IND,Bombay,NA,NA,NA,NA,NA,NA,NA,NA,NA,NA,NA,105,NA,NA,yes,NA,NA,NA,NA,https://www.who.int/csr/don/1996_08_12a/en/,DON-1996-08-12a
1996-Cholera-MNG,5,1996,8/13/1996,Cholera,NA,Mongolia,MNG,Khotol district,NA,NA,NA,8/9/1996,NA,yes,NA,NA,43,NA,NA,NA,NA,NA,yes,NA,NA,NA,NA,https://www.who.int/csr/don/1996_08_13b/en/,DON-1996-08-13b
1996-Dengue-VEN,6,1996,8/13/1996,Dengue/Dengue haemorrhagic fever,NA,Venezuela,VEN,"Federal District, Barina, Lara, Tachira",NA,NA,8/4/1996,NA,NA,NA,NA,NA,NA,NA,NA,293,NA,NA,NA,NA,NA,NA,NA,https://www.who.int/csr/don/1996_08_13a/en/,DON-1996-08-13a
1996-Cholera-MNG,5,1996,8/14/1996,Cholera,NA,Mongolia,MNG,NA,NA,NA,NA,8/13/1996,NA,NA,NA,NA,NA,NA,NA,52,6,NA,NA,NA,NA,NA,NA,https://www.who.int/csr/don/1996_08_14c/en/,DON-1996-08-14c
1996-Meningitis-MOZ,1,1996,8/14/1996,Cerebrospinal meningitis,NA,Mozambique,MOZ,"Cabo Delgado, Namuno, Montepuez, Pemba",NA,NA,07/??/1996,NA,NA,NA,NA,NA,NA,NA,NA,157,9,NA,yes,yes,NA,NA,NA,https://www.who.int/csr/don/1996_08_14b/en/,DON-1996-08-14b
1996-Cholera-LBR,5,1996,8/14/1996,Cholera,NA,Liberia,LBR,Monrovia,04/??/1996,NA,NA,NA,NA,NA,NA,NA,NA,NA,NA,NA,NA,NA,yes,yes,NA,NA,increase in cases,https://www.who.int/csr/don/1996_08_14a/en/,DON-1996-08-14a
1996-Meningitis-CYP,1,1996,8/21/1996,Viral meningitis,NA,Cyprus,CYP,"Limassol, Larnaca, Nicosia, Paphos, Famagusta",7/5/1996,NA,8/21/1996,NA,NA,NA,NA,NA,NA,NA,NA,280,0,NA,yes,NA,NA,NA,NA,https://www.who.int/csr/don/1996_08_21b/en/,DON-1996-08-21b
1996-Cholera-MNG,5,1996,8/21/1996,Cholera,NA,Mongolia,MNG,"Khutul, Darhan-Uul, Altanbulag, Ulan Batar, Zaamar District, Ulaantolgoi District",NA,NA,NA,8/9/1996,NA,NA,NA,NA,NA,NA,NA,106,8,NA,NA,NA,NA,NA,NA,https://www.who.int/csr/don/1996_08_21a/en/,DON-1996-08-21a
1996-EHEC-JAP,5,1996,8/28/1996,Enterohaemorrhagic Escherichia Coli,NA,Japan,JAP,Sakai city,NA,NA,NA,NA,NA,yes,NA,NA,NA,NA,NA,9578,11,NA,NA,NA,NA,NA,NA,https://www.who.int/csr/don/1996_08_28/en/,DON-1996-08-28
1996-Meningitis-UGA,1,1996,9/2/1996,Meningitis,NA,Uganda,UGA,4 districts,NA,NA,yes,NA,NA,NA,NA,NA,NA,NA,NA,NA,NA,NA,yes,NA,NA,NA,NA,https://www.who.int/csr/don/1996_09_02b/en/,DON-1996-09-02b
1996-Meningitis-ROU,1,1996,9/2/1996,Viral meningitis,NA,Romania,ROU,Bucharest,8/1/1996,beginning August 1996,NA,yes,NA,NA,NA,NA,NA,NA,NA,281,14,NA,yes,NA,NA,NA,NA,https://www.who.int/csr/don/1996_09_02a/en/,DON-1996-09-02a
1996-Meningitis-ROU,1,1996,9/3/1996,Viral meningitis,NA,Romania,ROU,Bucharest,NA,NA,NA,NA,NA,NA,NA,NA,NA,NA,NA,303,17,NA,NA,9/3/1996,NA,NA,NA,https://www.who.int/csr/don/1996_09_03/en/,DON-1996-09-03
1996-Meningitis-ROU,1,1996,9/9/1996,Viral meningitis,NA,Romania,ROU,Bucharest,NA,NA,7/30/1996,NA,NA,yes,NA,NA,2,NA,NA,342,17,NA,yes,NA,NA,NA,NA,https://www.who.int/csr/don/1996_09_09/en/,DON-1996-09-09
1996-Cholera-PHL,5,1996,9/12/1996,Cholera,NA,Philippines,PHL,"Paco, San Andres",NA,9/1/1996,NA,9/10/1996,NA,yes,NA,NA,33,NA,NA,284,5,NA,yes,yes,NA,NA,new outbreak,https://www.who.int/csr/don/1996_09_12/en/,DON-1996-09-12
1996-WPV-ALB,5,1996,9/18/1996,Polio,NA,Albania,ALB,NA,NA,NA,04/??/1996,NA,yes,yes,NA,NA,7,NA,NA,66,7,NA,yes,NA,NA,NA,NA,https://www.who.int/csr/don/1996_09_18/en/,DON-1996-09-18
1996-Meningitis-ROU,1,1996,9/24/1996,Viral meningitis,NA,Romania,ROU,Bucharest,End July 1996,NA,9/23/1996,NA,NA,yes,NA,NA,NA,NA,NA,450,39,NA,NA,NA,NA,NA,NA,https://www.who.int/csr/don/1996_09_24/en/,DON-1996-09-24
1996-Yellow Fever-BEN,6,1996,10/2/1996,Yellow Fever,NA,Benin,BEN,Kerou Sous Prefecture,07/??/1996,NA,yes,NA,NA,NA,NA,NA,NA,NA,NA,48,37,NA,yes,NA,NA,NA,NA,https://www.who.int/csr/don/1996_10_02/en/,DON-1996-10-02
1996-Japanese Encephalitis-NPL,6,1996,10/4/1996,Japanese encephalitis,NA,Nepal,NPL,NA,NA,NA,9/27/1996,NA,NA,NA,NA,NA,NA,NA,NA,697,118,NA,yes,NA,NA,NA,NA,https://www.who.int/csr/don/1996_10_04/en/,DON-1996-10-04
1996-Ebola-GAB,2,1996,10/14/1996,Ebola haemorrhagic fever,NA,Gabon,GAB,Boué,02/??/1996,NA,NA,yes,NA,NA,NA,NA,NA,NA,NA,37,NA,NA,yes,NA,NA,NA,NA,https://www.who.int/csr/don/1996_10_14/en/,DON-1996-10-14
1996-Ebola-GAB,2,1996,10/15/1996,Ebola haemorrhagic fever,NA,Gabon,GAB,"Boué, Makokou",7/24/1996,NA,NA,yes,NA,yes,NA,NA,NA,NA,NA,14,10,NA,yes,NA,NA,NA,NA,https://www.who.int/csr/don/1996_10_15b/en/,DON-1996-10-15b
1996-Meningitis-ROU,1,1996,10/15/1996,Viral meningitis,NA,Romania,ROU,"Bucharest, Dolj, Galati, Constanta",NA,NA,NA,NA,NA,yes,NA,NA,168,NA,NA,NA,NA,NA,yes,NA,NA,NA,NA,https://www.who.int/csr/don/1996_10_15a/en/,DON-1996-10-15a
1996-Cholera-GNB,5,1996,10/17/1996,Cholera,NA,Guinea-Bissau,GNB,NA,NA,NA,NA,10/6/1996,NA,NA,NA,NA,NA,NA,NA,143,7,NA,NA,NA,NA,NA,NA,https://www.who.int/csr/don/1996_10_17b/en/,DON-1996-10-17b
1996-Cholera-SEN,5,1996,10/17/1996,Cholera,NA,Senegal,SEN,NA,NA,NA,NA,yes,NA,NA,NA,NA,NA,NA,NA,NA,NA,NA,NA,NA,NA,NA,NA,https://www.who.int/csr/don/1996_10_17b/en/,DON-1996-10-17b
1996-Cholera-TGO,5,1996,10/17/1996,Cholera,NA,Togo,TGO,NA,NA,NA,NA,yes,NA,NA,NA,NA,NA,NA,NA,NA,NA,NA,NA,NA,NA,NA,NA,https://www.who.int/csr/don/1996_10_17b/en/,DON-1996-10-17b
1996-Dengue-IND,6,1996,10/17/1996,Dengue/dengue haemorrhagic fever,NA,India,IND,Delhi,NA,NA,NA,no,NA,NA,NA,NA,NA,NA,NA,NA,NA,NA,NA,NA,NA,NA,NA,https://www.who.int/csr/don/1996_10_17a/en/,DON-1996-10-17a
1996-Ebola-GAB,2,1996,10/18/1996,Ebola haemorrhagic fever,NA,Gabon,GAB,"Booué, Ogooué-Ivindo, Moyen Oogoué, Latoursville, Oogoueé Lolo, Libreville",NA,NA,10/18/1996,NA,NA,NA,NA,NA,NA,NA,NA,18,11,NA,yes,NA,NA,NA,NA,https://www.who.int/csr/don/1996_10_18/en/,DON-1996-10-18
1996-Ebola-GAB,2,1996,10/21/1996,Ebola haemorrhagic fever,NA,Gabon,GAB,Booué,NA,NA,10/19/1996,NA,NA,NA,NA,NA,NA,NA,NA,19,11,NA,yes,NA,NA,NA,NA,https://www.who.int/csr/don/1996_10_21/en/,DON-1996-10-21
1996-Dengue-IND,6,1996,10/24/1996,Dengue/dengue haemorrhagic fever,NA,India,IND,Delhi,NA,NA,NA,10/22/1996,NA,yes,NA,NA,NA,NA,NA,5930,251,NA,NA,NA,NA,NA,NA,https://www.who.int/csr/don/1996_10_24/en/,DON-1996-10-24
1996-Yellow Fever-BRA,6,1996,10/31/1996,Yellow fever,NA,Brazil,BRA,Amazone,NA,NA,NA,NA,NA,NA,NA,NA,NA,NA,NA,2,2,NA,NA,NA,NA,NA,2 travellers,https://www.who.int/csr/don/1996_10_31b/en/,DON-1996-10-31b
1996-Dengue-IND,6,1996,10/31/1996,Dengue/dengue haemorrhagic fever,NA,India,IND,Delhi,NA,NA,NA,10/29/1996,NA,yes,NA,NA,5,NA,NA,7427,297,4,NA,NA,NA,NA,NA,https://www.who.int/csr/don/1996_10_31a/en/,DON-1996-10-31a
1996-Yellow Fever-BEN,6,1996,10/31/1996,Yellow fever,NA,Benin,BEN,"Atacora, Borgou",Early July 1996,NA,7/1/1996,NA,NA,NA,NA,NA,NA,NA,NA,86,65,NA,yes,NA,NA,NA,NA,https://www.who.int/csr/don/1996_11_01/en/,DON-1996-11-01
1996-CCHF-ZAF,6,1996,11/5/1996,Crimean-Congo Haemorragic Fever,NA,South Africa,ZAF,Oudshoorn,NA,NA,NA,yes,NA,NA,NA,NA,NA,NA,NA,32,1,NA,11/4/1996,NA,NA,NA,NA,https://www.who.int/csr/don/1996_11_05/en/,DON-1996-11-05
1996-Dengue-IND,6,1996,11/12/1996,Dengue haemorrhagic fever,NA,India,IND,Delhi,NA,NA,11/3/1996,NA,NA,NA,NA,NA,NA,NA,NA,8170,319,3.9,yes,NA,NA,NA,NA,https://www.who.int/csr/don/1996_11_12b/en/,DON-1996-11-12b
1996-Ebola-GAB,2,1996,11/12/1996,Ebola haemorrhagic fever,NA,Gabon,GAB,NA,NA,NA,10/19/1996,NA,NA,NA,NA,NA,NA,NA,NA,24,17,NA,NA,NA,NA,NA,no new cases; numbers revised,https://www.who.int/csr/don/1996_11_12a/en/,DON-1996-11-12a
1996-Cholera-COD,5,1996,11/15/1996,Cholera,NA,Zaire,COD,Sake,NA,NA,NA,NA,NA,yes,NA,NA,2,NA,NA,NA,NA,NA,yes,NA,NA,NA,NA,https://www.who.int/csr/don/1996_11_15b/en/,DON-1996-11-15b
1996-Dengue-IND,6,1996,11/15/1996,Dengue/dengue haemorrhagic fever,NA,India,IND,NA,NA,NA,11/7/1996,NA,NA,NA,NA,NA,NA,NA,NA,8514,336,3.9,NA,NA,NA,NA,NA,https://www.who.int/csr/don/1996_11_15a/en/,DON-1996-11-15a
1996-Ebola-ZAF,2,1996,11/18/1996,Ebola haemorrhagic fever,NA,South Africa,ZAF,NA,11/2/1996,11/6/1996,NA,yes,NA,11/16/1996,NA,NA,NA,NA,NA,1,0,NA,11/16/1996,NA,NA,NA,NA,https://www.who.int/csr/don/1996_11_18/en/,DON-1996-11-18
1996-Ebola-GAB,2,1996,11/19/1996,Ebola haemorrhagic fever,NA,Gabon,GAB,Libreville,NA,NA,NA,yes,NA,NA,NA,NA,NA,NA,NA,NA,NA,NA,yes,NA,NA,NA,NA,https://www.who.int/csr/don/1996_11_19/en/,DON-1996-11-19
1996-Dengue-IND,6,1996,11/20/1996,Dengue/dengue haemorrhagic fever,NA,India,IND,NA,NA,NA,11/12/1996,NA,NA,NA,NA,NA,NA,NA,NA,8684,346,4,NA,NA,NA,NA,NA,https://www.who.int/csr/don/1996_11_20/en/,DON-1996-11-20
1996-Ebola-ZAF,2,1996,11/22/1996,Ebola haemorrhagic fever,NA,South Africa,ZAF,Johannesburg,NA,NA,NA,NA,NA,NA,NA,NA,NA,NA,NA,2,0,NA,yes,11/21/1996,NA,NA,NA,https://www.who.int/csr/don/1996_11_22/en/,DON-1996-11-22
1996-Ebola-GAB,2,1996,11/25/1996,Ebola haemorrhagic fever,NA,Gabon,GAB,Booué,Late July 1996,NA,NA,11/19/1996,NA,yes,NA,NA,NA,NA,NA,27,19,NA,yes,NA,NA,NA,NA,https://www.who.int/csr/don/1996_11_25/en/,DON-1996-11-25
1996-Diarrheal Disease-RWA,5,1996,11/28/1996,Acute diarrhoeal disease,NA,Rwanda,RWA,Gisenyi,NA,NA,NA,NA,NA,NA,NA,NA,NA,NA,NA,9407,38,0.4,NA,NA,NA,NA,Rwanda repatriation,https://www.who.int/csr/don/1996_11_28c/en/,DON-1996-11-28c
1996-Ebola-ZAF,2,1996,11/28/1996,Ebola haemorrhagic fever,NA,South Africa,ZAF,NA,NA,10/27/1996,NA,11/26/1996,NA,NA,NA,NA,NA,NA,NA,2,1,NA,yes,NA,NA,NA,NA,https://www.who.int/csr/don/1996_11_28b/en/,DON-1996-11-28b
1996-Dengue-IND,6,1996,11/28/1996,Dengue/dengue haemorrhagic fever,NA,India,IND,Delhi,NA,NA,11/13/1996,NA,NA,NA,NA,NA,NA,NA,NA,8777,354,4,NA,NA,NA,NA,NA,https://www.who.int/csr/don/1996_11_28a/en/,DON-1996-11-28a
1996-Yellow Fever-GHA,6,1996,12/5/1996,Yellow fever,NA,Ghana,GHA,Upper East Region,NA,NA,yes,NA,NA,yes,NA,NA,3,NA,NA,27,5,NA,yes,NA,NA,NA,NA,https://www.who.int/csr/don/1996_12_05/en/,DON-1996-12-05
1996-Cholera-TZA,5,1996,12/6/1996,Cholera,NA,Tanzania,TZA,Kigoma,NA,NA,NA,NA,NA,11/23/1996,NA,NA,NA,NA,NA,1100,6,NA,yes,NA,NA,NA,NA,https://www.who.int/csr/don/1996_12_06c/en/,DON-1996-12-06c
1996-Yellow Fever-GHA,6,1996,12/6/1996,Yellow fever,NA,Ghana,GHA,Upper East Region,NA,NA,NA,NA,NA,yes,NA,NA,NA,NA,NA,NA,NA,NA,yes,NA,NA,NA,NA,https://www.who.int/csr/don/1996_12_06b/en/,DON-1996-12-06b
1996-Ebola-GAB,2,1996,12/6/1996,Ebola haemorrhagic fever,NA,Gabon,GAB,Libreville,NA,NA,NA,NA,NA,NA,NA,NA,NA,NA,NA,27,19,NA,yes,NA,NA,NA,The patient who died on 5 November 1996 in a Libreville hospital was retrospectively identified as the contact of the Gabonese physician with Ebola fever who went to South Africa for medical care.,https://www.who.int/csr/don/1996_12_06a/en/,DON-1996-12-06a
1996-EHEC-GBR,5,1996,12/13/1996,E. Coli O157,NA,United Kingdom,GBR,Scottland,NA,NA,11/22/1996,NA,NA,NA,NA,NA,216,NA,180,396,11,NA,NA,NA,NA,NA,NA,https://www.who.int/csr/don/1996_12_13b/en/,DON-1996-12-13b
1996-Cholera-RWA,5,1996,12/13/1996,Cholera,NA,Rwanda,RWA,Runda Transit Camp,NA,NA,11/16/1996,NA,NA,NA,NA,NA,NA,NA,NA,106,10,NA,yes,NA,NA,NA,NA,https://www.who.int/csr/don/1996_12_13a/en/,DON-1996-12-13a
1996-Cholera-COD,5,1996,12/13/1996,Cholera,NA,Zaire,COD,Goma Hospital,11/16/1996,NA,NA,NA,NA,NA,NA,NA,NA,NA,NA,1133,23,NA,NA,NA,NA,NA,NA,https://www.who.int/csr/don/1996_12_13a/en/,DON-1996-12-13a
1996-Ebola-GAB,2,1996,12/20/1996,Ebola haemorrhagic fever,NA,Gabon,GAB,Djidji,NA,NA,NA,NA,NA,NA,NA,NA,NA,NA,NA,NA,8,NA,yes,NA,NA,NA,Seven deaths had occurred unreported until the last death which occurred on 16 December,https://www.who.int/csr/don/1996_12_20/en/,DON-1996-12-20
1996-Ebola-GAB,2,1996,12/24/1996,Ebola haemorrhagic fever,NA,Gabon,GAB,"Booue region, Lastourville, Libreville",NA,NA,NA,NA,NA,NA,NA,NA,NA,NA,NA,40,30,NA,yes,12/19/1996,NA,NA,NA,https://www.who.int/csr/don/1996_12_24/en/,DON-1996-12-24
1996-Ebola-GAB,2,1997,1/2/1997,Ebola haemorrhagic fever,NA,Gabon,GAB,"Libreville, Booue",NA,NA,NA,NA,NA,NA,NA,NA,NA,NA,NA,52,40,NA,yes,NA,NA,NA,NA,https://www.who.int/csr/don/1997_01_02/en/,DON-1997-01-02
1996-Ebola-GAB,2,1997,1/8/1997,Ebola haemorrhagic fever,NA,Gabon,GAB,"Ovan, Koumameyong, Libreville, Djidjii",7/13/1997,NA,NA,NA,NA,10/4/1996,NA,NA,NA,NA,NA,54,41,NA,yes,NA,NA,NA,start year likely a typo,https://www.who.int/csr/don/1997_01_08/en/,DON-1997-01-08
1996-Ebola-GAB,2,1997,1/9/1997,Ebola haemorrhagic fever,NA,Gabon,GAB,NA,NA,NA,NA,1/8/1997,NA,NA,NA,NA,NA,NA,NA,58,43,NA,NA,NA,NA,NA,discrepancy in report date-- date used here is from the report itself,https://www.who.int/csr/don/1997_01_09b/en/,DON-1997-01-09b
1997-Cholera-BDI,5,1997,1/9/1997,Cholera,NA,Burundi,BDI,Rumonge Province,NA,NA,yes,NA,NA,NA,NA,NA,NA,NA,NA,153,10,NA,yes,NA,NA,NA,NA,https://www.who.int/csr/don/1997_01_09a/en/,DON-1997-01-09a
1996-Ebola-GAB,2,1997,1/16/1997,Ebola haemorrhagic fever,NA,Gabon,GAB,"Booué, Makokou, Lolo I, Lolo II, Djidji, SHM Sawmill, Lassio, Ndjole, Matora, Libreville, Okala, Owendo, Nzeng-Ayong, Gros Bouqet, Plaine Orety, Casepga,Melen hospital, Lambarene",Late July 1997,NA,NA,1/15/1997,NA,NA,NA,NA,NA,NA,NA,59,44,NA,yes,NA,NA,NA,start date likely typo,https://www.who.int/csr/don/1997_01_16/en/,DON-1997-01-16
1997-Cholera-BDI,5,1997,1/17/1997,Cholera,NA,Burundi,BDI,Rumonge,NA,NA,1/13/1997,NA,NA,NA,NA,NA,NA,NA,NA,482,21,NA,yes,NA,NA,NA,NA,https://www.who.int/csr/don/1997_01_17b/en/,DON-1997-01-17b
1997-Measles-GLP,1,1997,1/17/1997,Measles,NA,Guadeloupe,GLP,St. François,mid-October 1997,NA,NA,1/15/1997,yes,yes,NA,NA,12,NA,NA,NA,NA,NA,yes,NA,NA,NA,start date likely typo,https://www.who.int/csr/don/1997_01_17a/en/,DON-1997-01-17a
1997-Cholera-COD,5,1997,1/20/1997,Cholera,NA,Zaire,COD,Tingi Tingi Camp,NA,NA,NA,NA,NA,yes,NA,NA,NA,NA,NA,56,2,NA,yes,NA,NA,NA,NA,https://www.who.int/csr/don/1997_01_20/en/,DON-1997-01-20
1996-Ebola-GAB,2,1997,1/21/1997,Ebola haemorrhagic fever,NA,Gabon,GAB,"Booué, Libreville",End July 1997,NA,NA,1/20/1997,NA,NA,NA,NA,NA,NA,NA,60,45,NA,yes,NA,NA,NA,start date likely typo,https://www.who.int/csr/don/1997_01_21/en/,DON-1997-01-21
1997-Cholera-BOL,5,1997,1/22/1997,Cholera,NA,Bolivia,BOL,"Yacuiba, Beni, Potosi, Santa Cruz",NA,NA,1/1/1997,yes,NA,yes,NA,NA,NA,NA,NA,723,6,NA,yes,NA,NA,NA,NA,https://www.who.int/csr/don/1997_01_22/en/,DON-1997-01-22
1997-Meningitis-TGO,1,1997,1/24/1997,Meningitis,NA,Togo,TGO,NA,11/??/1997,NA,NA,NA,NA,no,NA,NA,NA,NA,NA,522,97,NA,NA,NA,NA,NA,start date likely typo,https://www.who.int/csr/don/1997_01_24/en/,DON-1997-01-24
1997-Meningitis-TGO,1,1997,1/27/1997,Meningitis,NA,Togo,TGO,Dapaong,11/??/1997,NA,NA,11/27/1997,NA,NA,NA,NA,NA,NA,NA,739,121,16.3,yes,NA,NA,NA,start date likely typo,https://www.who.int/csr/don/1997_01_27/en/,DON-1997-01-27
1997-Plague-ZMB,2,1997,1/31/1997,Bubonic Plague,NA,Zambia,ZMB,Namwala,12/??/1997,NA,12/13/1997,NA,NA,no,NA,NA,NA,NA,NA,90,22,NA,yes,NA,NA,NA,start date likely typo,https://www.who.int/csr/don/1997_01_31b/en/,DON-1997-01-31b
1997-Meningitis-TGO,1,1997,1/31/1997,Meningitis,NA,Togo,TGO,NA,11/??/1997,NA,1/30/1997,NA,NA,NA,NA,NA,NA,NA,NA,961,143,14.4,yes,NA,NA,NA,start date likely typo,https://www.who.int/csr/don/1997_01_31a/en/,DON-1997-01-31a
1997-Meningitis-BFA,1,1997,1/31/1997,Meningitis,NA,Burkina Faso,BFA,NA,NA,NA,1/28/1997,NA,NA,NA,NA,NA,NA,NA,NA,461,64,13.9,yes,NA,NA,NA,NA,https://www.who.int/csr/don/1997_01_31a/en/,DON-1997-01-31a
1997-Meningitis-GHA,1,1997,1/31/1997,Meningitis,NA,Ghana,GHA,NA,NA,NA,NA,NA,NA,NA,NA,NA,NA,NA,NA,181,17,9.4,NA,NA,NA,NA,NA,https://www.who.int/csr/don/1997_01_31a/en/,DON-1997-01-31a
1997-Meningitis-MLI,1,1997,1/31/1997,Meningitis,NA,Mali,MLI,NA,NA,NA,NA,NA,NA,NA,NA,NA,NA,NA,NA,180,26,14.4,NA,NA,NA,NA,NA,https://www.who.int/csr/don/1997_01_31a/en/,DON-1997-01-31a
1997-Meningitis-TGO,1,1997,2/7/1997,Meningitis,NA,Togo,TGO,NA,11/??/1997,NA,2/3/1997,NA,NA,NA,NA,NA,NA,NA,NA,1235,151,60.4,2/7/1997,NA,NA,NA,CFR incorrect; start date likely typo,https://www.who.int/csr/don/1997_02_07c/en/,DON-1997-02-07c
1997-Plague-ZMB,2,1997,2/7/1997,Bubonic Plague,NA,Zambia,ZMB,Nwala,NA,NA,1/24/1997,NA,NA,yes,NA,NA,NA,NA,NA,267,26,10,yes,NA,NA,NA,NA,https://www.who.int/csr/don/1997_02_07b/en/,DON-1997-02-07b
1996-Ebola-GAB,2,1997,2/7/1997,Ebola haemorrhagic fever,NA,Gabon,GAB,Libreville,Late August 1997,NA,NA,NA,NA,NA,NA,NA,NA,NA,NA,61,45,NA,yes,NA,NA,NA,start date likely typo,https://www.who.int/csr/don/1997_02_07a/en/,DON-1997-02-07a
1997-Influenza-WHO,3,1997,2/20/1997,Influenza,NA,NA,NA,NA,NA,NA,NA,NA,NA,NA,NA,NA,NA,NA,NA,NA,NA,NA,yes,2/19/1997,NA,NA,vaccine,https://www.who.int/csr/don/1997_02_20/en/,DON-1997-02-20
1997-Meningococcal Disease-ESP,1,1997,2/28/1997,Meningococcal disease,NA,Spain,ESP,NA,NA,NA,yes,NA,NA,yes,NA,NA,NA,NA,NA,1383,NA,NA,yes,NA,NA,NA,increased since 1994,https://www.who.int/csr/don/1997_02_28c/en/,DON-1997-02-28c
1997-Typhoid Fever-TJK,5,1997,2/28/1997,Typhoid fever,NA,Tadjikistan,TJK,Dushanbé,NA,NA,NA,2/13/1997,yes,yes,NA,NA,NA,NA,NA,>3000,NA,1,yes,NA,NA,NA,NA,https://www.who.int/csr/don/1997_02_28b/en/,DON-1997-02-28b
1997-Dengue-COK,6,1997,2/28/1997,Dengue fever,NA,Cook Islands,COK,Rarotonga,Beginning January 1997,NA,NA,NA,NA,yes,NA,NA,NA,NA,NA,123,NA,NA,yes,NA,NA,NA,NA,https://www.who.int/csr/don/1997_02_28a/en/,DON-1997-02-28a
1996-Ebola-GAB,2,1997,3/2/1997,Ebola haemorrhagic fever,NA,Gabon,GAB,NA,NA,NA,7/13/1996,NA,NA,NA,yes,NA,NA,NA,NA,60,45,75,yes,NA,NA,NA,outbreak end,https://www.who.int/csr/don/1997_03_02/en/,DON-1997-03-02
1997-Meningitis-GHA,1,1997,3/6/1997,Meningitis,NA,Ghana,GHA,"East Mamprusi, Bawku East, 4 regions in Upper West district, Upper East, Northern, Brong Ahafo",NA,NA,11/??/1997,NA,NA,yes,NA,NA,NA,NA,NA,1659,281,17,yes,NA,NA,NA,reported date likely typo,https://www.who.int/csr/don/1997_03_06/en/,DON-1997-03-06
1997-Yellow Fever-BOL,6,1997,3/11/1997,Yellow fever,NA,Bolivia,BOL,"Cochabamba Department, La Paz Department, Cochabamba Department, Beni Deaprtment, Santa Cruz Department",NA,NA,NA,NA,NA,NA,NA,NA,NA,NA,NA,47,33,NA,yes,NA,NA,NA,NA,https://www.who.int/csr/don/1997_03_11/en/,DON-1997-03-11
1997-O'Nyong-Nyong Fever-UGA,6,1997,3/12/1997,O'nyong-nyong (ONN) fever,NA,Uganda,UGA,"Rakai, Mbarara, Masaka",NA,06/??/1997,NA,NA,NA,yes,NA,NA,NA,NA,NA,NA,0,NA,01/??/1997,NA,NA,NA,detection date likely typo,https://www.who.int/csr/don/1997_03_12/en/,DON-1997-03-12
1997-Monkeypox-COD,2,1997,3/21/1997,Monkeypox,NA,Democratic Republic of the Congo,COD,Katako-Kombe health zone,NA,NA,NA,NA,yes,yes,NA,NA,11,NA,NA,NA,NA,NA,yes,NA,NA,NA,NA,https://www.who.int/csr/don/1997_03_21c/en/,DON-1997-03-21c
1997-Lassa Fever-SLE,2,1997,3/21/1997,Lassa fever,NA,Sierra Leone,SLE,Kenema,NA,11/??/1996,NA,NA,NA,NA,NA,NA,NA,NA,NA,239,39,16,2/14/1997,NA,NA,NA,NA,https://www.who.int/csr/don/1997_03_21b/en/,DON-1997-03-21b
1997-Meningitis-GHA,1,1997,3/21/1997,Meningitis,NA,Ghana,GHA,"Bawku East, Bolgatanga, Bawku West, Kassena-Nankan, Gushegu-Karaga, Tamale, West Mamprusi, Yendi",NA,NA,3/13/1997,NA,NA,NA,NA,NA,NA,NA,NA,3757,411,11,yes,yes,NA,NA,NA,https://www.who.int/csr/don/1997_03_21a/en/,DON-1997-03-21a
1997-Meningitis-BFA,1,1997,3/21/1997,Meningitis,NA,Burkina Faso,BFA,NA,NA,NA,3/21/1997,NA,NA,NA,NA,NA,NA,NA,NA,10000,1200,12,NA,NA,NA,NA,NA,https://www.who.int/csr/don/1997_03_21a/en/,DON-1997-03-21a
1997-Meningitis-TCD,1,1997,3/21/1997,Meningitis,NA,Chad,TCD,NA,NA,NA,2/28/1997,NA,NA,NA,NA,NA,NA,NA,NA,38,6,16,NA,NA,NA,NA,NA,https://www.who.int/csr/don/1997_03_21a/en/,DON-1997-03-21a
1997-Meningitis-GMB,1,1997,3/21/1997,Meningitis,NA,Gambia,GMB,NA,NA,NA,3/19/1997,NA,NA,NA,NA,NA,NA,NA,NA,151,17,11,NA,NA,NA,NA,NA,https://www.who.int/csr/don/1997_03_21a/en/,DON-1997-03-21a
1997-Meningitis-MLI,1,1997,3/21/1997,Meningitis,NA,Mali,MLI,NA,NA,NA,3/11/1997,NA,NA,NA,NA,NA,NA,NA,NA,1549,160,10,NA,NA,NA,NA,NA,https://www.who.int/csr/don/1997_03_21a/en/,DON-1997-03-21a
1997-Meningitis-TGO,1,1997,3/21/1997,Meningitis,NA,Togo,TGO,NA,NA,NA,3/19/1997,NA,NA,NA,NA,NA,NA,NA,NA,2380,329,14,NA,NA,NA,NA,NA,https://www.who.int/csr/don/1997_03_21a/en/,DON-1997-03-21a
1997-Meningitis-West Africa,1,1997,3/27/1997,Meningitis,NA,West Africa,NA,"Benin, Burkina Faso, Gambia, Ghana, Mali, Niger, Togo",NA,NA,3/23/1997,NA,NA,NA,NA,NA,NA,NA,NA,24798,2933,NA,NA,NA,NA,NA,NA,https://www.who.int/csr/don/1997_03_27/en/,DON-1997-03-27
1997-Meningitis-GHA,1,1997,3/27/1997,Meningitis,NA,Ghana,GHA,"Upper East, Northern, Ashanti, Brong Ahafo, Upper West",NA,NA,3/23/1997,NA,NA,NA,NA,NA,NA,NA,NA,8671,902,NA,NA,NA,NA,NA,NA,https://www.who.int/csr/don/1997_03_27/en/,DON-1997-03-27
1997-Meningitis-BFA,1,1997,3/27/1997,Meningitis,NA,Burkina Faso,BFA,NA,NA,NA,NA,NA,NA,NA,NA,NA,NA,NA,NA,10429,1318,NA,NA,NA,NA,NA,NA,https://www.who.int/csr/don/1997_03_27/en/,DON-1997-03-27
1997-AMR-WHO,7,1997,3/28/1997,Antimicrobial resistance,NA,Germany,DEU,Berlin,NA,NA,NA,NA,NA,NA,NA,NA,NA,NA,NA,NA,NA,NA,10/??/1997,NA,NA,NA,WHO consultation,https://www.who.int/csr/don/archive/year/1997/en/,DON-archive/year/1997
1997-Meningitis-BFA,1,1997,4/11/1997,Meningitis,NA,Burkina Faso,BFA,NA,NA,NA,NA,4/11/1997,NA,NA,NA,NA,NA,NA,NA,16775,1953,NA,NA,NA,NA,NA,NA,https://www.who.int/csr/don/1997_04_11/en/,DON-1997-04-11
1997-Meningitis-GHA,1,1997,4/11/1997,Meningitis,NA,Ghana,GHA,NA,NA,NA,NA,4/11/1997,NA,NA,NA,NA,NA,NA,NA,13063,1191,NA,NA,NA,NA,NA,NA,https://www.who.int/csr/don/1997_04_11/en/,DON-1997-04-11
1997-Meningitis-MLI,1,1997,4/11/1997,Meningitis,NA,Mali,MLI,NA,NA,NA,NA,4/11/1997,NA,NA,NA,NA,NA,NA,NA,6119,587,NA,NA,NA,NA,NA,NA,https://www.who.int/csr/don/1997_04_11/en/,DON-1997-04-11
1997-Meningitis-BEN,1,1997,4/11/1997,Meningitis,NA,Benin,BEN,NA,NA,NA,NA,4/11/1997,NA,NA,NA,NA,NA,NA,NA,273,47,NA,NA,NA,NA,NA,NA,https://www.who.int/csr/don/1997_04_11/en/,DON-1997-04-11
1997-Meningitis-GMB,1,1997,4/11/1997,Meningitis,NA,Gambia,GMB,NA,NA,NA,NA,4/11/1997,NA,NA,NA,NA,NA,NA,NA,856,119,NA,NA,NA,NA,NA,NA,https://www.who.int/csr/don/1997_04_11/en/,DON-1997-04-11
1997-Meningitis-NER,1,1997,4/11/1997,Meningitis,NA,Niger,NER,NA,NA,NA,NA,4/11/1997,NA,NA,NA,NA,NA,NA,NA,1813,208,NA,NA,NA,NA,NA,NA,https://www.who.int/csr/don/1997_04_11/en/,DON-1997-04-11
1997-Meningitis-RWA,1,1997,4/11/1997,Meningitis,NA,Rwanda,RWA,NA,NA,NA,NA,4/11/1997,NA,NA,NA,NA,NA,NA,NA,10,4,NA,NA,NA,NA,NA,NA,https://www.who.int/csr/don/1997_04_11/en/,DON-1997-04-11
1997-Meningitis-SEN,1,1997,4/11/1997,Meningitis,NA,Senegal,SEN,NA,NA,NA,NA,4/11/1997,NA,NA,NA,NA,NA,NA,NA,13,4,NA,NA,NA,NA,NA,NA,https://www.who.int/csr/don/1997_04_11/en/,DON-1997-04-11
1997-Meningitis-TGO,1,1997,4/11/1997,Meningitis,NA,Togo,TGO,NA,NA,NA,NA,4/11/1997,NA,NA,NA,NA,NA,NA,NA,2619,360,NA,NA,NA,NA,NA,NA,https://www.who.int/csr/don/1997_04_11/en/,DON-1997-04-11
1997-Monkeypox-COD,2,1997,4/14/1997,Monkeypox,NA,Zaire,COD,NA,NA,NA,NA,NA,NA,NA,NA,NA,NA,NA,NA,NA,NA,NA,02/??/1997,NA,NA,NA,smallpox vaccine is effective against monkeypox,https://www.who.int/csr/don/1997_04_14/en/,DON-1997-04-14
1997-Cholera-COD,5,1997,4/15/1997,Cholera,NA,Zaire,COD,"Kasese refugee camp, Kinshasa, Equator Province",NA,NA,Beginning 1997,NA,NA,NA,NA,NA,NA,NA,NA,NA,NA,NA,yes,NA,NA,NA,NA,https://www.who.int/csr/don/1997_04_15b/en/,DON-1997-04-15b
1997-Cholera-SOM,5,1997,4/15/1997,Cholera,NA,Somalia,SOM,"Mogadishu, Merca, Lower Shabelle",11/30/1997,NA,NA,NA,NA,NA,NA,NA,NA,NA,NA,1535,47,NA,yes,NA,NA,NA,start date likely typo,https://www.who.int/csr/don/1997_04_15a/en/,DON-1997-04-15a
1997-Disease-WHO,7,1997,4/24/1997,Cholera,Surveillance Standards,NA,NA,NA,NA,NA,NA,NA,NA,NA,NA,NA,NA,NA,NA,NA,NA,NA,yes,NA,NA,NA,NA,https://www.who.int/csr/don/1997_04_24a/en/,DON-1997-04-24a
1997-Monkeypox-COD,2,1997,4/24/1997,Monkeypox,NA,Zaire,COD,NA,NA,NA,NA,NA,NA,NA,NA,NA,NA,NA,NA,NA,NA,NA,yes,yes,NA,NA,NA,https://www.who.int/csr/don/1997_04_24b/en/,DON-1997-04-24b
1997-Lassa Fever-SLE,2,1997,5/1/1997,Lassa fever,NA,Sierra Leone,SLE,Kenema,01/??/1997,NA,NA,NA,NA,NA,NA,NA,NA,NA,NA,799,148,18.5,yes,yes,NA,NA,NA,https://www.who.int/csr/don/1997_05_01/en/,DON-1997-05-01
1997-Rabies-WHO,4,1997,5/6/1997,Rabies,Update Recommendations,NA,NA,NA,NA,NA,NA,NA,NA,NA,NA,NA,NA,NA,NA,NA,NA,NA,yes,NA,NA,NA,NA,https://www.who.int/csr/don/1997_05_06a/en/,DON-1997-05-06a
1997-Typhus Fever-BDI,6,1997,5/6/1997,Louse-borne typhus,NA,Burundi,BDI,"Bujumbura Province; Gitega Province Karama, Burina, Gifugwe, Gasi, Rutovu, Ntabo and Kabezi Districts; 4 other provinces",NA,NA,NA,NA,NA,NA,NA,NA,NA,NA,NA,24000,NA,NA,yes,NA,NA,NA,NA,https://www.who.int/csr/don/1997_05_06c/en/,DON-1997-05-06c
1997-Cholera-TZA,5,1997,5/6/1997,Cholera,NA,Tanzania,TZA,"Dar es Salaam, 7 other areas",End January 1997,NA,4/30/1997,NA,NA,yes,NA,NA,NA,NA,NA,<3000,>100,NA,yes,NA,NA,NA,NA,https://www.who.int/csr/don/1997_05_06b/en/,DON-1997-05-06b
1997-Cholera-SOM,5,1997,5/9/1997,Cholera,NA,Somalia,SOM,Mogadishu,NA,NA,End November 1997,NA,NA,NA,NA,NA,NA,NA,NA,4437,146,NA,yes,NA,NA,NA,start date likey typo,https://www.who.int/csr/don/1997_05_09/en/,DON-1997-05-09
1997-Disease-WHO,7,1997,5/20/1997,Cholera,International Travel and Health,NA,NA,NA,NA,NA,NA,NA,NA,NA,NA,NA,NA,NA,NA,NA,NA,NA,yes,yes,NA,NA,NA,https://docs.google.com/spreadsheets/d/1hdPytPiW9vfsQW_rPlXH3I_pB2v0rKBrM80xH5ld3Jo/edit#gid=1919292199,https://docs.google.com/spreadsheets/d/1hdPytPiW9vfsQW-rPlXH3I-pB2v0rKBrM80xH5ld3Jo/edit#gid=1919292199
1997-Lassa Fever-SLE,2,1997,5/22/1997,Lassa fever,NA,Sierra Leone,SLE,"Kenema, Freetown",NA,NA,01/??/1997,NA,NA,NA,NA,NA,NA,NA,NA,353,43,12.2,yes,NA,NA,NA,NA,https://www.who.int/csr/don/1997_05_22/en/,DON-1997-05-22
1997-Cholera-SOM,5,1997,6/4/1997,Cholera,NA,Somalia,SOM,"Middle Shabelle, Galgaduud, Mogadishu",NA,NA,NA,yes,NA,no,NA,NA,NA,NA,NA,5557,247,4.4,yes,NA,NA,yes,NA,https://www.who.int/csr/don/1997_06_04/en/,DON-1997-06-04
1997-Anthrax-GHA,4,1997,6/5/1997,Anthrax,NA,Ghana,GHA,Bolgatanga,4/18/1997,4/19/1997,yes,NA,NA,NA,NA,NA,NA,NA,NA,185,26,NA,yes,yes,NA,NA,NA,https://www.who.int/csr/don/1997_06_05/en/,DON-1997-06-05
1997-Myocarditis-MYS,7,1997,6/6/1997,Myocarditis,NA,Malaysia,MYS,"Sibu, Sarikei and Kuching Divisions",4/14/1997,NA,NA,NA,NA,NA,NA,NA,NA,NA,NA,NA,17,NA,yes,NA,NA,NA,lab results pending,https://www.who.int/csr/don/1997_06_06/en/,DON-1997-06-06
1997-Myocarditis-MYS,7,1997,6/10/1997,Myocarditis,NA,Malaysia,MYS,NA,04/??/1997,NA,NA,NA,NA,yes,NA,NA,NA,NA,NA,NA,21,NA,yes,yes,NA,NA,confirmed Coxsacki virus,https://www.who.int/csr/don/1997_06_10/en/,DON-1997-06-10
1997-Dengue-CUB,6,1997,6/18/1997,Dengue,NA,Cuba,CUB,Santiago,NA,01/??/1997,NA,6/16/1997,NA,yes,NA,NA,NA,NA,NA,826,3,NA,NA,NA,NA,NA,NA,https://www.who.int/csr/don/1997_06_18/en/,DON-1997-06-18
1997-Staphylococcus Aureus-WHO,1,1997,6/19/1997,Staphylococcus aureus,NA,NA,NA,NA,NA,NA,NA,NA,NA,NA,NA,NA,NA,NA,NA,NA,NA,NA,NA,NA,NA,NA,AMR,https://www.who.int/csr/don/1997_06_19b/en/,DON-1997-06-19b
1997-Myocarditis-MYS,7,1997,6/19/1997,Myocarditis,NA,Malaysia,MYS,NA,NA,NA,NA,6/12/1997,NA,yes,NA,NA,15,NA,NA,NA,26,NA,NA,NA,NA,NA,NA,https://www.who.int/csr/don/1997_06_19a/en/,DON-1997-06-19a
1997-Myocarditis-MYS,7,1997,6/26/1997,Myocarditis,NA,Malaysia,MYS,NA,NA,NA,NA,NA,NA,NA,NA,NA,NA,NA,NA,NA,29,NA,yes,NA,NA,NA,NA,https://www.who.int/csr/don/1997_06_26/en/,DON-1997-06-26
1997-Myocarditis-MYS,7,1997,7/3/1997,Myocarditis,NA,Malaysia,MYS,"Sibu, Sarawak",NA,4/14/1997,NA,6/28/1997,NA,NA,NA,NA,NA,NA,NA,NA,30,NA,NA,NA,NA,NA,NA,https://www.who.int/csr/don/1997_07_03/en/,DON-1997-07-03
1997-Meningitis-PSE,1,1997,7/7/1997,Viral meningitis,NA,Gaza,PSE,NA,NA,NA,NA,Late May 1997,NA,yes,NA,NA,54,NA,NA,180,NA,NA,NA,NA,NA,NA,NA,https://www.who.int/csr/don/1997_07_07/en/,DON-1997-07-07
1997-Cholera-CAF,5,1997,7/30/1997,Cholera,NA,Central African Republic,CAF,Kouango Sous-Préfecture,NA,NA,7/8/1997,NA,NA,NA,NA,NA,NA,NA,NA,44,8,NA,yes,NA,NA,NA,NA,https://www.who.int/csr/don/1997_07_30/en/,DON-1997-07-30
1997-Monkeypox-COD,2,1997,7/31/1997,Monkeypox,NA,Democratic Republic of the Congo,COD,"Katako-Kombe, Lodja Nord, Lodja Sud",NA,NA,03/??/1997,NA,NA,NA,NA,NA,NA,NA,NA,170,0,NA,02/??/1997,NA,NA,NA,NA,https://www.who.int/csr/don/1997_07_31b/en/,DON-1997-07-31b
1997-Dengue-MYS,6,1997,7/31/1997,Dengue,NA,Malaysia,MYS,NA,NA,NA,01/??/1997,NA,NA,yes,NA,NA,99,NA,NA,11328,28,NA,yes,NA,NA,NA,NA,https://www.who.int/csr/don/1997_07_31a/en/,DON-1997-07-31a
1997-Plague-MOZ,2,1997,8/8/1997,Plague,NA,Mozambique,MOZ,Mutarana,7/7/1997,NA,NA,yes,NA,NA,NA,NA,NA,NA,NA,115,0,NA,yes,NA,NA,NA,NA,https://www.who.int/csr/don/1997_08_08/en/,DON-1997-08-08
1997-Yellow Fever-LBR,6,1997,8/11/1997,Yellow fever,NA,Liberia,LBR,Lofa County,NA,7/6/1997,NA,NA,yes,yes,NA,NA,1,NA,NA,2,NA,NA,yes,NA,NA,NA,NA,https://www.who.int/csr/don/1997_08_11/en/,DON-1997-08-11
1997-Encephalitis-NPL,7,1997,9/2/1997,Encephalitis,NA,Nepal,NPL,"Bankey district, Bardiya. Jhapa, Chitwan, Rupandehi, Kailali, Nawalparasi. Morang, Surkhet, Dang, Kanchanpur, Makwanpur, Gorkha, Saptari, Tanahu, Mahotari, Sindhuli, Siraha, Sunsari and Dhanusha.",NA,NA,1/1/1997,8/15/1997,NA,no,NA,NA,NA,NA,NA,247,NA,NA,NA,NA,NA,NA,NA,https://www.who.int/csr/don/1997_09_02c/en/,DON-1997-09-02c
1997-Cholera-MOZ,5,1997,9/2/1997,Cholera,NA,Mozambique,MOZ,Maputo,NA,8/13/1997,NA,NA,NA,NA,NA,NA,NA,NA,NA,49,NA,NA,yes,yes,NA,NA,NA,https://www.who.int/csr/don/1997_09_02b/en/,DON-1997-09-02b
1997-Meningitis-zwe,1,1997,9/2/1997,Meningitis,NA,Zimbabwe,ZWE,"Bulawayo, Mzilikazi, Makokoba",NA,NA,NA,yes,NA,NA,NA,NA,NA,NA,NA,NA,NA,NA,NA,NA,NA,NA,NA,https://www.who.int/csr/don/1997_09_02a/en/,DON-1997-09-02a
1997-Cholera-KEN,5,1997,9/22/1997,Cholera,NA,Kenya,KEN,Migori,mid-June 1997,NA,8/24/1997,NA,NA,NA,NA,NA,NA,NA,NA,555,29,NA,yes,yes,NA,NA,NA,https://www.who.int/csr/don/1997_09_22/en/,DON-1997-09-22
1997-Transmissible Spongiform Encephalopathies-WHO,5,1997,10/2/1997,Transmissible spongiform encephalopathies (TSEs),Consultation,NA,NA,NA,NA,NA,NA,NA,NA,NA,NA,NA,NA,NA,NA,NA,NA,NA,3/24/1997,yes,NA,NA,NA,https://www.who.int/csr/don/1997_10_02a/en/,DON-1997-10-02a
1997-HPS-Americas,4,1997,10/2/1997,Hantavirus Pulmonary Syndrome,NA,Americas,NA,"Argentina, Bolivia, Brazil, Canada, Chile, Paraguay, Peru, Uruguay, USA",NA,NA,NA,NA,NA,yes,NA,NA,350-400,NA,NA,NA,NA,45,yes,NA,NA,NA,NA,https://www.who.int/csr/don/1997_10_02b/en/,DON-1997-10-02b
1997-Encephalitis-NPL,7,1997,10/10/1997,Encephalitis,NA,Nepal,NPL,"Nepalgunj, Dhangadi",NA,NA,8/30/1997,NA,NA,NA,NA,NA,NA,NA,NA,1364,84,5.2,NA,NA,NA,NA,NA,https://www.who.int/csr/don/1997_10_10/en/,DON-1997-10-10
1997-Leptospirosis-IND,4,1997,10/27/1997,Leptospirosis,NA,India,IND,"Valsad, Chikhali and Gandevi taluks in Valsad district; Vyara and Mahuva taluks in Surat district",mid-July 1997,NA,9/11/1997,yes,NA,yes,NA,NA,NA,NA,NA,413,48,NA,NA,NA,NA,NA,NA,https://www.who.int/csr/don/1997_10_27/en/,DON-1997-10-27
1997-Cholera-KEN,5,1997,10/28/1997,Cholera,NA,Kenya,KEN,"Nyatike Division, Migori District; Rachuonyo, Suba, Homa Bay and Kisumu District of Nyuanza province; Molo in Nakuru.",NA,6/25/1997,NA,NA,NA,NA,NA,NA,NA,NA,NA,2500,140,5.6,yes,yes,NA,NA,NA,https://www.who.int/csr/don/1997_10_28b/en/,DON-1997-10-28b
1997-Cholera-SOM,5,1997,10/28/1997,Cholera,NA,Mozambique,MOZ,"Chamanculo, Mafalala, Polana Caniço, Maxaquene, Zona Verde (in Maputo)",NA,NA,NA,9/27/1997,NA,NA,NA,NA,NA,NA,NA,346,14,5,yes,yes,NA,NA,NA,https://www.who.int/csr/don/1997_10_28a/en/,DON-1997-10-28a
1997-Plague-MWI,2,1997,10/30/1997,Plague,NA,Malawi,MWI,Madani Village,NA,NA,9/29/1997,yes,NA,yes,NA,NA,17,NA,NA,43,NA,NA,yes,yes,NA,NA,NA,https://www.who.int/csr/don/1997_10_30/en/,DON-1997-10-30
1997-Lassa Fever-GHA,2,1997,10/31/1997,Lassa fever,NA,Ghana,GHA,NA,no,NA,NA,NA,NA,no,NA,NA,0,NA,NA,0,0,NA,NA,9/26/1997,NA,NA,no Lassa fever,https://www.who.int/csr/don/1997_10_31/en/,DON-1997-10-31
1997-Monkeypox-COD,2,1997,11/14/1997,Monkeypox,NA,Democratic Republic of the Congo,COD,"Kasai Oriental, Katako Kombe, Lodja, Akungula",02/??/1997,NA,NA,NA,NA,NA,NA,NA,NA,NA,NA,511,NA,1.5,10/??/1997,NA,NA,NA,NA,https://www.who.int/csr/don/1997_11_14b/en/,DON-1997-11-14b
1997-Cholera-SOM,5,1997,11/14/1997,Cholera,NA,Mozambique,MOZ,Maputo,08/??/1997,NA,NA,NA,NA,NA,NA,NA,NA,NA,NA,1330,41,1.8,yes,yes,NA,NA,NA,https://www.who.int/csr/don/1997_11_14a/en/,DON-1997-11-14a
1997-Cholera-SOM,5,1997,11/19/1997,Cholera,NA,Mozambique,MOZ,"Maputo, Xai-Xai City",NA,NA,Second week August 1997,NA,NA,yes,NA,NA,10,NA,NA,1664,62,3.7,yes,yes,NA,NA,NA,https://www.who.int/csr/don/1997_11_19/en/,DON-1997-11-19
1997-Cholera-DJI,5,1997,11/21/1997,Cholera,NA,Djibouti,DJI,NA,NA,NA,NA,11/16/1997,NA,yes,NA,NA,68,NA,NA,355,29,NA,yes,NA,NA,NA,NA,https://www.who.int/csr/don/1997_11_21b/en/,DON-1997-11-21b
1997-Plague-MOZ,2,1997,11/21/1997,Plague,NA,Mozambique,MOZ,Mutarara,06/??/1997,NA,NA,NA,NA,NA,NA,NA,NA,NA,NA,335,0,NA,NA,NA,NA,NA,for Mutarar district only,https://www.who.int/csr/don/1997_11_21a/en/,DON-1997-11-21a
1997-Cholera-DJI,5,1997,11/26/1997,Cholera,NA,Djibouti,DJI,Djibouti,NA,NA,11/24/1997,NA,NA,NA,NA,NA,NA,NA,NA,827,NA,NA,11/22/1997,NA,NA,NA,NA,https://www.who.int/csr/don/1997_11_26b/en/,DON-1997-11-26b
1997-Cholera-MOZ,5,1997,11/26/1997,Cholera,NA,Mozambique,MOZ,"Maputo, Xai-Xai",NA,NA,11/25/1997,NA,NA,NA,NA,NA,NA,NA,NA,4301,146,3.4,yes,NA,NA,NA,NA,https://www.who.int/csr/don/1997_11_26a/en/,DON-1997-11-26a
1998-H5 Influenza-HKG,3,1998,1/5/1998,H5N1,NA,Hong Kong,HKG,NA,NA,NA,NA,NA,NA,yes,NA,NA,16,NA,NA,NA,4,NA,yes,NA,NA,NA,NA,https://www.who.int/csr/don/1998_01_05/en/,DON-1998-01-05
1998-Rift Valley Fever-KEN,6,1998,1/6/1998,Rift Valley fever,NA,Kenya,KEN,Garissa District,NA,NA,NA,NA,NA,12/31/1997,NA,NA,NA,NA,NA,NA,<300,NA,NA,NA,NA,NA,NA,https://www.who.int/csr/don/1998_01_06b/en/,DON-1998-01-06b
1998-Cholera-COD,5,1998,1/6/1998,Cholera,NA,Democratic Republic of the Congo,COD,military camp close to Kisangani,NA,NA,NA,NA,12/18/1997,NA,NA,NA,NA,NA,NA,800,54,NA,yes,NA,NA,NA,NA,https://www.who.int/csr/don/1998_01_06a/en/,DON-1998-01-06a
1998-H5 Influenza-HKG,3,1998,1/7/1998,H5N1,NA,Hong Kong,HKG,NA,12/??/1997,NA,NA,NA,NA,yes,NA,NA,16,NA,2,NA,NA,NA,NA,NA,NA,NA,NA,https://www.who.int/csr/don/1998_01_07b/en/,DON-1998-01-07b
1998-Cholera-TZA,5,1998,1/7/1998,Cholera,NA,United Republic of Tanzania,TZA,NA,End January 1997,NA,yes,NA,NA,NA,NA,NA,NA,NA,NA,35591,2025,NA,yes,NA,NA,NA,NA,https://www.who.int/csr/don/1998_01_07a/en/,DON-1998-01-07a
1998-Unknown-SAU,7,1998,1/9/1998,Cholera,Hajj Guidelines,Saudi Arabia,SAU,NA,NA,NA,NA,NA,NA,NA,NA,NA,NA,NA,NA,NA,NA,NA,yes,NA,yes,NA,NA,https://docs.google.com/spreadsheets/d/1hdPytPiW9vfsQW_rPlXH3I_pB2v0rKBrM80xH5ld3Jo/edit#gid=1919292199,https://docs.google.com/spreadsheets/d/1hdPytPiW9vfsQW-rPlXH3I-pB2v0rKBrM80xH5ld3Jo/edit#gid=1919292199
1998-Cholera-Africa,5,1998,1/9/1998,Cholera,NA,Africa,NA,Eastern and Southern Africa,NA,NA,NA,NA,NA,NA,NA,NA,NA,NA,NA,NA,NA,NA,yes,NA,NA,NA,NA,https://www.who.int/csr/don/1998_01_09c/en/,DON-1998-01-09c
1998-H5 Influenza-HKG,3,1998,1/9/1998,H5N1,NA,Hong Kong,HKG,NA,NA,NA,NA,1/9/1998,NA,yes,NA,NA,16,NA,1,NA,NA,NA,NA,NA,NA,NA,NA,https://www.who.int/csr/don/1998_01_09b/en/,DON-1998-01-09b
1998-H5 Influenza-HKG,3,1998,1/12/1998,H5N1,NA,Hong Kong,HKG,NA,12/7/1997,NA,NA,1/10/1998,NA,yes,NA,NA,17,NA,1,NA,NA,NA,NA,NA,NA,NA,NA,https://www.who.int/csr/don/1998_01_12b/en/,DON-1998-01-12b
1998-Cholera-CHL,5,1998,1/12/1998,Cholera,NA,Chile,CHL,"Ayllo Solor, San Pedro de Atacama, Sequitor",End December 1997,NA,NA,NA,NA,yes,NA,NA,12,NA,NA,33,NA,NA,yes,yes,NA,NA,NA,https://www.who.int/csr/don/1998_01_12a/en/,DON-1998-01-12a
1998-H5 Influenza-HKG,3,1998,1/13/1998,H5N1,NA,Hong Kong,HKG,NA,NA,NA,NA,1/13/1998,NA,yes,NA,NA,17,NA,1,NA,300,NA,yes,NA,NA,NA,NA,https://www.who.int/csr/don/1998_01_13/en/,DON-1998-01-13
1998-Rift Valley Fever-KEN,6,1998,1/14/1998,Rift Valley fever,NA,Kenya,KEN,Garissa,NA,NA,NA,NA,NA,yes,NA,NA,17,NA,NA,NA,NA,NA,yes,NA,NA,NA,NA,https://www.who.int/csr/don/1998_01_14b/en/,DON-1998-01-14b
1998-H5 Influenza-HKG,3,1998,1/14/1998,H5N1,NA,Hong Kong,HKG,NA,NA,12/28/1997,NA,NA,NA,1/14/1998,NA,NA,18,NA,1,NA,5,NA,NA,NA,NA,NA,NA,https://www.who.int/csr/don/1998_01_14a/en/,DON-1998-01-14a
1998-H5 Influenza-HKG,3,1998,1/15/1998,H5N1,NA,Hong Kong,HKG,NA,NA,12/21/1997,NA,1/15/1998,NA,yes,NA,NA,18,NA,1,NA,6,NA,yes,NA,NA,NA,NA,https://www.who.int/csr/don/1998_01_15/en/,DON-1998-01-15
1998-Rift Valley Fever-KEN,6,1998,1/16/1998,Rift Valley fever,NA,Kenya,KEN,north-east,NA,NA,NA,NA,NA,yes,NA,NA,NA,NA,NA,NA,NA,NA,yes,NA,NA,NA,NA,https://www.who.int/csr/don/1998_01_16/en/,DON-1998-01-16
1998-Rift Valley Fever-SOM,6,1998,1/16/1998,Rift Valley fever,NA,Somalia,SOM,"Belete Weyne, Johar",NA,NA,NA,NA,NA,yes,NA,NA,4,NA,NA,NA,NA,NA,yes,NA,NA,NA,NA,https://www.who.int/csr/don/1998_01_16/en/,DON-1998-01-16
1998-H5 Influenza-HKG,3,1998,1/19/1998,H5N1,NA,Hong Kong,HKG,NA,NA,NA,NA,1/19/1998,NA,yes,NA,NA,18,NA,1,NA,NA,NA,yes,NA,NA,NA,NA,https://www.who.int/csr/don/1998_01_19/en/,DON-1998-01-19
1998-H5 Influenza-HKG,3,1998,1/20/1998,H5N1,NA,Hong Kong,HKG,NA,NA,NA,NA,1/20/1998,NA,yes,NA,NA,18,NA,1,NA,NA,NA,NA,NA,NA,NA,NA,https://www.who.int/csr/don/1998_01_20/en/,DON-1998-01-20
1997-Meningitis-COD,1,1998,1/28/1998,Meningitis,NA,Democratic Republic of the Congo,COD,Tembo,NA,NA,1/2/1998,NA,NA,yes,NA,NA,114,32,28,NA,NA,NA,yes,NA,NA,NA,NA,https://www.who.int/csr/don/1998_01_28/en/,DON-1998-01-28
1998-Cholera-SOM,5,1998,2/3/1998,Cholera,NA,Mozambique,MOZ,Beira City,NA,NA,NA,yes,NA,yes,NA,NA,5,NA,NA,NA,NA,NA,yes,NA,NA,NA,NA,https://www.who.int/csr/don/1998_02_03b/en/,DON-1998-02-03b
1998-Cholera-COG,5,1998,2/3/1998,Cholera-like diarrhoeal disease,NA,Republic of the Congo,COG,Pointe-Noire,11/7/1997,NA,11/??/1997,NA,NA,yes,NA,NA,6,NA,NA,445,83,20,2/1/1998,NA,NA,NA,NA,https://www.who.int/csr/don/1998_02_03a/en/,DON-1998-02-03a
1998-Cholera-COG,5,1998,2/10/1998,Cholera,NA,Republic of the Congo,COG,4 areas of Pointe-Noire; Madingo-Kayes; Kaka Mueka,11/27/1997,NA,2/5/1998,NA,NA,NA,NA,NA,NA,NA,NA,485,83,17.1,yes,NA,NA,NA,NA,https://www.who.int/csr/don/1998_02_10c/en/,DON-1998-02-10c
1998-Cholera-SOM,5,1998,2/10/1998,Cholera,NA,Mozambique,MOZ,Beira,NA,NA,NA,2/9/1998,NA,NA,NA,NA,NA,NA,NA,2000,109,NA,yes,NA,NA,NA,NA,https://www.who.int/csr/don/1998_02_10a/en/,DON-1998-02-10a
1998-Dengue-KHM,6,1998,2/13/1998,Dengue haemorrhagic fever,NA,Cambodia,KHM,Phnom Penh,NA,NA,1/1/1998,NA,NA,NA,NA,NA,NA,NA,NA,227,3,NA,yes,NA,NA,NA,NA,https://www.who.int/csr/don/1998_02_13/en/,DON-1998-02-13
1998-Influenza-Global,3,1998,2/19/1998,Influenza,NA,Global,NA,"Canda, USA, Israel, Iran, Japan, Europe",NA,NA,NA,NA,NA,NA,NA,NA,NA,NA,NA,NA,NA,NA,NA,NA,NA,NA,NA,https://www.who.int/csr/don/1998_02_19/en/,DON-1998-02-19
1998-Cholera-SOM,5,1998,2/20/1998,Cholera,NA,Mozambique,MOZ,Beira City,NA,NA,08/??/1997,NA,NA,NA,NA,NA,NA,NA,NA,14679,477,3.2,yes,NA,NA,NA,NA,https://www.who.int/csr/don/1998_02_20b/en/,DON-1998-02-20b
1998-Cholera-COM,5,1998,2/20/1998,Cholera,NA,Comoros Islands,COM,"Moroni, Mbeni",NA,NA,NA,1/19/1998,yes,yes,NA,NA,NA,NA,NA,282,10,3.5,yes,yes,NA,NA,NA,https://www.who.int/csr/don/1998_02_20a/en/,DON-1998-02-20a
1998-Cholera-PER,5,1998,2/25/1998,Cholera,NA,Peru,PER,"Arequipa, Lima, La Libertad, Lambayeque, Ancash, Cuzco",NA,NA,1/1/1998,NA,NA,NA,NA,NA,NA,NA,NA,2863,16,NA,yes,NA,NA,NA,El Nino,https://www.who.int/csr/don/1998_02_25/en/,DON-1998-02-25
1998-Cholera-COM,5,1998,3/10/1998,Cholera,NA,Comoros Islands,COM,"Mbeni, Moroni, Grande Comore Island",NA,NA,2/7/1998,NA,NA,NA,NA,NA,NA,NA,NA,193,8,4.14,yes,NA,NA,NA,NA,https://www.who.int/csr/don/1998_02_10b/en/,DON-1998-02-10b
1998-H5 Influenza-HKG,3,1998,3/12/1998,H5N1,NA,Hong Kong,HKG,NA,NA,NA,NA,NA,NA,yes,NA,NA,18,NA,NA,NA,6,NA,yes,NA,NA,NA,Case-control study; human-to-human transmission inefficient,https://www.who.int/csr/don/1998_03_12/en/,DON-1998-03-12
1998-Cholera-COM,5,1998,3/16/1998,Cholera,NA,Comoros Islands,COM,"Mbeni, Moroni, Mitsamiouli, Foumbouni, Ouzioini, Mitsoudje",NA,NA,3/11/1998,yes,NA,NA,NA,NA,NA,NA,NA,945,18,1.9,yes,NA,NA,NA,NA,https://www.who.int/csr/don/1998_03_16/en/,DON-1998-03-16
1998-Cholera-BOL,5,1998,3/31/1998,Cholera,NA,Bolivia,BOL,"La Paz, El Alto, Valles y Tropico de la Paz",NA,NA,NA,yes,NA,NA,NA,NA,NA,NA,NA,165,5,NA,yes,NA,NA,NA,El Nino,https://www.who.int/csr/don/1998_03_31/en/,DON-1998-03-31
1998-Cholera-HND,5,1998,3/31/1998,Cholera,NA,Honduras,HND,La Mosquitia in Gracias a Dios Department,NA,NA,NA,yes,NA,NA,NA,NA,NA,NA,NA,219,12,NA,yes,NA,NA,NA,NA,https://www.who.int/csr/don/1998_03_31/en/,DON-1998-03-31
1998-Cholera-ECU,5,1998,3/31/1998,Cholera,NA,Ecuador,ECU,Loja Province,NA,NA,NA,yes,NA,NA,NA,NA,NA,NA,NA,11,1,NA,yes,NA,NA,NA,NA,https://www.who.int/csr/don/1998_03_31/en/,DON-1998-03-31
1998-Cholera-PER,5,1998,3/31/1998,Cholera,NA,Peru,PER,various departments,NA,NA,NA,yes,NA,NA,NA,NA,NA,NA,NA,2863,16,NA,yes,NA,NA,NA,NA,https://www.who.int/csr/don/1998_03_31/en/,DON-1998-03-31
1998-Cholera-NIC,5,1998,3/31/1998,Cholera,NA,Nicaragua,NIC,border area with Honduras,NA,NA,NA,yes,NA,NA,NA,NA,NA,NA,3,NA,NA,NA,yes,NA,NA,NA,NA,https://www.who.int/csr/don/1998_03_31/en/,DON-1998-03-31
1998-Cholera-ZWE,5,1998,4/7/1998,Cholera,NA,Zimbabwe,ZWE,"Chipinge District, Chiredze District, Masvingo Province, Matabeleland North Province",NA,NA,3/27/1998,NA,NA,NA,NA,NA,NA,NA,NA,335,12,NA,yes,NA,NA,NA,NA,https://www.who.int/csr/don/1998_04_07b/en/,DON-1998-04-07b
1998-Cholera-UGA,5,1998,4/7/1998,Cholera,NA,Uganda,UGA,"Central, Eastern, Western Regions",late 1997,NA,NA,3/24/1998,NA,NA,NA,NA,NA,NA,NA,16982,849,5,NA,NA,NA,NA,NA,https://www.who.int/csr/don/1998_04_07/en/,DON-1998-04-07
1998-Dengue-MYS,6,1998,4/15/1998,Dengue,NA,Malaysia,MYS,all states,NA,NA,yes,NA,NA,yes,NA,NA,NA,NA,NA,19544,50,NA,yes,NA,NA,NA,NA,https://www.who.int/csr/don/1998_04_15/en/,DON-1998-04-15
1998-Meningitis-TCD,1,1998,4/22/1998,Meningitis,NA,Chad,TCD,"Bokoro, N'Djamena",NA,NA,12/19/1997,NA,NA,NA,NA,NA,NA,NA,NA,2835,239,NA,yes,NA,NA,NA,NA,https://www.who.int/csr/don/1998_04_22/en/,DON-1998-04-22
1998-Shigella-CMR,5,1998,4/29/1998,Shigella dysenteriae type 1,NA,Cameroon,CMR,NA,11/??/1997,NA,NA,NA,yes,yes,NA,NA,NA,NA,NA,237,60,NA,yes,NA,NA,NA,NA,https://www.who.int/csr/don/1998_04_29/en/,DON-1998-04-29
1998-CCHF-PAK,6,1998,5/8/1998,Crimean-Congo heamorrhagic fever,NA,Pakistan,PAK,Kohlu,NA,NA,NA,NA,NA,yes,NA,NA,2,NA,NA,4,2,NA,NA,NA,NA,NA,NA,https://www.who.int/csr/don/1998_05_08b/en/,DON-1998-05-08b
1998-CCHF-AFG,6,1998,5/8/1998,Crimean-Congo heamorrhagic fever,NA,Afghanistan,AFG,Rustaq,mid-March 1997,NA,NA,NA,NA,NA,NA,NA,NA,NA,NA,19,12,NA,yes,NA,NA,NA,NA,https://www.who.int/csr/don/1998_05_08a/en/,DON-1998-05-08a
1998-Cholera-RWA,5,1998,5/19/1998,Cholera,NA,Rwanda,RWA,Cyangugu Prefecture,late February 1998,NA,NA,NA,NA,NA,NA,NA,NA,NA,NA,NA,NA,NA,NA,NA,NA,NA,NA,https://www.who.int/csr/don/1998_05_19c/en/,DON-1998-05-19c
1998-Cholera-COD,5,1998,5/19/1998,Cholera,NA,Democratic Republic of the Congo,COD,"Bunia, Bukavu",NA,NA,NA,1/1/1998,NA,NA,NA,NA,NA,NA,NA,9605,746,7.8,yes,NA,NA,NA,NA,https://www.who.int/csr/don/1998_05_19b/en/,DON-1998-05-19b
1998-Malaria-TZA,6,1998,5/19/1998,Malaria,NA,United Republic of Tanzania,TZA,"Sumbawanga District; Matai, Sopa and Katete wards; Tanga, Muleba, Korogwe, Handeni and Lushoto",NA,NA,yes,NA,NA,yes,NA,NA,NA,NA,NA,NA,NA,NA,yes,NA,NA,NA,NA,https://www.who.int/csr/don/1998_05_19/en/,DON-1998-05-19
1998-Malaria-COD,6,1998,5/28/1998,Malaria,NA,Democratic Republic of the Congo,COD,"Katanga, Nord-Kivu, Sud-Kivu, Orientale, Kinsasha, Equateur",NA,NA,01/??/1998,NA,NA,NA,NA,NA,NA,NA,NA,13440,778,NA,yes,NA,NA,NA,NA,https://www.who.int/csr/don/1998_05_28/en/,DON-1998-05-28
1998-Malaria-BDI,6,1998,5/28/1998,Malaria,NA,Burundi,BDI,"Buyenzi, Bwiza, Cibitoke, Musaga districts",NA,NA,4/1/1998,NA,NA,NA,NA,NA,NA,NA,NA,77,3,NA,yes,yes,NA,NA,NA,https://www.who.int/csr/don/1998_05_28/en/,DON-1998-05-28
1998-Malaria-RWA,6,1998,5/28/1998,Malaria,NA,Rwanda,RWA,Cyangugu Prefecture,NA,NA,03/??/1998,NA,NA,NA,NA,NA,NA,NA,NA,NA,NA,NA,NA,NA,NA,NA,NA,https://www.who.int/csr/don/1998_05_28/en/,DON-1998-05-28
1998-Malaria-UGA,6,1998,5/28/1998,Malaria,NA,Uganda,UGA,NA,late 1997,NA,01/??/1998,NA,NA,NA,NA,NA,NA,NA,NA,>20000,>1000,NA,NA,NA,NA,NA,NA,https://www.who.int/csr/don/1998_05_28/en/,DON-1998-05-28
1998-Dengue-Global,6,1998,6/8/1998,Dengue,NA,Global,NA,"Malaysia, Taiwan [China], Cambodia, Viet Nam, Thailand, Philippines, Indonesia, Myanmar, Guam, Cook Islands, Fiji, New Caledonia, Kiribati, Brazil, Venezuela, Columbia",NA,NA,01/??/1998,NA,NA,NA,NA,NA,NA,NA,NA,289477,842,NA,yes,NA,NA,NA,NA,https://www.who.int/csr/don/1998_06_08e/en/,DON-1998-06-08e
1998-Enterovirus-TWN,1,1998,6/17/1998,Enterovirus,NA,Taiwan,TWN,NA,NA,NA,6/17/1998,NA,NA,NA,NA,NA,NA,NA,NA,NA,41,NA,NA,NA,NA,NA,NA,https://www.who.int/csr/don/1998_06_17e/en/,DON-1998-06-17e
1998-Cholera-WHO,7,1998,7/3/1998,Cholera,Lift Import Ban,European Commision,NA,NA,NA,NA,NA,NA,NA,NA,NA,NA,NA,NA,NA,NA,NA,NA,7/1/1998,NA,NA,NA,NA,https://docs.google.com/spreadsheets/d/1hdPytPiW9vfsQW_rPlXH3I_pB2v0rKBrM80xH5ld3Jo/edit#gid=1919292199,https://docs.google.com/spreadsheets/d/1hdPytPiW9vfsQW-rPlXH3I-pB2v0rKBrM80xH5ld3Jo/edit#gid=1919292199
1998-Enterovirus-TWN,1,1998,7/4/1998,Enterovirus,NA,Taiwan,TWN,all regions,04/??/1998,NA,7/3/1998,NA,NA,yes,NA,NA,NA,NA,NA,NA,55,NA,yes,NA,NA,NA,NA,https://www.who.int/csr/don/1998_07_04/en/,DON-1998-07-04
1998-Cholera-KHM,5,1998,7/15/1998,Cholera,NA,Cambodia,KHM,"Khaal Spean, Baliley, Kilo Leek Buon",6/14/1998,NA,NA,6/29/1998,NA,NA,NA,NA,NA,NA,NA,69,15,NA,yes,yes,NA,NA,NA,https://www.who.int/csr/don/1998_07_15/en/,DON-1998-07-15
1998-Cholera-UGA,5,1998,7/20/1998,Cholera,NA,Uganda,UGA,39 districts,end 1997,NA,NA,end June 1998,NA,NA,NA,NA,NA,NA,NA,38697,1576,NA,NA,NA,NA,NA,NA,https://www.who.int/csr/don/1998_07_20/en/,DON-1998-07-20
1998-Cholera-LBR,5,1998,8/3/1998,Cholera/diarrhoea,NA,Liberia,LBR,"Nimba County, Margibi County, Sinoe County",end May 1998,NA,NA,6/26/1998,NA,NA,NA,NA,NA,NA,NA,560,12,NA,yes,NA,NA,NA,NA,https://www.who.int/csr/don/1998_08_03/en/,DON-1998-08-03
1998-Meningitis-AGO,1,1998,8/6/1998,Meningococcal Meningitis,NA,Angola,AGO,"Bié, Malange, Lunda Norte and Huambo",NA,NA,NA,1/1/1998,NA,NA,NA,NA,NA,NA,NA,574,69,12,yes,NA,NA,NA,NA,https://www.who.int/csr/don/1998_08_06/en/,DON-1998-08-06
1998-Anthrax-RUS,4,1998,8/11/1998,Anthrax,NA,Russian Federation,RUS,NA,NA,NA,06/??/1998,NA,NA,NA,NA,NA,NA,NA,NA,15,2,NA,NA,NA,NA,NA,NA,https://www.who.int/csr/don/1998_08_11/en/,DON-1998-08-11
1999-Legionellosis-FRA,5,1998,8/13/1998,Legionellosis,NA,France,FRA,Paris,6/6/1998,early June 1998,NA,NA,NA,yes,NA,NA,NA,NA,NA,19,3,NA,yes,NA,NA,NA,NA,https://www.who.int/csr/don/1998_08_13/en/,DON-1998-08-13
1998-Cholera-MOZ,5,1998,8/14/1998,Cholera,NA,Mozambique,MOZ,8/11 provinces,NA,NA,NA,yes,NA,NA,NA,NA,NA,NA,NA,26783,619,2.3,yes,NA,NA,NA,NA,https://www.who.int/csr/don/1998_08_14/en/,DON-1998-08-14
1998-Dengue-Asia,6,1998,8/18/1998,Dengue,NA,Asia,NA,NA,NA,NA,NA,NA,NA,NA,NA,NA,NA,NA,NA,NA,NA,<1,NA,NA,NA,NA,NA,https://www.who.int/csr/don/1998_08_18/en/,DON-1998-08-18
1998-Cholera-AFG,5,1998,8/19/1998,Cholera,NA,Afghanistan,AFG,"Kabul, Logar, Bamyan, Uruzgan",07/??/1998,NA,NA,NA,NA,yes,NA,NA,NA,NA,NA,NA,NA,NA,yes,NA,NA,NA,NA,https://www.who.int/csr/don/1998_08_19b/en/,DON-1998-08-19b
1998-Cholera-Asia,5,1998,8/20/1998,Cholera,NA,Asia,NA,NA,NA,NA,NA,NA,NA,NA,NA,NA,NA,NA,NA,NA,NA,NA,yes,NA,NA,NA,NA,https://www.who.int/csr/don/1998_08_19/en/,DON-1998-08-19
1998-Cholera-AFG,5,1998,8/21/1998,Cholera,NA,Afghanistan,AFG,"Kabul, Baghlan, Takhar, Samangan, Kunduz, Badakhshan, Nooristan, Uruzgan, Ghanzi",NA,NA,NA,yes,NA,NA,NA,NA,NA,NA,NA,>13962,>145,NA,yes,yes,NA,NA,NA,https://www.who.int/csr/don/1998_08_21/en/,DON-1998-08-21
1998-Meningitis-AGO,1,1998,8/24/1998,Meningococcal Meningitis,NA,Angola,AGO,"Bié, Malange, Huambo and Lunda Norte",NA,NA,NA,NA,NA,NA,NA,NA,NA,NA,NA,1113,115,10.3,yes,NA,NA,NA,NA,https://www.who.int/csr/don/1998_08_24/en/,DON-1998-08-24
1998-Yellow Fever-BRA,6,1998,8/26/1998,Yellow fever,NA,Brazil,BRA,"Afuá, Bannach, Gurupá, Óbidos, Rendenção, Amazonas, Marcolândia",NA,NA,NA,yes,NA,yes,NA,NA,24,NA,NA,NA,9,NA,yes,NA,NA,NA,NA,https://www.who.int/csr/don/1998_08_26/en/,DON-1998-08-26
1998-Cholera-BTN,5,1998,8/31/1998,Cholera,NA,Bhutan,BTN,NA,NA,8/15/1998,NA,8/28/1998,NA,NA,NA,NA,NA,NA,NA,13,NA,NA,yes,NA,NA,NA,NA,https://www.who.int/csr/don/1998_08_31/en/,DON-1998-08-31
1998-Cholera-AFG,5,1998,9/2/1998,Cholera,NA,Afghanistan,AFG,"Bamya, Kabul, Ghazni, Baghlan, Laghman, Takhar, Samangan, Kunduz, Badakhshan, Uruzgan",NA,NA,NA,NA,NA,NA,NA,21,NA,NA,NA,NA,NA,NA,mid-August 1998,yes,NA,NA,numbers incomplete,https://www.who.int/csr/don/1998_09_02/en/,DON-1998-09-02
1998-Cholera-COM,5,1998,9/9/1998,Cholera,NA,Comoros,COM,"Mbeni, Moroni, Mayotte",02/??/1998,NA,NA,mid-August 1998,NA,NA,NA,NA,NA,NA,NA,3199,40,NA,yes,NA,NA,NA,NA,https://www.who.int/csr/don/1998_09_09/en/,DON-1998-09-09
1998-Cholera-ARM,5,1998,9/11/1998,Cholera,NA,Armenia,ARM,village 60 km from Yerevan,NA,NA,NA,9/6/1998,NA,yes,NA,NA,NA,NA,NA,25,NA,NA,yes,NA,NA,NA,NA,https://www.who.int/csr/don/1998_09_11/en/,DON-1998-09-11
1998-Typhoid Fever-KGZ,5,1998,9/21/1998,Typhoid Fever,NA,Kyrgyzstan,KGZ,Osh Oblast,NA,9/7/1998,NA,yes,NA,yes,NA,NA,46,NA,NA,458,NA,NA,yes,NA,NA,NA,NA,https://www.who.int/csr/don/1998_09_21/en/,DON-1998-09-21
1998-Cholera-UGA,5,1998,9/21/1998,Cholera,NA,Uganda,UGA,"Arua, Moyo, Kamuli, Bushenyi, Hoima, Kasese, Kibaale, Masinidi",late 1997,NA,yes,NA,NA,NA,NA,NA,NA,NA,NA,43911,1777,4,NA,NA,NA,NA,NA,https://www.who.int/csr/don/1998_09_21a/en/,DON-1998-09-21a
1998-Cholera-Asia,5,1998,9/22/1998,Vibrio cholerae O139,NA,Asia,NA,10 countries (Hong Kong and India 1998),6/14/1905,NA,NA,NA,NA,NA,NA,NA,6,NA,NA,NA,NA,NA,NA,NA,NA,NA,stressing importance of monitoring,https://www.who.int/csr/don/1998_09_22/en/,DON-1998-09-22
1998-Cholera-SLE,5,1998,9/23/1998,Cholera,NA,Sierra Leone,SLE,NA,NA,NA,9/16/1998,NA,NA,9/23/1998,NA,NA,NA,NA,NA,1770,55,NA,yes,yes,NA,NA,Vibrio cholerae O1 El Tor confirmed,https://www.who.int/csr/don/1998_09_23/en/,DON-1998-09-23
1998-Diarrheal Disease-BGD,5,1998,09/31/1998,Diarrhoeal diseases,NA,Bangladesh,BGD,NA,NA,NA,NA,NA,NA,NA,NA,NA,NA,NA,NA,">185,000",151,NA,yes,yes,NA,NA,NA,https://www.who.int/csr/don/1998_09_30/en/,DON-1998-09-30
1998-Cholera-West Africa,5,1998,10/14/1998,Cholera,NA,West Africa,NA,11 countries,09/??1998,NA,NA,09/??1998,NA,NA,NA,NA,NA,NA,NA,NA,NA,NA,yes,NA,NA,NA,NA,https://www.who.int/csr/don/1998_10_14/en/,DON-1998-10-14
1998-Cholera-CMR,5,1998,10/15/1998,Cholera,NA,Cameroon,CMR,"Kousseri, Maroua, Extrême-Nord, Garoua, Douala",06/??/1998,NA,06/??/1998,NA,NA,NA,NA,NA,NA,NA,NA,1106,113,NA,yes,NA,NA,NA,NA,https://www.who.int/csr/don/1998_10_15/en/,DON-1998-10-15
1998-Cholera-RWA,5,1998,10/22/1998,Cholera,NA,Rwanda,RWA,Cyangugu prefecture,05/??/1998,NA,09/??1998,NA,NA,NA,NA,NA,NA,NA,NA,2900,55,NA,yes,NA,NA,NA,NA,https://www.who.int/csr/don/1998_10_22c/en/,DON-1998-10-22c
1998-Cholera-COD,5,1998,10/22/1998,Cholera,NA,Democratic Republic of the Congo,COD,Shabunda,NA,NA,NA,NA,NA,NA,NA,NA,NA,NA,NA,NA,NA,NA,NA,NA,NA,NA,NA,https://www.who.int/csr/don/1998_10_22c/en/,DON-1998-10-22c
1998-Pneumonia-SDN,1,1998,10/22/1998,Pneumonia,NA,Sudan,SDN,Meyon,07/??1998,NA,NA,yes,NA,NA,NA,NA,NA,NA,NA,NA,100,NA,yes,NA,NA,NA,NA,https://www.who.int/csr/don/1998_10_22b/en/,DON-1998-10-22b
1998-Yellow Fever-BRA,6,1998,10/22/1998,Yellow fever,NA,Brazil,BRA,"Itaituba, Floresta, Alto Alegre, Mucajaí, Boa Vista",NA,NA,NA,10/??1998,NA,yes,NA,NA,32,NA,NA,NA,13,NA,yes,NA,NA,NA,NA,https://www.who.int/csr/don/1998_10_22a/en/,DON-1998-10-22a
1998-Cholera-RUS,5,1998,10/23/1998,Cholera,NA,Russian Federation,RUS,southern Dagestan,NA,NA,beginning October,NA,NA,yes,NA,NA,NA,NA,NA,8,NA,NA,yes,NA,NA,NA,NA,https://www.who.int/csr/don/1998_10_23/en/,DON-1998-10-23
1998-Cholera-IRQ,5,1998,10/26/1998,Cholera,NA,Iraq,IRQ,Sulaimania,NA,NA,NA,9/12/1998,NA,NA,NA,NA,NA,NA,NA,20,1,NA,yes,NA,NA,NA,NA,https://www.who.int/csr/don/1998_10_26/en/,DON-1998-10-26
1998-Yellow Fever-VEN,6,1998,11/4/1998,Yellow fever,NA,Venezuela,VEN,Parima,NA,NA,NA,10/??/1998,NA,NA,NA,NA,14,NA,NA,14,3,NA,yes,NA,NA,NA,NA,https://www.who.int/csr/don/1998_11_04/en/,DON-1998-11-04
1998-Cholera-SOM,5,1998,10/16/1998,Cholera,NA,Somalia,SOM,Mogadishu,NA,NA,NA,NA,NA,NA,NA,NA,NA,NA,NA,NA,NA,NA,yes,yes,NA,NA,NA,https://docs.google.com/spreadsheets/d/1hdPytPiW9vfsQW_rPlXH3I_pB2v0rKBrM80xH5ld3Jo/edit#gid=1919292199,https://docs.google.com/spreadsheets/d/1hdPytPiW9vfsQW-rPlXH3I-pB2v0rKBrM80xH5ld3Jo/edit#gid=1919292199
1998-Plague-UGA,2,1998,11/6/1998,Plague,NA,Uganda,UGA,Arua,NA,NA,04/??/1998,NA,NA,NA,NA,NA,NA,NA,NA,49,NA,NA,yes,NA,NA,NA,NA,https://www.who.int/csr/don/1998_11_06a/en/,DON-1998-11-06a
1998-Hurricane-HND,7,1998,11/10/1998,Plague,Hurricane Mitch,Honduras,HND,NA,NA,NA,NA,no,NA,NA,NA,NA,NA,NA,NA,NA,>5000,NA,NA,NA,NA,NA,NA,https://www.who.int/csr/don/1998_11_10a/en/,DON-1998-11-10a
1998-Hurricane-HND,7,1998,11/10/1998,Plague,NA,Nicaragua,NIC,NA,NA,NA,NA,yes,NA,NA,NA,NA,NA,NA,NA,NA,1368,NA,yes,NA,NA,NA,NA,https://www.who.int/csr/don/1998_11_10a/en/,DON-1998-11-10a
1998-Rift Valley Fever-MRT,6,1998,11/10/1998,Rift Valley fever,NA,Mauritania,MRT,"Aioun, Assaba",NA,NA,NA,NA,NA,yes,NA,NA,2,NA,NA,300-400,8,NA,yes,NA,NA,NA,NA,https://www.who.int/csr/don/1998_11_10/en/,DON-1998-11-10
1998-Hurricane-Central America,7,1998,11/11/1998,Rift Valley fever,Hurricane Mitch,Central America,NA,NA,no,NA,NA,NA,NA,yes,NA,NA,NA,NA,NA,NA,NA,NA,yes,NA,NA,NA,NA,https://www.who.int/csr/don/1998_11_11/en/,DON-1998-11-11
1998-Hurricane-NIC,7,1998,11/23/1998,Rift Valley fever,Hurricane Mitch,Nicaragua,NIC,"Matalgapla, Esteli, El Viejo",NA,NA,NA,NA,NA,NA,NA,NA,NA,NA,NA,NA,2362,NA,NA,NA,NA,NA,NA,https://www.who.int/csr/don/1998_11_23/en/,DON-1998-11-23
1998-Hurricane-HND,7,1998,11/23/1998,Rift Valley fever,NA,Honduras,HND,NA,NA,NA,NA,NA,NA,NA,NA,NA,NA,NA,NA,NA,7000,NA,NA,NA,NA,NA,NA,https://www.who.int/csr/don/1998_11_23/en/,DON-1998-11-23
1998-Cholera-SLV,5,1998,11/24/1998,Cholera,Hurricane Mitch,El Salvador,SLV,near Guatemala border,NA,NA,NA,yes,NA,yes,NA,NA,6,NA,NA,NA,1,NA,yes,NA,NA,NA,NA,https://www.who.int/csr/don/1998_11_24/en/,DON-1998-11-24
1998-Cholera-GTM,5,1998,11/24/1998,Cholera,Hurricane Mitch,Guatemala,GTM,NA,NA,NA,NA,yes,NA,yes,NA,NA,234,NA,NA,NA,17,NA,yes,NA,NA,NA,NA,https://www.who.int/csr/don/1998_11_24/en/,DON-1998-11-24
1998-Leptospirosis-GTM,4,1998,11/24/1998,Leptospirosis,Hurricane Mitch,Guatemala,GTM,"Guatemala City, Esquintla",NA,NA,NA,yes,NA,yes,NA,NA,4,NA,NA,7,NA,NA,yes,NA,NA,NA,NA,https://www.who.int/csr/don/1998_11_24/en/,DON-1998-11-24
1998-Dengue-GTM,6,1998,11/24/1998,Dengue,Hurricane Mitch,Guatemala,GTM,NA,NA,NA,NA,yes,NA,NA,NA,NA,NA,NA,NA,6,NA,NA,yes,NA,NA,NA,NA,https://www.who.int/csr/don/1998_11_24/en/,DON-1998-11-24
1998-Malaria-GTM,6,1998,11/24/1998,Malaria,Hurricane Mitch,Guatemala,GTM,NA,NA,NA,NA,yes,NA,NA,NA,NA,NA,NA,NA,70,NA,NA,yes,NA,NA,NA,NA,https://www.who.int/csr/don/1998_11_24/en/,DON-1998-11-24
1998-Cholera-NIC,5,1998,11/24/1998,Cholera,Hurricane Mitch,Nicaragua,NIC,"Managua, Carazo, Masaya, Matagalpa, Chinandega, Esteli",NA,NA,NA,yes,NA,yes,NA,NA,301,NA,NA,335,NA,NA,yes,NA,NA,NA,NA,https://www.who.int/csr/don/1998_11_24/en/,DON-1998-11-24
1998-Leptospirosis-NIC,4,1998,11/24/1998,Leptospirosis,Hurricane Mitch,Nicaragua,NIC,"Chinandega, Esteli, Madriz",NA,NA,NA,yes,NA,NA,NA,NA,42,NA,NA,264,7,NA,yes,NA,NA,NA,NA,https://www.who.int/csr/don/1998_11_24/en/,DON-1998-11-24
1998-Cholera-HND,5,1998,11/24/1998,Cholera,Hurricane Mitch,Honduras,HND,NA,NA,NA,NA,yes,NA,yes,NA,NA,NA,NA,NA,14,NA,NA,yes,NA,NA,NA,NA,https://www.who.int/csr/don/1998_11_24/en/,DON-1998-11-24
1998-Leptospirosis-HND,4,1998,11/24/1998,Leptospirosis,Hurricane Mitch,Honduras,HND,NA,NA,NA,NA,yes,NA,yes,NA,NA,NA,NA,NA,4,3,NA,yes,NA,NA,NA,NA,https://www.who.int/csr/don/1998_11_24/en/,DON-1998-11-24
1998-Dengue-HND,6,1998,11/24/1998,Dengue,Hurricane Mitch,Honduras,HND,NA,NA,NA,NA,yes,NA,NA,NA,NA,NA,NA,NA,1080,NA,NA,yes,NA,NA,NA,NA,https://www.who.int/csr/don/1998_11_24/en/,DON-1998-11-24
1998-Dengue-HND,6,1998,11/24/1998,Dengue Haemorrhagic fever,Hurricane Mitch,Honduras,HND,NA,NA,NA,NA,yes,NA,yes,NA,NA,15,NA,NA,NA,4,NA,yes,NA,NA,NA,NA,https://www.who.int/csr/don/1998_11_24/en/,DON-1998-11-24
1998-Malaria-HND,6,1998,11/24/1998,Malaria,Hurricane Mitch,Honduras,HND,NA,NA,NA,NA,yes,NA,NA,NA,NA,NA,NA,NA,1567,7,NA,yes,NA,NA,NA,NA,https://www.who.int/csr/don/1998_11_24/en/,DON-1998-11-24
1998-Cholera-BLZ,5,1998,11/24/1998,Cholera,Hurricane Mitch,Belize,BLZ,Saint Martin,NA,NA,NA,yes,NA,yes,NA,NA,5,NA,11,NA,NA,NA,yes,NA,NA,NA,NA,https://www.who.int/csr/don/1998_11_24/en/,DON-1998-11-24
1998-Cholera-LKA,5,1998,11/25/1998,Cholera,NA,Sri Lanka,LKA,Colombo,09/??/1997,NA,11/16/1998,NA,NA,NA,NA,NA,NA,NA,NA,1264,36,2.7,yes,NA,NA,NA,NA,https://www.who.int/csr/don/1998_11_25/en/,DON-1998-11-25
1998-Cholera-BRA,5,1998,11/25/1998,Cholera,NA,Brazil,BRA,"Cortez municipality, Rio Sirinhaem",NA,NA,11/12/1998,NA,NA,yes,NA,NA,24,NA,NA,376,NA,NA,yes,yes,NA,NA,NA,https://www.who.int/csr/don/1998_11_25a/en/,DON-1998-11-25a
1998-Cholera-SLV,5,1998,11/26/1998,Cholera,Hurricane Mitch,El Salvador,SLV,"San Alejo, La Union, Metepan, Santa Ana",NA,NA,NA,11/20/1998,NA,yes,NA,NA,1,NA,NA,6,1,NA,yes,yes,NA,NA,NA,https://www.who.int/csr/don/1998_11_26/en/,DON-1998-11-26
1998-Cholera-GTM,5,1998,11/26/1998,Cholera,Hurricane Mitch,Guatemala,GTM,NA,NA,NA,11/4/1998,yes,NA,yes,NA,NA,234,NA,NA,261,17,NA,yes,NA,NA,NA,NA,https://www.who.int/csr/don/1998_11_26/en/,DON-1998-11-26
1998-Leptospirosis-GTM,4,1998,11/26/1998,Leptospirosis,Hurricane Mitch,Guatemala,GTM,"Guatemala City, Escuintla",NA,NA,NA,11/23/1998,NA,yes,NA,NA,5,NA,NA,6,0,NA,NA,NA,NA,NA,NA,https://www.who.int/csr/don/1998_11_26/en/,DON-1998-11-26
1998-Dengue-GTM,6,1998,11/26/1998,Dengue,Hurricane Mitch,Guatemala,GTM,NA,NA,NA,NA,NA,NA,NA,NA,NA,NA,NA,NA,277,NA,NA,NA,NA,NA,NA,NA,https://www.who.int/csr/don/1998_11_26/en/,DON-1998-11-26
1998-Malaria-GTM,6,1998,11/26/1998,Malaria,Hurricane Mitch,Guatemala,GTM,NA,NA,NA,NA,NA,NA,NA,NA,NA,NA,NA,NA,NA,NA,NA,NA,NA,NA,NA,NA,https://www.who.int/csr/don/1998_11_26/en/,DON-1998-11-26
1998-Cholera-NIC,5,1998,11/26/1998,Cholera,Hurricane Mitch,Nicaragua,NIC,"Managua, Carazo, Masaya, Matagalpa",NA,NA,NA,11/22/1998,NA,yes,NA,NA,301,NA,NA,335,NA,NA,yes,yes,NA,NA,NA,https://www.who.int/csr/don/1998_11_26/en/,DON-1998-11-26
1998-Leptospirosis-NIC,4,1998,11/26/1998,Leptospirosis,Hurricane Mitch,Nicaragua,NIC,"Chinandega, Esteli",NA,NA,NA,11/22/1998,NA,yes,NA,NA,42,NA,222,264,NA,NA,yes,NA,NA,NA,NA,https://www.who.int/csr/don/1998_11_26/en/,DON-1998-11-26
1998-Cholera-HND,5,1998,11/26/1998,Cholera,Hurricane Mitch,Honduras,HND,"Regions 1, 3, 4",NA,NA,NA,11/21/1998,NA,yes,NA,NA,3,NA,11,NA,NA,NA,NA,NA,NA,NA,NA,https://www.who.int/csr/don/1998_11_26/en/,DON-1998-11-26
1998-Leptospirosis-HND,4,1998,11/26/1998,Leptospirosis,Hurricane Mitch,Honduras,HND,"San Pedro Zula, Choloma, La Lima",NA,NA,NA,11/20/1998,NA,yes,NA,NA,NA,2,NA,4,3,NA,yes,NA,NA,NA,NA,https://www.who.int/csr/don/1998_11_26/en/,DON-1998-11-26
1998-Dengue-HND,6,1998,11/26/1998,Dengue,Hurricane Mitch,Honduras,HND,Region 3,NA,NA,NA,11/21/1998,NA,NA,NA,NA,NA,NA,NA,1080,NA,NA,NA,NA,NA,NA,NA,https://www.who.int/csr/don/1998_11_26/en/,DON-1998-11-26
1998-Dengue-HND,6,1998,11/26/1998,Dengue Haemorrhagic fever,Hurricane Mitch,Honduras,HND,NA,NA,NA,NA,11/21/1998,NA,yes,NA,NA,15,NA,18,33,4,NA,NA,NA,NA,NA,NA,https://www.who.int/csr/don/1998_11_26/en/,DON-1998-11-26
1998-Cholera-BLZ,5,1998,11/26/1998,Cholera,Hurricane Mitch,Belize,BLZ,Saint Martin Village,NA,NA,NA,NA,NA,yes,NA,NA,5,NA,11,NA,1,NA,yes,NA,NA,NA,NA,https://www.who.int/csr/don/1998_11_26/en/,DON-1998-11-26
1998-Cholera-SLV,5,1998,12/2/1998,Cholera,Hurricane Mitch,El Salvador,SLV,NA,NA,NA,NA,yes,NA,NA,NA,NA,NA,NA,NA,8,1,NA,NA,NA,NA,NA,NA,https://www.who.int/csr/don/1998_12_02/en/,DON-1998-12-02
1998-Cholera-GTM,5,1998,12/2/1998,Cholera,Hurricane Mitch,Guatemala,GTM,NA,NA,NA,NA,11/27/1998,NA,NA,NA,NA,NA,NA,1362,NA,17,1.25,NA,NA,NA,NA,NA,https://www.who.int/csr/don/1998_12_02/en/,DON-1998-12-02
1998-Leptospirosis-GTM,4,1998,12/2/1998,Leptospirosis,Hurricane Mitch,Guatemala,GTM,NA,NA,NA,NA,yes,NA,yes,NA,NA,5,NA,NA,6,NA,NA,NA,NA,NA,NA,NA,https://www.who.int/csr/don/1998_12_02/en/,DON-1998-12-02
1998-Dengue-HND,6,1998,12/2/1998,Dengue,Hurricane Mitch,Guatemala,GTM,NA,NA,NA,NA,yes,NA,NA,NA,NA,NA,NA,NA,NA,NA,NA,NA,NA,NA,NA,NA,https://www.who.int/csr/don/1998_12_02/en/,DON-1998-12-02
1998-Malaria-GTM,6,1998,12/2/1998,Malaria,Hurricane Mitch,Guatemala,GTM,"Excan, Peten Sur Occidental, Peten Sur Oriental",NA,NA,NA,yes,NA,NA,NA,NA,NA,NA,NA,NA,NA,NA,NA,NA,NA,NA,NA,https://www.who.int/csr/don/1998_12_02/en/,DON-1998-12-02
1998-Cholera-NIC,5,1998,12/2/1998,Cholera,Hurricane Mitch,Nicaragua,NIC,"Carazo, Esteli, Managua, Leon, Granada",11/1/1998,NA,NA,11/27/1998,NA,NA,NA,NA,NA,NA,379,NA,NA,NA,NA,NA,NA,NA,NA,https://www.who.int/csr/don/1998_12_02/en/,DON-1998-12-02
1998-Leptospirosis-NIC,4,1998,12/2/1998,Leptospirosis,Hurricane Mitch,Nicaragua,NIC,"Esteli, Chinandega, Madriz, Carazo, Matagalpa, South Atlantic Region",11/1/1998,NA,NA,11/27/1998,NA,NA,NA,NA,NA,NA,NA,523,7,1.3,NA,NA,NA,NA,NA,https://www.who.int/csr/don/1998_12_02/en/,DON-1998-12-02
1998-Dengue-NIC,6,1998,12/2/1998,Dengue,Hurricane Mitch,Nicaragua,NIC,NA,11/1/1998,NA,NA,11/30/1998,NA,NA,NA,NA,NA,NA,NA,1244,NA,NA,NA,NA,NA,NA,NA,https://www.who.int/csr/don/1998_12_02/en/,DON-1998-12-02
1998-Malaria-NIC,6,1998,12/2/1998,Malaria,Hurricane Mitch,Nicaragua,NIC,NA,11/1/1998,NA,NA,yes,NA,NA,NA,NA,NA,NA,NA,2723,NA,NA,NA,NA,NA,NA,NA,https://www.who.int/csr/don/1998_12_02/en/,DON-1998-12-02
1998-Cholera-HND,5,1998,12/2/1998,Cholera,Hurricane Mitch,Honduras,HND,San Pedro Sula,NA,NA,NA,yes,NA,yes,NA,NA,1,NA,NA,16,NA,NA,NA,NA,NA,NA,NA,https://www.who.int/csr/don/1998_12_02/en/,DON-1998-12-02
1998-Malaria-HND,6,1998,12/2/1998,Malaria,Hurricane Mitch,Honduras,HND,"Regions 3, 4, 8",NA,NA,NA,yes,NA,NA,NA,NA,NA,NA,NA,1908,NA,NA,NA,NA,NA,NA,NA,https://www.who.int/csr/don/1998_12_02/en/,DON-1998-12-02
1998-Leptospirosis-HND,4,1998,12/2/1998,Leptospirosis,Hurricane Mitch,Honduras,HND,San Pedro Sula,NA,NA,NA,yes,NA,NA,NA,NA,6,NA,12,18,1,NA,NA,NA,NA,NA,NA,https://www.who.int/csr/don/1998_12_02/en/,DON-1998-12-02
1998-Dengue-HND,6,1998,12/2/1998,Dengue,Hurricane Mitch,Honduras,HND,NA,NA,NA,NA,11/26/1998,NA,NA,NA,NA,NA,NA,NA,1165,NA,NA,NA,NA,NA,NA,NA,https://www.who.int/csr/don/1998_12_02/en/,DON-1998-12-02
1998-Dengue-HND,6,1998,12/2/1998,Haemorrhagic dengue fever,Hurricane Mitch,Honduras,HND,Central District,NA,NA,NA,yes,NA,yes,NA,NA,49,NA,NA,NA,NA,NA,NA,NA,NA,NA,NA,https://www.who.int/csr/don/1998_12_02/en/,DON-1998-12-02
1998-Cholera-BLZ,5,1998,12/2/1998,Cholera,Hurricane Mitch,Belize,BLZ,Saint Martin,NA,NA,NA,11/30/1998,NA,yes,NA,NA,1,NA,1,2,NA,NA,NA,NA,NA,NA,NA,https://www.who.int/csr/don/1998_12_02/en/,DON-1998-12-02
1998-Food Poisoning-MOZ,5,1998,12/4/1998,Food poisoning,NA,Mozambique,MOZ,Cabo Delgado,NA,NA,yes,NA,NA,no,NA,NA,NA,NA,NA,600,100,NA,yes,NA,NA,NA,NA,https://www.who.int/csr/don/1998_12_04/en/,DON-1998-12-04
1998-Cholera-SOM,5,1998,12/18/1998,Cholera/acute diarrhoea,NA,Somalia,SOM,North Mogadishu,NA,NA,NA,yes,NA,NA,NA,NA,20,NA,NA,NA,NA,NA,yes,yes,NA,NA,NA,https://www.who.int/csr/don/1998_12_18/en/,DON-1998-12-18
1998-Meningitis-COD,1,1998,12/22/1998,Meningitis,NA,Democratic Republic of the Congo,COD,Bobozo,NA,NA,NA,early September 1998,NA,NA,NA,NA,NA,NA,NA,203,79,NA,yes,NA,NA,NA,NA,https://www.who.int/csr/don/1998_12_22b/en/,DON-1998-12-22b
1998-Yellow Fever-BFA,6,1998,12/22/1998,Yellow fever,NA,Burkina Faso,BFA,Batie District,11/18/1998,NA,NA,NA,NA,NA,NA,NA,1,NA,NA,2,1,NA,yes,yes,NA,NA,NA,https://www.who.int/csr/don/1998_12_22a/en/,DON-1998-12-22a
1998-Influenza-CHN,3,1998,12/23/1998,Influenza,NA,China,CHN,north,NA,NA,yes,NA,NA,no,NA,NA,NA,NA,NA,NA,NA,NA,NA,NA,NA,NA,NA,https://www.who.int/csr/don/1998_12_23/en/,DON-1998-12-23
1999-Influenza-CHN,3,1999,1/6/1999,Influenza,NA,China,CHN,NA,NA,NA,NA,NA,NA,yes,NA,NA,NA,NA,NA,NA,NA,NA,NA,NA,NA,NA,NA,https://www.who.int/csr/don/1999_01_06/en/,DON-1999-01-06
1999-Meningitis-SDN,1,1999,1/12/1999,Meningococcal meningitis,NA,Sudan,SDN,Northern Darfur,NA,NA,12/6/1999,NA,NA,yes,NA,NA,NA,NA,NA,169,>20,NA,yes,NA,NA,NA,NA,https://www.who.int/csr/don/1999_01_20/en/,DON-1999-01-20
1999-Cholera-KEN,5,1999,1/20/1999,Cholera,NA,Kenya,KEN,"Nyanza, Eastern Valley, Nairobi",mid-1997,NA,NA,1/19/1999,NA,NA,NA,NA,NA,NA,NA,1025,25,NA,yes,yes,NA,NA,NA,https://www.who.int/csr/don/1999_01_20/en/,DON-1999-01-20
1999-Meningitis-SDN,1,1999,1/22/1999,Meningococcal meningitis,NA,Sudan,SDN,"El Fashir, Kutum, Kabkabiyya",NA,NA,NA,NA,NA,NA,NA,NA,NA,NA,NA,199,30,NA,yes,NA,NA,NA,NA,https://www.who.int/csr/don/1999_01_22/en/,DON-1999-01-22
1999-Cholera-ZMB,5,1999,1/27/1999,Cholera,NA,Zambia,ZMB,Ndola,NA,NA,yes,NA,NA,NA,NA,NA,NA,NA,NA,66,4,NA,yes,yes,NA,NA,NA,https://www.who.int/csr/don/1999_01_27/en/,DON-1999-01-27
1999-Rift Valley Fever-ZAF,6,1999,2/10/1999,Rift Valley fever,NA,South Africa,ZAF,Kruger National Park,NA,NA,NA,yes,NA,yes,NA,NA,NA,NA,NA,3,NA,NA,yes,yes,NA,NA,animals and associated human cases,https://www.who.int/csr/don/1999_02_10/en/,DON-1999-02-10
1999-Yellow Fever-BOL,6,1999,2/11/1999,Yellow fever,NA,Bolivia,BOL,Santa Cruz,NA,NA,01/??/1999,NA,NA,yes,NA,NA,27,NA,NA,NA,13,NA,yes,NA,NA,NA,NA,https://www.who.int/csr/don/1999_02_11/en/,DON-1999-02-11
1999-Cholera-SOM,5,1999,3/12/1999,Cholera,NA,Somalia,SOM,"Mogadishu, Bay, Gedo, Lower Juba, Lower Shabelle",NA,NA,First week December,NA,NA,NA,NA,NA,NA,NA,NA,4457,166,NA,yes,yes,NA,NA,NA,https://www.who.int/csr/don/1999_03_12b/en/,DON-1999-03-12b
1999-Influenza-AFG,3,1999,2/24/1999,Unknown,NA,Afghanistan,AFG,Darwaz,NA,NA,2/13/1999,NA,NA,NA,NA,NA,NA,NA,NA,6300,135,NA,yes,NA,NA,NA,NA,https://www.who.int/csr/don/1999_02_24/en/,DON-1999-02-24
1999-Meningitis-GNB,1,1999,2/26/1999,Meningococcal meningitis,NA,Guinea-Bissau,GNB,"Oio, Bafata, Gabu",Early January,NA,NA,NA,NA,yes,NA,NA,NA,NA,NA,139,36,NA,yes,NA,NA,NA,NA,https://www.who.int/csr/don/1999_02_26b/en/,DON-1999-02-26b
1999-Cholera-Africa,5,1999,2/26/1999,Cholera,NA,Africa,NA,"Kenya, Mozambique, Somalia, Uganda, United Republic of Tanzania, Zambia and Zimbabwe",NA,NA,NA,yes,NA,NA,NA,NA,NA,NA,NA,NA,NA,NA,NA,NA,NA,NA,NA,https://www.who.int/csr/don/1999_02_26a/en/,DON-1999-02-26a
1999-Influenza-AFG,3,1999,3/1/1999,Acute respiratory infection,NA,Afghanistan,AFG,Darwaz,mid-January,NA,2/13/1999,NA,NA,NA,NA,NA,NA,NA,NA,NA,NA,43832,2/26/1999,NA,NA,NA,NA,https://www.who.int/csr/don/1999_03_01/en/,DON-1999-03-01
1999-Meningitis-SDN,1,1999,3/12/1999,Meningococcal disease,NA,Sudan,SDN,15 states,1/12/1998,NA,NA,3/9/1999,NA,NA,NA,NA,NA,NA,NA,2293,262,NA,yes,NA,NA,NA,NA,https://www.who.int/csr/don/1999_03_12a/en/,DON-1999-03-12a
1999-Cholera-COG,4,1999,3/17/1999,Diarrhoeal disease/cholera,NA,Republic of the Congo,COG,Brazzaville,NA,NA,NA,NA,NA,yes,NA,NA,NA,NA,NA,NA,NA,NA,NA,NA,NA,NA,NA,https://www.who.int/csr/don/1999_03_17c/en/,DON-1999-03-17c
1999-Yellow Fever-BRA,6,1999,3/17/1999,Yellow fever,NA,Brazil,BRA,Aldeia Cuoto Magalhaes,NA,NA,NA,End February 1999,NA,yes,NA,NA,1,NA,NA,NA,0,NA,NA,NA,NA,NA,NA,https://www.who.int/csr/don/1999_03_17b/en/,DON-1999-03-17b
1999-Yellow Fever-BOL,6,1999,3/17/1999,Yellow fever,NA,Bolivia,BOL,Santa Cruz,NA,NA,NA,NA,NA,yes,NA,NA,41,NA,NA,NA,NA,34,yes,NA,NA,NA,NA,https://www.who.int/csr/don/1999_03_17a/en/,DON-1999-03-17a
1999-Legionellosis-NLD,5,1999,3/18/1999,Legionellosis,NA,Netherlands,NLD,NA,NA,NA,NA,yes,NA,yes,NA,NA,54,NA,NA,200,13,NA,yes,NA,yes,NA,NA,https://www.who.int/csr/don/1999_03_18b/en/,DON-1999-03-18b
1999-Meningitis-SEN,1,1999,3/18/1999,Meningococcal disease,NA,Senegal,SEN,"Kaolack, Fatick, Kolda",NA,NA,NA,10/23/1998,NA,yes,NA,NA,NA,NA,NA,2709,372,NA,yes,NA,NA,NA,NA,https://www.who.int/csr/don/1999_03_18a/en/,DON-1999-03-18a
1999-Meningitis-ETH,1,1999,3/19/1999,Meningococcal disease,NA,Ethiopia,ETH,North Wolo,end February 1999,NA,NA,NA,NA,yes,NA,NA,NA,NA,NA,126,4,NA,yes,NA,NA,NA,NA,https://www.who.int/csr/don/1999_03_19b/en/,DON-1999-03-19b
1999-Yellow Fever-BRA,6,1999,3/19/1999,Yellow fever,NA,Brazil,BRA,"Mato Gross, Para",1/18/1999,NA,NA,NA,NA,NA,NA,NA,NA,NA,NA,4,NA,NA,NA,NA,NA,NA,new cases,https://www.who.int/csr/don/1999_03_19a/en/,DON-1999-03-19a
1999-Meningitis-GNB,1,1999,3/22/1999,Meningococcal disease,NA,Guinea-Bissau,GNB,"Oio, Gabu, Bafata, most of the country",Early January 1999,NA,3/17/1999,NA,NA,yes,NA,NA,NA,NA,NA,881,135,NA,yes,NA,NA,NA,NA,https://www.who.int/csr/don/1999_03_22b/en/,DON-1999-03-22b
1999-Japanese Encephalitis-MYS,6,1999,3/22/1999,Japanese Encephalitis,NA,Malaysia,MYS,"Perak, Negeri Sembilan",NA,NA,3/19/1999,NA,NA,yes,NA,NA,42,NA,NA,133,NA,NA,NA,NA,NA,NA,NA,https://www.who.int/csr/don/1999_03_22a/en/,DON-1999-03-22a
1999-Nipah Virus-MYS,2,1999,3/22/1999,Hendra-like Virus,NA,Malaysia,MYS,NA,NA,NA,NA,NA,yes,yes,NA,NA,5,NA,NA,NA,NA,NA,NA,NA,NA,NA,NA,https://www.who.int/csr/don/1999_03_22a/en/,DON-1999-03-22a
1999-Encephalitis-MYS,7,1999,3/26/1999,Encephalitis,NA,Malaysia,MYS,"Kinta, Sikamat, Bukit Pelandok",10/??/1998,NA,NA,NA,yes,yes,NA,NA,NA,NA,NA,157,58,NA,yes,yes,NA,NA,NA,https://www.who.int/csr/don/1999_03_26/en/,DON-1999-03-26
1999-Diarrheal Disease-SDN,5,1999,3/19/1999,Acute watery diarrhoea,NA,Sudan,SDN,NA,NA,NA,3/19/1999,NA,NA,NA,NA,NA,NA,NA,NA,NA,78,NA,yes,NA,NA,NA,NA,https://www.who.int/csr/don/1999_03_26a/en/,DON-1999-03-26a
1998-H5 Influenza-HKG,3,1999,3/29/1999,H5N1,NA,Hong Kong,HKG,NA,NA,NA,3/26/1999,NA,NA,yes,NA,NA,0,NA,NA,0,0,NA,yes,NA,NA,NA,isolated from goose,https://www.who.int/csr/don/1999_03_29/en/,DON-1999-03-29
1998-H5 Influenza-HKG,3,1999,4/6/1999,H5N1,NA,Hong Kong,HKG,NA,NA,03/??/1999,NA,NA,NA,yes,NA,NA,0,NA,NA,0,0,NA,NA,NA,NA,NA,isolated from goose,https://www.who.int/csr/don/1999_04_06/en/,DON-1999-04-06
1999-H9 Influenza-HKG,3,1999,4/7/1999,H9N2,NA,Hong Kong,HKG,"Kowloon, Hong Kong Island",NA,NA,NA,NA,NA,yes,NA,NA,2,NA,NA,NA,0,NA,NA,NA,NA,NA,NA,https://www.who.int/csr/don/1999_04_07c/en/,DON-1999-04-07c
1999-Relapsing Fever-SDN,6,1999,4/7/1999,Acute haemorrhagic fever syndrome,NA,Sudan,SDN,Rumbek county,NA,NA,Last week of March,NA,NA,NA,NA,NA,NA,NA,NA,NA,NA,NA,yes,NA,NA,NA,NA,https://www.who.int/csr/don/1999_04_07b/en/,DON-1999-04-07b
1999-Cholera-BRA,5,1999,4/8/1999,Cholera,NA,Brazil,BRA,"Guarani, Araça",NA,NA,NA,3/31/1999,NA,yes,NA,NA,205,NA,NA,235,3,NA,yes,yes,NA,NA,NA,https://www.who.int/csr/don/1999_04_08/en/,DON-1999-04-08
1999-H9 Influenza-HKG,3,1999,4/13/1999,H9N2,NA,Hong Kong,HKG,NA,NA,03/??/1999,NA,NA,yes,yes,NA,NA,NA,NA,NA,5,NA,NA,NA,NA,NA,NA,NA,https://www.who.int/csr/don/1999_04_13/en/,DON-1999-04-13
1999-Meningitis-GNB,1,1999,4/14/1999,Meningococcal disease,NA,Guinea-Bissau,GNB,"Oio, Bafata, Gabu, most of the country",Early January 1999,NA,yes,NA,NA,yes,NA,NA,NA,NA,NA,1307,158,NA,yes,NA,NA,NA,NA,https://www.who.int/csr/don/1999_04_14b/en/,DON-1999-04-14b
1999-Cholera-MDG,5,1999,4/14/1999,Cholera,NA,Madagascar,MDG,Antsohihy and Mahajanga districts,NA,NA,3/24/1999,NA,NA,yes,NA,NA,NA,NA,NA,278,NA,NA,yes,NA,NA,NA,NA,https://www.who.int/csr/don/1999_04_14a/en/,DON-1999-04-14a
1999-Nipah Virus-MYS,2,1999,4/15/1999,Hendra-like Virus (Nipah virus),NA,Malaysia,MYS,NA,NA,NA,yes,NA,NA,NA,NA,NA,NA,NA,NA,NA,NA,NA,yes,NA,NA,NA,NA,https://www.who.int/csr/don/1999_04_15/en/,DON-1999-04-15
1999-Relapsing Fever-SDN,6,1999,4/20/1999,Acute haemorrhagic fever syndrome,NA,Sudan,SDN,NA,NA,NA,NA,NA,NA,yes,NA,NA,NA,NA,NA,NA,NA,NA,yes,NA,NA,NA,NA,https://www.who.int/csr/don/1999_04_20/en/,DON-1999-04-20
1999-WPV-AGO,5,1999,4/28/1999,Polio,NA,Angola,AGO,"Luanda, neighboring areas of Bengo province",NA,NA,3/23/1999,NA,NA,4/8/1999,NA,NA,11,NA,NA,661,41,NA,4/17/1999,NA,NA,NA,NA,https://www.who.int/csr/don/1999_04_28b/en/,DON-1999-04-28b
1999-Meningitis-SDN,1,1999,4/28/1999,Meningococcal disease,NA,Sudan,SDN,18/26 states,early December 1998,NA,yes,NA,NA,NA,NA,NA,NA,NA,NA,>16000,1000,NA,yes,yes,NA,NA,NA,https://www.who.int/csr/don/1999_04_28a/en/,DON-1999-04-28a
1999-Relapsing Fever-SDN,6,1999,4/29/1999,Relapsing fever,NA,Sudan,SDN,Rumbek county,NA,NA,NA,NA,NA,yes,NA,NA,6,NA,NA,NA,NA,NA,yes,yes,NA,NA,NA,https://www.who.int/csr/don/1999_04_29/en/,DON-1999-04-29
1999-Diarrheal Disease-SDN,5,1999,4/30/1999,Acute diarrhoea,NA,Sudan,SDN,"Padak, Mading, Wanding, Lankien, Akobo, Burmat",early March 1999,NA,4/27/1999,NA,NA,NA,NA,NA,NA,NA,NA,892,24,NA,yes,NA,NA,NA,NA,https://www.who.int/csr/don/1999_04_30b/en/,DON-1999-04-30b
1999-Marburg haemorrhagic fever-COD,2,1999,4/30/1999,Acute haemorrhagic fever syndrome,NA,Democratic Republic of the Congo,COD,Durba,01/??/1999,NA,01/??/1999,NA,NA,NA,NA,NA,NA,NA,NA,50,46,92,yes,NA,NA,NA,NA,https://www.who.int/csr/don/1999_04_30/en/,DON-1999-04-30
1999-Cholera-SOM,5,1999,4/30/1999,Cholera,NA,Somalia,SOM,"Mogadishu, Kismayo, Baidoa, Bay, Lower Shabelle, Upper and Lower Juba",12/??/1998,NA,12/??/1998,NA,NA,NA,NA,NA,NA,NA,NA,7860,233,NA,yes,NA,NA,NA,NA,https://www.who.int/csr/don/1999_04_30a/en/,DON-1999-04-30a
1999-Marburg haemorrhagic fever-COD,2,1999,5/5/1999,Viral haemorrhagic fever,NA,Democratic Republic of the Congo,COD,Watsa,1/1/1999,NA,yes,NA,NA,NA,NA,NA,NA,NA,NA,68,63,93,yes,NA,NA,NA,NA,https://www.who.int/csr/don/1999_05_05/en/,DON-1999-05-05
1999-Marburg haemorrhagic fever-COD,2,1999,5/6/1999,Marburg,NA,Democratic Republic of the Congo,COD,Watsa,NA,NA,NA,NA,NA,NA,NA,NA,1,NA,NA,76,52,NA,yes,NA,NA,NA,NA,https://www.who.int/csr/don/1999_05_06/en/,DON-1999-05-06
1999-Hendra-like Virus-SGP,2,1999,5/7/1999,Hendra-like virus,NA,Singapore,SGP,NA,NA,NA,NA,NA,NA,yes,yes,NA,11,NA,NA,NA,1,NA,NA,NA,NA,NA,NA,https://www.who.int/csr/don/1999_04_07a/en/,DON-1999-04-07a
1999-Marburg haemorrhagic fever-COD,2,1999,5/10/1999,Viral haemorrhagic fever,NA,Democratic Republic of the Congo,COD,NA,NA,NA,NA,NA,NA,NA,NA,NA,NA,NA,NA,NA,NA,NA,yes,NA,NA,NA,NA,https://www.who.int/csr/don/1999_05_10/en/,DON-1999-05-10
1999-Plague-NAM,2,1999,5/11/1999,Plague,NA,Namibia,NAM,Ohangwena,NA,NA,NA,4/6/1999,NA,NA,NA,NA,6,NA,NA,39,8,NA,yes,NA,NA,NA,NA,https://www.who.int/csr/don/1999_05_11/en/,DON-1999-05-11
1999-Cholera-NGA,5,1999,5/12/1999,Cholera,NA,Nigeria,NGA,"Kano Municipal LGA, Tofa LGA, Adamawa State, Edo State",late March 1999,NA,5/6/1999,NA,NA,NA,NA,NA,NA,NA,NA,1122,89,NA,yes,yes,NA,NA,NA,https://www.who.int/csr/don/1999_05_12/en/,DON-1999-05-12
1999-Marburg haemorrhagic fever-COD,2,1999,5/12/1999,Viral haemorrhagic fever,NA,Democratic Republic of the Congo,COD,Durba,NA,NA,5/10/1999,NA,NA,yes,NA,NA,1,NA,90,NA,NA,NA,yes,NA,NA,NA,NA,https://www.who.int/csr/don/1999_05_12b/en/,DON-1999-05-12b
1999-Meningitis-SDN,1,1999,5/12/1999,Meningococcal disease,NA,Sudan,SDN,19 states,NA,NA,NA,NA,NA,NA,NA,NA,NA,NA,NA,22000,1600,NA,yes,yes,NA,NA,NA,https://www.who.int/csr/don/1999_05_12a/en/,DON-1999-05-12a
1999-Viral Haemorrhagic Fever-ZWE,2,1999,5/14/1999,Viral haemorrhagic fever,NA,Zimbabwe,ZWE,NA,NA,NA,NA,NA,NA,no,NA,NA,NA,NA,3,NA,NA,NA,yes,NA,NA,NA,travel from DRC,https://www.who.int/csr/don/1999_05_14/en/,DON-1999-05-14
1999-Marburg haemorrhagic fever-COD,2,1999,5/17/1999,Viral haemorrhagic fever,NA,Democratic Republic of the Congo,COD,Durba,NA,NA,NA,NA,NA,yes,NA,NA,2,NA,NA,NA,NA,NA,yes,yes,NA,NA,marburg,https://www.who.int/csr/don/1999_05_17/en/,DON-1999-05-17
1999-Marburg haemorrhagic fever-COD,2,1999,5/18/1999,Viral haemorrhagic fever/Marburg,NA,Democratic Republic of the Congo,COD,Durba,NA,NA,NA,NA,NA,5/17/1999,NA,NA,3,NA,93,NA,3,NA,5/17/1999,yes,NA,NA,NA,https://www.who.int/csr/don/1999_05_17/en/,DON-1999-05-17
1999-Yellow Fever-BOL,6,1999,5/18/1999,Sylvatic yellow fever,NA,Bolivia,BOL,Santa Cruz,NA,NA,NA,NA,NA,yes,NA,NA,53,NA,NA,NA,21,39.6,yes,NA,NA,NA,NA,https://www.who.int/csr/don/1999_05_18a/en/,DON-1999-05-18a
1999-Yellow Fever-BRA,6,1999,5/18/1999,Sylvatic yellow fever,NA,Brazil,BRA,Afuá and Breves,NA,NA,NA,NA,NA,yes,NA,NA,18,NA,NA,NA,3,16.7,yes,NA,NA,NA,NA,https://www.who.int/csr/don/1999_05_18a/en/,DON-1999-05-18a
1999-Yellow Fever-COL,6,1999,5/18/1999,Sylvatic yellow fever,NA,Colombia,COL,"Caqueta, Meta",NA,NA,NA,NA,NA,yes,NA,NA,2,NA,NA,NA,2,NA,NA,NA,NA,NA,NA,https://www.who.int/csr/don/1999_05_18a/en/,DON-1999-05-18a
1999-Yellow Fever-PER,6,1999,5/18/1999,Sylvatic yellow fever,NA,Peru,PER,"Loreto, Moyobamba, Jepelacio, Alonso de Alvarado, Ayacucho, Anco y Santa Rosa, Huanuco, Junin",NA,NA,NA,NA,NA,yes,NA,NA,13,NA,NA,49,NA,NA,yes,NA,NA,NA,NA,https://www.who.int/csr/don/1999_05_18a/en/,DON-1999-05-18a
1999-Marburg haemorrhagic fever-COD,2,1999,5/20/1999,Viral haemorrhagic fever/Marburg,NA,Democratic Republic of the Congo,COD,NA,NA,NA,yes,NA,NA,yes,NA,NA,3,NA,NA,72,NA,NA,yes,NA,NA,NA,NA,https://www.who.int/csr/don/1999_05_20/en/,DON-1999-05-20
1999-Cholera-KHM,5,1999,5/21/1999,Cholera,NA,Cambodia,KHM,Rottanakiri province,4/16/1999,NA,5/16/1999,NA,NA,NA,NA,NA,NA,NA,NA,874,56,NA,yes,yes,NA,NA,NA,https://www.who.int/csr/don/1999_05_21/en/,DON-1999-05-21
1999-Marburg haemorrhagic fever-COD,2,1999,5/28/1999,Viral haemorrhagic fever/Marburg,NA,Democratic Republic of the Congo,COD,NA,NA,NA,NA,NA,NA,yes,NA,NA,5,NA,NA,NA,NA,NA,yes,NA,NA,NA,NA,https://www.who.int/csr/don/1999_05_28/en/,DON-1999-05-28
1999-Cholera-ZMB,5,1999,6/16/1999,Cholera,NA,Zambia,ZMB,"Lusaka, Chilubi, Samfya",Early 1999,NA,6/4/1999,NA,NA,NA,NA,NA,NA,NA,NA,11327,393,NA,yes,NA,NA,NA,NA,https://www.who.int/csr/don/1999_06_16/en/,DON-1999-06-16
1999-Cholera-BDI,5,1999,6/23/1999,Cholera,NA,Burundi,BDI,Rumonge health district,5/24/1999,NA,NA,NA,NA,NA,NA,NA,NA,NA,NA,587,NA,NA,yes,NA,NA,NA,NA,https://www.who.int/csr/don/1999_06_23/en/,DON-1999-06-23
1999-Cholera-MDG,5,1999,6/23/1999,Cholera,NA,Madagascar,MDG,"Mahajanga, Antananarivo",03/??/1999,NA,NA,NA,NA,NA,NA,NA,NA,NA,NA,4007,218,NA,NA,NA,NA,NA,NA,https://www.who.int/csr/don/1999_06_23/en/,DON-1999-06-23
1999-Cholera-HND,5,1999,6/23/1999,Cholera,NA,Honduras,HND,"La Mosquita, border with Nicaragua and Guatemala",NA,NA,yes,NA,NA,no,NA,NA,NA,NA,NA,32,NA,NA,yes,NA,NA,NA,NA,https://www.who.int/csr/don/1999_06_23/en/,DON-1999-06-23
1999-Cholera-NIC,5,1999,6/23/1999,Cholera,NA,Nicaragua,NIC,"Region Autonoma Atlantico Norte (R.A.A.N.), Managua, Nueva Segovia and Jinotega",NA,NA,5/5/1999,NA,NA,NA,NA,NA,NA,NA,NA,359,7,NA,NA,NA,NA,NA,NA,https://www.who.int/csr/don/1999_06_23/en/,DON-1999-06-23
1999-Cholera-AFG,5,1999,6/23/1999,Cholera,NA,Afghanistan,AFG,"Central Region, Ghazni",5/29/1999,NA,NA,NA,NA,yes,NA,NA,3,NA,NA,NA,NA,NA,yes,NA,NA,NA,NA,https://www.who.int/csr/don/1999_06_23/en/,DON-1999-06-23
1999-Cholera-BRN,5,1999,6/23/1999,Cholera,NA,Brunei Darussalam,BRN,Muara District,6/3/1999,NA,6/18/1999,NA,NA,yes,NA,NA,72,NA,29,NA,NA,NA,yes,NA,NA,NA,NA,https://www.who.int/csr/don/1999_06_23/en/,DON-1999-06-23
1999-Malaria-BDI,6,1999,6/25/1999,Malaria,NA,Burundi,BDI,all provinces,NA,NA,01/??/1999,NA,NA,NA,NA,NA,NA,NA,NA,616034,NA,NA,yes,NA,NA,NA,NA,https://www.who.int/csr/don/1999_06_25/en/,DON-1999-06-25
1999-Shigella-GIN,5,1999,7/14/1999,Shigella,NA,Guinea,GIN,Dabola,NA,NA,yes,NA,NA,yes,NA,NA,1,NA,NA,7,NA,NA,yes,NA,NA,NA,NA,https://www.who.int/csr/don/1999_07_14/en/,DON-1999-07-14
1999-Malaria-KEN,6,1999,7/14/1999,Malaria,NA,Kenya,KEN,"Buret, Gucha, Kisii, Mount Elgon, Narok, Nyamira, Trans Mara, Trans Nzoia and West Pokot",NA,NA,NA,NA,NA,NA,NA,NA,NA,NA,NA,NA,NA,NA,yes,yes,NA,NA,NA,https://www.who.int/csr/don/1999_07_14a/en/,DON-1999-07-14a
1999-Cholera-AFG,5,1999,7/20/1999,Cholera,NA,Afghanistan,AFG,"Kabul, Kunduz",NA,NA,5/29/1999,NA,NA,NA,NA,NA,5,NA,NA,14402,NA,NA,yes,yes,NA,NA,NA,https://www.who.int/csr/don/1999_07_20/en/,DON-1999-07-20
1999-CCHF-RUS,6,1999,7/26/1999,Crimean-Congo haemorrhagic fever,NA,Russian Federation,RUS,NA,NA,NA,NA,7/26/1999,NA,yes,NA,NA,NA,NA,NA,65,6,NA,NA,NA,NA,NA,NA,https://www.who.int/csr/don/1999_07_26/en/,DON-1999-07-26
1999-Plague-MWI,2,1999,7/27/1999,Plague,NA,Malawi,MWI,Nsanje,6/18/1999,NA,NA,NA,NA,NA,NA,NA,NA,NA,74,NA,NA,NA,yes,yes,NA,NA,NA,https://www.who.int/csr/don/1999_07_27/en/,DON-1999-07-27
1999-Cholera-NER,5,1999,8/3/1999,Cholera,NA,Niger,NER,Boboyé District,NA,NA,06/??/1999,NA,NA,NA,NA,NA,NA,NA,NA,169,10,NA,yes,yes,NA,NA,NA,https://www.who.int/csr/don/1999_08_03/en/,DON-1999-08-03
1999-Yellow Fever-DEU,6,1999,8/4/1999,Haemorrhagic fever,NA,Germany,DEU,Berlin,NA,NA,NA,yes,NA,NA,NA,NA,NA,NA,1,NA,NA,NA,NA,NA,NA,NA,exported from Cote d'Ivoire,https://www.who.int/csr/don/1999_08_04/en/,DON-1999-08-04
1999-Yellow Fever-DEU,6,1999,8/6/1999,Yellow fever,NA,Germany,DEU,NA,NA,NA,NA,8/5/1999,NA,8/6/1999,NA,NA,NA,NA,NA,NA,NA,NA,yes,NA,NA,NA,NA,https://www.who.int/csr/don/1999_08_06/en/,DON-1999-08-06
1999-Cholera-MDG,5,1999,8/9/1999,Cholera,NA,Madagascar,MDG,"Antananarivo, Mahajanga, Antsiranana",Late March 1999,NA,NA,yes,NA,NA,NA,NA,NA,NA,NA,NA,NA,NA,yes,yes,NA,NA,NA,https://www.who.int/csr/don/1999_08_09/en/,DON-1999-08-09
1999-WPV-AFG,5,1999,8/25/1999,Polio,NA,Afghanistan,AFG,Kunduz,NA,NA,early May 1999,NA,NA,yes,NA,NA,6,NA,NA,26,NA,NA,yes,NA,NA,NA,NA,https://www.who.int/csr/don/1999_08_25/en/,DON-1999-08-25
1999-HPS-XKO,4,1999,8/30/1999,Hantavirus,NA,Kosovo,XKO,near Albanian border,NA,NA,NA,NA,NA,yes,NA,NA,1,NA,NA,NA,NA,NA,NA,NA,NA,NA,NA,https://www.who.int/csr/don/1999_08_30/en/,DON-1999-08-30
1999-Cholera-GHA,5,1999,9/2/1999,Cholera,NA,Ghana,GHA,Builsa district,NA,NA,8/23/1999,NA,NA,yes,NA,NA,NA,NA,NA,269,9,NA,yes,yes,NA,NA,NA,https://www.who.int/csr/don/1999_09_02/en/,DON-1999-09-02
1999-Cholera-AFG,5,1999,9/7/1999,Cholera,NA,Afghanistan,AFG,Kabul,NA,NA,NA,NA,NA,NA,NA,NA,NA,NA,NA,NA,NA,NA,8/16/1999,9/2/1999,NA,NA,NA,https://www.who.int/csr/don/1999_09_07/en/,DON-1999-09-07
1999-Cholera-SOM,5,1999,9/9/1999,Cholera,NA,Somalia,SOM,Bosaso,NA,NA,NA,8/31/1999,NA,yes,NA,NA,NA,NA,NA,6964,NA,NA,yes,yes,NA,NA,NA,https://www.who.int/csr/don/1999_09_08/en/,DON-1999-09-08
1999-St. Louis Encephalitis-USA,6,1999,9/10/1999,St. Louis Encephalitis (SLE),NA,United States,USA,New York City,NA,NA,yes,NA,NA,yes,NA,NA,9,NA,NA,47,3,NA,yes,NA,NA,NA,NA,https://www.who.int/csr/don/1999_09_10/en/,DON-1999-09-10
1999-Cholera-SLE,5,1999,9/14/1999,Cholera,NA,Sierra Leone,SLE,NA,NA,NA,9/1/1999,NA,NA,yes,NA,NA,6,NA,NA,134,1,NA,yes,yes,NA,NA,NA,https://www.who.int/csr/don/1999_09_14/en/,DON-1999-09-14
1999-St. Louis Encephalitis-USA,6,1999,9/14/1999,St. Louis Encephalitis (SLE),NA,United States of America,USA,"New York City (Queens, Brooklyn, South Bronx)",NA,NA,early September 1999,NA,NA,yes,NA,NA,11,8,NA,NA,3,NA,yes,NA,NA,NA,NA,https://www.who.int/csr/don/1999_09_14a/en/,DON-1999-09-14a
1999-WPV-IRQ,5,1999,9/24/1999,Polio,NA,Iraq,IRQ,9/15 central/southern governorates,5/10/1999,NA,NA,NA,NA,yes,NA,NA,16,NA,NA,NA,NA,NA,Early October 1999,NA,NA,NA,NA,https://www.who.int/csr/don/1999_09_24/en/,DON-1999-09-24
1999-West Nile Virus-USA,6,1999,10/6/1999,West Nile fever,NA,United States of America,USA,"New York City, Nassau, Westchester",NA,NA,NA,NA,NA,yes,NA,NA,50,NA,NA,NA,5,NA,yes,NA,NA,NA,SLE retested to be WNF,https://www.who.int/csr/don/1999_10_06/en/,DON-1999-10-06
1999-Meningitis-RWA,1,1999,10/20/1999,Meningitis,NA,Rwanda,RWA,"Kayenzi, Nyabikenke and Rutobwe (Gitarama and Kigali Rural prefectures)",NA,NA,9/1/1999,NA,NA,yes,NA,NA,2,NA,NA,29,11,NA,yes,NA,NA,NA,NA,https://www.who.int/csr/don/1999_10_20/en/,DON-1999-10-20
1999-Meningococcal Disease-AGO,1,1999,10/21/1999,Meningococcal disease,NA,Angola,AGO,Yambala,NA,NA,08/??/1999,NA,NA,no,NA,NA,NA,NA,NA,253,147,NA,yes,NA,NA,NA,NA,https://www.who.int/csr/don/1999_10_21/en/,DON-1999-10-21
1999-Cholera-ZMB,5,1999,10/27/1999,Cholera,NA,Zambia,ZMB,Chibombo District,NA,End September 1999,NA,NA,NA,10/7/1999,NA,NA,NA,NA,NA,13,6,NA,10/13/1999,yes,NA,NA,NA,https://www.who.int/csr/don/1999_10_27/en/,DON-1999-10-27
1999-Legionellosis-BEL,5,1999,11/18/1999,Legionnaires' disease,NA,Belgium,BEL,Kapellen,NA,NA,yes,NA,NA,yes,NA,NA,13,NA,NA,80,4,NA,yes,NA,yes,NA,NA,https://www.who.int/csr/don/1999_11_18b/en/,DON-1999-11-18b
1999-Cholera-RWA,5,1999,11/18/1999,Cholera,NA,Rwanda,RWA,"Cyabingo, Kigombe and Nyakinama",NA,10/24/1999,10/25/1999,NA,NA,yes,NA,NA,2,NA,NA,140,5,NA,10/26/1999,yes,NA,NA,NA,https://www.who.int/csr/don/1999_11_18/en/,DON-1999-11-18
1999-Cholera-FJI,5,1999,11/19/1999,Cholera,NA,Fiji,FJI,NA,NA,NA,NA,NA,NA,yes,NA,NA,1,NA,NA,2,NA,NA,yes,NA,NA,NA,NA,https://www.who.int/csr/don/1999_11_19/en/,DON-1999-11-19
1999-Yellow Fever-USA,6,1999,11/23/1999,Yellow fever,NA,United States of America,USA,Bolivar (Venezuala),9/23/1999,9/27/1999,NA,NA,NA,yes,NA,NA,1,NA,NA,1,1,NA,yes,NA,NA,NA,NA,https://www.who.int/csr/don/1999_11_23/en/,DON-1999-11-23
1999-Cholera-COD,5,1999,12/9/1999,Cholera,NA,Democratic Republic of the Congo,COD,Kinshasa,NA,NA,beginning November 1999,NA,NA,NA,NA,NA,NA,NA,NA,74,4,NA,yes,NA,NA,NA,NA,https://www.who.int/csr/don/1999_12_09/en/,DON-1999-12-09
1999-Japanese Ecephalitis-IND,6,1999,12/10/1999,Japanese encephalitis,NA,India,IND,Andhra Pradesh state,early September 1999,NA,NA,NA,NA,yes,NA,NA,16,NA,NA,965,200,20.7,yes,NA,NA,NA,title wrong,https://www.who.int/csr/don/1999_12_10/en/,DON-1999-12-10
1999-Creutzfeldt-Jakob Disease-FRA,5,1999,12/17/1999,nvCJD,NA,France,FRA,NA,NA,NA,NA,NA,NA,12/17/1999,NA,NA,2,NA,NA,NA,NA,NA,NA,NA,NA,NA,NA,https://www.who.int/csr/don/1999_12_17/en/,DON-1999-12-17
1999-Cholera-COM,5,1999,12/22/1999,Cholera,NA,Comoros,COM,Anjouan Island. Domoni,NA,NA,11/11/1999,NA,NA,NA,NA,NA,NA,NA,NA,103,14,NA,yes,yes,NA,NA,NA,https://www.who.int/csr/don/1999_12_22/en/,DON-1999-12-22
2000-Meningococcal Disease-HUN,1,2000,1/1/2000,Meningococcal disease,NA,Hungary,HUN,"Kecskemet city, Szabadszallas town",early December 1999,NA,NA,1/5/2000,NA,yes,NA,NA,NA,NA,NA,30,4,13.3,yes,NA,NA,NA,report date doesn't make sense,https://www.who.int/csr/don/2000_01_01/en/,DON-2000-01-01
2000-Lassa Fever-DEU,2,2000,1/13/2000,Lassa fever,NA,Germany,DEU,Bavaria,NA,1/7/2000,NA,yes,NA,yes,NA,NA,1,NA,NA,1,0,NA,yes,NA,NA,NA,imported,https://www.who.int/csr/don/2000_01_13/en/,DON-2000-01-13
2000-Yellow Fever-Brazil,6,2000,1/14/2000,Yellow fever,NA,Brazil,BRA,National Park of Chapada dos Veadeiros,12/??/2000,NA,NA,1/13/2000,NA,yes,NA,NA,3,NA,NA,3,1,NA,yes,NA,NA,NA,NA,https://www.who.int/csr/don/2000_01_18/en/,DON-2000-01-18
2000-WPV-CHN,5,2000,1/18/2000,Polio,NA,China,CHN,Geizi,10/12/1999,NA,NA,10/13/1999,NA,yes,NA,NA,2,NA,NA,NA,NA,NA,yes,NA,yes,NA,NA,https://www.who.int/csr/don/2000_01_18/en/,DON-2000-01-18
2000-Lassa Fever-DEU,2,2000,1/18/2000,Lassa fever,NA,Germany,DEU,NA,11/??/1999,NA,NA,NA,NA,NA,NA,NA,NA,NA,NA,1,1,NA,NA,NA,NA,NA,NA,https://www.who.int/csr/don/2000_01_18a/en/,DON-2000-01-18a
2000-Yellow Fever-Brazil,6,2000,1/20/2000,Yellow fever,NA,Brazil,BRA,NA,NA,NA,yes,NA,NA,NA,NA,NA,NA,NA,NA,3,NA,NA,NA,NA,NA,NA,NA,https://www.who.int/csr/don/2000_01_20/en/,DON-2000-01-20
2000-Yellow Fever-Brazil,6,2000,1/24/2000,Yellow fever,NA,Brazil,BRA,"Alto Paraíso, Doverlândia, Goiás Velho",NA,NA,beginning 2000,NA,NA,NA,NA,NA,5,NA,NA,NA,2,NA,yes,NA,NA,NA,NA,https://www.who.int/csr/don/2000_01_24/en/,DON-2000-01-24
2000-Cholera-MDG,5,2000,1/28/2000,Cholera,NA,Madagascar,MDG,"Mahajanga, Antananarivo, Antsiranana, Toliary",late March 1999,NA,NA,NA,NA,yes,NA,NA,NA,NA,NA,6983,433,NA,yes,NA,NA,NA,NA,https://www.who.int/csr/don/2000_01_28/en/,DON-2000-01-28
2000-Dysentary-LSO,5,2000,1/28/2000,Dysentery,NA,Lesotho,LSO,Mohale's Hoek district,NA,NA,NA,1/12/2000,NA,NA,NA,NA,NA,NA,NA,1862,28,NA,yes,yes,NA,NA,NA,https://www.who.int/csr/don/2000_01_28a/en/,DON-2000-01-28a
2000-Dysentary-SLE,5,2000,2/4/2000,Dysentery,NA,Sierra Leone,SLE,NA,NA,NA,NA,NA,NA,NA,NA,NA,NA,NA,NA,NA,NA,NA,yes,yes,NA,NA,NA,https://www.who.int/csr/don/2000_02_04/en/,DON-2000-02-04
2000-Marburg haemorrhagic fever-COD,2,2000,2/11/2000,Viral haemorrhagic fever/Marburg,NA,Democratic Republic of the Congo,COD,Durba,1/8/2000,NA,yes,NA,NA,yes,NA,NA,1,NA,NA,NA,NA,NA,NA,NA,NA,NA,NA,https://www.who.int/csr/don/2000_02_11/en/,DON-2000-02-11
2000-Meningitis-CAF,1,2000,2/16/2000,Meningococcal meningitis,NA,Central African Republic,CAF,"Vakaga, Bamingui-Bangoran, Haute Katto, Ouham Pend",NA,NA,NA,2/1/2000,NA,NA,NA,NA,NA,NA,NA,86,14,NA,yes,NA,NA,NA,NA,https://www.who.int/csr/don/2000_02_16/en/,DON-2000-02-16
2000-Yellow Fever-NLD,6,2000,2/25/2000,Yellow fever,NA,Netherlands,NLD,The hague,1/12/2000,NA,NA,yes,NA,2/16/2000,NA,NA,1,NA,NA,1,0,NA,NA,NA,NA,NA,imported,https://www.who.int/csr/don/2000_02_25/en/,DON-2000-02-25
2000-Listeria-FRA,5,2000,2/29/2000,Listeria,NA,France,FRA,NA,second half December 1999,NA,yes,NA,NA,yes,NA,NA,NA,NA,NA,26,7,NA,NA,yes,NA,NA,NA,https://www.who.int/csr/don/2000_02_29/en/,DON-2000-02-29
2000-HPS-PAN,4,2000,3/3/2000,Hantavirus Pulmonary Syndrome,NA,Panama,PAN,"Las Tablas, Guarare",NA,NA,yes,NA,NA,yes,NA,NA,3,NA,NA,12,3,NA,yes,yes,NA,NA,NA,https://www.who.int/csr/don/2000_03_02a/en/,DON-2000-03-02a
2000-Marburg haemorrhagic fever-COD,2,2000,3/2/2000,Viral haemorrhagic fever/Marburg,NA,Democratic Republic of the Congo,COD,Watsa Health Zone,late December 1999,NA,NA,NA,NA,yes,NA,NA,7,NA,NA,NA,3,NA,NA,NA,NA,NA,NA,https://www.who.int/csr/don/2000_03_02/en/,DON-2000-03-02
2000-Cholera-MDG,5,2000,3/8/2000,Cholera,NA,Madagascar,MDG,NA,NA,NA,12/1/1999,NA,NA,NA,NA,NA,NA,NA,NA,12481,736,NA,yes,NA,NA,NA,NA,https://www.who.int/csr/don/2000_03_08/en/,DON-2000-03-08
2000-Lassa Fever-GBR,2,2000,3/13/2000,Lassa fever,NA,United Kingdom,GBR,NA,2/21/2000,NA,NA,NA,NA,NA,NA,NA,NA,NA,1,NA,NA,NA,yes,NA,NA,NA,imported,https://www.who.int/csr/don/2000_03_13/en/,DON-2000-03-13
2000-Lassa Fever-GBR,2,2000,3/14/2000,Lassa fever,NA,United Kingdom,GBR,NA,NA,NA,NA,NA,NA,yes,NA,NA,1,NA,NA,1,0,NA,NA,NA,NA,NA,imported,https://www.who.int/csr/don/2000_03_14/en/,DON-2000-03-14
2000-Cholera-MDG,5,2000,3/16/2000,Cholera,NA,Madagascar,MDG,"Toliary, Antananarivo, Antsiranana, Mahajanga, Toamasina, Fianarantsoa",NA,NA,12/1/1999,NA,NA,NA,NA,NA,NA,NA,NA,15137,860,5.7,yes,NA,NA,NA,NA,https://www.who.int/csr/don/2000_03_16/en/,DON-2000-03-16
2000-Meningococcal Disease-ETH,1,2000,3/17/2000,Meningococcal disease,NA,Ethiopia,ETH,"Kobo, Alamata",NA,NA,1/30/2000,NA,NA,yes,NA,NA,NA,NA,NA,129,9,NA,2/14/2000,NA,NA,NA,NA,https://www.who.int/csr/don/2000_03_17/en/,DON-2000-03-17
2000-Marburg haemorrhagic fever-COD,2,2000,3/13/2000,Viral haemorrhagic fever/Marburg,NA,Democratic Republic of the Congo,COD,Durba,11/9/1999,NA,11/??/1999,3/13/2000,NA,yes,NA,NA,11,NA,7,30,12,NA,yes,NA,NA,NA,NA,https://www.who.int/csr/don/2000_03_21/en/,DON-2000-03-21
2000-Marburg haemorrhagic fever-COD,2,2000,3/31/2000,Viral haemorrhagic fever/Marburg,NA,Democratic Republic of the Congo,COD,NA,NA,NA,3/21/2000,NA,NA,yes,NA,NA,12,NA,4,16,NA,NA,yes,NA,NA,NA,NA,https://www.who.int/csr/don/2000_03_31/en/,DON-2000-03-31
2000-Lassa Fever-DEU,2,2000,4/4/2000,Lassa fever,NA,Germany,DEU,NA,NA,NA,NA,yes,NA,yes,NA,NA,1,NA,NA,NA,0,NA,yes,NA,NA,NA,NA,https://www.who.int/csr/don/2000_04_04/en/,DON-2000-04-04
2000-Meningococcal Disease-SDN,1,2000,4/7/2000,Meningococcal disease,NA,Sudan,SDN,"Bahar aj Jabal, Juba city, White Nile, South Kordofan, Sennar",NA,NA,1/1/2000,NA,NA,NA,NA,NA,NA,NA,NA,2549,186,NA,yes,NA,NA,NA,NA,https://www.who.int/csr/don/2000_04_07/en/,DON-2000-04-07
2000-Meningococcal Disease-ETH,1,2000,4/10/2000,Meningococcal disease,NA,Ethiopia,ETH,"Amhara, Tigray, Gambella",NA,NA,1/1/2000,NA,NA,yes,NA,NA,70,NA,NA,149,14,NA,2/28/2000,NA,NA,NA,NA,https://www.who.int/csr/don/2000_04_10/en/,DON-2000-04-10
2000-Meningococcal Disease-FRA,1,2000,4/11/2000,Meningococcal disease,NA,France,FRA,NA,NA,NA,3/28/2000,NA,NA,NA,NA,NA,NA,NA,NA,6,3,NA,NA,NA,yes,NA,2 from Haj,https://www.who.int/csr/don/2000_04_11/en/,DON-2000-04-11
2000-Meningococcal Disease-GBR,1,2000,4/11/2000,Meningococcal disease,NA,United Kingdom,GBR,NA,NA,NA,3/21/2000,NA,NA,NA,NA,NA,17,NA,NA,NA,4,NA,NA,NA,yes,NA,11 from Haj,https://www.who.int/csr/don/2000_04_11/en/,DON-2000-04-11
2000-Meningococcal Disease-FRA,1,2000,4/21/2000,Meningococcal disease,NA,France,FRA,NA,NA,NA,NA,NA,NA,yes,NA,NA,NA,NA,NA,14,4,NA,NA,NA,yes,NA,NA,https://www.who.int/csr/don/2000_04_21b/en/,DON-2000-04-21b
2000-Meningococcal Disease-GBR,1,2000,4/21/2000,Meningococcal disease,NA,United Kingdom,GBR,NA,NA,NA,NA,NA,NA,yes,NA,NA,NA,NA,NA,22,4,NA,NA,NA,yes,NA,NA,https://www.who.int/csr/don/2000_04_21b/en/,DON-2000-04-21b
2000-Meningococcal Disease-OMN,1,2000,4/21/2000,Meningococcal disease,NA,Oman,OMN,NA,3/20/2000,NA,NA,NA,NA,yes,NA,NA,NA,NA,NA,12,3,NA,NA,NA,yes,NA,NA,https://www.who.int/csr/don/2000_04_21b/en/,DON-2000-04-21b
2000-Meningococcal Disease-SAU,1,2000,4/21/2000,Meningococcal disease,NA,Saudi Arabia,SAU,NA,NA,NA,NA,NA,NA,yes,NA,NA,86,NA,NA,199,55,NA,yes,NA,yes,NA,NA,https://www.who.int/csr/don/2000_04_21b/en/,DON-2000-04-21b
2000-Meningococcal Disease-NLD,1,2000,4/21/2000,Meningococcal disease,NA,Netherlands,NLD,NA,4/5/2000,NA,NA,NA,NA,yes,NA,NA,2,1,NA,NA,NA,NA,NA,NA,yes,NA,NA,https://www.who.int/csr/don/2000_04_21b/en/,DON-2000-04-21b
2000-Tularemia-XKO,6,2000,4/21/2000,Tularemia,NA,Kosovo,XKO,90% of territory,NA,NA,NA,NA,yes,yes,NA,NA,NA,NA,250,NA,0,NA,yes,NA,NA,NA,NA,https://www.who.int/csr/don/2000_04_21a/en/,DON-2000-04-21a
2000-Meningococcal Disease-USA,1,2000,4/26/2000,Meningococcal disease,NA,United States,USA,New York,NA,NA,4/20/2000,NA,NA,NA,NA,NA,NA,NA,NA,3,NA,NA,NA,NA,yes,NA,NA,https://www.who.int/csr/don/2000_04_26/en/,DON-2000-04-26
2000-Meningococcal Disease-SAU,1,2000,4/27/2000,Meningococcal disease,NA,Saudi Arabia,SAU,NA,NA,NA,NA,NA,NA,yes,NA,NA,105,NA,NA,225,57,NA,NA,NA,yes,NA,NA,https://www.who.int/csr/don/2000_04_27/en/,DON-2000-04-27
2000-Meningococcal Disease-NLD,1,2000,4/27/2000,Meningococcal disease,NA,Netherlands,NLD,NA,NA,NA,NA,NA,NA,yes,NA,NA,2,2,NA,NA,1,NA,yes,NA,NA,NA,NA,https://www.who.int/csr/don/2000_04_27/en/,DON-2000-04-27
2000-Tularemia-XKO,6,2000,4/27/2000,Tularemia,NA,Kosovo,XKO,NA,NA,NA,NA,NA,NA,yes,NA,NA,56,NA,699,NA,NA,NA,yes,NA,NA,NA,NA,https://www.who.int/csr/don/2000_04_27a/en/,DON-2000-04-27a
2000-Cholera-SOM,5,2000,5/2/2000,Cholera,NA,Somalia,SOM,"Bay, Lower Juba, Lower Shabelle, Mogadishu, Mudug",NA,NA,1/1/2000,NA,NA,yes,NA,NA,NA,NA,NA,2232,230,NA,yes,NA,NA,NA,NA,https://www.who.int/csr/don/2000_05_02/en/,DON-2000-05-02
2000-Meningococcal Disease-SGP,1,2000,5/3/2000,Meningococcal disease,NA,Singapore,SGP,NA,NA,NA,NA,NA,NA,NA,NA,NA,NA,NA,NA,4,NA,NA,yes,NA,NA,NA,NA,https://www.who.int/csr/don/2000_05_02/en/,DON-2000-05-02
2000-Meningococcal Disease-IDN,1,2000,5/3/2000,Meningococcal disease,NA,Indonesia,IDN,NA,NA,NA,NA,NA,NA,yes,NA,NA,1,NA,NA,14,6,NA,yes,NA,NA,NA,NA,https://www.who.int/csr/don/2000_05_02/en/,DON-2000-05-02
2000-Meningococcal Disease-IRN,1,2000,5/3/2000,Meningococcal disease,NA,Iran,IRN,NA,NA,NA,NA,NA,NA,NA,NA,NA,NA,NA,NA,2,NA,NA,yes,NA,NA,NA,NA,https://www.who.int/csr/don/2000_05_02/en/,DON-2000-05-02
2000-Meningococcal Disease-MAR,1,2000,5/3/2000,Meningococcal disease,NA,Morocco,MAR,NA,NA,NA,NA,NA,NA,NA,NA,NA,2,NA,NA,3,NA,NA,yes,NA,NA,NA,NA,https://www.who.int/csr/don/2000_05_02/en/,DON-2000-05-02
2000-Legionellosis-AUS,5,2000,5/4/2000,Legionnaires' disease,NA,Australia,AUS,NA,NA,NA,NA,NA,NA,yes,NA,NA,66,NA,NA,NA,NA,NA,yes,NA,NA,NA,NA,https://www.who.int/csr/don/2000_05_04/en/,DON-2000-05-04
2000-Legionellosis-AUS,5,2000,5/11/2000,Legionnaires' disease,NA,Australia,AUS,NA,4/11/2000,NA,NA,NA,NA,yes,NA,NA,76,NA,NA,NA,2,NA,yes,NA,NA,NA,NA,https://www.who.int/csr/don/2000_05_11/en/,DON-2000-05-11
2000-Yellow Fever-NGA,6,2000,5/19/2000,Yellow fever,NA,Nigeria,NGA,Kano State,NA,NA,NA,NA,NA,yes,NA,NA,2,NA,NA,NA,NA,NA,yes,NA,NA,NA,NA,https://www.who.int/csr/don/2000_05_19/en/,DON-2000-05-19
2000-EHEC-CAN,5,2000,5/30/2000,E. coli O157,NA,Canada,CAN,NA,5/12/2000,NA,yes,NA,NA,yes,NA,NA,NA,NA,NA,32,5,NA,yes,5/21/2000,NA,NA,NA,https://www.who.int/csr/don/2000_05_30/en/,DON-2000-05-30
2000-Viral Haemorrhagic Fever-AFG,2,2000,6/19/2000,Acute haemorrhagic fever syndrome,NA,Afghanistan,AFG,Gulran,beginning May 2000,NA,NA,NA,NA,NA,NA,NA,NA,NA,25,NA,15,NA,6/16/2000,NA,NA,NA,NA,https://www.who.int/csr/don/2000_06_19e/en/,DON-2000-06-19e
2000-Smallpox-RUS,1,2000,6/20/2000,Smallpox,Exposure to smallpox vaccine,Russian Federation,RUS,Vladivostock,NA,NA,NA,NA,NA,NA,NA,NA,NA,NA,NA,NA,NA,NA,NA,NA,NA,NA,NA,https://www.who.int/csr/don/2000_06_20e/en/,DON-2000-06-20e
2000-Anthrax-ETH,4,2000,6/20/2000,Anthrax,NA,Ethiopia,ETH,Afar,NA,NA,NA,yes,NA,NA,NA,NA,NA,NA,NA,NA,NA,NA,no,NA,NA,NA,NA,https://www.who.int/csr/don/2000_07_20/en/,DON-2000-07-20
2000-Cholera-FSM,5,2000,7/6/2000,Cholera,NA,Federated States of Micronesia,FSM,Pohnpei,NA,NA,NA,6/26/2000,NA,yes,NA,NA,NA,NA,NA,954,9,NA,yes,NA,NA,NA,NA,https://www.who.int/csr/don/2000_07_06/en/,DON-2000-07-06
2000-Food Poisoning-JAP,5,2000,7/10/2000,Staphylococcal food intoxication,NA,Japan,JAP,8 western states,NA,NA,NA,7/10/2000,NA,NA,NA,NA,NA,NA,NA,13809,NA,NA,yes,NA,NA,NA,NA,https://www.who.int/csr/don/2000_07_10/en/,DON-2000-07-10
2000-Viral Haemorrhagic Fever-AFG,2,2000,7/11/2000,Acute haemorrhagic fever syndrome,NA,Afghanistan,AFG,Gulran,NA,NA,NA,NA,NA,no,NA,NA,NA,NA,27,NA,16,NA,yes,NA,NA,NA,NA,https://www.who.int/csr/don/2000_07_11/en/,DON-2000-07-11
2000-Lassa Fever-NLD,2,2000,7/25/2000,Lassa fever,NA,Netherlands,NLD,NA,7/11/2000,7/12/2000,NA,yes,NA,7/22/2000,NA,NA,1,NA,NA,NA,0,NA,yes,NA,NA,NA,imported,https://www.who.int/csr/don/2000_07_25/en/,DON-2000-07-25
2000-Lassa Fever-NLD,2,2000,7/26/2000,Lassa fever,NA,Netherlands,NLD,NA,NA,7/15/2000,NA,NA,NA,7/22/2000,NA,NA,1,NA,NA,NA,1,NA,NA,NA,NA,NA,NA,https://www.who.int/csr/don/2000_07_26/en/,DON-2000-07-26
2000-Measles-IRL,1,2000,8/9/2000,Measles,NA,Ireland,IRL,north Dublin,NA,NA,1/1/2000,NA,NA,NA,NA,NA,NA,NA,NA,1376,2,NA,yes,NA,NA,NA,NA,https://www.who.int/csr/don/2000_08_09/en/,DON-2000-08-09
2000-Meningococcal Disease-ETH,1,2000,8/17/2000,Meningococcal disease,NA,Ethiopia,ETH,Addis Ababa,03/??/2000,NA,03/??/2000,NA,NA,yes,NA,NA,311,NA,NA,855,19,NA,yes,NA,NA,NA,NA,https://www.who.int/csr/don/2000_08_17/en/,DON-2000-08-17
2000-Yellow Fever-LBR,6,2000,8/24/2000,Yellow fever,NA,Liberia,LBR,Grand Cape Mount County,NA,NA,NA,8/16/2000,NA,yes,NA,NA,1,NA,NA,29,3,NA,yes,NA,NA,NA,NA,https://www.who.int/csr/don/2000_08_24b/en/,DON-2000-08-24b
2000-Meningococcal Disease-RWA,1,2000,8/24/2000,Meningococcal disease,NA,Rwanda,RWA,Kabgayi,mid-July 2000,NA,8/22/2000,NA,NA,8/10/2000,NA,NA,NA,NA,NA,164,10,NA,8/14/2000,NA,NA,NA,NA,https://www.who.int/csr/don/2000_08_24/en/,DON-2000-08-24
2000-Viral Haemorrhagic Fever-AFG,2,2000,8/24/2000,Acute haemorrhagic fever syndrome,NA,Afghanistan,AFG,Herat,NA,NA,NA,NA,NA,NA,NA,NA,NA,NA,NA,NA,NA,NA,8/27/2000,NA,NA,NA,NA,https://www.who.int/csr/don/2000_08_24a/en/,DON-2000-08-24a
2000-Cholera-FSM,5,2000,9/9/2000,Cholera,NA,Federated States of Micronesia,FSM,Pohnpei,NA,NA,4/17/2000,NA,NA,NA,NA,NA,NA,NA,NA,2689,15,NA,yes,NA,NA,NA,NA,https://www.who.int/csr/don/2000_09_08/en/,DON-2000-09-08
2000-Yellow Fever-LBR,6,2000,9/11/2000,Yellow fever,NA,Liberia,LBR,Grand Cape Mount County,NA,NA,NA,9/6/2000,NA,NA,NA,NA,NA,NA,102,NA,NA,NA,9/5/2000,NA,NA,NA,NA,https://www.who.int/csr/don/2000_09_11/en/,DON-2000-09-11
2000-Cholera-AFG,5,2000,9/12/2000,Cholera,NA,Afghanistan,AFG,"Kandahar, Badghis, Jawzjan",08/??/2000,NA,yes,NA,NA,yes,NA,NA,NA,NA,NA,1604,19,NA,yes,NA,NA,NA,NA,https://www.who.int/csr/don/2000_09_13/en/,DON-2000-09-13
2000-Leptospirosis-USA,4,2000,9/15/2000,Leptospirosis,NA,United States of America,USA,NA,NA,NA,NA,NA,NA,yes,NA,NA,2,NA,NA,37,NA,NA,NA,NA,NA,NA,NA,https://www.who.int/csr/don/2000_09_15/en/,DON-2000-09-15
2000-Rift Valley Fever-SAU,6,2000,9/18/2000,Rift Valley fever,NA,Saudi Arabia,SAU,Jizan,NA,NA,NA,9/17/2000,NA,yes,NA,NA,NA,NA,38,NA,14,NA,yes,yes,NA,NA,NA,https://www.who.int/csr/don/2000_09_18/en/,DON-2000-09-18
2000-Leptospirosis-FRA,4,2000,9/21/2000,Leptospirosis,NA,France,FRA,NA,NA,NA,yes,NA,NA,yes,NA,NA,1,NA,NA,4,NA,NA,yes,NA,NA,NA,NA,https://www.who.int/csr/don/2000_09_15/en/,DON-2000-09-15
2000-Leptospirosis-CAN,4,2000,9/21/2000,Leptospirosis,NA,Canada,CAN,NA,NA,NA,9/21/2000,NA,NA,yes,NA,NA,2,NA,4,6,NA,NA,yes,NA,NA,NA,NA,https://www.who.int/csr/don/2000_09_21a/en/,DON-2000-09-21a
2000-West Nile Virus-ISR,6,2000,9/22/2000,West Nile fever,NA,Israel,ISR,NA,NA,NA,NA,9/19/2000,NA,NA,NA,NA,NA,NA,NA,151,12,NA,yes,NA,NA,NA,NA,https://www.who.int/csr/don/2000_09_22/en/,DON-2000-09-22
2000-Rift Valley Fever-YEM,6,2000,9/26/2000,Acute haemorrhagic fever syndrome,NA,Yemen,YEM,Wadi Mawr,9/10/2000,NA,NA,yes,NA,NA,NA,NA,NA,NA,NA,113,30,NA,yes,NA,NA,NA,NA,https://www.who.int/csr/don/2000_09_26/en/,DON-2000-09-26
2000-Rift Valley Fever-SAU,6,2000,9/29/2000,Rift Valley fever,NA,Saudi Arabia,SAU,Jizan,NA,NA,9/10/2000,NA,NA,yes,NA,NA,NA,NA,NA,160,33,NA,yes,yes,NA,NA,NA,https://www.who.int/csr/don/2000_09_29/en/,DON-2000-09-29
2000-Rift Valley Fever-YEM,6,2000,9/29/2000,Acute haemorrhagic fever syndrome,NA,Yemen,YEM,Wadi Mawr,NA,NA,NA,NA,NA,NA,NA,NA,NA,NA,NA,134,31,NA,yes,yes,NA,NA,NA,https://www.who.int/csr/don/2000_09_29/en/,DON-2000-09-29
2000-Rift Valley Fever-YEM,6,2000,10/3/2000,Rift Valley fever,NA,Yemen,YEM,Wadi Mawr,NA,NA,10/2/2000,NA,NA,yes,NA,NA,29,NA,321,NA,32,NA,yes,NA,NA,NA,NA,https://www.who.int/csr/don/2000_10_03/en/,DON-2000-10-03
2000-Rift Valley Fever-YEM,6,2000,10/9/2000,Rift Valley fever,NA,Yemen,YEM,NA,NA,NA,NA,10/9/2000,NA,yes,NA,NA,NA,NA,NA,321,32,10,yes,NA,NA,NA,NA,https://www.who.int/csr/don/2000_10_09/en/,DON-2000-10-09
2000-Rift Valley Fever-SAU,6,2000,10/10/2000,Rift Valley fever,NA,Saudi Arabia,SAU,NA,NA,NA,NA,10/8/2000,NA,NA,NA,NA,NA,NA,291,NA,64,NA,yes,NA,NA,NA,NA,https://www.who.int/csr/don/2000_10_10/en/,DON-2000-10-10
2000-Cholera-ZAF,5,2000,10/13/2000,Cholera,NA,South Africa,ZAF,"Ngwelezane, Empangeni, Eshowe/Nkandla",mid-August 2000,NA,yes,NA,NA,NA,NA,NA,NA,NA,NA,2175,22,NA,yes,yes,NA,NA,NA,https://www.who.int/csr/don/2000_10_13/en/,DON-2000-10-13
2000-Ebola-UGA,2,2000,10/16/2000,Ebola haemorrhagic fever,NA,Uganda,UGA,Gulu town,NA,NA,NA,10/16/2000,NA,yes,NA,NA,NA,NA,71,NA,35,NA,yes,NA,NA,NA,NA,https://www.who.int/csr/don/2000_10_16/en/,DON-2000-10-16
2000-Ebola-UGA,2,2000,10/17/2000,Ebola haemorrhagic fever,NA,Uganda,UGA,Gulu district,NA,NA,NA,10/17/2000,NA,NA,NA,NA,NA,NA,NA,81,35,NA,yes,NA,NA,NA,NA,https://www.who.int/csr/don/2000_10_17/en/,DON-2000-10-17
2000-Ebola-UGA,2,2000,10/18/2000,Ebola haemorrhagic fever,NA,Uganda,UGA,"Aswa county, Gulu municipality, Kitgum",NA,NA,NA,10/18/2000,NA,NA,NA,NA,NA,NA,NA,94,39,NA,yes,NA,NA,NA,NA,https://www.who.int/csr/don/2000_10_18/en/,DON-2000-10-18
2000-Cholera-ZAF,5,2000,10/18/2000,Cholera,NA,South Africa,ZAF,"Lower Umfolozi Districts, Ngwelezane, Empangeni, Eshowe/Nkandla areas, Stanger area, Port Shepstone area.",mid-August 2000,NA,yes,NA,NA,NA,NA,NA,NA,NA,NA,3075,26,NA,yes,yes,NA,NA,NA,https://www.who.int/csr/don/2000_10_18a/en/,DON-2000-10-18a
2000-Ebola-UGA,2,2000,10/19/2000,Ebola haemorrhagic fever,NA,Uganda,UGA,Gulu,NA,NA,NA,10/19/2000,NA,10/16/2000,NA,NA,NA,NA,NA,111,41,NA,yes,NA,NA,NA,NA,https://www.who.int/csr/don/2000_10_19/en/,DON-2000-10-19
2000-Rift Valley Fever-SAU,6,2000,10/19/2000,Rift Valley fever,NA,Saudi Arabia,SAU,NA,NA,NA,NA,10/17/2000,NA,NA,NA,NA,NA,NA,405,NA,76,NA,yes,NA,NA,NA,NA,https://www.who.int/csr/don/2000_10_19a/en/,DON-2000-10-19a
2000-Ebola-UGA,2,2000,10/20/2000,Ebola haemorrhagic fever,NA,Uganda,UGA,Gulu,NA,NA,NA,10/16/2000,NA,yes,NA,NA,NA,NA,NA,122,47,NA,yes,yes,NA,NA,NA,https://www.who.int/csr/don/2000_10_20b/en/,DON-2000-10-20b
2000-Cholera-ZAF,5,2000,10/20/2000,Cholera,NA,South Africa,ZAF,"Lower Umfolozi districts, Ngwelezane and Empangeni, Eshowe/Nkandla areas, Stanger area, Port Shepstone.",mid-August 2000,NA,10/19/2000,NA,NA,NA,NA,NA,NA,NA,NA,3279,27,NA,yes,NA,NA,NA,NA,https://www.who.int/csr/don/2000_10_20a/en/,DON-2000-10-20a
2000-Ebola-UGA,2,2000,10/21/2000,Ebola haemorrhagic fever,NA,Uganda,UGA,NA,NA,NA,NA,10/21/2000,NA,NA,NA,NA,NA,NA,NA,139,51,NA,yes,NA,NA,NA,NA,https://www.who.int/csr/don/2000_10_21/en/,DON-2000-10-21
2000-Ebola-UGA,2,2000,10/22/2000,Ebola haemorrhagic fever,NA,Uganda,UGA,NA,NA,NA,NA,10/22/2000,NA,NA,NA,NA,NA,NA,NA,149,54,NA,NA,NA,NA,NA,NA,https://www.who.int/csr/don/2000_10_22/en/,DON-2000-10-22
2000-Ebola-UGA,2,2000,10/23/2000,Ebola haemorrhagic fever,NA,Uganda,UGA,Gulu,NA,NA,NA,10/23/2000,NA,NA,NA,NA,NA,NA,NA,160,55,NA,yes,NA,NA,NA,NA,https://www.who.int/csr/don/2000_10_23/en/,DON-2000-10-23
2000-Ebola-UGA,2,2000,10/24/2000,Ebola haemorrhagic fever,NA,Uganda,UGA,NA,NA,NA,NA,10/24/2000,NA,NA,NA,NA,NA,NA,NA,165,60,NA,yes,yes,NA,NA,NA,https://www.who.int/csr/don/2000_10_24/en/,DON-2000-10-24
2000-Rift Valley Fever-SAU,6,2000,10/25/2000,Rift Valley fever,NA,Saudi Arabia,SAU,"Jizan, Asir",NA,NA,NA,10/23/2000,NA,NA,NA,NA,NA,NA,NA,443,85,NA,yes,NA,NA,NA,NA,https://www.who.int/csr/don/2000_10_25/en/,DON-2000-10-25
2000-Ebola-UGA,2,2000,10/25/2000,Ebola haemorrhagic fever,NA,Uganda,UGA,Gulu,NA,NA,NA,10/25/2000,NA,yes,NA,NA,NA,NA,NA,176,64,NA,yes,yes,NA,NA,NA,https://www.who.int/csr/don/2000_10_25a/en/,DON-2000-10-25a
2000-Rift Valley Fever-YEM,6,2000,10/26/2000,Rift Valley fever,NA,Yemen,YEM,"Hodeidah, Hajjah, Mahweet, Sadeh, Dhamar, El-Zuhrah",NA,NA,NA,10/19/2000,NA,yes,NA,NA,NA,NA,653,NA,80,NA,yes,NA,NA,NA,NA,https://www.who.int/csr/don/2000_10_26/en/,DON-2000-10-26
2000-Ebola-UGA,2,2000,10/26/2000,Ebola haemorrhagic fever,NA,Uganda,UGA,NA,NA,NA,NA,10/26/2000,NA,NA,NA,NA,NA,NA,NA,182,64,NA,NA,NA,NA,NA,NA,https://www.who.int/csr/don/2000_10_26a/en/,DON-2000-10-26a
2000-Ebola-UGA,2,2000,10/27/2000,Ebola haemorrhagic fever,NA,Uganda,UGA,Gulu,NA,NA,NA,10/27/2000,NA,NA,NA,NA,NA,NA,NA,191,68,NA,yes,yes,NA,NA,NA,https://www.who.int/csr/don/2000_10_27/en/,DON-2000-10-27
2000-Cholera-ZAF,5,2000,10/27/2000,Cholera,NA,South Africa,ZAF,"Lower Umfolozi, Ngwelezane, Empangeni, Eshowe/Nkandla areas, Durban, KwaDukuza/Stanger area, Jozini, Port Shepstone",mid-August 2000,NA,10/26/2000,NA,NA,NA,NA,NA,NA,NA,NA,3806,33,NA,yes,NA,NA,NA,NA,https://www.who.int/csr/don/2000_10_27a/en/,DON-2000-10-27a
2000-Ebola-UGA,2,2000,10/28/2000,Ebola haemorrhagic fever,NA,Uganda,UGA,Gulu,NA,NA,NA,10/28/2000,NA,NA,NA,NA,NA,NA,NA,205,71,NA,yes,NA,NA,NA,NA,https://www.who.int/csr/don/2000_10_28/en/,DON-2000-10-28
2000-Ebola-UGA,2,2000,10/29/2000,Ebola haemorrhagic fever,NA,Uganda,UGA,NA,NA,NA,NA,10/29/2000,NA,NA,NA,NA,NA,NA,NA,211,72,NA,NA,NA,NA,NA,NA,https://www.who.int/csr/don/2000_10_29/en/,DON-2000-10-29
2000-Ebola-UGA,2,2000,10/30/2000,Ebola haemorrhagic fever,NA,Uganda,UGA,NA,NA,NA,NA,10/30/2000,NA,NA,NA,NA,NA,NA,NA,224,73,NA,yes,NA,NA,NA,NA,https://www.who.int/csr/don/2000_10_30/en/,DON-2000-10-30
2000-Ebola-UGA,2,2000,10/31/2000,Ebola haemorrhagic fever,NA,Uganda,UGA,Gulu,NA,NA,NA,10/31/2000,NA,NA,NA,NA,NA,NA,NA,239,75,NA,yes,NA,NA,NA,NA,https://www.who.int/csr/don/2000_10_31/en/,DON-2000-10-31
2000-Ebola-UGA,2,2000,11/1/2000,Ebola haemorrhagic fever,NA,Uganda,UGA,NA,NA,NA,NA,11/1/2000,NA,NA,NA,NA,NA,NA,NA,251,80,NA,NA,NA,NA,NA,NA,https://www.who.int/csr/don/2000_11_01/en/,DON-2000-11-01
2000-Ebola-UGA,2,2000,11/2/2000,Ebola haemorrhagic fever,NA,Uganda,UGA,"Gulu, Mbarara",NA,NA,NA,11/2/2000,NA,yes,NA,NA,NA,NA,NA,262,81,NA,yes,NA,NA,NA,NA,https://www.who.int/csr/don/2000_11_02/en/,DON-2000-11-02
2000-Ebola-UGA,2,2000,11/3/2000,Ebola haemorrhagic fever,NA,Uganda,UGA,NA,NA,NA,NA,11/3/2000,NA,NA,NA,NA,NA,NA,NA,266,83,NA,NA,NA,NA,NA,NA,https://www.who.int/csr/don/2000_11_03/en/,DON-2000-11-03
2000-Ebola-UGA,2,2000,11/3/2000,Ebola haemorrhagic fever,NA,Uganda,UGA,NA,NA,NA,NA,NA,NA,NA,NA,NA,NA,NA,NA,NA,NA,NA,NA,NA,NA,NA,WHO advisory note,https://www.who.int/csr/don/2000_11_03b/en/,DON-2000-11-03b
2000-Cholera-ZAF,5,2000,11/3/2000,Cholera,NA,South Africa,ZAF,"Lower Umfolozi, Ngwelezane, Empangeni, Eshowe/Nkandla areas, Durban, KwaDukuza/Stanger area, Jozini, Ugu Region/South Coast",mid-August 2000,NA,11/2/2000,NA,NA,NA,NA,NA,NA,NA,NA,4270,32,NA,yes,yes,NA,NA,NA,https://www.who.int/csr/don/2000_11_03a/en/,DON-2000-11-03a
2000-Ebola-UGA,2,2000,11/5/2000,Ebola haemorrhagic fever,NA,Uganda,UGA,NA,NA,NA,NA,11/5/2000,NA,NA,NA,NA,NA,NA,NA,280,89,NA,NA,NA,NA,NA,NA,https://www.who.int/csr/don/2000_11_05/en/,DON-2000-11-05
2000-Ebola-UGA,2,2000,11/6/2000,Ebola haemorrhagic fever,NA,Uganda,UGA,"Gulu, Mbarara",NA,NA,NA,11/6/2000,NA,yes,NA,NA,3,NA,NA,281,91,NA,yes,NA,NA,NA,NA,https://www.who.int/csr/don/2000_11_06/en/,DON-2000-11-06
2000-Ebola-UGA,2,2000,11/7/2000,Ebola haemorrhagic fever,NA,Uganda,UGA,"Mbarara, Gulu",NA,NA,NA,11/7/2000,NA,yes,NA,NA,3,NA,NA,287,92,NA,NA,NA,NA,NA,NA,https://www.who.int/csr/don/2000_11_07/en/,DON-2000-11-07
2000-Ebola-UGA,2,2000,11/8/2000,Ebola haemorrhagic fever,NA,Uganda,UGA,Gulu,NA,NA,NA,11/8/2000,NA,NA,NA,NA,NA,NA,NA,286,94,NA,NA,NA,NA,NA,just Gulu district,https://www.who.int/csr/don/2000_11_08/en/,DON-2000-11-08
2000-Ebola-UGA,2,2000,11/9/2000,Ebola haemorrhagic fever,NA,Uganda,UGA,Gulu,NA,NA,NA,11/9/2000,NA,NA,NA,NA,NA,NA,NA,295,96,NA,NA,NA,NA,NA,NA,https://www.who.int/csr/don/2000_11_09/en/,DON-2000-11-09
2000-Cholera-ZAF,5,2000,11/10/2000,Cholera,NA,South Africa,ZAF,"Lower Umfolozi, Ngwelezane, Empangeni, Ulundi, Eshowe/Nkandla areas, Durban, KwaDukuza/Stanger area, Jozini, Ugu Region/South Coast",mid-August 2000,NA,11/9/2000,NA,NA,NA,NA,NA,NA,NA,NA,4583,33,NA,yes,yes,NA,NA,NA,https://www.who.int/csr/don/2000_11_10/en/,DON-2000-11-10
2000-Ebola-UGA,2,2000,11/10/2000,Ebola haemorrhagic fever,NA,Uganda,UGA,"Gulu, Mbarara",NA,NA,NA,11/10/2000,NA,yes,NA,NA,3,NA,NA,304,101,NA,NA,NA,NA,NA,NA,https://www.who.int/csr/don/2000_11_10a/en/,DON-2000-11-10a
2000-Ebola-UGA,2,2000,11/11/2000,Ebola haemorrhagic fever,NA,Uganda,UGA,Gulu,NA,NA,NA,11/11/2000,NA,NA,NA,NA,NA,NA,NA,313,101,NA,NA,NA,NA,NA,NA,https://www.who.int/csr/don/2000_11_11/en/,DON-2000-11-11
2000-Ebola-UGA,2,2000,11/12/2000,Ebola haemorrhagic fever,NA,Uganda,UGA,Gulu,NA,NA,NA,11/12/2000,NA,NA,NA,NA,NA,NA,NA,320,102,NA,NA,NA,NA,NA,NA,https://www.who.int/csr/don/2000_11_12/en/,DON-2000-11-12
2000-Ebola-UGA,2,2000,11/14/2000,Ebola haemorrhagic fever,NA,Uganda,UGA,"Gulu, Masindi",NA,NA,NA,11/12/2000,NA,yes,NA,NA,NA,NA,NA,320,104,NA,yes,NA,NA,NA,beginning today only new cases that are laboratory confirmed will be reported,https://www.who.int/csr/don/2000_11_14/en/,DON-2000-11-14
2000-Ebola-UGA,2,2000,11/15/2000,Ebola haemorrhagic fever,NA,Uganda,UGA,Gulu,NA,NA,NA,11/13/2000,NA,yes,NA,NA,NA,NA,NA,321,104,NA,NA,NA,NA,NA,NA,https://www.who.int/csr/don/2000_11_15/en/,DON-2000-11-15
2000-Ebola-UGA,2,2000,11/17/2000,Ebola haemorrhagic fever,NA,Uganda,UGA,Gulu,NA,NA,NA,11/17/2000,NA,yes,NA,NA,NA,NA,7,329,107,NA,NA,NA,NA,NA,NA,https://www.who.int/csr/don/2000_11_17/en/,DON-2000-11-17
2000-Cholera-ZAF,5,2000,11/20/2000,Cholera,NA,South Africa,ZAF,"Lower Umfolozi, Ngwelezane, Empangeni, Ulundi, Eshowe/Nkandla areas, Durban, KwaDukuza/Stanger area, Jozini, Ugu Region/South Coast",mid-August 2000,NA,11/19/2000,NA,NA,NA,NA,NA,NA,NA,NA,5285,35,NA,NA,yes,NA,NA,NA,https://www.who.int/csr/don/2000_11_20/en/,DON-2000-11-20
2000-Cholera-SOM,5,2000,11/22/2000,Cholera,NA,Somalia,SOM,Boroma,10/14/2000,NA,NA,11/15/2000,NA,yes,NA,NA,NA,NA,NA,272,14,NA,yes,NA,NA,NA,NA,https://www.who.int/csr/don/2000_11_22/en/,DON-2000-11-22
2000-Ebola-UGA,2,2000,11/24/2000,Ebola haemorrhagic fever,NA,Uganda,UGA,"Gulu, Masindi, Mbarara",NA,NA,NA,11/24/2000,NA,yes,NA,NA,22,NA,NA,343,123,NA,yes,NA,NA,NA,NA,https://www.who.int/csr/don/2000_11_24/en/,DON-2000-11-24
2000-Cholera-ZAF,5,2000,11/27/2000,Cholera,NA,South Africa,ZAF,"Lower Umfolozi, Ngwelezane, Empangeni, Ulundi, Eshowe/Nkandla areas, Durban, KwaDukuza/Stanger area, Jozini, Ugu Region/South Coast",mid-August 2000,NA,11/27/2000,NA,NA,NA,NA,NA,NA,NA,NA,5876,35,NA,yes,NA,NA,NA,NA,https://www.who.int/csr/don/2000_11_27/en/,DON-2000-11-27
2000-Ebola-UGA,2,2000,11/30/2000,Ebola haemorrhagic fever,NA,Uganda,UGA,Gulu,NA,NA,NA,NA,NA,yes,NA,NA,NA,NA,NA,354,140,NA,yes,yes,NA,NA,NA,https://www.who.int/csr/don/2000_11_30/en/,DON-2000-11-30
2000-Ebola-TZA,2,2000,11/30/2000,Ebola haemorrhagic fever,NA,Tanzania,TZA,NA,NA,NA,NA,NA,NA,no,NA,NA,0,NA,5,NA,NA,NA,NA,NA,NA,NA,NA,https://www.who.int/csr/don/2000_11_30/en/,DON-2000-11-30
2000-Ebola-UGA,2,2000,12/5/2000,Ebola haemorrhagic fever,NA,Uganda,UGA,"Gulu, Masindi",NA,NA,NA,12/5/2000,NA,yes,NA,NA,NA,NA,NA,370,140,NA,yes,NA,NA,NA,NA,https://www.who.int/csr/don/2000_12_05/en/,DON-2000-12-05
2000-Cholera-ZAF,5,2000,12/6/2000,Cholera,NA,South Africa,ZAF,"Lower Umfolozi, Ngwelezane, Empangeni, Ulundi, Eshowe/Nkandla areas, Durban, KwaDukuza/Stanger area, Jozini, Ugu Region/South Coast",mid-August 2000,NA,12/5/2000,NA,NA,NA,NA,NA,NA,NA,NA,6548,35,NA,NA,NA,NA,NA,NA,https://www.who.int/csr/don/2000_12_06/en/,DON-2000-12-06
2000-Ebola-UGA,2,2000,12/8/2000,Ebola haemorrhagic fever,NA,Uganda,UGA,"Gulu, Masindi",NA,NA,NA,12/8/2000,NA,yes,NA,NA,NA,NA,NA,405,160,NA,yes,NA,NA,NA,NA,https://www.who.int/csr/don/2000_12_08/en/,DON-2000-12-08
2000-Cholera-ZAF,5,2000,12/19/2000,Cholera,NA,South Africa,ZAF,"Empangeni area, Lower Umfolozi districts, Hlabisa, Ngwelezane, Eshowe/Nkandla area, KwaDukuza/Stanger area, Ugu Region/South Coast",mid-August 2000,NA,12/18/2000,NA,NA,yes,NA,NA,8137,NA,NA,8137,41,NA,NA,NA,NA,NA,NA,https://www.who.int/csr/don/2000_12_19/en/,DON-2000-12-19
2000-Ebola-UGA,2,2000,12/19/2000,Ebola haemorrhagic fever,NA,Uganda,UGA,NA,NA,NA,NA,12/19/2000,NA,yes,NA,NA,NA,NA,NA,421,162,NA,yes,NA,NA,NA,NA,https://www.who.int/csr/don/2000_12_19a/en/,DON-2000-12-19a
2000-Yellow Fever-GIN,6,2000,12/29/2000,Yellow fever,NA,Guinea,GIN,northwestern Guinea,NA,NA,12/27/2000,NA,NA,yes,NA,NA,NA,NA,512,NA,190,NA,yes,NA,NA,NA,NA,https://www.who.int/csr/don/2000_12_29/en/,DON-2000-12-29
2000-Ebola-UGA,2,2000,12/29/2000,Ebola haemorrhagic fever,NA,Uganda,UGA,"Gulu, Masindi, Mbarara",NA,NA,NA,12/29/2000,NA,yes,NA,NA,NA,NA,NA,426,172,NA,yes,NA,NA,NA,NA,https://www.who.int/csr/don/2000_12_29b/en/,DON-2000-12-29b
2000-Cholera-ZAF,5,2000,12/29/2000,Cholera,NA,South Africa,ZAF,"Empangeni area, Lower Umfolozi districts, Hlabisa, Ngwelezane, Eshowe/Nkandla area, KwaDukuza/Stanger area, Ugu Region/South Coast",mid-August 2000,NA,NA,NA,NA,yes,NA,NA,11183,NA,NA,11183,51,NA,NA,NA,NA,NA,NA,https://www.who.int/csr/don/2000_12_29a/en/,DON-2000-12-29a
2000-Ebola-UGA,2,2001,1/3/2001,Ebola haemorrhagic fever,NA,Uganda,UGA,"Gulu, Masindi",NA,NA,NA,1/2/2000,NA,yes,NA,NA,NA,NA,NA,421,168,NA,yes,NA,NA,NA,NA,https://www.who.int/csr/don/2001_01_03/en/,DON-2001-01-03
2001-Viral Haemorrhagic Fever-COD,2,2001,1/3/2001,Viral haemorrhagic fever,NA,Democratic Republic of the Congo,COD,"Dungu, Bengadi, Isiro, Buta, Nyankunde, Bunia",NA,NA,NA,NA,NA,no,NA,NA,0,NA,5,NA,NA,NA,yes,NA,NA,NA,NA,https://www.who.int/csr/don/2001_01_05/en/,DON-2001-01-05
2000-Cholera-ZAF,5,2001,1/9/2001,Cholera,NA,South Africa,ZAF,"Empangeni area, Lower Umfolozi districts, Hlabisa, Ngwelezane, Eshowe/Nkandla area, KwaDukuza/Stanger area, Ugu Region/South Coast",mid-August 2000,NA,1/8/2001,NA,NA,yes,NA,NA,15983,NA,NA,NA,60,NA,yes,NA,NA,NA,NA,https://www.who.int/csr/don/2001_01_09/en/,DON-2001-01-09
2000-Ebola-UGA,2,2001,1/9/2001,Ebola haemorrhagic fever,NA,Uganda,UGA,"Gulu, Masindi",NA,NA,NA,1/9/2001,NA,yes,NA,NA,NA,NA,NA,422,169,NA,yes,NA,NA,NA,NA,https://www.who.int/csr/don/2001_01_09a/en/,DON-2001-01-09a
2000-Cholera-ZAF,5,2001,1/16/2001,Cholera,NA,South Africa,ZAF,"Empangeni area, Lower Umfolozi districts, Eshowe/Nkandla area, KwaDukuza/Stanger area, Ugu Region/South Coast",mid-August 2000,NA,1/14/2001,NA,NA,NA,NA,NA,NA,NA,NA,19499,66,NA,yes,yes,NA,NA,NA,https://www.who.int/csr/don/2001_01_16/en/,DON-2001-01-16
2000-Ebola-UGA,2,2001,1/17/2001,Ebola haemorrhagic fever,NA,Uganda,UGA,"Gulu, Masindi",NA,NA,NA,1/16/2001,NA,yes,NA,NA,NA,NA,NA,423,169,NA,yes,NA,NA,NA,NA,https://www.who.int/csr/don/2001_01_17/en/,DON-2001-01-17
2000-Ebola-UGA,2,2001,1/24/2001,Ebola haemorrhagic fever,NA,Uganda,UGA,"Gulu, Masindi",NA,NA,NA,1/23/2001,NA,NA,NA,NA,NA,NA,NA,423,169,NA,NA,NA,NA,NA,NA,https://www.who.int/csr/don/2001_01_24/en/,DON-2001-01-24
2000-Cholera-ZAF,5,2001,1/26/2001,Cholera,NA,South Africa,ZAF,"Empangeni area, Lower Umfolozi districts, Eshowe/Nkandla area, KwaDukuza/Stanger area, Ugu Region/South Coast",mid-August 2000,NA,1/25/2001,NA,NA,NA,NA,NA,NA,NA,NA,27431,74,NA,yes,yes,NA,NA,NA,https://www.who.int/csr/don/2001_01_26/en/,DON-2001-01-26
2000-Cholera-ZAF,5,2001,2/5/2001,Cholera,NA,South Africa,ZAF,"Empangeni area, Lower Umfolozi districts, Eshowe/Nkandla area, KwaDukuza/Stanger area, Ugu Region/South Coast",mid-August 2000,NA,2/4/2001,NA,NA,NA,NA,NA,NA,NA,NA,37204,85,0.4,yes,yes,NA,NA,NA,https://www.who.int/csr/don/2001_02_05/en/,DON-2001-02-05
2001-Measles-KOR,1,2001,2/9/2001,Measles,NA,Republic of Korea,KOR,East,NA,NA,03/??/2000,NA,NA,yes,NA,NA,NA,NA,NA,39537,6,NA,yes,yes,NA,NA,NA,https://www.who.int/csr/don/2001_02_09/en/,DON-2001-02-09
2000-Ebola-UGA,2,2001,2/9/2001,Ebola haemorrhagic fever,NA,Uganda,UGA,"Gulu, Masindi, Mbarara",8/30/2000,NA,10/8/2000,NA,NA,10/15/2000,NA,NA,218,NA,NA,428,173,NA,yes,yes,NA,NA,external report,https://www.who.int/docstore/wer/pdf/2001/wer7606.pdf,https://www.who.int/docstore/wer/pdf/2001/wer7606.pdf
2000-Cholera-ZAF,5,2001,2/14/2001,Cholera,NA,South Africa,ZAF,"Empangeni area, Lower Umfolozi districts, Eshowe/Nkandla area, KwaDukuza/Stanger area, Ugu Region/South Coast",mid-August 2000,NA,2/14/2001,NA,NA,NA,NA,NA,NA,NA,NA,48647,108,NA,yes,yes,NA,NA,NA,https://www.who.int/csr/don/2001_02_16/en/,DON-2001-02-16
2001-Meningococcal Disease-BEN,1,2001,2/20/2001,Meningococcal disease,NA,Benin,BEN,"Alibori, Borgou, Atacora, Donga",NA,NA,NA,01/??/2001,NA,yes,NA,NA,NA,NA,NA,603,45,7.5,yes,NA,NA,NA,NA,https://www.who.int/csr/don/2001_02_20/en/,DON-2001-02-20
2001-Meningococcal Disease-TCD,1,2001,2/20/2001,Meningococcal disease,NA,Chad,TCD,"Moyen-Chari, Longone Occidental",NA,NA,12/25/2000,NA,NA,yes,NA,NA,NA,NA,NA,798,83,NA,yes,NA,NA,NA,NA,https://www.who.int/csr/don/2001_02_20/en/,DON-2001-02-20
2001-Meningococcal Disease-ETH,1,2001,2/20/2001,Meningococcal disease,NA,Ethiopia,ETH,"Amhara, Gambella, Somali, Tigray, Southern regions",NA,NA,NA,1/30/2001,NA,yes,NA,NA,NA,NA,NA,485,61,NA,yes,yes,NA,NA,NA,https://www.who.int/csr/don/2001_02_20/en/,DON-2001-02-20
2000-Cholera-ZAF,5,2001,2/23/2001,Cholera,South Africa,South Africa,ZAF,"Empangeni area, Lower Umfolozi districts, Eshowe/Nkandla area, KwaDukuza/Stanger area, Ugu Region/South Coast, Pietermaritzburg/Ndlovu",mid-August 2000,NA,2/22/2001,NA,NA,NA,NA,NA,NA,NA,NA,56092,120,NA,yes,NA,NA,NA,NA,https://www.who.int/csr/don/2001_02_23/en/,DON-2001-02-23
2001-Meningococcal Disease-BEN,1,2001,2/28/2001,Meningococcal disease,NA,Benin,BEN,"Atorca, Borgou",NA,NA,2/17/2001,NA,NA,NA,NA,NA,NA,NA,NA,2239,122,5.4,yes,NA,NA,NA,NA,https://www.who.int/csr/don/2001_02_28/en/,DON-2001-02-28
2001-Meningococcal Disease-BFA,1,2001,2/28/2001,Meningococcal disease,NA,Burkina Faso,BFA,NA,NA,NA,2/17/2001,NA,NA,NA,NA,NA,NA,NA,NA,1555,301,NA,yes,NA,NA,NA,NA,https://www.who.int/csr/don/2001_02_28/en/,DON-2001-02-28
2001-Meningococcal Disease-CMR,1,2001,2/28/2001,Meningococcal disease,NA,Cameroon,CMR,"Wum, Mbenwi",NA,NA,2/19/2001,NA,NA,yes,NA,NA,NA,NA,NA,270,17,NA,yes,NA,NA,NA,NA,https://www.who.int/csr/don/2001_02_28/en/,DON-2001-02-28
2001-Meningococcal Disease-TCD,1,2001,2/28/2001,Meningococcal disease,NA,Chad,TCD,"Logone Occidental, Moyen Chari",NA,NA,2/22/2001,NA,NA,NA,NA,NA,NA,NA,NA,1257,156,NA,yes,NA,NA,NA,NA,https://www.who.int/csr/don/2001_02_28/en/,DON-2001-02-28
2001-Meningococcal Disease-ETH,1,2001,2/28/2001,Meningococcal disease,NA,Ethiopia,ETH,"Amhara, Southern, Gambella, Somali, Tigray, Diredawa Regional Administration, Oromia",NA,NA,2/14/2001,NA,NA,NA,NA,NA,NA,NA,NA,1004,99,9.9,yes,NA,NA,NA,NA,https://www.who.int/csr/don/2001_02_28/en/,DON-2001-02-28
2000-Ebola-UGA,2,2001,2/28/2001,Ebola haemorrhagic fever,NA,Uganda,UGA,Gulu,NA,NA,NA,10/8/2000,NA,yes,2/28/2001,NA,NA,NA,NA,NA,224,NA,yes,NA,NA,NA,NA,https://www.who.int/csr/don/2001_02_28b/en/,DON-2001-02-28b
2001-Yellow Fever-BRA,6,2001,2/28/2001,Yellow fever,NA,Brazil,BRA,"Bom Despacho, Leandro Ferreira, Martinho Campos, Nova Serrana, Santo Antônio do Monte",NA,NA,NA,yes,NA,yes,NA,NA,6,NA,NA,9,6,NA,yes,NA,NA,NA,NA,https://www.who.int/csr/don/2001_02_28a/en/,DON-2001-02-28a
2000-Cholera-ZAF,5,2001,3/5/2001,Cholera,NA,South Africa,ZAF,"Empangeni area, Lower Umfolozi districts, Eshowe/Nkandla area, KwaDukuza/Stanger area, Ugu Region/South Coast, Pietermaritzburg/Ndlovu",mid-August 2000,NA,3/3/2001,NA,NA,NA,NA,NA,NA,NA,NA,62607,131,NA,yes,yes,NA,NA,NA,https://www.who.int/csr/don/2001_03_05/en/,DON-2001-03-05
2001-Yellow Fever-BRA,6,2001,3/7/2001,Yellow fever,NA,Brazil,BRA,"Minas Gerais (Leandro Ferreira, Martinho Campos, Nova Serrana, Moema, Bom Despacho, Conceiçao do Pará and Santo Antônio do Monte), Rondonia, Goiás, Bahia,",NA,NA,NA,3/6/2001,NA,yes,NA,NA,11,NA,35,NA,6,NA,yes,NA,NA,NA,NA,https://www.who.int/csr/don/2001_03_07/en/,DON-2001-03-07
2001-Meningococcal Disease-TCD,1,2001,3/8/2001,Meningococcal disease,NA,Chad,TCD,"Moyen Chari, Mayo Kebbi",last months 2000,NA,NA,3/4/2001,NA,NA,NA,NA,NA,NA,NA,2317,267,NA,yes,yes,NA,NA,NA,https://www.who.int/csr/don/2001_03_08/en/,DON-2001-03-08
2001-Meningococcal Disease-ETH,1,2001,3/8/2001,Meningococcal disease,NA,Ethiopia,ETH,"40 districts, 8/11 regions",NA,NA,3/2/2001,NA,NA,NA,NA,NA,NA,NA,NA,1348,108,NA,yes,yes,NA,NA,NA,https://www.who.int/csr/don/2001_03_08/en/,DON-2001-03-08
2001-Cholera-ZAF,5,2001,3/16/2001,Cholera,NA,South Africa,ZAF,KwaZulu Natal,NA,NA,NA,3/14/2001,NA,NA,NA,NA,NA,NA,NA,69761,139,NA,yes,yes,NA,NA,NA,https://www.who.int/csr/don/2001_03_16/en/,DON-2001-03-16
2001-Meningococcal Disease-BFA,1,2001,3/16/2001,Meninococcal disease,NA,Burkina Faso,BFA,NA,NA,NA,NA,1/1/2001,NA,NA,NA,NA,NA,NA,NA,3267,552,NA,yes,NA,NA,NA,NA,https://www.who.int/csr/don/2001_03_19a/en/,DON-2001-03-19a
2001-Meningococcal Disease-BEN,1,2001,3/16/2001,Meninococcal disease,NA,Benin,BEN,"Borgou, Atacora",NA,NA,NA,1/1/2001,NA,NA,NA,NA,NA,NA,NA,3643,172,NA,yes,NA,NA,NA,NA,https://www.who.int/csr/don/2001_03_19a/en/,DON-2001-03-19a
2001-Meningococcal Disease-CMR,1,2001,3/16/2001,Meninococcal disease,NA,Cameroon,CMR,"Wum, Mbengwi, Bafut, Bamenda, Ndop",NA,NA,NA,1/1/2001,NA,NA,NA,NA,NA,NA,NA,415,28,NA,yes,NA,NA,NA,NA,https://www.who.int/csr/don/2001_03_19a/en/,DON-2001-03-19a
2001-Meningococcal Disease-ETH,1,2001,3/16/2001,Meninococcal disease,NA,Ethiopia,ETH,"74 districts, 9/11 regions",NA,NA,3/16/2001,NA,NA,NA,NA,NA,NA,NA,NA,2324,148,NA,yes,yes,NA,NA,NA,https://www.who.int/csr/don/2001_03_19a/en/,DON-2001-03-19a
2001-Yellow Fever-BRA,6,2001,3/20/2001,Yellow fever,NA,Brazil,BRA,"Bom Despacho, Conceiçao do Pará, Leandro Ferreira, Luz, Martinho Campos, Nova Serrana, Santo Antônio do Monte and Sao Gotardo",NA,NA,NA,3/13/2001,NA,yes,NA,NA,20,NA,48,NA,9,NA,yes,NA,NA,NA,NA,https://www.who.int/csr/don/2001_03_20/en/,DON-2001-03-20
2001-Plague-ZMB,2,2001,3/20/2001,Plague,NA,Zambia,ZMB,Nyanje area,NA,NA,NA,3/15/2001,NA,yes,NA,NA,NA,NA,436,NA,11,NA,yes,yes,NA,NA,NA,https://www.who.int/csr/don/2001_03_20a/en/,DON-2001-03-20a
2001-Plague-ZMB,2,2001,3/26/2001,Plague,NA,Zambia,ZMB,Petauke,NA,NA,NA,3/15/2001,NA,NA,NA,NA,NA,NA,NA,23,3,NA,yes,yes,NA,NA,NA,https://www.who.int/csr/don/2001_03_26/en/,DON-2001-03-26
2001-Meningococcal Disease-BFA,1,2001,3/27/2001,Meningococcal disease,NA,Burkina Faso,BFA,NA,NA,NA,NA,1/1/2001,NA,NA,NA,NA,NA,NA,NA,4350,719,NA,yes,NA,NA,NA,NA,https://www.who.int/csr/don/2001_03_27/en/,DON-2001-03-27
2001-Meningococcal Disease-TCD,1,2001,3/27/2001,Meningococcal disease,NA,Chad,TCD,"Moyen Chari,  Mayo Kebb, Logone Oriental, Logone Occidental",NA,NA,NA,12/25/2000,NA,NA,NA,NA,NA,NA,NA,3064,337,NA,yes,NA,NA,NA,NA,https://www.who.int/csr/don/2001_03_27/en/,DON-2001-03-27
2001-Meningococcal Disease-NER,1,2001,3/27/2001,Meningococcal disease,NA,Niger,NER,"Gaya, Dosso, Madoua, Communauté Urbaine de Niamey",NA,NA,NA,1/2/2001,NA,NA,NA,NA,NA,NA,NA,1795,137,NA,yes,NA,NA,NA,NA,https://www.who.int/csr/don/2001_03_27/en/,DON-2001-03-27
2000-Cholera-ZAF,5,2001,3/28/2001,Cholera,NA,South Africa,ZAF,"Empangeni area, Lower Umfolozi districts, Eshowe/Nkandla area, Ulundi , KwaDukuza/Stanger area, Ugu Region/South Coast.",mid-August 2000,NA,3/27/2001,NA,NA,NA,NA,NA,NA,NA,NA,78140,163,NA,yes,yes,NA,NA,NA,https://www.who.int/csr/don/2001_03_28/en/,DON-2001-03-28
2001-Meningococcal Disease-BFA,1,2001,4/5/2001,Meningococcal disease,NA,Burkina Faso,BFA,NA,NA,NA,NA,1/1/2001,NA,NA,NA,NA,NA,NA,NA,7751,1137,NA,yes,NA,NA,NA,NA,https://www.who.int/csr/don/2001_04_05/en/,DON-2001-04-05
2001-Meningococcal Disease-BEN,1,2001,4/5/2001,Meningococcal disease,NA,Benin,BEN,"Borgou, Atacora",NA,NA,NA,1/1/2001,NA,NA,NA,NA,NA,NA,NA,6147,265,NA,yes,NA,NA,NA,NA,https://www.who.int/csr/don/2001_04_05/en/,DON-2001-04-05
2001-Meningococcal Disease-TCD,1,2001,4/5/2001,Meningococcal disease,NA,Chad,TCD,"Moyen Chari, Mayo Kebb, Logone Oriental, Logone Occidental",NA,NA,NA,12/25/2000,NA,NA,NA,NA,NA,NA,NA,3579,401,NA,yes,NA,NA,NA,NA,https://www.who.int/csr/don/2001_04_05/en/,DON-2001-04-05
2001-Meningococcal Disease-CAF,1,2001,4/5/2001,Meningococcal disease,NA,Central African Republic,CAF,Paoua,NA,NA,NA,2/18/2001,NA,NA,NA,NA,NA,NA,NA,1816,343,NA,yes,NA,NA,NA,NA,https://www.who.int/csr/don/2001_04_05/en/,DON-2001-04-05
2001-Meningococcal Disease-ETH,1,2001,4/5/2001,Meningococcal disease,NA,Ethiopia,ETH,NA,NA,NA,NA,3/24/2001,NA,NA,NA,NA,NA,NA,NA,3521,197,NA,yes,NA,NA,NA,NA,https://www.who.int/csr/don/2001_04_05/en/,DON-2001-04-05
2001-Meningococcal Disease-GMB,1,2001,4/5/2001,Meningococcal disease,NA,Gambia,GMB,Upper River Division,NA,NA,NA,11/??/2000,NA,NA,NA,NA,NA,NA,NA,137,21,NA,yes,NA,NA,NA,NA,https://www.who.int/csr/don/2001_04_05/en/,DON-2001-04-05
2001-Meningococcal Disease-ETH,1,2001,4/9/2001,Meningococcal disease,NA,Ethiopia,ETH,NA,NA,NA,NA,NA,NA,NA,NA,NA,NA,NA,NA,NA,NA,NA,NA,NA,NA,NA,external link that doesn't work,https://www.who.int/csr/don/2001_04_09/en/,DON-2001-04-09
2000-Cholera-ZAF,5,2001,4/17/2001,Cholera,NA,South Africa,ZAF,"Empangeni area, Lower Umfolozi, Eshowe/Nkandla area, Ulundi area, Stanger/Untunjambili area, Ugu Region/South Coast.",mid-August 2000,NA,4/16/2001,NA,NA,NA,NA,NA,NA,NA,NA,86107,181,NA,NA,NA,NA,NA,NA,https://www.who.int/csr/don/2001_04_17/en/,DON-2001-04-17
2001-Meningococcal Disease-BFA,1,2001,4/23/2001,Meningococcal disease,NA,Burkina Faso,BFA,NA,NA,NA,NA,1/1/2001,NA,NA,NA,NA,NA,NA,NA,10897,1525,NA,yes,NA,NA,NA,NA,https://www.who.int/csr/don/2001_04_23/en/,DON-2001-04-23
2001-Meningococcal Disease-BEN,1,2001,4/23/2001,Meningococcal disease,NA,Benin,BEN,"Borgou, Atacora, Donga, Alibori",NA,NA,NA,1/1/2001,NA,NA,NA,NA,NA,NA,NA,7532,300,NA,NA,NA,NA,NA,NA,https://www.who.int/csr/don/2001_04_23/en/,DON-2001-04-23
2001-Meningococcal Disease-CAF,1,2001,4/23/2001,Meningococcal disease,NA,Central African Republic,CAF,Ouham Pende,NA,NA,NA,2/18/2001,NA,NA,NA,NA,NA,NA,NA,1816,343,NA,yes,NA,NA,NA,NA,https://www.who.int/csr/don/2001_04_23/en/,DON-2001-04-23
2001-Meningococcal Disease-TCD,1,2001,4/23/2001,Meningococcal disease,NA,Chad,TCD,"Moyen Chari, Mayo Kebb, Logone Oriental, Logone Occidental",NA,NA,NA,12/25/2000,NA,NA,NA,NA,NA,NA,NA,5780,607,NA,yes,NA,NA,NA,NA,https://www.who.int/csr/don/2001_04_23/en/,DON-2001-04-23
2001-Meningococcal Disease-ETH,1,2001,4/23/2001,Meningococcal disease,NA,Ethiopia,ETH,NA,NA,NA,NA,3/31/2001,NA,NA,NA,NA,NA,NA,NA,4138,242,NA,yes,NA,NA,NA,NA,https://www.who.int/csr/don/2001_04_23/en/,DON-2001-04-23
2001-Meningococcal Disease-NER,1,2001,4/23/2001,Meningococcal disease,NA,Niger,NER,"Gay, Boboye, Doutchi, Madoua",NA,NA,NA,1/2/2001,NA,NA,NA,NA,NA,NA,NA,4014,321,NA,yes,NA,NA,NA,NA,https://www.who.int/csr/don/2001_04_23/en/,DON-2001-04-23
2001-Meningococcal Disease-BFA,1,2001,4/27/2001,"Meningococcal disease, serogroup W135",NA,Burkina Faso,BFA,NA,NA,NA,NA,yes,NA,yes,NA,NA,NA,NA,NA,4,NA,NA,NA,NA,NA,NA,NA,https://www.who.int/csr/don/2001_04_27/en/,DON-2001-04-27
2001-Meningococcal Disease-CAF,1,2001,4/27/2001,"Meningococcal disease, serogroup W135",NA,Central African Republic,CAF,NA,NA,NA,NA,yes,NA,yes,NA,NA,3,NA,NA,NA,NA,NA,NA,NA,yes,NA,NA,https://www.who.int/csr/don/2001_04_27/en/,DON-2001-04-27
2001-Meningococcal Disease-FRA,1,2001,4/27/2001,"Meningococcal disease, serogroup W135",NA,France,FRA,NA,NA,NA,NA,yes,NA,yes,NA,NA,NA,NA,NA,2,0,NA,NA,NA,yes,NA,NA,https://www.who.int/csr/don/2001_04_27/en/,DON-2001-04-27
2001-Meningococcal Disease-NOR,1,2001,4/27/2001,"Meningococcal disease, serogroup W135",NA,Norway,NOR,NA,NA,NA,NA,yes,NA,yes,NA,NA,NA,NA,NA,4,0,NA,NA,NA,yes,NA,NA,https://www.who.int/csr/don/2001_04_27/en/,DON-2001-04-27
2001-Meningococcal Disease-SAU,1,2001,4/27/2001,"Meningococcal disease, serogroup W135",NA,Saudi Arabia,SAU,NA,NA,NA,NA,2/9/2001,NA,yes,NA,NA,NA,NA,NA,109,35,NA,yes,NA,yes,NA,NA,https://www.who.int/csr/don/2001_04_27/en/,DON-2001-04-27
2001-Meningococcal Disease-SGP,1,2001,4/27/2001,"Meningococcal disease, serogroup W135",NA,Singapore,SGP,NA,01/??/2001,NA,NA,yes,NA,yes,NA,NA,NA,NA,NA,4,0,NA,NA,NA,yes,NA,NA,https://www.who.int/csr/don/2001_04_27/en/,DON-2001-04-27
2001-Meningococcal Disease-GBR,1,2001,4/27/2001,"Meningococcal disease, serogroup W135",NA,United Kingdom,GBR,NA,01/??/2001,NA,NA,yes,NA,yes,NA,NA,28,NA,NA,NA,7,NA,NA,NA,yes,NA,NA,https://www.who.int/csr/don/2001_04_27/en/,DON-2001-04-27
2001-Meningococcal Disease-BFA,1,2001,5/16/2001,"Meningococcal disease, serogroup W135",NA,Burkina Faso,BFA,NA,NA,NA,NA,yes,NA,yes,NA,NA,NA,NA,NA,4,NA,NA,NA,NA,NA,NA,NA,https://www.who.int/csr/don/2001_05_16/en/,DON-2001-05-16
2001-Meningococcal Disease-CAF,1,2001,5/16/2001,"Meningococcal disease, serogroup W135",NA,Central African Republic,CAF,NA,NA,NA,NA,yes,NA,yes,NA,NA,NA,NA,NA,3,NA,NA,NA,NA,yes,NA,NA,https://www.who.int/csr/don/2001_05_16/en/,DON-2001-05-16
2001-Meningococcal Disease-DNK,1,2001,5/16/2001,"Meningococcal disease, serogroup W135",NA,Denmark,DNK,NA,NA,NA,NA,yes,NA,yes,NA,NA,NA,NA,NA,2,NA,NA,NA,NA,yes,NA,NA,https://www.who.int/csr/don/2001_05_16/en/,DON-2001-05-16
2001-Meningococcal Disease-FRA,1,2001,5/16/2001,"Meningococcal disease, serogroup W135",NA,France,FRA,NA,NA,NA,NA,yes,NA,yes,NA,NA,NA,NA,NA,2,NA,NA,NA,NA,yes,NA,NA,https://www.who.int/csr/don/2001_05_16/en/,DON-2001-05-16
2001-Meningococcal Disease-NOR,1,2001,5/16/2001,"Meningococcal disease, serogroup W135",NA,Norway,NOR,NA,NA,NA,NA,yes,NA,yes,NA,NA,NA,NA,NA,4,NA,NA,NA,NA,yes,NA,NA,https://www.who.int/csr/don/2001_05_16/en/,DON-2001-05-16
2001-Meningococcal Disease-SAU,1,2001,5/16/2001,"Meningococcal disease, serogroup W135",NA,Saudi Arabia,SAU,NA,NA,NA,NA,2/9/2001,NA,yes,NA,NA,NA,NA,NA,109,35,NA,yes,NA,yes,NA,NA,https://www.who.int/csr/don/2001_05_16/en/,DON-2001-05-16
2001-Meningococcal Disease-SGP,1,2001,5/16/2001,"Meningococcal disease, serogroup W135",NA,Singapore,SGP,NA,01/??/2001,NA,NA,yes,NA,yes,NA,NA,NA,NA,NA,4,1,NA,NA,NA,yes,NA,NA,https://www.who.int/csr/don/2001_05_16/en/,DON-2001-05-16
2001-Meningococcal Disease-GBR,1,2001,5/16/2001,"Meningococcal disease, serogroup W135",NA,United Kingdom,GBR,NA,NA,NA,NA,yes,NA,yes,NA,NA,NA,NA,NA,41,11,NA,NA,NA,yes,NA,NA,https://www.who.int/csr/don/2001_05_16/en/,DON-2001-05-16
2001-H5 Influenza-HKG,3,2001,5/17/2001,H5N1,NA,Hong Kong,HKG,"Yeung Luk Road Market, Fa Yuen Street Market, and the Smithfield Road Market",no,NA,NA,NA,NA,yes,NA,NA,0,NA,NA,0,0,NA,yes,5/16/2001,NA,NA,detected in birds,https://www.who.int/csr/don/2001_05_17/en/,DON-2001-05-17
2001-H5 Influenza-HKG,3,2001,5/18/2001,H5N1,NA,Hong Kong,HKG,NA,no,NA,NA,NA,NA,yes,NA,NA,0,NA,NA,0,0,NA,yes,NA,NA,NA,NA,https://www.who.int/csr/don/2001_05_18/en/,DON-2001-05-18
2001-Meningococcal Disease-ETH,1,2001,5/25/2001,Meningococcal disease,NA,Ethiopia,ETH,10/11 regions,NA,NA,NA,yes,NA,NA,NA,NA,NA,NA,NA,5636,392,NA,yes,NA,NA,NA,NA,https://www.who.int/csr/don/2001_05_25/en/,DON-2001-05-25
2001-Encephalitis-BGD,7,2001,5/25/2001,Acute neurological syndrom,NA,Bangladesh,BGD,Meherpur,NA,NA,NA,4/26/2001,NA,NA,NA,NA,NA,NA,NA,28,9,NA,yes,NA,NA,NA,NA,https://www.who.int/csr/don/2001_05_25a/en/,DON-2001-05-25a
2001-Encephalitis-BGD,7,2001,5/30/2001,Acute neurological syndrom,NA,Bangladesh,BGD,Meherpur,NA,NA,NA,NA,NA,NA,NA,NA,NA,NA,NA,NA,NA,NA,5/28/2001,NA,NA,NA,NA,https://www.who.int/csr/don/2001_05_30/en/,DON-2001-05-30
2001-Yellow Fever-CIV,6,2001,5/31/2001,Yellow fever,NA,Cote d'Ivoire,CIV,"Danané, Duekoué",NA,NA,NA,yes,yes,yes,NA,NA,NA,NA,NA,4,3,NA,yes,NA,NA,NA,NA,https://www.who.int/csr/don/2001_05_31/en/,DON-2001-05-31
2001-Encephalitis-BGD,7,2001,6/5/2001,Acute neurological syndrom,NA,Bangladesh,BGD,Meherpur,4/26/2001,NA,NA,NA,NA,NA,NA,NA,NA,NA,NA,NA,NA,NA,yes,NA,NA,NA,NA,https://www.who.int/csr/don/2001_06_05e/en/,DON-2001-06-05e
2001-Yellow Fever-PER,6,2001,6/7/2001,Yellow fever,NA,Peru,PER,"Puinahua, San Pablo, Iquitos",NA,NA,NA,yes,NA,yes,NA,NA,8,NA,NA,20,2,NA,yes,NA,NA,NA,NA,https://www.who.int/csr/don/2001_06_07e/en/,DON-2001-06-07e
2001-CCHF-XKO,6,2001,6/8/2001,Acute haemorrhagic fever syndrome,NA,Kosovo,XKO,south-western area,NA,NA,NA,5/18/2001,NA,NA,NA,NA,NA,NA,NA,27,4,NA,yes,NA,NA,NA,NA,https://www.who.int/csr/don/2001_06_08e/en/,DON-2001-06-08e
2001-CCHF-XKO,6,2001,6/11/2001,Crimean-Congo haemorrhagic fever,NA,Kosovo,XKO,NA,NA,NA,NA,NA,NA,6/9/2001,NA,NA,NA,NA,NA,NA,NA,NA,yes,NA,NA,NA,NA,https://www.who.int/csr/don/2001_06_11e/en/,DON-2001-06-11e
2001-Meningococcal Disease-ETH,1,2001,6/14/2001,Meningococcal disease,NA,Ethiopia,ETH,10/11 regions,NA,NA,NA,5/31/2001,NA,NA,NA,NA,NA,NA,NA,6266,311,5,yes,NA,NA,NA,NA,https://www.who.int/csr/don/2001_06_14/en/,DON-2001-06-14
2001-CCHF-XKO,6,2001,6/14/2001,Crimean-Congo haemorrhagic fever,NA,Kosovo,XKO,NA,NA,NA,yes,NA,NA,yes,NA,NA,12,NA,NA,44,NA,NA,yes,NA,NA,NA,NA,https://www.who.int/csr/don/2001_06_14a/en/,DON-2001-06-14a
2001-CCHF-XKO,6,2001,6/15/2001,Crimean-Congo haemorrhagic fever,NA,Kosovo,XKO,NA,NA,NA,yes,NA,NA,NA,NA,NA,NA,NA,NA,48,NA,NA,NA,NA,NA,NA,NA,https://www.who.int/csr/don/2001_06_15e/en/,DON-2001-06-15e
2001-CCHF-XKO,6,2001,6/20/2001,Crimean-Congo haemorrhagic fever,NA,Kosovo,XKO,NA,NA,NA,5/18/2001,NA,NA,yes,NA,NA,12,NA,NA,57,NA,NA,yes,yes,NA,NA,NA,https://www.who.int/csr/don/2001_06_20e/en/,DON-2001-06-20e
2001-Meningococcal Disease-BFA,1,2001,6/22/2001,"Meningococcal disease, serogroup W135",NA,Burkina Faso,BFA,NA,NA,NA,NA,NA,NA,yes,NA,NA,14,NA,NA,NA,NA,NA,yes,NA,no,NA,NA,https://www.who.int/csr/don/2001_06_22e/en/,DON-2001-06-22e
2001-Meningococcal Disease-NER,1,2001,6/22/2001,"Meningococcal disease, serogroup W135",NA,Niger,NER,NA,NA,NA,NA,NA,NA,yes,NA,NA,10,NA,NA,NA,NA,NA,yes,NA,no,NA,NA,https://www.who.int/csr/don/2001_06_22e/en/,DON-2001-06-22e
2001-Meningococcal Disease-CAF,1,2001,6/22/2001,"Meningococcal disease, serogroup W135",NA,Central African Republic,CAF,NA,NA,NA,NA,yes,NA,yes,NA,NA,NA,NA,NA,3,NA,NA,NA,NA,yes,NA,NA,https://www.who.int/csr/don/2001_06_22e/en/,DON-2001-06-22e
2001-Meningococcal Disease-DNK,1,2001,6/22/2001,"Meningococcal disease, serogroup W135",NA,Denmark,DNK,NA,NA,NA,NA,yes,NA,yes,NA,NA,NA,NA,NA,2,NA,NA,NA,NA,yes,NA,NA,https://www.who.int/csr/don/2001_06_22e/en/,DON-2001-06-22e
2001-Meningococcal Disease-FRA,1,2001,6/22/2001,"Meningococcal disease, serogroup W135",NA,France,FRA,NA,NA,NA,NA,yes,NA,yes,NA,NA,NA,NA,NA,2,NA,NA,NA,NA,yes,NA,NA,https://www.who.int/csr/don/2001_06_22e/en/,DON-2001-06-22e
2001-Meningococcal Disease-NOR,1,2001,6/22/2001,"Meningococcal disease, serogroup W135",NA,Norway,NOR,NA,NA,NA,NA,yes,NA,yes,NA,NA,NA,NA,NA,4,NA,NA,NA,NA,yes,NA,NA,https://www.who.int/csr/don/2001_06_22e/en/,DON-2001-06-22e
2001-Meningococcal Disease-SAU,1,2001,6/22/2001,"Meningococcal disease, serogroup W135",NA,Saudi Arabia,SAU,NA,NA,NA,NA,2/9/2001,NA,yes,NA,NA,NA,NA,NA,109,35,NA,yes,NA,yes,NA,NA,https://www.who.int/csr/don/2001_06_22e/en/,DON-2001-06-22e
2001-Meningococcal Disease-SGP,1,2001,6/22/2001,"Meningococcal disease, serogroup W135",NA,Singapore,SGP,NA,01/??/2001,NA,NA,yes,NA,yes,NA,NA,NA,NA,NA,4,1,NA,NA,NA,yes,NA,NA,https://www.who.int/csr/don/2001_06_22e/en/,DON-2001-06-22e
2001-Meningococcal Disease-GBR,1,2001,6/22/2001,"Meningococcal disease, serogroup W135",NA,United Kingdom,BGR,NA,NA,NA,NA,yes,NA,yes,NA,NA,NA,NA,NA,41,11,NA,NA,NA,yes,NA,NA,https://www.who.int/csr/don/2001_06_22e/en/,DON-2001-06-22e
2001-CCHF-XKO,6,2001,6/29/2001,Crimean-Congo haemorrhagic fever,NA,Kosovo,XKO,NA,NA,NA,NA,6/26/2001,NA,yes,NA,NA,18,NA,69,NA,6,NA,yes,NA,NA,NA,NA,https://www.who.int/csr/don/2001_06_29e/en/,DON-2001-06-29e
2001-Meningococcal Disease-FRA,1,2001,7/3/2001,"Meningococcal disease, serogroup W135",NA,France,FRA,NA,NA,NA,NA,yes,NA,yes,NA,NA,NA,NA,NA,6,NA,NA,NA,NA,yes,NA,NA,https://www.who.int/csr/don/2001_07_03/en/,DON-2001-07-03
2001-Legionellosis-ESP,5,2001,7/12/2001,Legionellosis,NA,Spain,ESP,Murcia,NA,7/1/2001,7/11/2001,NA,NA,yes,NA,NA,178,NA,NA,470,1,NA,yes,NA,NA,NA,NA,https://www.who.int/csr/don/2001_07_12/en/,DON-2001-07-12
2001-Legionellosis-ESP,5,2001,7/18/2001,Legionellosis,NA,Spain,ESP,Murcia,NA,7/1/2001,7/18/2001,NA,NA,yes,NA,NA,310,NA,NA,751,2,NA,yes,NA,NA,NA,NA,https://www.who.int/csr/don/2001_07_18/en/,DON-2001-07-18
2001-Cholera-TZA,5,2001,7/26/2001,Cholera,NA,Tanzania,TZA,"Temeke, Ilala districts",NA,NA,NA,5/18/2001,NA,NA,NA,NA,NA,NA,NA,109,3,NA,yes,yes,NA,NA,NA,https://www.who.int/csr/don/2001_07_26/en/,DON-2001-07-26
2001-Cholera-AFG,5,2001,7/26/2001,Cholera,NA,Afghanistan,AFG,"Khulm, Aibak, Faizabad, Kunduz",NA,NA,NA,7/25/2001,NA,NA,NA,NA,NA,NA,NA,4499,114,NA,yes,NA,NA,NA,NA,https://www.who.int/csr/don/2001_07_26b/en/,DON-2001-07-26b
2001-Cholera-TCD,5,2001,7/26/2001,Cholera,NA,Chad,TCD,"N'djamena, Massakory, Bongo, Moundou",NA,NA,NA,7/25/2001,NA,NA,NA,NA,NA,NA,NA,608,20,NA,yes,yes,NA,NA,NA,https://www.who.int/csr/don/2001_07_26a/en/,DON-2001-07-26a
2001-Cholera-TCD,5,2001,8/6/2001,Cholera,NA,Chad,TCD,"N'djamena, Massakory, Bongo, Bol",NA,NA,NA,8/3/2001,NA,NA,NA,NA,NA,NA,NA,1111,33,NA,yes,yes,NA,NA,NA,https://www.who.int/csr/don/2001_08_06/en/,DON-2001-08-06
2001-Cholera-IND,5,2001,8/14/2001,Cholera,NA,India,IND,Orissa,NA,NA,7/7/2001,NA,NA,yes,NA,NA,NA,NA,NA,34111,33,NA,yes,NA,NA,NA,NA,https://www.who.int/csr/don/2001_08_14/en/,DON-2001-08-14
2001-Cholera-TCD,5,2001,8/12/2001,Cholera,NA,Chad,TCD,"south-west,N'djamena",NA,NA,NA,8/12/2001,NA,NA,NA,NA,NA,NA,NA,1959,83,4.2,yes,NA,NA,NA,NA,https://www.who.int/csr/don/2001_08_15/en/,DON-2001-08-15
2001-Meningococcal Disease-AGO,1,2001,8/15/2001,Meningococcal disease,NA,Angola,AGO,Balombo district,NA,NA,NA,third week May 2001,NA,yes,NA,NA,NA,NA,NA,77,17,22,8/13/2001,NA,NA,NA,NA,https://www.who.int/csr/don/2001_08_15a/en/,DON-2001-08-15a
2001-Cholera-TCD,5,2001,8/22/2001,Cholera,NA,Chad,TCD,south-west,NA,NA,NA,8/21/2001,NA,NA,NA,NA,NA,NA,NA,2458,88,3.5,yes,yes,NA,NA,NA,https://www.who.int/csr/don/2001_08_22/en/,DON-2001-08-22
2001-Yellow Fever-LBR,6,2001,8/23/2001,Yellow fever,NA,Liberia,LBR,Maryland county,8/1/2001,NA,NA,NA,NA,yes,NA,NA,1,NA,2,3,3,NA,yes,NA,NA,NA,NA,https://www.who.int/csr/don/2001_08_23/en/,DON-2001-08-23
2001-Yellow Fever-CIV,6,2001,9/4/2001,Yellow fever,NA,Cote d'Ivoire,CIV,Abidjan,NA,NA,NA,yes,NA,yes,NA,NA,20,NA,108,128,14,NA,yes,NA,NA,NA,NA,https://www.who.int/csr/don/2001_09_04/en/,DON-2001-09-04
2001-Cholera-TCD,5,2001,9/5/2001,Cholera,NA,Chad,TCD,south-west,NA,NA,NA,9/4/2001,NA,NA,NA,NA,NA,NA,NA,3557,113,3.2,yes,NA,NA,NA,NA,https://www.who.int/csr/don/2001_09_05/en/,DON-2001-09-05
2001-Cholera-CMR,5,2001,9/5/2001,Cholera,NA,Cameroon,CMR,north,NA,NA,NA,yes,NA,NA,NA,NA,NA,NA,NA,158,3,NA,NA,NA,NA,NA,NA,https://www.who.int/csr/don/2001_09_05/en/,DON-2001-09-05
2001-Legionellosis-NOR,5,2001,9/5/2001,Legionellosis,NA,Norway,NOR,Stavanger,7/26/2001,NA,NA,9/4/2001,NA,yes,NA,NA,17,2,NA,19,2,NA,yes,NA,NA,NA,NA,https://www.who.int/csr/don/2001_09_05a/en/,DON-2001-09-05a
2001-Yellow Fever-CIV,6,2001,9/5/2001,Yellow fever,NA,Cote d'Ivoire,CIV,Abidjan,NA,NA,NA,NA,NA,yes,NA,NA,6,NA,14,20,4,NA,yes,yes,NA,NA,WHO press release,https://www.who.int/csr/don/2001_09_05b/en/,DON-2001-09-05b
2001-Yellow Fever-CIV,6,2001,9/12/2001,Yellow fever,NA,Cote d'Ivoire,CIV,Abidjan,NA,NA,NA,NA,NA,NA,NA,NA,NA,NA,NA,NA,NA,NA,9/17/2001,NA,NA,NA,NA,https://www.who.int/csr/don/2001_09_12/en/,DON-2001-09-12
2001-Yellow Fever-CIV,6,2001,9/13/2001,Yellow fever,NA,Cote d'Ivoire,CIV,Abidjan,NA,NA,NA,9/12/2001,NA,NA,NA,NA,NA,NA,143,NA,NA,NA,yes,NA,NA,NA,NA,https://www.who.int/csr/don/2001_09_13/en/,DON-2001-09-13
2001-Meningococcal Disease-AGO,1,2001,9/17/2001,Meningococcal disease,NA,Angola,AGO,"Bolombo, Cunene, Cuando Cubango",05/??/2001,NA,NA,yes,NA,yes,NA,NA,NA,NA,NA,193,24,NA,yes,NA,NA,NA,NA,https://www.who.int/csr/don/2001_09_17/en/,DON-2001-09-17
2001-Cholera-BFA,5,2001,9/17/2001,Cholera,NA,Burkina Faso,BFA,Ourgaye,NA,NA,7/14/2001,NA,NA,yes,NA,NA,NA,NA,NA,55,3,NA,yes,NA,NA,NA,NA,https://www.who.int/csr/don/2001_09_17a/en/,DON-2001-09-17a
2001-Cholera-CIV,5,2001,9/17/2001,Cholera,NA,Cote d'Ivoire,CIV,Abidjan,NA,NA,8/12/2001,NA,NA,NA,NA,NA,NA,NA,NA,897,47,NA,yes,NA,NA,NA,NA,https://www.who.int/csr/don/2001_09_17a/en/,DON-2001-09-17a
2001-Cholera-NER,5,2001,9/17/2001,Cholera,NA,Niger,NER,Fillingué,NA,NA,8/27/2001,NA,NA,yes,NA,NA,NA,NA,NA,13,3,NA,yes,NA,NA,NA,NA,https://www.who.int/csr/don/2001_09_17a/en/,DON-2001-09-17a
2001-Yellow Fever-CIV,6,2001,9/18/2001,Yellow fever,NA,Cote d'Ivoire,CIV,Abidjan,NA,NA,NA,9/17/2001,NA,yes,NA,NA,22,NA,131,153,20,NA,yes,NA,NA,NA,NA,https://www.who.int/csr/don/2001_09_18/en/,DON-2001-09-18
2001-Yellow Fever-CIV,6,2001,9/25/2001,Yellow fever,NA,Cote d'Ivoire,CIV,Abidjan,NA,NA,NA,9/24/2001,NA,yes,NA,NA,22,NA,NA,169,20,NA,9/21/2001,NA,NA,NA,NA,https://www.who.int/csr/don/2001_09_25/en/,DON-2001-09-25
2001-Yellow Fever-GIN,6,2001,9/25/2001,Yellow fever,NA,Guinea,GIN,"Conakry, N'zerekore",NA,NA,NA,9/24/2001,NA,yes,NA,NA,2,NA,27,29,2,NA,yes,NA,NA,NA,NA,https://www.who.int/csr/don/2001_09_25a/en/,DON-2001-09-25a
2001-Cholera-BFA,5,2001,9/26/2001,Cholera,NA,Burkina Faso,BFA,Ourgaye,NA,NA,NA,7/14/2001,NA,yes,NA,NA,NA,NA,NA,314,6,1.9,yes,NA,NA,NA,NA,https://www.who.int/csr/don/2001_09_26/en/,DON-2001-09-26
2001-Cholera-CIV,5,2001,9/26/2001,Cholera,NA,Cote d'Ivoire,CIV,Abidjan,NA,NA,NA,05/??/2001,NA,NA,NA,NA,NA,NA,NA,3152,175,NA,yes,NA,NA,NA,NA,https://www.who.int/csr/don/2001_09_26/en/,DON-2001-09-26
2001-Cholera-GIN,5,2001,9/26/2001,Cholera,NA,Guinea,GIN,N'zerekore,NA,NA,8/6/2001,NA,NA,NA,NA,NA,NA,NA,NA,155,12,NA,yes,yes,NA,NA,NA,https://www.who.int/csr/don/2001_09_26/en/,DON-2001-09-26
2001-Yellow Fever-CIV,6,2001,10/2/2001,Yellow fever,NA,Cote d'Ivoire,CIV,Abidjan,NA,NA,NA,9/29/2001,NA,yes,NA,NA,23,NA,151,174,20,NA,yes,NA,NA,NA,NA,https://www.who.int/csr/don/2001_10_02/en/,DON-2001-10-02
2001-Anthrax-USA,4,2001,10/10/2001,Anthrax,NA,United States,USA,"Boca Raton,Florida",NA,NA,NA,yes,NA,yes,NA,NA,2,NA,NA,2,1,NA,yes,NA,NA,NA,NA,https://www.who.int/csr/don/2001_10_10/en/,DON-2001-10-10
2001-Meningococcal Disease-AGO,1,2001,10/10/2001,Meningococcal disease,NA,Angola,AGO,"Benguela, Cunene, Luanda, Lunda Sul, Cuando Cubango",NA,NA,NA,10/2/2001,NA,NA,NA,NA,NA,NA,NA,332,30,NA,yes,NA,NA,NA,NA,https://www.who.int/csr/don/2001_10_10c/en/,DON-2001-10-10c
2001-Meningococcal Disease-COD,1,2001,10/10/2001,Meningococcal disease,NA,Democratic Republic of the Congo,COD,Katana health zone,NA,NA,NA,yes,NA,NA,NA,NA,NA,NA,NA,283,27,9.54,yes,yes,NA,NA,NA,https://www.who.int/csr/don/2001_10_10b/en/,DON-2001-10-10b
2001-Yellow Fever-CIV,6,2001,10/10/2001,Yellow fever,NA,Cote d'Ivoire,CIV,20 districts,NA,NA,NA,10/8/2001,NA,yes,NA,NA,23,NA,180,201,21,NA,9/21/2001,NA,NA,NA,NA,https://www.who.int/csr/don/2001_10_10a/en/,DON-2001-10-10a
2001-Anthrax-USA,4,2001,10/11/2001,Anthrax,NA,United States,USA,Florida,NA,NA,NA,10/11/2001,NA,yes,NA,NA,3,NA,NA,3,1,NA,NA,NA,NA,NA,NA,https://www.who.int/csr/don/2001_10_11/en/,DON-2001-10-11
2001-Anthrax-USA,4,2001,10/15/2001,Anthrax,NA,United States,USA,NA,NA,NA,NA,NA,NA,NA,NA,NA,NA,NA,NA,NA,NA,NA,yes,NA,NA,NA,NA,https://www.who.int/csr/don/2001_10_15/en/,DON-2001-10-15
2001-Anthrax-USA,4,2001,10/17/2001,Anthrax,NA,United States,USA,NA,NA,NA,NA,NA,NA,NA,NA,NA,NA,NA,NA,NA,NA,NA,yes,NA,NA,NA,NA,https://www.who.int/csr/don/2001_10_17/en/,DON-2001-10-17
2001-Anthrax-USA,4,2001,10/18/2001,Anthrax,NA,United States,USA,NA,NA,NA,NA,NA,NA,NA,NA,NA,NA,NA,NA,NA,NA,NA,yes,10/18/2001,NA,NA,NA,https://www.who.int/csr/don/2001_10_18/en/,DON-2001-10-18
2001-Anthrax-USA,4,2001,10/19/2001,Anthrax,NA,United States,USA,NA,NA,NA,NA,NA,NA,NA,NA,NA,NA,NA,NA,NA,NA,NA,yes,NA,NA,NA,NA,https://www.who.int/csr/don/2001_10_19/en/,DON-2001-10-19
2001-Anthrax-USA,4,2001,10/22/2001,Anthrax,NA,United States,USA,NA,NA,NA,NA,NA,NA,NA,NA,NA,NA,NA,NA,NA,NA,NA,yes,NA,NA,NA,NA,https://www.who.int/csr/don/2001_10_22/en/,DON-2001-10-22
2001-Meningococcal Disease-COD,1,2001,10/22/2001,Meningococcal disease,NA,Democratic Republic of the Congo,COD,Katana health zone,NA,NA,NA,10/16/2001,NA,yes,NA,NA,NA,NA,NA,378,32,8.46,yes,yes,NA,NA,NA,https://www.who.int/csr/don/2001_10_22a/en/,DON-2001-10-22a
2001-Anthrax-USA,4,2001,10/23/2001,Anthrax,NA,United States,USA,NA,NA,NA,NA,NA,NA,NA,NA,NA,NA,NA,NA,NA,NA,NA,yes,NA,NA,NA,NA,https://www.who.int/csr/don/2001_10_23/en/,DON-2001-10-23
2001-Anthrax-USA,4,2001,10/24/2001,Anthrax,NA,United States,USA,NA,NA,NA,NA,NA,NA,NA,NA,NA,NA,NA,NA,NA,NA,NA,yes,NA,NA,NA,NA,https://www.who.int/csr/don/2001_10_24/en/,DON-2001-10-24
2001-Anthrax-USA,4,2001,10/26/2001,Anthrax,NA,United States,USA,NA,NA,NA,NA,NA,NA,NA,NA,NA,NA,NA,NA,NA,NA,NA,yes,NA,NA,NA,NA,https://www.who.int/csr/don/2001_10_26/en/,DON-2001-10-26
2001-Anthrax-USA,4,2001,10/29/2001,Anthrax,NA,United States,USA,NA,NA,NA,NA,NA,NA,NA,NA,NA,NA,NA,NA,NA,NA,NA,yes,NA,NA,NA,NA,https://www.who.int/csr/don/2001_10_29/en/,DON-2001-10-29
2001-Anthrax-USA,4,2001,10/30/2001,Anthrax,NA,United States,USA,NA,NA,NA,NA,NA,NA,NA,NA,NA,NA,NA,NA,NA,NA,NA,yes,NA,NA,NA,NA,https://www.who.int/csr/don/2001_10_30/en/,DON-2001-10-30
2001-Anthrax-USA,4,2001,10/31/2001,Anthrax,NA,United States,USA,NA,NA,NA,NA,NA,NA,NA,NA,NA,NA,NA,NA,NA,NA,NA,yes,NA,NA,NA,NA,https://www.who.int/csr/don/2001_10_31/en/,DON-2001-10-31
2001-Anthrax-USA,4,2001,11/2/2001,Anthrax,NA,United States,USA,"DC, Florida, New Jersey, New York City",NA,NA,NA,NA,NA,yes,NA,NA,16,NA,5,21,4,NA,10/3/2001,NA,NA,NA,external link,https://www.cdc.gov/mmwr//preview/mmwrhtml/mm5043a1.htm,https://www.cdc.gov/mmwr//preview/mmwrhtml/mm5043a1.htm
2001-Anthrax-USA,4,2001,11/5/2001,Anthrax,NA,United States,USA,NA,NA,NA,NA,11/4/2001,NA,yes,NA,NA,17,NA,NA,22,4,NA,yes,NA,NA,NA,NA,https://www.who.int/csr/don/2001_11_05/en/,DON-2001-11-05
2001-Yellow Fever-BEL,6,2001,11/12/2001,Yellow fever,NA,Belgium,BEL,Gambia (imported),NA,NA,NA,yes,NA,yes,NA,NA,1,NA,NA,1,0,NA,NA,NA,NA,NA,imported,https://www.who.int/csr/don/2001_11_12/en/,DON-2001-11-12
2001-Yellow Fever-BEL,6,2001,11/15/2001,Yellow fever,NA,Belgium,BEL,Gambia (imported),NA,NA,NA,NA,NA,NA,NA,NA,NA,NA,NA,1,1,NA,NA,NA,NA,NA,NA,https://www.who.int/csr/don/2001_11_15/en/,DON-2001-11-15
2001-Anthrax-USA,4,2001,11/23/2001,Anthrax,NA,United States,USA,NA,NA,NA,NA,11/21/2001,NA,yes,NA,NA,18,NA,5,23,5,NA,yes,NA,NA,NA,NA,https://www.who.int/csr/don/2001_11_23/en/,DON-2001-11-23
2001-Cholera-NGA,5,2001,11/27/2001,Cholera,NA,Nigeria,NGA,"Opkoso, Bode Saadu, Kano Metropolis",NA,NA,NA,11/14/2001,NA,NA,NA,NA,NA,NA,NA,724,52,NA,yes,NA,NA,NA,NA,https://www.who.int/csr/don/2001_11_27/en/,DON-2001-11-27
2001-Cholera-NGA,5,2001,12/3/2001,Cholera,NA,Nigeria,NGA,"Kano metropolis, Jigawa state",NA,NA,NA,11/26/2001,NA,NA,NA,NA,NA,NA,NA,2050,80,NA,yes,yes,NA,NA,NA,https://www.who.int/csr/don/2001_12_03/en/,DON-2001-12-03
2001-Ebola-GAB,2,2001,12/5/2001,Viral haemorrhagic fever,NA,Gabon,GAB,Ogooué Ivindo,NA,NA,NA,12/4/2001,NA,NA,NA,NA,NA,NA,NA,NA,7,7,10/5/2001,NA,NA,NA,NA,https://www.who.int/csr/don/2001_12_05/en/,DON-2001-12-05
2001-Meningococcal Disease-SOM,1,2001,12/7/2001,Meningococcal disease,NA,Somalia,SOM,Hargersa,NA,NA,NA,10/13/2001,NA,yes,NA,NA,NA,NA,NA,49,6,NA,yes,NA,NA,NA,NA,https://www.who.int/csr/don/2001_12_07/en/,DON-2001-12-07
2001-Ebola-GAB,2,2001,12/11/2001,Ebola haemorrhagic fever,NA,Gabon,GAB,Ogooué Ivindo,NA,NA,NA,12/11/2001,NA,yes,NA,NA,1,NA,12,NA,10,NA,yes,NA,NA,NA,NA,https://www.who.int/csr/don/2001_12_11/en/,DON-2001-12-11
2001-Ebola-GAB,2,2001,12/12/2001,Ebola haemorrhagic fever,NA,Gabon,GAB,NA,NA,NA,NA,12/12/2001,NA,yes,NA,NA,NA,NA,12,NA,10,NA,yes,12/12/2001,NA,NA,NA,https://www.who.int/csr/don/2001_12_12/en/,DON-2001-12-12
2001-Coccidioidomycosis-GBR,5,2001,12/12/2001,Coccidioidomycosis,NA,United Kingdom,GBR,NA,NA,NA,NA,12/12/2001,NA,yes,NA,NA,1,NA,NA,NA,NA,NA,yes,NA,yes,NA,NA,https://www.who.int/csr/don/2001_12_12a/en/,DON-2001-12-12a
2001-Ebola-GAB,2,2001,12/13/2001,Ebola haemorrhagic fever,NA,Gabon,GAB,NA,NA,NA,NA,12/13/2001,NA,yes,NA,NA,2,NA,12,14,10,NA,yes,yes,NA,NA,NA,https://www.who.int/csr/don/2001_12_13/en/,DON-2001-12-13
2001-Ebola-GAB,2,2001,12/16/2001,Ebola haemorrhagic fever,NA,Gabon,GAB,NA,NA,NA,NA,12/16/2001,NA,yes,NA,NA,2,NA,13,15,12,NA,yes,yes,NA,NA,NA,https://www.who.int/csr/don/2001_12_16/en/,DON-2001-12-16
2001-Ebola-GAB,2,2001,12/17/2001,Ebola haemorrhagic fever,NA,Gabon,GAB,"Makoukou, Zadie",NA,NA,NA,12/17/2001,NA,yes,NA,NA,2,NA,14,16,12,NA,yes,NA,NA,NA,NA,https://www.who.int/csr/don/2001_12_17/en/,DON-2001-12-17
2001-Meningococcal Disease-ETH,1,2001,12/18/2001,Meningococcal disease,NA,Ethiopia,ETH,"Sidama Zone, Dale, Sheedino",NA,NA,NA,9/10/2001,NA,NA,NA,NA,NA,NA,NA,391,37,NA,yes,NA,NA,NA,NA,https://www.who.int/csr/don/2001_12_18/en/,DON-2001-12-18
2001-Ebola-GAB,2,2001,12/18/2001,Ebola haemorrhagic fever,NA,Gabon,GAB,NA,NA,NA,NA,12/18/2001,NA,yes,NA,NA,2,NA,17,19,13,NA,yes,NA,NA,NA,NA,https://www.who.int/csr/don/2001_12_18a/en/,DON-2001-12-18a
2001-Ebola-GAB,2,2001,12/20/2001,Ebola haemorrhagic fever,NA,Gabon,GAB,NA,NA,NA,12/19/2001,NA,NA,yes,NA,NA,25,NA,2,27,15,NA,yes,NA,NA,NA,NA,https://www.who.int/csr/don/2001_12_20/en/,DON-2001-12-20
2001-Ebola-GAB,2,2001,12/24/2001,Ebola haemorrhagic fever,NA,Gabon,GAB,NA,NA,NA,12/23/2001,NA,NA,yes,NA,NA,27,NA,7,NA,18,NA,yes,NA,NA,NA,NA,https://www.who.int/csr/don/2001_12_24/en/,DON-2001-12-24
2001-Ebola-GAB,2,2001,12/28/2001,Ebola haemorrhagic fever,NA,Gabon,GAB,NA,NA,NA,12/27/2001,NA,NA,yes,NA,NA,17,NA,8,NA,20,NA,yes,NA,NA,NA,NA,https://www.who.int/csr/don/2001_12_28/en/,DON-2001-12-28
2001-Ebola-COG,2,2001,12/28/2001,Ebola haemorrhagic fever,NA,Republic of the Congo,COG,NA,NA,NA,12/27/2001,NA,NA,yes,NA,NA,12,NA,NA,NA,NA,NA,yes,NA,NA,NA,NA,https://www.who.int/csr/don/2001_12_28/en/,DON-2001-12-28
2001-Ebola-GAB,2,2001,12/31/2001,Ebola haemorrhagic fever,NA,Gabon,GAB,NA,NA,NA,12/30/2001,NA,NA,yes,NA,NA,18,NA,NA,NA,22,NA,yes,NA,NA,NA,NA,https://www.who.int/csr/don/2001_12_31/en/,DON-2001-12-31
2001-Ebola-COG,2,2001,12/31/2001,Ebola haemorrhagic fever,NA,Republic of the Congo,COG,NA,NA,NA,12/30/2001,NA,NA,yes,NA,NA,12,NA,NA,NA,NA,NA,yes,NA,NA,NA,NA,https://www.who.int/csr/don/2001_12_31/en/,DON-2001-12-31
2001-Ebola-GAB,2,2002,1/2/2002,Ebola haemorrhagic fever,NA,Gabon,GAB,NA,NA,NA,1/1/2002,NA,NA,yes,NA,NA,20,NA,7,NA,17,NA,yes,NA,NA,NA,NA,https://www.who.int/csr/don/2002_01_02/en/,DON-2002-01-02
2001-Ebola-COG,2,2002,1/2/2002,Ebola haemorrhagic fever,NA,Republic of the Congo,COG,NA,NA,NA,1/1/2002,NA,NA,yes,NA,NA,12,NA,2,NA,6,NA,yes,NA,NA,NA,NA,https://www.who.int/csr/don/2002_01_02/en/,DON-2002-01-02
2001-Ebola-GAB,2,2002,1/4/2002,Ebola haemorrhagic fever,NA,Gabon,GAB,NA,NA,NA,1/2/2002,NA,NA,yes,NA,NA,20,NA,8,NA,17,NA,yes,NA,NA,NA,NA,https://www.who.int/csr/don/2002_01_04/en/,DON-2002-01-04
2001-Ebola-COG,2,2002,1/4/2002,Ebola haemorrhagic fever,NA,Republic of the Congo,COG,NA,NA,NA,1/2/2002,NA,NA,yes,NA,NA,12,NA,2,NA,6,NA,yes,NA,NA,NA,NA,https://www.who.int/csr/don/2002_01_04/en/,DON-2002-01-04
2001-Ebola-GAB,2,2002,1/7/2002,Ebola haemorrhagic fever,NA,Gabon,GAB,NA,NA,NA,1/6/2002,NA,NA,yes,NA,NA,20,NA,15,NA,17,NA,yes,yes,NA,NA,NA,https://www.who.int/csr/don/2002_01_07/en/,DON-2002-01-07
2001-Ebola-COG,2,2002,1/7/2002,Ebola haemorrhagic fever,NA,Republic of the Congo,COG,NA,NA,NA,1/6/2002,NA,NA,yes,NA,NA,13,NA,NA,NA,7,NA,yes,NA,NA,NA,NA,https://www.who.int/csr/don/2002_01_07/en/,DON-2002-01-07
2001-Ebola-GAB,2,2002,1/9/2002,Ebola haemorrhagic fever,NA,Gabon,GAB,NA,NA,NA,1/7/2002,NA,NA,yes,NA,NA,21,NA,16,NA,18,NA,yes,NA,NA,NA,NA,https://www.who.int/csr/don/2002_01_09/en/,DON-2002-01-09
2001-Ebola-COG,2,2002,1/9/2002,Ebola haemorrhagic fever,NA,Republic of the Congo,COG,NA,NA,NA,1/7/2002,NA,NA,yes,NA,NA,13,NA,NA,NA,7,NA,yes,NA,NA,NA,NA,https://www.who.int/csr/don/2002_01_09/en/,DON-2002-01-09
2002-Leishmaniasis-PAK,6,2002,1/16/2002,Leshmaniasis,NA,Pakistan,PAK,Kurram Agency,NA,NA,yes,NA,NA,NA,NA,NA,NA,NA,NA,NA,2238,NA,yes,NA,NA,NA,NA,https://www.who.int/csr/don/2002_01_16/en/,DON-2002-01-16
2002-Tularemia-XKO,6,2002,1/17/2002,Tularemia,NA,Kosovo,XKO,NA,11/1/2001,NA,1/17/2002,NA,NA,yes,NA,NA,59,NA,223,282,NA,NA,yes,yes,NA,NA,NA,https://www.who.int/csr/don/2002_01_17/en/,DON-2002-01-17
2001-Meningococcal Disease-SOM,1,2002,1/18/2002,Meningococcal disease,NA,Somalia,SOM,NA,10/??/2001,NA,NA,1/16/2002,NA,yes,NA,NA,64,NA,NA,144,33,NA,yes,yes,NA,NA,NA,https://www.who.int/csr/don/2002_01_18/en/,DON-2002-01-18
2002-Yellow Fever-SEN,6,2002,1/21/2002,Yellow fever,NA,Senegal,SEN,"Diourbel, Ziguinchor",NA,NA,NA,1/18/2002,NA,yes,NA,NA,18,NA,NA,NA,NA,NA,yes,NA,NA,NA,NA,https://www.who.int/csr/don/2002_01_21/en/,DON-2002-01-21
2001-Ebola-GAB,2,2002,1/24/2002,Ebola haemorrhagic fever,NA,Gabon,GAB,NA,NA,NA,NA,1/20/2002,NA,yes,NA,NA,26,NA,NA,NA,23,NA,yes,NA,NA,NA,NA,https://www.who.int/csr/don/2002_01_24/en/,DON-2002-01-24
2001-Ebola-COG,2,2002,1/24/2002,Ebola haemorrhagic fever,NA,Republic of the Congo,COG,NA,NA,NA,1/20/2002,NA,NA,yes,NA,NA,16,NA,NA,NA,11,NA,NA,NA,NA,NA,NA,https://www.who.int/csr/don/2002_01_24/en/,DON-2002-01-24
2002-Tularemia-XKO,6,2002,1/25/2002,Tularemia,NA,Kosovo,XKO,NA,11/1/2001,NA,1/24/2002,NA,NA,yes,NA,NA,109,NA,387,496,0,NA,yes,yes,NA,NA,NA,https://www.who.int/csr/don/2002_01_25/en/,DON-2002-01-25
2001-Meningococcal Disease-SOM,1,2002,1/28/2002,Meningococcal meningitis,NA,Somalia,SOM,NA,NA,NA,NA,NA,NA,NA,NA,NA,NA,NA,NA,NA,NA,NA,1/24/2002,NA,NA,NA,NA,https://www.who.int/csr/don/2002_01_28/en/,DON-2002-01-28
2002-Tularemia-XKO,6,2002,2/6/2002,Tularemia,NA,Kosovo,XKO,NA,11/1/2001,NA,2/5/2002,NA,NA,yes,NA,NA,170,NA,141,715,NA,NA,yes,yes,NA,NA,NA,https://www.who.int/csr/don/2002_02_06/en/,DON-2002-02-06
2001-Ebola-GAB,2,2002,2/7/2002,Ebola haemorrhagic fever,NA,Gabon,GAB,NA,NA,NA,NA,2/5/2002,NA,yes,NA,NA,49,NA,NA,NA,42,NA,NA,NA,NA,NA,NA,https://www.who.int/csr/don/2002_02_07/en/,DON-2002-02-07
2001-Ebola-COG,2,2002,2/7/2002,Ebola haemorrhagic fever,NA,Republic of the Congo,COG,NA,NA,NA,2/1/2002,NA,NA,yes,NA,NA,20,NA,NA,NA,12,NA,NA,NA,NA,NA,NA,https://www.who.int/csr/don/2002_02_07/en/,DON-2002-02-07
2002-H5 Influenza-HKG,3,2002,2/8/2002,Influenze A(H5),NA,Hong Kong,HKG,NA,no,NA,NA,NA,NA,yes,NA,NA,NA,NA,NA,NA,NA,NA,yes,NA,NA,NA,NA,https://www.who.int/csr/don/2002_02_08/en/,DON-2002-02-08
2002-Leishmaniasis-PAK,6,2002,2/12/2002,Leshmaniasis,NA,Pakistan,PAK,"Northwest Fortier Province, Kurram Agency",NA,NA,NA,yes,NA,NA,NA,NA,NA,NA,NA,5000,NA,NA,yes,NA,NA,NA,NA,https://www.who.int/csr/don/2002_02_12/en/,DON-2002-02-12
2002-Meningococcal Disease-COD,1,2002,2/15/2002,Meningococcal disease,NA,Democratic Republic of the Congo,COD,"Katana, Bukavu, Idjwi",08/??/2001,NA,NA,1/2/2002,NA,yes,NA,NA,NA,NA,NA,893,104,NA,yes,yes,NA,NA,NA,https://www.who.int/csr/don/2002_02_15/en/,DON-2002-02-15
2002-Plague-IND,2,2002,2/20/2002,Plague,NA,India,IND,Hat Koti,2/4/2002,NA,NA,2/19/2002,NA,yes,NA,NA,NA,NA,NA,16,4,NA,yes,yes,NA,NA,NA,https://www.who.int/csr/don/2002_02_20/en/,DON-2002-02-20
2002-Meningococcal Disease-ETH,1,2002,2/21/2002,Meningococcal meningitis,NA,Ethiopia,ETH,Southern Nations,NA,NA,NA,2/3/2002,NA,yes,NA,NA,NA,NA,NA,1332,85,NA,yes,NA,NA,NA,NA,https://www.who.int/csr/don/2002_02_21/en/,DON-2002-02-21
2001-Ebola-GAB,2,2002,2/21/2002,Ebola haemorrhagic fever,NA,Gabon,GAB,NA,NA,NA,NA,2/18/2002,NA,yes,NA,NA,55,NA,NA,NA,46,NA,yes,NA,NA,NA,NA,https://www.who.int/csr/don/2002_02_21a/en/,DON-2002-02-21a
2001-Ebola-COG,2,2002,2/21/2002,Ebola haemorrhagic fever,NA,Republic of the Congo,COG,NA,NA,NA,2/15/2002,NA,NA,yes,NA,NA,21,NA,NA,NA,13,NA,NA,NA,NA,NA,NA,https://www.who.int/csr/don/2002_02_21a/en/,DON-2002-02-21a
2001-Ebola-GAB,2,2002,2/25/2002,Ebola haemorrhagic fever,NA,Gabon,GAB,NA,NA,NA,NA,2/23/2002,NA,yes,NA,NA,57,NA,NA,NA,48,NA,yes,NA,NA,NA,NA,https://www.who.int/csr/don/2002_02_25/en/,DON-2002-02-25
2002-Cholera-COD,5,2002,3/5/2002,Cholera,NA,Democratic Republic of the Congo,COD,"Katango province, Lubumbashi, Ankoro, Kabolo, Kongolo and Kalemie",11/??/2001,NA,NA,3/5/2002,NA,NA,NA,NA,NA,NA,NA,5021,407,NA,yes,NA,NA,NA,NA,https://www.who.int/csr/don/2002_03_05/en/,DON-2002-03-05
2001-Ebola-GAB,2,2002,3/6/2002,Ebola haemorrhagic fever,NA,Gabon,GAB,NA,NA,NA,NA,3/4/2002,NA,yes,NA,NA,60,NA,NA,NA,49,NA,yes,NA,NA,NA,NA,https://www.who.int/csr/don/2002_03_06/en/,DON-2002-03-06
2002-Meningococcal Disease-BFA,1,2002,3/7/2002,Meningococcal disease,NA,Burkina Faso,BFA,Diebougou,NA,NA,NA,2/4/2002,NA,NA,NA,NA,NA,NA,NA,201,36,NA,yes,NA,NA,NA,NA,https://www.who.int/csr/don/2002_03_07/en/,DON-2002-03-07
2002-Meningococcal Disease-BFA,1,2002,3/8/2002,Meningococcal disease,NA,Burkina Faso,BFA,"Diebougou, Pama, Pissy, Yako",12/??/2001,NA,NA,3/3/2002,NA,NA,NA,NA,NA,NA,NA,1874,329,NA,yes,NA,NA,NA,NA,https://www.who.int/csr/don/2002_03_08/en/,DON-2002-03-08
2002-Meningococcal Disease-ETH,1,2002,3/8/2002,Meningococcal disease,NA,Ethiopia,ETH,Southern Nations,09/??/2001,NA,NA,3/3/2002,NA,NA,NA,NA,NA,NA,NA,2329,118,NA,yes,NA,NA,NA,NA,https://www.who.int/csr/don/2002_03_08a/en/,DON-2002-03-08a
2001-Ebola-GAB,2,2002,3/14/2002,Ebola haemorrhagic fever,NA,Gabon,GAB,"Ogooue-Invindo province, Makokou, Mekambo",NA,NA,NA,3/12/2002,NA,yes,NA,NA,60,NA,NA,NA,50,NA,yes,NA,NA,NA,NA,https://www.who.int/csr/don/2002_03_14/en/,DON-2002-03-14
2001-Ebola-COG,2,2002,3/14/2002,Ebola haemorrhagic fever,NA,Republic of the Congo,COG,"Cuvette, Ambomi",NA,NA,3/9/2002,NA,NA,yes,NA,NA,31,NA,NA,NA,18,NA,yes,NA,NA,NA,NA,https://www.who.int/csr/don/2002_03_14/en/,DON-2002-03-14
2002-Cholera-COD,5,2002,3/15/2002,Cholera,NA,Democratic Republic of the Congo,COD,Katanga,NA,NA,NA,3/14/2002,NA,NA,NA,NA,NA,NA,NA,6601,502,NA,yes,NA,NA,NA,NA,https://www.who.int/csr/don/2002_03_15/en/,DON-2002-03-15
2002-Meningococcal Disease-BFA,1,2002,3/21/2002,Meningococcal disease,NA,Burkina Faso,BFA,12/15 districts,NA,NA,NA,3/21/2002,NA,yes,NA,NA,NA,NA,NA,3579,544,15,yes,NA,NA,NA,NA,https://www.who.int/csr/don/2002_03_21a/en/,DON-2002-03-21a
2002-Dengue-BRA,6,2002,3/21/2002,Dengue/dengue haemorrhagic fever,NA,Brazil,BRA,Rio de Janeiro State,NA,NA,3/19/2002,NA,NA,NA,NA,NA,NA,NA,NA,104469,40,NA,yes,NA,NA,NA,NA,https://www.who.int/csr/don/2002_03_21/en/,DON-2002-03-21
2001-Ebola-GAB,2,2002,3/22/2002,Ebola haemorrhagic fever,NA,Gabon,GAB,NA,NA,NA,NA,3/20/2002,NA,yes,NA,NA,60,NA,NA,NA,50,NA,yes,NA,NA,NA,NA,https://www.who.int/csr/don/2002_03_22/en/,DON-2002-03-22
2001-Ebola-COG,2,2002,3/22/2002,Ebola haemorrhagic fever,NA,Republic of the Congo,COG,"Cuvette region, Kelle area",NA,NA,3/22/2002,NA,NA,yes,NA,NA,32,NA,NA,NA,19,NA,yes,NA,NA,NA,NA,https://www.who.int/csr/don/2002_03_22/en/,DON-2002-03-22
2002-Cholera-MWI,5,2002,3/26/2002,Cholera,NA,Malawi,MWI,Southern region,10/28/2001,NA,NA,3/9/2002,NA,yes,NA,NA,NA,NA,NA,22023,609,2.8,yes,yes,NA,NA,NA,https://www.who.int/csr/don/2002_03_26/en/,DON-2002-03-26
2002-Enterovirus-GRC,1,2002,4/25/2002,Acute respiratory syndrome,NA,Greece,GRC,NA,NA,NA,NA,3/1/2002,NA,NA,NA,NA,NA,NA,NA,39,3,NA,yes,yes,NA,NA,NA,https://www.who.int/csr/don/2002_04_25/en/,DON-2002-04-25
2002-Enterovirus-GRC,1,2002,4/26/2002,Acute respiratory syndrome,NA,Greece,GRC,NA,NA,NA,NA,yes,NA,yes,NA,NA,NA,NA,NA,NA,NA,NA,yes,NA,NA,NA,enterovirus,https://www.who.int/csr/don/2002_04_26/en/,DON-2002-04-26
2002-Enterovirus-GRC,1,2002,5/3/2002,Acute respiratory syndrome,NA,Greece,GRC,NA,NA,NA,NA,4/29/2002,NA,NA,NA,NA,NA,NA,NA,51,3,NA,yes,NA,NA,NA,NA,https://www.who.int/csr/don/2002_05_03/en/,DON-2002-05-03
2002-Meningococcal Disease-BFA,1,2002,5/6/2002,Meningococcal disease,NA,Burkina Faso,BFA,NA,NA,NA,NA,4/28/2002,NA,NA,NA,NA,NA,NA,NA,11899,1368,11.5,yes,NA,NA,NA,NA,https://www.who.int/csr/don/2002_05_06/en/,DON-2002-05-06
2002-Meningococcal Disease-NER,1,2002,5/6/2002,Meningococcal disease,NA,Niger,NER,Matameye (Zinder),NA,NA,NA,4/21/2002,NA,NA,NA,NA,NA,NA,NA,3518,308,8.8,yes,NA,NA,NA,NA,https://www.who.int/csr/don/2002_05_06/en/,DON-2002-05-06
2002-Dengue-BRA,6,2002,5/8/2002,Dengue/dengue haemorrhagic fever,NA,Brazil,BRA,Rio de Janeiro State,NA,NA,NA,yes,NA,NA,NA,NA,NA,NA,NA,317787,57,NA,NA,NA,NA,NA,NA,https://www.who.int/csr/don/2002_05_08/en/,DON-2002-05-08
2001-Ebola-GAB,2,2002,5/9/2002,Ebola haemorrhagic fever,NA,Gabon,GAB,Ogooué-Ivindo,NA,NA,NA,NA,NA,NA,5/6/2002,NA,NA,NA,NA,NA,NA,NA,NA,NA,NA,NA,NA,https://www.who.int/csr/don/2002_05_09/en/,DON-2002-05-09
2002-Meningococcal Disease-BFA,1,2002,5/17/2002,Meningococcal disease,NA,Burkina Faso,BFA,NA,NA,NA,NA,5/15/2002,NA,yes,NA,NA,NA,NA,NA,12587,1447,NA,yes,NA,NA,NA,NA,https://www.who.int/csr/don/2002_05_17/en/,DON-2002-05-17
2002-Leishmaniasis-AFG,6,2002,5/22/2002,Leishmaniasis,NA,Afghanistan,AFG,Kabul,NA,NA,NA,NA,NA,NA,NA,NA,NA,NA,NA,200000,NA,NA,yes,yes,NA,NA,NA,https://www.who.int/csr/don/2002_05_22/en/,DON-2002-05-22
2002-Plague-MWI,2,2002,6/5/2002,Plague,NA,Malawi,MWI,"Nsanje, Ndamera, Chimombo",4/16/2002,NA,NA,5/27/2002,NA,NA,NA,NA,NA,NA,NA,71,NA,NA,yes,NA,NA,NA,NA,https://www.who.int/csr/don/2002_06_05e/en/,DON-2002-06-05e
2002-Viral Haemorrhagic Fever-COG,2,2002,6/12/2002,Acute haemorrhagic fever syndrome,NA,Republic of the Congo,COG,Mbomo,NA,NA,NA,yes,NA,NA,NA,NA,NA,NA,6,NA,5,NA,yes,NA,NA,NA,NA,https://www.who.int/csr/don/2002_06_12e/en/,DON-2002-06-12e
2002-Viral Haemorrhagic Fever-COG,2,2002,6/19/2002,Acute haemorrhagic fever syndrome,NA,Republic of the Congo,COG,NA,NA,NA,NA,no,NA,no,NA,NA,NA,NA,6,NA,5,NA,yes,NA,NA,yes,NA,https://www.who.int/csr/don/2002_06_19e/en/,DON-2002-06-19e
2002-Dengue-SLV,6,2002,6/21/2002,Dengue/dengue haemorrhagic fever,NA,El Salvador,SLV,"San Salvador, Libertad, Santa Ana, Cabañas",NA,NA,NA,6/15/2002,NA,yes,NA,NA,1301,NA,NA,NA,NA,NA,yes,yes,NA,NA,NA,https://www.who.int/csr/don/2002_06_21e/en/,DON-2002-06-21e
2002-Viral Haemorrhagic Fever-COG,2,2002,6/24/2002,Acute haemorrhagic fever syndrome,NA,Gabon,GAB,"Ekata, Mbomo",NA,NA,NA,6/19/2002,NA,no,NA,NA,NA,NA,2,NA,2,NA,yes,NA,NA,NA,NA,https://www.who.int/csr/don/2002_06_24e/en/,DON-2002-06-24e
2002-Leishmaniasis-AFG,6,2002,6/28/2002,Leishmaniasis,NA,Afghanistan,AFG,Kabul,NA,NA,NA,NA,NA,NA,NA,NA,NA,NA,NA,200000,NA,NA,yes,yes,NA,NA,NA,https://www.who.int/csr/don/2002_06_28b/en/,DON-2002-06-28b
2002-Cholera-MOZ,5,2002,6/28/2002,Cholera,NA,Mozambique,MOZ,"Pemba, Namuno, Mocimboa da praia, Quissanga, Macomia",NA,NA,NA,1/1/2002,NA,NA,NA,NA,NA,NA,NA,2028,17,0.84,yes,NA,NA,NA,NA,https://www.who.int/csr/don/2002_06_28/en/,DON-2002-06-28
2002-Viral Haemorrhagic Fever-GAB,2,2002,6/28/2002,Acute haemorrhagic fever syndrome,NA,Gabon,GAB,Zadie,NA,NA,NA,yes,NA,NA,NA,NA,NA,NA,2,NA,2,NA,yes,yes,NA,NA,NA,https://www.who.int/csr/don/2002_06_28a/en/,DON-2002-06-28a
2002-Viral Haemorrhagic Fever-GAB,2,2002,7/10/2002,Acute haemorrhagic fever syndrome,NA,Republic of the Congo,COG,Mbomo,NA,NA,NA,yes,NA,NA,NA,NA,NA,NA,8,NA,5,NA,yes,NA,NA,yes,NA,https://www.who.int/csr/don/2002_07_10/en/,DON-2002-07-10
2002-Dengue-SLV,6,2002,7/12/2002,Dengue/dengue haemorrhagic fever,NA,El Salvador,SLV,all departments,NA,NA,NA,6/29/2002,NA,NA,NA,NA,NA,NA,NA,1773,6,NA,NA,NA,NA,NA,NA,https://www.who.int/csr/don/2002_07_12/en/,DON-2002-07-12
2002-Cholera-AFG,5,2002,7/12/2002,Cholera,NA,Afghanistan,AFG,Kabul,NA,NA,NA,yes,NA,yes,NA,NA,3,NA,NA,6691,3,NA,yes,yes,NA,NA,confirmed Vibrio cholerae,https://www.who.int/csr/don/2002_07_17/en/,DON-2002-07-17
2002-Cholera-BDI,5,2002,7/19/2002,Cholera,NA,Burundi,BDI,"Bujumbura Rurale, Rushubi, Nyambuye, Gihosha, Gikungu",7/15/2002,NA,NA,yes,NA,NA,NA,NA,NA,NA,NA,217,2,NA,yes,NA,NA,NA,NA,https://www.who.int/csr/don/2002_07_19/en/,DON-2002-07-19
2002-Dengue-HND,6,2002,7/19/2002,Dengue/dengue haemorrhagic fever,NA,Honduras,HND,"Francisco, Morazan, La Paz, Cortes, Olancho, Comayagua, Choluteca, El Paraiso, Yoro, Santa  Barbara, Copan",NA,NA,NA,6/29/2002,NA,NA,NA,NA,NA,NA,NA,2405,8,NA,yes,yes,NA,NA,NA,https://www.who.int/csr/don/2002_07_19b/en/,DON-2002-07-19b
2002-Dengue-SLV,6,2002,7/19/2002,Dengue/dengue haemorrhagic fever,NA,El Salvador,SLV,NA,NA,NA,NA,7/6/2002,NA,NA,NA,NA,NA,NA,NA,4538,6,NA,yes,NA,NA,NA,NA,https://www.who.int/csr/don/2002_07_19a/en/,DON-2002-07-19a
2002-Cholera-NER,5,2002,7/24/2002,Cholera,NA,Niger,NER,Gaya district,NA,NA,NA,6/9/2002,NA,yes,NA,NA,NA,NA,NA,104,8,7.7,yes,yes,NA,NA,NA,https://www.who.int/csr/don/2002_07_24/en/,DON-2002-07-24
2002-Influenza-MDG,3,2002,8/5/2002,Acute respiratory syndrome,NA,Madagascar,MDG,south,NA,NA,NA,yes,NA,NA,NA,NA,NA,NA,NA,1930,153,NA,yes,NA,NA,NA,NA,https://www.who.int/csr/don/2002_08_05/en/,DON-2002-08-05
2002-Influenza-MDG,3,2002,8/7/2002,Influenza,NA,Madagascar,MDG,Fianarantsoa,NA,NA,NA,NA,NA,yes,NA,NA,2,NA,NA,1291,156,NA,NA,NA,NA,NA,NA,https://www.who.int/csr/don/2002_08_07/en/,DON-2002-08-07
2002-Influenza-MDG,3,2002,8/13/2002,Influenza,NA,Madagascar,MDG,5/13 districts,NA,NA,NA,yes,NA,NA,NA,NA,NA,NA,NA,5117,374,7.3,yes,NA,NA,NA,NA,https://www.who.int/csr/don/2002_08_13/en/,DON-2002-08-13
2002-Cholera-CIV,5,2002,8/13/2002,Cholera,NA,Cote d'Ivoir,CIV,"Abidjan, Adzope, Bondoukou, Boundiali, Dimbokro, Ferkessedougou, Korhogo, Man, San Pedro, Seguela, Toouba",NA,NA,NA,beginning 2002,NA,yes,NA,NA,NA,NA,NA,581,19,3.27,yes,NA,NA,NA,NA,https://www.who.int/csr/don/2002_08_13a/en/,DON-2002-08-13a
2002-Cholera-BDI,5,2002,8/14/2002,Cholera,NA,Burundi,BDI,Bujumbura Rurale,6/17/2002,NA,NA,8/5/2002,NA,NA,NA,NA,NA,NA,NA,577,8,NA,NA,NA,NA,NA,NA,https://www.who.int/csr/don/2002_08_14/en/,DON-2002-08-14
2002-Dengue-ECU,6,2002,8/16/2002,Dengue/dengue haemorrhagic fever,NA,Ecuador,ECU,NA,NA,NA,NA,8/2/2002,NA,yes,NA,NA,355,NA,NA,5991,NA,NA,yes,NA,NA,NA,NA,https://www.who.int/csr/don/2002_08_16/en/,DON-2002-08-16
2002-Influenza-MDG,3,2002,8/16/2002,Influenza,NA,Madagascar,MDG,6/111 districts,NA,NA,NA,8/13/2002,NA,NA,NA,NA,NA,NA,NA,13300,444,3.3,8/14/2002,NA,NA,NA,NA,https://www.who.int/csr/don/2002_08_16a/en/,DON-2002-08-16a
2002-Influenza-MDG,3,2002,8/23/2002,Influenza,NA,Madagascar,MDG,5/6 provinces,NA,NA,8/22/2002,NA,NA,yes,NA,NA,NA,NA,NA,22646,671,NA,yes,NA,NA,NA,NA,https://www.who.int/csr/don/2002_08_23/en/,DON-2002-08-23
2002-Meningococcal Disease-BDI,1,2002,8/23/2002,Meningococcal disease,NA,Burundi,BDI,"Ngozi, Muyinga, Kirundo",NA,NA,NA,7/6/2002,NA,yes,NA,NA,15,NA,NA,269,30,11,yes,NA,NA,NA,NA,https://www.who.int/csr/don/2002_08_23a/en/,DON-2002-08-23a
2002-Meningococcal Disease-RWA,1,2002,8/23/2002,Meningococcal disease,NA,Rwanda,RWA,"Butare, Kibungo",NA,NA,NA,6/24/2002,NA,NA,NA,NA,NA,NA,NA,173,27,NA,yes,NA,NA,NA,NA,https://www.who.int/csr/don/2002_08_23a/en/,DON-2002-08-23a
2002-Meningococcal Disease-TZA,1,2002,8/23/2002,Meningococcal disease,NA,United Republic of Tanzania,TZA,Nduta and Karago camps,NA,NA,NA,7/1/2002,NA,NA,NA,NA,NA,NA,90,NA,4,NA,yes,NA,NA,NA,NA,https://www.who.int/csr/don/2002_08_23a/en/,DON-2002-08-23a
2002-West Nile Virus-USA,6,2002,8/27/2002,West Nile virus,NA,United States,USA,"20 states, DC",NA,NA,NA,8/26/2002,NA,NA,NA,NA,NA,NA,NA,425,20,NA,yes,NA,NA,NA,NA,https://www.who.int/csr/don/2002_08_27/en/,DON-2002-08-27
2002-Influenza-MDG,3,2002,8/28/2002,Influenza,NA,Madagascar,MDG,5/6 provinces,NA,NA,NA,NA,yes,yes,NA,NA,NA,NA,NA,NA,NA,NA,yes,NA,NA,NA,NA,https://www.who.int/csr/don/2002_08_28/en/,DON-2002-08-28
2002-Cholera-BDI,5,2002,8/29/2002,Cholera,NA,Burundi,BDI,"Bujumbura, Bubanza, Cibitoke",6/17/2002,NA,NA,8/22/2002,NA,NA,NA,NA,NA,NA,NA,794,13,NA,yes,NA,NA,NA,NA,https://www.who.int/csr/don/2002_08_29/en/,DON-2002-08-29
2002-Influenza-MDG,3,2002,8/30/2002,Influenza,NA,Madagascar,MDG,"Fianarantsoa, Ikongo",NA,NA,8/29/2002,NA,NA,NA,NA,NA,NA,NA,NA,NA,NA,NA,yes,NA,NA,NA,NA,https://www.who.int/csr/don/2002_08_30/en/,DON-2002-08-30
2002-Encephalitis-BGD,7,2002,8/30/2002,Acute neurological syndrome,NA,Bangladesh,BGD,Meherpur,04/??/2002,NA,NA,yes,NA,yes,NA,NA,NA,NA,NA,NA,NA,NA,NA,NA,NA,NA,Nipah or closely related virus,https://www.who.int/csr/don/2002_08_30a/en/,DON-2002-08-30a
2002-West Nile Virus-USA,6,2002,9/3/2002,West Nile virus,NA,United States,USA,"27 states, DC",NA,NA,NA,8/29/2002,NA,NA,NA,NA,NA,NA,NA,638,31,NA,NA,NA,NA,NA,NA,https://www.who.int/csr/don/2002_09_03a/en/,DON-2002-09-03a
2002-Meningococcal Disease-BDI,1,2002,9/4/2002,Meningococcal disease,NA,Burundi,BDI,"Muyinga, Kirundo, Ngozi",NA,NA,NA,7/6/2002,NA,NA,NA,NA,NA,NA,NA,428,38,NA,yes,NA,NA,NA,NA,https://www.who.int/csr/don/2002_09_04/en/,DON-2002-09-04
2002-Meningococcal Disease-RWA,1,2002,9/4/2002,Meningococcal disease,NA,Rwanda,RWA,"Butare, Kibungo, Kibuye, Umutara",NA,NA,NA,8/30/2002,NA,NA,NA,NA,NA,NA,NA,506,72,NA,yes,NA,NA,NA,NA,https://www.who.int/csr/don/2002_09_04/en/,DON-2002-09-04
2002-Meningococcal Disease-TZA,1,2002,9/4/2002,Meningococcal disease,NA,United Republic of Tanzania,TZA,"Nduta, Karago, Mtendeli, Mkugwa camps",NA,NA,NA,7/1/2002,NA,yes,NA,NA,10,NA,149,NA,9,NA,yes,NA,NA,NA,NA,https://www.who.int/csr/don/2002_09_04/en/,DON-2002-09-04
2002-Cholera-MWI,5,2002,9/6/2002,Cholera,NA,Malawi,MWI,Nkhotakota,NA,NA,NA,8/24/2002,NA,NA,NA,NA,NA,NA,NA,755,24,3.17,yes,NA,NA,NA,NA,https://www.who.int/csr/don/2002_09_06/en/,DON-2002-09-06
2002-West Nile Virus-USA,6,2002,9/12/2002,West Nile virus,NA,United States,USA,"30 states, DC",NA,NA,NA,9/11/2002,NA,NA,NA,NA,NA,NA,NA,1201,46,NA,NA,NA,NA,NA,NA,https://www.who.int/csr/don/2002_09_12/en/,DON-2002-09-12
2002-West Nile Virus-CAN,6,2002,9/12/2002,West Nile virus,NA,Canada,CAN,Ontario,NA,NA,NA,NA,NA,9/11/2002,NA,NA,1,NA,NA,NA,NA,NA,NA,NA,NA,NA,NA,https://www.who.int/csr/don/2002_09_12b/en/,DON-2002-09-12b
2002-Meningococcal Disease-BDI,1,2002,9/12/2002,Meningococcal disease,NA,Burundi,BDI,"Muyinga, Cankuzo, Ruyigi",NA,NA,9/2/2002,NA,NA,NA,NA,NA,NA,NA,NA,NA,NA,NA,yes,NA,NA,NA,NA,https://www.who.int/csr/don/2002_09_12a/en/,DON-2002-09-12a
2002-Meningococcal Disease-RWA,1,2002,9/12/2002,Meningococcal disease,NA,Rwanda,RWA,8/12 provinces,NA,NA,9/2/2002,NA,NA,NA,NA,NA,NA,NA,NA,636,83,NA,yes,NA,NA,NA,NA,https://www.who.int/csr/don/2002_09_12a/en/,DON-2002-09-12a
2002-Meningococcal Disease-TZA,1,2002,9/12/2002,Meningococcal disease,NA,United Republic of Tanzania,TZA,camps in Kibondo,NA,NA,NA,NA,NA,NA,NA,NA,NA,NA,NA,NA,NA,NA,yes,NA,NA,NA,NA,https://www.who.int/csr/don/2002_09_12a/en/,DON-2002-09-12a
2002-Cholera-MWI,5,2002,9/13/2002,Cholera,NA,Malawi,MWI,Nkhotakota,NA,NA,1/1/2002,NA,NA,NA,NA,NA,NA,NA,NA,773,41,5.13,yes,NA,NA,NA,NA,https://www.who.int/csr/don/2002_09_13/en/,DON-2002-09-13
2002-Cholera-LBR,5,2002,9/13/2002,Cholera,NA,Liberia,LBR,Montserado,NA,NA,NA,9/1/2002,NA,NA,NA,NA,NA,NA,NA,661,NA,NA,yes,NA,NA,NA,NA,https://www.who.int/csr/don/2002_09_13a/en/,DON-2002-09-13a
2002-Cholera-COD,5,2002,9/16/2002,Cholera,NA,Democratic Republic of the Congo,COD,"Malemba Nkulu, Kabala, Butombe, Songwe, Twite-Mwanza",07/??/2002,NA,NA,early September 2002,NA,NA,NA,NA,NA,NA,NA,2636,67,2.5,yes,NA,NA,NA,NA,https://www.who.int/csr/don/2002_09_16/en/,DON-2002-09-16
2002-West Nile Virus-USA,6,2002,9/17/2002,West Nile virus,NA,United States,USA,"30 states, DC",NA,NA,NA,9/16/2002,NA,NA,NA,NA,NA,NA,NA,1460,66,NA,NA,NA,NA,NA,NA,https://www.who.int/csr/don/2002_09_17/en/,DON-2002-09-17
2002-West Nile Virus-CAN,6,2002,9/18/2002,West Nile virus,NA,Canada,CAN,Ontario,NA,NA,NA,9/17/2002,NA,yes,NA,NA,3,NA,14,NA,1,NA,NA,NA,NA,NA,NA,https://www.who.int/csr/don/2002_09_18/en/,DON-2002-09-18
2002-West Nile Virus-CAN,6,2002,9/20/2002,West Nile virus,NA,Canada,CAN,"Quebec, Ontario",NA,NA,NA,9/19/2002,NA,yes,NA,NA,3,NA,17,20,1,NA,NA,NA,NA,NA,NA,https://www.who.int/csr/don/2002_09_20/en/,DON-2002-09-20
2002-West Nile Virus-USA,6,2002,9/24/2002,West Nile virus,NA,United States,USA,"32 states, DC",NA,NA,NA,9/23/2002,NA,NA,NA,NA,NA,NA,NA,1963,94,NA,NA,NA,NA,NA,NA,https://www.who.int/csr/don/2002_09_24/en/,DON-2002-09-24
2002-West Nile Virus-USA,6,2002,10/1/2002,West Nile virus,NA,United States,USA,"32 states, DC",NA,NA,NA,9/30/2002,NA,NA,NA,NA,NA,NA,NA,2405,117,NA,NA,NA,NA,NA,NA,https://www.who.int/csr/don/2002_10_01/en/,DON-2002-10-01
2002-West Nile Virus-CAN,6,2002,10/1/2002,West Nile virus,NA,Canada,CAN,"Quebec, Ontario",NA,NA,NA,9/30/2002,NA,yes,NA,NA,10,NA,28,38,1,NA,NA,NA,NA,NA,NA,https://www.who.int/csr/don/2002_10_01a/en/,DON-2002-10-01a
2002-Meningococcal Disease-BDI,1,2002,10/2/2002,Meningococcal disease,NA,Burundi,BDI,"Muyinga, Ruyigi, Gitega, Karuzi",NA,NA,NA,9/22/2002,NA,yes,NA,NA,53,NA,NA,934,68,NA,yes,NA,NA,NA,NA,https://www.who.int/csr/don/2002_10_02/en/,DON-2002-10-02
2002-Meningococcal Disease-TZA,1,2002,10/2/2002,Meningococcal disease,NA,United Republic of Tanzania,TZA,"camps in Ngara, Kasulu, Kibondo",NA,NA,NA,NA,NA,NA,NA,NA,NA,NA,NA,NA,NA,NA,yes,NA,NA,NA,NA,https://www.who.int/csr/don/2002_10_02/en/,DON-2002-10-02
2002-Yellow Fever-SEN,6,2002,10/4/2002,Yellow fever,NA,Senegal,SEN,Mbaké,NA,NA,NA,NA,NA,yes,NA,NA,12,NA,NA,NA,NA,NA,10/1/2002,NA,NA,NA,NA,https://www.who.int/csr/don/2002_10_04/en/,DON-2002-10-04
2002-Yellow Fever-SEN,6,2002,10/11/2002,Yellow fever,NA,Senegal,SEN,"Mbacké, Bambey, Touba",NA,NA,NA,NA,NA,yes,NA,NA,15,NA,NA,NA,2,NA,10/1/2002,NA,NA,NA,NA,https://www.who.int/csr/don/2002_10_11/en/,DON-2002-10-11
2002-West Nile Virus-USA,6,2002,10/15/2002,West Nile virus,NA,United States,USA,"35 states, DC",NA,NA,NA,NA,NA,NA,NA,NA,NA,NA,NA,2946,160,NA,10/11/2002,NA,NA,NA,NA,https://www.who.int/csr/don/2002_10_15/en/,DON-2002-10-15
2002-West Nile Virus-CAN,6,2002,10/15/2002,West Nile virus,NA,Canada,CAN,"Quebec, Ontario",NA,NA,NA,10/11/2002,NA,yes,NA,NA,20,NA,49,69,1,NA,NA,NA,NA,NA,NA,https://www.who.int/csr/don/2002_10_15a/en/,DON-2002-10-15a
2002-Yellow Fever-SEN,6,2002,10/18/2002,Yellow fever,NA,Senegal,SEN,"Touba, Mbacké, Bambey, Gossas",NA,NA,NA,NA,NA,yes,NA,NA,18,NA,NA,NA,2,NA,10/1/2002,yes,NA,NA,NA,https://www.who.int/csr/don/2002_10_18/en/,DON-2002-10-18
2002-West Nile Virus-USA,6,2002,10/22/2002,West Nile virus,NA,United States,USA,"37 states, DC",NA,NA,NA,10/21/2002,NA,NA,NA,NA,NA,NA,NA,3231,176,NA,NA,NA,NA,NA,NA,https://www.who.int/csr/don/2002_10_22/en/,DON-2002-10-22
2002-West Nile Virus-CAN,6,2002,10/22/2002,West Nile virus,NA,Canada,CAN,"Quebec, Ontario",NA,NA,NA,10/17/2002,NA,yes,NA,NA,30,NA,58,88,1,NA,yes,NA,NA,NA,NA,https://www.who.int/csr/don/2002_10_22a/en/,DON-2002-10-22a
2002-West Nile Virus-CAN,6,2002,10/22/2002,West Nile virus,NA,Canada,CAN,"Quebec, Ontario, Alberta",NA,NA,NA,10/22/2002,NA,yes,NA,NA,31,NA,65,96,1,NA,yes,NA,NA,NA,NA,https://www.who.int/csr/don/2002_10_24a/en/,DON-2002-10-24a
2002-Yellow Fever-SEN,6,2002,10/25/2002,Yellow fever,NA,Senegal,SEN,"Touba, Mbacké, Bambey, Gossas, Fatick",10/17/2002,NA,NA,10/24/2002,NA,yes,NA,NA,41,NA,NA,NA,4,NA,10/1/2002,NA,NA,NA,NA,https://www.who.int/csr/don/2002_10_25/en/,DON-2002-10-25
2002-West Nile Virus-USA,6,2002,10/30/2002,West Nile virus,NA,United States,USA,"38 states, DC",NA,NA,NA,10/29/2002,NA,NA,NA,NA,NA,NA,NA,3399,193,NA,NA,NA,NA,NA,NA,https://www.who.int/csr/don/2002_10_30/en/,DON-2002-10-30
2002-West Nile Virus-CAN,6,2002,10/30/2002,West Nile virus,NA,Canada,CAN,"Alberta, Quebec, Ontario",NA,NA,NA,10/29/2002,NA,yes,NA,NA,31,NA,79,NA,1,NA,yes,NA,NA,NA,NA,https://www.who.int/csr/don/2002_10_30a/en/,DON-2002-10-30a
2002-Yellow Fever-SEN,6,2002,11/1/2002,Yellow fever,NA,Senegal,SEN,"Touba, Mbacké, Bambey, Gossas",10/20/2002,NA,NA,10/31/2002,NA,yes,NA,NA,45,NA,NA,NA,4,NA,yes,NA,NA,NA,NA,https://www.who.int/csr/don/2002_11_01/en/,DON-2002-11-01
2002-West Nile Virus-CAN,6,2002,11/6/2002,West Nile virus,NA,Canada,CAN,"Alberta, Quebec, Ontario",NA,NA,NA,11/5/2002,NA,yes,NA,NA,56,NA,65,NA,1,NA,yes,NA,NA,NA,NA,https://www.who.int/csr/don/2002_11_06/en/,DON-2002-11-06
2002-West Nile Virus-CAN,6,2002,11/13/2002,West Nile virus,NA,Canada,CAN,"Alberta, Quebec, Ontario",NA,NA,NA,11/13/2002,NA,yes,NA,NA,57,NA,84,NA,2,NA,yes,NA,NA,NA,NA,https://www.who.int/csr/don/2002_11_13/en/,DON-2002-11-13
2002-West Nile Virus-USA,6,2002,11/14/2002,West Nile virus,NA,United States,USA,"39 states, DC",NA,NA,NA,11/13/2002,NA,NA,NA,NA,NA,NA,NA,3587,211,NA,NA,NA,NA,NA,NA,https://www.who.int/csr/don/2002_11_14/en/,DON-2002-11-14
2002-Cholera-COD,5,2002,11/15/2002,Cholera,NA,Democratic Republic of the Congo,COD,"Kasai Oriental, Mbuji-Mayi, Miabi, Tshilenge, Katende",NA,NA,NA,10/20/2002,NA,yes,NA,NA,NA,NA,NA,394,41,10.4,yes,NA,NA,NA,NA,https://www.who.int/csr/don/2002_11_15/en/,DON-2002-11-15
2002-Yellow Fever-SEN,6,2002,11/20/2002,Yellow fever,NA,Senegal,SEN,"Touba, Mbacké Bambey, Gossas, Fatick, Guinguinéo, Darou Mousty, Kébémer, Khombole, Thiadiaye, Tambacounda, Dakar Centre",11/9/2002,NA,NA,11/20/2002,NA,yes,NA,NA,NA,NA,NA,57,10,NA,yes,NA,NA,NA,NA,https://www.who.int/csr/don/2002_11_20/en/,DON-2002-11-20
2002-Yellow Fever-SEN,6,2002,11/29/2002,Yellow fever,NA,Senegal,SEN,"Touba, Mbacké, Bambey, Gossas, Fatick, Guinguinéo, Darou Mousty, Kébémer, Khombole, Thiadiaye, Tambacounda, Sedhiou, Dakar Centre",11/11/2002,NA,NA,11/28/2002,NA,yes,NA,NA,NA,NA,NA,60,11,NA,yes,NA,NA,NA,NA,https://www.who.int/csr/don/2002_11_29/en/,DON-2002-11-29
2002-Influenza-COD,3,2002,11/29/2002,Acute respiratory syndrome,NA,Democratic Republic of the Congo,COD,Bosobolo,NA,NA,10/??/2002,NA,NA,NA,NA,NA,NA,NA,NA,4000,500,NA,yes,NA,NA,NA,NA,https://www.who.int/csr/don/2002_11_29a/en/,DON-2002-11-29a
2002-Influenza-COD,3,2002,12/12/2002,Acute respiratory syndrome,NA,Democratic Republic of the Congo,COD,"Bosobolo, Gbadolite, Gemena, Karawa",NA,NA,NA,yes,NA,yes,NA,NA,NA,NA,NA,1245,18,1.4,yes,NA,NA,NA,H3N2,https://www.who.int/csr/don/2002_12_12/en/,DON-2002-12-12
2002-Influenza-COD,3,2002,12/20/2002,Acute respiratory syndrome,NA,Democratic Republic of the Congo,COD,"Djolu, Bosobolo, Karawa, Genema",NA,NA,11/22/2002,NA,NA,yes,NA,NA,NA,NA,NA,NA,NA,NA,yes,NA,NA,NA,H3N2,https://www.who.int/csr/don/2002_12_20/en/,DON-2002-12-20
2003-Cholera-CIV,5,2003,1/8/2003,Cholera,NA,Cote d'Ivoire,CIV,Tabléguikou-gly,NA,12/22/2002,NA,NA,NA,yes,NA,NA,NA,NA,NA,70,15,NA,yes,NA,NA,NA,NA,https://www.who.int/csr/don/2003_01_08/en/,DON-2003-01-08
2003-Pertussis-AFG,1,2003,1/8/2003,Pertussis,NA,Afghanistan,AFG,Khwahan,NA,NA,NA,yes,NA,Early November 2002,NA,NA,NA,NA,NA,115,17,NA,yes,NA,NA,NA,NA,https://www.who.int/csr/don/2003_01_08a/en/,DON-2003-01-08a
2003-Yellow Fever-BRA,6,2003,1/17/2003,Yellow fever,NA,Brazil,BRA,Minas Gerais,NA,NA,NA,yes,NA,yes,NA,NA,4,NA,NA,24,5,NA,yes,NA,NA,NA,NA,https://www.who.int/csr/don/2003_01_17/en/,DON-2003-01-17
2003-Pertussis-AFG,1,2003,1/21/2003,Pertussis,NA,Afghanistan,AFG,Khwahan,NA,NA,NA,yes,NA,NA,NA,NA,NA,NA,NA,NA,NA,NA,yes,NA,NA,NA,NA,https://www.who.int/csr/don/2003_01_21/en/,DON-2003-01-21
2003-Yellow Fever-GIN,6,2003,2/3/2003,Yellow fever,NA,Guinea,GIN,"Macenta, Kérouane",NA,NA,NA,1/23/2003,yes,yes,NA,NA,NA,NA,NA,43,24,NA,yes,NA,NA,NA,NA,https://www.who.int/csr/don/2003_02_03/en/,DON-2003-02-03
2003-Meningococcal Disease-BFA,1,2003,2/4/2003,Meningococcal disease,NA,Burkina Faso,BFA,"Batie, Kossodo, Manga, Tenkodogo",NA,NA,NA,1/1/2003,NA,yes,NA,NA,28,NA,NA,980,196,20,yes,NA,NA,NA,NA,https://www.who.int/csr/don/2003_02_04/en/,DON-2003-02-04
2003-Meningococcal Disease-BFA,1,2003,2/7/2003,Meningococcal disease,NA,Burkina Faso,BFA,"Batie, Leo, Sapone, Manga, Dande, Nanoro, Reo, Titao, Zabre, Zorgho",NA,NA,NA,1/26/2003,NA,NA,NA,NA,NA,NA,NA,369,58,NA,yes,NA,NA,NA,NA,https://www.who.int/csr/don/2003_02_07/en/,DON-2003-02-07
2003-Ebola-COG,2,2003,###############################################################################################################################################################################################################################################################,Acute haemorrhagic fever syndrome,NA,Republic of the Congo,COG,Mbomo district,NA,NA,NA,NA,NA,no,NA,NA,NA,NA,NA,NA,NA,NA,yes,NA,NA,NA,NA,https://www.who.int/csr/don/2003_02_07a/en/,DON-2003-02-07a
2003-Ebola-COG,2,2003,2/10/2003,Acute haemorrhagic fever syndrome,NA,Republic of the Congo,COG,Mbomo district,NA,NA,NA,NA,NA,NA,NA,NA,NA,NA,NA,NA,NA,NA,2/10/2003,NA,NA,NA,NA,https://www.who.int/csr/don/2003_02_10/en/,DON-2003-02-10
2003-Lassa Fever-GBR,2,2003,2/10/2003,Lassa fever,NA,United Kingdom,GBR,Sierra Leone (imported),NA,NA,NA,NA,NA,yes,NA,NA,1,NA,NA,NA,0,NA,yes,NA,NA,NA,imported,https://www.who.int/csr/don/2003_02_10a/en/,DON-2003-02-10a
2003-SARS-CHN,2,2003,2/11/2003,Acute respiratory syndrome,NA,China,CHN,Guangdong,NA,NA,NA,yes,NA,NA,NA,NA,NA,NA,NA,300,5,NA,yes,NA,NA,NA,NA,https://www.who.int/csr/don/2003_02_11/en/,DON-2003-02-11
2003-SARS-CHN,2,2003,2/12/2003,Acute respiratory syndrome,NA,China,CHN,"Foshan, Guangzhou, Heyuan, Jiangmen, Shenzhen, Zhongshan",NA,NA,11/16/2002,NA,NA,no,NA,NA,NA,NA,NA,305,5,NA,yes,NA,NA,NA,NA,https://www.who.int/csr/don/2003_02_12a/en/,DON-2003-02-12a
2003-Influenza-COD,3,2003,2/12/2003,Influenza,NA,Democratic Republic of the Congo,COD,Kinshasa,NA,NA,NA,early January 2003,NA,yes,NA,NA,NA,NA,NA,31174,296,NA,yes,NA,NA,NA,NA,https://www.who.int/csr/don/2003_02_12/en/,DON-2003-02-12
2003-Ebola-COG,2,2003,2/12/2003,Acute haemorrhagic fever syndrome,NA,Republic of the Congo,COG,"Mbomo, Kellé",NA,NA,2/12/2003,NA,NA,NA,NA,NA,NA,NA,61,NA,48,NA,yes,NA,NA,NA,NA,https://www.who.int/csr/don/2003_02_12b/en/,DON-2003-02-12b
2003-SARS-CHN,2,2003,2/14/2003,Acute respiratory syndrome,NA,China,CHN,Guangdong,NA,11/26/2002,NA,yes,NA,NA,NA,NA,NA,NA,NA,305,5,NA,yes,NA,NA,NA,clinically consistent with pneumonia,https://www.who.int/csr/don/2003_02_14/en/,DON-2003-02-14
2003-Ebola-COG,2,2003,2/14/2003,Acute haemorrhagic fever syndrome,NA,Republic of the Congo,COG,"Mbomo, Kellé",NA,NA,2/13/2003,NA,NA,NA,NA,NA,NA,NA,61,NA,50,NA,yes,NA,NA,NA,NA,https://www.who.int/csr/don/2003_02_14a/en/,DON-2003-02-14a
2003-Ebola-COG,2,2003,2/18/2003,Ebola haemorrhagic fever,NA,Republic of the Congo,COG,"Mbomo, Kellé",NA,NA,2/18/2003,NA,NA,yes,NA,NA,NA,NA,73,NA,59,NA,yes,NA,NA,NA,NA,https://www.who.int/csr/don/2003_02_18/en/,DON-2003-02-18
2003-H5 Influenza-HKG,3,2003,2/19/2003,H5N1,NA,Hong Kong,HKG,NA,2/9/2003,2/12/2003,NA,NA,yes,yes,NA,NA,1,NA,NA,4,2,NA,NA,NA,NA,NA,NA,https://www.who.int/csr/don/2003_2_19/en/,DON-2003-2-19
2003-SARS-CHN,2,2003,2/20/2003,Acute respiratory syndrome,NA,China,CHN,Guangdong,NA,NA,NA,NA,NA,NA,NA,NA,NA,NA,NA,305,5,NA,yes,NA,NA,NA,probably chlamydia pneumoniae,https://www.who.int/csr/don/2003_2_20/en/,DON-2003-2-20
2003-H5 Influenza-HKG,3,2003,2/20/2003,H5N1,NA,Hong Kong,HKG,NA,NA,NA,NA,NA,NA,2/20/2003,NA,NA,2,NA,NA,4,2,NA,yes,NA,NA,NA,NA,https://www.who.int/csr/don/2003_02_20/en/,DON-2003-02-20
2003-Ebola-COG,2,2003,2/26/2003,Ebola haemorrhagic fever,NA,Republic of the Congo,COG,"Mbomo, Kellé",NA,NA,2/25/2003,NA,NA,yes,NA,NA,5,90,NA,NA,77,81,yes,NA,NA,NA,NA,https://www.who.int/csr/don/2003_02_26/en/,DON-2003-02-26
2003-Meningococcal Disease-BFA,1,2003,2/27/2003,Meningococcal disease,NA,Burkina Faso,BFA,"Batie, Bogande, Bousse, Manga, Pama, Po, Zabre, Barsalogho, Boulsa, Dano, Koudougou, Leo, Nanoro, Sapone, Tenkodogo, Zorgho",NA,NA,NA,2/23/2003,NA,yes,NA,NA,NA,NA,NA,3107,480,NA,yes,NA,NA,NA,NA,https://www.who.int/csr/don/2003_02_27/en/,DON-2003-02-27
2003-H5 Influenza-HKG,3,2003,2/27/2003,H5N1,NA,Hong Kong,HKG,NA,2/7/2003,2/11/2003,2/27/2003,NA,NA,2/20/2003,NA,NA,2,NA,NA,4,2,NA,yes,NA,NA,NA,NA,https://www.who.int/csr/don/2003_02_27a/en/,DON-2003-02-27a
2003-Ebola-COG,2,2003,2/28/2003,Ebola haemorrhagic fever,NA,Republic of the Congo,COG,"Mbomo, Kellé",NA,NA,2/27/2003,NA,NA,yes,NA,NA,5,92,NA,NA,80,NA,yes,yes,NA,NA,NA,https://www.who.int/csr/don/2003_02_28/en/,DON-2003-02-28
2003-Ebola-COG,2,2003,3/7/2003,Ebola haemorrhagic fever,NA,Republic of the Congo,COG,"Mbomo, Kellé",NA,NA,3/7/2003,NA,NA,yes,NA,NA,5,105,NA,NA,89,NA,yes,yes,NA,NA,NA,https://www.who.int/csr/don/2003_03_7/en/,DON-2003-03-7
2003-Meningococcal Disease-BFA,1,2003,3/7/2003,Meningococcal disease,NA,Burkina Faso,BFA,"Batie, Bogande, Manga, Po, Zabre, Boulsa, Bousse, Dande, Leo, Nanoro, Sapone, Secteur 30 de Ouagadougou, Zorgho",01/??/2003,NA,NA,3/6/2003,NA,yes,NA,NA,NA,NA,NA,3691,542,NA,yes,NA,NA,NA,NA,https://www.who.int/csr/don/2003_03_7a/en/,DON-2003-03-7a
2003-CCHF-MRT,6,2003,3/11/2003,Crimean-Congo haemorrhagic fever,NA,Mauritania,MRT,"Nouakchott, Trarza, Brakna, Hodh Gharbi",NA,NA,NA,3/8/2003,NA,yes,NA,NA,11,NA,NA,30,6,NA,yes,NA,NA,NA,NA,https://www.who.int/csr/don/2003_03_11/en/,DON-2003-03-11
2003-SARS-HKG,2,2003,3/12/2003,Acute respiratory syndrome,NA,Hong Kong,HKG,NA,NA,NA,NA,3/12/2003,NA,NA,NA,NA,NA,NA,NA,23,NA,NA,yes,NA,NA,NA,NA,https://www.who.int/csr/don/2003_03_12/en/,DON-2003-03-12
2003-SARS-VNM,2,2003,3/12/2003,Acute respiratory syndrome,NA,Vietnam,VNM,Hanoi,NA,NA,NA,NA,NA,NA,NA,NA,NA,NA,NA,21,NA,NA,NA,NA,NA,NA,NA,https://www.who.int/csr/don/2003_03_12/en/,DON-2003-03-12
2003-SARS-CHN,2,2003,3/12/2003,Acute respiratory syndrome,NA,China,CHN,Guangdong,NA,NA,NA,mid February 2003,NA,NA,NA,NA,NA,NA,NA,305,5,NA,NA,NA,NA,NA,NA,https://www.who.int/csr/don/2003_03_12/en/,DON-2003-03-12
2003-Meningococcal Disease-NER,1,2003,3/13/2003,Meningococcal disease,NA,Niger,NER,"Magaria, Aguié, Matameye, Madarounfa, Madaoua, Tahoua, Mirriah",02/??/2003,NA,NA,3/9/2003,NA,yes,NA,NA,NA,NA,NA,2056,195,NA,yes,NA,NA,NA,NA,https://www.who.int/csr/don/2003_03_13/en/,DON-2003-03-13
2003-Ebola-COG,2,2003,3/14/2003,Ebola haemorrhagic fever,NA,Republic of the Congo,COG,"Mbomo, Kellé",NA,NA,NA,3/14/2003,NA,yes,NA,NA,13,NA,NA,118,106,NA,yes,NA,NA,NA,NA,https://www.who.int/csr/don/2003_03_14/en/,DON-2003-03-14
2003-SARS-Global,2,2003,3/16/2003,Severe Acute Respiratory Syndrome (SARS),NA,Global,NA,"Hanoi, Hong Kong, Singapore, Thailand, Canada, New York, Frankfurt",NA,2/26/2003,NA,2/26/2003,NA,no,NA,NA,NA,NA,NA,>150,NA,NA,yes,NA,NA,NA,NA,https://www.who.int/csr/don/2003_03_16/en/,DON-2003-03-16
2003-SARS-Global,2,2003,3/17/2003,Severe Acute Respiratory Syndrome (SARS),NA,Global,NA,NA,NA,NA,NA,NA,NA,no,NA,NA,NA,NA,NA,NA,NA,NA,yes,NA,NA,NA,NA,https://www.who.int/csr/don/2003_03_17/en/,DON-2003-03-17
2003-SARS-Global,2,2003,3/18/2003,Severe Acute Respiratory Syndrome (SARS),NA,Global,NA,"Canada, China, Taiwan (China), Germany, Hong Kong Special Administrative Region of China, Singapore, Slovenia, Thailand, Viet Nam, the United Kingdom",NA,NA,NA,NA,NA,no,NA,NA,NA,NA,NA,NA,NA,NA,yes,NA,NA,NA,invalid link,https://www.who.int/csr/don/2003_03_18/en/,DON-2003-03-18
2003-SARS-Global,2,2003,3/19/2003,Severe Acute Respiratory Syndrome (SARS),NA,Global,NA,"Canada, China, Hong Kong, Germany Singapore, Slovenia, Spain, Thailand, the United Kingdom, the United States of America, Viet Nam",NA,NA,NA,3/19/2003,NA,no,NA,NA,NA,NA,NA,264,9,NA,yes,NA,NA,NA,progress in pinpointing causative agent,https://www.who.int/csr/don/2003_03_19/en/,DON-2003-03-19
2003-SARS-Global,2,2003,3/20/2003,Severe Acute Respiratory Syndrome (SARS),NA,Global,NA,11 countries,2/8/2003,NA,NA,3/20/2003,NA,no,NA,NA,NA,NA,NA,306,10,NA,yes,NA,NA,NA,NA,https://www.who.int/csr/don/2003_03_20/en/,DON-2003-03-20
2003-SARS-Global,2,2003,3/21/2003,Severe Acute Respiratory Syndrome (SARS),NA,Global,NA,13 countries,NA,NA,NA,2/11/2003,NA,no,NA,NA,NA,NA,NA,350,10,NA,yes,NA,NA,NA,NA,https://www.who.int/csr/don/2003_03_21/en/,DON-2003-03-21
2003-SARS-Global,2,2003,3/22/2003,Severe Acute Respiratory Syndrome (SARS),NA,Global,NA,NA,NA,mid-February 2003,NA,NA,NA,no,NA,NA,NA,NA,NA,>380,NA,NA,yes,NA,NA,NA,invalid link,https://www.who.int/csr/don/2003_03_22/en/,DON-2003-03-22
2003-CCHF-MRT,6,2003,3/24/2003,Crimean-Congo haemorrhagic fever,NA,Mauritania,MRT,NA,NA,NA,NA,3/21/2003,NA,yes,NA,NA,18,NA,NA,35,6,NA,yes,NA,NA,NA,NA,https://www.who.int/csr/don/2003_03_24/en/,DON-2003-03-24
2003-Ebola-COG,2,2003,3/24/2003,Ebola haemorrhagic fever,NA,Republic of the Congo,COG,"Mbomo, Kellé",NA,NA,NA,3/23/2003,NA,yes,NA,NA,13,NA,NA,123,113,NA,yes,NA,NA,NA,NA,https://www.who.int/csr/don/2003_03_24a/en/,DON-2003-03-24a
2003-SARS-Global,2,2003,3/24/2003,Severe Acute Respiratory Syndrome (SARS),NA,Global,NA,13 countries,NA,mid-February 2003,NA,yes,NA,no,NA,NA,NA,NA,NA,456,17,NA,yes,3/15/2003,NA,NA,NA,https://www.who.int/csr/don/2003_03_24B/en/,DON-2003-03-24B
2003-SARS-Global,2,2003,3/25/2003,Severe Acute Respiratory Syndrome (SARS),NA,Global,NA,12 countries,NA,NA,NA,yes,NA,no,NA,NA,NA,NA,NA,487,NA,NA,yes,3/15/2003,NA,NA,NA,https://www.who.int/csr/don/2003_03_25/en/,DON-2003-03-25
2003-SARS-Global,2,2003,3/26/2003,Severe Acute Respiratory Syndrome (SARS),NA,Global,NA,NA,NA,NA,NA,11/16/2002,NA,no,NA,NA,NA,NA,NA,1323,49,NA,yes,NA,NA,NA,NA,https://www.who.int/csr/don/2003_03_26/en/,DON-2003-03-26
2003-SARS-Global,2,2003,3/27/2003,Severe Acute Respiratory Syndrome (SARS),NA,Global,NA,NA,NA,NA,NA,NA,NA,NA,NA,NA,NA,NA,NA,NA,NA,NA,yes,NA,NA,NA,travel advice,https://www.who.int/csr/don/2003_03_27/en/,DON-2003-03-27
2003-SARS-Global,2,2003,3/27/2003,Severe Acute Respiratory Syndrome (SARS),NA,Global,NA,13 countries,NA,NA,NA,NA,NA,no,NA,NA,NA,NA,NA,1408,53,NA,yes,NA,NA,NA,NA,https://www.who.int/csr/don/2003_03_27b/en/,DON-2003-03-27b
2003-SARS-Global,2,2003,3/28/2003,Severe Acute Respiratory Syndrome (SARS),NA,Global,NA,13 countries,11/16/2002,NA,NA,NA,NA,no,NA,NA,NA,NA,NA,1485,53,NA,NA,3/28/2003,NA,NA,NA,https://www.who.int/csr/don/2003_03_28/en/,DON-2003-03-28
2003-SARS-Global,2,2003,3/29/2003,Severe Acute Respiratory Syndrome (SARS),NA,Global,NA,13 countries,NA,NA,NA,3/29/2003,NA,NA,NA,NA,NA,NA,NA,1550,54,NA,NA,NA,NA,NA,NA,https://www.who.int/csr/don/2003_03_29/en/,DON-2003-03-29
2003-SARS-Global,2,2003,3/31/2003,Severe Acute Respiratory Syndrome (SARS),NA,Global,NA,13 countries,NA,NA,NA,NA,NA,NA,NA,NA,NA,NA,NA,1622,58,NA,yes,NA,NA,NA,NA,https://www.who.int/csr/don/2003_03_31/en/,DON-2003-03-31
2003-SARS-Global,2,2003,4/1/2003,Severe Acute Respiratory Syndrome (SARS),NA,Global,NA,15 countries,NA,NA,NA,4/1/2003,NA,no,NA,NA,NA,NA,NA,1804,62,NA,yes,NA,NA,NA,NA,https://www.who.int/csr/don/2003_04_01/en/,DON-2003-04-01
2003-SARS-Global,2,2003,4/2/2003,Severe Acute Respiratory Syndrome (SARS),NA,Global,NA,"Canada (Toronto), China (Guangdong Province, Hong Kong Special Administrative Region of China, Shanxi Province, Taiwan Province), Singapore (Singapore), Vietnam (Hanoi)",NA,NA,NA,NA,NA,no,NA,NA,NA,NA,NA,NA,NA,NA,yes,NA,NA,NA,NA,https://www.who.int/csr/don/2003_04_02/en/,DON-2003-04-02
2003-SARS-Global,2,2003,4/2/2003,Severe Acute Respiratory Syndrome (SARS),NA,Global,NA,NA,NA,NA,NA,NA,NA,NA,NA,NA,NA,NA,NA,NA,NA,NA,yes,4/2/2003,NA,NA,NA,https://www.who.int/csr/don/2003_02_02a/en/,DON-2003-02-02a
2003-SARS-Global,2,2003,4/2/2003,Severe Acute Respiratory Syndrome (SARS),NA,China,CHN,Guangdong,NA,NA,NA,11/16/2002,NA,NA,NA,NA,NA,NA,NA,1153,40,NA,yes,NA,NA,NA,NA,https://www.who.int/csr/don/2003_04_02b/en/,DON-2003-04-02b
2003-Ebola-COG,2,2003,4/2/2003,Ebola haemorrhagic fever,NA,Republic of the Congo,COG,"Mbomo, Kellé",NA,NA,NA,4/2/2003,NA,yes,NA,NA,13,NA,NA,135,120,NA,yes,NA,NA,NA,NA,https://www.who.int/csr/don/2003_04_02c/en/,DON-2003-04-02c
2003-SARS-CHN,2,2003,4/3/2003,Severe Acute Respiratory Syndrome (SARS),NA,Global,NA,16 countries,11/16/2002,NA,NA,NA,NA,no,NA,NA,NA,NA,NA,2270,79,NA,yes,yes,NA,NA,NA,https://www.who.int/csr/don/2003_04_03a/en/,DON-2003-04-03a
2003-SARS-Global,2,2003,4/4/2003,Severe Acute Respiratory Syndrome (SARS),NA,Global,NA,16 countries,NA,NA,NA,yes,NA,NA,NA,NA,NA,NA,NA,2353,84,NA,yes,NA,NA,NA,NA,https://www.who.int/csr/don/2003_04_04/en/,DON-2003-04-04
2003-SARS-Global,2,2003,4/5/2003,Severe Acute Respiratory Syndrome (SARS),NA,Global,NA,18 countries,NA,NA,NA,4/5/2003,NA,NA,NA,NA,NA,NA,NA,2416,89,NA,NA,NA,NA,NA,NA,https://www.who.int/csr/don/2003_04_05/en/,DON-2003-04-05
2003-SARS-Global,2,2003,4/7/2003,Severe Acute Respiratory Syndrome (SARS),NA,Global,NA,17 countries,NA,NA,NA,4/7/2003,NA,no,NA,NA,NA,NA,NA,2601,98,NA,yes,NA,NA,NA,NA,https://www.who.int/csr/don/2003_04_07/en/,DON-2003-04-07
2003-SARS-Global,2,2003,4/8/2003,Severe Acute Respiratory Syndrome (SARS),NA,Global,NA,17 countries,mid-November 2002,NA,NA,NA,NA,NA,NA,NA,NA,NA,NA,2671,103,NA,yes,NA,NA,NA,NA,https://www.who.int/csr/don/2003_04_08/en/,DON-2003-04-08
2003-SARS-Global,2,2003,4/9/2003,Severe Acute Respiratory Syndrome (SARS),NA,Global,NA,16 countries,NA,NA,NA,4/9/2003,NA,no,NA,NA,NA,NA,NA,2722,106,NA,yes,NA,NA,NA,NA,https://www.who.int/csr/don/2003_04_09/en/,DON-2003-04-09
2003-SARS-Global,2,2003,4/10/2003,Severe Acute Respiratory Syndrome (SARS),NA,Global,NA,17 countries,NA,NA,NA,4/9/2003,NA,no,NA,NA,NA,NA,NA,2781,111,NA,yes,NA,NA,NA,NA,https://www.who.int/csr/don/2003_04_10/en/,DON-2003-04-10
2003-SARS-Global,2,2003,4/11/2003,Severe Acute Respiratory Syndrome (SARS),NA,Global,NA,17 countries,11/16/2002,2/28/2003,11/16/2002,4/10/2003,NA,yes,NA,NA,NA,NA,NA,2781,111,NA,yes,yes,NA,NA,NA,https://www.who.int/csr/don/2003_04_11/en/,DON-2003-04-11
2003-SARS-Global,2,2003,4/12/2003,Severe Acute Respiratory Syndrome (SARS),NA,Global,NA,19 countries,NA,NA,NA,4/12/2003,NA,NA,NA,NA,NA,NA,NA,2960,119,NA,yes,NA,NA,NA,NA,https://www.who.int/csr/don/2003_04_12/en/,DON-2003-04-12
2003-Ebola-COG,2,2003,4/14/2003,Ebola haemorrhagic fever,NA,Republic of the Congo,COG,"Mbomo, Kellé, Ndjoukou",NA,NA,NA,4/14/2003,NA,yes,NA,NA,13,NA,NA,140,123,NA,yes,NA,NA,NA,NA,https://www.who.int/csr/don/2003_04_14/en/,DON-2003-04-14
2003-SARS-Global,2,2003,4/14/2003,Severe Acute Respiratory Syndrome (SARS),NA,Global,NA,21 countries,NA,NA,NA,4/14/2003,NA,no,NA,NA,NA,NA,NA,3169,144,NA,yes,NA,NA,NA,NA,https://www.who.int/csr/don/2003_04_14a/en/,DON-2003-04-14a
2003-SARS-Global,2,2003,4/15/2003,Severe Acute Respiratory Syndrome (SARS),NA,Global,NA,22 countries,NA,NA,NA,4/15/2003,NA,no,NA,NA,NA,NA,NA,3235,154,NA,yes,NA,NA,NA,NA,https://www.who.int/csr/don/2003_04_15/en/,DON-2003-04-15
2003-SARS-Global,2,2003,4/16/2003,Severe Acute Respiratory Syndrome (SARS),NA,Global,NA,NA,NA,NA,NA,NA,NA,no,NA,NA,NA,NA,NA,NA,NA,NA,yes,NA,NA,NA,confirmed new coronavirus,https://www.who.int/csr/don/2003_04_16/en/,DON-2003-04-16
2003-SARS-Global,2,2003,4/17/2003,Severe Acute Respiratory Syndrome (SARS),NA,Global,NA,25 countries,NA,NA,NA,4/17/2003,NA,no,NA,NA,NA,NA,NA,3389,165,NA,yes,NA,NA,NA,NA,https://www.who.int/csr/don/2003_04_17/en/,DON-2003-04-17
2003-SARS-Global,2,2003,4/18/2003,Severe Acute Respiratory Syndrome (SARS),NA,Global,NA,25 countries,NA,NA,NA,4/18/2003,NA,no,NA,NA,NA,NA,NA,3461,170,NA,yes,NA,NA,NA,NA,https://www.who.int/csr/don/2003_04_18/en/,DON-2003-04-18
2003-SARS-Global,2,2003,4/19/2003,Severe Acute Respiratory Syndrome (SARS),NA,Global,NA,NA,NA,NA,NA,4/19/2003,NA,NA,NA,NA,NA,NA,NA,3547,182,NA,yes,NA,yes,NA,NA,https://www.who.int/csr/don/2003_04_19/en/,DON-2003-04-19
2003-SARS-CHN,2,2003,4/21/2003,Severe Acute Respiratory Syndrome (SARS),NA,China,CHN,"Beijing, Shanghai",NA,NA,NA,4/21/2003,NA,yes,NA,NA,1959,NA,NA,NA,NA,NA,yes,NA,NA,NA,NA,https://www.who.int/csr/don/2003_04_21/en/,DON-2003-04-21
2003-SARS-Global,2,2003,4/22/2003,Severe Acute Respiratory Syndrome (SARS),NA,Global,NA,25 countries,NA,NA,NA,4/22/2003,NA,NA,NA,NA,NA,3947,NA,NA,228,NA,yes,NA,NA,NA,NA,https://www.who.int/csr/don/2003_04_22/en/,DON-2003-04-22
2003-SARS-Global,2,2003,4/23/2003,Severe Acute Respiratory Syndrome (SARS),NA,Global,NA,25 countries,NA,late February 2003,NA,4/22/2003,NA,NA,NA,NA,NA,NA,NA,3947,NA,NA,yes,3/12/2003,NA,NA,NA,https://www.who.int/csr/don/2003_04_23/en/,DON-2003-04-23
2003-H7 Influenza-NLD,3,2003,4/24/2003,H7N7,NA,Netherlands,NLD,NA,NA,NA,NA,02/??/2003,NA,yes,NA,NA,83,NA,NA,NA,1,NA,yes,NA,NA,NA,NA,https://www.who.int/csr/don/2003_04_24/en/,DON-2003-04-24
2003-SARS-Global,2,2003,4/24/2003,Severe Acute Respiratory Syndrome (SARS),NA,Global,NA,26 countries,NA,NA,NA,4/24/2003,NA,NA,NA,NA,NA,NA,NA,4439,263,NA,yes,NA,NA,NA,NA,https://www.who.int/csr/don/2003_04_24a/en/,DON-2003-04-24a
2003-SARS-Global,2,2003,4/25/2003,Severe Acute Respiratory Syndrome (SARS),NA,Global,NA,26 countries,NA,11/26/2002,NA,4/25/2003,NA,no,NA,NA,NA,NA,NA,4649,274,NA,yes,NA,NA,NA,NA,https://www.who.int/csr/don/2003_04_25/en/,DON-2003-04-25
2003-SARS-Global,2,2003,4/26/2003,Severe Acute Respiratory Syndrome (SARS),NA,Global,NA,26 countries,NA,NA,NA,4/26/2003,NA,NA,NA,NA,NA,NA,NA,4836,293,NA,yes,NA,NA,NA,NA,https://www.who.int/csr/don/2003_04_26/en/,DON-2003-04-26
2003-SARS-Global,2,2003,4/28/2003,Severe Acute Respiratory Syndrome (SARS),NA,Global,NA,26 countries,NA,NA,NA,NA,NA,NA,NA,NA,NA,5050,NA,NA,321,NA,4/28/2003,NA,NA,NA,NA,https://www.who.int/csr/don/2003_04_28/en/,DON-2003-04-28
2003-SARS-Global,2,2003,4/28/2003,Severe Acute Respiratory Syndrome (SARS),NA,Vietnam,VNM,NA,NA,2/26/2003,NA,NA,NA,NA,4/28/2003,NA,NA,NA,NA,NA,NA,NA,yes,4/28/2003,NA,NA,NA,https://www.who.int/csr/don/2003_04_28/en/,DON-2003-04-28
2003-SARS-Global,2,2003,4/29/2003,Severe Acute Respiratory Syndrome (SARS),NA,Global,NA,27 countries,NA,NA,NA,4/29/2003,NA,NA,NA,NA,NA,5462,NA,NA,353,NA,yes,NA,NA,NA,NA,https://www.who.int/csr/don/2003_04_29/en/,DON-2003-04-29
2003-SARS-Global,2,2003,4/30/2003,Severe Acute Respiratory Syndrome (SARS),NA,Global,NA,26 countries,NA,NA,NA,4/30/2003,NA,NA,NA,NA,NA,5663,NA,NA,372,NA,yes,NA,NA,NA,NA,https://www.who.int/csr/don/2003_04_30/en/,DON-2003-04-30
2003-SARS-Global,2,2003,5/1/2003,Severe Acute Respiratory Syndrome (SARS),NA,Global,NA,27 countries,NA,NA,NA,5/1/2003,NA,no,NA,NA,NA,5865,NA,NA,391,NA,yes,NA,NA,NA,NA,https://www.who.int/csr/don/2003_05_01/en/,DON-2003-05-01
2003-Meningococcal Disease-BFA,1,2003,5/2/2003,Meningococcal disease,NA,Burkina Faso,BFA,32/53 districts,01/??/2003,NA,NA,4/20/2003,NA,yes,NA,NA,NA,NA,NA,7146,1058,14.8,yes,NA,NA,NA,NA,https://www.who.int/csr/don/2003_05_02/en/,DON-2003-05-02
2003-SARS-Global,2,2003,5/2/2003,Severe Acute Respiratory Syndrome (SARS),NA,Global,NA,27 countries,NA,NA,NA,5/2/2003,NA,NA,NA,NA,NA,6054,NA,NA,417,NA,yes,NA,NA,NA,NA,https://www.who.int/csr/don/2003_05_02a/en/,DON-2003-05-02a
2003-SARS-Global,2,2003,5/3/2003,Severe Acute Respiratory Syndrome (SARS),NA,Global,NA,27 countries,NA,NA,NA,5/3/2003,NA,NA,NA,NA,NA,6234,NA,NA,435,NA,yes,NA,NA,NA,NA,https://www.who.int/csr/don/2003_05_03/en/,DON-2003-05-03
2003-SARS-Global,2,2003,5/5/2003,Severe Acute Respiratory Syndrome (SARS),NA,Global,NA,27 countries,NA,NA,NA,5/5/2003,NA,NA,NA,NA,NA,6583,NA,NA,461,NA,yes,NA,NA,NA,NA,https://www.who.int/csr/don/2003_05_05/en/,DON-2003-05-05
2003-SARS-Global,2,2003,5/6/2003,Severe Acute Respiratory Syndrome (SARS),NA,Global,NA,29 countries,NA,NA,NA,5/6/2003,NA,NA,NA,NA,NA,6727,NA,NA,478,NA,yes,yes,NA,NA,NA,https://www.who.int/csr/don/2003_05_06/en/,DON-2003-05-06
2003-Ebola-COG,2,2003,5/7/2003,Ebola haemorrhagic fever,NA,Republic of the Congo,COG,"Mbomo, Kellé, Ndjoukou",NA,NA,NA,5/6/2003,NA,yes,NA,NA,13,NA,NA,143,128,NA,yes,NA,NA,NA,NA,https://www.who.int/csr/don/2003_05_07/en/,DON-2003-05-07
2003-SARS-Global,2,2003,5/7/2003,Severe Acute Respiratory Syndrome (SARS),NA,Global,NA,29 countries,NA,NA,NA,5/7/2003,NA,NA,NA,NA,NA,6903,NA,NA,495,14-15,yes,NA,NA,NA,NA,https://www.who.int/csr/don/2003_05_07a/en/,DON-2003-05-07a
2003-SARS-Global,2,2003,5/8/2003,Severe Acute Respiratory Syndrome (SARS),NA,Global,NA,29 countries,NA,NA,NA,5/7/2003,NA,NA,NA,NA,NA,NA,NA,6903,NA,NA,yes,3/12/2003,NA,NA,NA,https://www.who.int/csr/don/2003_05_08/en/,DON-2003-05-08
2003-Cholera-IRQ,5,2003,5/8/2003,Cholera,NA,Iraq,IRQ,Basra,NA,NA,4/28/2003,NA,NA,no,NA,NA,NA,NA,NA,17,NA,NA,yes,NA,NA,NA,NA,https://www.who.int/csr/don/2003_05_08a/en/,DON-2003-05-08a
2003-Cholera-ZMB,5,2003,5/9/2003,Cholera,NA,Zambia,ZMB,Nchelenge,4/19/2003,NA,5/6/2003,NA,NA,NA,NA,NA,NA,NA,NA,68,3,4.4,yes,NA,NA,NA,NA,https://www.who.int/csr/don/2003_05_09/en/,DON-2003-05-09
2003-SARS-Global,2,2003,5/9/2003,Severe Acute Respiratory Syndrome (SARS),NA,Global,NA,30 countries,NA,NA,NA,5/9/2003,NA,NA,NA,NA,NA,7183,NA,NA,514,NA,yes,NA,NA,NA,NA,https://www.who.int/csr/don/2003_05_09b/en/,DON-2003-05-09b
2003-SARS-Global,2,2003,5/10/2003,Severe Acute Respiratory Syndrome (SARS),NA,Global,NA,30 countries,NA,NA,NA,5/10/2003,NA,NA,NA,NA,NA,7296,NA,NA,526,NA,yes,NA,NA,NA,NA,https://www.who.int/csr/don/2003_05_10/en/,DON-2003-05-10
2003-SARS-Global,2,2003,5/12/2003,Severe Acute Respiratory Syndrome (SARS),NA,Global,NA,30 countries,NA,NA,NA,5/12/2003,NA,NA,NA,NA,NA,7447,NA,NA,552,NA,yes,NA,NA,NA,NA,https://www.who.int/csr/don/2003_05_12/en/,DON-2003-05-12
2003-Cholera-IRQ,5,2003,5/13/2003,Cholera,NA,Iraq,IRQ,Basra,NA,NA,NA,NA,NA,yes,NA,NA,4,NA,NA,NA,NA,NA,yes,yes,NA,NA,NA,https://www.who.int/csr/don/2003_05_13a/en/,DON-2003-05-13a
2003-SARS-Global,2,2003,5/13/2003,Severe Acute Respiratory Syndrome (SARS),NA,Global,NA,29 countries,NA,NA,NA,5/13/2003,NA,NA,NA,NA,NA,7548,NA,NA,573,NA,yes,NA,NA,NA,NA,https://www.who.int/csr/don/2003_05_13b/en/,DON-2003-05-13b
2003-Cholera-IRQ,5,2003,5/14/2003,Cholera,NA,Iraq,IRQ,Basra,NA,NA,NA,NA,yes,yes,NA,NA,22,NA,NA,NA,NA,NA,yes,NA,NA,NA,NA,https://www.who.int/csr/don/2003_05_14/en/,DON-2003-05-14
2003-SARS-Global,2,2003,5/14/2003,Severe Acute Respiratory Syndrome (SARS),NA,Global,NA,29 countries,NA,NA,NA,5/14/2003,NA,NA,NA,NA,NA,7628,NA,NA,587,NA,yes,NA,NA,NA,NA,https://www.who.int/csr/don/2003_05_14a/en/,DON-2003-05-14a
2003-SARS-Global,2,2003,5/14/2003,Severe Acute Respiratory Syndrome (SARS),NA,Canada,CAN,NA,NA,NA,NA,NA,NA,NA,5/14/2003,NA,NA,NA,NA,NA,NA,NA,yes,NA,NA,NA,NA,https://www.who.int/csr/don/2003_05_14a/en/,DON-2003-05-14a
2003-SARS-Global,2,2003,5/15/2003,Severe Acute Respiratory Syndrome (SARS),NA,Global,NA,29 countries,NA,NA,NA,5/15/2003,NA,NA,NA,NA,NA,7699,NA,NA,598,NA,yes,yes,yes,NA,NA,https://www.who.int/csr/don/2003_05_15/en/,DON-2003-05-15
2003-SARS-Global,2,2003,5/16/2003,Severe Acute Respiratory Syndrome (SARS),NA,Global,NA,29 countries,NA,NA,NA,5/16/2003,NA,NA,NA,NA,NA,7739,NA,NA,611,NA,yes,5/15/2003,yes,NA,NA,https://www.who.int/csr/don/2003_05_16/en/,DON-2003-05-16
2003-SARS-Global,2,2003,5/17/2003,Severe Acute Respiratory Syndrome (SARS),NA,Global,NA,28 countries,NA,NA,NA,5/17/2003,NA,NA,NA,NA,NA,7761,NA,NA,623,14-15,yes,NA,NA,NA,NA,https://www.who.int/csr/don/2003_05_17/en/,DON-2003-05-17
2003-Cholera-UGA,5,2003,5/19/2003,Cholera,NA,Uganda,UGA,"Bundibugyo district, Semliki, Lamia rivers",03/??/2003,NA,NA,4/30/2003,NA,yes,NA,NA,NA,NA,NA,277,35,NA,yes,yes,NA,NA,NA,https://www.who.int/csr/don/2003_05_19/en/,DON-2003-05-19
2003-SARS-Global,2,2003,5/19/2003,Severe Acute Respiratory Syndrome (SARS),NA,Global,NA,28 countries,NA,NA,NA,5/19/2003,NA,NA,NA,NA,NA,7864,NA,NA,643,NA,yes,NA,NA,NA,NA,https://www.who.int/csr/don/2003_05_19a/en/,DON-2003-05-19a
2003-SARS-Global,2,2003,5/20/2003,Severe Acute Respiratory Syndrome (SARS),NA,Global,NA,28 countries,NA,NA,NA,5/20/2003,NA,no,NA,NA,NA,7919,NA,NA,662,NA,NA,NA,NA,NA,NA,https://www.who.int/csr/don/2003_05_20/en/,DON-2003-05-20
2003-SARS-Global,2,2003,5/20/2003,Severe Acute Respiratory Syndrome (SARS),NA,Philippines,PHL,NA,NA,NA,NA,5/21/2003,NA,NA,5/20/2013,NA,NA,12,NA,NA,2,NA,3/17/2003,NA,NA,NA,NA,https://www.who.int/csr/don/2003_05_20/en/,DON-2003-05-20
2003-Cholera-MOZ,5,2003,5/21/2003,Cholera,NA,Mozambique,MOZ,"Gaza, Maputo, Sabie, Sofala",early January 2003,NA,NA,yes,NA,NA,NA,NA,NA,NA,NA,7288,67,NA,NA,NA,NA,NA,NA,https://www.who.int/csr/don/2003_05_21/en/,DON-2003-05-21
2003-SARS-Global,2,2003,5/21/2003,Severe Acute Respiratory Syndrome (SARS),NA,Taiwan,TWN,NA,NA,NA,NA,NA,NA,NA,NA,NA,NA,NA,NA,NA,NA,NA,yes,yes,NA,NA,travel advice,https://www.who.int/csr/don/2003_05_21a/en/,DON-2003-05-21a
2003-SARS-Global,2,2003,5/22/2003,Severe Acute Respiratory Syndrome (SARS),NA,Global,NA,28 countries,NA,NA,NA,5/22/2003,NA,NA,NA,NA,NA,8046,NA,NA,682,NA,yes,NA,NA,NA,NA,https://www.who.int/csr/don/2003_05_22/en/,DON-2003-05-22
2003-SARS-CHN,2,2003,5/22/2003,Severe Acute Respiratory Syndrome (SARS),NA,China,NA,"Guangdong, Hong Kong",NA,NA,NA,NA,NA,NA,NA,NA,NA,NA,NA,NA,NA,NA,yes,5/23/2003,NA,NA,remove travel precaution,https://www.who.int/csr/don/2003_05_23/en/,DON-2003-05-23
2003-Cholera-ZAF,5,2003,5/23/2003,Cholera,NA,South Africa,ZAF,"Mpumalanga region, Tonga",NA,NA,1/1/2003,NA,NA,yes,NA,NA,NA,NA,NA,174,3,1.7,yes,NA,NA,NA,NA,https://www.who.int/csr/don/2003_05_23a/en/,DON-2003-05-23a
2003-SARS-Global,2,2003,5/23/2003,Severe Acute Respiratory Syndrome (SARS),NA,Global,NA,28 countries,NA,NA,NA,5/23/2003,NA,NA,NA,NA,NA,8117,NA,NA,689,NA,yes,NA,NA,NA,NA,https://www.who.int/csr/don/2003_05_23b/en/,DON-2003-05-23b
2003-SARS-Global,2,2003,5/24/2003,Severe Acute Respiratory Syndrome (SARS),NA,Global,NA,28 countries,NA,NA,NA,5/24/2003,NA,NA,NA,NA,NA,8141,NA,NA,696,NA,yes,NA,NA,NA,NA,https://www.who.int/csr/don/2003_05_23b/en/,DON-2003-05-23b
2003-SARS-Global,2,2003,5/26/2003,Severe Acute Respiratory Syndrome (SARS),NA,Global,NA,28 countries,NA,NA,NA,5/26/2003,NA,NA,NA,NA,NA,8202,NA,NA,725,NA,NA,NA,NA,NA,NA,https://www.who.int/csr/don/2003_05_26/en/,DON-2003-05-26
2003-SARS-Global,2,2003,5/26/2003,Severe Acute Respiratory Syndrome (SARS),NA,Canada,CAN,Toronto,NA,NA,NA,yes,NA,NA,no,NA,26,8,NA,NA,NA,NA,yes,NA,NA,NA,re-added to list,https://www.who.int/csr/don/2003_05_26/en/,DON-2003-05-26
2003-Yellow Fever-SDN,6,2003,5/27/2003,Yellow fever,NA,Sudan,SDN,Imatong mountains,NA,NA,first week May 2003,NA,NA,yes,NA,NA,17,NA,NA,178,27,NA,5/11/2003,NA,NA,NA,NA,https://www.who.int/csr/don/2003_05_27/en/,DON-2003-05-27
2003-SARS-Global,2,2003,5/27/2003,Severe Acute Respiratory Syndrome (SARS),NA,Global,NA,28 countries,NA,NA,NA,5/27/2003,NA,NA,NA,NA,NA,8221,NA,NA,735,NA,5/27/2003,NA,NA,NA,WHA approves SARS resolution,https://www.who.int/csr/don/2003_05_27a/en/,DON-2003-05-27a
2003-SARS-Global,2,2003,5/28/2003,Severe Acute Respiratory Syndrome (SARS),NA,Global,NA,28 countries,NA,NA,NA,5/28/2003,NA,NA,NA,NA,NA,8240,NA,NA,745,NA,NA,NA,NA,NA,NA,https://www.who.int/csr/don/2003_05_28/en/,DON-2003-05-28
2003-SARS-Global,2,2003,5/28/2003,Severe Acute Respiratory Syndrome (SARS),NA,Taiwan,TWN,NA,NA,NA,NA,5/28/2003,NA,NA,NA,NA,NA,610,NA,NA,81,NA,yes,NA,NA,NA,NA,https://www.who.int/csr/don/2003_05_28/en/,DON-2003-05-28
2003-SARS-Global,2,2003,5/29/2003,Severe Acute Respiratory Syndrome (SARS),NA,Global,NA,NA,NA,NA,NA,5/29/2003,NA,NA,NA,NA,NA,8295,NA,NA,750,NA,NA,NA,NA,NA,NA,https://www.who.int/csr/don/2003_05_29/en/,DON-2003-05-29
2003-SARS-CHN,2,2003,5/29/2003,Severe Acute Respiratory Syndrome (SARS),NA,China,CHN,"Beijing, Tianjin, Shanxi",NA,NA,NA,5/29/2003,NA,NA,NA,NA,NA,NA,NA,NA,NA,NA,yes,NA,NA,NA,NA,https://www.who.int/csr/don/2003_05_29/en/,DON-2003-05-29
2003-SARS-Global,2,2003,5/30/2003,Severe Acute Respiratory Syndrome (SARS),NA,Singapore,SGP,NA,NA,NA,3/9/2003,5/29/2003,NA,NA,5/31/2003,NA,NA,206,NA,NA,NA,NA,yes,NA,NA,NA,NA,https://www.who.int/csr/don/2003_05_30a/en/,DON-2003-05-30a
2003-SARS-Global,2,2003,5/30/2003,Severe Acute Respiratory Syndrome (SARS),NA,Global,NA,29 countries,NA,NA,NA,5/30/2003,NA,no,NA,NA,NA,8384,NA,NA,770,NA,yes,NA,NA,NA,NA,https://www.who.int/csr/don/2003_06_02a/en/,DON-2003-06-02a
2003-SARS-CHN,2,2003,6/3/2003,Severe Acute Respiratory Syndrome (SARS),NA,China,CHN,"Guangdong, other provinces",NA,NA,NA,NA,NA,NA,NA,NA,NA,NA,NA,NA,NA,NA,yes,NA,NA,NA,NA,https://www.who.int/csr/don/2003_06_03/en/,DON-2003-06-03
2003-SARS-Global,2,2003,6/4/2003,Severe Acute Respiratory Syndrome (SARS),NA,Global,NA,29 countries,NA,NA,NA,6/4/2003,NA,NA,NA,NA,NA,8402,NA,NA,772,NA,yes,NA,NA,NA,NA,https://www.who.int/csr/don/2003_06_04/en/,DON-2003-06-04
2003-SARS-Global,2,2003,6/5/2003,Severe Acute Respiratory Syndrome (SARS),NA,Global,NA,29 countries,NA,NA,NA,6/5/2003,NA,NA,NA,NA,NA,8403,NA,NA,775,NA,yes,NA,NA,NA,global decline,https://www.who.int/csr/don/2003_06_05/en/,DON-2003-06-05
2003-SARS-Global,2,2003,6/6/2003,Severe Acute Respiratory Syndrome (SARS),NA,Singapore,SGP,NA,NA,NA,NA,NA,NA,NA,NA,NA,NA,NA,NA,NA,NA,NA,6/6/2003,NA,NA,NA,NA,https://www.who.int/csr/don/2003_06_06/en/,DON-2003-06-06
2003-SARS-CHN,2,2003,6/9/2003,Severe Acute Respiratory Syndrome (SARS),NA,China,CHN,NA,NA,NA,NA,6/9/2003,NA,NA,NA,NA,NA,0,NA,NA,NA,NA,NA,NA,NA,NA,no new cases,https://www.who.int/csr/don/2003_06_09/en/,DON-2003-06-09
2003-SARS-Global,2,2003,6/9/2003,Severe Acute Respiratory Syndrome (SARS),NA,Taiwan,TWN,Taipei,NA,NA,NA,6/9/2003,NA,NA,NA,NA,NA,4,NA,NA,NA,NA,yes,NA,NA,NA,new cases,https://www.who.int/csr/don/2003_06_09/en/,DON-2003-06-09
2003-SARS-Global,2,2003,6/9/2003,Severe Acute Respiratory Syndrome (SARS),NA,Hong Kong,HKG,NA,NA,NA,NA,6/9/2003,NA,NA,NA,NA,NA,1,NA,NA,1,NA,NA,NA,NA,NA,new cases,https://www.who.int/csr/don/2003_06_09/en/,DON-2003-06-09
2003-SARS-CHN,2,2003,6/10/2003,Severe Acute Respiratory Syndrome (SARS),NA,China,CHN,Guangdong,NA,NA,NA,NA,NA,NA,NA,NA,NA,NA,NA,NA,NA,NA,6/10/2003,NA,NA,NA,NA,https://www.who.int/csr/don/2003_06_10/en/,DON-2003-06-10
2003-Yellow Fever-SDN,6,2003,6/11/2003,Yellow fever,NA,Sudan,SDN,Torit County,NA,NA,NA,NA,NA,NA,NA,NA,NA,NA,NA,NA,NA,NA,yes,NA,NA,NA,NA,https://www.who.int/csr/don/2003_06_11/en/,DON-2003-06-11
2003-SARS-Global,2,2003,6/11/2003,Severe Acute Respiratory Syndrome (SARS),NA,Canada,CAN,Toronto,NA,NA,NA,5/22/2003,NA,NA,NA,NA,NA,NA,NA,NA,NA,NA,yes,NA,NA,NA,NA,https://www.who.int/csr/don/2003_06_11a/en/,DON-2003-06-11a
2003-SARS-CHN,2,2003,6/12/2003,Severe Acute Respiratory Syndrome (SARS),NA,China,CHN,NA,NA,mid-November 2003,NA,NA,NA,NA,NA,NA,NA,NA,NA,NA,NA,NA,yes,6/12/2003,NA,NA,NA,https://www.who.int/csr/don/2003_06_12/en/,DON-2003-06-12
2003-Cholera-COD,5,2003,6/13/2003,Cholera,NA,Democratic Republic of the Congo,COD,"Sud Kivu, Katanga, Kasai Oriental, Tsilingue",NA,NA,NA,6/8/2003,NA,NA,NA,NA,NA,NA,NA,13452,380,2.82,yes,NA,NA,NA,NA,https://www.who.int/csr/don/2003_06_13a/en/,DON-2003-06-13a
2003-SARS-CHN,2,2003,6/13/2003,Severe Acute Respiratory Syndrome (SARS),NA,China,CHN,"Hebei, Inner Mongolia, Shanxi, Tianjin",NA,NA,NA,NA,NA,NA,NA,NA,NA,NA,NA,NA,NA,NA,yes,NA,NA,NA,remove travel restrictions; end of outbreak in some areas,https://www.who.int/csr/don/2003_06_13/en/,DON-2003-06-13
2003-SARS-Global,2,2003,6/13/2003,Severe Acute Respiratory Syndrome (SARS),NA,Canada,CAN,Toronto,NA,NA,NA,NA,NA,NA,NA,NA,NA,NA,NA,NA,NA,NA,NA,NA,NA,NA,Pattern B -> C,https://www.who.int/csr/don/2003_06_13/en/,DON-2003-06-13
2003-SARS-Global,2,2003,6/16/2003,Severe Acute Respiratory Syndrome (SARS),NA,Global,NA,Kuala Lumpur,NA,NA,NA,NA,NA,no,NA,NA,NA,NA,NA,NA,NA,NA,6/17/2003,NA,NA,NA,global scientific meeting,https://www.who.int/csr/don/2003_06_16/en/,DON-2003-06-16
2003-Cholera-MOZ,5,2003,6/16/2003,Cholera,NA,Mozambique,MOZ,"Maputo, Gaza, Sofala",NA,NA,1/1/2003,6/15/2003,NA,NA,NA,NA,NA,NA,NA,11796,87,0.74,yes,NA,NA,NA,NA,https://www.who.int/csr/don/2003_06_16a/en/,DON-2003-06-16a
2003-SARS-Global,2,2003,6/17/2003,Severe Acute Respiratory Syndrome (SARS),NA,Taiwan,TWN,NA,NA,NA,NA,NA,NA,NA,NA,NA,NA,NA,NA,NA,NA,NA,yes,NA,NA,NA,lift travel advisory,https://www.who.int/csr/don/2003_06_17/en/,DON-2003-06-17
2003-Typhoid Fever-HTI,5,2003,6/17/2003,Typhoid fever,NA,Haiti,HTI,Grand Bois,04/??/2003,NA,NA,5/30/2003,NA,yes,NA,NA,3,NA,NA,200,40,NA,yes,yes,NA,NA,NA,https://www.who.int/csr/don/2003_06_17a/en/,DON-2003-06-17a
2003-SARS-Global,2,2003,6/18/2003,Severe Acute Respiratory Syndrome (SARS),NA,Global,NA,NA,late November 2002,NA,NA,NA,NA,no,NA,NA,NA,NA,NA,NA,NA,15,yes,NA,NA,NA,100 days,https://www.who.int/csr/don/2003_06_18/en/,DON-2003-06-18
2003-Cholera-IRQ,5,2003,6/19/2003,Cholera,NA,Iraq,IRQ,"Basra, Missan, Muthana",NA,NA,4/28/2003,NA,NA,yes,NA,NA,73,NA,NA,NA,0,NA,yes,yes,NA,NA,NA,https://www.who.int/csr/don/2003_06_17A/en/,DON-2003-06-17A
2003-SARS-Global,2,2003,6/19/2003,Severe Acute Respiratory Syndrome (SARS),NA,Global,NA,NA,NA,NA,NA,NA,NA,no,NA,NA,NA,NA,NA,NA,NA,NA,yes,NA,NA,NA,NA,https://www.who.int/csr/don/2003_06_19/en/,DON-2003-06-19
2003-SARS-Global,2,2003,6/20/2003,Severe Acute Respiratory Syndrome (SARS),NA,Hong Kong,HKG,NA,NA,NA,NA,NA,NA,no,6/22/2003,NA,NA,NA,NA,NA,NA,NA,yes,NA,NA,NA,NA,https://www.who.int/csr/don/2003_06_20/en/,DON-2003-06-20
2003-SARS-Global,2,2003,6/23/2003,Severe Acute Respiratory Syndrome (SARS),NA,Hong Kong,NA,NA,NA,NA,NA,NA,NA,NA,6/23/2003,NA,NA,NA,NA,NA,NA,NA,yes,NA,NA,NA,NA,https://www.who.int/csr/don/2003_06_23/en/,DON-2003-06-23
2003-Plague-DZA,2,2003,6/24/2003,Plague,NA,Algeria,DZA,Tafraoui,NA,NA,NA,6/23/2003,NA,NA,NA,NA,NA,NA,NA,10,1,NA,yes,NA,NA,NA,NA,https://www.who.int/csr/don/2003_06_24a/en/,DON-2003-06-24a
2003-SARS-CHN,2,2003,6/24/2003,Severe Acute Respiratory Syndrome (SARS),NA,China,CHN,Beijing,NA,NA,NA,NA,NA,NA,yes,NA,NA,2521,NA,NA,191,NA,yes,NA,NA,NA,remove Beijing travel advisory,https://www.who.int/csr/don/2003_06_24/en/,DON-2003-06-24
2003-SARS-CHN,2,2003,6/25/2003,Severe Acute Respiratory Syndrome (SARS),NA,China,CHN,Guangdong,mid-November 2002,NA,NA,6/25/2003,NA,NA,NA,NA,NA,1,NA,NA,NA,NA,NA,NA,NA,NA,new case,https://www.who.int/csr/don/2003_06_25/en/,DON-2003-06-25
2003-SARS-Global,2,2003,6/25/2003,Severe Acute Respiratory Syndrome (SARS),NA,Japan,JPN,Tokyo,6/22/2003,NA,NA,6/25/2003,NA,NA,NA,NA,NA,1,NA,NA,NA,NA,yes,NA,NA,NA,new case,https://www.who.int/csr/don/2003_06_25/en/,DON-2003-06-25
2003-SARS-Global,2,2003,6/26/2003,Severe Acute Respiratory Syndrome (SARS),NA,Global,NA,"Toronto, Taiwan",mid-November 2002,NA,NA,NA,NA,NA,NA,NA,NA,NA,NA,NA,NA,15,yes,NA,NA,NA,NA,https://www.who.int/csr/don/2003_06_26/en/,DON-2003-06-26
2003-SARS-Global,2,2003,6/27/2003,Severe Acute Respiratory Syndrome (SARS),NA,Japan,JPN,NA,NA,NA,NA,NA,NA,no,NA,NA,NA,NA,NA,NA,NA,NA,NA,NA,NA,NA,NA,https://www.who.int/csr/don/2003_06_27/en/,DON-2003-06-27
2003-SARS-Global,2,2003,6/30/2003,Severe Acute Respiratory Syndrome (SARS),NA,Global,NA,NA,NA,NA,NA,6/15/2003,NA,NA,NA,NA,NA,NA,NA,NA,NA,NA,yes,NA,NA,NA,no new cases; patents,https://www.who.int/csr/don/2003_06_30/en/,DON-2003-06-30
2003-SARS-Global,2,2003,7/1/2003,Severe Acute Respiratory Syndrome (SARS),NA,Global,NA,"Toronto, Taiwan",NA,NA,NA,NA,NA,NA,NA,NA,NA,NA,NA,NA,NA,NA,yes,3/12/2003,NA,NA,chronology of travel recommendations,https://www.who.int/csr/don/2003_07_01/en/,DON-2003-07-01
2003-SARS-Global,2,2003,7/2/2003,Severe Acute Respiratory Syndrome (SARS),NA,Canada,CAN,Toronto,NA,NA,NA,NA,NA,NA,7/2/2003,NA,NA,NA,NA,NA,NA,NA,yes,NA,NA,NA,NA,https://www.who.int/csr/don/2003_07_02/en/,DON-2003-07-02
2003-Plague-DZA,2,2003,7/3/2003,Plague,NA,Algeria,DZA,NA,NA,NA,NA,7/2/2003,NA,yes,NA,NA,8,NA,NA,10,1,NA,yes,NA,NA,NA,NA,https://www.who.int/csr/don/2003_07_03b/en/,DON-2003-07-03b
2003-Cholera-LBR,5,2003,7/3/2003,Cholera,NA,Liberia,LBR,"Monrovia, Bushrod",NA,NA,6/6/2003,NA,NA,NA,NA,NA,NA,NA,NA,586,NA,NA,yes,NA,NA,NA,NA,https://www.who.int/csr/don/2003_07_03a/en/,DON-2003-07-03a
2003-SARS-Global,2,2003,7/3/2003,Severe Acute Respiratory Syndrome (SARS),NA,Global,NA,NA,NA,NA,NA,NA,NA,no,NA,NA,NA,NA,NA,NA,NA,NA,yes,NA,NA,NA,NA,https://www.who.int/csr/don/2003_07_03/en/,DON-2003-07-03
2003-SARS-Global,2,2003,7/4/2003,Severe Acute Respiratory Syndrome (SARS),NA,Global,NA,NA,11/16/2002,NA,2/10/2003,2/11/2003,NA,NA,7/5/2003,NA,NA,NA,NA,NA,NA,NA,yes,3/12/2003,NA,NA,chronology,https://www.who.int/csr/don/2003_07_04/en/,DON-2003-07-04
2003-SARS-Global,2,2003,7/5/2003,Severe Acute Respiratory Syndrome (SARS),NA,Taiwan,TWN,NA,NA,3/8/2003,NA,NA,NA,NA,7/5/2003,NA,NA,NA,NA,674,84,NA,yes,yes,NA,NA,NA,https://www.who.int/csr/don/2003_07_05/en/,DON-2003-07-05
2003-Plague-DZA,2,2003,7/10/2003,Plague,NA,Algeria,DZA,Oran,NA,NA,NA,7/9/2003,NA,yes,NA,NA,10,1,NA,NA,NA,NA,yes,NA,NA,NA,NA,https://www.who.int/csr/don/2003_07_10/en/,DON-2003-07-10
2003-Cholera-LBR,5,2003,7/15/2003,Cholera,NA,Liberia,LBR,Monrovia,NA,NA,5/30/2003,NA,NA,NA,NA,NA,NA,NA,NA,1630,15,NA,yes,yes,NA,NA,NA,https://www.who.int/csr/don/2003_07_15/en/,DON-2003-07-15
2003-Influenza-HKG,3,2003,7/28/2003,Influenza,NA,Hong Kong,HKG,"2 elderly homes, two in homes fort the mentally deficient including the Lai King Hostel",NA,NA,NA,7/28/2003,NA,yes,NA,NA,8,NA,NA,NA,NA,NA,NA,NA,NA,NA,NA,https://www.who.int/csr/don/2003_07_28/en/,DON-2003-07-28
2003-Cholera-LBR,5,2003,8/13/2003,Cholera,NA,Liberia,LBR,Monrovia,NA,NA,NA,NA,NA,NA,NA,NA,NA,NA,NA,1944,17,NA,yes,NA,NA,NA,NA,https://www.who.int/csr/don/2003_08_13/en/,DON-2003-08-13
2003-Legionellosis-FRA,5,2003,8/14/2003,Legionellosis,NA,France,FRA,Hérault,NA,NA,yes,NA,NA,NA,NA,NA,NA,NA,NA,29,2,NA,yes,NA,NA,NA,NA,https://www.who.int/csr/don/2003_08_14a/en/,DON-2003-08-14a
2003-Legionellosis-FRA,5,2003,8/18/2003,Legionellosis,NA,France,FRA,Hérault,NA,NA,NA,NA,NA,yes,NA,NA,NA,NA,NA,30,3,NA,yes,NA,NA,NA,NA,https://www.who.int/csr/don/2003_08_18/en/,DON-2003-08-18
2003-Cholera-LBR,5,2003,8/18/2003,Cholera,NA,Liberia,LBR,Monrovia,NA,NA,NA,NA,NA,NA,NA,NA,NA,NA,NA,NA,NA,NA,yes,yes,NA,NA,NA,https://www.who.int/csr/don/2003_08_18a/en/,DON-2003-08-18a
2003-Yellow Fever-SLE,6,2003,8/19/2003,Yellow fever,NA,Sierra Leone,SLE,Tonkolili,NA,NA,NA,NA,NA,NA,NA,NA,1,NA,45,NA,NA,NA,8/7/2003,NA,NA,NA,NA,https://www.who.int/csr/don/2003_08_19/en/,DON-2003-08-19
2003-Cholera-LBR,5,2003,8/25/2003,Cholera,NA,Liberia,LBR,Monrovia,NA,NA,NA,beginning 2003,NA,NA,NA,NA,NA,NA,NA,3889,NA,NA,NA,NA,NA,NA,NA,https://www.who.int/csr/don/2003_08_25/en/,DON-2003-08-25
2003-Human Coronavirus OC43-CAN,1,2003,8/25/2003,OC43,NA,Canada,CAN,Surrey,NA,NA,NA,NA,NA,yes,NA,NA,NA,NA,NA,143,NA,NA,yes,NA,NA,NA,NA,https://www.who.int/csr/don/2003_08_25a/en/,DON-2003-08-25a
2003-Diphtheria-AFG,1,2003,8/29/2003,Diptheria,NA,Afghanistan,AFG,Kandahar (resettlement camp),6/12/2003,NA,NA,8/9/2003,NA,yes,NA,NA,NA,NA,NA,50,3,6,8/2/2003,NA,NA,NA,NA,https://www.who.int/csr/don/2003_08_29/en/,DON-2003-08-29
2003-Cholera-LBR,5,2003,9/2/2003,Cholera,NA,Liberia,LBR,Monrovia,06/??/2003,NA,NA,NA,NA,NA,NA,NA,NA,NA,NA,6353,NA,NA,yes,NA,NA,NA,NA,https://www.who.int/csr/don/2003_09_02/en/,DON-2003-09-02
2003-SARS-SGP,2,2003,9/10/2003,Severe Acute Respiratory Syndrome (SARS),NA,Singapore,SGP,NA,NA,NA,NA,NA,NA,yes,NA,NA,1,NA,NA,NA,0,NA,yes,NA,NA,NA,NA,https://www.who.int/csr/don/2003_09_10/en/,DON-2003-09-10
2003-SARS-SGP,2,2003,9/16/2003,Severe Acute Respiratory Syndrome (SARS),NA,Singapore,SGP,NA,NA,NA,NA,yes,yes,yes,NA,NA,1,NA,NA,NA,0,NA,yes,NA,NA,NA,NA,https://www.who.int/csr/don/2003_09_16/en/,DON-2003-09-16
2003-SARS-SGP,2,2003,9/24/2003,Severe Acute Respiratory Syndrome (SARS),NA,Singapore,SGP,NA,NA,NA,NA,NA,yes,9/8/2003,NA,NA,NA,NA,NA,NA,NA,NA,yes,NA,NA,NA,laboratory accident,https://www.who.int/csr/don/2003_09_24/en/,DON-2003-09-24
2003-Cholera-LBR,5,2003,9/30/2003,Cholera,NA,Liberia,LBR,"Buchanan, Monrovia, mostly Central Monrovia, Paynesville and Sinkor",06/??/2003,NA,NA,yes,NA,NA,NA,NA,NA,NA,NA,17561,NA,NA,yes,NA,NA,NA,NA,https://www.who.int/csr/don/2003_09_30/en/,DON-2003-09-30
2003-Yellow Fever-SLE,6,2003,9/30/2003,Yellow fever,NA,Sierra Leone,SLE,"Tonkolili, Bombali, Kenema, Koinadugu, Porto Loko, Kambia, Kono",NA,NA,NA,9/29/2003,NA,yes,NA,NA,4,NA,NA,90,10,NA,8/22/2003,NA,NA,NA,NA,https://www.who.int/csr/don/2003_09_30a/en/,DON-2003-09-30a
2003-WPV-TGO,5,2003,10/9/2003,Poliomyelitis,NA,Togo,TGO,NA,7/22/2003,NA,NA,NA,NA,yes,NA,NA,1,NA,NA,1,NA,NA,10/22/2003,NA,NA,NA,NA,https://www.who.int/csr/don/2003_10_09/en/,DON-2003-10-09
2003-WPV-BFA,5,2003,10/9/2003,Poliomyelitis,NA,Burkina Faso,BFA,NA,NA,NA,NA,NA,NA,NA,NA,NA,NA,NA,NA,1,NA,NA,10/22/2003,NA,NA,NA,NA,https://www.who.int/csr/don/2003_10_09/en/,DON-2003-10-09
2003-WPV-GHA,5,2003,10/9/2003,Poliomyelitis,NA,Ghana,GHA,NA,NA,NA,NA,NA,NA,NA,NA,NA,NA,NA,NA,1,NA,NA,10/22/2003,NA,NA,NA,NA,https://www.who.int/csr/don/2003_10_09/en/,DON-2003-10-09
2003-Yellow Fever-BFA,6,2003,10/10/2003,Yellow fever,NA,Burkina Faso,BFA,Gaoua,NA,NA,NA,yes,yes,yes,NA,NA,NA,NA,NA,NA,NA,NA,yes,NA,NA,NA,NA,https://www.who.int/csr/don/2003_10_10/en/,DON-2003-10-10
2003-WPV-TCD,5,2003,10/29/2003,Poliomyelitis,NA,Chad,TCD,"Mayo-Kebbi, Logone Orientale",8/2/2003,NA,NA,NA,NA,yes,NA,NA,2,NA,NA,NA,NA,NA,11/11/2003,NA,NA,NA,NA,https://www.who.int/csr/don/2003_10_29/en/,DON-2003-10-29
2003-Dengue-IND,6,2003,10/30/2003,Dengue fever,NA,India,IND,"Delhi, surrounding areas",NA,NA,6/1/2003,NA,NA,yes,NA,NA,1723,NA,NA,NA,4,NA,yes,NA,NA,NA,NA,https://www.who.int/csr/don/2003_10_30/en/,DON-2003-10-30
2003-Shigella-LBR,5,2003,11/5/2003,Shigella,NA,Liberia,LBR,Monrovia,NA,NA,8/18/2003,NA,NA,yes,NA,NA,NA,NA,NA,1857,NA,NA,yes,NA,NA,NA,NA,https://www.who.int/csr/don/2003_11_05/en/,DON-2003-11-05
2003-Shigella-CAF,5,2003,11/5/2003,Shigellosis,NA,Central African Republic,CAF,"Paoua, Bozoum",6/16/2003,NA,NA,NA,NA,yes,NA,NA,NA,NA,NA,379,23,NA,yes,NA,NA,NA,NA,https://www.who.int/csr/don/2003_11_05a/en/,DON-2003-11-05a
2003-Ebola-COG,2,2003,11/7/2003,Acute haemorrhagic fever syndrome,NA,Republic of the Congo,COG,Mbomo,NA,NA,11/7/2003,NA,NA,NA,NA,NA,NA,NA,12,NA,9,NA,yes,NA,NA,NA,NA,https://www.who.int/csr/don/2003_11_07/en/,DON-2003-11-07
2003-Dengue-IND,6,2003,11/12/2003,Dengue fever,NA,India,IND,"Delhi, surrounding areas",NA,NA,6/1/2003,NA,NA,yes,NA,NA,2185,NA,NA,NA,NA,NA,yes,NA,NA,NA,NA,https://www.who.int/csr/don/2003_11_12/en/,DON-2003-11-12
2003-Ebola-COG,2,2003,11/17/2003,Ebola haemorrhagic fever,NA,Republic of the Congo,COG,Mbomo,NA,NA,NA,11/17/2003,yes,yes,NA,NA,1,NA,NA,11,11,NA,yes,NA,NA,NA,NA,https://www.who.int/csr/don/2003_11_17/en/,DON-2003-11-17
2003-Cholera-BEN,5,2003,11/20/2003,Cholera,NA,Benin,BEN,"Atlantique, Borgou",NA,NA,NA,yes,NA,yes,NA,NA,NA,NA,NA,265,3,NA,yes,yes,NA,NA,NA,https://www.who.int/csr/don/2003_11_20/en/,DON-2003-11-20
2003-Ebola-COG,2,2003,11/21/2003,Ebola haemorrhagic fever,NA,Republic of the Congo,COG,"Mbomo, Mbandza",NA,NA,NA,11/21/2003,NA,yes,NA,NA,NA,NA,NA,24,12,NA,NA,NA,NA,NA,NA,https://www.who.int/csr/don/2003_11_21/en/,DON-2003-11-21
2003-Influenza-Northern Hemisphere,3,2003,11/21/2003,Influenza,NA,Northrern Hemisphere,NA,"Canada, Finland, France, Israel, Norway, Portugal, Spain, the United Kingdom, the United States of America",NA,NA,NA,NA,NA,yes,NA,NA,NA,NA,NA,NA,NA,NA,NA,NA,NA,NA,early start,https://www.who.int/csr/don/2003_11_21a/en/,DON-2003-11-21a
2003-Cholera-MLI,5,2003,11/25/2003,Cholera,NA,Mali,MLI,"Segou, Mopti, Koulikoro",NA,NA,NA,8/11/2003,NA,yes,NA,NA,NA,NA,NA,693,55,NA,yes,NA,NA,NA,NA,https://www.who.int/csr/don/2003_11_25/en/,DON-2003-11-25
2003-Ebola-COG,2,2003,11/25/2003,Ebola haemorrhagic fever,NA,Republic of the Congo,COG,"Mbomo, Mbandza",NA,NA,NA,11/24/2003,NA,NA,NA,NA,NA,NA,NA,36,18,NA,yes,NA,NA,NA,NA,https://www.who.int/csr/don/2003_11_25a/en/,DON-2003-11-25a
2003-Ebola-COG,2,2003,12/3/2003,Ebola haemorrhagic fever,NA,Republic of the Congo,COG,Mbomo district,NA,NA,NA,12/2/2003,NA,yes,NA,NA,NA,NA,NA,47,28,NA,yes,yes,NA,NA,NA,https://www.who.int/csr/don/2003_12_03/en/,DON-2003-12-03
2003-Cholera-MLI,5,2003,12/4/2003,Cholera,NA,Mali,MLI,"Segou, Mopti, Koulikoro",NA,NA,NA,12/2/2003,NA,NA,NA,NA,NA,NA,NA,1149,78,NA,yes,NA,NA,NA,NA,https://www.who.int/csr/don/2003_12_04/en/,DON-2003-12-04
2003-H3 Influenza-Northern Hemisphere,3,2003,12/4/2003,Influenza A/H3N2,NA,Northern Hemisphere,NA,"France, Norway, Spain, Portugal, USA, UK, Canada",NA,NA,NA,NA,NA,NA,NA,NA,NA,NA,NA,NA,NA,NA,NA,NA,NA,NA,NA,https://www.who.int/csr/don/2003_12_04a/en/,DON-2003-12-04a
2003-H9 Influenza-HKG,3,2003,12/10/2003,A(H9N2),NA,Hong Kong,HKG,NA,NA,NA,NA,12/9/2003,NA,yes,NA,NA,1,NA,NA,NA,0,NA,yes,NA,NA,NA,NA,https://www.who.int/csr/don/2003_12_10/en/,DON-2003-12-10
2003-Influenza-Northern Hemisphere,3,2003,12/10/2003,Influenza,NA,Northern Hemisphere,NA,"Finland, France, Norway, United States, Portugal, Spain, UK, Canada, Czech Republic, Denmark, Italy, Latvia, Russian Federation, Switzerland, Hong Kong SAR, Republic of Korea, Thailand",NA,NA,NA,NA,NA,yes,NA,NA,NA,NA,NA,NA,NA,NA,NA,NA,NA,NA,NA,https://www.who.int/csr/don/2003_12_10a/en/,DON-2003-12-10a
2003-Ebola-COG,2,2003,12/12/2003,Ebola haemorrhagic fever,NA,Republic of the Congo,COG,Mbomo district,NA,NA,NA,12/11/2003,NA,NA,NA,NA,NA,31,NA,NA,29,NA,yes,NA,NA,NA,NA,https://www.who.int/csr/don/2003_12_12/en/,DON-2003-12-12
2003-Ebola-TWN,2,2003,12/17/2003,Severe Acute Respiratory Syndrome (SARS),NA,Taiwan,TWN,NA,NA,NA,NA,yes,NA,yes,NA,NA,NA,NA,NA,NA,NA,NA,yes,NA,NA,NA,laboratory acquired,https://www.who.int/csr/don/2003_12_17/en/,DON-2003-12-17
2003-Cholera-MLI,5,2003,12/17/2003,Cholera,NA,Mali,MLI,"Koulikoro, Segou, Mopti, Tombouctou, Sikasso",NA,NA,NA,12/12/2003,NA,NA,NA,NA,NA,NA,NA,1216,106,8.72,yes,NA,NA,NA,NA,https://www.who.int/csr/don/2003_12_17c/en/,DON-2003-12-17c
2003-Influenza-Northern Hemisphere,3,2003,12/17/2003,Influenza,NA,Northern Hemisphere,NA,"Finland, France, Norway, Russian Federation, Switzerland , USA, Portugal, Spain, Canada, UK, Denmark, Italy, Ukraine, Honk Kong SAR",NA,NA,NA,NA,NA,yes,NA,NA,NA,NA,NA,NA,NA,NA,NA,NA,NA,NA,NA,https://www.who.int/csr/don/2003_12_17a/en/,DON-2003-12-17a
2003-Influenza-Northern Hemisphere,3,2003,12/23/2003,Influenza,NA,Northern Hemisphere,NA,"Tunisia, Czech Republic, Denmark, Finland, Italy, Norway, Russia, Switzerland, Russia Federation, Ukraine, USA, Canada, France, Portugal, Spain, UK, Hong Kong, Republic of Korea",NA,NA,NA,NA,NA,yes,NA,NA,NA,NA,NA,NA,NA,NA,yes,NA,NA,NA,NA,https://www.who.int/csr/don/2003_12_23/en/,DON-2003-12-23
2003-SARS-CHN,2,2003,12/28/2003,Severe Acute Respiratory Syndrome (SARS),NA,China,CHN,southern China,NA,NA,NA,NA,NA,no,NA,NA,NA,NA,NA,NA,NA,NA,NA,NA,NA,NA,NA,https://www.who.int/csr/don/2003_12_28/en/,DON-2003-12-28
2003-SARS-CHN,2,2003,12/30/2003,Severe Acute Respiratory Syndrome (SARS),NA,China,CHN,southern China,NA,NA,NA,12/26/2003,NA,no,NA,NA,NA,NA,1,NA,0,NA,yes,NA,NA,NA,NA,https://www.who.int/csr/don/2003_12_30/en/,DON-2003-12-30
2003-SARS-CHN,2,2004,1/5/2004,Severe Acute Respiratory Syndrome (SARS),NA,China,CHN,Guangdong,NA,12/20/2003,NA,12/26/2003,NA,1/5/2004,NA,NA,1,NA,NA,1,0,NA,12/26/2003,NA,NA,NA,NA,https://www.who.int/csr/don/2004_01_05/en/,DON-2004-01-05
2003-Ebola-COG,2,2004,1/6/2004,Ebola haemorrhagic fever,NA,Republic of the Congo,COG,"Mbomo, Mbandza",NA,NA,NA,12/24/2003,yes,yes,NA,NA,16,NA,NA,35,29,NA,yes,yes,NA,NA,NA,https://www.who.int/csr/don/2004_01_06/en/,DON-2004-01-06
2003-Influenza-Global,3,2004,1/7/2004,Influenza,NA,Global,NA,"Czech Republic, Finland, Greece, Israel, Russian Federation, Switzerland, Ukraine, Belgium, France, Norway, Portugal, Spain, the United Kingdom, Canada, USA, Hong Kong SAR, Japan, Thailand, Algeria, Madagascar",NA,NA,yes,NA,NA,yes,NA,NA,NA,NA,NA,NA,NA,NA,yes,NA,NA,NA,NA,https://www.who.int/csr/don/2004_01_07/en/,DON-2004-01-07
2003-SARS-CHN,2,2004,1/8/2004,Severe Acute Respiratory Syndrome (SARS),NA,China,CHN,Guangzhou,12/25/2003,12/31/2003,NA,NA,NA,yes,NA,NA,1,NA,1,2,0,NA,yes,NA,NA,NA,NA,https://www.who.int/csr/don/2004_01_08/en/,DON-2004-01-08
2004-H5 Influenza-VNM,3,2004,1/13/2004,H5N1,NA,Vietnam,VNM,Hanoi,NA,end October 2003,NA,NA,NA,1/11/2004,NA,NA,3,NA,NA,14,12,NA,yes,NA,NA,NA,NA,https://www.who.int/csr/don/2004_01_13/en/,DON-2004-01-13
2004-H3 Influenza-Global,3,2004,1/13/2004,H3N2,NA,Global,NA,"Croatia, Denmark, Finland, France, Norway, Switzerland, Croatia, Latvia and Switzerland, Republic of Korea, Thailand, UK, USA",NA,NA,yes,NA,NA,yes,NA,NA,NA,NA,NA,NA,NA,NA,yes,NA,NA,NA,NA,https://www.who.int/csr/don/2004_01_13a/en/,DON-2004-01-13a
2004-H5 Influenza-VNM,3,2004,1/14/2004,H5N1,NA,Vietnam,VNM,NA,NA,beginning January 2004,NA,NA,NA,yes,NA,NA,NA,NA,NA,NA,NA,NA,yes,NA,NA,NA,NA,https://www.who.int/csr/don/2004_01_14/en/,DON-2004-01-14
2004-H5 Influenza-KOR,3,2004,1/14/2004,H5N1,NA,Republic of Korea,KOR,NA,no,NA,NA,NA,NA,NA,NA,NA,NA,NA,NA,0,0,NA,yes,NA,NA,NA,animals,https://www.who.int/csr/don/2004_01_14/en/,DON-2004-01-14
2004-H5 Influenza-JAP,3,2004,1/14/2004,H5N1,NA,Japan,JPN,NA,no,NA,NA,NA,NA,NA,NA,NA,NA,NA,NA,0,0,NA,yes,NA,NA,NA,animals,https://www.who.int/csr/don/2004_01_14/en/,DON-2004-01-14
2004-H5 Influenza-VNM,3,2004,1/16/2004,H5N1,NA,Vietnam,VNM,Hanoi,NA,NA,NA,NA,NA,yes,NA,NA,4,NA,NA,NA,NA,NA,yes,NA,NA,NA,NA,https://www.who.int/csr/don/2004_01_16/en/,DON-2004-01-16
2004-H5 Influenza-VNM,3,2004,1/19/2004,H5N1,NA,Vietnam,VNM,Hanoi,NA,1/15/2004,NA,NA,NA,yes,NA,NA,5,NA,NA,NA,5,NA,NA,NA,NA,NA,NA,https://www.who.int/csr/don/2004_01_19/en/,DON-2004-01-19
2004-H5 Influenza-VNM,3,2004,1/20/2004,H5N1,NA,Vietnam,VNM,Hanoi,NA,NA,NA,NA,NA,yes,NA,NA,5,NA,NA,NA,5,NA,yes,NA,NA,NA,vaccine development,https://www.who.int/csr/don/2004_01_20/en/,DON-2004-01-20
2004-H3 Influenza-Global,3,2004,1/21/2004,Influenza A/H3N2,NA,Global,NA,"Austria, Croatia, Latvia, Norway, Russia Federation, Slovenia, Switzerland, Ukraine, Canada, USA",NA,NA,NA,NA,NA,yes,NA,NA,NA,NA,NA,NA,NA,NA,yes,NA,NA,NA,NA,https://www.who.int/csr/don/2004_01_21/en/,DON-2004-01-21
2004-H5 Influenza-VNM,3,2004,1/22/2004,H5N1,NA,Vietnam,VNM,NA,NA,NA,NA,NA,NA,yes,NA,NA,NA,NA,NA,NA,NA,NA,yes,NA,NA,NA,NA,https://www.who.int/csr/don/2004_01_22/en/,DON-2004-01-22
2004-H5 Influenza-THA,3,2004,1/23/2004,H5N1,NA,Thailand,THA,"Suphanburi, Kanchanaburi",1/3/2004,NA,NA,1/23/2003,NA,1/23/2004,NA,NA,2,NA,NA,NA,NA,NA,yes,NA,NA,NA,NA,https://www.who.int/csr/don/2004_01_23/en/,DON-2004-01-23
2004-H5 Influenza-VNM,3,2004,1/24/2004,H5N1,NA,Vietnam,VNM,"Ho Chi Minh City, Hanoi",NA,NA,NA,NA,NA,yes,NA,NA,7,NA,NA,NA,6,NA,yes,NA,NA,NA,NA,https://www.who.int/csr/don/2004_01_24/en/,DON-2004-01-24
2004-H5 Influenza-THA,3,2004,1/24/2004,H5N1,NA,Thailand,THA,NA,NA,NA,NA,NA,NA,1/23/2004,NA,NA,2,NA,NA,NA,NA,NA,NA,NA,NA,NA,NA,https://www.who.int/csr/don/2004_01_24/en/,DON-2004-01-24
2004-H5 Influenza-THA,3,2004,1/26/2004,H5N1,NA,Thailand,THA,"Sukhothai, Kanchanaburi, Suphanburi",NA,NA,NA,NA,NA,1/26/2003,NA,NA,3,NA,NA,NA,1,NA,NA,NA,NA,NA,NA,https://www.who.int/csr/don/2004_01_26/en/,DON-2004-01-26
2004-H5 Influenza-THA,3,2004,1/27/2004,H5N1,NA,Thailand,THA,"Sukhothai, Kanchanaburi",NA,NA,NA,1/27/2004,NA,yes,NA,NA,3,NA,NA,NA,2,NA,NA,NA,NA,NA,NA,https://www.who.int/csr/don/2004_01_27a/en/,DON-2004-01-27a
2004-H5 Influenza-VNM,3,2004,1/27/2004,H5N1,NA,Vietnam,VNM,NA,NA,NA,NA,yes,NA,yes,NA,NA,7,NA,NA,NA,6,NA,NA,NA,NA,NA,NA,https://www.who.int/csr/don/2004_01_27a/en/,DON-2004-01-27a
2003-SARS-CHN,2,2004,1/27/2004,Severe Acute Respiratory Syndrome (SARS),NA,China,CHN,Guangdong,NA,NA,NA,NA,yes,1/17/2004,NA,NA,3,NA,NA,NA,NA,NA,yes,NA,NA,NA,NA,https://www.who.int/csr/don/2004_01_27/en/,DON-2004-01-27
2004-H5 Influenza-CHN,3,2004,1/27/2004,H5N1,NA,China,CHN,"Guangxi, Hubei, Hunan",no,NA,NA,NA,NA,yes,NA,NA,0,NA,NA,0,0,NA,yes,NA,NA,NA,detected in poultry,https://www.who.int/csr/don/2004_01_27b/en/,DON-2004-01-27b
2004-H5 Influenza-VNM,3,2004,1/28/2004,H5N1,NA,Vietnam,VNM,"Hanoi, Ho Chi Minh City",12/22/2003,12/29/2003,NA,yes,NA,yes,NA,NA,8,NA,NA,NA,6,NA,yes,yes,NA,NA,NA,https://www.who.int/csr/don/2004_01_28a/en/,DON-2004-01-28a
2004-Cholera-TCD,5,2004,1/28/2004,Cholera,NA,Chad,TCD,Moundou,NA,NA,NA,11/24/2003,NA,NA,NA,NA,NA,NA,NA,131,11,8,yes,yes,NA,NA,NA,https://www.who.int/csr/don/2004_01_28/en/,DON-2004-01-28
2004-Cholera-MOZ,5,2004,1/28/2004,Cholera,NA,Mozambique,MOZ,"Maputo, Gaza, Sofala",NA,NA,NA,12/20/2003,NA,NA,NA,NA,NA,NA,NA,3699,19,NA,1/9/2004,NA,NA,NA,NA,https://www.who.int/csr/don/2004_01_28/en/,DON-2004-01-28
2004-Cholera-ZMB,5,2004,1/28/2004,Cholera,NA,Zambia,ZMB,"Lusaka, Copperbelt, Northern, Central",11/28/2003,NA,NA,1/22/2004,NA,NA,NA,NA,NA,NA,NA,1721,70,4.06,yes,NA,NA,NA,NA,https://www.who.int/csr/don/2004_01_28/en/,DON-2004-01-28
2004-H5 Influenza-Asia,3,2004,1/29/2004,H5N1,NA,Asia,NA,"Cambodia, Japan, South Korea, Viet Nam, Indonesia, Laos, Thailand",NA,NA,NA,NA,NA,yes,NA,NA,NA,NA,NA,NA,NA,NA,yes,NA,NA,NA,NA,https://www.who.int/csr/don/2004_01_29/en/,DON-2004-01-29
2004-H5 Influenza-CHN,3,2004,1/30/2004,H5N1,NA,China,CHN,"Hunan, Hubei, Guangxi, Angui, Shanghai, Guangdong",no,NA,NA,1/30/2004,NA,yes,NA,NA,0,NA,NA,0,0,NA,yes,NA,NA,NA,in poultry,https://www.who.int/csr/don/2004_01_30/en/,DON-2004-01-30
2003-SARS-CHN,2,2004,1/31/2004,Severe Acute Respiratory Syndrome (SARS),NA,China,CHN,Guangdong,1/7/2004,1/16/2004,NA,1/31/2004,yes,yes,NA,NA,3,1,NA,4,NA,NA,yes,NA,NA,NA,NA,https://www.who.int/csr/don/2004_01_31/en/,DON-2004-01-31
2004-H5 Influenza-VNM,3,2004,2/1/2004,H5N1,NA,Vietnam,VNM,"Thai Binh, Hanoi",1/10/2004,1/13/2004,NA,NA,NA,2/1/2004,NA,NA,10,NA,NA,NA,8,NA,yes,NA,NA,NA,NA,https://www.who.int/csr/don/2004_02_01/en/,DON-2004-02-01
2004-H5 Influenza-THA,3,2004,2/2/2004,H5N1,NA,Thailand,THA,NA,1/19/2004,NA,NA,NA,NA,yes,NA,NA,NA,NA,NA,4,3,NA,NA,NA,NA,NA,NA,https://www.who.int/csr/don/2004_02_02/en/,DON-2004-02-02
2004-H5 Influenza-CHN,3,2004,2/2/2004,H5N1,NA,China,CHN,"Zhejiang, Yunnan, Henan, Xinjiang Uygar Autonomous Region, Guangxi, Hunan, Hubei, Shanghai, Guangdong, Anhui",no,NA,yes,yes,NA,yes,NA,NA,0,NA,NA,0,0,NA,NA,NA,NA,NA,poultry,https://www.who.int/csr/don/2004_02_02/en/,DON-2004-02-02
2004-H5 Influenza-VNM,3,2004,2/2/2004,H5N1,NA,Vietnam,VNM,Thai Binh,NA,NA,NA,NA,NA,yes,NA,NA,NA,NA,NA,NA,NA,NA,yes,NA,NA,NA,NA,https://www.who.int/csr/don/2004_02_02/en/,DON-2004-02-02
2004-H5 Influenza-VNM,3,2004,2/3/2004,H5N1,NA,Vietnam,VNM,"Hanoi, Ho Chi Minh City",NA,NA,NA,NA,NA,2/3/2004,NA,NA,13,NA,NA,NA,9,NA,NA,NA,NA,NA,NA,https://www.who.int/csr/don/2004_02_03/en/,DON-2004-02-03
2004-H5 Influenza-THA,3,2004,2/4/2004,H5N1,NA,Thailand,THA,Suphanburi,NA,NA,NA,1/23/2004,NA,yes,NA,NA,4,NA,NA,NA,4,NA,NA,NA,NA,NA,NA,https://www.who.int/csr/don/2004_02_04/en/,DON-2004-02-04
2004-H5 Influenza-CHN,3,2004,2/4/2004,H5N1,NA,China,CHN,poultry farms in 12/31 provinces,no,NA,yes,1/27/2003,NA,yes,NA,NA,0,NA,NA,0,0,NA,NA,NA,NA,NA,NA,https://www.who.int/csr/don/2004_02_04/en/,DON-2004-02-04
2004-H5 Influenza-IDN,3,2004,2/4/2004,H5N1,NA,Indonesia,IDN,NA,no,NA,NA,2/2/2004,NA,yes,NA,NA,0,NA,NA,0,0,NA,NA,NA,NA,NA,NA,https://www.who.int/csr/don/2004_02_04/en/,DON-2004-02-04
2004-H5 Influenza-KOR,3,2004,2/4/2004,H5N1,NA,Republic of Korea,KOR,NA,no,NA,NA,12/12/2003,NA,yes,NA,NA,0,NA,NA,0,0,NA,NA,NA,NA,NA,NA,https://www.who.int/csr/don/2004_02_04/en/,DON-2004-02-04
2004-H5 Influenza-VNM,3,2004,2/4/2004,H5N1,NA,Vietnam,VNM,NA,NA,NA,NA,1/8/2004,NA,yes,NA,NA,NA,NA,NA,NA,NA,NA,NA,NA,NA,NA,NA,https://www.who.int/csr/don/2004_02_04/en/,DON-2004-02-04
2004-H5 Influenza-KHM,3,2004,2/4/2004,H5N1,NA,Cambodia,KHM,NA,no,NA,NA,1/24/2004,NA,yes,NA,NA,0,NA,NA,0,0,NA,NA,NA,NA,NA,NA,https://www.who.int/csr/don/2004_02_04/en/,DON-2004-02-04
2004-H5 Influenza-LAO,3,2004,2/4/2004,H5N1,NA,Laos,LAO,NA,no,NA,NA,1/27/2004,NA,NA,NA,NA,0,NA,NA,0,0,NA,NA,NA,NA,NA,NA,https://www.who.int/csr/don/2004_02_04/en/,DON-2004-02-04
2004-H5 Influenza-VNM,3,2004,2/5/2004,H5N1,NA,Vietnam,VNM,southern,NA,NA,NA,yes,NA,yes,NA,NA,15,NA,NA,NA,11,NA,NA,NA,NA,NA,NA,https://www.who.int/csr/don/2004_02_05/en/,DON-2004-02-05
2004-H5 Influenza-THA,3,2004,2/5/2004,H5N1,NA,Thailand,THA,Kanchanaburi,1/24/2004,NA,NA,NA,NA,yes,NA,NA,5,NA,NA,NA,5,NA,NA,NA,NA,NA,NA,https://www.who.int/csr/don/2004_02_05/en/,DON-2004-02-05
2004-H5 Influenza-VNM,3,2004,2/6/2004,H5N1,NA,Vietnam,VNM,NA,NA,NA,NA,2/6/2004,NA,yes,NA,NA,NA,NA,NA,NA,NA,NA,NA,NA,NA,NA,NA,https://www.who.int/csr/don/2004_02_06/en/,DON-2004-02-06
2004-H5 Influenza-CHN,3,2004,2/6/2004,H5N1,NA,China,CHN,farms in 13/31 provinces,no,NA,NA,NA,NA,yes,NA,NA,0,NA,NA,0,0,NA,NA,NA,NA,NA,NA,https://www.who.int/csr/don/2004_02_06/en/,DON-2004-02-06
2004-H5 Influenza-VNM,3,2004,2/9/2004,H5N1,NA,Vietnam,VNM,Ho Chi Minh City,NA,NA,NA,yes,NA,yes,NA,NA,18,NA,NA,NA,13,NA,NA,NA,NA,NA,NA,https://www.who.int/csr/don/2004_02_09/en/,DON-2004-02-09
2004-H5 Influenza-Asia,3,2004,2/9/2004,H5N1,NA,Asia,NA,8 Asian countires,no,NA,NA,NA,NA,yes,NA,NA,0,NA,NA,0,0,NA,yes,NA,NA,NA,NA,https://www.who.int/csr/don/2004_02_09/en/,DON-2004-02-09
2004-H5 Influenza-CHN,3,2004,2/11/2004,H5N1,NA,China,CHN,39 farms in 14 provinces,no,NA,NA,NA,NA,yes,NA,NA,0,NA,NA,0,0,NA,NA,NA,NA,NA,poultry,https://www.who.int/csr/don/2004_02_11/en/,DON-2004-02-11
2004-H5 Influenza-VNM,3,2004,2/11/2004,H5N1,NA,Vietnam,VNM,NA,NA,NA,NA,2/11/2004,NA,yes,NA,NA,NA,NA,NA,NA,NA,NA,NA,NA,NA,NA,NA,https://www.who.int/csr/don/2004_02_11/en/,DON-2004-02-11
2004-H5 Influenza-THA,3,2004,2/12/2004,H5N1,NA,Thailand,THA,Chaiyaphum,NA,NA,NA,NA,NA,yes,NA,NA,6,NA,NA,NA,NA,NA,yes,NA,NA,NA,NA,https://www.who.int/csr/don/2004_02_12a/en/,DON-2004-02-12a
2004-H5 Influenza-VNM,3,2004,2/12/2004,H5N1,NA,Vietnam,VNM,Ho Chi Minh City,NA,NA,NA,yes,NA,2/12/2003,NA,NA,19,NA,NA,NA,14,NA,NA,NA,NA,NA,NA,https://www.who.int/csr/don/2004_02_12a/en/,DON-2004-02-12a
2004-Nipah Virus-BGD,2,2004,2/12/2004,Nipah-like virus,NA,Bangladesh,BGD,"Manikganj, Rajbari",NA,NA,NA,1/4/2004,NA,yes,NA,NA,9,NA,NA,42,14,NA,yes,NA,NA,NA,NA,https://www.who.int/csr/don/2004_02_12/en/,DON-2004-02-12
2004-H5 Influenza-THA,3,2004,2/13/2004,H5N1,NA,Thailand,THA,"Suphanburi, Uttaradit",NA,NA,NA,NA,NA,yes,NA,NA,8,NA,NA,NA,6,NA,yes,NA,NA,NA,NA,https://www.who.int/csr/don/2004_02_13/en/,DON-2004-02-13
2004-H5 Influenza-VNM,3,2004,2/16/2004,H5N1,NA,Vietnam,VNM,Ho Chi Minh City,NA,NA,NA,NA,NA,yes,NA,NA,NA,NA,NA,20,14,NA,NA,NA,NA,NA,NA,https://www.who.int/csr/don/2004_02_16/en/,DON-2004-02-16
2004-H5 Influenza-VNM,3,2004,2/17/2004,H5N1,NA,Vietnam,VNM,Thanh Hoa,NA,2/9/2004,NA,NA,NA,2/17/2004,NA,NA,NA,NA,NA,21,14,NA,NA,NA,NA,NA,NA,https://www.who.int/csr/don/2004_02_17/en/,DON-2004-02-17
2004-H5 Influenza-THA,3,2004,2/18/2004,H5N1,NA,Thailand,THA,Khon Kaen,NA,NA,NA,2/18/2004,NA,2/18/2004,NA,NA,NA,NA,NA,9,7,NA,NA,NA,NA,NA,NA,https://www.who.int/csr/don/2004_02_18/en/,DON-2004-02-18
2004-H5 Influenza-VNM,3,2004,2/18/2004,H5N1,NA,Vietnam,VNM,NA,NA,NA,NA,2/18/2004,NA,2/18/2004,NA,NA,NA,NA,NA,22,15,NA,NA,NA,NA,NA,NA,https://www.who.int/csr/don/2004_02_18/en/,DON-2004-02-18
2004-H5 Influenza-Asia,3,2004,2/18/2004,H5N1,NA,Asia,NA,8 countries,no,NA,NA,NA,NA,yes,NA,NA,0,NA,NA,0,0,NA,yes,NA,NA,NA,poultry outbreaks,https://www.who.int/csr/don/2004_02_18/en/,DON-2004-02-18
2004-Cholera-BDI,5,2004,2/18/2004,Cholera,NA,Burundi,BDI,"Bubamza, Bujumbura, Bururi, Citiboke",beginning December 2003,NA,NA,2/10/2004,NA,NA,NA,NA,NA,NA,NA,236,6,NA,yes,NA,NA,NA,NA,https://www.who.int/csr/don/2004_02_18a/en/,DON-2004-02-18a
2004-Cholera-CMR,5,2004,2/18/2004,Cholera,NA,Cameroon,CMR,Douala,NA,NA,NA,yes,NA,NA,NA,NA,NA,NA,NA,514,13,2.5,yes,NA,NA,NA,NA,https://www.who.int/csr/don/2004_02_18a/en/,DON-2004-02-18a
2004-Cholera-MLI,5,2004,2/18/2004,Cholera,NA,Mali,MLI,"Mopti, Segou, Timbuctou",1/26/2004,NA,beginning 2004,NA,NA,NA,NA,NA,NA,NA,NA,280,33,11.78,yes,NA,NA,NA,NA,https://www.who.int/csr/don/2004_02_18a/en/,DON-2004-02-18a
2004-Cholera-MOZ,5,2004,2/18/2004,Cholera,NA,Mozambique,MOZ,"Gaza, Inhambane, Maputo, Nampula, Sofala, Zambézia",NA,NA,NA,12/20/2003,NA,NA,NA,NA,NA,NA,NA,9391,61,NA,NA,NA,NA,NA,NA,https://www.who.int/csr/don/2004_02_18a/en/,DON-2004-02-18a
2004-Cholera-ZAF,5,2004,2/18/2004,Cholera,NA,South Africa,ZAF,Nkomazi,NA,NA,NA,2/11/2004,NA,NA,NA,NA,NA,NA,NA,179,5,2.79,NA,NA,NA,NA,NA,https://www.who.int/csr/don/2004_02_18a/en/,DON-2004-02-18a
2004-Cholera-ZMB,5,2004,2/18/2004,Cholera,NA,Zambia,ZMB,Lusaka,NA,NA,NA,2/9/2004,NA,NA,NA,NA,NA,NA,NA,3835,179,4.66,yes,NA,NA,NA,NA,https://www.who.int/csr/don/2004_02_18a/en/,DON-2004-02-18a
2004-H5 Influenza-VNM,3,2004,2/19/2004,H5N1,NA,Vietnam,VNM,Lam Dong,NA,NA,NA,NA,NA,2/18/2004,NA,NA,NA,NA,NA,22,15,NA,NA,NA,NA,NA,NA,https://www.who.int/csr/don/2004_02_19/en/,DON-2004-02-19
2004-H5 Influenza-THA,3,2004,2/20/2004,H5N1,NA,Thailand,THA,NA,NA,NA,NA,1/23/2004,NA,yes,NA,NA,9,NA,NA,NA,7,NA,yes,NA,NA,NA,NA,https://www.who.int/csr/don/2004_02_20/en/,DON-2004-02-20
2004-H5 Influenza-JAP,3,2004,2/20/2004,H5N1,NA,Japan,JAP,Oita Prefecture,no,NA,NA,NA,NA,yes,NA,NA,0,NA,NA,0,0,NA,NA,NA,NA,NA,poultry,https://www.who.int/csr/don/2004_02_20/en/,DON-2004-02-20
2004-H5 Influenza-CHN,3,2004,2/20/2004,H5N1,NA,China,CHN,16 provinces,no,NA,NA,NA,NA,yes,NA,NA,0,NA,NA,0,0,NA,yes,NA,NA,NA,poultry,https://www.who.int/csr/don/2004_02_20/en/,DON-2004-02-20
2004-H5 Influenza-VNM,3,2004,2/23/2004,H5N1,NA,Vietnam,VNM,Dong Nai,NA,2/16/2004,NA,2/23/2004,NA,yes,NA,NA,23,NA,NA,NA,15,NA,NA,NA,NA,NA,NA,https://www.who.int/csr/don/2004_02_23/en/,DON-2004-02-23
2004-Yellow Fever-LBR,6,2004,2/25/2004,Yellow fever,NA,Liberia,LBR,NA,NA,NA,NA,NA,NA,yes,NA,NA,3,NA,NA,NA,5,NA,yes,2/25/2004,NA,NA,NA,https://www.who.int/mediacentre/news/releases/2004/pr16/en/,https://www.who.int/mediacentre/news/releases/2004/pr16
2004-Nipah Virus-BGD,2,2004,2/26/2004,Nipah-like virus,NA,Bangladesh,BGD,"Rajbari, Manikganj, Jaipurhat, Naogang, Faridpur",NA,NA,NA,2/26/2004,NA,yes,NA,NA,11,NA,NA,22,17,NA,yes,NA,NA,NA,NA,https://www.who.int/csr/don/2004_02_26/en/,DON-2004-02-26
2004-Dengue-IDN,6,2004,2/26/2004,Dengue fever,NA,Indonesia,IDN,"Java, Sumatra",NA,NA,NA,1/1/2004,NA,NA,NA,NA,NA,NA,NA,14626,260,1.8,yes,NA,NA,NA,NA,https://www.who.int/csr/don/2004_02_26a/en/,DON-2004-02-26a
2004-H5 Influenza-THA,3,2004,2/27/2004,H5N1,NA,Thailand,THA,Lopburi,2/3/2004,NA,NA,2/27/2004,NA,yes,NA,NA,10,NA,NA,10,7,NA,NA,NA,NA,NA,NA,https://www.who.int/csr/don/2004_02_27/en/,DON-2004-02-27
2004-H5 Influenza-Asia,3,2004,3/2/2004,H5N1,NA,Asia,NA,NA,no,NA,NA,NA,NA,mid-December 2003,NA,NA,0,NA,NA,0,0,NA,yes,NA,NA,NA,poultry,https://www.who.int/csr/don/2004_03_02/en/,DON-2004-03-02
2004-Yellow Fever-LBR,6,2004,3/4/2004,Yellow fever,NA,Liberia,LBR,"Bong, Nimba, 3 other counties",NA,NA,NA,3/3/2004,NA,yes,NA,NA,4,NA,29,33,8,NA,2/26/2004,NA,NA,NA,NA,https://www.who.int/csr/don/2004_03_04/en/,DON-2004-03-04
2004-Dengue-IDN,6,2004,3/5/2004,Dengue fever,NA,Indonesia,IDN,"Java, South Kalimantan, South Sulawesi, Bali, East and West Nusa Tenggara, Aceh",NA,NA,NA,1/1/2004,NA,NA,NA,NA,NA,NA,23857,NA,387,NA,yes,yes,NA,NA,NA,https://www.who.int/csr/don/2004_03_05/en/,DON-2004-03-05
2004-H5 Influenza-THA,3,2004,3/9/2004,H5N1,NA,Thailand,THA,Nakhon Ratchasima Province,2/13/2004,2/20/2004,NA,3/9/2004,NA,3/9/2004,NA,NA,11,NA,NA,NA,7,NA,NA,NA,NA,NA,NA,https://www.who.int/csr/don/2004_03_09/en/,DON-2004-03-09
2004-Yellow Fever-LBR,6,2004,3/11/2004,Yellow fever,NA,Liberia,LBR,"Margibi, Grand Bassa, and Grand Gedeh, Nimba, 4 other counties",NA,NA,NA,3/9/2004,NA,yes,NA,NA,4,NA,35,39,8,NA,yes,NA,NA,NA,NA,https://www.who.int/csr/don/2004_03_11/en/,DON-2004-03-11
2004-H5 Influenza-THA,3,2004,3/17/2004,H5N1,NA,Thailand,THA,Ayudhaya,3/1/2004,3/3/2004,NA,3/17/2004,NA,yes,NA,NA,12,NA,NA,NA,8,NA,NA,NA,NA,NA,NA,https://www.who.int/csr/don/2004_03_17/en/,DON-2004-03-17
2004-Influenza-Global,3,2004,3/22/2004,Influenza,NA,Global,NA,"Austria, Canada, Hong Kong, Germany, Italy, Japan, Latvia, Russia, Switzerland, USA, Chile, Denmark, Madagascar, Norway, Slovenia, Sweden, UK",NA,NA,NA,NA,NA,NA,NA,NA,NA,NA,NA,NA,NA,NA,NA,NA,NA,NA,mostly declining activity,https://www.who.int/csr/don/2004_03_22/en/,DON-2004-03-22
2004-H5 Influenza-VNM,3,2004,3/22/2004,H5N1,NA,Vietnam,VNM,NA,NA,3/13/2004,NA,no,NA,NA,NA,NA,1,NA,1,NA,2,NA,NA,NA,NA,NA,NA,https://www.who.int/csr/don/2004_03_22a/en/,DON-2004-03-22a
2004-Cholera-MOZ,5,2004,3/23/2004,Cholera,NA,Mozambique,MOZ,"Maputo, Gaza, Sofala, Zambesia, Nampula, Inhambane, Tete",NA,NA,NA,12/20/2004,NA,NA,NA,NA,NA,NA,NA,15237,85,NA,1/9/2004,NA,NA,NA,NA,https://www.who.int/csr/don/2004_03_23/en/,DON-2004-03-23
2004-Meningococcal Disease-NGA,1,2004,3/26/2004,Meningococcal disease,NA,Nigeria,NGA,Jigwa,NA,NA,NA,yes,NA,NA,NA,NA,NA,NA,NA,327,46,NA,NA,NA,NA,NA,NA,https://www.who.int/csr/don/2004_03_26a/en/,DON-2004-03-26a
2004-Meningococcal Disease-BFA,1,2004,3/26/2004,Meningococcal disease,NA,Burkina Faso,BFA,"Diébougou, Naonoro, Gaoua, Zabré, oudougou, Po, Sebba, Seguenega",NA,NA,NA,1/1/2004,NA,yes,NA,NA,NA,NA,NA,2783,527,NA,yes,NA,NA,NA,NA,https://www.who.int/csr/don/2004_03_26/en/,DON-2004-03-26
2004-Dengue-IDN,6,2004,3/29/2004,Dengue fever,NA,Indonesia,IDN,"Java, DKI Jakarta, Jawa Tenggah, Nusa Tenggara Timur, Bali, Sumatera Selatan, Lampung, Kalimantan Timur, Sulawesi Seltan, Nusa Tenggara Barat",NA,NA,NA,1/1/2004,NA,NA,NA,NA,NA,NA,NA,40337,507,NA,yes,NA,NA,NA,NA,https://www.who.int/csr/don/2004_03_29/en/,DON-2004-03-29
2004-H7 Influenza-CAN,3,2004,4/5/2004,A(H7),NA,Canada,CAN,British Columbia,3/16/2004,NA,NA,3/31/2004,NA,NA,NA,NA,NA,NA,NA,2,0,NA,yes,NA,NA,NA,NA,https://www.who.int/csr/don/2004_04_05/en/,DON-2004-04-05
2004-Meningococcal Disease-TCD,1,2004,4/8/2004,Meningococcal disease,NA,Chad,TCD,Iriba,NA,NA,NA,4/4/2004,NA,yes,NA,NA,7,NA,NA,19,4,NA,yes,NA,NA,NA,NA,https://www.who.int/csr/don/2004_04_08b/en/,DON-2004-04-08b
2004-Dengue-IDN,6,2004,4/8/2004,Dengue fever,NA,Indonesia,IDN,12/32 provinces,NA,NA,1/1/2004,NA,NA,NA,NA,NA,NA,NA,NA,52013,603,NA,yes,NA,NA,NA,NA,https://www.who.int/csr/don/2004_04_08/en/,DON-2004-04-08
2004-Meningococcal Disease-CAF,1,2004,4/8/2004,Meningococcal disease,NA,Central African Republic,CAF,"Nana Bougila, Zere",NA,NA,NA,3/31/2004,NA,yes,NA,NA,2,NA,NA,43,7,NA,yes,NA,NA,NA,NA,https://www.who.int/csr/don/2004_04_08a/en/,DON-2004-04-08a
2004-Nipah Virus-BGD,2,2004,4/20/2004,Nipah virus,NA,Bangladesh,BGD,Faridpur,NA,NA,NA,4/20/2004,NA,yes,NA,NA,16,NA,NA,30,18,NA,yes,NA,NA,NA,NA,https://www.who.int/csr/don/2004_04_20/en/,DON-2004-04-20
2004-Lassa Fever-SLE,2,2004,4/20/2004,Lassa fever,NA,Sierra Leone,SLE,Kenema,NA,NA,NA,yes,NA,yes,NA,NA,NA,NA,NA,NA,NA,NA,yes,NA,NA,NA,NA,https://www.who.int/csr/don/2004_04_20a/en/,DON-2004-04-20a
2003-SARS-CHN,2,2004,4/22/2004,Severe Acute Respiratory Syndrome (SARS),NA,China,CHN,Beijing,4/5/2004,4/7/2004,NA,4/22/2004,NA,no,NA,NA,NA,NA,1,1,0,NA,yes,NA,NA,NA,NA,https://www.who.int/csr/don/2004_04_22/en/,DON-2004-04-22
2003-SARS-CHN,2,2004,4/23/2004,Severe Acute Respiratory Syndrome (SARS),NA,China,CHN,"Beijing, Anhui",3/25/2004,NA,NA,4/23/2004,NA,no,NA,NA,NA,2,NA,4,1,NA,yes,NA,NA,NA,NA,https://www.who.int/csr/don/2004_04_23/en/,DON-2004-04-23
2003-SARS-CHN,2,2004,4/26/2004,Severe Acute Respiratory Syndrome (SARS),NA,China,CHN,"Beijing, Anhui",4/16/2004,NA,NA,4/22/2004,NA,NA,NA,NA,NA,NA,NA,8,NA,NA,yes,NA,NA,NA,NA,https://www.who.int/csr/don/2004_04_26/en/,DON-2004-04-26
2003-SARS-CHN,2,2004,4/28/2004,Severe Acute Respiratory Syndrome (SARS),NA,China,CHN,"Beijing, Anhui",4/19/2004,NA,4/22/2004,NA,NA,yes,NA,NA,NA,NA,NA,9,1,NA,yes,NA,NA,NA,NA,https://www.who.int/csr/don/2004_04_28/en/,DON-2004-04-28
2003-SARS-CHN,2,2004,4/29/2004,Severe Acute Respiratory Syndrome (SARS),NA,China,CHN,"Beijing, Anhui",4/7/2004,NA,NA,NA,NA,4/29/2004,NA,NA,NA,NA,NA,9,1,NA,yes,NA,NA,NA,NA,https://www.who.int/csr/don/2004_04_29/en/,DON-2004-04-29
2003-SARS-CHN,2,2004,4/30/2004,Severe Acute Respiratory Syndrome (SARS),NA,China,CHN,"Beijing, Anhui",3/25/2004,NA,4/22/2004,NA,NA,yes,NA,NA,5,NA,NA,9,1,NA,yes,NA,NA,NA,NA,https://www.who.int/csr/don/2004_04_30/en/,DON-2004-04-30
2003-SARS-CHN,2,2004,5/5/2004,Severe Acute Respiratory Syndrome (SARS),NA,China,CHN,Beijing,late March 2004,NA,4/22/2004,NA,NA,NA,NA,NA,NA,NA,NA,NA,NA,NA,yes,NA,NA,NA,NA,https://www.who.int/csr/don/2004_05_05/en/,DON-2004-05-05
2004-Yellow Fever-BFA,6,2004,5/11/2004,Yellow fever,NA,Burkina Faso,BFA,"Bobo-Dioulasso, Gaoua",NA,NA,NA,5/10/2004,NA,yes,NA,NA,4,NA,21,25,NA,NA,yes,NA,NA,NA,NA,https://www.who.int/csr/don/2004_05_11/en/,DON-2004-05-11
2004-Dengue-IDN,6,2004,5/11/2004,Dengue fever,NA,Indonesia,IDN,all provinces,NA,NA,1/1/2004,NA,NA,NA,NA,NA,NA,NA,NA,58301,658,1.1,yes,NA,NA,NA,NA,https://www.who.int/csr/don/2004_05_11a/en/,DON-2004-05-11a
2004-Ebola-SDN,2,2004,5/18/2004,Acute haemorrhagic fever syndrome,NA,Sudan,SDN,"Hai-Cuba, Yambio, Western Equatoria",NA,NA,NA,5/10/2004,NA,no,NA,NA,NA,NA,NA,NA,NA,NA,yes,NA,NA,NA,NA,https://www.who.int/csr/don/2004_05_18/en/,DON-2004-05-18
2004-Ebola-SDN,2,2004,5/24/2004,Ebola haemorrhagic fever,NA,Sudan,SDN,Yambio,NA,NA,5/24/2004,NA,yes,yes,NA,NA,NA,NA,NA,19,4,NA,yes,NA,NA,NA,NA,https://www.who.int/csr/don/2004_05_24/en/,DON-2004-05-24
2004-Ebola-SDN,2,2004,5/26/2004,Ebola haemorrhagic fever,NA,Sudan,SDN,Yambio,NA,NA,5/26/2004,NA,yes,yes,NA,NA,NA,NA,NA,20,5,NA,yes,NA,NA,NA,NA,https://www.who.int/csr/don/2004_05_26/en/,DON-2004-05-26
2004-Yellow Fever-BFA,6,2004,6/1/2004,Yellow fever,NA,Burkina Faso,BFA,Bobo-Dioulasso,NA,NA,NA,6/1/2004,NA,NA,NA,NA,NA,NA,NA,NA,NA,NA,NA,NA,NA,NA,no new cases,https://www.who.int/csr/don/2004_06_01/en/,DON-2004-06-01
2004-Ebola-SDN,2,2004,6/1/2004,Ebola haemorrhagic fever,NA,Sudan,SDN,Yambio,NA,NA,5/31/2004,NA,NA,NA,NA,NA,NA,NA,NA,25,6,NA,yes,NA,NA,NA,NA,https://www.who.int/csr/don/2004_06_01a/en/,DON-2004-06-01a
2004-Cholera-NER,5,2004,6/2/2004,Cholera,NA,Niger,NER,Tillabery,NA,NA,NA,5/3/2004,NA,yes,NA,NA,NA,NA,NA,137,5,NA,yes,yes,NA,NA,NA,https://www.who.int/csr/don/2004_06_02/en/,DON-2004-06-02
2004-Salmonella-USA,5,2004,6/2/2004,Salmonella Enteritidis,NA,United States of America,USA,NA,03/??/2003,NA,NA,NA,NA,yes,NA,NA,NA,NA,NA,32,NA,NA,yes,NA,NA,NA,raw almonds,https://www.who.int/csr/don/2004_06_02a/en/,DON-2004-06-02a
2004-Ebola-SDN,2,2004,6/7/2004,Ebola haemorrhagic fever,NA,Sudan,SDN,Yambio,NA,NA,6/6/2004,NA,NA,NA,NA,NA,NA,NA,NA,28,7,25,yes,yes,NA,NA,NA,https://www.who.int/csr/don/2004_06_07/en/,DON-2004-06-07
2004-Ebola-SDN,2,2004,6/11/2004,Ebola haemorrhagic fever,NA,Sudan,SDN,Yambio,NA,NA,6/10/2004,NA,NA,NA,NA,NA,NA,NA,NA,30,7,23,yes,yes,NA,NA,NA,https://www.who.int/csr/don/2004_06_11/en/,DON-2004-06-11
2004-Cholera-CMR,5,2004,6/15/2004,Cholera,NA,Cameroon,CMR,"Douala, Littoral, West",1/1/2004,NA,NA,yes,NA,yes,NA,NA,NA,NA,NA,2924,46,NA,yes,NA,NA,NA,NA,https://www.who.int/csr/don/2004_06_15/en/,DON-2004-06-15
2004-Ebola-SDN,2,2004,6/17/2004,Ebola haemorrhagic fever,NA,Sudan,SDN,Yambio,NA,NA,6/17/2004,NA,NA,NA,NA,NA,NA,NA,NA,NA,NA,NA,yes,NA,NA,NA,NA,https://www.who.int/csr/don/2004_06_17/en/,DON-2004-06-17
2004-Leptospirosis-KEN,4,2004,6/17/2004,Leptospirosis,NA,Kenya,KEN,Bungoma,NA,NA,NA,yes,NA,yes,NA,NA,NA,NA,141,NA,8,NA,yes,NA,NA,NA,NA,https://www.who.int/csr/don/2004_06_17a/en/,DON-2004-06-17a
2004-Ebola-SDN,2,2004,6/22/2004,Ebola haemorrhagic fever,NA,Sudan,SDN,Yambio,NA,NA,6/20/2004,NA,NA,NA,NA,NA,NA,NA,NA,18,6,NA,yes,NA,NA,NA,NA,https://www.who.int/csr/don/2004_06_22/en/,DON-2004-06-22
2004-Ebola-SDN,2,2004,7/6/2004,Ebola haemorrhagic fever,NA,Sudan,SDN,Yambio,NA,NA,7/6/2004,NA,NA,yes,NA,NA,13,NA,NA,17,7,NA,yes,NA,NA,NA,NA,https://www.who.int/csr/don/2004_07_06/en/,DON-2004-07-06
2004-H5 Influenza-Asia,3,2004,7/8/2004,H5N1,NA,Asia,NA,NA,no,NA,NA,NA,NA,NA,NA,NA,0,NA,NA,0,0,NA,yes,NA,NA,NA,risk assessment,https://www.who.int/csr/don/2004_07_08/en/,DON-2004-07-08
2004-Shigella-SDN,5,2004,7/14/2004,Shigellosis,NA,Sudan,SDN,Abu Shoak IDP camp,middle May 2004,NA,6/30/2004,NA,NA,yes,NA,NA,3,NA,NA,1340,11,NA,yes,NA,NA,NA,NA,https://www.who.int/csr/don/2004_07_14/en/,DON-2004-07-14
2004-H5 Influenza-Asia,3,2004,7/16/2004,H5N1,NA,Asia,NA,NA,NA,NA,NA,NA,NA,NA,NA,NA,0,NA,NA,0,0,NA,yes,NA,NA,NA,poultry outbreaks,https://www.who.int/csr/don/2004_07_16/en/,DON-2004-07-16
2004-H5 Influenza-Asia,3,2004,7/30/2004,H5N1,NA,Asia,NA,"China, Indonesia, Thailand, Vietnam",no,NA,NA,NA,NA,NA,NA,NA,0,NA,NA,0,0,NA,yes,NA,NA,NA,poultry outbreaks,https://www.who.int/csr/don/2004_07_30/en/,DON-2004-07-30
2004-Ebola-SDN,2,2004,8/7/2004,Ebola haemorrhagic fever,NA,Sudan,SDN,Yambio,NA,NA,NA,late May 2004,yes,yes,8/7/2004,NA,NA,NA,NA,17,7,NA,yes,yes,NA,NA,NA,https://www.who.int/csr/don/2004_08_07/en/,DON-2004-08-07
2004-Hepatitis E-SDN,5,2004,8/10/2004,Hepatitis E,NA,Sudan,SDN,"Greater Darfur, Morni IDP Camp",NA,NA,5/22/2004,NA,NA,yes,NA,NA,23,NA,NA,625,22,NA,yes,NA,NA,NA,NA,https://www.who.int/csr/don/2004_08_10/en/,DON-2004-08-10
2004-H5 Influenza-VNM,3,2004,8/12/2004,Avian influenza,NA,Vietnam,VNM,"Ha Tay, Hau Giang",NA,7/19/2004,NA,8/12/2004,NA,yes,NA,NA,3,NA,NA,NA,3,NA,yes,NA,NA,NA,NA,https://www.who.int/csr/don/2004_08_12/en/,DON-2004-08-12
2004-H5 Influenza-VNM,3,2004,8/13/2004,H5N1,NA,Vietnam,VNM,"Ha Tay, Hau Giang",NA,NA,NA,8/12/2004,NA,yes,NA,NA,3,NA,NA,NA,3,NA,yes,NA,NA,NA,NA,https://www.who.int/csr/don/2004_08_13/en/,DON-2004-08-13
2004-H5 Influenza-VNM,3,2004,8/18/2004,H5N1,NA,Vietnam,VNM,"north, south",NA,NA,NA,NA,NA,yes,NA,NA,3,NA,NA,NA,3,NA,yes,NA,NA,NA,NA,https://www.who.int/csr/don/2004_08_18/en/,DON-2004-08-18
2004-Hepatitis E-TCD,5,2004,8/19/2004,Hepatitis E,NA,Chad,TCD,Goz Amer,NA,NA,NA,6/26/2004,NA,yes,NA,NA,7,NA,NA,672,21,NA,yes,yes,NA,NA,NA,https://www.who.int/csr/don/2004_08_19/en/,DON-2004-08-19
2004-H5 Influenza-CHN,3,2004,8/20/2004,H5N1,NA,China,CHN,NA,no,NA,NA,no,NA,no,NA,NA,0,NA,NA,0,0,NA,yes,NA,NA,NA,pigs,https://www.who.int/csr/don/2004_08_20/en/,DON-2004-08-20
2004-H5 Influenza-CHN,3,2004,8/25/2004,H5N1,NA,China,CHN,NA,NA,NA,NA,NA,NA,yes,NA,NA,0,NA,NA,0,0,NA,NA,NA,NA,NA,pigs,https://www.who.int/csr/don/2004_08_25/en/,DON-2004-08-25
2004-Hepatitis E-SDN,5,2004,8/30/2004,Hepatitis E,NA,Sudan,SDN,Greater Darfur,NA,NA,5/22/2004,NA,NA,yes,NA,NA,NA,NA,NA,2431,41,NA,yes,NA,NA,NA,NA,https://www.who.int/csr/don/2004_08_30/en/,DON-2004-08-30
2004-Hepatitis E-TCD,5,2004,8/31/2004,Hepatitis E,NA,Chad,TCD,"Goz Amer, Goz Beida",NA,NA,6/26/2004,NA,NA,NA,NA,NA,NA,NA,959,959,30,NA,yes,NA,NA,NA,NA,https://www.who.int/csr/don/2004_08_31/en/,DON-2004-08-31
2004-Cholera-TCD,5,2004,9/1/2004,Cholera,NA,Chad,TCD,"Massaguet, Lac, Kanem, N'Djamena",NA,NA,6/14/2004,NA,NA,NA,NA,NA,NA,NA,NA,2046,98,4.8,yes,NA,NA,NA,NA,https://www.who.int/csr/don/2004_09_01/en/,DON-2004-09-01
2004-Rabies-FRA,4,2004,9/1/2004,Rabies,NA,France,FRA,Bordeaux,no,NA,NA,yes,NA,8/26/2004,NA,NA,0,NA,NA,0,0,NA,yes,NA,NA,NA,NA,https://www.who.int/csr/don/2004_09_01a/en/,DON-2004-09-01a
2004-Hepatitis E-TCD,5,2004,9/6/2004,Hepatitis E,NA,Chad,TCD,"Goz Amer, Goz Abal, Koukou, Am-Ouchar, Am -Bitin, Habile, Aradibe",NA,NA,6/26/2004,NA,NA,NA,NA,NA,NA,NA,NA,1077,35,3.2,9/2/2004,NA,NA,NA,NA,https://www.who.int/csr/don/2004_09_06/en/,DON-2004-09-06
2004-H5 Influenza-VNM,3,2004,9/7/2004,Avian influenza,NA,Vietnam,VNM,Hanoi,NA,08/??/2004,NA,yes,NA,yes,NA,NA,NA,NA,NA,4,NA,NA,NA,NA,NA,NA,NA,https://www.who.int/csr/don/2004_09_07/en/,DON-2004-09-07
2004-Hepatitis E-SDN,5,2004,9/8/2004,Hepatitis E,NA,Sudan,SDN,Greater Darfur,NA,NA,NA,5/22/2004,NA,NA,NA,NA,NA,NA,3753,NA,55,NA,yes,yes,NA,NA,NA,https://www.who.int/csr/don/2004_09_08/en/,DON-2004-09-08
2004-H5 Influenza-THA,3,2004,9/9/2004,H5N1,NA,Thailand,THA,Prachinburi,NA,9/5/2004,NA,8/9/2004,NA,yes,NA,NA,1,NA,NA,NA,1,NA,yes,NA,NA,NA,NA,https://www.who.int/csr/don/2004_09_09/en/,DON-2004-09-09
2004-Yellow Fever-VEN,6,2004,9/14/2004,Yellow fever,NA,Venezuela,VEN,Sucre,second half August 2004,NA,NA,yes,NA,yes,NA,NA,2,NA,NA,NA,1,NA,yes,NA,NA,NA,NA,https://www.who.int/csr/don/2004_09_14/en/,DON-2004-09-14
2004-Hepatitis E-TCD,5,2004,9/15/2004,Hepatitis E,NA,Chad,TCD,"Goz Amer, Goz Abal and neighbouring villages",NA,NA,6/26/2004,NA,NA,NA,NA,NA,NA,NA,1292,NA,42,3.3,yes,NA,NA,NA,NA,https://www.who.int/csr/don/2004_09_15/en/,DON-2004-09-15
2004-Cholera-TCD,5,2004,9/27/2004,Cholera,NA,Chad,TCD,"Bousso, Massaguet, Lac, Kanem, N'Djamena, Abeche",NA,NA,6/14/2004,NA,NA,NA,NA,NA,NA,NA,NA,3910,164,4.2,yes,NA,NA,NA,NA,https://www.who.int/csr/don/2004_09_27/en/,DON-2004-09-27
2004-Hepatitis E-TCD,5,2004,9/27/2004,Hepatitis E,NA,Chad,TCD,"Goz Amer, Goz Abal and neighbouring villages",NA,NA,6/26/2004,NA,NA,NA,NA,NA,NA,NA,1442,NA,46,3.2,yes,yes,NA,NA,NA,https://www.who.int/csr/don/2004_09_27a/en/,DON-2004-09-27a
2004-Hepatitis E-SDN,5,2004,9/28/2004,Hepatitis E,NA,Sudan,SDN,Greater Darfur,NA,NA,5/22/2004,NA,NA,NA,NA,NA,NA,NA,6861,NA,87,NA,yes,yes,NA,NA,NA,https://www.who.int/csr/don/2004_09_28/en/,DON-2004-09-28
2004-H5 Influenza-THA,3,2004,9/28/2004,H5N1,NA,Thailand,THA,"Kamphaeng Phet, Bangkok",NA,01/??/2004,NA,NA,NA,yes,NA,NA,NA,NA,NA,15,10,NA,yes,NA,NA,NA,NA,https://www.who.int/csr/don/2004_09_28a/en/,DON-2004-09-28a
2004-H5 Influenza-THA,3,2004,10/4/2004,H5N1,NA,Thailand,THA,Phetchabun,9/23/2004,9/27/2004,Beginnning 2004,NA,NA,10/4/2004,NA,NA,16,NA,NA,NA,11,NA,yes,NA,NA,NA,NA,https://www.who.int/csr/don/2004_10_04/en/,DON-2004-10-04
2004-H5 Influenza-THA,3,2004,10/25/2004,H5N1,NA,Thailand,THA,Sukhothai,10/8/2004,NA,NA,NA,NA,10/25/2004,NA,NA,NA,NA,NA,17,12,NA,NA,NA,NA,NA,NA,https://www.who.int/csr/don/2004_10_25/en/,DON-2004-10-25
2004-H5 Influenza-Asia,3,2004,10/29/2004,H5N1,NA,Asia,NA,NA,no,NA,NA,NA,NA,yes,NA,NA,NA,NA,NA,NA,NA,NA,yes,NA,NA,NA,study on ducks,https://www.who.int/csr/don/2004_10_29/en/,DON-2004-10-29
2004-Cholera-SEN,5,2004,11/2/2004,Cholera,NA,Senegal,SEN,Dakar,NA,NA,NA,10/5/2004,NA,yes,NA,NA,NA,NA,NA,128,2,1.6,yes,yes,NA,NA,NA,https://www.who.int/csr/don/2004_11_02/en/,DON-2004-11-02
2004-Cholera-SEN,5,2004,11/12/2004,Cholera,NA,Senegal,SEN,Dakar,NA,NA,NA,11/10/2004,NA,NA,NA,NA,NA,NA,NA,861,6,NA,yes,yes,NA,NA,NA,https://www.who.int/csr/don/2004_11_12/en/,DON-2004-11-12
2004-Yellow Fever-BFA,6,2004,11/24/2004,Yellow fever,NA,Burkina Faso,BFA,Sindou,NA,NA,NA,yes,yes,yes,NA,NA,1,NA,NA,NA,1,NA,yes,NA,NA,NA,NA,https://www.who.int/csr/don/2004_11_24/en/,DON-2004-11-24
2004-Cholera-NGA,5,2004,12/3/2004,Cholera,NA,Nigeria,NGA,"Kano, Edo",NA,NA,9/16/2004,yes,NA,yes,NA,NA,NA,NA,NA,1316,76,5.8,yes,NA,NA,NA,NA,https://www.who.int/csr/don/2004_12_03/en/,DON-2004-12-03
2004-Typhoid Fever-COD,5,2004,12/15/2004,Typhoid fever,NA,Democratic Republic of the Congo,COD,"Kinshasa, Kimbanseke, Kikimi, Masina, Ndjili",NA,NA,NA,12/13/2004,NA,yes,NA,NA,5,NA,NA,13400,134,NA,yes,yes,NA,NA,NA,https://www.who.int/csr/don/2004_12_15/en/,DON-2004-12-15
2004-H5 Influenza-VNM,3,2004,12/30/2004,Avian influenza,NA,Vietnam,VNM,Tay Ninh,NA,12/26/2004,NA,yes,NA,yes,NA,NA,NA,NA,NA,28,20,NA,NA,NA,NA,NA,NA,https://www.who.int/csr/don/2004_12_30/en/,DON-2004-12-30
2005-Yellow Fever-MLI,6,2005,1/6/2005,Yellow fever,NA,Mali,MLI,Kita,NA,NA,NA,yes,NA,yes,NA,NA,1,NA,NA,NA,1,NA,yes,NA,NA,NA,NA,https://www.who.int/csr/don/2005_01_06/en/,DON-2005-01-06
2005-H5 Influenza-VNM,3,2005,1/6/2005,Avian Influenza,NA,Vietnam,VNM,"Dong Thap, Tra Vinh",NA,NA,NA,yes,NA,yes,NA,NA,NA,NA,NA,3,2,NA,yes,NA,NA,NA,initial tests identified H5 subtype; 3 cases unclear which are confirmed,https://www.who.int/csr/don/2005_01_06a/en/,DON-2005-01-06a
2005-Yellow Fever-GIN,6,2005,1/7/2005,Yellow fever,NA,Guinea,GIN,Faranah,NA,NA,NA,10/19/2004,NA,yes,NA,NA,6,NA,NA,NA,NA,NA,yes,NA,NA,NA,NA,https://www.who.int/csr/don/2005_01_07/en/,DON-2005-01-07
2005-Meningococcal Disease-TCD,1,2005,1/11/2005,Meningococcal disease,NA,Chad,TCD,Brejing and Treijing refugee camps,NA,NA,1/3/2005,NA,NA,no,NA,NA,NA,NA,NA,3,NA,NA,yes,NA,NA,NA,"3 cases were positive for Neisseria meningitidis W135 by latex test. Laboratory confirmation will be conducted by the WHO Collaborating Centre, Institute Médecine Tropicale des Services de Santé des Armées",https://www.who.int/csr/don/2005_01_11a/en/,DON-2005-01-11a
2005-Meningococcal Disease-PHL,1,2005,1/11/2005,Meningococcemia-like illness,NA,Philippines,PHL,Baguio City,NA,NA,NA,yes,NA,yes,NA,NA,8,NA,NA,33,19,58,yes,NA,NA,NA,the clinical presentation and the high case fatality ratio observed are unusual in epidemic meningococcal disease,https://www.who.int/csr/don/2005_01_11/en/,DON-2005-01-11
2005-H5 Influenza-VNM,3,2005,1/13/2005,H5N1,NA,Vietnam,VNM,Tien Giang,1/1/2005,1/5/2005,NA,NA,NA,yes,NA,NA,NA,NA,NA,31,23,NA,yes,NA,NA,NA,cases since beginning of outbreak in Jan 2014,https://www.who.int/csr/don/2005_01_13/en/,DON-2005-01-13
2005-H5 Influenza-VNM,3,2005,1/14/2005,H5N1,NA,Vietnam,VNM,"Hau Giang, Tra Vinh",1/1/2005,1/10/2005,NA,NA,NA,no,NA,NA,4,NA,NA,6,4,NA,NA,NA,NA,NA,"""informal reports""; numbers since Dec 2004",https://www.who.int/csr/don/2005_01_14/en/,DON-2005-01-14
2005-Typhoid Fever-COD,5,2005,1/19/2005,Typhoid fever,NA,Democratic Republic of the Congo,COD,NA,NA,NA,NA,9/27/2005,NA,NA,NA,NA,NA,NA,NA,42564,214,0.5,yes,NA,NA,NA,NA,https://www.who.int/csr/don/2005_01_19/en/,DON-2005-01-19
2005-H5 Influenza-VNM,3,2005,1/19/2005,Avian Influenza,NA,Vietnam,VNM,Hanoi,NA,NA,NA,NA,NA,yes,NA,NA,1,NA,NA,NA,0,NA,yes,NA,NA,NA,new case,https://www.who.int/csr/don/2005_01_19b/en/,DON-2005-01-19b
2005-Meningococcal Disease-PHL,1,2005,1/19/2005,Meningococcal disease,NA,Philippines,PHL,"Baguio City, Cordillera Region",NA,NA,10/1/2005,NA,NA,yes,NA,NA,11,NA,NA,78,30,NA,yes,NA,NA,NA,NA,https://www.who.int/csr/don/2005_01_19a/en/,DON-2005-01-19a
2005-Meningococcal Disease-TCD,1,2005,1/20/2005,Meningococcal disease,NA,Chad,TCD,"Brejin, Treijing and Farchana refugee camps",NA,NA,1/6/2005,NA,NA,yes,NA,NA,4,NA,NA,8,NA,NA,yes,NA,NA,NA,NA,https://www.who.int/csr/don/2005_01_20/en/,DON-2005-01-20
2005-H5 Influenza-VNM,3,2005,1/26/2005,H5N1,NA,Vietnam,VNM,"Dong Thap, Bac Lieu",NA,1/10/2005,NA,1/26/2005,NA,yes,NA,NA,NA,NA,NA,10,9,NA,yes,NA,NA,NA,NA,https://www.who.int/csr/don/2005_01_26/en/,DON-2005-01-26
2005-H5 Influenza-VNM,3,2005,1/28/2005,H5N1,NA,Vietnam,VNM,"Long An, Dong Thap",1/13/2005,1/20/2005,NA,yes,NA,yes,NA,NA,10,NA,NA,12,9,NA,yes,NA,NA,NA,NA,https://www.who.int/csr/don/2005_01_28b/en/,DON-2005-01-28b
2005-Meningococcal Disease-PHL,1,2005,1/28/2005,Meningococcal disease,NA,Philippines,PHL,"Baguio, Mr. Province, Ifugao",NA,NA,10/1/2005,NA,NA,NA,NA,NA,NA,NA,NA,98,32,33,yes,NA,NA,NA,NA,https://www.who.int/csr/don/2005_01_28a/en/,DON-2005-01-28a
2005-Meningococcal Disease-TCD,1,2005,1/28/2005,Meningococcal disease,NA,Chad,TCD,"Brejing, Trejing and Farchana refugee camps",NA,NA,1/6/2005,NA,NA,yes,NA,NA,8,NA,NA,14,NA,NA,1/26/2005,NA,NA,NA,NA,https://www.who.int/csr/don/2005_01_28/en/,DON-2005-01-28
2005-Dengue-TLS,6,2005,1/31/2005,Acute haemorrhagic fever syndrom,NA,Timor-Leste,TLS,"Dili, Liquica, Maliana",NA,NA,NA,1/26/2005,NA,NA,NA,NA,NA,NA,NA,67,8,NA,yes,NA,NA,NA,clinical features compatible with dengue,https://www.who.int/csr/don/2005_01_31/en/,DON-2005-01-31
2005-H5 Influenza-KHM,3,2005,2/2/2005,A/H5 Avian Influenza,NA,Cambodia,KHM,Kampot Province,1/21/2005,1/27/2005,NA,2/2/2005,NA,yes,NA,NA,1,NA,NA,1,1,NA,yes,NA,NA,NA,first case; exported to Vietnam,https://www.who.int/csr/don/2005_02_02/en/,DON-2005-02-02
2005-H5 Influenza-VNM,3,2005,2/2/2005,H5N1,NA,Vietnam,VNM,"southern provinces, Phu Tho",NA,NA,NA,NA,NA,NA,NA,NA,NA,NA,NA,13,12,NA,NA,NA,NA,NA,NA,https://www.who.int/csr/don/2005_02_02/en/,DON-2005-02-02
2005-Dengue-TLS,6,2005,2/3/2005,Dengue haemorrhagic fever,NA,Timor-Leste,TLS,"Baucau, Dili, Liquica, Maliana and Manatuto",NA,NA,NA,2/1/2005,NA,NA,NA,NA,NA,NA,34,95,11,11.6,yes,NA,NA,NA,NA,https://www.who.int/csr/don/2005_02_03/en/,DON-2005-02-03
2005-Dengue-TLS,6,2005,2/10/2005,Dengue haemorrhagic fever,NA,Timor-Leste,TLS,"Baucau, Dili, Liquica, Maliana and Manatuto",NA,NA,NA,2/9/2005,NA,NA,NA,NA,NA,NA,NA,178,16,9,yes,NA,NA,NA,NA,https://www.who.int/csr/don/2005_02_10/en/,DON-2005-02-10
2005-Meningococcal Disease-SDN,1,2005,2/14/2005,Meningococcal disease,NA,Sudan,SDN,"Blue Nile, Gadaref, Khartoum",NA,NA,NA,2/7/2005,NA,yes,NA,NA,3,NA,NA,250,19,NA,yes,NA,NA,NA,NA,https://www.who.int/csr/don/2005_02_14/en/,DON-2005-02-14
2005-Dengue-TLS,6,2005,2/15/2005,Dengue haemorrhagic fever,NA,Timor-Leste,TLS,"Baucau, Dili, Liquica, Maliana and Manatuto",NA,NA,NA,2/15/2005,NA,NA,NA,NA,NA,NA,49,215,20,9.3,yes,NA,NA,NA,NA,https://www.who.int/csr/don/2005_02_15/en/,DON-2005-02-15
2005-Plague-COD,2,2005,2/18/2005,Plague,NA,Democratic Republic of the Congo,COD,"Bas-Uele district, diamond mine in Zobia",12/20/2004,NA,NA,2/15/2005,NA,yes,NA,NA,NA,NA,NA,NA,61,NA,yes,NA,NA,NA,NA,https://www.who.int/csr/don/2005_02_18/en/,DON-2005-02-18
2005-Plague-COD,2,2005,3/1/2005,Plague,NA,Democratic Republic of the Congo,COD,"Zobia, Bas-Uele district",NA,NA,NA,NA,NA,NA,NA,NA,NA,4,4,NA,1,NA,2/25/2005,NA,NA,NA,team arrived; updates since 2/25,https://www.who.int/csr/don/2005_03_01/en/,DON-2005-03-01
2005-Dengue-TLS,6,2005,3/1/2005,Dengue haemorrhagic fever,NA,Timor-Leste,TLS,"Baucau, Dili, Liquica, Maliana, Manatuto, Viqueque",NA,NA,NA,2/28/2005,NA,yes,NA,NA,NA,NA,73,336,22,NA,yes,yes,NA,NA,NA,https://www.who.int/csr/don/2005_03_01a/en/,DON-2005-03-01a
2005-Plague-COD,2,2005,3/4/2005,Plague,NA,Democratic Republic of the Congo,COD,"Zobia, Bas-Uele district",NA,NA,NA,yes,NA,yes,NA,NA,10,3,54,57,16,NA,yes,NA,NA,NA,NA,https://www.who.int/csr/don/2005_03_04/en/,DON-2005-03-04
2005-H5 Influenza-VNM,3,2005,3/7/2005,H5N1,NA,Vietnam,VNM,"Thai Binh, Hanoi",2/14/2005,2/20/2005,NA,NA,NA,yes,NA,NA,4,NA,NA,NA,NA,NA,yes,NA,NA,NA,new cases,https://www.who.int/csr/don/2005_03_07/en/,DON-2005-03-07
2005-Plague-COD,2,2005,3/9/2005,Plague,NA,Democratic Republic of the Congo,COD,"Zobia, Bas-Uele district",NA,NA,NA,yes,NA,NA,NA,NA,NA,4,110,114,54,NA,yes,NA,NA,NA,NA,https://www.who.int/csr/don/2005_03_09/en/,DON-2005-03-09
2005-H5 Influenza-VNM,3,2005,3/11/2005,H5N1,NA,Vietnam,VNM,NA,NA,Mid-December 2004,NA,3/11/2005,NA,yes,NA,NA,24,NA,NA,NA,13,NA,yes,NA,NA,NA,NA,https://www.who.int/csr/don/2005_03_11/en/,DON-2005-03-11
2005-Plague-COD,2,2005,3/15/2005,Plague,NA,Democratic Republic of the Congo,COD,"Zobia, Bas-Uele district",NA,NA,NA,3/14/2005,NA,NA,NA,NA,NA,NA,130,NA,57,NA,yes,NA,NA,NA,NA,https://www.who.int/csr/don/2005_03_15/en/,DON-2005-03-15
2005-Measles-NGA,1,2005,3/17/2005,Acute fever and rash syndrome,NA,Nigeria,NGA,12 Local Government Areas in Adamawa state,NA,NA,NA,yes,NA,no,NA,NA,NA,NA,NA,1118,76,6.8,yes,NA,NA,NA,diagnosed as measles but no lab confirmation,https://www.who.int/csr/don/2005_03_17/en/,DON-2005-03-17
2005-Myocarditis-LKA,7,2005,3/17/2005,Myocarditis,NA,Sri Lanka,LKA,"Badulla, Monaragala",NA,NA,NA,yes,NA,no,NA,NA,NA,NA,NA,NA,NA,NA,yes,NA,NA,NA,suspected cases of unknown aetiology,https://www.who.int/csr/don/2005_03_17a/en/,DON-2005-03-17a
2005-Marburg haemorrhagic fever-AGO,2,2005,3/17/2005,Acute haemorrhagic fever syndrom,NA,Angola,AGO,Uige Province,NA,NA,NA,01/??/2005,NA,no,NA,NA,NA,NA,NA,NA,39,NA,yes,NA,NA,NA,lab samples collected,https://www.who.int/csr/don/2005_03_17b/en/,DON-2005-03-17b
2005-Marburg haemorrhagic fever-AGO,2,2005,3/23/2005,Marburg haemorrhagic fever,NA,Angola,AGO,Uige Province,NA,NA,NA,NA,NA,3/21/2005,NA,NA,9,NA,NA,102,95,NA,yes,yes,NA,NA,NA,https://www.who.int/csr/don/2005_03_23/en/,DON-2005-03-23
2005-Meningococcal Disease-SDN,1,2005,3/23/2005,Meningococcal disease,NA,Sudan,SDN,Sara Omra,NA,NA,NA,yes,NA,yes,NA,NA,11,NA,26,NA,NA,NA,yes,NA,NA,NA,NA,https://www.who.int/csr/don/2005_03_23a/en/,DON-2005-03-23a
2005-Marburg haemorrhagic fever-AGO,2,2005,3/24/2005,Marburg haemorrhagic fever,NA,Angola,AGO,NA,NA,NA,NA,NA,NA,yes,NA,NA,NA,NA,NA,NA,NA,NA,yes,yes,NA,NA,Report about technical assistance,https://www.who.int/csr/don/2005_03_24a/en/,DON-2005-03-24a
2005-Meningococcal Disease-TCD,1,2005,3/24/2005,Meningococcal disease,NA,Chad,TCD,"Bongor, Moissal",NA,NA,NA,1/1/2005,NA,yes,NA,NA,9,NA,NA,387,53,13,3/11/2005,NA,NA,NA,NA,https://www.who.int/csr/don/2005_03_24/en/,DON-2005-03-24
2005-Marburg haemorrhagic fever-AGO,2,2005,3/29/2005,Marburg haemorrhagic fever,NA,Angola,AGO,"Cabinda, Luanda, Uige",NA,NA,NA,3/29/2005,NA,yes,NA,NA,10,NA,NA,124,117,NA,yes,yes,NA,NA,NA,https://www.who.int/csr/don/2005_03_29a/en/,DON-2005-03-29a
2005-H5 Influenza-VNM,3,2005,3/29/2005,H5N1,NA,Vietnam,VNM,"Quang Binh, Nam Dinh",NA,NA,NA,NA,NA,yes,NA,NA,NA,NA,NA,NA,28,NA,yes,NA,NA,NA,NA,https://www.who.int/csr/don/2005_03_29b/en/,DON-2005-03-29b
2005-H5 Influenza-KHM,3,2005,3/29/2005,H5N1,NA,Cambodia,KHM,Kampot,3/17/2005,3/21/2005,NA,NA,NA,3/22/2005,NA,NA,NA,NA,NA,2,NA,NA,yes,NA,NA,NA,NA,https://www.who.int/csr/don/2005_03_29b/en/,DON-2005-03-29b
2005-Cholera-SEN,5,2005,3/29/2005,Cholera,NA,Senegal,SEN,"Touba, Mbacké and Bambey districts",NA,NA,NA,1/1/2005,NA,yes,NA,NA,14,NA,NA,2054,8,NA,yes,NA,yes,NA,NA,https://www.who.int/csr/don/2005_03_29/en/,DON-2005-03-29
2005-H5 Influenza-PRK,3,2005,3/30/2005,Avian Influenza,NA,Democratic People's Republic of Korea,PRK,Pyongyang,NA,NA,NA,NA,NA,NA,NA,NA,0,NA,NA,0,0,NA,yes,3/27/2005,NA,NA,in poultry,https://www.who.int/csr/don/2005_03_30/en/,DON-2005-03-30
2005-Cholera-SEN,5,2005,3/31/2005,Cholera,NA,Senegal,SEN,NA,NA,NA,NA,3/21/2005,NA,NA,NA,NA,NA,NA,NA,757,NA,NA,yes,yes,yes,NA,for the week,https://www.who.int/csr/don/2005_03_31/en/,DON-2005-03-31
2005-Marburg haemorrhagic fever-AGO,2,2005,3/31/2005,Marburg haemorrhagic fever,NA,Angola,AGO,Uige,NA,NA,NA,3/30/2005,NA,NA,NA,NA,NA,NA,NA,132,127,NA,yes,NA,NA,NA,NA,https://www.who.int/csr/don/2005_03_31a/en/,DON-2005-03-31a
2005-Marburg haemorrhagic fever-AGO,2,2005,4/1/2005,Marburg haemorrhagic fever,NA,Angola,AGO,Uige,NA,NA,NA,3/31/2005,NA,NA,NA,NA,NA,NA,NA,140,132,NA,yes,NA,NA,NA,NA,https://www.who.int/csr/don/2005_04_01/en/,DON-2005-04-01
2005-H5 Influenza-VNM,3,2005,4/4/2005,Avian Influenza,NA,Vietnam,VNM,Haiphong,NA,3/22/2005,NA,NA,NA,yes,NA,NA,NA,NA,NA,33,15,NA,NA,NA,NA,NA,NA,https://www.who.int/csr/don/2005_04_04/en/,DON-2005-04-04
2005-Marburg haemorrhagic fever-AGO,2,2005,4/4/2005,Marburg haemorrhagic fever,NA,Angola,AGO,"Uige, Luanda, Cabinda, Malange, Kuanza Norte",NA,NA,NA,4/2/2005,NA,NA,NA,NA,NA,NA,NA,163,150,NA,yes,NA,NA,NA,NA,https://www.who.int/csr/don/2005_04_04a/en/,DON-2005-04-04a
2005-Marburg haemorrhagic fever-AGO,2,2005,4/5/2005,Marburg haemorrhagic fever,NA,Angola,AGO,NA,NA,NA,NA,NA,NA,NA,NA,NA,NA,NA,NA,NA,NA,NA,NA,NA,NA,NA,NA,https://docs.google.com/spreadsheets/d/1hdPytPiW9vfsQW_rPlXH3I_pB2v0rKBrM80xH5ld3Jo/edit#gid=1919292199,https://docs.google.com/spreadsheets/d/1hdPytPiW9vfsQW-rPlXH3I-pB2v0rKBrM80xH5ld3Jo/edit#gid=1919292199
2005-Meningococcal Disease-SDN,1,2005,4/6/2005,Meningococcal disease,NA,Sudan,SDN,Sarf Omra,NA,NA,3/25/2005,NA,NA,yes,NA,NA,11,NA,71,NA,5,7.04,4/2/2005,NA,NA,NA,NA,https://www.who.int/csr/don/2005_04_06a/en/,DON-2005-04-06a
2005-Marburg haemorrhagic fever-AGO,2,2005,4/6/2005,Marburg haemorrhagic fever,NA,Angola,AGO,"Uige epicentre, 4 other provinces",NA,NA,NA,4/5/2005,NA,3/21/2005,NA,NA,NA,NA,NA,181,156,NA,yes,NA,NA,yes,NA,https://www.who.int/csr/don/2005_04_06/en/,DON-2005-04-06
2005-Marburg haemorrhagic fever-AGO,2,2005,4/7/2005,Marburg haemorrhagic fever,NA,Angola,AGO,6 provinces in north-west,NA,NA,NA,4/6/2005,NA,NA,NA,NA,NA,NA,NA,200,173,NA,yes,NA,NA,NA,lab testing occuring-- doesn't mention confirmation specifically,https://www.who.int/csr/don/2005_04_07/en/,DON-2005-04-07
2005-Cholera-SEN,5,2005,4/8/2005,Cholera,NA,Senegal,SEN,"Diourbel region, Touba city",NA,NA,NA,3/28/2005,NA,NA,NA,NA,NA,NA,NA,3475,54,1.5,yes,NA,yes,NA,NA,https://www.who.int/csr/don/2005_04_08/en/,DON-2005-04-08
2005-Marburg haemorrhagic fever-AGO,2,2005,4/8/2005,Marburg haemorrhagic fever,NA,Angola,AGO,7 provinces in north-west,NA,NA,4/7/2005,NA,NA,NA,NA,NA,NA,NA,NA,NA,NA,NA,yes,NA,NA,yes,NA,https://www.who.int/csr/don/2005_04_08a/en/,DON-2005-04-08a
2005-Marburg haemorrhagic fever-AGO,2,2005,4/11/2005,Marburg haemorrhagic fever,NA,Angola,AGO,Uige,NA,NA,4/9/2005,NA,NA,NA,NA,NA,NA,NA,NA,NA,NA,NA,yes,yes,NA,NA,NA,https://www.who.int/csr/don/2005_04_11/en/,DON-2005-04-11
2005-H5 Influenza-KHM,3,2005,4/12/2005,H5N1,NA,Cambodia,KHM,Kampot,3/29/2005,4/7/2005,NA,NA,NA,yes,NA,NA,NA,NA,NA,NA,NA,NA,yes,yes,NA,NA,NA,https://www.who.int/csr/don/2005_04_12/en/,DON-2005-04-12
2005-Marburg haemorrhagic fever-AGO,2,2005,4/13/2005,Marburg haemorrhagic fever,NA,Angola,AGO,Uige,NA,NA,4/11/2005,NA,NA,NA,NA,NA,NA,NA,NA,231,210,NA,yes,yes,NA,yes,NA,https://www.who.int/csr/don/2005_04_13/en/,DON-2005-04-13
2005-H5 Influenza-VNM,3,2005,4/14/2005,H5N1,NA,Vietnam,VNM,"Hung Yen, Ha Tay, 18 cities and provinces total",NA,NA,NA,yes,NA,NA,NA,NA,NA,NA,NA,41,16,NA,NA,NA,NA,NA,NA,https://www.who.int/csr/don/2005_04_14/en/,DON-2005-04-14
2005-Marburg haemorrhagic fever-AGO,2,2005,4/14/2005,Marburg haemorrhagic fever,NA,Angola,AGO,Uige,NA,NA,4/12/2005,NA,NA,NA,NA,NA,NA,NA,NA,235,215,NA,yes,NA,NA,yes,NA,https://www.who.int/csr/don/2005_04_14a/en/,DON-2005-04-14a
2005-Marburg haemorrhagic fever-AGO,2,2005,4/15/2005,Marburg haemorrhagic fever,NA,Angola,AGO,"Uige, 7 municipalities in same province",NA,NA,4/14/2005,NA,NA,NA,NA,NA,NA,NA,NA,224,207,NA,yes,NA,NA,yes,case data reclassified,https://www.who.int/csr/don/2005_04_15/en/,DON-2005-04-15
2005-Cholera-SEN,5,2005,4/20/2005,Cholera,NA,Senegal,SEN,"Diourbel, Touba",NA,NA,NA,4/11/2005,NA,NA,NA,NA,NA,NA,NA,1187,14,1.2,yes,yes,NA,NA,NA,https://www.who.int/csr/don/2005_04_20/en/,DON-2005-04-20
2005-Marburg haemorrhagic fever-AGO,2,2005,4/21/2005,Marburg haemorrhagic fever,NA,Angola,AGO,Uige,NA,NA,NA,4/19/2005,NA,NA,NA,NA,NA,NA,NA,266,239,NA,yes,yes,NA,NA,NA,https://www.who.int/csr/don/2005_04_21/en/,DON-2005-04-21
2005-Marburg haemorrhagic fever-AGO,2,2005,4/22/2005,Marburg haemorrhagic fever,NA,Angola,AGO,Uige,NA,NA,NA,4/20/2005,NA,3/21/2005,NA,NA,NA,NA,NA,266,244,>90,3/22/2005,NA,NA,yes,NA,https://www.who.int/csr/don/2005_04_22/en/,DON-2005-04-22
2005-WPV-YEM,5,2005,4/25/2005,Poliomyelitis,NA,Yemen,YEM,Hudeida,02/??/2005,NA,NA,4/4/2005,NA,4/20/2005,NA,NA,4,NA,NA,NA,NA,NA,4/13/2005,NA,NA,NA,WPV1,https://www.who.int/csr/don/2005_04_25/en/,DON-2005-04-25
2005-Marburg haemorrhagic fever-AGO,2,2005,4/29/2005,Marburg haemorrhagic fever,NA,Angola,AGO,Uige,NA,NA,NA,4/27/2005,NA,NA,NA,NA,NA,NA,NA,275,255,NA,yes,yes,NA,NA,NA,https://www.who.int/csr/don/2005_04_29/en/,DON-2005-04-29
2005-H5 Influenza-KHM,3,2005,5/4/2005,Avian Influenza,NA,Cambodia,KHM,Kompong Trach district,NA,NA,NA,NA,NA,5/4/2005,NA,NA,NA,NA,NA,4,NA,NA,yes,yes,NA,NA,NA,https://www.who.int/csr/don/2005_05_04/en/,DON-2005-05-04
2005-Marburg haemorrhagic fever-AGO,2,2005,5/6/2005,Marburg haemorrhagic fever,NA,Angola,AGO,Uige,NA,NA,NA,5/3/2005,NA,yes,NA,NA,NA,NA,NA,308,277,NA,yes,yes,NA,NA,NA,https://www.who.int/csr/don/2005_05_06/en/,DON-2005-05-06
2005-Meningococcal Disease-IND,1,2005,5/9/2005,Meningococcal disease,NA,India,IND,Delhi (mostly Old Delhi),NA,NA,3/29/2005,NA,NA,yes,NA,NA,5,NA,NA,111,15,NA,yes,yes,NA,NA,NA,https://www.who.int/csr/don/2005_05_09/en/,DON-2005-05-09
2005-Marburg haemorrhagic fever-AGO,2,2005,5/11/2005,Marburg haemorrhagic fever,NA,Angola,AGO,Uige,NA,NA,NA,5/10/2005,NA,NA,NA,NA,NA,NA,NA,316,276,NA,yes,yes,NA,NA,NA,https://www.who.int/csr/don/2005_05_11/en/,DON-2005-05-11
2005-Meningococcal Disease-IND,1,2005,5/12/2005,Meningococcal disease,NA,India,IND,Old Delhi,NA,NA,NA,3/29/2005,NA,yes,NA,NA,7,NA,NA,214,16,7.5,yes,NA,NA,NA,NA,https://www.who.int/csr/don/2005_05_12/en/,DON-2005-05-12
2005-Ebola-COG,2,2005,5/13/2005,Acute Haemorrhagic Fever,NA,Republic of the Congo,COG,"Etoumbi, Mbomo, Cuvette Ouest",NA,NA,4/27/2005,NA,NA,NA,NA,NA,NA,NA,9,NA,9,NA,yes,NA,NA,NA,NA,https://www.who.int/csr/don/2005_05_13/en/,DON-2005-05-13
2005-Cholera-SEN,5,2005,5/13/2005,Cholera,NA,Senegal,SEN,"Diourbel, Touba",NA,NA,NA,5/2/2005,NA,NA,NA,NA,NA,NA,NA,509,6,1.2,yes,yes,NA,NA,NA,https://www.who.int/csr/don/2005_05_13a/en/,DON-2005-05-13a
2005-Meningococcal Disease-IND,1,2005,5/17/2005,Meningococcal disease,NA,India,IND,"Delhi, Old Delhi, Shahdara",NA,NA,5/16/2005,NA,NA,yes,NA,NA,18,NA,NA,303,26,NA,NA,NA,NA,NA,NA,https://www.who.int/csr/don/2005_05_17/en/,DON-2005-05-17
2005-Ebola-COG,2,2005,5/18/2005,Ebola haemorrhagic fever,NA,Republic of the Congo,COG,"Etoumbi, Mbomo",NA,NA,5/17/2005,NA,yes,yes,NA,NA,1,NA,NA,11,9,NA,yes,yes,NA,NA,NA,https://www.who.int/csr/don/2005_05_18/en/,DON-2005-05-18
2005-Marburg haemorrhagic fever-AGO,2,2005,5/18/2005,Marburg haemorrhagic fever,NA,Angola,AGO,Uige,NA,NA,NA,5/17/2005,NA,yes,NA,NA,NA,NA,NA,337,311,NA,yes,yes,NA,NA,NA,https://www.who.int/csr/don/2005_05_18a/en/,DON-2005-05-18a
2005-H5 Influenza-VNM,3,2005,5/19/2005,H5N1,NA,Vietnam,VNM,NA,12/??/2003,NA,NA,01/??/2004,NA,NA,NA,NA,NA,NA,NA,76,37,NA,NA,NA,NA,NA,update table showing cumulative numbers,https://www.who.int/csr/don/2005_05_19/en/,DON-2005-05-19
2005-H5 Influenza-THA,3,2005,5/19/2005,H5N1,NA,Thailand,THA,NA,12/??/2003,NA,NA,01/??/2004,NA,NA,NA,NA,NA,NA,NA,17,12,NA,NA,NA,NA,NA,NA,https://www.who.int/csr/don/2005_05_19/en/,DON-2005-05-19
2005-H5 Influenza-KHM,3,2005,5/19/2005,H5N1,NA,Cambodia,KHM,NA,12/??/2003,NA,NA,01/??/2004,NA,NA,NA,NA,NA,NA,NA,4,4,NA,NA,NA,NA,NA,NA,https://www.who.int/csr/don/2005_05_19/en/,DON-2005-05-19
2005-Ebola-COG,2,2005,5/25/2005,Ebola haemorrhagic fever,NA,Republic of the Congo,COG,"Etoumbi, Mbomo",NA,NA,5/24/2005,NA,NA,yes,NA,NA,1,NA,NA,12,9,NA,yes,yes,NA,NA,NA,https://www.who.int/csr/don/2005_05_25/en/,DON-2005-05-25
2005-Cholera-SEN,5,2005,5/27/2005,Cholera,NA,Senegal,SEN,"Diourbel, Fatick, Louga, Dakar",NA,NA,NA,5/16/2005,NA,NA,NA,NA,NA,NA,NA,766,8,1.04,yes,NA,NA,NA,NA,https://www.who.int/csr/don/2005_05_27/en/,DON-2005-05-27
2005-Marburg haemorrhagic fever-AGO,2,2005,5/27/2005,Marburg haemorrhagic fever,NA,Angola,AGO,"Uige Province, Bungo municipality",NA,NA,NA,5/26/2005,NA,yes,NA,NA,NA,NA,NA,399,335,NA,yes,yes,NA,NA,NA,https://www.who.int/csr/don/2005_05_27a/en/,DON-2005-05-27a
2005-WPV-YEM,5,2005,5/30/2005,Poliomyelitis,NA,Yemen,YEM,"Hudaidah, 11 governorates total",2/25/2005,NA,4/22/2005,NA,NA,NA,NA,NA,NA,NA,NA,179,NA,NA,5/29/2005,NA,NA,NA,NA,https://www.who.int/csr/don/2005_05_30/en/,DON-2005-05-30
2005-Meningococcal Disease-IND,1,2005,5/30/2005,Meningococcal disease,NA,India,IND,"City, Shahdara North, Sadar Paharganj, Shadara South, Civil Lines, Central",NA,NA,NA,5/26/2005,NA,yes,NA,NA,35,NA,NA,368,37,10.1,yes,NA,NA,NA,NA,https://www.who.int/csr/don/2005_05_30a/en/,DON-2005-05-30a
2005-WPV-IDN,5,2005,6/6/2005,Poliomyelitis,NA,Indonesia,IDN,"Sukabumi, Lebak, Cianjur",3/13/2005,NA,NA,NA,NA,NA,NA,NA,NA,NA,NA,20,NA,NA,yes,NA,NA,NA,NA,https://www.who.int/csr/don/2005_06_06/en/,DON-2005-06-06
2005-Marburg haemorrhagic fever-AGO,2,2005,6/7/2005,Marburg haemorrhagic fever,NA,Angola,AGO,Uige,NA,NA,yes,6/5/2005,NA,yes,NA,NA,NA,NA,NA,423,357,NA,yes,NA,NA,NA,NA,https://www.who.int/csr/don/2005_06_07/en/,DON-2005-06-07
2005-WPV-IDN,5,2005,6/8/2005,Poliomyelitis,NA,Indonesia,IDN,Lebak and Serang districts,NA,NA,NA,NA,NA,NA,NA,NA,NA,NA,NA,28,NA,NA,NA,NA,NA,NA,NA,https://www.who.int/csr/don/2005_06_08/en/,DON-2005-06-08
2005-H5 Influenza-VNM,3,2005,6/8/2005,H5N1,NA,Vietnam,VNM,NA,NA,NA,NA,NA,NA,yes,NA,NA,NA,NA,NA,52,18,NA,NA,NA,NA,NA,NA,https://www.who.int/csr/don/2005_06_08a/en/,DON-2005-06-08a
2005-WPV-IDN,5,2005,6/9/2005,Poliomyelitis,NA,Indonesia,IDN,"Lebak, Cianjur, Bogor, Sukabumi",NA,NA,NA,NA,NA,NA,NA,NA,NA,NA,NA,34,NA,NA,NA,NA,NA,NA,NA,https://www.who.int/csr/don/2005_06_09/en/,DON-2005-06-09
2005-WPV-IDN,5,2005,6/14/2005,Poliomyelitis,NA,Indonesia,IDN,"Sukabumi, Bogor",NA,NA,NA,NA,NA,NA,NA,NA,NA,NA,NA,39,NA,NA,NA,NA,NA,NA,NA,https://www.who.int/csr/don/2005_06_14a/en/,DON-2005-06-14a
2005-Meningococcal Disease-IND,1,2005,6/14/2005,Meningococcal disease,NA,India,IND,NA,NA,NA,NA,6/8/2005,NA,yes,NA,NA,NA,NA,NA,405,48,11.9,yes,yes,NA,NA,NA,https://www.who.int/csr/don/2005_06_14/en/,DON-2005-06-14
2005-H5 Influenza-VNM,3,2005,6/14/2005,H5N1,NA,Vietnam,VNM,Hanoi,NA,Last 2 weeks of May,NA,NA,NA,NA,NA,NA,NA,NA,NA,55,18,NA,NA,NA,NA,NA,NA,https://www.who.int/csr/don/2005_06_14b/en/,DON-2005-06-14b
2005-WPV-IDN,5,2005,6/15/2005,Poliomyelitis,NA,Indonesia,IDN,"Sukabumi, Bogor, Lebak",NA,NA,NA,NA,NA,NA,NA,NA,NA,NA,NA,46,NA,NA,5/31/2005,NA,NA,NA,NA,https://www.who.int/csr/don/2005_06_15/en/,DON-2005-06-15
2005-Ebola-COG,2,2005,6/16/2005,Ebola haemorrhagic fever,NA,Republic of the Congo,COG,"Etoumbi, Mbomo",NA,NA,4/25/2005,NA,NA,yes,NA,NA,1,NA,NA,12,9,NA,yes,yes,NA,NA,NA,https://www.who.int/csr/don/2005_06_16/en/,DON-2005-06-16
2005-H5 Influenza-VNM,3,2005,6/16/2005,H5N1,NA,Vietnam,VNM,Hanoi,NA,NA,NA,no,NA,NA,NA,NA,NA,NA,NA,7,NA,NA,NA,NA,NA,NA,media reports of new cases,https://www.who.int/csr/don/2005_06_16a/en/,DON-2005-06-16a
2005-Marburg haemorrhagic fever-AGO,2,2005,6/17/2005,Marburg haemorrhagic fever,NA,Angola,AGO,Uige,NA,NA,NA,6/16/2005,NA,NA,NA,NA,NA,NA,NA,422,356,NA,yes,NA,NA,NA,in Uige province,https://www.who.int/csr/don/2005_06_17/en/,DON-2005-06-17
2005-H5 Influenza-VNM,3,2005,6/17/2005,H5N1,NA,Vietnam,VNM,"Hanoi, Hai Duong, Nghe An",NA,NA,6/1/2005,NA,NA,NA,NA,NA,NA,NA,NA,59,18,NA,NA,NA,NA,NA,NA,https://www.who.int/csr/don/2005_06_17a/en/,DON-2005-06-17a
2005-WPV-IDN,5,2005,6/20/2005,Poliomyelitis,NA,Indonesia,IDN,"Bogor, Cinajur, Sukabumi,Demak",NA,NA,NA,NA,NA,NA,NA,NA,NA,NA,NA,51,NA,NA,5/31/2005,NA,NA,NA,NA,https://www.who.int/csr/don/2005_06_20/en/,DON-2005-06-20
2005-Cholera-AFG,5,2005,6/21/2005,Cholera,NA,Afghanistan,AFG,Kabul city,NA,NA,NA,5/25/2005,NA,yes,NA,NA,40,NA,NA,3245,NA,NA,yes,NA,NA,NA,NA,https://www.who.int/csr/don/2005_06_21/en/,DON-2005-06-21
2005-WPV-IDN,5,2005,6/27/2005,Poliomyelitis,NA,Indonesia,IDN,"Western Javan, Banten, Demak",NA,NA,NA,NA,NA,NA,NA,NA,NA,NA,NA,65,NA,NA,5/31/2005,NA,NA,NA,NA,https://www.who.int/csr/don/2005_06_27/en/,DON-2005-06-27
2005-H5 Influenza-VNM,3,2005,6/28/2005,H5N1,NA,Vietnam,VNM,Ha Tay,NA,NA,NA,NA,NA,NA,NA,NA,NA,NA,NA,60,18,NA,NA,NA,NA,NA,NA,https://www.who.int/csr/don/2005_06_28/en/,DON-2005-06-28
2005-H5 Influenza-VNM,3,2005,6/30/2005,H5N1,NA,Vietnam,VNM,NA,NA,NA,NA,NA,NA,yes,NA,NA,NA,NA,NA,NA,NA,NA,yes,NA,NA,NA,risk assessment,https://www.who.int/csr/don/2005_06_30/en/,DON-2005-06-30
2005-WPV-IDN,5,2005,7/1/2005,Poliomyelitis,NA,Indonesia,IDN,Lampung,6/4/2005,NA,NA,NA,NA,6/30/2005,NA,NA,NA,NA,NA,66,NA,NA,5/31/2005,NA,NA,NA,NA,https://www.who.int/csr/don/2005_07_01/en/,DON-2005-07-01
2005-WPV-AGO,5,2005,7/1/2005,Poliomyelitis,NA,Angola,AGO,Luanda,4/25/2005,NA,NA,6/24/2005,NA,yes,NA,NA,NA,NA,NA,1,NA,NA,yes,NA,NA,NA,NA,https://www.who.int/csr/don/2005_07_01a/en/,DON-2005-07-01a
2005-WPV-IDN,5,2005,7/4/2005,Poliomyelitis,NA,Indonesia,IDN,"Banten, West Java",NA,NA,NA,NA,NA,NA,NA,NA,NA,NA,NA,79,NA,NA,yes,NA,NA,NA,NA,https://www.who.int/csr/don/2005_07_04/en/,DON-2005-07-04
2005-WPV-IDN,5,2005,7/5/2005,Poliomyelitis,NA,Indonesia,IDN,"Banten, Lampung",NA,NA,NA,NA,NA,NA,NA,NA,NA,NA,NA,100,NA,NA,yes,NA,NA,NA,NA,https://www.who.int/csr/don/2005_07_05/en/,DON-2005-07-05
2005-WPV-IDN,5,2005,7/8/2005,Poliomyelitis,NA,Indonesia,IDN,West Java,NA,NA,NA,NA,NA,NA,NA,NA,NA,NA,NA,122,NA,NA,yes,NA,NA,NA,NA,https://www.who.int/csr/don/2005_07_08/en/,DON-2005-07-08
2005-Cholera-SEN,5,2005,7/8/2005,Cholera,NA,Senegal,SEN,"Diourbel, Fatick, Dakar, Thies, Mbour, Bakel",NA,NA,NA,6/27/2005,NA,NA,NA,NA,NA,NA,NA,469,4,0.9,yes,yes,NA,NA,NA,https://www.who.int/csr/don/2005_07_08a/en/,DON-2005-07-08a
2005-Marburg haemorrhagic fever-AGO,2,2005,7/13/2005,Marburg haemorrhagic fever,NA,Angola,AGO,Uige,NA,NA,NA,7/10/2005,NA,NA,NA,NA,NA,NA,NA,351,312,NA,yes,NA,NA,NA,weekly,https://www.who.int/csr/don/2005_07_13/en/,DON-2005-07-13
2005-Cholera-SEN,5,2005,7/15/2005,Cholera,NA,Senegal,SEN,"Dakar, Diourbel, Fatick, Kaolack, Saint Louis, Tambacounda, Thies, Foundiougne",NA,NA,NA,7/4/2005,NA,NA,NA,NA,NA,NA,NA,532,6,NA,yes,NA,NA,NA,weekly,https://www.who.int/csr/don/2005_07_15/en/,DON-2005-07-15
2005-WPV-IDN,5,2005,7/21/2005,Poliomyelitis,NA,Indonesia,IDN,"Bogor, Lebak",NA,NA,NA,NA,NA,7/19/2005,NA,NA,NA,NA,NA,153,NA,NA,yes,NA,NA,NA,NA,https://www.who.int/csr/don/2005_07_21/en/,DON-2005-07-21
2005-H5 Influenza-IDN,3,2005,7/21/2005,H5N1,NA,Indonesia,IDN,Tangerang,6/24/2005,NA,NA,yes,yes,yes,NA,NA,1,NA,NA,3,3,NA,yes,NA,NA,NA,NA,https://www.who.int/csr/don/2005_07_21a/en/,DON-2005-07-21a
2005-WPV-IDN,5,2005,7/29/2005,Poliomyelitis,NA,Indonesia,IDN,"Cianjur, Kota Bekasi",NA,NA,NA,NA,NA,NA,NA,NA,NA,NA,NA,155,NA,NA,yes,NA,NA,NA,NA,https://www.who.int/csr/don/2005_07_29/en/,DON-2005-07-29
2005-Marburg haemorrhagic fever-AGO,2,2005,7/29/2005,Marburg haemorrhagic fever,NA,Angola,AGO,NA,NA,NA,NA,7/28/2005,NA,yes,NA,NA,157,NA,NA,368,323,NA,yes,NA,NA,NA,NA,https://www.who.int/csr/don/2005_07_29a/en/,DON-2005-07-29a
2005-Cholera-NER,5,2005,7/29/2005,Cholera,NA,Niger,NER,Bouza,NA,NA,NA,7/13/2005,NA,yes,NA,NA,NA,NA,NA,49,5,10.2,7/29/2005,NA,NA,NA,NA,https://www.who.int/csr/don/2005_07_29b/en/,DON-2005-07-29b
2005-H5 Influenza-IDN,3,2005,7/29/2005,H5N1,NA,Indonesia,IDN,Tangerang,NA,NA,NA,NA,NA,yes,NA,NA,1,1,NA,3,NA,NA,yes,yes,NA,NA,NA,https://www.who.int/csr/don/2005_07_29c/en/,DON-2005-07-29c
2005-Streptococcus Suis-CHN,4,2005,8/3/2005,Streptococcus suis,NA,China,CHN,"Ziyang City, 11 prefectures in Sichuan Province",End June 2005,NA,6/24/2005,7/22/2005,NA,NA,NA,NA,NA,NA,NA,206,38,NA,yes,NA,NA,NA,NA,https://www.who.int/csr/don/2005_08_03/en/,DON-2005-08-03
2005-H5 Influenza-VNM,3,2005,8/5/2005,H5N1,NA,Vietnam,VNM,"Ha Tay, Tra Vinh, Ho Chi Minh",NA,NA,NA,NA,NA,NA,NA,NA,NA,NA,NA,63,20,NA,NA,NA,NA,NA,NA,https://www.who.int/csr/don/2005_08_05/en/,DON-2005-08-05
2005-H5 Influenza-RUS,3,2005,8/18/2005,H5N1,NA,Russia,RUS,Siberia,no,NA,NA,late July 2005,NA,early August 2005,NA,NA,0,NA,NA,0,0,NA,yes,NA,NA,NA,birds,https://www.who.int/csr/don/2005_08_18/en/,DON-2005-08-18
2005-H5 Influenza-KAZ,3,2005,8/18/2005,H5N1,NA,Kazakhstan,KAZ,villages bordering Siberia,no,NA,NA,late July 2005,NA,early August 2005,NA,NA,0,NA,NA,0,0,NA,yes,NA,NA,NA,birds,https://www.who.int/csr/don/2005_08_18/en/,DON-2005-08-18
2005-H5 Influenza-MNG,3,2005,8/18/2005,H5N1,NA,Mongolia,MNG,NA,no,NA,NA,early August 2005,NA,NA,NA,NA,0,NA,NA,0,0,NA,yes,NA,NA,NA,birds,https://www.who.int/csr/don/2005_08_18/en/,DON-2005-08-18
2005-H5 Influenza-CHN,3,2005,8/18/2005,H5N1,NA,China,CHN,Tibet,no,early August 2005,NA,NA,NA,NA,NA,NA,0,NA,NA,0,0,NA,yes,NA,NA,NA,birds,https://www.who.int/csr/don/2005_08_18/en/,DON-2005-08-18
2005-Marburg haemorrhagic fever-AGO,2,2005,8/24/2005,Marburg haemorrhagic fever,NA,Angola,AGO,Uige,NA,NA,NA,8/23/2005,NA,yes,NA,NA,158,NA,NA,374,329,88,yes,NA,NA,NA,NA,https://www.who.int/csr/don/2005_08_24/en/,DON-2005-08-24
2005-WPV-IDN,5,2005,8/25/2005,Poliomyelitis,NA,Indonesia,IDN,"West Java, Central Java, Banten, Lampung, Jakarta, Brebes",NA,NA,NA,8/24/2005,NA,NA,NA,NA,NA,NA,NA,225,NA,NA,8/30/2005,NA,NA,NA,NA,https://www.who.int/csr/don/2005_08_25a/en/,DON-2005-08-25a
2005-WPV-AGO,5,2005,8/25/2005,Poliomyelitis,NA,Angola,AGO,"Bengo, Benguela, Luanda, Lunda Sul, Moxico",NA,NA,NA,8/23/2005,NA,NA,NA,NA,NA,NA,NA,7,NA,NA,7/29/2005,NA,NA,NA,NA,https://www.who.int/csr/don/2005_08_25/en/,DON-2005-08-25
2005-Cholera-BFA,5,2005,8/26/2005,Cholera,NA,Burkina Faso,BFA,Ougadougou,NA,NA,NA,8/22/2005,NA,NA,NA,NA,NA,NA,NA,295,8,2.7,NA,NA,NA,NA,NA,https://www.who.int/csr/don/2005_08_26/en/,DON-2005-08-26
2005-Cholera-GIN,5,2005,8/26/2005,Cholera,NA,Guinea,GIN,NA,NA,NA,Mid-July 2005,NA,NA,NA,NA,NA,NA,NA,NA,571,32,5.6,NA,NA,NA,NA,NA,https://www.who.int/csr/don/2005_08_26/en/,DON-2005-08-26
2005-Cholera-GNB,5,2005,8/26/2005,Cholera,NA,Guinea-Bissau,GNB,"Bissau, Bimbo, 10/11 regions",6/6/2005,NA,NA,NA,NA,NA,NA,NA,NA,NA,NA,9047,172,1.9,NA,NA,NA,NA,NA,https://www.who.int/csr/don/2005_08_26/en/,DON-2005-08-26
2005-Cholera-LBR,5,2005,8/26/2005,Cholera,NA,Liberia,LBR,Sinoe County,NA,NA,8/1/2005,NA,NA,NA,NA,NA,NA,NA,NA,703,29,4.1,NA,NA,NA,NA,NA,https://www.who.int/csr/don/2005_08_26/en/,DON-2005-08-26
2005-Cholera-MLI,5,2005,8/26/2005,Cholera,NA,Mali,MLI,NA,6/20/2005,NA,NA,NA,NA,NA,NA,NA,NA,NA,NA,158,20,12.65,NA,NA,NA,NA,NA,https://www.who.int/csr/don/2005_08_26/en/,DON-2005-08-26
2005-Cholera-MRT,5,2005,8/26/2005,Cholera,NA,Mauritania,MRT,"Nouakchott, Brakna, Guidimakha, Traza",NA,NA,early May 2005,NA,NA,NA,NA,NA,NA,NA,NA,717,NA,NA,NA,NA,NA,NA,reports only deaths from Nouakchott,https://www.who.int/csr/don/2005_08_26/en/,DON-2005-08-26
2005-Cholera-NER,5,2005,8/26/2005,Cholera,NA,Niger,NER,Bouza,7/13/2005,NA,NA,NA,NA,NA,NA,NA,NA,NA,NA,125,15,12,NA,NA,NA,NA,NA,https://www.who.int/csr/don/2005_08_26/en/,DON-2005-08-26
2005-Cholera-SEN,5,2005,8/26/2005,Cholera,NA,Senegal,SEN,NA,01/??/2005,NA,NA,NA,NA,NA,NA,NA,NA,NA,NA,19863,231,1.1,NA,NA,NA,NA,NA,https://www.who.int/csr/don/2005_08_26/en/,DON-2005-08-26
2005-Yellow Fever-GIN,6,2005,8/31/2005,Yellow fever,NA,Guinea,GIN,"Mamou, Dalaba",NA,NA,NA,yes,NA,yes,NA,NA,4,NA,NA,7,4,NA,NA,NA,NA,NA,NA,https://www.who.int/csr/don/2005_08_31/en/,DON-2005-08-31
2005-WPV-ETH,5,2005,9/6/2005,Poliomyelitis,NA,Ethiopia,ETH,"Oromia, Amhara",7/1/2005,NA,8/31/2005,NA,NA,NA,NA,NA,NA,NA,NA,15,NA,NA,yes,NA,NA,NA,NA,https://www.who.int/csr/don/2005_09_06/en/,DON-2005-09-06
2005-WPV-SOM,5,2005,9/13/2005,Poliomyelitis,NA,Somalia,SOM,Mogadishu,7/12/2005,NA,NA,NA,NA,NA,NA,NA,NA,NA,NA,1,NA,NA,9/13/2005,NA,NA,NA,NA,https://www.who.int/csr/don/2005_09_13/en/,DON-2005-09-13
2005-Japanese Encephalitis-IND,6,2005,9/13/2005,Japanese Encephalitis (JE),NA,India,IND,14 districts of Uttar Pradesh Province,NA,NA,7/29/2005,NA,NA,yes,NA,NA,NA,NA,NA,1145,296,NA,NA,NA,NA,NA,NA,https://www.who.int/csr/don/2005_09_13a/en/,DON-2005-09-13a
2005-H5 Influenza-IDN,3,2005,9/16/2005,H5N1,NA,Indonesia,IDN,Jakarta,8/31/2005,9/6/2005,NA,NA,NA,9/16/2005,NA,NA,2,NA,NA,4,4,NA,yes,NA,NA,NA,NA,https://www.who.int/csr/don/2005_09_16/en/,DON-2005-09-16
2005-H5 Influenza-VNM,3,2005,9/19/2005,H5N1,NA,Vietnam,VNM,Ben Tre,7/25/2005,NA,NA,NA,NA,yes,NA,NA,NA,NA,NA,64,21,NA,NA,NA,NA,NA,NA,https://www.who.int/csr/don/2005_09_19/en/,DON-2005-09-19
2005-Yellow Fever-BFA,6,2005,9/22/2005,Yellow fever,NA,Burkina Faso,BFA,"Batie, Gaoua, Banfora",NA,NA,NA,yes,yes,yes,NA,NA,3,NA,NA,NA,0,NA,yes,NA,NA,NA,spread from Cote d'Ivoire,https://www.who.int/csr/don/2005_09_22/en/,DON-2005-09-22
2005-Yellow Fever-CIV,6,2005,9/22/2005,Yellow fever,NA,Cote d'Ivoire,CIV,Bouna,NA,NA,NA,NA,yes,yes,NA,NA,1,NA,NA,NA,1,NA,yes,NA,NA,NA,NA,https://www.who.int/csr/don/2005_09_22/en/,DON-2005-09-22
2005-H5 Influenza-IDN,3,2005,9/22/2005,H5N1,NA,Indonesia,IDN,NA,NA,NA,NA,NA,NA,9/22/2005,NA,NA,3,NA,NA,NA,NA,NA,yes,NA,NA,NA,NA,https://www.who.int/csr/don/archive/disease/influenza/2005_09_22a/en/,DON-archive/disease/influenza/2005-09-22a
2005-Cholera-BEN,5,2005,9/23/2005,Cholera,NA,Benin,BEN,"Cotonou, Oueme",early June 2005,NA,6/6/2005,NA,NA,NA,NA,NA,NA,NA,NA,210,4,NA,yes,NA,NA,NA,NA,https://www.who.int/csr/don/2005_09_23/en/,DON-2005-09-23
2005-Cholera-BFA,5,2005,9/23/2005,Cholera,NA,Burkina Faso,BFA,Ougadougou,NA,NA,8/8/2005,NA,NA,NA,NA,NA,NA,NA,NA,615,9,1.5,yes,yes,NA,NA,NA,https://www.who.int/csr/don/2005_09_23/en/,DON-2005-09-23
2005-Cholera-GIN,5,2005,9/23/2005,Cholera,NA,Guinea,GIN,"Conakry, Kindia",NA,NA,mid-July 2005,NA,NA,NA,NA,NA,NA,NA,NA,1956,72,3.7,yes,NA,NA,NA,NA,https://www.who.int/csr/don/2005_09_23/en/,DON-2005-09-23
2005-Cholera-GNB,5,2005,9/23/2005,Cholera,NA,Guinea-Bissau,GNB,all 11 regions,6/6/2005,NA,NA,NA,NA,NA,NA,NA,NA,NA,NA,14303,252,1.8,yes,NA,NA,NA,NA,https://www.who.int/csr/don/2005_09_23/en/,DON-2005-09-23
2005-Cholera-MLI,5,2005,9/23/2005,Cholera,NA,Mali,MLI,NA,6/20/2005,NA,NA,NA,NA,NA,NA,NA,NA,NA,NA,158,20,12.65,NA,NA,NA,NA,NA,https://www.who.int/csr/don/2005_09_23/en/,DON-2005-09-23
2005-Cholera-MRT,5,2005,9/23/2005,Cholera,NA,Mauritania,MRT,6 regions,NA,NA,7/20/2005,NA,NA,NA,NA,NA,NA,NA,NA,2640,55,2,NA,NA,NA,NA,NA,https://www.who.int/csr/don/2005_09_23/en/,DON-2005-09-23
2005-Cholera-NER,5,2005,9/23/2005,Cholera,NA,Niger,NER,"Bouza, Tahoua, Tilaberi, Tera",NA,NA,7/13/2005,NA,NA,NA,NA,NA,NA,NA,NA,431,44,10,NA,NA,NA,NA,NA,https://www.who.int/csr/don/2005_09_23/en/,DON-2005-09-23
2005-Cholera-SEN,5,2005,9/23/2005,Cholera,NA,Senegal,SEN,Dakar,01/??/2005,NA,NA,NA,NA,NA,NA,NA,NA,NA,NA,23325,303,1.2,NA,NA,NA,NA,NA,https://www.who.int/csr/don/2005_09_23/en/,DON-2005-09-23
2005-H5 Influenza-IDN,3,2005,9/29/2005,H5N1,NA,Indonesia,IDN,Jakarta,9/17/2005,9/19/2005,NA,NA,NA,9/29/2005,NA,NA,4,NA,NA,NA,3,NA,yes,NA,NA,NA,NA,https://www.who.int/csr/don/2005_09_29/en/,DON-2005-09-29
2005-WPV-IDN,5,2005,9/30/2005,Poliomyelitis,NA,Indonesia,IDN,"Banten, Lampung, Central Java",NA,NA,NA,NA,NA,NA,NA,NA,NA,NA,NA,251,NA,NA,NA,NA,NA,NA,NA,https://www.who.int/csr/don/2005_09_30/en/,DON-2005-09-30
2005-H5 Influenza-IDN,3,2005,10/10/2005,H5N1,NA,Indonesia,IDN,Lampung,9/20/2005,9/24/2005,NA,NA,NA,yes,NA,NA,5,NA,NA,NA,3,NA,yes,NA,NA,NA,NA,https://www.who.int/csr/don/2005_10_10/en/,DON-2005-10-10
2005-H5 Influenza-TUR,3,2005,10/13/2005,H5N1,NA,Turkey,TUR,NA,NA,NA,NA,NA,NA,yes,NA,NA,0,NA,NA,0,0,NA,NA,NA,NA,NA,bird samples,https://www.who.int/csr/don/2005_10_13/en/,DON-2005-10-13
2005-H5 Influenza-ROU,3,2005,10/13/2005,H5 avian infuenza,NA,Romania,ROU,NA,NA,NA,NA,NA,NA,yes,NA,NA,0,NA,NA,0,0,NA,NA,NA,NA,NA,bird samples,https://www.who.int/csr/don/2005_10_13/en/,DON-2005-10-13
2005-Yellow Fever-SEN,6,2005,10/20/2005,Yellow fever,NA,Senegal,SEN,Goudiri,NA,NA,NA,10/11/2005,NA,yes,NA,NA,2,NA,NA,NA,2,NA,10/4/2005,NA,NA,NA,NA,https://www.who.int/csr/don/2005_10_20/en/,DON-2005-10-20
2005-H5 Influenza-THA,3,2005,10/20/2005,H5N1,NA,Thailand,THA,Kanchanaburi,10/13/2005,10/17/2005,NA,NA,NA,10/20/2005,NA,NA,18,NA,NA,NA,13,NA,yes,NA,NA,NA,NA,https://www.who.int/csr/don/2005_10_20a/en/,DON-2005-10-20a
2005-H5 Influenza-THA,3,2005,10/24/2005,H5N1,NA,Thailand,THA,Kanchanaburi,10/16/2005,10/19/2005,NA,NA,NA,yes,NA,NA,19,NA,NA,NA,13,NA,NA,NA,NA,NA,NA,https://www.who.int/csr/don/2005_10_24/en/,DON-2005-10-24
2005-H5 Influenza-IDN,3,2005,10/24/2005,H5N1,NA,Indonesia,IDN,"Sumatra, Bogor",NA,9/28/2005,NA,NA,NA,yes,NA,NA,NA,NA,NA,7,4,NA,yes,NA,NA,NA,NA,https://www.who.int/csr/don/2005_10_24/en/,DON-2005-10-24
2005-H5 Influenza-THA,3,2005,11/1/2005,H5N1,NA,Thailand,THA,Bangkok,10/26/2005,10/29/2005,NA,NA,NA,yes,NA,NA,20,NA,NA,NA,13,NA,yes,NA,NA,NA,NA,https://www.who.int/csr/don/2005_11_01/en/,DON-2005-11-01
2005-Yellow Fever-GIN,6,2005,11/2/2005,Yellow fever,NA,Guinea,GIN,"Boke, Kankan, N'Zerekore, Faranah, Conakry",10/3/2005,NA,NA,10/30/2005,NA,yes,NA,NA,6,NA,NA,9,NA,NA,yes,NA,NA,NA,NA,https://www.who.int/csr/don/2005_11_02/en/,DON-2005-11-02
2005-Yellow Fever-MLI,6,2005,11/3/2005,Yellow fever,NA,Mali,MLI,Kayes,NA,NA,NA,10/31/2005,yes,yes,NA,NA,1,NA,1,NA,2,NA,yes,NA,NA,NA,NA,https://www.who.int/csr/don/2005_11_03/en/,DON-2005-11-03
2005-Marburg haemorrhagic fever-AGO,2,2005,11/7/2005,Marburg haemorrhagic fever,NA,Angola,AGO,Uige,NA,NA,NA,NA,NA,3/21/2005,11/7/2005,NA,NA,NA,NA,63,NA,NA,3/22/2005,yes,NA,yes,outbreak over,https://www.who.int/csr/don/2005_11_07a/en/,DON-2005-11-07a
2005-H5 Influenza-IDN,3,2005,11/7/2005,H5N1,NA,Indonesia,IDN,Tangerang,10/19/2005,10/26/2005,NA,NA,NA,yes,NA,NA,9,NA,NA,NA,5,NA,yes,NA,NA,NA,NA,https://www.who.int/csr/don/2005_11_07/en/,DON-2005-11-07
2005-H5 Influenza-VNM,3,2005,11/9/2005,H5N1,NA,Vietnam,VNM,Hanoi,NA,10/26/2005,NA,NA,NA,yes,NA,NA,NA,NA,NA,65,22,NA,NA,NA,NA,NA,NA,https://www.who.int/csr/don/2005_11_09/en/,DON-2005-11-09
2005-Yellow Fever-MLI,6,2005,11/10/2005,Yellow fever,NA,Mali,MLI,"Bafoulabe district, Kayes region",NA,NA,NA,10/7/2005,yes,yes,NA,NA,4,NA,17,21,14,NA,yes,NA,NA,NA,NA,https://www.who.int/csr/don/2005_11_10/en/,DON-2005-11-10
2005-H5 Influenza-THA,3,2005,11/14/2005,H5N1,NA,Thailand,THA,Bangkok,11/1/2005,11/5/2005,NA,NA,NA,yes,NA,NA,NA,NA,NA,21,13,NA,NA,NA,NA,NA,NA,https://www.who.int/csr/don/2005_11_14/en/,DON-2005-11-14
2005-Yellow Fever-MLI,6,2005,11/16/2005,Yellow fever,NA,Mali,MLI,"Bafoulabe district, Kayes region",NA,NA,NA,11/13/2005,NA,NA,NA,NA,NA,NA,28,NA,14,NA,yes,NA,NA,NA,NA,https://www.who.int/csr/don/2005_11_16/en/,DON-2005-11-16
2005-H5 Influenza-CHN,3,2005,11/17/2005,H5N1,NA,China,CHN,"Hunan, Anhui, Liaoning, Xinjiang",NA,10/17/2005,NA,NA,NA,yes,NA,NA,2,NA,NA,NA,1,NA,yes,NA,NA,NA,NA,https://www.who.int/csr/don/2005_11_17/en/,DON-2005-11-17
2005-H5 Influenza-IDN,3,2005,11/17/2005,H5N1,NA,Indonesia,IDN,Jakarta,11/4/2005,11/6/2005,NA,NA,NA,11/17/2005,NA,NA,11,NA,NA,NA,7,NA,NA,NA,NA,NA,NA,https://www.who.int/csr/don/2005_11_17/en/,DON-2005-11-17
2005-Yellow Fever-SDN,6,2005,11/21/2005,Yellow fever,NA,Sudan,SDN,"Abu Gebiha, Rashad, Dilling, Kadugli, Talodi",NA,NA,11/16/2005,NA,NA,yes,NA,NA,13,NA,NA,404,118,NA,11/14/2005,NA,NA,NA,NA,https://www.who.int/csr/don/2005_11_21/en/,DON-2005-11-21
2005-H5 Influenza-CHN,3,2005,11/24/2005,H5N1,NA,China,CHN,Anhui,11/11/2005,11/15/2005,NA,NA,NA,yes,NA,NA,3,NA,NA,NA,2,NA,yes,NA,NA,NA,NA,https://www.who.int/csr/don/2005_11_24/en/,DON-2005-11-24
2005-H5 Influenza-VNM,3,2005,11/25/2005,H5N1,NA,Vietnam,VNM,Hai Phong,11/14/2005,11/16/2005,NA,NA,NA,yes,NA,NA,NA,NA,NA,66,22,NA,NA,NA,NA,NA,NA,https://www.who.int/csr/don/2005_11_25/en/,DON-2005-11-25
2005-Yellow Fever-SDN,6,2005,11/28/2005,Yellow fever,NA,Sudan,SDN,"Abu Jibeha, Abyei, Dilling, Kadugli, Lagawa, Rashad and Talodi",NA,NA,NA,11/27/2008,NA,NA,NA,NA,NA,NA,NA,530,131,25.2,yes,NA,NA,NA,NA,https://www.who.int/csr/don/2005_11_28/en/,DON-2005-11-28
2005-Yellow Fever-MLI,6,2005,11/28/2005,Yellow fever,NA,Mali,MLI,Bafoulabe,NA,NA,NA,11/22/2005,NA,NA,NA,NA,NA,NA,53,NA,23,NA,yes,NA,NA,NA,NA,https://www.who.int/csr/don/2005_11_28a/en/,DON-2005-11-28a
2005-H5 Influenza-IDN,3,2005,11/29/2005,H5N1,NA,Indonesia,IDN,West Java,11/6/2005,11/16/2005,NA,NA,NA,yes,NA,NA,12,NA,NA,NA,7,NA,yes,NA,NA,NA,NA,https://www.who.int/csr/don/2005_11_29/en/,DON-2005-11-29
2005-H5 Influenza-CHN,3,2005,11/29/2005,H5N1,NA,China,CHN,Angui,NA,NA,NA,NA,NA,yes,NA,NA,3,NA,NA,NA,2,NA,NA,NA,NA,NA,NA,https://www.who.int/csr/don/2005_11_29/en/,DON-2005-11-29
2005-H5 Influenza-IDN,3,2005,12/6/2005,H5N1,NA,Indonesia,IDN,Tangerang,11/17/2005,11/23/2005,NA,NA,NA,yes,NA,NA,13,NA,NA,NA,8,NA,yes,NA,NA,NA,NA,https://www.who.int/csr/don/2005_12_06/en/,DON-2005-12-06
2005-Yellow Fever-CIV,6,2005,12/7/2005,Yellow fever,NA,Cote d'Ivoire,CIV,Doropo,NA,NA,NA,NA,NA,NA,NA,NA,NA,NA,NA,NA,NA,NA,yes,NA,NA,NA,mass vaccination campaign,https://www.who.int/csr/don/2005_12_07/en/,DON-2005-12-07
2005-H5 Influenza-CHN,3,2005,12/7/2005,H5N1,NA,China,CHN,Guangxi,11/23/2005,NA,NA,NA,NA,yes,NA,NA,4,NA,NA,NA,2,NA,yes,NA,NA,NA,NA,https://www.who.int/csr/don/2005_12_07a/en/,DON-2005-12-07a
2005-Yellow Fever-SDN,6,2005,12/9/2005,Yellow fever,NA,Sudan,SDN,"Dilling, Kadugli, Rashad and Talodi",NA,NA,NA,12/6/2005,NA,NA,NA,NA,NA,NA,NA,565,143,25.3,yes,NA,NA,NA,NA,https://www.who.int/csr/don/2005_12_09a/en/,DON-2005-12-09a
2005-H5 Influenza-CHN,3,2005,12/9/2005,H5N1,NA,China,CHN,NA,NA,NA,NA,NA,NA,NA,NA,NA,NA,NA,NA,NA,NA,NA,NA,NA,NA,NA,NA,https://www.who.int/csr/don/2005_12_09/en/,DON-2005-12-09
2005-H5 Influenza-THA,3,2005,12/9/2005,H5N1,NA,Thailand,THA,Nakhonnayok,11/25/2005,12/5/2005,NA,NA,NA,yes,NA,NA,NA,NA,NA,22,14,NA,yes,NA,NA,NA,NA,https://www.who.int/csr/don/2005_12_09/en/,DON-2005-12-09
2005-H5 Influenza-IDN,3,2005,12/14/2005,H5N1,NA,Indonesia,IDN,West Jakarta,11/6/2005,11/9/2005,NA,NA,NA,yes,NA,NA,14,NA,NA,NA,9,NA,yes,NA,NA,NA,NA,https://www.who.int/csr/don/2005_12_14/en/,DON-2005-12-14
2005-H5 Influenza-CHN,3,2005,12/16/2005,H5N1,NA,China,CHN,"Hunan, Anhui, Guangxi, Liaoning,and Jiangxi",12/4/2005,NA,NA,NA,NA,yes,NA,NA,6,NA,NA,NA,2,NA,yes,NA,NA,NA,NA,https://www.who.int/csr/don/2005_12_16/en/,DON-2005-12-16
2005-Yellow Fever-GIN,6,2005,12/19/2005,Yellow fever,NA,Guinea,GIN,Boke,NA,NA,NA,12/19/2005,NA,yes,NA,NA,23,NA,91,114,26,NA,yes,NA,NA,NA,NA,https://www.who.int/csr/don/2005_12_19/en/,DON-2005-12-19
2005-H5 Influenza-IDN,3,2005,12/23/2005,H5N1,NA,Indonesia,IDN,"Central Jakarta, East Jakarta",12/8/2005,12/13/2005,NA,NA,NA,yes,NA,NA,16,NA,NA,NA,11,NA,yes,NA,NA,NA,NA,https://www.who.int/csr/don/2005_12_23/en/,DON-2005-12-23
2005-H5 Influenza-CHN,3,2005,12/30/2005,H5N1,NA,China,CHN,"Hunan, Anhui, Guangxi, Liaoning, Jiangxi and Fujian",12/6/2005,12/8/2005,NA,NA,NA,12/23/2005,NA,NA,7,NA,NA,NA,3,NA,yes,NA,NA,NA,NA,https://www.who.int/csr/don/2005_12_30/en/,DON-2005-12-30
2006-H5 Influenza-TUR,3,2006,1/5/2006,H5N1,NA,Turkey,TUR,Dogubayazit,1/1/2006,NA,NA,NA,NA,yes,NA,NA,2,NA,NA,NA,2,NA,yes,NA,NA,NA,NA,https://www.who.int/csr/don/2006_01_05/en/,DON-2006-01-05
2006-H5 Influenza-TUR,3,2006,1/7/2006,H5N1,NA,Turkey,TUR,Dogubayazit,NA,NA,NA,NA,1/7/2006,yes,NA,NA,4,30,NA,NA,2,NA,yes,NA,NA,NA,"vague language on ""possible cases""--classified as probable??",https://www.who.int/csr/don/2006_01_07/en/,DON-2006-01-07
2006-H5 Influenza-TUR,3,2006,1/9/2006,H5N1,NA,Turkey,TUR,"Ankara, Dogubeyazit, Kastamonu, Corum, Samsun",NA,NA,NA,NA,NA,yes,NA,NA,14,NA,NA,NA,2,NA,yes,NA,NA,NA,NA,https://www.who.int/csr/don/2006_01_09/en/,DON-2006-01-09
2006-H5 Influenza-CHN,3,2006,1/10/2006,H5N1,NA,China,CHN,"Hunan, Guangxi, Jiangxi, Anhui, Liaoning, Fujian",12/24/2005,NA,NA,NA,NA,yes,NA,NA,8,NA,NA,NA,5,NA,yes,NA,NA,NA,NA,https://www.who.int/csr/don/2006_01_10/en/,DON-2006-01-10
2006-H5 Influenza-TUR,3,2006,1/10/2006,H5N1,NA,Turkey,TUR,Sivas,NA,NA,NA,NA,NA,yes,NA,NA,15,NA,NA,NA,NA,NA,yes,yes,NA,NA,didn't report number of deaths,https://www.who.int/csr/don/2006_01_10a/en/,DON-2006-01-10a
2006-H5 Influenza-TUR,3,2006,1/12/2006,H5N1,NA,Turkey,TUR,"Sanliurfa, Siirt, 9 provinces total",NA,NA,NA,NA,NA,yes,NA,NA,18,NA,NA,NA,NA,NA,yes,NA,NA,NA,genetic sequencing completed,https://www.who.int/csr/don/2006_01_12/en/,DON-2006-01-12
2006-H5 Influenza-IDN,3,2006,1/14/2006,H5N1,NA,Indonesia,IDN,Jakarta,12/31/2005,1/2/2006,NA,NA,NA,yes,NA,NA,17,NA,NA,NA,12,NA,yes,NA,NA,NA,NA,https://www.who.int/csr/don/2006_01_14/en/,DON-2006-01-14
2006-H5 Influenza-TUR,3,2006,1/16/2006,H5N1,NA,Turkey,TUR,Dogubayazit,1/4/2006,1/11/2006,NA,NA,NA,yes,NA,NA,20,NA,NA,NA,4,NA,NA,NA,NA,NA,NA,https://www.who.int/csr/don/2006_01_16/en/,DON-2006-01-16
2006-H5 Influenza-TUR,3,2006,1/18/2006,H5N1,NA,Turkey,TUR,Dogubayazit,1/5/2006,1/13/2006,NA,NA,NA,yes,NA,NA,21,NA,NA,NA,4,NA,NA,yes,NA,NA,NA,https://www.who.int/csr/don/2006_01_18/en/,DON-2006-01-18
2006-H5 Influenza-CHN,3,2006,1/19/2006,H5N1,NA,China,CHN,"Anhui, Guangxi, Liaoning, Jiangxi, Fujian, Hunan, Sichuan",1/3/2006,1/10/2006,NA,NA,NA,yes,NA,NA,9,NA,NA,NA,6,NA,yes,NA,NA,NA,NA,https://www.who.int/csr/don/2006_01_19/en/,DON-2006-01-19
2006-H5 Influenza-IDN,3,2006,1/23/2006,H5N1,NA,Indonesia,IDN,NA,1/6/2006,1/12/2006,NA,NA,NA,yes,NA,NA,19,NA,NA,NA,14,NA,yes,NA,NA,NA,NA,https://www.who.int/csr/don/2006_01_23/en/,DON-2006-01-23
2006-Meningococcal Disease-UGA,1,2006,1/25/2006,Meningococcal disease,NA,Uganda,UGA,Nakapiripirit,NA,NA,12/28/2005,NA,NA,yes,NA,NA,2,NA,163,NA,NA,NA,yes,NA,NA,NA,NA,https://www.who.int/csr/don/2006_01_25/en/,DON-2006-01-25
2006-H5 Influenza-CHN,3,2006,1/25/2006,H5N1,NA,China,CHN,"Anhui, Guangxi, Liaoning, Jiangxi, Fujian, Hunan, and Sichuan",1/12/2006,NA,NA,NA,NA,yes,NA,NA,10,NA,NA,NA,7,NA,yes,NA,NA,NA,NA,https://www.who.int/csr/don/2006_01_25a/en/,DON-2006-01-25a
2006-H5 Influenza-IRQ,3,2006,1/30/2006,H5N1,NA,Iraq,IRQ,Raniya,NA,NA,NA,NA,NA,yes,NA,NA,1,NA,NA,3,2,NA,yes,NA,NA,NA,suspected cases a bit unclear,https://www.who.int/csr/don/2006_01_30a/en/,DON-2006-01-30a
2006-H5 Influenza-TUR,3,2006,1/30/2006,H5N1,NA,Turkey,TUR,NA,NA,NA,NA,NA,yes,yes,NA,NA,12,NA,NA,21,4,NA,NA,NA,NA,NA,12/21 cases reported by Turkeywere confirmed by WHO lab in UK,https://www.who.int/csr/don/2006_01_30/en/,DON-2006-01-30
2006-H5 Influenza-IRQ,3,2006,2/2/2006,H5N1,NA,Iraq,IRQ,Sulaimaniyah,NA,NA,NA,NA,yes,yes,NA,NA,1,NA,NA,5,2,NA,yes,NA,NA,NA,NA,https://www.who.int/csr/don/2006_02_02/en/,DON-2006-02-02
2006-Meningococcal Disease-SDN,1,2006,2/3/2006,Meningococcal disease,NA,Sudan,SDN,"6 districts, epidemic threshold reached in Guli in Blue Nile State and Wad el Heleu in Kassala State",NA,NA,1/1/2006,NA,NA,yes,NA,NA,1,NA,136,NA,15,NA,yes,NA,NA,NA,NA,https://www.who.int/csr/don/2006_02_03/en/,DON-2006-02-03
2006-H5 Influenza-IDN,3,2006,2/6/2006,H5N1,NA,Indonesia,IDN,"East Jakarta, West Java, Lampung",NA,NA,NA,NA,NA,yes,NA,NA,23,NA,NA,NA,16,NA,yes,NA,NA,NA,NA,https://www.who.int/csr/don/2006_02_06/en/,DON-2006-02-06
2006-H5 Influenza-IRQ,3,2006,2/7/2006,H5N1,NA,Iraq,IRQ,"Erbil, Sulaimaniyah, Omara",NA,NA,NA,NA,NA,1/30/2006,NA,NA,1,NA,NA,10,3,NA,yes,NA,NA,NA,"The transportation of patient samples for diagnostic confirmation has encountered difficulties; unclear number of probably/suspected cases, but new ones being reported",https://www.who.int/csr/don/2006_02_07/en/,DON-2006-02-07
2006-H5 Influenza-NGA,3,2006,2/8/2006,H5N1,NA,Nigeria,NGA,Kaduna State,NA,NA,NA,NA,NA,yes,NA,NA,0,NA,NA,NA,NA,NA,yes,NA,NA,NA,IN CHICKENS,https://www.who.int/csr/don/2006_02_08/en/,DON-2006-02-08
2006-H5 Influenza-CHN,3,2006,2/9/2006,H5N1,NA,China,CHN,"Anhui, Fujian, Guangxi, Jiangxi, Hunan, Liaoning, and Sichuan",1/10/2006,NA,NA,yes,NA,yes,NA,NA,11,NA,NA,NA,7,NA,NA,NA,NA,NA,NA,https://www.who.int/csr/don/2006_02_09/en/,DON-2006-02-09
2006-Meningococcal Disease-UGA,1,2006,2/10/2006,Meningococcal disease,NA,Uganda,UGA,"Nakapiripirit, Boroto",NA,NA,NA,12/28/2005,NA,yes,NA,NA,NA,NA,301,NA,23,NA,yes,NA,NA,NA,NA,https://www.who.int/csr/don/2006_02_10/en/,DON-2006-02-10
2006-H5 Influenza-IDN,3,2006,2/13/2006,H5N1,NA,Indonesia,IDN,West Java,1/25/2006,NA,NA,NA,NA,yes,NA,NA,25,NA,NA,NA,18,NA,yes,NA,NA,NA,NA,https://www.who.int/csr/don/2006_02_13/en/,DON-2006-02-13
2006-H5 Influenza-CHN,3,2006,2/13/2006,H5N1,NA,China,CHN,Hunan,1/27/2006,NA,NA,yes,NA,yes,NA,NA,12,NA,NA,NA,8,NA,NA,NA,NA,NA,NA,https://www.who.int/csr/don/2006_02_13a/en/,DON-2006-02-13a
2006-Chikungunya-REU,6,2006,2/17/2006,Chikungunya,NA,La Réunion (France),REU,NA,NA,NA,3/28/2005,NA,NA,NA,NA,NA,NA,NA,NA,1722,NA,NA,yes,yes,NA,NA,NA,https://www.who.int/csr/don/2006_02_17a/en/,DON-2006-02-17a
2006-H5 Influenza-IRQ,3,2006,2/17/2006,H5N1,NA,Iraq,IRQ,Sulaimaniyah,1/18/2006,NA,NA,NA,NA,2/17/2006,NA,NA,2,NA,NA,NA,2,NA,NA,NA,NA,NA,NA,https://www.who.int/csr/don/2006_02_17/en/,DON-2006-02-17
2006-H5 Influenza-IDN,3,2006,2/20/2006,H5N1,NA,Indonesia,IDN,East Jakarta,2/5/2006,2/7/2006,NA,NA,NA,yes,NA,NA,26,NA,NA,NA,19,NA,yes,NA,NA,NA,NA,https://www.who.int/csr/don/2006_02_20/en/,DON-2006-02-20
2006-H5 Influenza-Global,3,2006,2/21/2006,H5N1,NA,Global,NA,"Iraq, Nigeria, Azerbaijan, Bulgaria, Greece, Italy, Slovenia, Iran, Austria, Germany, Egypt, India and France",NA,NA,NA,NA,NA,NA,NA,NA,NA,NA,NA,NA,NA,NA,NA,NA,NA,NA,NA,https://www.who.int/csr/don/2006_02_21b/en/,DON-2006-02-21b
2006-H5 Influenza-IND,3,2006,2/21/2006,H5N1,NA,India,IND,Navapur,1/27/2006,NA,NA,NA,NA,2/18/2006,NA,NA,0,NA,NA,NA,NA,NA,yes,NA,NA,NA,IN POULTRY,https://www.who.int/csr/don/2006_02_21/en/,DON-2006-02-21
2006-H5 Influenza-NGA,3,2006,2/22/2006,H5N1,NA,Nigeria,NGA,"Kaduna, Kano, Plateau, Katsina, and Bauchi, Abuja",1/10/2006,NA,NA,NA,NA,no,NA,NA,0,NA,NA,4,1,NA,yes,NA,NA,NA,samples being sent,https://www.who.int/csr/don/2006_02_22/en/,DON-2006-02-22
2006-H5 Influenza-IND,3,2006,2/23/2006,H5N1,NA,India,IND,NA,NA,NA,NA,NA,NA,no,NA,NA,0,NA,NA,NA,NA,NA,NA,NA,NA,NA,NA,https://www.who.int/csr/don/2006_02_23/en/,DON-2006-02-23
2006-Cholera-SDN,5,2006,2/24/2006,Cholera,NA,Sudan,SDN,"Yei, Juba (southern Sudan)",NA,NA,1/28/2006,NA,NA,yes,NA,NA,NA,NA,NA,3793,77,2.03,yes,NA,NA,NA,NA,https://www.who.int/csr/don/2006_02_24/en/,DON-2006-02-24
2006-H5 Influenza-IDN,3,2006,2/27/2006,H5N1,NA,Indonesia,IDN,West Java,2/13/2006,NA,NA,NA,NA,yes,NA,NA,27,NA,NA,NA,20,NA,yes,NA,NA,NA,NA,https://www.who.int/csr/don/2006_02_27/en/,DON-2006-02-27
2006-H5 Influenza-CHN,3,2006,2/27/2006,H5N1,NA,China,CHN,"Zhejiang, Anhui",2/10/2006,NA,NA,NA,NA,yes,NA,NA,14,NA,NA,NA,8,NA,yes,yes,NA,NA,NA,https://www.who.int/csr/don/2006_02_27a/en/,DON-2006-02-27a
2006-H5 Influenza-NER,3,2006,2/28/2006,H5N1,NA,Niger,NER,"Magaria, Dan Barde",NA,NA,NA,NA,NA,yes,NA,NA,0,NA,NA,NA,NA,NA,yes,NA,NA,NA,in poultry,https://www.who.int/csr/don/2006_02_28/en/,DON-2006-02-28
2006-H5 Influenza-DEU,3,2006,2/28/2006,H5N1,NA,Germany,DEU,NA,NA,NA,NA,NA,NA,yes,NA,NA,0,NA,NA,0,0,NA,NA,NA,NA,NA,in domestic cats,https://www.who.int/csr/don/2006_02_28a/en/,DON-2006-02-28a
2006-Chikungunya-REU,6,2006,3/1/2006,Chikungunya,NA,La Réunion (France),REU,NA,NA,NA,3/28/2005,NA,NA,NA,NA,NA,NA,NA,NA,2406,NA,NA,yes,yes,NA,NA,NA,https://www.who.int/csr/don/2006_03_01/en/,DON-2006-03-01
2006-Chikungunya-MYT,6,2006,3/1/2006,Chikungunya,NA,Mayotte,MYT,NA,NA,NA,NA,NA,NA,NA,NA,NA,NA,NA,NA,924,NA,NA,yes,yes,NA,NA,NA,https://www.who.int/csr/don/2006_03_01/en/,DON-2006-03-01
2006-Chikungunya-MUS,6,2006,3/1/2006,Chikungunya,NA,Mauritius,MUS,NA,NA,NA,NA,NA,NA,NA,NA,NA,1173,NA,NA,2553,NA,NA,yes,yes,NA,NA,NA,https://www.who.int/csr/don/2006_03_01/en/,DON-2006-03-01
2006-Chikungunya-SYC,6,2006,3/1/2006,Chikungunya,NA,Seychelles,SYC,NA,NA,NA,NA,NA,NA,NA,NA,NA,NA,NA,NA,4650,NA,NA,yes,yes,NA,NA,NA,https://www.who.int/csr/don/2006_03_01/en/,DON-2006-03-01
2006-H5 Influenza-IRQ,3,2006,3/1/2006,H5N1,NA,Iraq,IRQ,"Sulaimaniyah, Missan, Basra",mid-January 2006,NA,NA,NA,yes,yes,NA,NA,2,NA,NA,NA,2,NA,NA,NA,NA,NA,NA,https://www.who.int/csr/don/2006_03_01a/en/,DON-2006-03-01a
2006-Meningococcal Disease-NER,1,2006,3/3/2006,Meningococcal disease,NA,Niger,NER,"Madarounfa, Guidan-Roumdji",NA,NA,NA,1/1/2006,NA,yes,NA,NA,NA,NA,NA,614,44,NA,yes,NA,NA,NA,NA,https://www.who.int/csr/don/2006_03_03/en/,DON-2006-03-03
2006-Meningococcal Disease-KEN,1,2006,3/3/2006,Meningococcal disease,NA,Kenya,KEN,"Alale, Chepareria, Kachelila, Kasei",NA,NA,NA,1/1/2006,NA,NA,NA,NA,NA,NA,NA,74,15,20,3/7/2006,NA,NA,NA,NA,https://www.who.int/csr/don/2006_03_03a/en/,DON-2006-03-03a
2006-Cholera-SDN,5,2006,3/6/2006,Cholera,NA,Sudan,SDN,"Yei, Juba (southern Sudan)",NA,NA,NA,1/28/2006,NA,yes,NA,NA,NA,NA,NA,5634,127,2.25,yes,NA,NA,NA,NA,https://www.who.int/csr/don/2006_03_06/en/,DON-2006-03-06
2006-H5 Influenza-CHN,3,2006,3/6/2006,H5N1,NA,China,CHN,Guangdong,2/22/2006,NA,NA,yes,NA,yes,NA,NA,15,NA,NA,NA,9,NA,NA,NA,NA,NA,NA,https://www.who.int/csr/don/2006_03_06a/en/,DON-2006-03-06a
2006-H5 Influenza-CHN,3,2006,3/8/2006,H5N1,NA,China,CHN,Zhejiang,2/10/2006,NA,NA,yes,NA,yes,NA,NA,15,NA,NA,NA,10,NA,NA,NA,NA,NA,death of previous case,https://www.who.int/csr/don/2006_03_08/en/,DON-2006-03-08
2006-H5 Influenza-NGA,3,2006,3/9/2006,H5N1,NA,Nigeria,NGA,"Kaduna, Kano, Plateau, Katsina, Bauchi, Yobe, Nasarawa, Abuja, Anambra, Banue, Rivers",NA,NA,NA,NA,NA,2/8/2006,NA,NA,0,NA,NA,NA,NA,NA,yes,NA,NA,NA,in farms,https://www.who.int/csr/don/2006_03_09/en/,DON-2006-03-09
2006-H5 Influenza-DEU,3,2006,3/9/2006,H5N1,NA,Germany,DEU,Ruegen,NA,NA,NA,NA,NA,3/9/2006,NA,NA,0,NA,NA,0,0,NA,NA,NA,NA,NA,in stone marten,https://www.who.int/csr/don/2006_03_09a/en/,DON-2006-03-09a
2006-H5 Influenza-IDN,3,2006,3/10/2006,H5N1,NA,Indonesia,IDN,Semerang,2/10/2006,NA,NA,NA,NA,yes,NA,NA,28,NA,NA,NA,21,NA,yes,NA,NA,NA,NA,https://www.who.int/csr/don/2006_03_10/en/,DON-2006-03-10
2006-H5 Influenza-AZE,3,2006,3/10/2006,H5N1,NA,Azerbaijan,AZE,Kaikyand settlement (Salyan rayon),NA,NA,NA,NA,NA,no,NA,NA,0,NA,NA,10,2,NA,yes,NA,NA,NA,lab results pending,https://www.who.int/csr/don/2006_03_10a/en/,DON-2006-03-10a
2006-H5 Influenza-IDN,3,2006,3/13/2006,H5N1,NA,Indonesia,IDN,Boyolali,2/19/2006,2/23/2006,NA,NA,NA,yes,NA,NA,29,NA,NA,NA,22,NA,yes,NA,NA,NA,NA,https://www.who.int/csr/don/2006_03_13/en/,DON-2006-03-13
2006-H5 Influenza-AZE,3,2006,3/14/2006,H5N1,NA,Azerbaijan,AZE,"Salyan, Tarter",NA,NA,NA,NA,NA,yes,NA,NA,3,NA,NA,NA,3,NA,yes,NA,NA,NA,NA,https://www.who.int/csr/don/2006_03_14/en/,DON-2006-03-14
2005-WPV-BGD,5,2006,3/16/2006,Poliomelitis,NA,Bangladesh,BGD,Chandpur,1/23/2006,NA,NA,yes,NA,3/8/2006,NA,NA,1,NA,NA,NA,NA,NA,4/16/2006,NA,NA,NA,NA,https://www.who.int/csr/don/2006_03_16/en/,DON-2006-03-16
2006-Chikungunya-REU,6,2006,3/17/2006,Chikungunya,NA,La Réunion (France),REU,NA,NA,NA,3/5/2005,NA,NA,NA,NA,NA,NA,NA,NA,3115,NA,NA,yes,NA,NA,NA,NA,https://www.who.int/csr/don/2006_03_17/en/,DON-2006-03-17
2006-Chikungunya-MYT,6,2006,3/17/2006,Chikungunya,NA,Mayotte,MYT,NA,NA,NA,NA,1/9/2006,NA,NA,NA,NA,NA,NA,2833,NA,NA,NA,yes,NA,NA,NA,NA,https://www.who.int/csr/don/2006_03_17/en/,DON-2006-03-17
2006-Chikungunya-MUS,6,2006,3/17/2006,Chikungunya,NA,Mauritius,MUS,NA,NA,NA,NA,1/1/2006,NA,NA,NA,NA,1200,NA,6000,NA,NA,NA,yes,NA,NA,NA,NA,https://www.who.int/csr/don/2006_03_17/en/,DON-2006-03-17
2006-Chikungunya-SYC,6,2006,3/17/2006,Chikungunya,NA,Seychelles,SYC,NA,NA,NA,NA,1/1/2006,NA,NA,NA,NA,NA,NA,8818,NA,NA,NA,yes,NA,NA,NA,NA,https://www.who.int/csr/don/2006_03_17/en/,DON-2006-03-17
2006-Chikungunya-IND,6,2006,3/17/2006,Chikungunya,NA,India,IND,"Andhra Pradesh, Malegaon town, Orissa state",NA,NA,12/1/2005,NA,NA,NA,NA,NA,NA,NA,NA,12575,NA,NA,2/13/2006,NA,NA,NA,NA,https://www.who.int/csr/don/2006_03_17/en/,DON-2006-03-17
2006-Dengue-MDG,6,2006,3/17/2006,Dengue,NA,Madagascar,MDG,Toamasina,mid-January 2006,NA,NA,NA,NA,NA,NA,NA,NA,NA,NA,NA,NA,NA,yes,NA,NA,NA,NA,https://www.who.int/csr/don/2006_03_17/en/,DON-2006-03-17
2006-Dengue-MDV,6,2006,3/17/2006,Dengue,NA,Maldives,MDV,NA,01/??/2006,NA,NA,NA,NA,NA,NA,NA,NA,NA,602,NA,NA,NA,yes,NA,NA,NA,NA,https://www.who.int/csr/don/2006_03_17/en/,DON-2006-03-17
2006-Dengue-REU,6,2006,3/17/2006,Dengue,NA,La Réunion (France),REU,NA,NA,NA,NA,NA,NA,yes,NA,NA,25,NA,NA,NA,NA,NA,yes,NA,NA,NA,NA,https://www.who.int/csr/don/2006_03_17/en/,DON-2006-03-17
2006-H5 Influenza-EGY,3,2006,3/20/2006,H5N1,NA,Egypt,EGY,Qaliubiya,early March 2006,3/16/2006,NA,NA,NA,yes,NA,NA,1,NA,NA,NA,1,NA,yes,NA,NA,NA,NA,https://www.who.int/csr/don/2006_03_20/en/,DON-2006-03-20
2006-H5 Influenza-AZE,3,2006,3/21/2006,H5N1,NA,Azerbaijan,AZE,"Daikyand settlement, Salyan Rayon, Tarter",NA,NA,NA,NA,NA,yes,NA,NA,7,NA,NA,NA,5,NA,yes,NA,NA,NA,NA,https://www.who.int/csr/don/2006_03_21a/en/,DON-2006-03-21a
2006-Meningococcal Disease-African Meningitis Belt,1,2006,3/21/2006,Meningococcal disease,NA,African Meningitis Belt,NA,"Burkina Faso, Cote d'Ivoire, Kenya, Mali, Niger, Sudan W. Darfur IDP camps, Sudan other states, Uganda Gulu district, Uganda other districts",NA,NA,yes,NA,NA,yes,NA,NA,NA,NA,5719,580,NA,NA,yes,NA,NA,NA,NA,https://www.who.int/csr/don/2006_03_21/en/,DON-2006-03-21
2006-Cholera-SDN,5,2006,3/22/3006,Cholera,NA,Sudan,SDN,"southern Sudan, Juba and Yei",NA,NA,1/28/2006,NA,NA,yes,NA,NA,NA,NA,NA,8923,238,2.67,yes,NA,NA,NA,NA,https://www.who.int/csr/don/2006_03_22/en/,DON-2006-03-22
2006-Botulism-THA,5,2006,3/22/2006,Botulism,NA,Thailand,THA,Banluang District,NA,NA,NA,3/17/2006,NA,NA,NA,NA,NA,NA,NA,152,0,NA,yes,yes,yes,NA,traced to baboo shots at Buddhist festival,https://www.who.int/csr/don/2006_03_22a/en/,DON-2006-03-22a
2006-H5 Influenza-KHM,3,2006,3/24/2006,H5N1,NA,Cambodia,KHM,Kampong Speu,3/14/2006,3/20/2006,NA,NA,NA,yes,NA,NA,5,NA,NA,NA,5,NA,yes,NA,NA,NA,NA,https://www.who.int/csr/don/2006_03_24/en/,DON-2006-03-24
2005-WPV-SOM,5,2006,3/24/2006,Poliomyelitis,NA,Somalia,SOM,"Lower Juba, Mudug",NA,NA,yes,NA,NA,NA,NA,NA,NA,NA,NA,2,NA,NA,3/26/2006,NA,NA,NA,NA,https://www.who.int/csr/don/2006_03_24a/en/,DON-2006-03-24a
2006-H5 Influenza-CHN,3,2006,3/24/2006,H5N1,NA,China,CHN,Shanghai,NA,3/15/2006,NA,NA,NA,yes,NA,NA,16,NA,NA,NA,11,NA,yes,NA,NA,NA,NA,https://www.who.int/csr/don/2006_03_24c/en/,DON-2006-03-24c
2006-H5 Influenza-EGY,3,2006,3/29/2006,H5N1,NA,Egypt,EGY,Qaliubiya,3/12/2006,3/16/2006,NA,NA,NA,yes,NA,NA,5,NA,NA,NA,2,NA,yes,NA,NA,NA,NA,https://www.who.int/csr/don/2006_03_29/en/,DON-2006-03-29
2006-H5 Influenza-EGY,3,2006,4/3/2006,H5N1,NA,Egypt,EGY,NA,NA,NA,NA,NA,yes,yes,NA,NA,NA,NA,NA,NA,NA,NA,NA,NA,NA,NA,verification of previous cases by labs in UK; numbers a bit unclear,https://www.who.int/csr/don/2006_04_03/en/,DON-2006-04-03
2006-H5 Influenza-IDN,3,2006,4/3/2006,H5N1,NA,Indonesia,IDN,Kapuk,3/17/2006,3/22/2006,NA,NA,NA,yes,NA,NA,30,NA,NA,NA,23,NA,yes,NA,NA,NA,NA,https://www.who.int/csr/don/2006_04_04/en/,DON-2006-04-04
2006-H5 Influenza-KHM,3,2006,4/6/2006,H5N1,NA,Cambodia,KHM,Prey Veng,3/29/2006,4/4/2006,NA,NA,NA,yes,NA,NA,6,NA,NA,NA,6,NA,4/5/2006,NA,NA,NA,NA,https://www.who.int/csr/don/2006_04_06/en/,DON-2006-04-06
2006-H5 Influenza-EGY,3,2006,4/6/2006,H5N1,NA,Egypt,EGY,Minufiyah,3/29/2006,4/5/2006,NA,NA,NA,yes,NA,NA,11,NA,NA,NA,3,NA,yes,NA,NA,NA,NA,https://www.who.int/csr/don/2006_04_06a/en/,DON-2006-04-06a
2006-H5 Influenza-AZE,3,2006,4/11/2006,H5N1,NA,Azerbaijan,AZE,Daikyand,3/11/2006,NA,NA,NA,yes,yes,NA,NA,8,NA,NA,NA,5,NA,yes,NA,NA,NA,NA,https://www.who.int/csr/don/2006_04_11/en/,DON-2006-04-11
2006-H5 Influenza-IDN,3,2006,4/12/2006,H5N1,NA,Indonesia,IDN,West Java,3/20/2006,NA,NA,NA,NA,yes,NA,NA,31,NA,NA,NA,23,NA,NA,NA,NA,NA,NA,https://www.who.int/csr/don/2006_04_12/en/,DON-2006-04-12
2006-H5 Influenza-EGY,3,2006,4/13/2006,H5N1,NA,Egypt,EGY,Minufiyah,4/5/2006,4/11/2006,NA,NA,yes,yes,NA,NA,12,NA,NA,NA,3,NA,NA,NA,NA,NA,NA,https://www.who.int/csr/don/2006_04_13/en/,DON-2006-04-13
2006-H5 Influenza-IDN,3,2006,4/19/2006,H5N1,NA,Indonesia,IDN,Tangerang,3/29/2006,4/5/2006,NA,NA,NA,yes,NA,NA,32,NA,NA,NA,24,NA,yes,NA,NA,NA,NA,https://www.who.int/csr/don/2006_04_19a/en/,DON-2006-04-19a
2006-H5 Influenza-CHN,3,2006,4/19/2006,H5N1,NA,China,CHN,Wuhan,4/1/2006,NA,NA,NA,NA,yes,NA,NA,17,NA,NA,NA,11,NA,yes,NA,NA,NA,NA,https://www.who.int/csr/don/2006_04_19/en/,DON-2006-04-19
2006-H5 Influenza-CHN,3,2006,4/21/2006,H5N1,NA,China,CHN,Hubei,NA,NA,NA,yes,NA,yes,NA,NA,17,NA,NA,NA,12,NA,NA,NA,NA,NA,death of previous case,https://www.who.int/csr/don/2006_04_21/en/,DON-2006-04-21
2006-H5 Influenza-EGY,3,2006,4/21/2006,H5N1,NA,Egypt,EGY,Minufiyah,4/5/2006,NA,NA,yes,yes,yes,NA,NA,12,NA,NA,NA,4,NA,NA,NA,NA,NA,NA,https://www.who.int/csr/don/2006_04_21a/en/,DON-2006-04-21a
2006-H5 Influenza-CHN,3,2006,4/27/2006,H5N1,NA,China,CHN,Sichuan,4/16/2006,NA,NA,yes,NA,yes,NA,NA,18,NA,NA,NA,12,NA,yes,NA,NA,NA,NA,https://www.who.int/csr/don/2006_04_27/en/,DON-2006-04-27
2006-H5 Influenza-EGY,3,2006,5/4/2006,H5N1,NA,Egypt,EGY,"Cairo, exposure in Minufiyah",NA,5/1/2006,NA,NA,yes,yes,NA,NA,13,NA,NA,NA,4,NA,NA,NA,NA,NA,NA,https://www.who.int/csr/don/2006_05_04/en/,DON-2006-05-04
2006-H5 Influenza-EGY,3,2006,5/5/2006,H5N1,NA,Egypt,EGY,Cairo,NA,5/1/2006,NA,NA,NA,NA,NA,NA,NA,NA,NA,NA,5,NA,NA,NA,NA,NA,death of previous case,https://www.who.int/csr/don/2006_05_05/en/,DON-2006-05-05
2006-H5 Influenza-IDN,3,2006,5/8/2006,H5N1,NA,Indonesia,IDN,Greater Jakarta,4/17/2006,4/21/2006,NA,NA,NA,yes,NA,NA,33,NA,NA,NA,25,NA,yes,NA,NA,NA,NA,https://www.who.int/csr/don/2006_05_08/en/,DON-2006-05-08
2006-Cholera-AGO,5,2006,5/10/2006,Cholera,NA,Angola,AGO,"Luanda, Benguela, Malanje, Kuanza Norte, Bengo",NA,NA,NA,2/19/2006,NA,NA,NA,NA,NA,NA,NA,30612,1156,4,yes,NA,NA,NA,NA,https://www.who.int/csr/don/2006_05_10/en/,DON-2006-05-10
2006-H5 Influenza-DJI,3,2006,5/12/2006,H5N1,NA,Djibouti,DJI,Arta,4/23/2006,NA,NA,NA,NA,yes,NA,NA,1,NA,NA,NA,0,NA,yes,NA,NA,NA,NA,https://www.who.int/csr/don/2006_05_12/en/,DON-2006-05-12
2006-Cholera-SDN,5,2006,5/18/2006,Cholera,NA,Sudan,SDN,"Southern Sudan, 6/10 states",NA,NA,NA,5/5/2006,NA,NA,NA,NA,NA,NA,NA,13852,516,3.73,yes,NA,NA,NA,NA,https://www.who.int/csr/don/2006_05_18a/en/,DON-2006-05-18a
2006-Cholera-AGO,5,2006,5/18/2006,Cholera,NA,Angola,AGO,11/18 provinces,NA,NA,NA,5/16/2006,NA,yes,NA,NA,9,NA,NA,35775,1298,4,yes,yes,NA,NA,NA,https://www.who.int/csr/don/2006_05_18/en/,DON-2006-05-18
2006-H5 Influenza-IDN,3,2006,5/18/2006,H5N1,NA,Indonesia,IDN,"Surabaya, Kubu Sembelang, Sumatra",4/27/2006,NA,NA,NA,NA,yes,NA,NA,40,NA,NA,NA,31,NA,yes,NA,NA,NA,NA,https://www.who.int/csr/don/2006_05_18b/en/,DON-2006-05-18b
2006-H5 Influenza-EGY,3,2006,5/18/2006,H5N1,NA,Egypt,EGY,Al Minya,5/11/2006,NA,NA,NA,NA,yes,NA,NA,14,NA,NA,NA,6,NA,NA,NA,NA,NA,NA,https://www.who.int/csr/don/2006_05_18c/en/,DON-2006-05-18c
2006-H5 Influenza-IDN,3,2006,5/19/2006,H5N1,NA,Indonesia,IDN,Bekasi,NA,5/7/2006,NA,NA,NA,yes,NA,NA,41,NA,NA,NA,32,NA,yes,NA,NA,NA,NA,https://www.who.int/csr/don/2006_05_19/en/,DON-2006-05-19
2006-H5 Influenza-IDN,3,2006,5/22/2006,H5N1,NA,Indonesia,IDN,Kubu Sembelang,5/15/2006,NA,NA,NA,NA,yes,NA,NA,1,NA,NA,NA,1,NA,yes,NA,NA,yes,doesn't report cumulative total,https://www.who.int/csr/don/2006_05_22/en/,DON-2006-05-22
2006-H5 Influenza-IDN,3,2006,5/23/2006,H5N1,NA,Indonesia,IDN,Kubu Sembelang,5/15/2006,NA,NA,NA,NA,yes,NA,NA,1,NA,NA,NA,1,NA,yes,NA,NA,NA,almost identical to previous report,https://www.who.int/csr/don/2006_05_23/en/,DON-2006-05-23
2006-Cholera-AGO,5,2006,5/25/2006,Cholera,NA,Angola,AGO,12/18 provinces,NA,NA,NA,5/23/2006,NA,NA,NA,NA,NA,NA,NA,38897,1437,3.6,yes,NA,NA,NA,NA,https://www.who.int/csr/don/2006_05_25/en/,DON-2006-05-25
2006-H5 Influenza-IDN,3,2006,5/29/2006,H5N1,NA,Indonesia,IDN,"Karo, East Java, South Jakarta, West Sumatra, West Jakarta, Bandung",5/6/2006,5/17/2006,NA,NA,NA,yes,NA,NA,48,NA,NA,NA,36,NA,yes,NA,NA,NA,NA,https://www.who.int/csr/don/2006_05_29/en/,DON-2006-05-29
2006-H5 Influenza-IDN,3,2006,5/31/2006,H5N1,NA,Indonesia,IDN,Bubu Simbelang,4/24/2006,5/2/2006,NA,NA,NA,yes,NA,NA,7,NA,NA,8,7,NA,yes,NA,NA,NA,Family cluster,https://www.who.int/csr/don/2006_05_31/en/,DON-2006-05-31
2006-H5 Influenza-IDN,3,2006,6/6/2006,H5N1,NA,Indonesia,IDN,"Bandung, Medan",NA,NA,NA,NA,NA,no,NA,NA,0,NA,NA,NA,0,NA,yes,NA,NA,NA,4 nurses who treated infected patients; negative lab results,https://www.who.int/csr/don/2006_06_06/en/,DON-2006-06-06
2006-Cholera-AGO,5,2006,6/6/2006,Cholera,NA,Angola,AGO,13/18 provinces,NA,NA,NA,5/31/2006,NA,NA,NA,NA,NA,NA,NA,41475,1576,3.8,yes,NA,NA,NA,NA,https://www.who.int/csr/don/2006_06_06a/en/,DON-2006-06-06a
2006-H5 Influenza-IDN,3,2006,6/6/2006,H5N1,NA,Indonesia,IDN,Tasikmalaya,5/24/2006,5/26/2006,NA,NA,NA,yes,NA,NA,49,NA,NA,NA,37,NA,yes,NA,NA,NA,NA,https://www.who.int/csr/don/2006_06_06b/en/,DON-2006-06-06b
2005-WPV-NAM,5,2006,6/7/2006,Poliomyelitis,NA,Namibia,NAM,Windhoek,5/8/2006,NA,NA,NA,NA,yes,NA,NA,3,NA,31,34,NA,NA,yes,NA,NA,NA,NA,https://www.who.int/csr/don/2006_06_07/en/,DON-2006-06-07
2006-Cholera-AGO,5,2006,6/9/2006,Cholera,NA,Angola,AGO,14/18 provinces,NA,NA,NA,6/6/2006,NA,NA,NA,NA,NA,NA,NA,43076,1642,3.8,yes,NA,NA,NA,NA,https://www.who.int/csr/don/2006_06_09/en/,DON-2006-06-09
2006-Plague-COD,2,2006,6/14/2006,Plague,NA,Democratic Republic of the Congo,COD,Ituri district,NA,NA,NA,6/13/2006,NA,yes,NA,NA,NA,NA,NA,>100,19,NA,yes,NA,NA,NA,NA,https://www.who.int/csr/don/2006_06_14/en/,DON-2006-06-14
2006-H5 Influenza-IDN,3,2006,6/15/2006,H5N1,NA,Indonesia,IDN,Tangerang,5/26/2006,5/30/2006,NA,NA,NA,yes,NA,NA,50,NA,NA,NA,38,NA,yes,NA,NA,NA,NA,https://www.who.int/csr/don/2006_06_15/en/,DON-2006-06-15
2006-H5 Influenza-CHN,3,2006,6/16/2006,H5N1,NA,China,CHN,Shenzhen,6/3/2006,6/9/2006,NA,NA,NA,yes,NA,NA,19,NA,NA,NA,12,NA,yes,NA,NA,NA,NA,https://www.who.int/csr/don/2006_06_16/en/,DON-2006-06-16
2006-H5 Influenza-IDN,3,2006,6/20/2006,H5N1,NA,Indonesia,IDN,South Jakarta,6/9/2006,6/13/2006,NA,NA,NA,yes,NA,NA,51,NA,NA,NA,39,NA,yes,NA,NA,NA,NA,https://www.who.int/csr/don/2006_06_20/en/,DON-2006-06-20
2006-Cholera-AGO,5,2006,6/21/2006,Cholera,NA,Angola,AGO,14/18 provinces,NA,NA,NA,6/19/2006,NA,NA,NA,NA,NA,NA,NA,46758,1893,4,yes,NA,NA,NA,NA,https://www.who.int/csr/don/2006_06_21/en/,DON-2006-06-21
2006-Cholera-SDN,5,2006,6/21/2006,Cholera,NA,Sudan,SDN,"9/15 states in northern Sudan, 8/10 states in southern Sudan",NA,NA,NA,1/28/2006,NA,yes,NA,NA,70,NA,NA,18194,553,"3.8 (northern), 3.0 (southern)",yes,NA,NA,NA,report differntiates between northern and southern Sudan; case totals have been combined here,https://www.who.int/csr/don/2006_06_21a/en/,DON-2006-06-21a
2006-H5 Influenza-IDN,3,2006,7/4/2006,H5N1,NA,Indonesia,IDN,Tulungagung,6/8/2006,6/14/2006,NA,NA,NA,yes,NA,NA,52,NA,NA,NA,40,NA,yes,NA,NA,NA,NA,https://www.who.int/csr/don/2006_07_04/en/,DON-2006-07-04
2006-H5 Influenza-IDN,3,2006,7/14/2006,H5N1,NA,Indonesia,IDN,Jakarta suburb,6/23/2006,7/5/2006,NA,NA,NA,yes,NA,NA,53,NA,NA,NA,41,NA,yes,NA,NA,NA,NA,https://www.who.int/csr/don/2006_07_14/en/,DON-2006-07-14
2006-Lassa Fever-DEU,2,2006,7/25/2006,Lassa fever,NA,Germany,DEU,NA,7/5/2006,7/21/2006,NA,NA,NA,yes,NA,NA,1,NA,NA,NA,0,NA,yes,NA,NA,NA,imported from Sierra Leone,https://www.who.int/csr/don/2006_07_25/en/,DON-2006-07-25
2006-H5 Influenza-IDN,3,2006,8/7/2006,H5N1,NA,Thailand,THA,Uthai Thani,7/24/2006,7/30/2006,NA,NA,NA,yes,NA,NA,24,NA,NA,NA,NA,NA,yes,NA,NA,NA,total death count not reported,https://www.who.int/csr/don/2006_08_07/en/,DON-2006-08-07
2006-H5 Influenza-IDN,3,2006,8/8/2006,H5N1,NA,Indonesia,IDN,West Java,7/27/2006,8/4/2006,NA,NA,NA,yes,NA,NA,55,NA,NA,NA,43,NA,yes,NA,NA,NA,NA,https://www.who.int/csr/don/2006_08_08a/en/,DON-2006-08-08a
2006-CCHF-TUR,6,2006,8/8/2006,Crimean-Congo haemorrhagic fever,NA,Turkey,TUR,NA,NA,NA,NA,1/1/2006,NA,yes,NA,NA,242,NA,NA,NA,20,8.3,NA,NA,NA,NA,NA,https://www.who.int/csr/don/2006_08_08b/en/,DON-2006-08-08b
2006-H5 Influenza-CHN,3,2006,8/8/2006,H5N1,NA,China,CHN,Beijing,11/25/2003,NA,06/??/2006,NA,NA,yes,NA,NA,20,NA,NA,NA,13,NA,NA,NA,NA,NA,retrospective analysis reveals first case of H5N1 in China,https://www.who.int/csr/don/2006_08_08/en/,DON-2006-08-08
2006-H5 Influenza-IDN,3,2006,8/9/2006,H5N1,NA,Indonesia,IDN,Jakarta,7/28/2006,8/4/2006,NA,NA,NA,yes,NA,NA,56,NA,NA,NA,44,NA,yes,NA,NA,NA,NA,https://www.who.int/csr/don/2006_08_09/en/,DON-2006-08-09
2006-H5 Influenza-IDN,3,2006,8/14/2006,H5N1,NA,Indonesia,IDN,Garut,7/26/2006,8/9/2006,NA,NA,NA,8/12/2006,NA,NA,57,NA,NA,NA,44,NA,yes,NA,NA,NA,NA,https://www.who.int/csr/don/2006_08_14a/en/,DON-2006-08-14a
2006-H5 Influenza-CHN,3,2006,8/14/2006,H5N1,NA,China,CHN,Xinjiang Uygur Autonomous Region,6/19/2006,NA,NA,NA,NA,yes,NA,NA,21,NA,NA,NA,14,NA,yes,NA,NA,NA,NA,https://www.who.int/csr/don/2006_08_14/en/,DON-2006-08-14
2006-H5 Influenza-IDN,3,2006,8/17/2006,H5N1,NA,Indonesia,IDN,Garut,8/1/2006,8/14/2006,NA,NA,NA,yes,NA,NA,58,NA,NA,NA,45,NA,yes,NA,NA,NA,NA,https://www.who.int/csr/don/2006_08_17/en/,DON-2006-08-17
2006-H5 Influenza-IDN,3,2006,8/21/2006,H5N1,NA,Indonesia,IDN,Cikelet,8/8/2006,8/17/2006,NA,NA,NA,yes,NA,NA,59,NA,NA,NA,46,NA,yes,NA,NA,NA,NA,https://www.who.int/csr/don/2006_08_21/en/,DON-2006-08-21
2006-H5 Influenza-IDN,3,2006,8/23/2006,H5N1,NA,Indonesia,IDN,Bekasi,8/6/2006,8/11/2006,NA,NA,NA,yes,NA,NA,60,NA,NA,NA,46,NA,yes,NA,NA,NA,NA,https://www.who.int/csr/don/2006_08_23/en/,DON-2006-08-23
2006-WPV-ETH,5,2006,9/8/2006,Poliomyelitis,NA,Ethiopia,ETH,11 regions,12/??/2004,NA,NA,NA,NA,NA,NA,NA,NA,NA,NA,37,NA,NA,9/9/2006,NA,NA,NA,NA,https://www.who.int/csr/don/2006_09_08/en/,DON-2006-09-08
2006-WPV-SOM,5,2006,9/8/2006,Poliomyelitis,NA,Somalia,SOM,14/19 regions,NA,NA,NA,NA,NA,yes,NA,NA,215,NA,NA,NA,NA,NA,9/9/2006,NA,NA,NA,NA,https://www.who.int/csr/don/2006_09_08/en/,DON-2006-09-08
2006-H5 Influenza-IDN,3,2006,9/14/2006,H5N1,NA,Indonesia,IDN,"East Bekasi, Solok",3/4/2006,3/6/2006,NA,NA,NA,yes,NA,NA,65,NA,NA,NA,49,NA,yes,NA,NA,NA,NA,https://www.who.int/csr/don/2006_09_14/en/,DON-2006-09-14
2006-H5 Influenza-IRQ,3,2006,9/19/2006,H5N1,NA,Iraq,IRQ,Baghdad,NA,3/15/2006,NA,NA,NA,yes,NA,NA,3,NA,NA,2,NA,NA,NA,NA,NA,NA,retrospective confirmation,https://www.who.int/csr/don/2006_09_19/en/,DON-2006-09-19
2006-H5 Influenza-IDN,3,2006,9/25/2006,H5N1,NA,Indonesia,IDN,"East Java, South Jakarta",9/13/2006,9/20/2006,NA,NA,NA,yes,NA,NA,67,NA,NA,NA,51,NA,NA,NA,NA,NA,NA,https://www.who.int/csr/don/2006_09_25/en/,DON-2006-09-25
2006-H5 Influenza-THA,3,2006,9/27/2006,H5N1,NA,Thailand,THA,Nong Bua Lam Phu Province,7/14/2006,7/24/2006,NA,NA,NA,yes,NA,NA,25,NA,NA,NA,17,NA,NA,NA,NA,NA,NA,https://www.who.int/csr/don/2006_09_27/en/,DON-2006-09-27
2006-H5 Influenza-IDN,3,2006,9/27/2006,H5N1,NA,Indonesia,IDN,Bandung,9/17/2006,9/24/2006,NA,NA,NA,yes,NA,NA,68,NA,NA,NA,51,NA,yes,NA,NA,NA,NA,https://www.who.int/csr/don/2006_09_27a/en/,DON-2006-09-27a
2006-H5 Influenza-IDN,3,2006,9/28/2006,H5N1,NA,Indonesia,IDN,NA,NA,NA,NA,NA,NA,NA,NA,NA,68,NA,NA,NA,52,NA,NA,NA,NA,NA,death of previous case,https://www.who.int/csr/don/2006_09_28/en/,DON-2006-09-28
2006-H5 Influenza-IDN,3,2006,10/3/2006,H5N1,NA,Indonesia,IDN,East Java,9/19/2006,9/25/2006,NA,NA,NA,yes,NA,NA,69,NA,NA,NA,52,NA,yes,NA,NA,NA,NA,https://www.who.int/csr/don/2006_10_03/en/,DON-2006-10-03
2006-Acute Watery Diarrhoeal Syndrome-ETH,5,2006,10/4/2006,Acute watery diarrhoeal syndrome,NA,Ethiopia,ETH,"Amhara, Oromiya, Somali, Southern Nations, Nationalities, and People's Region",NA,NA,NA,9/28/2006,NA,yes,NA,NA,NA,NA,NA,22101,219,1,yes,NA,NA,NA,Vibrio cholerae 01 sero type inaba confirmed in some regions,https://www.who.int/csr/don/2006_10_04/en/,DON-2006-10-04
2006-Botulism-USA,5,2006,10/11/2006,Botulism,NA,United States,USA,"Georgia, Florida",NA,NA,NA,10/11/2006,NA,NA,NA,NA,NA,NA,NA,2,0,NA,NA,yes,NA,NA,tracked to carrot juice,https://www.who.int/csr/don/2006_10_11a/en/,DON-2006-10-11a
2006-Botulism-CAN,5,2006,10/11/2006,Botulism,NA,Canada,CAN,Toronto,NA,NA,NA,10/11/2006,NA,NA,NA,NA,NA,NA,NA,2,0,NA,NA,yes,NA,NA,NA,https://www.who.int/csr/don/2006_10_11a/en/,DON-2006-10-11a
2006-H5 Influenza-EGY,3,2006,10/11/2006,H5N1,NA,Egypt,EGY,Gharbiya,9/30/2006,10/4/2006,NA,NA,NA,yes,NA,NA,15,NA,NA,NA,6,NA,NA,NA,NA,NA,NA,https://www.who.int/csr/don/2006_10_11/en/,DON-2006-10-11
2006-Plague-COD,2,2006,10/13/2006,Plague,NA,Democratic Republic of the Congo,COD,"Wamba health zone, Haut-Uele district",NA,NA,7/31/2006,NA,NA,yes,NA,NA,3,NA,626,NA,42,NA,yes,NA,NA,NA,suspected case numbers may be overestimated,https://www.who.int/csr/don/2006_10_13/en/,DON-2006-10-13
2006-H5 Influenza-IDN,3,2006,10/16/2006,H5N1,NA,Indonesia,IDN,"West Java, South Jakarta, Central Java",10/2/2006,10/5/2006,NA,NA,NA,yes,NA,NA,72,NA,NA,NA,55,NA,yes,NA,NA,NA,NA,https://www.who.int/csr/don/2006_10_16/en/,DON-2006-10-16
2006-Chikungunya-IND,6,2006,10/17/2006,Chikungunya,NA,India,IND,151 districts in 8 states/provinces,NA,NA,NA,02/??/2006,NA,yes,NA,NA,NA,NA,NA,NA,NA,NA,yes,NA,NA,NA,entomological survey revealed high densities of Aedes albopictus in the affected areas as well as in areas not affected by the disease,https://www.who.int/csr/don/2006_10_17/en/,DON-2006-10-17
2006-WPV-KEN,5,2006,10/19/2006,Poliomyelitis,NA,Kenya,KEN,Somali refugee camp in Garissa,9/17/2006,NA,NA,NA,NA,NA,NA,NA,1,NA,NA,NA,NA,NA,yes,NA,NA,NA,WPV1,https://www.who.int/csr/don/2006_10_19/en/,DON-2006-10-19
2006-Yellow Fever-CIV,6,2006,10/19/2006,Yellow fever,NA,Cote d'Ivoire,CIV,"Korhogo, Ouaragahio",NA,NA,NA,10/5/2006,yes,yes,NA,NA,2,NA,NA,NA,0,NA,yes,NA,NA,NA,NA,https://www.who.int/csr/don/2006_10_19a/en/,DON-2006-10-19a
2006-H5 Influenza-EGY,3,2006,10/31/2006,H5N1,NA,Egypt,EGY,NA,NA,NA,NA,NA,NA,10/11/2006,NA,NA,15,NA,NA,NA,7,NA,NA,NA,NA,NA,death of previous case,https://www.who.int/csr/don/2006_10_31/en/,DON-2006-10-31
2006-Plague-COD,2,2006,11/7/2006,Plague,NA,Democratic Republic of the Congo,COD,4 health zones in Haut-Uele district,NA,NA,NA,9/29/2006,NA,no,NA,NA,NA,NA,1174,NA,50,NA,yes,NA,NA,NA,confirmation pending,https://www.who.int/csr/don/2006_11_07/en/,DON-2006-11-07
2006-H5 Influenza-IDN,3,2006,11/13/2006,H5N1,NA,Indonesia,IDN,"Tangerang, Karawang",11/5/2006,11/10/2006,NA,NA,NA,yes,NA,NA,74,NA,NA,NA,56,NA,yes,NA,NA,NA,NA,https://www.who.int/csr/don/2006_11_13/en/,DON-2006-11-13
2006-Meningococcal Disease-SDN,1,2006,11/21/2006,Meningococcal disease,NA,Sudan,SDN,Greater Yei Country (South Sudan),Last week of October,NA,9/1/2006,NA,NA,yes,NA,NA,NA,NA,231,NA,16,NA,yes,NA,NA,NA,NA,https://www.who.int/csr/don/2006_11_21/en/,DON-2006-11-21
2006-H5 Influenza-IDN,3,2006,11/29/2006,H5N1,NA,Indonesia,IDN,NA,NA,NA,NA,NA,NA,yes,NA,NA,74,NA,NA,NA,57,NA,NA,NA,NA,NA,death of previous case,https://www.who.int/csr/don/2006_11_29/en/,DON-2006-11-29
2006-Yellow Fever-TGO,6,2006,12/19/2006,Yellow fever,NA,Togo,TGO,"Dankpen, Oti",NA,NA,NA,12/15/2006,NA,yes,NA,NA,3,NA,NA,NA,NA,NA,yes,NA,NA,NA,NA,https://www.who.int/csr/don/2006_12_19/en/,DON-2006-12-19
2006-Rift Valley Fever-KEN,6,2006,12/26/2006,Rift Valley Fever,NA,Kenya,KEN,"Korakora, Shanta Abak, Shell Gulliet and Shimbirey",NA,NA,NA,12/21/2006,NA,yes,NA,NA,NA,NA,NA,12,11,NA,yes,NA,NA,NA,NA,https://www.who.int/csr/don/2006_12_26/en/,DON-2006-12-26
2006-Rift Valley Fever-KEN,6,2006,12/27/2006,Rift Valley Fever,NA,Kenya,KEN,NA,NA,NA,NA,12/27/2006,NA,NA,NA,NA,NA,NA,NA,32,19,59.4,yes,NA,NA,NA,NA,https://www.who.int/csr/don/2006_12_27/en/,DON-2006-12-27
2006-H5 Influenza-EGY,3,2006,12/27/2006,H5N1,NA,Egypt,EGY,Gharbiyah,NA,NA,NA,yes,yes,yes,NA,NA,3,NA,NA,NA,3,NA,yes,NA,NA,NA,3 new cases,https://www.who.int/csr/don/2006_12_27a/en/,DON-2006-12-27a
2007-H5 Influenza-IDN,3,2007,1/9/2007,H5N1,NA,Indonesia,IDN,"West Jakarta, Tangerang",12/30/2006,1/4/2007,NA,NA,NA,yes,NA,NA,76,NA,NA,NA,57,NA,yes,NA,NA,NA,NA,https://www.who.int/csr/don/2007_01_09/en/,DON-2007-01-09
2007-H5 Influenza-CHN,3,2007,1/10/2007,H5N1,NA,China,CHN,Tunxi,12/10/2006,12/17/2006,NA,NA,NA,yes,NA,NA,22,NA,NA,NA,14,NA,yes,NA,NA,NA,NA,https://www.who.int/csr/don/2007_01_10/en/,DON-2007-01-10
2007-H5 Influenza-IDN,3,2007,1/11/2007,H5N1,NA,Indonesia,IDN,West Jakarta,NA,NA,NA,NA,NA,yes,NA,NA,76,NA,NA,NA,58,NA,NA,NA,NA,NA,death of previous case,https://www.who.int/csr/don/2007_01_11a/en/,DON-2007-01-11a
2006-Yellow Fever-TGO,6,2007,1/11/2007,Yellow fever,NA,Togo,TGO,"Savanes, Kara",NA,NA,NA,NA,NA,yes,NA,NA,3,NA,NA,NA,0,NA,yes,NA,NA,NA,NA,https://www.who.int/csr/don/2007_01_11/en/,DON-2007-01-11
2007-H5 Influenza-IDN,3,2007,1/12/2007,H5N1,NA,Indonesia,IDN,"Banten Province, Tangerang",1/3/2007,NA,NA,NA,NA,yes,NA,NA,77,NA,NA,NA,59,NA,yes,NA,NA,NA,NA,https://www.who.int/csr/don/2007_01_12/en/,DON-2007-01-12
2007-H5 Influenza-IDN,3,2007,1/15/2007,H5N1,NA,Indonesia,IDN,"South Jakarta, Tangerang",1/6/2007,NA,NA,NA,NA,yes,NA,NA,79,NA,NA,NA,61,NA,yes,NA,NA,NA,NA,https://www.who.int/csr/don/2007_01_15/en/,DON-2007-01-15
2006-Rift Valley Fever-KEN,6,2007,1/15/2007,Rift Valley Fever,NA,Kenya,KEN,"North Eastern Province, Coast Province",NA,NA,NA,1/12/2007,NA,yes,NA,NA,56,NA,220,NA,82,37.2,yes,NA,NA,NA,NA,https://www.who.int/csr/don/2007_01_15a/en/,DON-2007-01-15a
2007-H5 Influenza-EGY,3,2007,1/18/2007,H5N1,NA,Egypt,EGY,Gharbiya,NA,12/19/2006,NA,NA,yes,yes,NA,NA,NA,NA,NA,NA,NA,NA,yes,NA,NA,NA,found mutation in 2 previously reported cases that causes reduced susceptibility to oseltamivir,https://www.who.int/csr/don/2007_01_18/en/,DON-2007-01-18
2007-H5 Influenza-EGY,3,2007,1/22/2007,H5N1,NA,Egypt,EGY,Beni Sweif,1/9/2007,NA,NA,NA,yes,yes,NA,NA,19,NA,NA,NA,11,NA,yes,NA,NA,NA,NA,https://www.who.int/csr/don/2007_01_22a/en/,DON-2007-01-22a
2007-H5 Influenza-IDN,3,2007,1/22/2007,H5N1,NA,Indonesia,IDN,West Java,1/11/2007,NA,NA,NA,NA,yes,NA,NA,80,NA,NA,NA,62,NA,yes,NA,NA,NA,NA,https://www.who.int/csr/don/2007_01_22/en/,DON-2007-01-22
2007-Meningococcal Disease-UGA,1,2007,1/24/2007,Meningococcal disease,NA,Uganda,UGA,"Arua/ Maracha-Terego, Koboko, Yumbe districts",NA,NA,NA,1/1/2007,NA,yes,NA,NA,3,NA,241,NA,16,6.6,yes,NA,NA,NA,NA,https://www.who.int/csr/don/2007_01_24/en/,DON-2007-01-24
2006-Yellow Fever-TGO,6,2007,1/29/2007,Yellow fever,NA,Togo,TGO,"Savanes, Kara",NA,NA,NA,NA,NA,yes,NA,NA,3,NA,NA,NA,NA,NA,yes,NA,NA,NA,Mass vaccination campaign to begin,https://www.who.int/csr/don/2007_01_29a/en/,DON-2007-01-29a
2007-H5 Influenza-IDN,3,2007,1/29/2007,H5N1,NA,Indonesia,IDN,Magelang,1/8/2007,NA,NA,NA,NA,yes,NA,NA,81,NA,NA,NA,63,NA,yes,NA,NA,NA,NA,https://www.who.int/csr/don/2007_01_29/en/,DON-2007-01-29
2006-Rift Valley Fever-KEN,6,2007,1/31/2007,Rift Valley Fever,NA,Kenya,KEN,"North Eastern Province, Coast Province, Eastern Province, Central Province",NA,NA,NA,1/30/2007,NA,yes,NA,NA,131,NA,411,NA,121,NA,yes,yes,NA,NA,NA,https://www.who.int/csr/don/2007_01_31/en/,DON-2007-01-31
2006-Rift Valley Fever-SOM,6,2007,1/31/2007,Rift Valley Fever,NA,Somalia,SOM,NA,NA,NA,NA,1/30/2007,NA,yes,NA,NA,1,NA,100,NA,48,NA,yes,NA,NA,NA,NA,https://www.who.int/csr/don/2007_01_31/en/,DON-2007-01-31
2007-H5 Influenza-NGA,3,2007,1/31/2007,H5N1,NA,Nigera,NGA,Lagos,NA,NA,NA,NA,NA,no,NA,NA,NA,NA,5,NA,2,NA,yes,NA,NA,NA,lab results pending; prelim samples positive,https://www.who.int/csr/don/2007_01_31a/en/,DON-2007-01-31a
2007-Meningococcal Disease-COD,1,2007,2/2/2007,Meningococcal disease,NA,Democratic Republic of the Congo,COD,Adi Health zone,NA,NA,NA,1/1/2007,NA,yes,NA,NA,NA,NA,53,NA,6,11.3,yes,NA,NA,NA,NA,https://www.who.int/csr/don/2007_02_02/en/,DON-2007-02-02
2007-H5 Influenza-NGA,3,2007,2/3/2007,H5N1,NA,Nigeria,NGA,Lagos,NA,NA,NA,NA,NA,yes,NA,NA,1,NA,NA,NA,1,NA,yes,NA,NA,NA,NA,https://www.who.int/csr/don/2007_02_03/en/,DON-2007-02-03
2007-H5 Influenza-EGY,3,2007,2/6/2007,H5N1,NA,Egypt,EGY,Fayyoum,1/25/2007,2/1/2007,NA,NA,yes,yes,NA,NA,20,NA,NA,NA,12,NA,yes,NA,NA,NA,NA,https://www.who.int/csr/don/2007_02_06/en/,DON-2007-02-06
2007-Meningococcal Disease-BFA,1,2007,2/7/2007,Meningococcal disease,NA,Burkina Faso,BFA,"Ouargaye, Banfora, Batie, Sapouy",NA,NA,NA,NA,NA,yes,NA,NA,NA,NA,789,NA,96,12.2,yes,NA,NA,NA,NA,https://www.who.int/csr/don/2007_02_07/en/,DON-2007-02-07
2007-WPV-TCD,5,2007,2/7/2007,Poliomyelitis,NA,Chad,TCD,N'Djamena,11/26/2006,NA,NA,NA,NA,1/23/2007,NA,NA,1,NA,NA,NA,NA,NA,yes,NA,NA,NA,type 3,https://www.who.int/csr/don/2007_02_07a/en/,DON-2007-02-07a
2007-Malaria-JAM,6,2007,2/9/2007,Malaria,NA,Jamaica,JAM,"Kingston, St. Catherine, St. Thomas, Clarendon",NA,NA,NA,NA,NA,yes,NA,NA,280,NA,NA,NA,0,NA,yes,NA,NA,NA,NA,https://www.who.int/csr/don/2007_02_09/en/,DON-2007-02-09
2006-Yellow Fever-TGO,6,2007,2/12/2007,Yellow fever,NA,Togo,TGO,"Savanes, Kara, Maritime",NA,NA,NA,NA,NA,yes,NA,NA,5,NA,NA,NA,NA,NA,2/12/2007,NA,NA,NA,mass vaccination has begun,https://www.who.int/csr/don/2007_02_12/en/,DON-2007-02-12
2007-Meningococcal Disease-SDN,1,2007,2/15/2007,Meningococcal disease,NA,Sudan,SDN,8 states,NA,NA,NA,1/1/2007,NA,yes,NA,NA,NA,NA,1129,NA,96,8.5,yes,NA,NA,NA,NA,https://www.who.int/csr/don/2007_2_15/en/,DON-2007-2-15
2007-H5 Influenza-EGY,3,2007,2/15/2007,H5N1,NA,Egypt,EGY,Fayyoum,2/12/2007,NA,NA,NA,yes,yes,NA,NA,21,NA,NA,NA,12,NA,NA,NA,NA,NA,NA,https://www.who.int/csr/don/2007_02_15/en/,DON-2007-02-15
2007-H5 Influenza-EGY,3,2007,2/16/2007,H5N1,NA,Egypt,EGY,NA,NA,NA,NA,NA,NA,yes,NA,NA,21,NA,NA,NA,13,NA,NA,NA,NA,NA,NA,https://www.who.int/csr/don/2007_02_16/en/,DON-2007-02-16
2007-H5 Influenza-EGY,3,2007,2/19/2007,H5N1,NA,Egypt,EGY,Sharkia,NA,2/14/2007,NA,NA,yes,yes,NA,NA,22,NA,NA,NA,13,NA,yes,NA,NA,NA,NA,https://www.who.int/csr/don/2007_02_19/en/,DON-2007-02-19
2007-H5 Influenza-LAO,3,2007,2/27/2007,H5N1,NA,Lao People's Democratic Republic,LAO,Vientiane,2/10/2007,2/15/2007,NA,2/27/2007,NA,yes,NA,NA,1,NA,NA,NA,0,NA,2/24/2007,NA,NA,NA,NA,https://www.who.int/csr/don/2007_02_27/en/,DON-2007-02-27
2007-H5 Influenza-EGY,3,2007,3/1/2007,H5N1,NA,Egypt,EGY,Dakahlea,2/25/2007,2/26/2007,NA,NA,yes,yes,NA,NA,23,NA,NA,NA,13,NA,yes,NA,NA,NA,NA,https://www.who.int/csr/don/2007_03_01/en/,DON-2007-03-01
2007-H5 Influenza-CHN,3,2007,3/1/2007,H5N1,NA,China,CHN,Jian'ou,2/18/2007,2/22/2007,NA,yes,2/27/2007,2/26/2007,NA,NA,23,NA,NA,NA,14,NA,yes,NA,NA,NA,NA,https://www.who.int/csr/don/2007_03_01a/en/,DON-2007-03-01a
2007-H5 Influenza-LAO,3,2007,3/8/2007,H5N1,NA,Lao People's Democratic Republic,LAO,Ventiane,NA,NA,NA,NA,NA,NA,NA,NA,1,NA,NA,NA,1,NA,NA,NA,NA,NA,death of first case,https://www.who.int/csr/don/2007_03_08/en/,DON-2007-03-08
2007-H5 Influenza-EGY,3,2007,3/12/2007,H5N1,NA,Egypt,EGY,Ad Daqahliyah,3/7/2007,3/8/2007,NA,NA,yes,yes,NA,NA,24,NA,NA,NA,13,NA,yes,NA,NA,NA,NA,https://www.who.int/csr/don/2007_03_12/en/,DON-2007-03-12
2007-H5 Influenza-EGY,3,2007,3/15/2007,H5N1,NA,Egypt,EGY,Aswan,NA,3/13/2007,NA,NA,NA,yes,NA,NA,25,NA,NA,NA,13,NA,yes,NA,NA,NA,NA,https://www.who.int/csr/don/2007_03_15/en/,DON-2007-03-15
2007-Meningococcal Disease-SDN,1,2007,3/15/2007,Meningococcal disease,NA,Sudan,SDN,"Aweil West, Juba, Mundri East, Rumbek, Tonj South, Wulu, Yirol (Southern Sudan)",NA,NA,NA,1/1/2007,NA,NA,NA,NA,NA,NA,6946,NA,430,6.19,yes,NA,NA,NA,takes place in what is now south sudan,https://www.who.int/csr/don/2007_3_15a/en/,DON-2007-3-15a
2007-H5 Influenza-LAO,3,2007,3/16/2007,H5N1,NA,Lao People's Democratic Republic,LAO,Saka,2/26/2007,2/28/2007,NA,yes,yes,yes,NA,NA,2,NA,NA,NA,2,NA,yes,NA,NA,NA,NA,https://www.who.int/csr/don/2007_03_16/en/,DON-2007-03-16
2007-H5 Influenza-EGY,3,2007,3/19/2007,H5N1,NA,Egypt,EGY,Aswan,NA,3/13/2007,NA,NA,yes,yes,NA,NA,25,NA,NA,NA,13,NA,yes,NA,NA,NA,same report as 3/15?,https://www.who.int/csr/don/2007_03_19/en/,DON-2007-03-19
2007-Meningococcal Disease-BFA,1,2007,3/19/2007,Meningococcal disease,NA,Burkina Faso,BFA,22 districts,NA,NA,NA,1/1/2007,NA,yes,NA,NA,NA,NA,7333,NA,583,8,yes,NA,NA,NA,NA,https://www.who.int/csr/don/2007_03_19a/en/,DON-2007-03-19a
2007-H5 Influenza-EGY,3,2007,3/20/2007,H5N1,NA,Egypt,EGY,Aswan,3/15/2007,3/16/2007,NA,NA,yes,yes,NA,NA,26,NA,NA,NA,13,NA,yes,NA,NA,NA,NA,https://www.who.int/csr/don/2007_03_20/en/,DON-2007-03-20
2007-Rift Valley-TZA,6,2007,3/23/2007,Rift Valley Fever,NA,United Republic of Tanzania,TZA,"Arusha, Tanga, Dodoma, Morogoro",1/18/2007,NA,NA,Beginning February 2007,NA,yes,NA,NA,12,NA,122,NA,12,NA,yes,NA,NA,NA,different clusters; numbers a bit unclear,https://www.who.int/csr/don/2007_03_23/en/,DON-2007-03-23
2007-H5 Influenza-EGY,3,2007,3/27/2007,H5N1,NA,Egypt,EGY,Aswan,3/22/2007,3/24/2007,NA,NA,yes,yes,NA,NA,27,NA,NA,NA,13,NA,yes,NA,NA,NA,NA,https://www.who.int/csr/don/2007_03_27/en/,DON-2007-03-27
2007-H5 Influenza-EGY,3,2007,3/28/2007,H5N1,NA,Egypt,EGY,Qena,NA,3/25/2207,NA,NA,yes,yes,NA,NA,29,NA,NA,NA,13,NA,yes,NA,NA,NA,NA,https://www.who.int/csr/don/2007_03_28/en/,DON-2007-03-28
2007-H5 Influenza-CHN,3,2007,3/29/2007,H5N1,NA,China,CHN,Anhui,3/17/2007,3/20/2007,NA,yes,NA,yes,NA,NA,24,NA,NA,NA,15,NA,yes,NA,NA,NA,NA,https://www.who.int/csr/don/2007_03_29/en/,DON-2007-03-29
2007-H5 Influenza-EGY,3,2007,4/2/2007,H5N1,NA,Egypt,EGY,"Qena, Sohag",3/26/2007,3/29/2007,NA,NA,yes,yes,NA,NA,32,NA,NA,NA,13,NA,yes,NA,NA,NA,NA,https://www.who.int/csr/don/2007_04_02/en/,DON-2007-04-02
2007-H5 Influenza-EGY,3,2007,4/10/2007,H5N1,NA,Egypt,EGY,"Menia, Cairo",3/30/2007,4/5/2007,NA,NA,yes,yes,NA,NA,34,NA,NA,NA,13,NA,yes,NA,NA,NA,NA,https://www.who.int/csr/don/2007_04_10/en/,DON-2007-04-10
2007-H5 Influenza-KHM,3,2007,4/10/2007,H5N1,NA,Cambodia,KHM,Ponhea Kreak,4/2/2007,4/3/2007,NA,NA,NA,yes,NA,NA,7,NA,NA,NA,7,NA,yes,yes,NA,NA,First case in 2007,https://www.who.int/csr/don/2007_04_10a/en/,DON-2007-04-10a
2007-H5 Influenza-EGY,3,2007,4/11/2007,H5N1,NA,Egypt,EGY,Cairo,NA,NA,NA,NA,NA,yes,NA,NA,34,NA,NA,NA,14,NA,NA,NA,NA,NA,death of previous case,https://www.who.int/csr/don/2007_04_11/en/,DON-2007-04-11
2007-Meningococcal Disease-BFA,1,2007,4/17/2007,Meningococcal disease,NA,Burkina Faso,BFA,34 districts,NA,NA,NA,1/1/2007,NA,yes,NA,NA,NA,NA,22255,NA,1490,7,yes,NA,NA,NA,NA,https://www.who.int/csr/don/2007_04_17/en/,DON-2007-04-17
2007-Rift Valley Fever-KEN,6,2007,5/9/2007,Rift Valley Fever,NA,Kenya,KEN,"North Eastern, Rift Valley, Coast, Central, Eastern",NA,NA,11/30/2006,NA,NA,yes,NA,NA,234,NA,NA,684,155,23,NA,NA,NA,NA,NA,https://www.who.int/csr/don/2007_05_09/en/,DON-2007-05-09
2007-Rift Valley Fever-SOM,6,2007,5/9/2007,Rift Valley Fever,NA,Somalia,SOM,"Lower Juba, Gedo, Hiran, Middle Juba, Middle Shabelle, Lower Shabelle",NA,NA,12/19/2006,NA,NA,yes,NA,NA,3,NA,NA,114,51,45,NA,NA,NA,NA,NA,https://www.who.int/csr/don/2007_05_09/en/,DON-2007-05-09
2007-Rift Valley Fever-TZA,6,2007,5/9/2007,Rift Valley Fever,NA,United Republic of Tanzania,TZA,10/21 regions,NA,NA,1/13/2007,NA,NA,yes,NA,NA,154,NA,NA,264,109,41,yes,yes,NA,NA,NA,https://www.who.int/csr/don/2007_05_09/en/,DON-2007-05-09
2007-H5 Influenza-IDN,3,2007,5/16/2007,H5N1,NA,Indonesia,IDN,"West Java, Central Jakarta, East Java, East Jakarta, South Suamtra, West Sumatra, Jakarta, Riau, North Sumatra",1/25/2007,1/31/2007,NA,NA,NA,yes,NA,NA,15,NA,NA,NA,13,NA,yes,NA,NA,NA,WHO will now accept results from national laboratory,https://www.who.int/csr/don/2007_05_16/en/,DON-2007-05-16
2007-H5 Influenza-IDN,3,2007,5/24/2007,H5N1,NA,Indonesia,IDN,Wonogiri,5/8/2007,5/15/2007,NA,NA,NA,yes,NA,NA,97,NA,NA,NA,77,NA,yes,NA,NA,NA,NA,https://www.who.int/csr/don/2007_05_24/en/,DON-2007-05-24
2007-H7 Influenza-GBR,3,2007,5/29/2007,H7N2,NA,United Kingdom,GBR,Corwen Farm (Wales),5/8/2007,NA,NA,5/25/2007,NA,5/24/2007,NA,NA,4,NA,NA,NA,NA,NA,NA,NA,NA,NA,NA,https://www.who.int/csr/don/2007_05_29/en/,DON-2007-05-29
2007-H5 Influenza-CHN,3,2007,5/30/2007,H5N1,NA,China,CHN,Fujian,5/9/2007,5/14/2007,NA,yes,NA,5/23/2007,NA,NA,25,NA,NA,NA,15,NA,yes,NA,NA,NA,NA,https://www.who.int/csr/don/2007_05_30/en/,DON-2007-05-30
2007-XDR-TB-USA,1,2007,5/30/2007,XDR-TB,NA,United States of America,USA,Air passenger to Europe,NA,NA,NA,NA,NA,NA,NA,NA,NA,NA,NA,1,NA,NA,yes,NA,NA,NA,NA,https://www.who.int/csr/don/2007_05_30a/en/,DON-2007-05-30a
2007-H5 Influenza-IDN,3,2007,5/31/2007,H5N1,NA,Indonesia,IDN,Grobogan,5/17/2007,5/26/2007,NA,NA,NA,yes,NA,NA,98,NA,NA,NA,78,NA,yes,NA,NA,NA,NA,https://www.who.int/csr/don/2007_05_31/en/,DON-2007-05-31
2007-H7 Influenza-GBR,3,2007,6/4/2007,H7N2,NA,United Kingdom,GBR,Corwen Farm (Wales),NA,NA,NA,NA,NA,yes,NA,NA,4,NA,NA,NA,NA,NA,yes,NA,NA,NA,continued investigation,https://www.who.int/csr/don/2007_06_04/en/,DON-2007-06-04
2007-H5 Influenza-CHN,3,2007,6/4/2007,H5N1,NA,China,CHN,Fujian,NA,NA,NA,yes,NA,yes,NA,NA,25,NA,NA,NA,16,NA,NA,NA,NA,NA,death of previous case,https://www.who.int/csr/don/2007_06_04a/en/,DON-2007-06-04a
2007-H5 Influenza-IDN,3,2007,6/6/2007,H5N1,NA,Indonesia,IDN,Kendal,5/21/2007,5/25/2007,NA,NA,NA,yes,NA,NA,99,NA,NA,NA,79,NA,yes,NA,NA,NA,NA,https://www.who.int/csr/don/2007_06_06/en/,DON-2007-06-06
2007-H5 Influenza-EGY,3,2007,6/11/2007,H5N1,NA,Egypt,EGY,Qena,6/1/2007,6/6/2007,NA,NA,yes,yes,NA,NA,35,NA,NA,NA,15,NA,yes,NA,NA,NA,NA,https://www.who.int/csr/don/2007_06_11/en/,DON-2007-06-11
2007-H5 Influenza-EGY,3,2007,6/12/2007,H5N1,NA,Egypt,EGY,Qena,6/7/2007,6/10/2007,NA,NA,yes,yes,NA,NA,36,NA,NA,NA,15,NA,yes,NA,NA,NA,NA,https://www.who.int/csr/don/2007_06_12/en/,DON-2007-06-12
2007-H5 Influenza-IDN,3,2007,6/15/2007,H5N1,NA,Indonesia,IDN,Riau,6/3/2007,6/6/2007,NA,NA,NA,yes,NA,NA,100,NA,NA,NA,80,NA,yes,NA,NA,NA,NA,https://www.who.int/csr/don/2007_06_15/en/,DON-2007-06-15
2007-H5 Influenza-EGY,3,2007,6/25/2007,H5N1,NA,Egypt,EGY,Qena,6/20/2007,6/21/2007,NA,NA,yes,yes,NA,NA,37,NA,NA,NA,15,NA,yes,NA,NA,NA,NA,https://www.who.int/csr/don/2007_06_25/en/,DON-2007-06-25
2007-H5 Influenza-IDN,3,2007,6/25/2007,H5N1,NA,Indonesia,IDN,Riau,6/18/2007,NA,NA,NA,NA,yes,NA,NA,101,NA,NA,NA,80,NA,yes,NA,NA,NA,NA,https://www.who.int/csr/don/2007_06_25a/en/,DON-2007-06-25a
2007-H5 Influenza-VNM,3,2007,6/29/2007,H5N1,NA,Vietnam,VNM,"Vinh Phuc, Thai Nguyen",5/10/2007,5/15/2007,NA,NA,yes,yes,NA,NA,2,NA,NA,NA,0,NA,NA,NA,NA,NA,NA,https://www.who.int/csr/don/2007_06_29/en/,DON-2007-06-29
2007-H5 Influenza-IDN,3,2007,7/11/2007,H5N1,NA,Indonesia,IDN,Banten,6/23/2007,7/5/2007,NA,NA,NA,yes,NA,NA,102,NA,NA,NA,81,NA,yes,NA,NA,NA,NA,https://www.who.int/csr/don/2007_07_11/en/,DON-2007-07-11
2007-H5 Influenza-EGY,3,2007,7/25/2007,H5N1,NA,Egypt,EGY,Damietta,7/20/2007,7/21/2007,NA,NA,yes,yes,NA,NA,38,NA,NA,NA,15,NA,yes,NA,NA,NA,NA,https://www.who.int/csr/don/2007_07_25/en/,DON-2007-07-25
2007-WPV-AGO,5,2007,7/30/2007,Poliomyelitis,NA,Angola,AGO,"Luanda, Benguele",NA,NA,NA,NA,NA,NA,NA,NA,NA,NA,NA,8,NA,NA,7/25/2007,NA,NA,NA,NA,https://www.who.int/csr/don/2007_07_30/en/,DON-2007-07-30
2007-WPV-COD,5,2007,7/30/2007,Poliomyelitis,NA,Democratic Republic of the Congo,COD,Equator province,NA,NA,NA,NA,NA,7/25/2007,NA,NA,NA,NA,NA,26,NA,NA,7/25/2007,NA,NA,NA,NA,https://www.who.int/csr/don/2007_07_30/en/,DON-2007-07-30
2007-Marburg haemorrhagic fever-UGA,2,2007,8/3/2007,Marburg haemorrhagic fever,NA,Uganda,UGA,NA,7/4/2007,7/7/2007,NA,NA,NA,7/30/2007,NA,NA,1,NA,2,NA,NA,NA,yes,NA,NA,NA,NA,https://www.who.int/csr/don/2007_08_03/en/,DON-2007-08-03
2007-WPV-AGO,5,2007,8/9/2007,Poliomyelitis,NA,Angola,AGO,"Luanda, Benguela",7/8/2007,NA,NA,NA,NA,yes,NA,NA,4,NA,NA,10,NA,NA,yes,NA,NA,NA,NA,https://www.who.int/csr/don/2007_08_09/en/,DON-2007-08-09
2007-Marburg haemorrhagic fever-UGA,2,2007,8/14/2007,Marburg haemorrhagic fever,NA,Uganda,UGA,"Kampala, Kamwenge",NA,NA,NA,NA,NA,yes,NA,NA,NA,NA,NA,NA,NA,NA,yes,NA,NA,NA,NA,https://www.who.int/csr/don/2007_08_14/en/,DON-2007-08-14
2007-H5 Influenza-IDN,3,2007,8/14/2007,H5N1,NA,Indonesia,IDN,Bali,8/3/2007,8/7/2007,NA,NA,NA,yes,NA,NA,103,NA,NA,NA,82,NA,yes,NA,NA,NA,NA,https://www.who.int/csr/don/2007_08_14a/en/,DON-2007-08-14a
2007-H5 Influenza-IDN,3,2007,8/16/2007,H5N1,NA,Indonesia,IDN,Tangerang,8/9/2007,8/13/2007,NA,NA,NA,yes,NA,NA,104,NA,NA,NA,83,NA,yes,NA,NA,NA,NA,https://www.who.int/csr/don/2007_08_16/en/,DON-2007-08-16
2007-WPV-COD,5,2007,8/21/2007,Poliomyelitis,NA,Democratic Republic of the Congo,COD,Bandundu,NA,NA,NA,8/14/2007,NA,NA,NA,NA,NA,NA,NA,27,NA,NA,yes,NA,NA,NA,NA,https://www.who.int/csr/don/2007_08_21/en/,DON-2007-08-21
2007-H5 Influenza-IDN,3,2007,8/23/2007,H5N1,NA,Indonesia,IDN,Babanan,8/14/2007,8/18/2007,NA,NA,NA,yes,NA,NA,105,NA,NA,NA,84,NA,yes,NA,NA,NA,NA,https://www.who.int/csr/don/2007_08_23/en/,DON-2007-08-23
2007-H5 Influenza-VNM,3,2007,8/31/2007,H5N1,NA,Vietnam,VNM,"Ha Nam, Thanh Hoa, Ha Tay",5/30/2007,5/31/2007,NA,NA,NA,yes,NA,NA,5,NA,NA,NA,2,NA,yes,NA,NA,NA,WHO introduced External Quality Assessment Project and amended criteria for confirmed cases --> confirms 5 additional cases and 2 deaths,https://www.who.int/csr/don/2007_08_31/en/,DON-2007-08-31
2007-Ebola-COD,2,2007,8/31/2007,Unknown,NA,Democratic Republic of the Congo,COD,Kasai Occidental,NA,NA,NA,NA,NA,no,NA,NA,NA,NA,NA,NA,NA,NA,yes,NA,NA,NA,"samples taken, etiology unknown",https://www.who.int/csr/don/2007_08_31a/en/,DON-2007-08-31a
2007-H5 Influenza-IDN,3,2007,9/10/2007,H5N1,NA,Indonesia,IDN,Riau,8/25/2007,9/2/2007,NA,NA,NA,yes,NA,NA,106,NA,NA,NA,85,NA,yes,NA,NA,NA,NA,https://www.who.int/csr/don/2007_09_10/en/,DON-2007-09-10
2007-Cholera-IRQ,5,2007,9/10/2007,Cholera,NA,Iraq,IRQ,"Sulaymaniyah Governate, Kirkuk Governate, Erbil Governate",NA,NA,8/14/2007,NA,NA,yes,NA,NA,289,NA,NA,6916,10,NA,yes,yes,NA,NA,NA,https://www.who.int/csr/don/2007_09_10a/en/,DON-2007-09-10a
2007-Ebola-COD,2,2007,9/11/2007,EHF,NA,Democratic Republic of the Congo,COD,Kasai Occidental,NA,NA,NA,NA,yes,yes,NA,NA,NA,NA,NA,372,166,NA,yes,NA,NA,NA,NA,https://www.who.int/csr/don/2007_09_11/en/,DON-2007-09-11
2007-Cholera-IRQ,5,2007,9/25/2007,Cholera,NA,Iraq,IRQ,"Kirkuk, Sulaymaniah, Erbil, Tikrit, Mosul, Basra, Baghdad, Dahuk",NA,NA,NA,NA,NA,yes,NA,NA,2116,NA,NA,>30000,NA,0.52,yes,NA,NA,NA,NA,https://www.who.int/csr/don/2007_09_25/en/,DON-2007-09-25
2007-Ebola-COD,2,2007,9/27/2007,EHF,NA,Democratic Republic of the Congo,COD,"Mweka, Luebo health zones",NA,NA,NA,NA,NA,yes,NA,NA,17,NA,NA,NA,NA,NA,yes,yes,NA,NA,NA,https://www.who.int/csr/don/2007_09_27/en/,DON-2007-09-27
2007-H5 Influenza-IDN,3,2007,10/2/2007,H5N1,NA,Indonesia,IDN,Jakarta,9/19/2008,9/25/2007,NA,NA,NA,yes,NA,NA,107,NA,NA,NA,86,NA,yes,NA,NA,NA,NA,https://www.who.int/csr/don/2007_10_02/en/,DON-2007-10-02
2007-Ebola-COD,2,2007,10/3/2007,EHF,NA,Democratic Republic of the Congo,COD,Kasai Occidental,NA,NA,NA,10/2/2007,NA,yes,NA,NA,25,NA,NA,76,NA,NA,yes,NA,NA,NA,NA,https://www.who.int/csr/don/2007_10_03a/en/,DON-2007-10-03a
2007-Cholera-IRQ,5,2007,10/3/2007,Cholera,NA,Iraq,IRQ,9/18 provinces,NA,8/14/2007,NA,NA,NA,yes,NA,NA,3315,NA,NA,>30000,14,NA,yes,NA,NA,NA,NA,https://www.who.int/csr/don/2007_10_03/en/,DON-2007-10-03
2007-H5 Influenza-IDN,3,2007,10/8/2007,H5N1,NA,Indonesia,IDN,Pekanbaru,10/1/2007,NA,NA,NA,NA,yes,NA,NA,108,NA,NA,NA,87,NA,yes,NA,NA,NA,NA,https://www.who.int/csr/don/2007_10_08/en/,DON-2007-10-08
2007-H5 Influenza-IDN,3,2007,10/12/2007,H5N1,NA,Indonesia,IDN,Tangerang,9/30/2007,NA,NA,NA,NA,yes,NA,NA,109,NA,NA,NA,87,NA,yes,NA,NA,NA,NA,https://www.who.int/csr/don/2007_10_12/en/,DON-2007-10-12
2007-H5 Influenza-IDN,3,2007,10/17/2007,H5N1,NA,Indonesia,IDN,Tangerang,NA,NA,NA,NA,NA,yes,NA,NA,109,NA,NA,NA,88,NA,NA,NA,NA,NA,death of previous case,https://www.who.int/csr/don/2007_10_17/en/,DON-2007-10-17
2007-H5 Influenza-IDN,3,2007,10/25/2007,H5N1,NA,Indonesia,IDN,Tangerang,10/14/2007,10/20/2007,NA,NA,NA,yes,NA,NA,110,NA,NA,NA,89,NA,yes,NA,NA,NA,NA,https://www.who.int/csr/don/2007_10_25/en/,DON-2007-10-25
2007-H5 Influenza-IDN,3,2007,10/31/2007,H5N1,NA,Indonesia,IDN,Tangerang,10/14/2007,NA,NA,NA,NA,yes,NA,NA,111,NA,NA,NA,89,NA,yes,NA,NA,NA,NA,https://www.who.int/csr/don/2007_10_31/en/,DON-2007-10-31
2007-Rift Valley Fever-SDN,6,2007,11/5/2007,Rift Valley Fever,NA,Sudan,SDN,"White Nile, Sinnar, Gezeera",NA,NA,NA,NA,NA,NA,NA,NA,25,NA,NA,125,60,NA,10/24/2007,yes,NA,NA,NA,https://www.who.int/csr/don/2007_11_05/en/,DON-2007-11-05
2007-H5 Influenza-IDN,3,2007,11/5/2007,H5N1,NA,Indonesia,IDN,Tangerang,10/23/2007,10/31/2007,NA,NA,NA,yes,NA,NA,112,NA,NA,NA,90,NA,yes,NA,NA,NA,NA,https://www.who.int/csr/don/2007_11_05a/en/,DON-2007-11-05a
2007-Rift Valley Fever-SDN,6,2007,11/7/2007,Rift Valley Fever,NA,Sudan,SDN,"White Nile, Sinnar, Gezeera",NA,NA,NA,11/7/2007,NA,NA,NA,NA,25,NA,NA,228,84,NA,NA,NA,NA,NA,NA,https://www.who.int/csr/don/2007_11_07/en/,DON-2007-11-07
2007-H5 Influenza-IDN,3,2007,11/12/2007,H5N1,NA,Indonesia,IDN,Bengkalis,10/31/2007,11/3/2007,NA,NA,NA,yes,NA,NA,113,NA,NA,NA,91,NA,yes,NA,NA,NA,NA,https://www.who.int/csr/don/2007_11_12/en/,DON-2007-11-12
2007-Rift Valley Fever-SDN,6,2007,11/14/2007,Rift Valley Fever,NA,Sudan,SDN,"White Nile, Sinnar, Gezeera",NA,NA,NA,11/14/2007,NA,NA,NA,NA,NA,NA,NA,329,96,29,yes,NA,NA,NA,NA,https://www.who.int/csr/don/2007_11_14/en/,DON-2007-11-14
2007-Bromide Poisoning-AGO,7,2007,11/16/2007,Unknown,NA,Angola,AGO,Cacuaco,NA,NA,10/2/2007,NA,NA,no,NA,NA,NA,NA,NA,370,NA,NA,yes,NA,NA,NA,"The clinical symptoms of the disease are extreme drowsiness, waking only to painful stimuli. Patients recover slowly, over a number of days, but remain ataxic with many unable to walk unaided. The symptoms are most extreme in children. Suggests toxological cause. No positive lab results yet",https://www.who.int/csr/don/2007_11_16/en/,DON-2007-11-16
2007-Bromide Poisoning-AGO,7,2007,11/21/2007,Unknown,NA,Angola,AGO,Cacuaco,NA,NA,NA,NA,NA,yes,NA,NA,NA,NA,NA,390,NA,NA,yes,yes,NA,NA,found extremely high levels of bromide,https://www.who.int/csr/don/2007_11_21/en/,DON-2007-11-21
2007-Rift Valley Fever-SDN,6,2007,11/22/2007,Rift Valley Fever,NA,Sudan,SDN,"White Nile, Sinnar, Gezeera",NA,NA,NA,11/21/2007,NA,NA,NA,NA,NA,NA,NA,451,164,NA,yes,NA,NA,NA,NA,https://www.who.int/csr/don/2007_11_22/en/,DON-2007-11-22
2007-Bromide Poisoning-AGO,7,2007,11/30/2007,Mass Bromide poisoning,NA,Angola,AGO,Cacuaco,NA,NA,NA,11/29/2007,yes,yes,NA,NA,468,NA,NA,NA,NA,NA,yes,yes,NA,NA,contaminated table salt,https://www.who.int/csr/don/2007_11_30/en/,DON-2007-11-30
2007-Ebola-UGA,2,2007,11/30/2007,EHF,NA,Uganda,UGA,Bundibugyo,09/??/2007,NA,11/28/2007,NA,yes,yes,NA,NA,NA,NA,51,NA,16,NA,yes,NA,NA,NA,NA,https://www.who.int/csr/don/2007_11_30a/en/,DON-2007-11-30a
2007-H5 Influenza-CHN,3,2007,12/4/2007,H5N1,NA,China,CHN,Jiangsu,11/24/2007,11/27/2007,yes,yes,NA,12/2/2007,NA,NA,26,NA,NA,NA,17,NA,yes,NA,NA,NA,NA,https://www.who.int/csr/don/2007_12_04/en/,DON-2007-12-04
2007-Ebola-UGA,2,2007,12/7/2007,EHF,NA,Uganda,UGA,Bundibugyo,NA,NA,NA,NA,NA,yes,NA,NA,9,NA,93,NA,22,NA,yes,yes,NA,NA,NA,https://www.who.int/csr/don/2007_12_07/en/,DON-2007-12-07
2007-H5 Influenza-CHN,3,2007,12/9/2007,H5N1,NA,China,CHN,Jiangsu,12/3/2007,12/3/2007,NA,yes,NA,12/6/2007,NA,NA,27,NA,NA,NA,17,NA,yes,NA,NA,NA,NA,https://www.who.int/csr/don/2007_12_09/en/,DON-2007-12-09
2007-H5 Influenza-IDN,3,2007,12/12/2007,H5N1,NA,Indonesia,IDN,Tangerang,12/1/2007,12/7/2007,NA,NA,NA,yes,NA,NA,114,NA,NA,NA,92,NA,yes,NA,NA,NA,NA,https://www.who.int/csr/don/2007_12_12/en/,DON-2007-12-12
2007-H5 Influenza-IDN,3,2007,12/13/2007,H5N1,NA,Indonesia,IDN,Tangerang,12/2/2007,12/9/2007,NA,NA,NA,yes,NA,NA,115,NA,NA,NA,92,NA,yes,NA,NA,NA,NA,https://www.who.int/csr/don/2007_12_13/en/,DON-2007-12-13
2007-H5 Influenza-MMR,3,2007,12/14/2007,H5N1,NA,Myanmar,MMR,Kyaing Tone Township,11/21/2007,11/27/2007,NA,NA,yes,yes,NA,NA,1,NA,NA,NA,0,NA,yes,NA,NA,NA,NA,https://www.who.int/csr/don/2007_12_14/en/,DON-2007-12-14
2007-H5 Influenza-PAK,3,2007,12/15/2007,H5N1,NA,Pakistan,PAK,Peshawar,NA,NA,NA,yes,NA,no,NA,NA,NA,NA,8,NA,2,NA,yes,NA,NA,NA,"samples positive, being sent to reference lab for testing",https://www.who.int/csr/don/2007_12_15/en/,DON-2007-12-15
2007-H5 Influenza-IDN,3,2007,12/18/2007,H5N1,NA,Indonesia,IDN,Tangerang,NA,NA,NA,NA,NA,yes,NA,NA,115,NA,NA,NA,93,NA,NA,NA,NA,NA,death of previous case,https://www.who.int/csr/don/2007_12_18/en/,DON-2007-12-18
2007-Rift Valley Fever-SDN,6,2007,12/21/2007,Rift Valley Fever,NA,Sudan,SDN,"White Nile, Sennar, Gazeera, River Nile",NA,NA,NA,12/19/2007,NA,NA,NA,NA,NA,NA,NA,632,218,NA,NA,NA,NA,NA,NA,https://www.who.int/csr/don/2007_12_21/en/,DON-2007-12-21
2007-H5 Influenza-EGY,3,2007,12/26/2007,H5N1,NA,Egypt,EGY,Bany Sewef,NA,12/23/2007,NA,NA,NA,yes,NA,NA,39,NA,NA,NA,16,NA,yes,NA,NA,NA,NA,https://www.who.int/csr/don/2007_12_26a/en/,DON-2007-12-26a
2007-H5 Influenza-IDN,3,2007,12/26/2007,H5N1,NA,Indonesia,IDN,West Jakarta,12/14/2007,12/19/2007,NA,NA,NA,yes,NA,NA,116,NA,NA,NA,94,NA,yes,NA,NA,NA,NA,https://www.who.int/csr/don/2007_12_26/en/,DON-2007-12-26
2007-H5 Influenza-PAK,3,2007,12/27/2007,H5N1,NA,Pakistan,PAK,Peshawar,11/21/2007,11/23/2007,NA,NA,yes,yes,NA,NA,1,NA,NA,NA,1,NA,yes,NA,NA,NA,NA,https://www.who.int/csr/don/2007_12_27/en/,DON-2007-12-27
2007-H5 Influenza-VNM,3,2007,12/28/2007,H5N1,NA,Vietnam,VNM,Son La,12/7/2007,12/11/2007,NA,NA,NA,yes,NA,NA,101,NA,NA,NA,47,NA,yes,NA,NA,NA,NA,https://www.who.int/csr/don/2007_12_28/en/,DON-2007-12-28
2007-H5 Influenza-EGY,3,2007,12/28/2007,H5N1,NA,Egypt,EGY,Domiatt,NA,12/24/2007,NA,NA,NA,yes,NA,NA,41,NA,NA,NA,16,NA,NA,NA,NA,NA,NA,https://www.who.int/csr/don/2007_12_28a/en/,DON-2007-12-28a
2008-H5 Influenza-EGY,3,2008,1/2/2008,H5N1,NA,Egypt,EGY,Dekerns,12/26/2007,12/27/2007,NA,NA,NA,yes,NA,NA,43,NA,NA,NA,18,NA,NA,NA,NA,NA,NA,https://www.who.int/csr/don/2008_01_02/en/,DON-2008-01-02
2008-H5 Influenza-EGY,3,2008,1/3/2008,H5N1,NA,Egypt,EGY,Domiatt,NA,NA,NA,NA,NA,yes,NA,NA,43,NA,NA,NA,19,NA,NA,NA,NA,NA,report of death from previous case,https://www.who.int/csr/don/2008_01_03/en/,DON-2008-01-03
2008-H5 Influenza-IDN,3,2008,1/11/2008,H5N1,NA,Indonesia,IDN,West Java,12/30/2007,1/4/2008,NA,NA,NA,yes,NA,NA,117,NA,NA,NA,94,NA,yes,NA,NA,NA,NA,https://www.who.int/csr/don/2008_01_11/en/,DON-2008-01-11
2008-H5 Influenza-IDN,3,2008,1/15/2008,H5N1,NA,Indonesia,IDN,Tangerang,1/3/2008,1/9/2008,NA,NA,NA,yes,NA,NA,118,NA,NA,NA,95,NA,yes,NA,NA,NA,NA,https://www.who.int/csr/don/2008_01_15/en/,DON-2008-01-15
2008-H5 Influenza-IDN,3,2008,1/18/2008,H5N1,NA,Indonesia,IDN,West Java,NA,NA,NA,NA,NA,yes,NA,NA,118,NA,NA,NA,96,NA,NA,NA,NA,NA,report of death from previous case,https://www.who.int/csr/don/2008_01_18/en/,DON-2008-01-18
2008-H5 Influenza-IDN,3,2008,1/21/2008,H5N1,NA,Indonesia,IDN,Tangerang,1/7/2008,1/16/2008,NA,NA,NA,yes,NA,NA,119,NA,NA,NA,97,NA,yes,NA,NA,NA,NA,https://www.who.int/csr/don/2008_01_21/en/,DON-2008-01-21
2007-Rift Valley Fever-SDN,6,2008,1/22/2008,Rift Valley Fever,NA,Sudan,SDN,"Gazeera, Kassala, Khartoum, River Nile, Sinnar and White Nile",NA,NA,1/15/2008,NA,NA,NA,NA,NA,NA,NA,NA,698,222,31.8,yes,NA,NA,NA,NA,https://www.who.int/csr/don/2008_01_22/en/,DON-2008-01-22
2008-H5 Influenza-IDN,3,2008,1/23/2008,H5N1,NA,Indonesia,IDN,Tangerang,1/13/2008,1/19/2008,NA,NA,NA,yes,NA,NA,120,NA,NA,NA,97,NA,yes,NA,NA,NA,NA,https://www.who.int/csr/don/2008_01_23/en/,DON-2008-01-23
2008-H5 Influenza-VNM,3,2008,1/23/2008,H5N1,NA,Vietnam,VNM,Tuyen Quang,1/10/2008,1/16/2008,NA,NA,NA,yes,NA,NA,102,NA,NA,NA,48,NA,yes,NA,NA,NA,NA,https://www.who.int/csr/don/2008_01_24/en/,DON-2008-01-24
2008-H5 Influenza-IDN,3,2008,1/24/2008,H5N1,NA,Indonesia,IDN,Tangerang,NA,NA,NA,NA,NA,yes,NA,NA,120,NA,NA,NA,98,NA,NA,NA,NA,NA,report of death from previous case,https://www.who.int/csr/don/2008_01_24a/en/,DON-2008-01-24a
2008-H5 Influenza-IDN,3,2008,1/29/2008,H5N1,NA,Indonesia,IDN,"East Jakarta, Depok, Tangerang",1/16/2008,1/23/2008,NA,NA,NA,yes,NA,NA,124,NA,NA,NA,100,NA,yes,NA,NA,NA,NA,https://www.who.int/csr/don/2008_01_29/en/,DON-2008-01-29
2008-H5 Influenza-IDN,3,2008,1/30/2008,H5N1,NA,Indonesia,IDN,Tangerang,NA,NA,NA,NA,NA,yes,NA,NA,124,NA,NA,NA,101,NA,NA,NA,NA,NA,report of death from previous case,https://www.who.int/csr/don/2008_01_30/en/,DON-2008-01-30
2008-H5 Influenza-IDN,3,2008,2/1/2008,H5N1,NA,Indonesia,IDN,East Jakarta,NA,NA,NA,NA,NA,yes,NA,NA,124,NA,NA,NA,102,NA,NA,NA,NA,NA,report of death from previous case,https://www.who.int/csr/don/2008_02_01/en/,DON-2008-02-01
2008-H5 Influenza-IDN,3,2008,2/5/2008,H5N1,NA,Indonesia,IDN,"Tangerang, West Jakarta",1/22/2008,1/28/2008,NA,NA,NA,yes,NA,NA,126,NA,NA,NA,103,NA,yes,NA,NA,NA,NA,https://www.who.int/csr/don/2008_02_05/en/,DON-2008-02-05
2008-Yellow Fever-BRA,6,2008,2/7/2008,Yellow fever,NA,Brazil,BRA,"Goias, Distrito Federal, Mato Grosso do Sol",12/17/2007,NA,NA,2/1/2008,NA,yes,NA,NA,23,NA,NA,48,13,NA,yes,NA,NA,NA,**discrepancy in date in report vs on the link,https://www.who.int/csr/don/2008_02_07/en/,DON-2008-02-07
2008-H5 Influenza-IDN,3,2008,2/12/2008,H5N1,NA,Indonesia,IDN,West Jakarta,2/2/2008,2/8/2008,NA,NA,NA,yes,NA,NA,127,NA,NA,NA,103,NA,yes,NA,NA,NA,NA,https://www.who.int/csr/don/2008_02_12/en/,DON-2008-02-12
2008-H5 Influenza-VNM,3,2008,2/15/2008,H5N1,NA,Vietnam,VNM,Gia Loc,2/2/2008,2/8/2008,NA,NA,NA,yes,NA,NA,103,NA,NA,NA,49,NA,yes,NA,NA,NA,NA,https://www.who.int/csr/don/2008_02_15/en/,DON-2008-02-15
2008-Yellow Fever-PRY,6,2008,2/20/2008,Yellow fever,NA,Paraguay,PRY,"San Pedro Department, San Lorenzo municipality",NA,NA,NA,yes,NA,yes,NA,NA,7,NA,4,NA,NA,NA,yes,NA,NA,NA,NA,https://www.who.int/csr/don/2008_02_20a/en/,DON-2008-02-20a
2008-H5 Influenza-CHN,3,2008,2/20/2008,H5N1,NA,China,CHN,Jianghua,1/16/2008,1/23/2008,NA,yes,NA,12/17/2008,NA,NA,28,NA,NA,NA,18,NA,yes,NA,NA,NA,NA,https://www.who.int/csr/don/2008_02_20/en/,DON-2008-02-20
2008-Ebola-UGA,2,2008,2/20/2008,Ebola,NA,Uganda,UGA,Bundibugyo,NA,NA,NA,NA,yes,yes,2/20/2008,NA,NA,NA,NA,NA,NA,NA,yes,yes,NA,NA,end of outbreak,https://www.who.int/csr/don/2007_02_20b/en/,DON-2007-02-20b
2008-H5 Influenza-VNM,3,2008,2/21/2008,H5N1,NA,Vietnam,VNM,Ninh Nhat,2/3/2008,2/12/2008,NA,NA,NA,yes,NA,NA,104,NA,NA,NA,50,NA,NA,NA,NA,NA,NA,https://www.who.int/csr/don/2008_02_21/en/,DON-2008-02-21
2008-H5 Influenza-IDN,3,2008,2/21/2008,H5N1,NA,Indonesia,IDN,"Sragen, South Jakarta",2/3/2008,2/7/2008,NA,NA,NA,yes,NA,NA,129,NA,NA,NA,105,NA,yes,NA,NA,NA,NA,https://www.who.int/csr/don/2008_02_21a/en/,DON-2008-02-21a
2008-H5 Influenza-CHN,3,2008,2/22/2008,H5N1,NA,China,CHN,Xixiangtang,2/12/2008,NA,NA,yes,NA,2/21/2008,NA,NA,29,NA,NA,NA,19,NA,yes,NA,NA,NA,NA,https://www.who.int/csr/don/2008_02_22/en/,DON-2008-02-22
2008-Meningococcal Disease-African Meningitis Belt,1,2008,2/22/2008,Meningococcal disease,NA,African Meningitis Belt,NA,"Benin, Burkina Faso, Cameroon, the Central African Republic, Chad, Côte d'Ivoire, the Democratic Republic of the Congo, Ethiopia, Ghana, Mali, Niger, Nigeria and Togo",NA,NA,NA,NA,NA,NA,NA,NA,2312,NA,NA,NA,NA,NA,yes,NA,NA,NA,numbers since beginning of year; lower than last year,https://www.who.int/csr/don/2008_02_22a/en/,DON-2008-02-22a
2008-H5 Influenza-CHN,3,2008,2/26/2008,H5N1,NA,China,CHN,Haifeng,2/16/2008,2/22/2008,NA,yes,NA,2/25/2008,NA,NA,30,NA,NA,NA,20,NA,yes,NA,NA,NA,NA,https://www.who.int/csr/don/2008_02_26/en/,DON-2008-02-26
2008-H5 Influenza-VNM,3,2008,2/26/2008,H5N1,NA,Vietnam,VNM,Cam Khe,2/14/2008,2/19/2008,NA,NA,NA,yes,NA,NA,105,NA,NA,NA,51,NA,NA,NA,NA,NA,NA,https://www.who.int/csr/don/2008_02_26b/en/,DON-2008-02-26b
2008-Yellow Fever-PRY,6,2008,2/28/2008,Yellow fever,NA,Paraguay,PRY,"San Pedro Department, San Lorenzo municipality",NA,NA,NA,yes,NA,yes,NA,NA,16,NA,15,NA,3,NA,yes,NA,NA,NA,NA,https://www.who.int/csr/don/2008_02_28a/en/,DON-2008-02-28a
2008-H5 Influenza-EGY,3,2008,2/28/2008,H5N1,NA,Egypt,EGY,El-Edwa,2/21/2008,2/24/2008,NA,NA,NA,yes,NA,NA,44,NA,NA,NA,19,NA,yes,NA,NA,NA,NA,https://www.who.int/csr/don/2008_02_28/en/,DON-2008-02-28
2008-H5 Influenza-EGY,3,2008,3/4/2008,H5N1,NA,Egypt,EGY,Sennoris,2/24/2008,2/27/2008,NA,NA,NA,yes,NA,NA,45,NA,NA,NA,20,NA,yes,NA,NA,NA,NA,https://www.who.int/csr/don/2008_03_04/en/,DON-2008-03-04
2008-H5 Influenza-EGY,3,2008,3/5/2008,H5N1,NA,Egypt,EGY,Menof,NA,2/26/2008,NA,NA,3/4/2008,3/4/2008,NA,NA,46,NA,NA,NA,20,NA,yes,NA,NA,NA,NA,https://www.who.int/csr/don/2008_03_05/en/,DON-2008-03-05
2008-Yellow Fever-PRY,6,2008,3/7/2008,Yellow fever,NA,Paraguay,PRY,"San Pedro, Laurelty",NA,NA,NA,yes,NA,yes,NA,NA,22,NA,12,NA,6,NA,yes,NA,NA,NA,NA,https://www.who.int/csr/don/2008_03_07/en/,DON-2008-03-07
2008-H5 Influenza-EGY,3,2008,3/11/2008,H5N1,NA,Egypt,EGY,Etsa,NA,3/3/3008,NA,NA,NA,yes,NA,NA,47,NA,NA,NA,20,NA,yes,NA,NA,NA,NA,https://www.who.int/csr/don/2008_03_11/en/,DON-2008-03-11
2008-H5 Influenza-VNM,3,2008,3/18/2008,H5N1,NA,Vietnam,VNM,Thanh Liem,3/4/2008,3/9/2008,NA,NA,NA,yes,NA,NA,106,NA,NA,NA,52,NA,yes,NA,NA,NA,NA,https://www.who.int/csr/don/2008_03_18/en/,DON-2008-03-18
2008-H5 Influenza-IDN,3,2008,4/2/2008,H5N1,NA,Indonesia,IDN,Subang,3/17/2008,3/22/2008,NA,NA,NA,yes,NA,NA,132,NA,NA,NA,107,NA,yes,NA,NA,NA,NA,https://www.who.int/csr/don/2008_04_02/en/,DON-2008-04-02
2008-H5 Influenza-PAK,3,2008,4/3/2008,H5N1,NA,Pakistan,PAK,Peshawar,NA,NA,NA,NA,NA,yes,NA,NA,2,1,NA,NA,2,NA,yes,NA,NA,NA,lab results from previously reported family cluster,https://www.who.int/csr/don/2008_04_03/en/,DON-2008-04-03
2008-H5 Influenza-EGY,3,2008,4/8/2008,H5N1,NA,Egypt,EGY,Kafr El-Dawar,3/30/2008,3/31/2008,NA,NA,yes,yes,NA,NA,48,NA,NA,NA,21,NA,yes,NA,NA,NA,NA,https://www.who.int/csr/don/2008_04_08/en/,DON-2008-04-08
2008-Dengue-BRA,6,2008,4/10/2008,Dengue fever,NA,Brazil,BRA,Rio de Janeiro,NA,NA,NA,3/28/2008,NA,NA,NA,NA,NA,NA,NA,120570,48,NA,yes,NA,NA,NA,NA,https://www.who.int/csr/don/2008_04_10/en/,DON-2008-04-10
2008-H5 Influenza-EGY,3,2008,4/15/2008,H5N1,NA,Egypt,EGY,Al-Matarya,4/2/2008,NA,NA,NA,yes,yes,NA,NA,49,NA,NA,NA,22,NA,yes,NA,NA,NA,NA,https://www.who.int/csr/don/2008_04_15/en/,DON-2008-04-15
2008-H5 Influenza-EGY,3,2008,4/17/2008,H5N1,NA,Egypt,EGY,Al-Honsanya,4/13/2008,4/14/2008,NA,NA,yes,yes,NA,NA,50,NA,NA,NA,22,NA,yes,NA,NA,NA,NA,https://www.who.int/csr/don/2008_04_17/en/,DON-2008-04-17
2008-Yellow Fever-LBR,6,2008,4/18/2008,Yellow fever,NA,Libera,LBR,Zuotuo,NA,NA,NA,yes,NA,yes,NA,NA,1,NA,1,NA,1,NA,4/4/2008,NA,NA,NA,NA,https://www.who.int/csr/don/2008_04_18/en/,DON-2008-04-18
2008-Rift Valley Fever-MDG,6,2008,4/18/2008,Rift Valley Fever,NA,Madagascar,MDG,"Alaotra Mangoro, Analamanga, Itasy, Vakinakaratra and Anosy Regions.",NA,NA,NA,4/17/2008,NA,yes,NA,NA,59,NA,418,NA,17,NA,yes,NA,NA,NA,NA,https://www.who.int/csr/don/2008_04_18a/en/,DON-2008-04-18a
2008-Cholera-VNM,5,2008,4/22/2008,Cholera,NA,Vietnam,VNM,20 provinces and municipalities,NA,NA,NA,3/5/2008,NA,yes,NA,NA,377,NA,NA,2490,NA,NA,yes,yes,NA,NA,Severe Acute Watery Diarrhoea with V. cholerae positive cases in Viet Nam,https://www.who.int/csr/don/2008_04_22/en/,DON-2008-04-22
2008-Yellow Fever-LBR,6,2008,4/25/2008,Yellow fever,NA,Libera,LBR,Zuotuo,NA,NA,NA,yes,NA,yes,NA,NA,2,NA,NA,NA,1,NA,yes,NA,NA,NA,NA,https://www.who.int/csr/don/2008_04_25/en/,DON-2008-04-25
2008-H5 Influenza-IDN,3,2008,4/30/2008,H5N1,NA,Indonesia,IDN,Wonogiri District,4/14/2008,4/21/2008,NA,NA,NA,yes,NA,NA,133,NA,NA,NA,108,NA,yes,NA,NA,NA,NA,https://www.who.int/csr/don/2008_04_30/en/,DON-2008-04-30
2008-Enterovirus-CHN,1,2008,5/1/2008,Enterovirus,NA,China,CHN,"Fuyang, Anhui",Beginning March,NA,NA,4/29/2008,NA,4/23/2008,NA,NA,NA,NA,NA,1884,20,NA,yes,yes,NA,NA,NA,https://www.who.int/csr/don/2008_05_01/en/,DON-2008-05-01
2008-Enterovirus-CHN,1,2008,5/7/2008,Enterovirus,NA,China,CHN,"Fuyang, Anhui",NA,NA,NA,5/5/2008,NA,NA,NA,NA,NA,NA,NA,4496,22,NA,yes,yes,NA,NA,NA,https://www.who.int/csr/don/2008_05_07/en/,DON-2008-05-07
2008-Yellow Fever-CAF,6,2008,5/20/2008,Yellow fever,NA,Central African Republic,CAF,Bozoum sub-prefecture,NA,NA,NA,5/15/2008,NA,yes,NA,NA,2,NA,NA,NA,NA,NA,yes,NA,NA,NA,NA,https://www.who.int/csr/don/2008_05_20/en/,DON-2008-05-20
2008-Enterovirus-CHN,1,2008,5/21/2008,Enterovirus,NA,China,CHN,"Fuyang, Anhui",NA,NA,NA,NA,NA,NA,NA,NA,NA,NA,NA,NA,NA,NA,yes,NA,NA,NA,CDC & WHO Rep. Office in China has released prelimenary report,https://www.who.int/csr/don/2008_05_21/en/,DON-2008-05-21
2008-H5 Influenza-BGD,3,2008,5/28/2008,H5N1,NA,Bangladesh,BGD,Komalapur,1/27/2008,NA,NA,NA,NA,yes,NA,NA,1,NA,NA,NA,0,NA,yes,NA,NA,NA,NA,https://www.who.int/csr/don/2008_05_28/en/,DON-2008-05-28
2008-WPV-NGA,5,2008,6/18/2008,WPV1,NA,Nigeria,NGA,NA,NA,NA,NA,NA,NA,NA,NA,NA,NA,NA,NA,NA,NA,NA,yes,NA,NA,NA,high risk of international spread,https://www.who.int/csr/don/2008_06_18/en/,DON-2008-06-18
2008-WPV-BEN,5,2008,6/18/2008,WPV1,NA,Benin,BEN,NA,4/17/2008,NA,NA,NA,NA,yes,NA,NA,1,NA,NA,NA,NA,NA,NA,NA,NA,NA,NA,https://www.who.int/csr/don/2008_06_18/en/,DON-2008-06-18
2008-WPV-NER,5,2008,6/18/2008,WPV1,NA,Niger,NER,NA,4/11/2008,NA,NA,NA,NA,yes,NA,NA,1,NA,NA,NA,NA,NA,NA,NA,NA,NA,NA,https://www.who.int/csr/don/2008_06_18/en/,DON-2008-06-18
2008-WPV-TCD,5,2008,6/18/2008,WPV3,NA,Chad,TCD,NA,4/13/2008,NA,NA,yes,NA,NA,NA,NA,NA,NA,NA,NA,NA,NA,NA,NA,NA,NA,NA,https://www.who.int/csr/don/2008_06_18/en/,DON-2008-06-18
2008-H5 Influenza-IDN,3,2008,6/19/2008,H5N1,NA,Indonesia,IDN,"South Jakarta, Tangerang",5/7/2008,5/12/2008,NA,NA,NA,yes,NA,NA,135,NA,NA,NA,110,NA,yes,NA,NA,NA,NA,https://www.who.int/csr/don/2008_06_19/en/,DON-2008-06-19
2008-Lead Poisoning-SEN,7,2008,6/23/2008,Lead intoxication,NA,Senegal,SEN,"NGagne Diaw Quarter, Thiaroye sur Mer, Dakar",NA,NA,NA,NA,NA,yes,NA,NA,NA,NA,NA,NA,NA,NA,yes,NA,NA,NA,NA,https://www.who.int/csr/don/2008_06_23/en/,DON-2008-06-23
2007-Marburg haemorrhagic fever-NLD,2,2008,7/10/2008,Marburg haemorrhagic fever,NA,Netherlands,NLD,"*python cave, Uganda",7/2/2008,7/5/2008,NA,yes,NA,yes,NA,NA,1,NA,NA,NA,0,NA,yes,NA,NA,NA,*imported from Uganda,https://www.who.int/csr/don/2008_07_10/en/,DON-2008-07-10
2008-Yellow Fever-CIV,6,2008,8/8/2008,Yellow fever,NA,Cote d'Ivoire,CIV,"Cocody, Treichville",NA,NA,NA,NA,yes,Beginning May 2008,NA,NA,5,NA,9,NA,NA,NA,06/??/2008,NA,NA,NA,NA,https://www.who.int/csr/don/2008_08_08/en/,DON-2008-08-08
2008-H5 Influenza-IDN,3,2008,9/10/2008,H5N1,NA,Indonesia,IDN,Tangerang,7/4/2008,7/9/2008,NA,NA,NA,yes,NA,NA,137,NA,NA,NA,112,NA,NA,NA,NA,NA,NA,https://www.who.int/csr/don/2008_09_10/en/,DON-2008-09-10
2008-Cholera-IRQ,5,2008,9/10/2008,Cholera,NA,Iraq,IRQ,"Baghdad, Misan, Babil",NA,NA,NA,NA,NA,8/20/2008,NA,NA,28,NA,290,NA,10,NA,yes,NA,NA,NA,NA,https://www.who.int/csr/don/2008_09_10a/en/,DON-2008-09-10a
2008-Melamine Contamination-CHN,7,2008,9/18/2008,Melamine-contaminated powdered infant formula,NA,China,CHN,NA,NA,NA,9/17/2008,NA,NA,yes,NA,NA,NA,NA,NA,6240,3,NA,yes,NA,NA,NA,causing kidney stones in infants,https://www.who.int/csr/don/2008_09_19/en/,DON-2008-09-19
2008-Melamine Contamination-CHN,7,2008,9/22/2008,Melamine-contaminated powdered infant formula,NA,China,CHN,NA,NA,NA,NA,yes,NA,NA,NA,NA,NA,NA,NA,40000,3,NA,yes,NA,NA,NA,NA,https://www.who.int/csr/don/2008_09_22/en/,DON-2008-09-22
2008-Cholera-GNB,5,2008,9/24/2008,Cholera,NA,Guinea-Bissau,GNB,"Bissau, Biombo, Bijagos, Oio",Beginning May 2008,NA,9/21/2008,NA,NA,NA,NA,NA,NA,NA,NA,7166,133,1.9,yes,NA,NA,NA,NA,https://www.who.int/csr/don/2008_09_24/en/,DON-2008-09-24
2008-Yellow Fever-GIN,6,2008,9/29/2008,Yellow fever,NA,Guinea,GIN,"Bounouma, Urbain",7/26/2008,NA,NA,8/20/2008,NA,yes,NA,NA,2,NA,14,NA,1,NA,9/5/2008,NA,NA,NA,NA,https://www.who.int/csr/don/2008_09_29/en/,DON-2008-09-29
2008-Melamine Contamination-CHN,7,2008,9/29/2008,Melamine-contaminated powdered infant formula,NA,China,CHN,NA,NA,NA,NA,NA,NA,NA,NA,NA,NA,NA,NA,54000,3,NA,NA,NA,NA,NA,causing kidney stones; WHO published guidance to assist ntl. authorities,https://www.who.int/csr/don/2008_09_29a/en/,DON-2008-09-29a
2008-Cholera-IRQ,5,2008,9/29/2008,Cholera,NA,Iraq,IRQ,"Babil, Baghdad, Kerbala, Anbar, Basra, Diala, Diwanyia, Misan and Najaf",NA,NA,NA,8/20/2008,NA,NA,NA,NA,341,NA,31,NA,5,1.5,NA,NA,NA,NA,7 more deaths under investigation,https://www.who.int/csr/don/2008_09_29c/en/,DON-2008-09-29c
2008-Arenaviridae Virus-ZMB,2,2008,10/10/2008,Unknown,NA,Zambia,ZMB,NA,NA,9/12/2008,NA,NA,NA,NA,NA,NA,NA,NA,NA,1,1,NA,yes,NA,NA,NA,Underwent medical evacuation to SA; nurse and paramedic who cared for him also got sick,https://www.who.int/csr/don/2008_10_10/en/,DON-2008-10-10
2008-Arenaviridae Virus-ZAF,2,2008,10/10/2008,Unknown,NA,South Africa,ZAF,Johannesburg,NA,9/27/2008,NA,NA,NA,no,NA,NA,NA,NA,NA,2,2,NA,yes,NA,NA,NA,"lab testing going on, negative for common infectious pathogens",https://www.who.int/csr/don/2008_10_10/en/,DON-2008-10-10
2008-Arenaviridae Virus-ZAF,2,2008,10/13/2008,New Arenaviridae virus,NA,South Africa,ZAF,NA,NA,NA,NA,NA,yes,yes,NA,NA,3,NA,NA,NA,2,NA,yes,NA,NA,NA,continued analysis to fully characterize virus,https://www.who.int/csr/don/2008_10_13/en/,DON-2008-10-13
2008-Arenaviridae Virus-ZMB,2,2008,10/13/2008,New Arenaviridae virus,NA,Zambia,ZMB,NA,NA,NA,NA,NA,NA,yes,NA,NA,1,NA,NA,NA,1,NA,yes,NA,NA,NA,NA,https://www.who.int/csr/don/2008_10_13/en/,DON-2008-10-13
2008-Yellow Fever-CAF,6,2008,10/30/2008,Yellow fever,NA,Central African Republic,CAF,Ngotto,NA,NA,NA,8/22/2008,NA,yes,NA,NA,1,NA,4,NA,0,NA,yes,NA,NA,NA,NA,https://www.who.int/csr/don/2008_10_30/en/,DON-2008-10-30
2008-Yellow Fever-BFA,6,2008,11/3/2008,Yellow fever,NA,Burkina Faso,BFA,Ouahigouya,NA,NA,NA,10/3/2008,yes,yes,NA,NA,2,NA,NA,NA,1,NA,yes,NA,NA,NA,NA,https://www.who.int/csr/don/2008_11_03/en/,DON-2008-11-03
2008-Cholera-ZWE,5,2008,12/2/2008,Cholera,NA,Zimbabwe,ZWE,"Budirio, Beitbridge, Chegutu, Mvuma",NA,NA,NA,08/??/2008,NA,NA,NA,NA,NA,NA,NA,11735,484,4,yes,NA,NA,NA,NA,https://www.who.int/csr/don/2008_12_02/en/,DON-2008-12-02
2008-H5 Influenza-IDN,3,2008,12/9/2008,H5N1,NA,Indonesia,IDN,"Riau, East Jakarta",11/7/2008,11/12/2008,NA,NA,NA,yes,NA,NA,139,NA,NA,NA,113,NA,yes,NA,NA,NA,NA,https://www.who.int/csr/don/2008_12_09/en/,DON-2008-12-09
2008-H5 Influenza-KHM,3,2008,12/12/2008,H5N1,NA,Cambodia,KHM,Kandal,11/28/2008,11/30/2008,NA,NA,NA,12/11/2008,NA,NA,8,NA,NA,NA,7,NA,yes,NA,NA,NA,NA,https://www.who.int/csr/don/2008_12_12/en/,DON-2008-12-12
2008-H5 Influenza-EGY,3,2008,12/16/2008,H5N1,NA,Egypt,EGY,Assuit,12/8/2008,12/11/2008,NA,NA,12/15/2008,yes,NA,NA,51,NA,NA,NA,23,NA,yes,NA,NA,NA,NA,https://www.who.int/csr/don/2008_12_16/en/,DON-2008-12-16
2008-Ebola-COD,2,2008,12/26/2008,EHF,NA,Democratic Republic of the Congo,COD,Mweka,NA,NA,NA,12/25/2008,NA,yes,NA,NA,2,NA,34,NA,9,26,yes,NA,NA,NA,NA,https://www.who.int/csr/don/2008_12_26a/en/,DON-2008-12-26a
2008-Cholera-ZWE,5,2008,12/26/2008,Cholera,NA,Zimbabwe,ZWE,all provinces,NA,NA,NA,12/25/2008,NA,NA,NA,NA,NA,NA,NA,26497,1518,5.7,yes,NA,NA,NA,NA,https://www.who.int/csr/don/2008_12_26/en/,DON-2008-12-26
2008-Cholera-ZAF,5,2008,12/26/2008,Cholera,NA,South Africa,ZAF,Limpopo,NA,NA,NA,NA,NA,NA,NA,NA,NA,NA,NA,1279,12,0.9,yes,NA,NA,NA,NA,https://www.who.int/csr/don/2008_12_26/en/,DON-2008-12-26
2009-Ebola-COD,2,2009,1/2/2009,Ebola,NA,Democratic Republic of the Congo,COD,Mweka,NA,NA,NA,12/31/2008,NA,yes,NA,NA,3,NA,36,NA,12,NA,yes,yes,NA,NA,NA,https://www.who.int/csr/don/2009_01_02/en/,DON-2009-01-02
2009-Yellow Fever-SLE,6,2009,1/6/2009,Yellow fever,NA,Sierra Leone,SLE,"Gerihun, Jembe",10/7/2008,NA,NA,12/12/2008,NA,yes,NA,NA,2,NA,7,NA,0,NA,1/10/2009,NA,NA,NA,NA,https://www.who.int/csr/don/2009_01_06a/en/,DON-2009-01-06a
2009-WPV-NGA,5,2009,1/6/2009,Polio,NA,Nigeria,NGA,NA,NA,NA,NA,NA,NA,NA,NA,NA,NA,NA,NA,NA,NA,NA,yes,NA,NA,NA,NA,https://www.who.int/csr/don/2009_01_06/en/,DON-2009-01-06
2009-WPV-West Africa,5,2009,1/6/2009,Polio,NA,West Africa,NA,"Benin, Burkina Faso, Ghana, Niger, Mali, Togo, Chad",NA,04/??/2008,NA,NA,NA,NA,NA,NA,NA,NA,NA,NA,NA,NA,yes,NA,NA,NA,NA,https://www.who.int/csr/don/2009_01_06/en/,DON-2009-01-06
2009-H5 Influenza-VNM,3,2009,1/7/2009,H5N1,NA,Vietnam,VNM,Nien Trung,12/27/2008,1/2/2009,NA,yes,NA,yes,NA,NA,107,NA,NA,NA,52,NA,yes,NA,NA,NA,NA,https://www.who.int/csr/don/2009_01_07/en/,DON-2009-01-07
2009-H5 Influenza-CHN,3,2009,1/7/2009,H5N1,NA,China,CHN,Chaoyang District,12/24/2008,NA,NA,yes,NA,yes,NA,NA,31,NA,NA,NA,21,NA,yes,NA,NA,NA,NA,https://www.who.int/csr/don/2009_01_07a/en/,DON-2009-01-07a
2009-H5 Influenza-VNM,3,2009,1/11/2009,H5N1,NA,Vietnam,VNM,Dam Ha,1/28/2009,1/31/2009,NA,yes,NA,yes,NA,NA,108,NA,NA,NA,52,NA,yes,NA,NA,NA,"**dates don't make sense, maybe a typo?",https://www.who.int/csr/don/2009_01_11/en/,DON-2009-01-11
2009-Yellow Fever-GIN,6,2009,1/14/2009,Yellow fever,NA,Guinea,GIN,"Faranah, Nianfourando",Beginning November 2008,NA,NA,12/31/2009,NA,yes,NA,NA,2,NA,21,NA,3,NA,1/26/2009,NA,NA,NA,NA,https://www.who.int/csr/don/2009_01_14/en/,DON-2009-01-14
2009-H5 Influenza-EGY,3,2009,1/14/2009,H5N1,NA,Egypt,EGY,6th October Governorate,1/9/2009,1/10/2009,NA,NA,yes,yes,NA,NA,52,NA,NA,NA,23,NA,yes,NA,NA,NA,NA,https://www.who.int/csr/don/2009_01_14a/en/,DON-2009-01-14a
2009-H5 Influenza-CHN,3,2009,1/19/2009,H5N1,NA,China,CHN,"Jinan, Luliang, Huaihua",1/5/2009,NA,NA,yes,NA,yes,NA,NA,34,NA,NA,NA,22,NA,yes,NA,NA,NA,NA,https://www.who.int/csr/don/2009_01_19/en/,DON-2009-01-19
2009-H5 Influenza-IDN,3,2009,1/22/2009,H5N1,NA,Indonesia,IDN,"Tangerang, Bekasi",12/11/2008,12/13/2008,NA,NA,NA,yes,NA,NA,141,NA,NA,NA,115,NA,yes,NA,NA,NA,NA,https://www.who.int/csr/don/2009_01_22/en/,DON-2009-01-22
2009-H5 Influenza-CHN,3,2009,1/24/2009,H5N1,NA,China,CHN,Huaihua,NA,NA,NA,NA,NA,yes,NA,NA,34,NA,NA,NA,23,NA,NA,NA,NA,NA,NA,https://www.who.int/csr/don/2009_01_24/en/,DON-2009-01-24
2009-H5 Influenza-EGY,3,2009,1/26/2009,H5N1,NA,Egypt,EGY,Manofia,1/23/2009,1/23/2009,NA,NA,NA,yes,NA,NA,53,NA,NA,NA,23,NA,yes,NA,NA,NA,NA,https://www.who.int/csr/don/2009_01_26/en/,DON-2009-01-26
2009-H5 Influenza-CHN,3,2009,1/27/2009,H5N1,NA,China,CHN,"Urumqi, Guiyang, Beiliu",1/10/2009,NA,NA,NA,NA,yes,NA,NA,37,NA,NA,NA,25,NA,yes,NA,NA,NA,NA,https://www.who.int/csr/don/2009_01_27/en/,DON-2009-01-27
2008-Cholera-ZWE,5,2009,1/30/2009,Cholera,NA,Zimbabwe,ZWE,NA,08/??/2008,NA,NA,NA,NA,NA,NA,NA,NA,NA,NA,60000,3100,NA,NA,NA,NA,NA,Efforts must be intensified to get oubreak under control,https://www.who.int/csr/don/2009_01_30/en/,DON-2009-01-30
2009-H5 Influenza-CHN,3,2009,2/2/2009,H5N1,NA,China,CHN,Xupo,1/23/2009,NA,NA,NA,NA,yes,NA,NA,38,NA,NA,NA,25,NA,yes,NA,NA,NA,NA,https://www.who.int/csr/don/2009_02_02/en/,DON-2009-02-02
2009-Ebola Reston Virus-PHL,4,2009,2/3/2009,Ebola Reston Virus (ERV),NA,Philippines,PHL,"Bulacan, Pangasinan, Valenzuela",no,NA,NA,NA,NA,yes,NA,NA,5,NA,NA,NA,NA,NA,yes,NA,NA,NA,believed to be transmitted from sick pigs; not yet shown to cause illness in humans,https://www.who.int/csr/don/2009_02_03/en/,DON-2009-02-03
2009-H5 Influenza-EGY,3,2009,2/5/2009,H5N1,NA,Egypt,EGY,Suez,2/2/2009,2/3/2009,NA,NA,NA,yes,NA,NA,54,NA,NA,NA,23,NA,yes,NA,NA,NA,NA,https://www.who.int/csr/don/2009_02_05/en/,DON-2009-02-05
2009-H5 Influenza-EGY,3,2009,2/9/2009,H5N1,NA,Egypt,EGY,Maghagha,2/6/2009,2/7/2009,NA,NA,NA,yes,NA,NA,55,NA,NA,NA,23,NA,yes,NA,NA,NA,NA,https://www.who.int/csr/don/2009_02_09/en/,DON-2009-02-09
2009-H5 Influenza-VNM,3,2009,2/11/2009,H5N1,NA,Vietnam,VNM,Dam Ha,1/28/2009,1/31/2009,NA,NA,NA,yes,NA,NA,108,NA,NA,NA,52,NA,yes,NA,NA,NA,NA,https://www.who.int/csr/don/2009_02_11/en/,DON-2009-02-11
2009-Ebola-COD,2,2009,2/17/2009,Ebola,NA,Democratic Republic of the Congo,COD,"Mweka, Luebo health zones",NA,NA,NA,NA,yes,yes,2/16/2009,NA,NA,NA,NA,32,15,NA,yes,NA,NA,NA,end of outbreak,https://www.who.int/csr/don/2009_02_17/en/,DON-2009-02-17
2009-H5 Influenza-VNM,3,2009,2/18/2009,H5N1,NA,Vietnam,VNM,Kim Son,2/5/2009,2/13/2009,NA,yes,NA,yes,NA,NA,109,NA,NA,NA,52,NA,yes,NA,NA,NA,NA,https://www.who.int/csr/don/2009_02_18/en/,DON-2009-02-18
2009-Meningococcal Disease-NGA,1,2009,2/19/2009,Meningococcal disease,NA,Nigeria,NGA,NA,NA,NA,NA,2/8/2009,NA,yes,NA,NA,NA,NA,1364,NA,108,7.9,yes,NA,NA,NA,NA,https://www.who.int/csr/don/2009_02_19/en/,DON-2009-02-19
2008-Cholera-ZWE,5,2009,2/20/2009,Cholera,NA,Zimbabwe,ZWE,NA,NA,NA,NA,08/??/2008,NA,NA,NA,NA,NA,NA,79613,NA,3731,4.7,yes,NA,NA,NA,NA,https://www.who.int/csr/don/2009_02_20/en/,DON-2009-02-20
2009-H5 Influenza-VNM,3,2009,2/24/2009,H5N1,NA,Vietnam,VNM,Dam Ha,NA,NA,NA,NA,NA,yes,NA,NA,109,NA,NA,NA,53,NA,NA,NA,NA,NA,NA,https://www.who.int/csr/don/2009_02_24/en/,DON-2009-02-24
2009-H5 Influenza-VNM,3,2009,2/27/2009,H5N1,NA,Vietnam,VNM,Kim Son,NA,NA,NA,NA,NA,yes,NA,NA,109,NA,NA,NA,54,NA,NA,NA,NA,NA,NA,https://www.who.int/csr/don/2009_02_27/en/,DON-2009-02-27
2009-WPV-SDN,5,2009,3/2/2009,WPV1,NA,Sudan,SDN,Port Sudan,NA,NA,NA,NA,NA,NA,NA,NA,NA,NA,NA,NA,NA,NA,2/15/2009,NA,NA,NA,NA,https://www.who.int/csr/don/2009_03_02a/en/,DON-2009-03-02a
2009-WPV-KEN,5,2009,3/2/2009,WPV1,NA,Kenya,KEN,NA,NA,NA,NA,NA,NA,yes,NA,NA,NA,NA,NA,NA,NA,NA,yes,NA,NA,NA,NA,https://www.who.int/csr/don/2009_03_02a/en/,DON-2009-03-02a
2009-WPV-UGA,5,2009,3/2/2009,WPV1,NA,Uganda,UGA,NA,NA,NA,NA,NA,NA,yes,NA,NA,NA,NA,NA,NA,NA,NA,yes,NA,NA,NA,NA,https://www.who.int/csr/don/2009_03_02a/en/,DON-2009-03-02a
2009-H5 Influenza-EGY,3,2009,3/2/2009,H5N1,NA,Egypt,EGY,Youssef el seddik,2/25/2009,2/28/2009,NA,3/1/2009,NA,3/1/2009,NA,NA,56,NA,NA,NA,23,NA,yes,NA,NA,NA,NA,https://www.who.int/csr/don/2009_03_02/en/,DON-2009-03-02
2009-Meningococcal Disease-NGA,1,2009,3/4/2009,Meningococcal disease,NA,Nigeria,NGA,"Gombe, Jigawa, Kano, Katsina states",NA,NA,NA,1/1/2009,NA,yes,NA,NA,NA,NA,5323,NA,333,6.3,yes,NA,NA,NA,NA,https://www.who.int/csr/don/2009_03_04/en/,DON-2009-03-04
2009-H5 Influenza-EGY,3,2009,3/10/2009,H5N1,NA,Egypt,EGY,Amaria,3/3/2009,NA,NA,yes,NA,3/4/2009,NA,NA,57,NA,NA,NA,23,NA,yes,NA,NA,NA,NA,https://www.who.int/csr/don/2009_03_10/en/,DON-2009-03-10
2009-H5 Influenza-EGY,3,2009,3/11/2009,H5N1,NA,Egypt,EGY,Menofia,3/6/2009,3/9/2009,NA,yes,NA,3/10/2009,NA,NA,58,NA,NA,NA,23,NA,yes,NA,NA,NA,NA,https://www.who.int/csr/don/2009_03_11/en/,DON-2009-03-11
2008-Cholera-ZWE,5,2009,3/23/2009,Cholera,NA,Zimbabwe,ZWE,NA,NA,NA,NA,08/??/2008,NA,NA,NA,NA,NA,NA,NA,91164,4037,2.3,yes,NA,NA,NA,decreasing trend,https://www.who.int/csr/don/2009_03_23/en/,DON-2009-03-23
2009-H5 Influenza-EGY,3,2009,3/23/2009,H5N1,NA,Egypt,EGY,Elfath,3/14/2009,3/14/2009,NA,yes,NA,3/18/2009,NA,NA,59,NA,NA,NA,23,NA,yes,NA,NA,NA,NA,https://www.who.int/csr/don/2009_03_23a/en/,DON-2009-03-23a
2009-Meningococcal Disease-NGA,1,2009,3/25/2009,Meningococcal disease,NA,Nigeria,NGA,"16 Northern states; Bauchi, Gombe, Yobe, Katsina, Jigawa most affected",NA,NA,NA,1/1/2009,NA,yes,NA,NA,NA,NA,17462,NA,960,5.5,yes,NA,NA,NA,NA,https://www.who.int/csr/don/2009_03_25/en/,DON-2009-03-25
2009-Meningococcal Disease-NER,1,2009,3/25/2009,Meningococcal disease,NA,Niger,NER,NA,NA,NA,NA,1/1/2009,NA,yes,NA,NA,NA,NA,4513,NA,169,NA,NA,NA,NA,NA,NA,https://www.who.int/csr/don/2009_03_25/en/,DON-2009-03-25
2009-H5 Influenza-EGY,3,2009,3/30/2009,H5N1,NA,Egypt,EGY,Qena,3/23/2009,3/24/2009,NA,yes,NA,3/26/2009,NA,NA,60,NA,NA,NA,23,NA,yes,NA,NA,NA,NA,https://www.who.int/csr/don/2009_03_30/en/,DON-2009-03-30
2009-Ebola Reston Virus-PHL,4,2009,3/31/2009,Ebola Reston Virus (ERV),NA,Philippines,PHL,NA,no,NA,NA,NA,NA,yes,NA,NA,6,NA,NA,NA,0,NA,NA,2/16/2009,NA,NA,no effects on health,https://www.who.int/csr/don/2009_03_31/en/,DON-2009-03-31
2009-H5 Influenza-VNM,3,2009,4/8/2009,H5N1,NA,Vietnam,VNM,Chau Thanh,3/12/2009,3/13/2009,NA,yes,NA,yes,NA,NA,110,NA,NA,NA,55,NA,yes,NA,NA,NA,NA,https://www.who.int/csr/don/2009_04_08/en/,DON-2009-04-08
2009-H5 Influenza-EGY,3,2009,4/8/2009,H5N1,NA,Egypt,EGY,"Kom Hamada, Shubra El Khema",3/22/2009,3/28/2009,NA,yes,yes,yes,NA,NA,63,NA,NA,NA,23,NA,NA,NA,NA,NA,NA,https://www.who.int/csr/don/2009_04_08a/en/,DON-2009-04-08a
2009-H5 Influenza-EGY,3,2009,4/17/2009,H5N1,NA,Egypt,EGY,Kellin,4/7/2009,4/15/2009,NA,yes,NA,4/15/2009,NA,NA,64,NA,NA,NA,23,NA,yes,NA,NA,NA,NA,https://www.who.int/csr/don/2009_04_17/en/,DON-2009-04-17
2009-H5 Influenza-EGY,3,2009,4/21/2009,H5N1,NA,Egypt,EGY,"El Marg, Kellin",4/6/2009,4/11/2009,NA,yes,yes,yes,NA,NA,66,NA,NA,NA,23,NA,yes,NA,NA,NA,NA,https://www.who.int/csr/don/2009_04_21/en/,DON-2009-04-21
2009-H5 Influenza-EGY,3,2009,4/23/2009,H5N1,NA,Egypt,EGY,Akhmim,4/18/2009,4/18/2009,NA,yes,yes,yes,NA,NA,67,NA,NA,NA,23,NA,yes,NA,NA,NA,NA,https://www.who.int/csr/don/2009_04_23a/en/,DON-2009-04-23a
2009-Meningococcal Disease-TCD,1,2009,4/23/2009,Meningococcal disease,NA,Chad,TCD,"N'Djamena, Dourbali, Goundi, Pala",NA,NA,NA,12/29/2008,NA,yes,NA,NA,NA,NA,922,NA,105,11.4,yes,NA,NA,NA,NA,https://www.who.int/csr/don/2009_04_23/en/,DON-2009-04-23
2009-H1 Influenza-USA,3,2009,4/24/2009,H1N1,NA,United States of America,USA,"Texas, California",NA,NA,NA,yes,NA,yes,NA,NA,7,NA,9,NA,0,NA,yes,NA,NA,NA,NA,https://www.who.int/csr/don/2009_04_24/en/,DON-2009-04-24
2009-H1 Influenza-MEX,3,2009,4/24/2009,H1N1,NA,Mexico,MEX,"Federal District, San Luis Potosi, Mexicali",NA,3/18/2009,NA,yes,NA,yes,NA,NA,18,NA,NA,882,62,NA,yes,NA,NA,NA,a bit confusing numbers since ILI is vague and not allconfirmed yet,https://www.who.int/csr/don/2009_04_24/en/,DON-2009-04-24
2009-H1 Influenza-USA,3,2009,4/26/2009,H1N1,NA,United States of America,USA,"New York, California, Texas, Kansas, Ohio",NA,NA,NA,4/26/2009,NA,yes,NA,NA,20,NA,NA,NA,0,NA,NA,NA,NA,NA,NA,https://www.who.int/csr/don/2009_04_26/en/,DON-2009-04-26
2009-H1 Influenza-MEX,3,2009,4/26/2009,H1N1,NA,Mexico,MEX,NA,NA,NA,NA,4/26/2009,NA,yes,NA,NA,18,NA,NA,NA,NA,NA,yes,NA,NA,NA,NA,https://www.who.int/csr/don/2009_04_26/en/,DON-2009-04-26
2009-H1 Influenza-USA,3,2009,4/27/2009,H1N1,NA,United States of America,USA,NA,NA,NA,NA,4/27/2009,NA,yes,NA,NA,40,NA,NA,NA,0,NA,NA,NA,NA,NA,NA,https://www.who.int/csr/don/2009_04_27/en/,DON-2009-04-27
2009-H1 Influenza-MEX,3,2009,4/27/2009,H1N1,NA,Mexico,MEX,NA,NA,NA,NA,NA,NA,yes,NA,NA,26,NA,NA,NA,7,NA,NA,NA,NA,NA,NA,https://www.who.int/csr/don/2009_04_27/en/,DON-2009-04-27
2009-H1 Influenza-CAN,3,2009,4/27/2009,H1N1,NA,Canada,CAN,NA,NA,NA,NA,NA,NA,NA,NA,NA,NA,NA,NA,6,0,NA,NA,NA,NA,NA,NA,https://www.who.int/csr/don/2009_04_27/en/,DON-2009-04-27
2009-H1 Influenza-ESP,3,2009,4/27/2009,H1N1,NA,Spain,ESP,NA,NA,NA,NA,NA,NA,NA,NA,NA,1,NA,NA,NA,0,NA,NA,NA,NA,NA,NA,https://www.who.int/csr/don/2009_04_27/en/,DON-2009-04-27
2009-H1 Influenza-USA,3,2009,4/28/2009,H1N1,NA,United States of America,USA,NA,NA,NA,NA,NA,NA,NA,NA,NA,64,NA,NA,NA,0,NA,NA,NA,NA,NA,NA,https://www.who.int/csr/don/2009_04_28/en/,DON-2009-04-28
2009-H1 Influenza-MEX,3,2009,4/28/2009,H1N1,NA,Mexico,MEX,NA,NA,NA,NA,NA,NA,NA,NA,NA,26,NA,NA,NA,7,NA,NA,NA,NA,NA,NA,https://www.who.int/csr/don/2009_04_28/en/,DON-2009-04-28
2009-H1 Influenza-CAN,3,2009,4/28/2009,H1N1,NA,Canada,CAN,NA,NA,NA,NA,NA,NA,NA,NA,NA,6,NA,NA,NA,0,NA,NA,NA,NA,NA,NA,https://www.who.int/csr/don/2009_04_28/en/,DON-2009-04-28
2009-H1 Influenza-NZL,3,2009,4/28/2009,H1N1,NA,New Zealand,NZL,NA,NA,NA,NA,NA,NA,NA,NA,NA,3,NA,NA,NA,0,NA,NA,NA,NA,NA,NA,https://www.who.int/csr/don/2009_04_28/en/,DON-2009-04-28
2009-H1 Influenza-GBR,3,2009,4/28/2009,H1N1,NA,United Kingdom,GBR,NA,NA,NA,NA,NA,NA,NA,NA,NA,2,NA,NA,NA,0,NA,NA,NA,NA,NA,NA,https://www.who.int/csr/don/2009_04_28/en/,DON-2009-04-28
2009-H1 Influenza-ISR,3,2009,4/28/2009,H1N1,NA,Israel,ISR,NA,NA,NA,NA,NA,NA,NA,NA,NA,2,NA,NA,NA,0,NA,NA,NA,NA,NA,NA,https://www.who.int/csr/don/2009_04_28/en/,DON-2009-04-28
2009-H1 Influenza-ESP,3,2009,4/28/2009,H1N1,NA,Spain,ESP,NA,NA,NA,NA,NA,NA,NA,NA,NA,2,NA,NA,NA,0,NA,NA,NA,NA,NA,NA,https://www.who.int/csr/don/2009_04_28/en/,DON-2009-04-28
2009-Yellow Fever-COG,6,2009,4/30/2009,Yellow fever,NA,Republic of the Congo,COG,Mbama,NA,1/28/2009,NA,4/1/2009,yes,yes,NA,NA,NA,NA,NA,NA,NA,NA,3/23/2009,NA,NA,NA,NA,https://www.who.int/csr/don/2009_04_30/en/,DON-2009-04-30
2009-H1 Influenza-Global,3,2009,4/30/2009,H1N1,NA,Global,NA,11 countries,NA,NA,NA,NA,NA,yes,NA,NA,257,NA,NA,NA,8,NA,NA,NA,NA,NA,"*DONs has not yet switched to pandemic language yet, but I'll be classifying this as global from here on out",https://www.who.int/csr/don/2009_04_30_a/en/,DON-2009-04-30-a
2009-H1 Influenza-Global,3,2009,5/1/2009,H1N1,NA,Global,NA,13 countries,NA,NA,NA,5/1/2019,NA,yes,NA,NA,367,NA,NA,NA,10,NA,NA,NA,NA,NA,NA,https://www.who.int/csr/don/2009_05_01a/en/,DON-2009-05-01a
2009-H1 Influenza-Global,3,2009,5/2/2009,H1N1,NA,Global,NA,15 countries,NA,NA,NA,5/2/2009,NA,yes,NA,NA,615,NA,NA,NA,17,NA,NA,NA,NA,NA,NA,https://www.who.int/csr/don/2009_05_02/en/,DON-2009-05-02
2009-H1 Influenza-Global,3,2009,5/2/2009,H1N1,NA,Global,NA,16 countries,NA,NA,NA,5/2/2009,NA,yes,NA,NA,658,NA,NA,NA,17,NA,NA,NA,NA,NA,update from a few hours later,https://www.who.int/csr/don/2009_05_02a/en/,DON-2009-05-02a
2009-H1 Influenza-Global,3,2009,5/3/2009,H1N1,NA,Global,NA,17 countries,NA,NA,NA,5/3/2009,NA,yes,NA,NA,787,NA,NA,NA,20,NA,NA,NA,NA,NA,NA,https://www.who.int/csr/don/2009_05_03/en/,DON-2009-05-03
2009-H1 Influenza-Global,3,2009,5/3/2009,H1N1,NA,Global,NA,18 countries,NA,NA,NA,5/3/2009,NA,yes,NA,NA,898,NA,NA,NA,20,NA,NA,NA,NA,NA,NA,https://www.who.int/csr/don/2009_05_03a/en/,DON-2009-05-03a
2009-H1 Influenza-Global,3,2009,5/4/2009,H1N1,NA,Global,NA,20 countries,NA,NA,NA,5/4/2009,NA,yes,NA,NA,985,NA,NA,NA,26,NA,NA,NA,NA,NA,NA,https://www.who.int/csr/don/2009_05_04/en/,DON-2009-05-04
2009-H1 Influenza-Global,3,2009,5/4/2009,H1N1,NA,Global,NA,21 countries,NA,NA,NA,5/4/2009,NA,yes,NA,NA,1085,NA,NA,NA,26,NA,NA,NA,NA,NA,NA,https://www.who.int/csr/don/2009_05_04a/en/,DON-2009-05-04a
2009-H1 Influenza-Global,3,2009,5/5/2009,H1N1,NA,Global,NA,21 countries,NA,NA,NA,5/5/2009,NA,yes,NA,NA,1124,NA,NA,NA,26,NA,NA,NA,NA,NA,NA,https://www.who.int/csr/don/2009_05_05/en/,DON-2009-05-05
2009-H1 Influenza-Global,3,2009,5/5/2009,H1N1,NA,Global,NA,21 countries,NA,NA,NA,5/5/2009,NA,yes,NA,NA,1490,NA,NA,NA,30,NA,NA,NA,NA,NA,NA,https://www.who.int/csr/don/2009_05_05a/en/,DON-2009-05-05a
2009-H1 Influenza-Global,3,2009,5/6/2009,H1N1,NA,Global,NA,22 countries,NA,NA,NA,5/6/2009,NA,yes,NA,NA,1516,NA,NA,NA,30,NA,NA,NA,NA,NA,NA,https://www.who.int/csr/don/2009_05_06/en/,DON-2009-05-06
2009-Yellow Fever-LBR,6,2009,5/6/2009,Yellow fever,NA,Liberia,LBR,Luyema town,2/28/2009,3/28/2009,NA,4/15/2009,NA,yes,NA,NA,1,NA,NA,NA,NA,NA,yes,NA,NA,NA,NA,https://www.who.int/csr/don/2009_05_06a/en/,DON-2009-05-06a
2009-H5 Influenza-EGY,3,2009,5/6/2009,H5N1,NA,Egypt,EGY,Tanta,4/21/2009,4/21/2009,NA,yes,yes,4/23/2009,NA,NA,68,NA,NA,NA,23,NA,yes,NA,NA,NA,NA,https://www.who.int/csr/don/2009_05_06b/en/,DON-2009-05-06b
2009-H5 Influenza-VNM,3,2009,5/6/2009,H5N1,NA,Vietnam,VNM,Quan Hoa,4/16/2009,4/21/2009,NA,yes,NA,yes,NA,NA,111,NA,NA,NA,56,NA,yes,NA,NA,NA,NA,https://www.who.int/csr/don/2009_05_06c/en/,DON-2009-05-06c
2009-H1 Influenza-Global,3,2009,5/6/2009,H1N1,NA,Global,NA,23 countries,NA,NA,NA,5/6/2009,NA,yes,NA,NA,1893,NA,NA,NA,31,NA,NA,NA,NA,NA,NA,https://www.who.int/csr/don/2009_05_06d/en/,DON-2009-05-06d
2009-H1 Influenza-Global,3,2009,5/7/2009,H1N1,NA,Global,NA,23 countries,NA,NA,NA,5/7/2009,NA,yes,NA,NA,2099,NA,NA,NA,44,NA,NA,NA,NA,NA,NA,https://www.who.int/csr/don/2009_05_07/en/,DON-2009-05-07
2009-H1 Influenza-Global,3,2009,5/7/2009,H1N1,NA,Global,NA,24 countries,NA,NA,NA,5/7/2009,NA,yes,NA,NA,2371,NA,NA,NA,44,NA,NA,NA,NA,NA,NA,https://www.who.int/csr/don/2009_05_07a/en/,DON-2009-05-07a
2009-H1 Influenza-Global,3,2009,5/8/2009,H1N1,NA,Global,NA,24 countries,NA,NA,NA,5/8/2009,NA,yes,NA,NA,2384,NA,NA,NA,44,NA,NA,NA,NA,NA,NA,https://www.who.int/csr/don/2009_05_08/en/,DON-2009-05-08
2009-H1 Influenza-Global,3,2009,5/8/2009,H1N1,NA,Global,NA,25 countries,NA,NA,NA,5/8/2009,NA,yes,NA,NA,2500,NA,NA,NA,46,NA,NA,NA,NA,NA,NA,https://www.who.int/csr/don/2009_05_08a/en/,DON-2009-05-08a
2009-H1 Influenza-Global,3,2009,5/9/2009,H1N1,NA,Global,NA,29 countries,NA,NA,NA,5/9/2009,NA,yes,NA,NA,3440,NA,NA,NA,48,NA,NA,NA,NA,NA,NA,https://www.who.int/csr/don/2009_05_09/en/,DON-2009-05-09
2009-H1 Influenza-Global,3,2009,5/10/2009,H1N1,NA,Global,NA,29 countries,NA,NA,NA,5/10/2009,NA,yes,NA,NA,4379,NA,NA,NA,49,NA,NA,NA,NA,NA,NA,https://www.who.int/csr/don/2009_05_10/en/,DON-2009-05-10
2009-H1 Influenza-Global,3,2009,5/11/2009,H1N1,NA,Global,NA,30 countries,NA,NA,NA,5/11/2009,NA,yes,NA,NA,4694,NA,NA,NA,53,NA,NA,NA,NA,NA,NA,https://www.who.int/csr/don/2009_05_11/en/,DON-2009-05-11
2009-H1 Influenza-Global,3,2009,5/12/2009,H1N1,NA,Global,NA,30 countries,NA,NA,NA,5/12/2009,NA,yes,NA,NA,5251,NA,NA,NA,61,NA,NA,NA,NA,NA,NA,https://www.who.int/csr/don/2009_05_12/en/,DON-2009-05-12
2009-H1 Influenza-Global,3,2009,5/13/2009,H1N1,NA,Global,NA,33 countries,NA,NA,NA,5/13/2009,NA,yes,NA,NA,5728,NA,NA,NA,61,NA,NA,NA,NA,NA,NA,https://www.who.int/csr/don/2009_05_13/en/,DON-2009-05-13
2009-H1 Influenza-Global,3,2009,5/14/2009,H1N1,NA,Global,NA,33 countries,NA,NA,NA,5/14/2009,NA,yes,NA,NA,6497,NA,NA,NA,65,NA,NA,NA,NA,NA,NA,https://www.who.int/csr/don/2009_05_14/en/,DON-2009-05-14
2009-H5 Influenza-EGY,3,2009,5/15/2009,H5N1,NA,Egypt,EGY,Tama,5/7/2009,5/9/2009,NA,yes,NA,5/10/2009,NA,NA,69,NA,NA,NA,26,NA,yes,NA,NA,NA,NA,https://www.who.int/csr/don/2009_05_15a/en/,DON-2009-05-15a
2009-H1 Influenza-Global,3,2009,5/15/2009,H1N1,NA,Global,NA,34 countries,NA,NA,NA,5/15/2009,NA,yes,NA,NA,7520,NA,NA,NA,65,NA,NA,NA,NA,NA,NA,https://www.who.int/csr/don/2009_05_15/en/,DON-2009-05-15
2009-H1 Influenza-Global,3,2009,5/16/2009,H1N1,NA,Global,NA,36 countries,NA,NA,NA,5/16/2009,NA,yes,NA,NA,8451,NA,NA,NA,72,NA,NA,NA,NA,NA,NA,https://www.who.int/csr/don/2009_05_16/en/,DON-2009-05-16
2009-H1 Influenza-Global,3,2009,5/17/2009,H1N1,NA,Global,NA,39 countries,NA,NA,NA,5/17/2009,NA,yes,NA,NA,2895,NA,NA,NA,72,NA,NA,NA,NA,NA,NA,https://www.who.int/csr/don/2009_05_17/en/,DON-2009-05-17
2009-H1 Influenza-Global,3,2009,5/18/2009,H1N1,NA,Global,NA,40 countries,NA,NA,NA,5/18/2009,NA,yes,NA,NA,8829,NA,NA,NA,74,NA,NA,NA,NA,NA,NA,https://www.who.int/csr/don/2009_05_18/en/,DON-2009-05-18
2009-H1 Influenza-Global,3,2009,5/19/2009,H1N1,NA,Global,NA,40 countries,NA,NA,NA,5/19/2009,NA,yes,NA,NA,9830,NA,NA,NA,79,NA,NA,NA,NA,NA,NA,https://www.who.int/csr/don/2009_05_19/en/,DON-2009-05-19
2009-H1 Influenza-Global,3,2009,5/20/2009,H1N1,NA,Global,NA,41 countries,NA,NA,NA,5/20/2009,NA,yes,NA,NA,10243,NA,NA,NA,80,NA,NA,NA,NA,NA,NA,https://www.who.int/csr/don/2009_05_20/en/,DON-2009-05-20
2009-H1 Influenza-Global,3,2009,5/21/2009,H1N1,NA,Global,NA,41 countries,NA,NA,NA,5/21/2009,NA,yes,NA,NA,11034,NA,NA,NA,85,NA,NA,NA,NA,NA,NA,https://www.who.int/csr/don/2009_05_21/en/,DON-2009-05-21
2009-H1 Influenza-Global,3,2009,5/22/2009,H1N1,NA,Global,NA,42 countries,NA,NA,NA,5/22/2009,NA,yes,NA,NA,11168,NA,NA,NA,86,NA,NA,NA,NA,NA,NA,https://www.who.int/csr/don/2009_05_22/en/,DON-2009-05-22
2009-H5 Influenza-EGY,3,2009,5/22/2009,H5N1,NA,Egypt,EGY,"Kafr Sakr, Mahalla, Meet Ghamr, Sherbin, Sohag",5/9/2009,5/17/2009,NA,5/20/2009,NA,yes,NA,NA,74,NA,NA,NA,27,NA,NA,NA,NA,NA,NA,https://www.who.int/csr/don/2009_05_22a/en/,DON-2009-05-22a
2009-H1 Influenza-Global,3,2009,5/23/2009,H1N1,NA,Global,NA,43 countries,NA,NA,NA,5/23/2009,NA,yes,NA,NA,12022,NA,NA,NA,86,NA,NA,NA,NA,NA,NA,https://www.who.int/csr/don/2009_05_23/en/,DON-2009-05-23
2009-H1 Influenza-Global,3,2009,5/25/2009,H1N1,NA,Global,NA,46 countries,NA,NA,NA,5/25/2009,NA,yes,NA,NA,12515,NA,NA,NA,91,NA,NA,NA,NA,NA,NA,https://www.who.int/csr/don/2009_05_25/en/,DON-2009-05-25
2009-H1 Influenza-Global,3,2009,5/26/2009,H1N1,NA,Global,NA,46 countries,NA,NA,NA,5/26/2009,NA,yes,NA,NA,12954,NA,NA,NA,92,NA,NA,NA,NA,NA,NA,https://www.who.int/csr/don/2009_05_26/en/,DON-2009-05-26
2009-H1 Influenza-Global,3,2009,5/27/2009,H1N1,NA,Global,NA,48 countries,NA,NA,NA,5/27/2009,NA,yes,NA,NA,13398,NA,NA,NA,95,NA,NA,NA,NA,NA,NA,https://www.who.int/csr/don/2009_05_27a/en/,DON-2009-05-27a
2009-H1 Influenza-Global,3,2009,5/27/2009,H1N1,NA,Global,NA,46 countries,NA,NA,NA,5/26/2009,NA,yes,NA,NA,12954,NA,NA,NA,92,NA,NA,NA,NA,NA,**this is the same report published on the 26th,https://www.who.int/csr/don/2009_05_27/en/,DON-2009-05-27
2009-H5 Influenza-EGY,3,2009,5/28/2009,H5N1,NA,Egypt,EGY,"Hehia, Abo Hammad",5/23/2009,NA,NA,yes,NA,5/26/2009,NA,NA,76,NA,NA,NA,27,NA,yes,NA,NA,NA,NA,https://www.who.int/csr/don/2009_05_28/en/,DON-2009-05-28
2009-H1 Influenza-Global,3,2009,5/29/2009,H1N1,NA,Global,NA,53 countries,NA,NA,NA,5/29/2009,NA,yes,NA,NA,15510,NA,NA,NA,99,NA,NA,NA,NA,NA,NA,https://www.who.int/csr/don/2009_05_29/en/,DON-2009-05-29
2009-H5 Influenza-EGY,3,2009,6/1/2009,H5N1,NA,Egypt,EGY,Dekernes,5/25/2009,5/29/2009,NA,yes,NA,yes,NA,NA,77,NA,NA,NA,27,NA,yes,NA,NA,NA,NA,https://www.who.int/csr/don/2009_06_01/en/,DON-2009-06-01
2009-H1 Influenza-Global,3,2009,6/1/2009,H1N1,NA,Global,NA,62 countries,NA,NA,NA,6/1/2009,NA,yes,NA,NA,17410,NA,NA,NA,115,NA,NA,NA,NA,NA,NA,https://www.who.int/csr/don/2009_06_01a/en/,DON-2009-06-01a
2009-H5 Influenza-EGY,3,2009,6/2/2009,H5N1,NA,Egypt,EGY,Kefr El Sheikh,5/30/2009,5/31/2009,NA,6/1/2009,NA,yes,NA,NA,78,NA,NA,NA,27,NA,yes,NA,NA,NA,NA,https://www.who.int/csr/don/2009_06_02/en/,DON-2009-06-02
2009-H1 Influenza-Global,3,2009,6/3/2009,H1N1,NA,Global,NA,66 countries,NA,NA,NA,6/3/2009,NA,yes,NA,NA,19273,NA,NA,NA,117,NA,NA,NA,NA,NA,NA,https://www.who.int/csr/don/2009_06_03/en/,DON-2009-06-03
2009-H1 Influenza-Global,3,2009,6/5/2009,H1N1,NA,Global,NA,69 countries,NA,NA,NA,6/5/2009,NA,yes,NA,NA,21940,NA,NA,NA,125,NA,NA,NA,NA,NA,NA,https://www.who.int/csr/don/2009_06_05/en/,DON-2009-06-05
2009-H1 Influenza-Global,3,2009,6/8/2009,H1N1,NA,Global,NA,73 countries,NA,NA,NA,6/8/2009,NA,yes,NA,NA,25288,NA,NA,NA,139,NA,NA,NA,NA,NA,NA,https://www.who.int/csr/don/2009_06_08/en/,DON-2009-06-08
2008-Cholera-ZWE,5,2009,6/9/2009,Cholera,NA,Zimbabwe,ZWE,55 districts,NA,NA,NA,08/??/2008,NA,NA,NA,NA,NA,NA,98424,NA,4276,4.3,yes,NA,NA,NA,NA,https://www.who.int/csr/don/2009_06_09/en/,DON-2009-06-09
2009-H1 Influenza-Global,3,2009,6/10/2009,H1N1,NA,Global,NA,74 countries,NA,NA,NA,6/10/2009,NA,yes,NA,NA,27737,NA,NA,NA,141,NA,NA,NA,NA,NA,NA,https://www.who.int/csr/don/2009_06_10a/en/,DON-2009-06-10a
2009-H1 Influenza-Global,3,2009,6/11/2009,H1N1,NA,Global,NA,74 countries,NA,NA,NA,6/11/2009,NA,yes,NA,NA,28774,NA,NA,NA,144,NA,NA,NA,NA,NA,NA,https://www.who.int/csr/don/2009_06_11/en/,DON-2009-06-11
2009-H1 Influenza-Global,3,2009,6/12/2009,H1N1,NA,Global,NA,74 countries,NA,NA,NA,6/12/2009,NA,yes,NA,NA,29669,NA,NA,NA,145,NA,NA,NA,NA,NA,NA,https://www.who.int/csr/don/2009_06_12/en/,DON-2009-06-12
2009-H1 Influenza-Global,3,2009,6/15/2009,H1N1,NA,Global,NA,76 countries,NA,NA,NA,6/15/2009,NA,yes,NA,NA,35928,NA,NA,NA,163,NA,NA,NA,NA,NA,NA,https://www.who.int/csr/don/2009_06_15/en/,DON-2009-06-15
2009-H1 Influenza-Global,3,2009,6/17/2009,H1N1,NA,Global,NA,NA,NA,NA,NA,yes,NA,yes,NA,NA,39620,NA,NA,NA,167,NA,NA,NA,NA,NA,NA,https://www.who.int/csr/don/2009_06_17/en/,DON-2009-06-17
2009-H1 Influenza-Global,3,2009,6/19/2009,H1N1,NA,Global,NA,NA,NA,NA,NA,yes,NA,yes,NA,NA,44287,NA,NA,NA,180,NA,NA,NA,NA,NA,NA,https://www.who.int/csr/don/2009_06_19/en/,DON-2009-06-19
2009-H1 Influenza-Global,3,2009,6/22/2009,H1N1,NA,Global,NA,NA,NA,NA,NA,yes,NA,yes,NA,NA,52160,NA,NA,NA,231,NA,NA,NA,NA,NA,NA,https://www.who.int/csr/don/2009_06_22/en/,DON-2009-06-22
2009-H1 Influenza-Global,3,2009,6/24/2009,H1N1,NA,Global,NA,NA,NA,NA,NA,yes,NA,yes,NA,NA,55867,NA,NA,NA,238,NA,NA,NA,NA,NA,NA,https://www.who.int/csr/don/2009_06_24/en/,DON-2009-06-24
2009-H1 Influenza-Global,3,2009,6/26/2009,H1N1,NA,Global,NA,NA,NA,NA,NA,yes,NA,yes,NA,NA,59814,NA,NA,NA,263,NA,NA,NA,NA,NA,NA,https://www.who.int/csr/don/2009_06_26/en/,DON-2009-06-26
2009-H1 Influenza-Global,3,2009,6/29/2009,H1N1,NA,Global,NA,NA,NA,NA,NA,yes,NA,yes,NA,NA,70893,NA,NA,NA,311,NA,NA,NA,NA,NA,NA,https://www.who.int/csr/don/2009_06_29/en/,DON-2009-06-29
2009-H1 Influenza-Global,3,2009,7/1/2009,H1N1,NA,Global,NA,NA,NA,NA,NA,yes,NA,yes,NA,NA,77201,NA,NA,NA,332,NA,NA,NA,NA,NA,NA,https://www.who.int/csr/don/2009_07_01a/en/,DON-2009-07-01a
2009-H5 Influenza-EGY,3,2009,7/1/2009,H5N1,NA,Egypt,EGY,"Domiat, Dakhlia, Kaleen",6/1/2009,6/2/2009,NA,yes,NA,yes,NA,NA,81,NA,NA,NA,27,NA,yes,NA,NA,NA,NA,https://www.who.int/csr/don/2009_07_01/en/,DON-2009-07-01
2009-H1 Influenza-Global,3,2009,7/3/2009,H1N1,NA,Global,NA,NA,NA,NA,NA,yes,NA,yes,NA,NA,89921,NA,NA,NA,382,NA,NA,NA,NA,NA,NA,https://www.who.int/csr/don/2009_07_03/en/,DON-2009-07-03
2009-H1 Influenza-Global,3,2009,7/6/2009,H1N1,NA,Global,NA,NA,NA,NA,NA,yes,NA,yes,NA,NA,94512,NA,NA,NA,429,NA,NA,NA,NA,NA,NA,https://www.who.int/csr/don/2009_07_06/en/,DON-2009-07-06
2009-WPV-NGA,5,2009,7/17/2009,WPV3,NA,Nigeria,NGA,northern states,NA,NA,NA,NA,NA,NA,NA,NA,NA,NA,NA,258,NA,NA,yes,NA,NA,NA,NA,https://www.who.int/csr/don/2009_07_17/en/,DON-2009-07-17
2009-cVDPV-NGA,1,2009,7/17/2009,cVDPV2,NA,Nigeria,NGA,northern states,NA,NA,NA,NA,NA,NA,NA,NA,NA,NA,NA,103,NA,NA,yes,NA,NA,NA,NA,https://www.who.int/csr/don/2009_07_17/en/,DON-2009-07-17
2009-H1 Influenza-Global,3,2009,7/27/2009,H1N1,NA,Global,NA,NA,NA,NA,NA,yes,NA,yes,NA,NA,134503,NA,NA,NA,816,NA,NA,NA,NA,NA,NA,https://www.who.int/csr/don/2009_07_27/en/,DON-2009-07-27
2009-H1 Influenza-Global,3,2009,8/4/2009,H1N1,NA,Global,NA,168 countries,NA,NA,NA,7/31/2009,NA,yes,NA,NA,162380,NA,NA,NA,1154,NA,NA,NA,NA,NA,NA,https://www.who.int/csr/don/2009_08_04/en/,DON-2009-08-04
2009-Plague-CHN,2,2009,8/11/2009,Plague,NA,China,CHN,Ziketan,7/26/2009,NA,NA,8/1/2009,NA,8/1/2009,NA,NA,12,NA,NA,NA,3,NA,yes,NA,NA,NA,NA,https://www.who.int/csr/don/2009_08_11/en/,DON-2009-08-11
2009-H5 Influenza-EGY,3,2009,8/11/2009,H5N1,NA,Egypt,EGY,"Kfr Elsheikh, Shebin Elkom",7/24/2009,7/25/2009,NA,yes,NA,yes,NA,NA,83,NA,NA,NA,27,NA,yes,NA,NA,NA,NA,https://www.who.int/csr/don/2009_08_11a/en/,DON-2009-08-11a
2009-H1 Influenza-Global,3,2009,8/12/2009,H1N1,NA,Global,NA,over 170 countries,NA,NA,NA,8/6/2009,NA,yes,NA,NA,177457,NA,NA,NA,1462,NA,NA,NA,NA,NA,NA,https://www.who.int/csr/don/2009_08_12/en/,DON-2009-08-12
2009-H1 Influenza-Global,3,2009,8/21/2009,H1N1,NA,Global,NA,NA,NA,NA,NA,8/13/2009,NA,yes,NA,NA,182166,NA,NA,NA,1799,NA,NA,NA,NA,NA,the number of cases reported actually understates the real number of cases.,https://www.who.int/csr/don/2009_08_21/en/,DON-2009-08-21
2009-H5 Influenza-EGY,3,2009,8/31/2009,H5N1,NA,Egypt,EGY,"Menofyia, Damitta",8/21/2009,8/23/2009,NA,yes,NA,yes,NA,NA,85,NA,NA,NA,27,NA,yes,NA,NA,NA,NA,https://www.who.int/csr/don/2009_08_31/en/,DON-2009-08-31
2009-H1 Influenza-Global,3,2009,9/4/2009,H1N1,NA,Global,NA,NA,NA,NA,NA,8/30/2009,NA,yes,NA,NA,254206,NA,NA,NA,2837,NA,NA,NA,NA,NA,NA,https://www.who.int/csr/don/2009_09_04/en/,DON-2009-09-04
2009-H1 Influenza-Global,3,2009,9/11/2009,H1N1,NA,Global,NA,NA,NA,NA,NA,9/6/2009,NA,yes,NA,NA,277607,NA,NA,NA,3205,NA,NA,NA,NA,NA,NA,https://www.who.int/csr/don/2009_09_11/en/,DON-2009-09-11
2009-H1 Influenza-Global,3,2009,9/18/2009,H1N1,NA,Global,NA,NA,NA,NA,NA,9/13/2009,NA,yes,NA,NA,296471,NA,NA,NA,3486,NA,NA,NA,NA,NA,NA,https://www.who.int/csr/don/2009_09_18/en/,DON-2009-09-18
2009-H5 Influenza-EGY,3,2009,9/24/2009,H5N1,NA,Egypt,EGY,"Alexandria, Tahrer",9/13/2009,9/14/2009,NA,yes,NA,yes,NA,NA,87,NA,NA,NA,27,NA,yes,NA,NA,NA,NA,https://www.who.int/csr/don/2009_09_24/en/,DON-2009-09-24
2009-H1 Influenza-Global,3,2009,9/20/2009,H1N1,NA,Global,NA,191 countries,NA,NA,NA,9/20/2009,NA,yes,NA,NA,318925,NA,NA,NA,3917,NA,NA,NA,NA,NA,NA,https://www.who.int/csr/don/2009_09_25/en/,DON-2009-09-25
2009-Yellow Fever-CMR,6,2009,10/1/2009,Yellow fever,NA,Cameroon,CMR,Kotton 1- Bomboko Village,7/27/2009,NA,NA,9/8/2009,NA,yes,NA,NA,1,NA,NA,NA,NA,NA,yes,NA,NA,NA,NA,https://www.who.int/csr/don/2009_10_01/en/,DON-2009-10-01
2009-H1 Influenza-Global,3,2009,10/2/2009,H1N1,NA,Global,NA,NA,NA,NA,NA,9/27/2009,NA,yes,NA,NA,343298,NA,NA,NA,4108,NA,yes,NA,NA,NA,NA,https://www.who.int/csr/don/2009_10_02/en/,DON-2009-10-02
2009-H1 Influenza-Global,3,2009,10/9/2009,H1N1,NA,Global,NA,NA,NA,NA,NA,10/4/2009,NA,yes,NA,NA,378223,NA,NA,NA,4525,NA,yes,NA,NA,NA,NA,https://www.who.int/csr/don/2009_10_09/en/,DON-2009-10-09
2009-H1 Influenza-Global,3,2009,10/16/2009,H1N1,NA,Global,NA,NA,NA,NA,NA,10/11/2009,NA,yes,NA,NA,299232,NA,NA,NA,4735,NA,yes,NA,NA,NA,NA,https://www.who.int/csr/don/2009_10_16/en/,DON-2009-10-16
2009-H1 Influenza-Global,3,2009,10/23/2009,H1N1,NA,Global,NA,NA,NA,NA,NA,10/17/2009,NA,yes,NA,NA,414945,NA,NA,NA,4999,NA,yes,NA,NA,NA,NA,https://www.who.int/csr/don/2009_10_23/en/,DON-2009-10-23
2009-H1 Influenza-Global,3,2009,10/30/2009,H1N1,NA,Global,NA,NA,NA,NA,NA,10/25/2009,NA,yes,NA,NA,441661,NA,NA,NA,5712,NA,yes,NA,NA,NA,NA,https://www.who.int/csr/don/2009_10_30/en/,DON-2009-10-30
2009-Dengue-CPV,6,2009,10/30/2009,Dengue Fever,NA,Cape Verde,CPV,"Brava, Fogo, Maio, Santiago islands",NA,NA,NA,10/28/2009,NA,yes,NA,NA,NA,NA,3367,NA,NA,NA,yes,NA,NA,NA,NA,https://www.who.int/csr/don/2009_10_30a/en/,DON-2009-10-30a
2009-H1 Influenza-Global,3,2009,11/1/2009,H1N1,NA,Ukraine,UKR,"Ternopil, Lviv, Ivano-Frankivsk, and Chernivtsi regions",NA,NA,NA,10/28/2009,NA,10/30/2009,NA,NA,11,NA,NA,2300,NA,NA,yes,NA,NA,NA,unusally high level of activity of acute respiratory illnesses,https://www.who.int/csr/don/2009_11_01/en/,DON-2009-11-01
2009-H1 Influenza-Global,3,2009,11/3/2009,H1N1,NA,Ukraine,UKR,NA,NA,NA,NA,11/2/2009,NA,yes,NA,NA,NA,NA,NA,250000,70,NA,yes,NA,NA,NA,NA,https://www.who.int/csr/don/2009_11_03/en/,DON-2009-11-03
2009-H1 Influenza-Global,3,2009,11/6/2009,H1N1,NA,Global,NA,199 countries,NA,NA,NA,11/1/2009,NA,yes,NA,NA,482300,NA,NA,NA,6071,NA,yes,NA,NA,NA,NA,https://www.who.int/csr/don/2009_11_06/en/,DON-2009-11-06
2009-H1 Influenza-Global,3,2009,11/13/2009,H1N1,NA,Global,NA,206 countries/territories,NA,NA,NA,11/8/2009,NA,yes,NA,NA,503536,NA,NA,NA,6260,NA,yes,NA,NA,NA,NA,https://www.who.int/csr/don/2009_11_13/en/,DON-2009-11-13
2009-H1 Influenza-Global,3,2009,11/17/2009,H1N1,NA,Ukraine,UKR,NA,NA,NA,NA,NA,NA,yes,NA,NA,NA,NA,NA,NA,NA,NA,yes,NA,NA,NA,no significant changes in the virus,https://www.who.int/csr/don/2009_11_16/en/,DON-2009-11-16
2009-Dengue-CPV,6,2009,11/18/2009,Dengue Fever,NA,Cape Verde,CPV,"Brava, Fogo, Maio, Sal, Santiago",NA,NA,NA,11/16/2009,NA,NA,NA,NA,NA,NA,16744,NA,NA,NA,yes,yes,NA,NA,NA,https://www.who.int/csr/don/2009_11_18/en/,DON-2009-11-18
2009-H1 Influenza-Global,3,2009,11/20/2009,H1N1,NA,Global,NA,206 countries,NA,NA,NA,11/15/2009,NA,yes,NA,NA,526060,NA,NA,NA,6670,NA,yes,NA,NA,NA,NA,https://www.who.int/csr/don/2009_11_20a/en/,DON-2009-11-20a
2009-H5 Influenza-EGY,3,2009,11/20/2009,H5N1,NA,Egypt,EGY,Sedy Bashir,11/11/2009,11/15/2009,NA,yes,NA,yes,NA,NA,88,NA,NA,NA,27,NA,yes,NA,NA,NA,NA,https://www.who.int/csr/don/2009_11_20/en/,DON-2009-11-20
2009-H1 Influenza-Global,3,2009,11/27/2009,H1N1,NA,Global,NA,207 countries,NA,NA,NA,11/22/2009,NA,yes,NA,NA,622482,NA,NA,NA,7826,NA,yes,NA,NA,NA,NA,https://www.who.int/csr/don/2009_11_27a/en/,DON-2009-11-27a
2009-H5 Influenza-EGY,3,2009,11/27/2009,H5N1,NA,Egypt,EGY,Minia,11/21/2009,11/22/2009,NA,yes,NA,yes,NA,NA,89,NA,NA,NA,27,NA,yes,NA,NA,NA,NA,https://www.who.int/csr/don/2009_11_27/en/,DON-2009-11-27
2009-Yellow Fever-CAF,6,2009,12/1/2009,Yellow fever,NA,Central African Republic,CAF,"Yaloké-Bossembelle, Bagamongone",11/6/2009,NA,NA,11/14/2009,yes,yes,NA,NA,3,NA,4,NA,3,NA,yes,NA,NA,NA,NA,https://www.who.int/csr/don/2009_12_01/en/,DON-2009-12-01
2009-H1 Influenza-Global,3,2009,12/4/2009,H1N1,NA,Global,NA,207 countries,NA,NA,NA,11/29/2009,NA,yes,NA,NA,NA,NA,NA,NA,8768,NA,yes,NA,NA,NA,NA,https://www.who.int/csr/don/2009_12_04/en/,DON-2009-12-04
2009-H1 Influenza-Global,3,2009,12/11/2009,H1N1,NA,Global,NA,208 countries,NA,NA,NA,12/6/2009,NA,yes,NA,NA,NA,NA,NA,NA,9596,NA,yes,NA,NA,NA,NA,https://www.who.int/csr/don/2009_12_11a/en/,DON-2009-12-11a
2009-H5 Influenza-VNM,3,2009,12/11/2009,H5N1,NA,Vietnam,VNM,Dien Bien Phu,11/18/2009,NA,NA,yes,NA,yes,NA,NA,112,NA,NA,NA,57,NA,yes,NA,NA,NA,NA,https://www.who.int/csr/don/2009_12_11/en/,DON-2009-12-11
2009-H1 Influenza-Global,3,2009,12/18/2009,H1N1,NA,Global,NA,208 countries,NA,NA,NA,12/13/2009,NA,yes,NA,NA,NA,NA,NA,NA,10582,NA,yes,NA,NA,NA,NA,https://www.who.int/csr/don/2009_12_18a/en/,DON-2009-12-18a
2009-H5 Influenza-KHM,3,2009,12/19/2009,H5N1,NA,Cambodia,KHM,Ponhea Kreak,12/11/2009,12/16/2009,NA,NA,NA,yes,NA,NA,9,NA,NA,NA,7,NA,yes,NA,NA,NA,NA,https://www.who.int/csr/don/2009_12_18/en/,DON-2009-12-18
2009-H5 Influenza-EGY,3,2009,12/21/2009,H5N1,NA,Egypt,EGY,El Tanta,12/15/2009,NA,NA,12/19/2009,NA,yes,NA,NA,90,NA,NA,NA,27,NA,yes,NA,NA,NA,NA,https://www.who.int/csr/don/2009_12_21/en/,DON-2009-12-21
2009-H1 Influenza-Global,3,2009,12/23/2009,H1N1,NA,Global,NA,208 countries,NA,NA,NA,12/20/2009,NA,yes,NA,NA,NA,NA,NA,NA,11516,NA,yes,NA,NA,NA,NA,https://www.who.int/csr/don/2009_12_23/en/,DON-2009-12-23
2009-H1 Influenza-Global,3,2009,12/30/2009,H1N1,NA,Global,NA,208 countries,NA,NA,NA,12/27/2009,NA,yes,NA,NA,NA,NA,NA,NA,12220,NA,yes,NA,NA,NA,NA,https://www.who.int/csr/don/2009_12_30/en/,DON-2009-12-30
2009-H1 Influenza-Global,3,2010,1/8/2010,H1N1,NA,Global,NA,"central, eastern and southeastern Europe, North Africa, and South Asia",NA,NA,NA,1/3/2010,NA,yes,NA,NA,NA,NA,NA,NA,12799,NA,yes,NA,NA,NA,NA,https://www.who.int/csr/don/2010_01_08/en/,DON-2010-01-08
2010-Yellow Fever-CIV,6,2010,1/8/2010,Yellow fever,NA,Cote d'Ivoire,CIV,"Minignan, Madinani",NA,9/5/2009,NA,9/6/2009,yes,yes,NA,NA,3,NA,10,6,NA,NA,yes,NA,NA,NA,NA,https://www.who.int/csr/don/2010_01_08a/en/,DON-2010-01-08a
2010-Yellow Fever-GIN,6,2010,1/12/2010,Yellow fever,NA,Guinea,GIN,Malikila,11/23/2009,NA,NA,1/4/2010,NA,yes,NA,NA,NA,NA,NA,NA,NA,NA,yes,NA,NA,NA,NA,https://www.who.int/csr/don/2010_01_12/en/,DON-2010-01-12
2009-H1 Influenza-Global,3,2010,1/22/2010,H1N1,NA,Global,NA,"North Africa, Sout Asia, limited areas of Eastern Europe",NA,NA,NA,1/17/2010,NA,yes,NA,NA,NA,NA,NA,NA,14142,NA,yes,NA,NA,NA,NA,https://www.who.int/csr/don/2010_01_22/en/,DON-2010-01-22
2010-H5 Influenza-EGY,3,2010,1/28/2010,H5N1,NA,Egypt,EGY,"Baniswief, Dakahalya, Assuit, Shargea",1/6/2010,1/11/2010,NA,NA,NA,yes,NA,NA,94,NA,NA,NA,27,NA,yes,NA,NA,NA,NA,https://www.who.int/csr/don/2010_01_28/en/,DON-2010-01-28
2009-H1 Influenza-Global,3,2010,1/29/2010,H1N1,NA,Global,NA,"North Africa, limited areas of eastern and southeastern Europe, and in parts of South and East Asia",NA,NA,NA,1/24/2010,NA,yes,NA,NA,NA,NA,NA,NA,14711,NA,yes,NA,NA,NA,NA,https://www.who.int/csr/don/2010_01_29/en/,DON-2010-01-29
2009-H1 Influenza-Global,3,2010,2/5/2010,H1N1,NA,Global,NA,"North Africa, limited areas of Eastern Europe and East Asia",NA,NA,NA,1/31/2010,NA,yes,NA,NA,NA,NA,NA,NA,15174,NA,yes,NA,NA,NA,NA,https://www.who.int/csr/don/2010_02_5/en/,DON-2010-02-5
2010-H5 Influenza-EGY,3,2010,2/8/2010,H5N1,NA,Egypt,EGY,"Banha, Alsadat",1/27/2010,2/3/2010,NA,NA,NA,yes,NA,NA,96,NA,NA,NA,27,NA,yes,NA,NA,NA,NA,https://www.who.int/csr/don/2010_02_08/en/,DON-2010-02-08
2010-H5 Influenza-EGY,3,2010,2/10/2010,H5N1,NA,Egypt,EGY,Helwan,1/31/2010,2/6/2010,NA,NA,NA,yes,NA,NA,97,NA,NA,NA,27,NA,NA,NA,NA,NA,NA,https://www.who.int/csr/don/2010_02_10/en/,DON-2010-02-10
2009-H1 Influenza-Global,3,2010,2/12/2010,H1N1,NA,Global,NA,"northern Africa, South Asia, and East Asia",NA,NA,NA,2/7/2010,NA,yes,NA,NA,NA,NA,NA,NA,15292,NA,yes,NA,NA,NA,NA,https://www.who.int/csr/don/2010_02_12/en/,DON-2010-02-12
2010-H5 Influenza-IDN,3,2010,2/12/2010,H5N1,NA,Indonesia,IDN,South Jakarta,NA,NA,NA,NA,NA,yes,NA,NA,163,NA,NA,NA,135,NA,NA,NA,NA,NA,NA,https://www.who.int/csr/don/2010_02_12a/en/,DON-2010-02-12a
2010-H5 Influenza-EGY,3,2010,2/17/2010,H5N1,NA,Egypt,EGY,"Ashmon, Elsadat",2/6/2010,2/8/2010,NA,NA,NA,yes,NA,NA,99,NA,NA,NA,30,NA,yes,NA,NA,NA,NA,https://www.who.int/csr/don/2010_02_17/en/,DON-2010-02-17
2009-H1 Influenza-Global,3,2010,2/19/2010,H1N1,NA,Global,NA,"limited areas of eastern and southern Europe, South Asia, and in East Asia",NA,NA,NA,2/14/2010,NA,yes,NA,NA,NA,NA,NA,NA,15921,NA,yes,NA,NA,NA,NA,https://www.who.int/csr/don/2010_02_19/en/,DON-2010-02-19
2010-Yellow Fever-CMR,6,2010,2/24/2010,Yellow fever,NA,Cameroon,CMR,"Bandrrefan village, Banjoun district, Fantun district, Fombat district",End December 2009,1/4/2010,NA,2/17/2010,NA,yes,NA,NA,3,NA,NA,NA,3,NA,yes,NA,NA,NA,NA,https://www.who.int/csr/don/2010_02_24/en/,DON-2010-02-24
2009-H1 Influenza-Global,3,2010,2/26/2010,H1N1,NA,Global,NA,parts of south and southeast Asia and in limited areas of east and southeastern Europe,NA,NA,NA,2/21/2010,NA,yes,NA,NA,NA,NA,NA,NA,16226,NA,yes,NA,NA,NA,NA,https://www.who.int/csr/don/2010_02_26/en/,DON-2010-02-26
2010-H5 Influenza-EGY,3,2010,3/4/2010,H5N1,NA,Egypt,EGY,"Shobra Elkhima, Banha, Meet Ghamr, Kellin, Kafr El-Sheikh",2/10/2010,2/11/2010,NA,NA,NA,yes,NA,NA,104,NA,NA,NA,30,NA,yes,NA,NA,NA,NA,https://www.who.int/csr/don/2010_03_04/en/,DON-2010-03-04
2010-H5 Influenza-VNM,3,2010,3/4/2010,H5N1,NA,Vietnam,VNM,"Ninh Hoa, Cai Be, Son Duong",1/27/2010,1/28/2010,NA,yes,NA,yes,NA,NA,115,NA,NA,NA,58,NA,yes,NA,NA,NA,NA,https://www.who.int/csr/don/2010_03_04a/en/,DON-2010-03-04a
2009-H1 Influenza-Global,3,2010,3/5/2010,H1N1,NA,Global,NA,parts of Southeast Asia and East and South-eastern Europe,NA,NA,NA,2/28/2010,NA,yes,NA,NA,NA,NA,NA,NA,16455,NA,yes,NA,NA,NA,NA,https://www.who.int/csr/don/2010_03_05/en/,DON-2010-03-05
2010-H5 Influenza-EGY,3,2010,3/12/2010,H5N1,NA,Egypt,EGY,"El Khanka, Elhamool",NA,3/2/2010,NA,NA,NA,yes,NA,NA,106,NA,NA,NA,32,NA,yes,NA,NA,NA,NA,https://www.who.int/csr/don/_2010_03_12/en/,DON--2010-03-12
2010-H5 Influenza-VNM,3,2010,3/16/2010,H5N1,NA,Vietnam,VNM,Soc Son,3/5/2010,3/7/2010,NA,yes,NA,yes,NA,NA,116,NA,NA,NA,58,NA,yes,NA,NA,NA,NA,https://www.who.int/csr/don/2010_03_16a/en/,DON-2010-03-16a
2009-H1 Influenza-Global,3,2010,3/19/2010,H1N1,NA,Global,NA,"Southeast Asia, West Africa, Central America, Caribbean, south-eastern Europe, East, West & South Asia",NA,NA,NA,3/14/2010,NA,yes,NA,NA,NA,NA,NA,NA,16813,NA,yes,NA,NA,NA,NA,https://www.who.int/csr/don/2010_03_19/en/,DON-2010-03-19
2009-H1 Influenza-Global,3,2010,3/26/2010,H1N1,NA,Global,NA,"parts of Southeast Asia, West Africa, tropical zone of the Americas",NA,3/21/2010,NA,NA,NA,yes,NA,NA,NA,NA,NA,NA,16931,NA,yes,NA,NA,NA,NA,https://www.who.int/csr/don/2010_03_26/en/,DON-2010-03-26
2010-H5 Influenza-VNM,3,2010,3/29/2010,H5N1,NA,Vietnam,VNM,Thuan An,3/5/2010,3/10/2010,NA,yes,NA,3/17/2010,NA,NA,117,NA,NA,NA,59,NA,NA,NA,NA,NA,NA,https://www.who.int/csr/don/2010_03_29a/en/,DON-2010-03-29a
2010-H5 Influenza-EGY,3,2010,3/30/2010,H5N1,NA,Egypt,EGY,"Damietta, Beba",3/21/2010,3/18/2010,NA,NA,NA,yes,NA,NA,108,NA,NA,NA,33,NA,yes,NA,NA,NA,NA,https://www.who.int/csr/don/_2010_03_30/en/,DON--2010-03-30
2010-Rift Valley Fever-ZAF,6,2010,3/30/2010,Rift Valley fever,NA,South Africa,ZAF,"Free State, Eastern Cape, Northern Cape",NA,NA,NA,3/27/2010,NA,yes,NA,NA,63,NA,NA,NA,NA,NA,yes,NA,NA,NA,NA,https://www.who.int/csr/don/2010_03_30a/en/,DON-2010-03-30a
2010-Meningococcal Disease-TCD,1,2010,4/1/2010,Meningococcal disease,NA,Chad,TCD,"Bébidja, Bédjondo, Béré, Doba, Dono-Manga, Goundi, Laï, Bénoye, Laokassi, Sarh",NA,NA,NA,1/4/2010,NA,yes,NA,NA,NA,NA,1531,NA,151,10,yes,NA,NA,NA,some areas experiencing mixed epidemics and some by either serogroup A or W135,https://www.who.int/csr/don/2010_04_01a/en/,DON-2010-04-01a
2009-H1 Influenza-Global,3,2010,4/9/2010,H1N1,NA,Global,NA,"parts of Southeast Asia, West Africa, tropical zone of the Americas",NA,NA,NA,4/4/2010,NA,yes,NA,NA,NA,NA,NA,NA,17700,NA,yes,NA,NA,NA,NA,https://www.who.int/csr/don/2010_04_09/en/,DON-2010-04-09
2010-H5 Influenza-EGY,3,2010,4/9/2010,H5N1,NA,Egypt,EGY,Etsa,NA,3/31/2010,NA,NA,NA,yes,NA,NA,109,NA,NA,NA,34,NA,yes,NA,NA,NA,NA,https://www.who.int/csr/don/_2010_04_09/en/,DON--2010-04-09
2009-H1 Influenza-Global,3,2010,4/16/2010,H1N1,NA,Global,NA,"parts of the tropical zones of the Americas, West Africa, Eastern Africa and South East Asia",NA,NA,NA,4/11/2010,NA,yes,NA,NA,NA,NA,NA,NA,17798,NA,yes,NA,NA,NA,NA,https://www.who.int/csr/don/2010_04_16/en/,DON-2010-04-16
2010-H5 Influenza-VNM,3,2010,4/21/2010,H5N1,NA,Vietnam,VNM,"Nhu Co commune, Cho Moi",3/28/2010,NA,NA,4/6/2010,NA,4/3/2010,NA,NA,119,NA,NA,NA,59,NA,yes,NA,NA,NA,NA,https://www.who.int/csr/don/2010_04_21/en/,DON-2010-04-21
2009-H1 Influenza-Global,3,2010,4/23/2010,H1N1,NA,Global,NA,"parts of West and Central Africa, South East Asia, Central America",NA,NA,NA,4/18/2010,NA,yes,NA,NA,NA,NA,NA,NA,17853,NA,yes,NA,NA,NA,NA,https://www.who.int/csr/don/2010_04_23a/en/,DON-2010-04-23a
2010-WPV-TJK,5,2010,4/23/2010,Poliovirus type 1,NA,Tajikistan,TJK,south-west,4/9/2010,NA,NA,NA,NA,yes,NA,NA,7,NA,NA,NA,NA,NA,yes,NA,NA,NA,symptom onset an estimate based on the given data,https://www.who.int/csr/don/2010_04_23/en/,DON-2010-04-23
2010-WPV-TJK,5,2010,4/29/2010,WPV1,NA,Tajikistan,TJK,"south-west, Dushanbe",03/??/2010,NA,NA,01/??/2010,NA,yes,NA,NA,32,NA,NA,171,NA,NA,yes,NA,NA,NA,symptom onset an estimate based on the given data,https://www.who.int/csr/don/2010_04_29/en/,DON-2010-04-29
2009-H1 Influenza-Global,3,2010,4/30/2010,H1N1,NA,Global,NA,"parts of West and Central Africa, South East Asia, South Asia",NA,NA,NA,4/25/2010,NA,yes,NA,NA,NA,NA,NA,NA,17919,NA,yes,NA,NA,NA,NA,https://www.who.int/csr/don/2010_04_30a/en/,DON-2010-04-30a
2010-H5 Influenza-KHM,3,2010,5/4/2010,H5N1,NA,Cambodia,KHM,Prey Veng,4/13/2010,4/16/2010,NA,NA,NA,yes,NA,NA,10,NA,NA,NA,8,NA,NA,NA,NA,NA,NA,https://www.who.int/csr/don/2010_05_04/en/,DON-2010-05-04
2010-Rift Valley Fever-ZAF,6,2010,5/4/2010,Rift Valley fever,NA,South Africa,ZAF,"Free State Province, Eastern Cape Province, Northern Cape Province, Western Cape, North West Province",4/7/2010,NA,NA,4/27/2010,NA,yes,NA,NA,NA,NA,NA,172,15,NA,yes,yes,NA,NA,new case reported by Germany,https://www.who.int/csr/don/2010_05_04a/en/,DON-2010-05-04a
2010-H5 Influenza-IDN,3,2010,5/6/2010,H5N1,NA,Indonesia,IDN,"Malang, Pekanbaru",2/22/2010,NA,NA,NA,NA,yes,NA,NA,165,NA,NA,NA,136,NA,yes,NA,NA,NA,NA,https://www.who.int/csr/don/2010_05_06/en/,DON-2010-05-06
2009-H1 Influenza-Global,3,2010,5/7/2010,H1N1,NA,Global,NA,"parts of West Africa, the Caribbean, and Southeast Asia",NA,NA,NA,5/2/2010,NA,yes,NA,NA,NA,NA,NA,NA,18001,NA,yes,NA,NA,NA,NA,https://www.who.int/csr/don/2010_05_07/en/,DON-2010-05-07
2010-Rift Valley Fever-ZAF,6,2010,5/12/2010,Rift Valley fever,NA,South Africa,ZAF,"Free State Province, Eastern Cape Province, Northern Cape Province, Western Cape, and North West Province",NA,NA,NA,5/10/2010,NA,yes,NA,NA,186,NA,NA,NA,18,NA,NA,NA,NA,NA,the previous RVF case in Germany was confirmed for Rickettsia,https://www.who.int/csr/don/2010_05_12/en/,DON-2010-05-12
2009-H1 Influenza-Global,3,2010,5/14/2010,H1N1,NA,Global,NA,"parts of the Caribbean and Central America, West Africa, South and Southeast Asia",NA,NA,NA,5/9/2010,NA,yes,NA,NA,NA,NA,NA,NA,18036,NA,yes,NA,NA,NA,NA,https://www.who.int/csr/don/2010_05_14/en/,DON-2010-05-14
2009-H1 Influenza-Global,3,2010,5/21/2010,H1N1,NA,Global,NA,parts of the Caribbean and Southeast Asia,NA,NA,NA,5/16/2010,NA,yes,NA,NA,NA,NA,NA,NA,18097,NA,yes,NA,NA,NA,NA,https://www.who.int/csr/don/2010_05_21/en/,DON-2010-05-21
2010-Yellow Fever-CMR,6,2010,5/27/2010,Yellow fever,NA,Cameroon,CMR,Kumba,1/11/2010,NA,NA,1/25/2010,yes,yes,NA,NA,1,NA,NA,NA,0,NA,yes,NA,NA,NA,NA,https://www.who.int/csr/don/2010_05_27/en/,DON-2010-05-27
2009-H1 Influenza-Global,3,2010,5/28/2010,H1N1,NA,Global,NA,parts of the Caribbean and Southeast Asia,NA,NA,NA,5/23/2010,NA,yes,NA,NA,NA,NA,NA,NA,18114,NA,yes,NA,NA,NA,NA,https://www.who.int/csr/don/2010_05_28/en/,DON-2010-05-28
2009-H1 Influenza-Global,3,2010,6/4/2010,H1N1,NA,Global,NA,parts of the Caribbean and Southeast Asia,NA,NA,NA,5/30/2010,NA,yes,NA,NA,NA,NA,NA,NA,18138,NA,yes,NA,NA,NA,NA,https://www.who.int/csr/don/2010_06_04/en/,DON-2010-06-04
2010-H5 Influenza-CHN,3,2010,6/8/2010,H5N1,NA,China,CHN,Hubei,5/23/2010,NA,NA,NA,NA,yes,NA,NA,39,NA,NA,NA,26,NA,yes,NA,NA,NA,NA,https://www.who.int/csr/don/2010_06_08/en/,DON-2010-06-08
2009-H1 Influenza-Global,3,2010,6/11/2010,H1N1,NA,Global,NA,"limited areas of the tropics, particularly in Southeast Asia and the Caribbean",NA,NA,NA,6/6/2010,NA,yes,NA,NA,NA,NA,NA,NA,18156,NA,yes,NA,NA,NA,NA,https://www.who.int/csr/don/2010_06_11/en/,DON-2010-06-11
2009-H1 Influenza-Global,3,2010,6/18/2010,H1N1,NA,Global,NA,parts of Central America and the Caribbean and in parts of South and Southeast Asia,NA,NA,NA,6/13/2010,NA,yes,NA,NA,NA,NA,NA,NA,18172,NA,yes,NA,NA,NA,NA,https://www.who.int/csr/don/2010_06_18/en/,DON-2010-06-18
2009-H1 Influenza-Global,3,2010,6/25/2010,H1N1,NA,Global,NA,"parts of the tropics, particularly in the Caribbean, West Africa, and South and Southeast Asia",NA,NA,NA,6/20/2010,NA,yes,NA,NA,NA,NA,NA,NA,18209,NA,yes,NA,NA,NA,NA,https://www.who.int/csr/don/2010_06_25/en/,DON-2010-06-25
2010-Viral Haemorrhagic Fever-COG,2,2010,6/29/2010,Haemorrhagic Fever,NA,Republic of the Congo,COG,Mokouangonda,NA,NA,NA,yes,NA,no,NA,NA,NA,NA,5,NA,3,NA,yes,NA,NA,NA,pending lab confirmation,https://www.who.int/csr/don/2010_06_29/en/,DON-2010-06-29
2009-H1 Influenza-Global,3,2010,7/2/2010,H1N1,NA,Global,NA,"localized areas of the tropics, particularly in South and Southeast Asia, the Caribbean and West Africa",NA,NA,NA,6/27/2010,NA,yes,NA,NA,NA,NA,NA,NA,18239,NA,yes,NA,NA,NA,NA,https://www.who.int/csr/don/2010_07_02/en/,DON-2010-07-02
2010-Viral Haemorrhagic Fever-COG,2,2010,7/2/2010,Haemorrhagic Fever,NA,Republic of the Congo,COG,Sangha region,NA,NA,NA,NA,NA,no,NA,NA,NA,NA,4,NA,3,NA,yes,NA,NA,NA,"tested negative for several viral haemorrhagic fevers (Ebola, Marburg, CCHF, Arenavirus). Additional laboratory investigations are ongoing; could only get samples from one sesupected case",https://www.who.int/csr/don/2010_07_02a/en/,DON-2010-07-02a
2010-H5 Influenza-IDN,3,2010,7/5/2010,H5N1,NA,Indonesia,IDN,South Jakarta,5/25/2010,5/27/2010,NA,NA,NA,yes,NA,NA,166,NA,NA,NA,137,NA,NA,NA,NA,NA,NA,https://www.who.int/csr/don/2010_07_05/en/,DON-2010-07-05
2010-Lead Poisoning-NGA,7,2010,7/7/2010,Lead poisoning,NA,Nigeria,NGA,"Bukkuyum, Anka",03/??/2010,NA,03/??/2010,NA,NA,yes,NA,NA,>100,NA,NA,NA,NA,NA,yes,NA,NA,NA,over 2000 people may need chelation therapy,https://www.who.int/csr/don/2010_07_07/en/,DON-2010-07-07
2009-H1 Influenza-Global,3,2010,7/9/2010,H1N1,NA,Global,NA,"South and Southeast Asia, the Caribbean and West Africa",NA,NA,NA,7/4/2010,NA,yes,NA,NA,NA,NA,NA,NA,18311,NA,yes,NA,NA,NA,NA,https://www.who.int/csr/don/2010_07_09/en/,DON-2010-07-09
2009-H1 Influenza-Global,3,2010,7/16/2010,H1N1,NA,Global,NA,"parts of South Asia, West Africa, and Central America",NA,NA,NA,7/12/2010,NA,yes,NA,NA,NA,NA,NA,NA,18337,NA,yes,NA,NA,NA,NA,https://www.who.int/csr/don/2010_07_16/en/,DON-2010-07-16
2010-WPV-AGO,5,2010,7/19/2010,WPV1,NA,Angola,AGO,"Luanda, Bie, Bengo, Huambo, Lunda Norte and Lunda Sul",NA,02/??/2010,NA,7/19/2010,NA,NA,NA,NA,NA,NA,NA,15,NA,NA,yes,NA,NA,NA,NA,https://www.who.int/csr/don/2010_07_19/en/,DON-2010-07-19
2010-Yellow Fever-COD,6,2010,7/19/2010,Yellow fever,NA,Democratic Republic of the Congo,COD,Titule,3/15/2010,NA,6/25/2010,NA,yes,yes,NA,NA,1,NA,11,2,NA,NA,yes,NA,NA,NA,NA,https://www.who.int/csr/don/2010_07_19a/en/,DON-2010-07-19a
2010-H5 Influenza-IDN,3,2010,7/22/2010,H5N1,NA,Indonesia,IDN,Sukoharjo,6/16/2010,6/21/2010,NA,NA,NA,yes,NA,NA,167,NA,NA,NA,138,NA,yes,NA,NA,NA,NA,https://www.who.int/csr/don/2010_07_22/en/,DON-2010-07-22
2009-H1 Influenza-Global,3,2010,7/23/2010,H1N1,NA,Global,NA,"West Africa, Central America, the Caribbean, and South and Southeast Asia",NA,NA,NA,7/18/2010,NA,yes,NA,NA,NA,NA,NA,NA,18366,NA,yes,NA,NA,NA,NA,https://www.who.int/csr/don/2010_07_23a/en/,DON-2010-07-23a
2010-WPV-TJK,5,2010,7/23/2010,WPV1,NA,Tajikistan,TJK,NA,NA,NA,NA,1/1/2010,NA,NA,NA,NA,NA,NA,NA,430,19,NA,yes,NA,NA,NA,NA,https://www.who.int/csr/don/2010_07_23/en/,DON-2010-07-23
2010-H5 Influenza-EGY,3,2010,7/29/2010,H5N1,NA,Egypt,EGY,Shobra Elkhima,NA,7/21/2010,NA,NA,NA,yes,NA,NA,110,NA,NA,NA,35,NA,yes,NA,NA,NA,NA,https://www.who.int/csr/don/2010_07_29/en/,DON-2010-07-29
2009-H1 Influenza-Global,3,2010,7/30/2010,H1N1,NA,Global,NA,Americas and South and Southeast Asia,NA,NA,NA,7/25/2010,NA,yes,NA,NA,NA,NA,NA,NA,18398,NA,yes,NA,NA,NA,NA,https://www.who.int/csr/don/2010_07_30/en/,DON-2010-07-30
2010-H5 Influenza-IDN,3,2010,8/3/2010,H5N1,NA,Indonesia,IDN,Tangerang,7/2/2010,7/4/2010,NA,NA,NA,yes,NA,NA,168,NA,NA,NA,139,NA,yes,NA,NA,NA,NA,https://www.who.int/csr/don/2010_08_03/en/,DON-2010-08-03
2009-H1 Influenza-Global,3,2010,8/6/2010,H1N1,NA,Global,NA,parts of South Asia and in limited areas of tropical South and Central America,NA,NA,NA,8/1/2010,NA,yes,NA,NA,NA,NA,NA,NA,18449,NA,yes,NA,NA,NA,NA,https://www.who.int/csr/don/2010_08_06/en/,DON-2010-08-06
2010-Plague-PER,2,2010,8/10/2010,Plague,NA,Peru,PER,Ascope,NA,NA,NA,7/30/2010,NA,yes,NA,NA,17,NA,NA,NA,NA,NA,yes,NA,NA,NA,"four are pneumonic plague, 12 are bubonic plague and one was septicemic plague",https://www.who.int/csr/don/2010_08_10/en/,DON-2010-08-10
2010-H5 Influenza-EGY,3,2010,8/12/2010,H5N1,NA,Egypt,EGY,Elsalam district,8/2/2010,8/2/2010,NA,NA,NA,yes,NA,NA,111,NA,NA,NA,35,NA,yes,NA,NA,NA,NA,https://www.who.int/csr/don/2010_08_12/en/,DON-2010-08-12
2009-H1 Influenza-Global,3,2010,8/13/2010,H1N1,NA,Global,NA,"India, New Zealand, South Africa",NA,NA,NA,NA,NA,yes,NA,NA,NA,NA,NA,NA,NA,NA,NA,NA,NA,NA,NA,https://www.who.int/csr/don/2010_08_13/en/,DON-2010-08-13
2009-H1 Influenza-Global,3,2010,8/20/2010,H1N1,NA,Global,NA,"India, New Zealand, South Africa",NA,NA,NA,NA,NA,NA,NA,NA,NA,NA,NA,NA,NA,NA,NA,NA,NA,NA,NA,https://www.who.int/csr/don/2010_08_20/en/,DON-2010-08-20
2009-H1 Influenza-Global,3,2010,8/27/2010,H1N1,NA,Global,NA,"India, New Zealand, Australia",NA,NA,NA,NA,NA,NA,NA,NA,NA,NA,NA,NA,NA,NA,NA,NA,NA,NA,NA,https://www.who.int/csr/don/2010_08_27/en/,DON-2010-08-27
2010-H5 Influenza-EGY,3,2010,8/31/2010,H5N1,NA,Egypt,EGY,Qaluibia,8/17/2010,8/24/2010,NA,NA,NA,yes,NA,NA,112,NA,NA,NA,36,NA,yes,NA,NA,NA,NA,https://www.who.int/csr/don/2010_08_31/en/,DON-2010-08-31
2010-WPV-AGO,5,2010,9/8/2010,WPV1,NA,Angola,AGO,"Bie, Bengo, Huambo, Lunda Norte, Lunda Sul and Uige",NA,NA,NA,NA,NA,NA,NA,NA,NA,NA,NA,NA,NA,NA,yes,NA,NA,NA,re-established transmission,https://www.who.int/csr/don/2010_09_08/en/,DON-2010-09-08
2010-WPV-COD,5,2010,9/8/2010,WPV1,NA,Democratic Republic of the Congo,COD,Katanga province,6/20/2010,NA,NA,NA,NA,NA,NA,NA,NA,NA,NA,NA,NA,NA,no,NA,NA,NA,re-established transmission,https://www.who.int/csr/don/2010_09_08/en/,DON-2010-09-08
2009-H1 Influenza-Global,3,2010,9/10/2010,H1N1,NA,Global,NA,NA,NA,NA,NA,NA,NA,NA,8/10/2010,NA,NA,NA,NA,NA,NA,NA,NA,NA,NA,NA,post-pandemic period--no more DONs,https://www.who.int/csr/don/2010_09_10/en/,DON-2010-09-10
2010-Yellow Fever-SEN,6,2010,10/5/2010,Yellow fever,NA,Senegal,SEN,Mbour,NA,NA,NA,9/20/2010,NA,yes,NA,NA,1,NA,1,NA,NA,NA,NA,NA,NA,NA,NA,https://www.who.int/csr/don/2010_10_05/en/,DON-2010-10-05
2010-Cholera-CMR,5,2010,10/8/2010,Cholera,NA,Cameroon,CMR,"Centre, Extreme Nord, Littoral, Nord, Ouest, Sud Ouest",NA,NA,5/6/2010,NA,NA,NA,NA,NA,NA,NA,NA,7869,515,6.5,yes,NA,NA,NA,NA,https://www.who.int/csr/don/2010_10_08/en/,DON-2010-10-08
2010-Cholera-TCD,5,2010,10/8/2010,Cholera,NA,Chad,TCD,NA,NA,NA,7/13/2010,NA,NA,NA,NA,NA,NA,NA,NA,2508,111,4.4,yes,NA,NA,NA,NA,https://www.who.int/csr/don/2010_10_08/en/,DON-2010-10-08
2010-Cholera-NER,5,2010,10/8/2010,Cholera,NA,Niger,NER,NA,NA,NA,7/3/2010,NA,NA,NA,NA,NA,NA,NA,NA,976,62,6.4,yes,NA,NA,NA,NA,https://www.who.int/csr/don/2010_10_08/en/,DON-2010-10-08
2010-Cholera-NGA,5,2010,10/8/2010,Cholera,NA,Nigeria,NGA,NA,NA,NA,1/4/2010,NA,NA,NA,NA,NA,NA,NA,NA,29115,1191,4.1,yes,NA,NA,NA,NA,https://www.who.int/csr/don/2010_10_08/en/,DON-2010-10-08
2010-H5 Influenza-IDN,3,2010,10/18/2010,H5N1,NA,Indonesia,IDN,West Jakarta,8/16/2010,8/20/2010,NA,NA,NA,NA,NA,NA,170,NA,NA,NA,141,NA,yes,yes,NA,NA,NA,https://www.who.int/csr/don/2010_10_18/en/,DON-2010-10-18
2010-CCHF-PAK,6,2010,10/25/2010,CCHF,NA,Pakistan,PAK,NA,NA,NA,NA,10/15/2010,NA,NA,NA,NA,NA,NA,NA,26,3,NA,yes,yes,NA,NA,NA,https://www.who.int/csr/don/2010_10_25a/en/,DON-2010-10-25a
2010-Dengue-PAK,6,2010,10/25/2010,Dengue,NA,Pakistan,PAK,NA,NA,NA,NA,NA,NA,yes,NA,NA,1500,NA,NA,NA,15,NA,yes,yes,NA,NA,NA,https://www.who.int/csr/don/2010_10_25a/en/,DON-2010-10-25a
2010-Cholera-PAK,5,2010,10/25/2010,Cholera,NA,Pakistan,PAK,"Sindh, Punjab and Khyber Pakhtunkhwa",NA,NA,NA,10/12/2010,NA,yes,NA,NA,99,NA,NA,NA,NA,NA,yes,NA,NA,NA,NA,https://www.who.int/csr/don/2010_10_25/en/,DON-2010-10-25
2010-Cholera-HTI,5,2010,10/26/2010,Cholera,NA,Haiti,HTI,"North, South, West Departments",NA,NA,NA,10/25/2010,NA,yes,NA,NA,3342,NA,NA,NA,259,NA,yes,yes,NA,NA,NA,https://www.who.int/csr/don/2010_10_26/en/,DON-2010-10-26
2010-Cholera-HTI,5,2010,10/28/2010,Cholera,NA,Haiti,HTI,"Artibonte, Central, Nord-Est, Nord",NA,NA,NA,10/27/2010,NA,yes,NA,NA,NA,NA,NA,4722,303,NA,yes,yes,NA,NA,NA,https://www.who.int/csr/don/2010_10_28/en/,DON-2010-10-28
2010-Cholera-HTI,5,2010,11/4/2010,Cholera,NA,Haiti,HTI,"Artibonite, Centre, Nord, Nord-Ouest, Ouest",NA,NA,NA,11/3/2010,NA,yes,NA,NA,NA,NA,NA,6742,442,NA,yes,NA,NA,NA,NA,https://www.who.int/csr/don/2010_11_04/en/,DON-2010-11-04
2010-WPV-COG,5,2010,11/4/2010,Polio,NA,Republic of the Congo,COG,"Pointe Noire, Dolisie, Kayes, Bouenza, Brazzaville, Mvouiti",Early October,NA,NA,NA,NA,yes,NA,NA,2,NA,NA,120,58,NA,yes,yes,NA,NA,NA,https://www.who.int/csr/don/2010_11_04a/en/,DON-2010-11-04a
2010-WPV-COG,5,2010,11/9/2010,Polio,NA,Republic of the Congo,COG,"Pointe Noire, Niari, Bouenza, Brazzaville, and Kouilou",NA,NA,NA,NA,NA,yes,NA,NA,4,NA,NA,184,85,NA,yes,yes,NA,NA,NA,https://www.who.int/csr/don/2010_11_09/en/,DON-2010-11-09
2010-WPV-KAZ,5,2010,11/13/2010,Polio,NA,Kazakhstan,KAZ,NA,8/12/2010,NA,NA,NA,NA,yes,NA,NA,1,NA,NA,1,NA,NA,yes,NA,NA,NA,NA,https://www.who.int/csr/don/2010_11_13/en/,DON-2010-11-13
2010-WPV-TJK,5,2010,11/13/2010,Polio,NA,Tajikistan,TJK,NA,NA,NA,NA,NA,NA,NA,NA,NA,NA,NA,NA,458,NA,NA,yes,NA,NA,NA,no new cases since 04 July following 5 mass immunization campaigns,https://www.who.int/csr/don/2010_11_13/en/,DON-2010-11-13
2010-WPV-TKM,5,2010,11/13/2010,Polio,NA,Turkmenistan,TKM,NA,NA,NA,NA,NA,NA,NA,NA,NA,NA,NA,NA,3,NA,NA,yes,NA,NA,NA,no new cases since 20 June after 4 mass immunization campaigns,https://www.who.int/csr/don/2010_11_13/en/,DON-2010-11-13
2010-WPV-RUS,5,2010,11/13/2010,Polio,NA,Russian Federation,RUS,North Caugus Federal Region,7/15/2010,NA,NA,NA,NA,yes,NA,NA,NA,NA,NA,14,NA,NA,11/1/2010,NA,NA,NA,NA,https://www.who.int/csr/don/2010_11_13/en/,DON-2010-11-13
2010-WPV-UZB,5,2010,11/13/2010,Polio,NA,Uzbekistan,UZB,NA,NA,NA,NA,NA,NA,no,NA,NA,NA,NA,NA,1,NA,NA,yes,NA,NA,NA,no laboratory testing occurring,https://www.who.int/csr/don/2010_11_13/en/,DON-2010-11-13
2010-Cholera-HTI,5,2010,11/17/2010,Cholera,NA,Haiti,HTI,"Artibonite, Centre, Nord, Nord-Ouest, Nord Est, Ouest, Sud",NA,NA,NA,11/16/2010,NA,NA,NA,NA,NA,NA,NA,17418,1065,NA,yes,NA,NA,NA,NA,https://www.who.int/csr/don/2010_11_17/en/,DON-2010-11-17
2010-H5 Influenza-CHN,3,2010,11/19/2010,H5N1,NA,China,CHN,Hong Kong,11/2/2010,11/14/2010,NA,11/17/2010,NA,yes,NA,NA,1,NA,NA,NA,NA,NA,yes,NA,NA,NA,NA,https://www.who.int/csr/don/2010_11_19/en/,DON-2010-11-19
2010-Cholera-HTI,5,2010,11/24/2010,Cholera,NA,Haiti,HTI,Port-au-prince & metropolitan area,NA,NA,NA,11/20/2010,NA,yes,NA,NA,NA,NA,NA,60240,1415,2.3,yes,NA,NA,NA,NA,https://www.who.int/csr/don/2010_11_24/en/,DON-2010-11-24
2010-H5 Influenza-EGY,3,2010,12/8/2010,H5N1,NA,Egypt,EGY,Gharbia,11/28/2010,12/1/2010,NA,NA,NA,yes,NA,NA,113,NA,NA,NA,37,NA,yes,NA,NA,NA,NA,https://www.who.int/csr/don/2010_12_08/en/,DON-2010-12-08
2010-H5 Influenza-IDN,3,2010,12/9/2010,H5N1,NA,Indonesia,IDN,Bandung City,11/14/2010,11/22/2010,NA,NA,NA,yes,NA,NA,171,NA,NA,NA,141,NA,yes,NA,NA,NA,NA,https://www.who.int/csr/don/2010_12_09/en/,DON-2010-12-09
2010-H5 Influenza-EGY,3,2010,12/29/2010,H5N1,NA,Egypt,EGY,"Mamanhour, Esna",12/12/2010,12/14/2010,NA,NA,NA,yes,NA,NA,115,NA,NA,NA,38,NA,yes,NA,NA,NA,NA,https://www.who.int/csr/don/2010_12_29/en/,DON-2010-12-29
2011-H5 Influenza-EGY,3,2011,1/5/2011,H5N1,NA,Egypt,EGY,"Sharkia, Wena, Ismailia, Dakahlia",12/19/2010,12/27/2010,NA,NA,NA,yes,NA,NA,119,NA,NA,NA,40,NA,yes,NA,NA,NA,NA,https://www.who.int/csr/don/2011_01_05/en/,DON-2011-01-05
2011-H5 Influenza-EGY,3,2011,1/13/2011,H5N1,NA,Egypt,EGY,Giza,1/5/2011,1/8/2011,NA,NA,NA,yes,NA,NA,120,NA,NA,NA,40,NA,yes,NA,NA,NA,NA,https://www.who.int/csr/don/2011_01_12/en/,DON-2011-01-12
2011-Yellow Fever-UGA,6,2011,1/19/2011,Yellow fever,NA,Uganda,UGA,"Abim Agago, Kitgum",10/??/2010,NA,NA,12/23/2010,NA,yes,NA,NA,5,NA,NA,226,53,NA,yes,NA,NA,NA,NA,https://www.who.int/csr/don/2011_01_19/en/,DON-2011-01-19
2011-H5 Influenza-EGY,3,2011,1/20/2011,H5N1,NA,Egypt,EGY,Alexandria,1/12/2011,1/13/2011,NA,NA,NA,yes,NA,NA,121,NA,NA,NA,40,NA,yes,NA,NA,NA,NA,https://www.who.int/csr/don/2011_01_20/en/,DON-2011-01-20
2011-Yellow Fever-CIV,6,2011,1/25/2011,Yellow fever,NA,Côte d'Ivoire,CIV,Béoumi and Katiola districts,NA,NA,NA,1/3/2011,yes,yes,NA,NA,12,NA,64,NA,25,NA,1/10/2011,NA,NA,NA,NA,https://www.who.int/csr/don/2011_01_25/en/,DON-2011-01-25
2011-Yellow Fever-CIV,6,2011,2/1/2011,Yellow fever,NA,Côte d'Ivoire,CIV,"Katiola, Beoumi, Seguela, Mankono",NA,NA,NA,1/3/2011,NA,1/17/2011,NA,NA,12,NA,NA,79,35,NA,1/21/2011,NA,NA,NA,mass vaccination campaign,https://www.who.int/csr/don/2011_02_01/en/,DON-2011-02-01
2011-H5 Influenza-EGY,3,2011,2/1/2011,H5N1,NA,Egypt,EGY,Gharbia,1/20/2011,1/20/2011,NA,NA,NA,yes,NA,NA,122,NA,NA,NA,40,NA,yes,NA,NA,NA,NA,https://www.who.int/csr/don/2011_02_02/en/,DON-2011-02-02
2011-H5 Influenza-KHM,3,2011,2/9/2011,H5N1,NA,Cambodia,KHM,Prek Leap village,1/29/2011,2/3/2011,NA,NA,NA,yes,NA,NA,11,NA,NA,NA,9,NA,yes,yes,NA,NA,NA,https://www.who.int/csr/don/2011_02_09/en/,DON-2011-02-09
2011-H5 Influenza-KHM,3,2011,2/25/2011,H5N1,NA,Cambodia,KHM,Takong,2/5/2011,2/9/2011,NA,NA,NA,2/20/2011,NA,NA,13,NA,NA,NA,11,NA,yes,NA,NA,NA,NA,https://www.who.int/csr/don/2011_02_25/en/,DON-2011-02-25
2011-H5 Influenza-EGY,3,2011,2/28/2011,H5N1,NA,Egypt,EGY,"Dakahlia, Menofia, Damiata",1/18/2011,1/23/2011,NA,NA,NA,yes,NA,NA,125,NA,NA,NA,41,NA,yes,NA,NA,NA,NA,https://www.who.int/csr/don/2011_02_28/en/,DON-2011-02-28
2011-H5 Influenza-IDN,3,2011,3/2/2011,H5N1,NA,Indonesia,IDN,Karawang,1/30/2011,2/3/2011,NA,NA,NA,yes,NA,NA,172,NA,NA,NA,142,NA,yes,NA,NA,NA,NA,https://www.who.int/csr/don/2011_03_02/en/,DON-2011-03-02
2011-H5 Influenza-EGY,3,2011,3/7/2011,H5N1,NA,Egypt,EGY,"Sharkia, Kafr Elsheikh",2/10/2011,2/14/2011,NA,NA,NA,yes,NA,NA,127,NA,NA,NA,41,NA,yes,NA,NA,NA,NA,https://www.who.int/csr/don/2011_03_07/en/,DON-2011-03-07
2011-Meningococcal Disease-TCD,1,2011,3/8/2011,Meningococcal disease,NA,Chad,TCD,"Benoye, Kello, Laokassy, Melfi and Moundou",NA,NA,NA,1/1/2011,NA,yes,NA,NA,NA,NA,923,NA,57,6.2,yes,NA,NA,NA,NA,https://www.who.int/csr/don/2011_03_08/en/,DON-2011-03-08
2011-H5 Influenza-EGY,3,2011,3/10/2011,H5N1,NA,Egypt,EGY,"Behira, Dakahlia",2/24/2011,2/26/2011,NA,NA,NA,yes,NA,NA,129,NA,NA,43,NA,NA,yes,NA,NA,NA,NA,https://www.who.int/csr/don/2011_03_10/en/,DON-2011-03-10
2011-Yellow Fever-SLE,6,2011,3/11/2011,Yellow fever,NA,Sierra Leone,SLE,Jahun village,1/17/2011,NA,NA,2/8/2011,2/8/2011,2/1/2011,NA,NA,2,NA,NA,NA,NA,NA,3/5/2011,NA,NA,NA,NA,https://www.who.int/csr/don/2011_03_11/en/,DON-2011-03-11
2011-H5 Influenza-IDN,3,2011,3/14/2011,H5N1,NA,Indonesia,IDN,"Depok, Bekasi",2/3/2011,2/5/2011,NA,NA,NA,yes,NA,NA,174,NA,NA,NA,144,NA,yes,NA,NA,NA,NA,https://www.who.int/csr/don/2011_03_14/en/,DON-2011-03-14
2011-H5 Influenza-EGY,3,2011,3/15/2011,H5N1,NA,Egypt,EGY,Ismailia,3/1/2011,3/7/2011,NA,NA,NA,yes,NA,NA,130,NA,NA,NA,44,NA,yes,NA,NA,NA,NA,https://www.who.int/csr/don/2011_03_15/en/,DON-2011-03-15
2011-H5 Influenza-BGD,3,2011,3/16/2011,H5N1,NA,Bangladesh,BGD,Kamalapur,NA,3/8/2011,NA,NA,NA,yes,NA,NA,1,NA,NA,NA,0,NA,yes,NA,NA,NA,NA,https://www.who.int/csr/don/2011_03_16/en/,DON-2011-03-16
2011-H5 Influenza-IDN,3,2011,3/25/2011,H5N1,NA,Indonesia,IDN,Bekasi,3/2/2011,3/3/2011,NA,NA,NA,yes,NA,NA,175,NA,NA,NA,144,NA,NA,NA,NA,NA,NA,https://www.who.int/csr/don/2011_03_25/en/,DON-2011-03-25
2011-H5 Influenza-EGY,3,2011,3/29/2011,H5N1,NA,Egypt,EGY,"Suez, Giza. Behira",3/5/2011,3/7/2011,NA,NA,NA,yes,NA,NA,133,NA,NA,NA,45,NA,yes,NA,NA,NA,NA,https://www.who.int/csr/don/2011_03_29/en/,DON-2011-03-29
2011-H5 Influenza-IDN,3,2011,4/1/2011,H5N1,NA,Indonesia,IDN,Gunung Kidul,3/1/2011,3/6/2011,NA,NA,NA,yes,NA,NA,176,NA,NA,NA,145,NA,NA,NA,NA,NA,NA,https://www.who.int/csr/don/2011_04_01/en/,DON-2011-04-01
2011-H5 Influenza-EGY,3,2011,4/6/2011,H5N1,NA,Egypt,EGY,"Behaira, Alexandria, Kafr El-Sheikh",2/14/2011,2/16/2011,NA,NA,NA,yes,NA,NA,137,NA,NA,NA,45,NA,yes,NA,NA,NA,NA,https://www.who.int/csr/don/2011_04_06/en/,DON-2011-04-06
2011-H5 Influenza-KHM,3,2011,4/11/2011,H5N1,NA,Cambodia,KHM,Steung Trang,3/22/2011,3/29/2011,NA,NA,NA,yes,NA,NA,14,NA,NA,NA,12,NA,yes,NA,NA,NA,NA,https://www.who.int/csr/don/2011_04_11b/en/,DON-2011-04-11b
2011-H5 Influenza-EGY,3,2011,4/11/2011,H5N1,NA,Egypt,EGY,"Bahaira, Menofeya, Fayoum",3/14/2011,3/19/2011,NA,NA,NA,yes,NA,NA,141,NA,NA,NA,46,NA,yes,NA,NA,NA,NA,https://www.who.int/csr/don/2011_04_11/en/,DON-2011-04-11
2011-H5 Influenza-BGD,3,2011,4/11/2011,H5N1,NA,Bangladesh,BGD,Kamalapur,3/1/2011,3/9/2011,NA,NA,NA,yes,NA,NA,1,NA,NA,NA,0,NA,yes,NA,NA,NA,new case,https://www.who.int/csr/don/2011_04_11a/en/,DON-2011-04-11a
2011-H5 Influenza-KHM,3,2011,4/21/2011,H5N1,NA,Cambodia,KHM,Pea Raing,4/11/2011,4/13/2011,NA,NA,NA,yes,NA,NA,15,NA,NA,NA,13,NA,yes,NA,NA,NA,NA,https://www.who.int/csr/don/2011_04_21c/en/,DON-2011-04-21c
2011-Measles-Europe,1,2011,4/21/2011,Measles,NA,Europe,NA,"Germany, Netherlands, Norway, Romania, Russian Federation, Switzerland, United Kingdom",NA,NA,NA,4/18/2011,NA,yes,NA,NA,NA,NA,NA,6500,NA,NA,yes,NA,NA,NA,increases in 33 countries this year,https://www.who.int/csr/don/2011_04_21/en/,DON-2011-04-21
2011-Measles-BEL,1,2011,4/21/2011,Measles,NA,Belgium,BEL,NA,NA,NA,NA,NA,NA,yes,NA,NA,NA,NA,NA,100,NA,NA,NA,NA,NA,NA,to date,https://www.who.int/csr/don/2011_04_21/en/,DON-2011-04-21
2011-Measles-BGR,1,2011,4/21/2011,Measles,NA,Bulgaria,BGR,NA,NA,NA,NA,NA,NA,yes,NA,NA,NA,NA,NA,131,NA,NA,NA,NA,NA,NA,this year,https://www.who.int/csr/don/2011_04_21/en/,DON-2011-04-21
2011-Measles-FRA,1,2011,4/21/2011,Measles,NA,France,FRA,NA,NA,03/??/2011,NA,NA,NA,yes,NA,NA,NA,NA,NA,4937,NA,NA,NA,NA,NA,NA,jan-march,https://www.who.int/csr/don/2011_04_21/en/,DON-2011-04-21
2011-Measles-SRB,1,2011,4/21/2011,Measles,NA,Serbia,SRB,Leskovac,NA,NA,NA,NA,NA,yes,NA,NA,NA,NA,NA,300,NA,NA,NA,NA,NA,NA,NA,https://www.who.int/csr/don/2011_04_21/en/,DON-2011-04-21
2011-Measles-ESP,1,2011,4/21/2011,Measles,NA,Spain,ESP,"Andalusia, Sevilla, Granada",10/??/2010,NA,NA,NA,NA,yes,NA,NA,NA,NA,NA,600,NA,NA,NA,NA,NA,NA,2 ongoing outbreaks,https://www.who.int/csr/don/2011_04_21/en/,DON-2011-04-21
2011-Measles-TUR,1,2011,4/21/2011,Measles,NA,Turkey,TUR,Istanbul,NA,NA,NA,NA,NA,yes,NA,NA,NA,NA,NA,80,NA,NA,NA,NA,NA,NA,in january,https://www.who.int/csr/don/2011_04_21/en/,DON-2011-04-21
2011-Measles-MKD,1,2011,4/21/2011,Measles,NA,Former Yugoslav Republic of Macedonia,MKD,Skopje,09/??/2010,NA,NA,4/11/2011,NA,yes,NA,NA,NA,NA,NA,636,NA,NA,NA,NA,NA,NA,since september,https://www.who.int/csr/don/2011_04_21/en/,DON-2011-04-21
2011-H5 Influenza-EGY,3,2011,4/21/2011,H5N1,NA,Egypt,EGY,Fayoum,4/1/2011,4/4/2011,NA,4/16/2011,NA,yes,NA,NA,143,NA,NA,47,NA,NA,yes,NA,NA,NA,NA,https://www.who.int/csr/don/2011_04_21d/en/,DON-2011-04-21d
2011-WPV-CIV,5,2011,4/21/2011,WPV3,NA,Côte d'Ivoire,CIV,NA,1/27/2011,NA,NA,NA,NA,yes,NA,NA,NA,NA,NA,NA,NA,NA,no,NA,NA,NA,vaccination campaign did not occur bc of security situation but another is being planned,https://www.who.int/csr/don/2011_04_21a/en/,DON-2011-04-21a
2011-H5 Influenza-IDN,3,2011,5/13/2011,H5N1,NA,Indonesia,IDN,West Jakarta,4/1/2011,4/4/2011,NA,NA,NA,yes,NA,NA,177,NA,NA,146,NA,NA,yes,NA,NA,NA,NA,https://www.who.int/csr/don/2011_05_13/en/,DON-2011-05-13
2011-Ebola-UGA,2,2011,5/18/2011,Ebola,NA,Uganda,UGA,Luwero,NA,5/6/2011,NA,5/13/2011,NA,yes,NA,NA,1,NA,NA,NA,1,NA,yes,NA,NA,NA,NA,https://www.who.int/csr/don/2011_05_18/en/,DON-2011-05-18
2011-HUS-DEU,5,2011,5/27/2011,HUS,NA,Germany,DEU,NA,NA,NA,Second week of may,yes,NA,NA,NA,NA,NA,NA,NA,276,3,NA,yes,NA,NA,NA,NA,https://www.who.int/csr/don/2011_05_27/en/,DON-2011-05-27
2011-H5 Influenza-EGY,3,2011,6/1/2011,H5N1,NA,Egypt,EGY,Amria,4/26/2011,5/3/2011,NA,NA,NA,yes,NA,NA,144,NA,NA,NA,48,NA,yes,NA,NA,NA,NA,https://www.who.int/csr/don/2011_06_01/en/,DON-2011-06-01
2011-HUS-DEU,5,2011,6/2/2011,HUS,NA,Germany,DEU,NA,NA,NA,NA,5/31/2011,NA,NA,NA,NA,NA,NA,NA,470,9,NA,yes,NA,NA,NA,NA,https://www.who.int/csr/don/2011_06_02/en/,DON-2011-06-02
2011-EHEC-DEU,5,2011,6/2/2011,EHEC,NA,Germany,DEU,NA,NA,NA,NA,5/31/2011,NA,NA,NA,NA,NA,NA,NA,1064,6,NA,yes,NA,NA,NA,NA,https://www.who.int/csr/don/2011_06_02/en/,DON-2011-06-02
2011-HUS-AUT,5,2011,6/2/2011,HUS,NA,Austria,AUT,NA,NA,NA,NA,yes,NA,NA,NA,NA,NA,NA,NA,0,NA,NA,yes,NA,NA,NA,all cases except 2 had travel to germany,https://www.who.int/csr/don/2011_06_02/en/,DON-2011-06-02
2011-EHEC-AUT,5,2011,6/2/2011,EHEC,NA,Austria,AUT,NA,NA,NA,NA,yes,NA,NA,NA,NA,NA,NA,NA,2,NA,NA,yes,NA,NA,NA,NA,https://www.who.int/csr/don/2011_06_02/en/,DON-2011-06-02
2011-HUS-DNK,5,2011,6/2/2011,HUS,NA,Denmark,DNK,NA,NA,NA,NA,yes,NA,NA,NA,NA,NA,NA,NA,7,NA,NA,yes,NA,NA,NA,NA,https://www.who.int/csr/don/2011_06_02/en/,DON-2011-06-02
2011-EHEC-DNK,5,2011,6/2/2011,EHEC,NA,Denmark,DNK,NA,NA,NA,NA,yes,NA,NA,NA,NA,NA,NA,NA,7,NA,NA,yes,NA,NA,NA,NA,https://www.who.int/csr/don/2011_06_02/en/,DON-2011-06-02
2011-HUS-FRA,5,2011,6/2/2011,HUS,NA,France,FRA,NA,NA,NA,NA,yes,NA,NA,NA,NA,NA,NA,NA,0,NA,NA,yes,NA,NA,NA,NA,https://www.who.int/csr/don/2011_06_02/en/,DON-2011-06-02
2011-EHEC-FRA,5,2011,6/2/2011,EHEC,NA,France,FRA,NA,NA,NA,NA,yes,NA,NA,NA,NA,NA,NA,NA,6,NA,NA,yes,NA,NA,NA,NA,https://www.who.int/csr/don/2011_06_02/en/,DON-2011-06-02
2011-HUS-NLD,5,2011,6/2/2011,HUS,NA,Netherlands,NLD,NA,NA,NA,NA,yes,NA,NA,NA,NA,NA,NA,NA,4,NA,NA,yes,NA,NA,NA,NA,https://www.who.int/csr/don/2011_06_02/en/,DON-2011-06-02
2011-EHEC-NLD,5,2011,6/2/2011,EHEC,NA,Netherlands,NLD,NA,NA,NA,NA,yes,NA,NA,NA,NA,NA,NA,NA,4,NA,NA,yes,NA,NA,NA,NA,https://www.who.int/csr/don/2011_06_02/en/,DON-2011-06-02
2011-HUS-NOR,5,2011,6/2/2011,HUS,NA,Norway,NOR,NA,NA,NA,NA,yes,NA,NA,NA,NA,NA,NA,NA,0,NA,NA,yes,NA,NA,NA,NA,https://www.who.int/csr/don/2011_06_02/en/,DON-2011-06-02
2011-EHEC-NOR,5,2011,6/2/2011,EHEC,NA,Norway,NOR,NA,NA,NA,NA,yes,NA,NA,NA,NA,NA,NA,NA,1,NA,NA,yes,NA,NA,NA,NA,https://www.who.int/csr/don/2011_06_02/en/,DON-2011-06-02
2011-HUS-ESP,5,2011,6/2/2011,HUS,NA,Spain,ESP,NA,NA,NA,NA,yes,NA,NA,NA,NA,NA,NA,NA,1,NA,NA,yes,NA,NA,NA,NA,https://www.who.int/csr/don/2011_06_02/en/,DON-2011-06-02
2011-EHEC-ESP,5,2011,6/2/2011,EHEC,NA,Spain,ESP,NA,NA,NA,NA,yes,NA,NA,NA,NA,NA,NA,NA,0,NA,NA,yes,NA,NA,NA,NA,https://www.who.int/csr/don/2011_06_02/en/,DON-2011-06-02
2011-HUS-SWE,5,2011,6/2/2011,HUS,NA,Sweden,SWE,NA,NA,NA,NA,yes,NA,NA,NA,NA,NA,NA,NA,15,NA,NA,yes,NA,NA,NA,NA,https://www.who.int/csr/don/2011_06_02/en/,DON-2011-06-02
2011-EHEC-SWE,5,2011,6/2/2011,EHEC,NA,Sweden,SWE,NA,NA,NA,NA,yes,NA,NA,NA,NA,NA,NA,NA,28,NA,NA,yes,NA,NA,NA,NA,https://www.who.int/csr/don/2011_06_02/en/,DON-2011-06-02
2011-HUS-CHE,5,2011,6/2/2011,HUS,NA,Switzerland,CHE,NA,NA,NA,NA,yes,NA,NA,NA,NA,NA,NA,NA,0,NA,NA,yes,NA,NA,NA,NA,https://www.who.int/csr/don/2011_06_02/en/,DON-2011-06-02
2011-EHEC-CHE,5,2011,6/2/2011,EHEC,NA,Switzerland,CHE,NA,NA,NA,NA,yes,NA,NA,NA,NA,NA,NA,NA,2,NA,NA,yes,NA,NA,NA,NA,https://www.who.int/csr/don/2011_06_02/en/,DON-2011-06-02
2011-HUS-GBR,5,2011,6/2/2011,HUS,NA,United Kingdom,GBR,NA,NA,NA,NA,yes,NA,NA,NA,NA,NA,NA,NA,2,NA,NA,yes,NA,NA,NA,NA,https://www.who.int/csr/don/2011_06_02/en/,DON-2011-06-02
2011-EHEC-GBR,5,2011,6/2/2011,EHEC,NA,United Kingdom,GBR,NA,NA,NA,NA,yes,NA,NA,NA,NA,NA,NA,NA,1,NA,NA,yes,NA,NA,NA,NA,https://www.who.int/csr/don/2011_06_02/en/,DON-2011-06-02
2011-H5 Influenza-IDN,3,2011,6/3/2011,H5N1,NA,Indonesia,IDN,North Jakarta,4/3/2011,4/8/2011,NA,NA,NA,yes,NA,NA,178,NA,NA,NA,146,NA,NA,NA,NA,NA,NA,https://www.who.int/csr/don/2011_06_03/en/,DON-2011-06-03
2011-H5 Influenza-KHM,3,2011,6/10/2011,H5N1,NA,Cambodia,KHM,Prasat,5/24/2011,5/31/2011,NA,NA,NA,yes,NA,NA,16,NA,NA,NA,14,NA,yes,NA,NA,NA,NA,https://www.who.int/csr/don/2011_06_10/en/,DON-2011-06-10
2011-WPV-TCD,5,2011,6/10/2011,WPV1,NA,Chad,TCD,"N'Djamena, south, east",09/??/2010,NA,NA,NA,NA,NA,NA,NA,NA,NA,NA,NA,NA,NA,yes,NA,NA,NA,Ramadan and Hajj coming up; pilgrims already anticipated to be moving now; high international spread risk,https://www.who.int/csr/don/2011_06_10a/en/,DON-2011-06-10a
2011-WPV-TCD,5,2011,6/10/2011,WPV3,NA,Chad,TCD,NA,11/??/2007,NA,NA,NA,NA,NA,NA,NA,NA,NA,NA,NA,NA,NA,yes,NA,yes,NA,NA,https://www.who.int/csr/don/2011_06_10a/en/,DON-2011-06-10a
2011-H5 Influenza-EGY,3,2011,6/16/2011,H5N1,NA,Egypt,EGY,"Aswan, Ashmoun, Shobra Elkhima, Elzawya",5/14/2011,NA,NA,yes,NA,yes,NA,NA,149,NA,NA,NA,51,NA,yes,NA,NA,NA,NA,https://www.who.int/csr/don/2011_06_16/en/,DON-2011-06-16
2011-H5 Influenza-EGY,3,2011,6/22/2011,H5N1,NA,Egypt,EGY,Qena,6/5/2011,6/13/2011,NA,yes,NA,yes,NA,NA,150,NA,NA,NA,52,NA,yes,NA,NA,NA,NA,https://www.who.int/csr/don/2011_06_22/en/,DON-2011-06-22
2011-WPV-PAK,5,2011,7/7/2011,WPV3,NA,Pakistan,PAK,Khuber Agency,6/9/2011,NA,NA,yes,NA,NA,NA,NA,NA,NA,NA,1,NA,NA,7/4/2011,NA,yes,NA,high risk of spread with Umrah and upcoming Hajj,https://www.who.int/csr/don/2011_07_07/en/,DON-2011-07-07
2011-Cholera-COD,5,2011,7/22/2011,Cholera,NA,Democratic Republic of the Congo,COD,"Bandundu, Equateur, Kinshasa and P Orientale",NA,NA,03/??/2011,NA,NA,NA,NA,NA,NA,NA,NA,3896,265,7,yes,NA,NA,NA,NA,https://www.who.int/csr/don/2011_07_22/en/,DON-2011-07-22
2011-Cholera-COG,5,2011,7/22/2011,Cholera,NA,Republic of the Congo,COG,"Brazzaville, Cuvette, Likouala and Plateaux",NA,NA,6/14/2011,NA,NA,yes,NA,NA,4,NA,181,NA,6,3,yes,NA,NA,NA,NA,https://www.who.int/csr/don/2011_07_22/en/,DON-2011-07-22
2011-H5 Influenza-KHM,3,2011,8/2/2011,H5N1,NA,Cambodia,KHM,Chork Reaksmey,7/11/2011,7/18/2011,NA,NA,NA,yes,NA,NA,17,NA,NA,NA,15,NA,yes,yes,NA,NA,NA,https://www.who.int/csr/don/2011_08_02/en/,DON-2011-08-02
2011-H5 Influenza-EGY,3,2011,8/9/2011,H5N1,NA,Egypt,EGY,Demnhoor,7/12/2011,NA,NA,yes,NA,yes,NA,NA,151,NA,NA,NA,52,NA,yes,NA,NA,NA,NA,https://www.who.int/csr/don/2011_08_09/en/,DON-2011-08-09
2011-Unknown Illness-AGO,7,2011,8/15/2011,unknown,NA,Angola,AGO,schools in Luanda,NA,NA,yes,NA,NA,NA,NA,NA,NA,NA,NA,NA,NA,NA,yes,NA,NA,NA,unknown ilness; occurs suddenly and resolves within a few hours,https://www.who.int/csr/don/2011_08_15/en/,DON-2011-08-15
2011-West Nile Virus-Europe,6,2011,8/16/2011,WNV,NA,Europe,NA,"Albania, Greece, Israel, Romania, Russian Federation",NA,NA,Beginning July,NA,NA,yes,NA,NA,42,NA,NA,NA,NA,NA,yes,NA,NA,NA,"general info given for europe, but individual numbers reported for each country listed",https://www.who.int/csr/don/2011_08_16/en/,DON-2011-08-16
2011-H5 Influenza-KHM,3,2011,8/19/2011,H5N1,NA,Cambodia,KHM,Taing Thleung,8/7/2011,8/12/2011,NA,NA,NA,yes,NA,NA,18,NA,NA,NA,16,NA,yes,NA,NA,NA,NA,https://www.who.int/csr/don/2011_08_19/en/,DON-2011-08-19
2011-WPV-CHN,5,2011,9/1/2011,WPV1,NA,China,CHN,Hotan Prefecture,7/3/2011,NA,NA,yes,NA,yes,NA,NA,4,NA,NA,NA,NA,NA,yes,NA,NA,NA,related to pakistan strain,https://www.who.int/csr/don/2011_09_01/en/,DON-2011-09-01
2011-WPV-PAK,5,2011,9/20/2011,WPV,NA,Pakistan,PAK,Khuyber,NA,NA,NA,9/13/2011,NA,NA,NA,NA,NA,NA,NA,84,NA,NA,yes,NA,yes,NA,WPV 1 & 3,https://www.who.int/csr/don/2011_09_20/en/,DON-2011-09-20
2011-Measles-Europe,1,2011,10/7/2011,Measles,NA,Europe,NA,"France (highest number), Germany, Kyrgyzstan, Romany, Former Yugoslav Republic of Macedonia, UK, Israel, 40 states total",NA,NA,NA,1/1/2011,NA,NA,NA,NA,20025,NA,NA,NA,11,NA,NA,NA,NA,NA,40 Member States from Jan to July,https://www.who.int/csr/don/2011_10_07/en/,DON-2011-10-07
2011-Measles-COD,1,2011,10/7/2011,Measles,NA,Democratic Republic of the Congo,COD,NA,NA,NA,NA,09/??/2011,NA,NA,NA,NA,NA,NA,NA,103000,1100,NA,NA,NA,NA,NA,NA,https://www.who.int/csr/don/2011_10_07/en/,DON-2011-10-07
2011-Measles-NGA,1,2011,10/7/2011,Measles,NA,Nigeria,NGA,NA,NA,NA,NA,09/??/2011,NA,NA,NA,NA,NA,NA,NA,17428,NA,NA,NA,NA,NA,NA,NA,https://www.who.int/csr/don/2011_10_07/en/,DON-2011-10-07
2011-Measles-ZMB,1,2011,10/7/2011,Measles,NA,Zambia,ZMB,NA,NA,NA,NA,09/??/2011,NA,NA,NA,NA,NA,NA,NA,5397,NA,NA,NA,NA,NA,NA,NA,https://www.who.int/csr/don/2011_10_07/en/,DON-2011-10-07
2011-Measles-ETH,1,2011,10/7/2011,Measles,NA,Ethiopia,ETH,NA,NA,NA,NA,09/??/2011,NA,NA,NA,NA,NA,NA,NA,2902,NA,NA,NA,NA,NA,NA,NA,https://www.who.int/csr/don/2011_10_07/en/,DON-2011-10-07
2011-Measles-CAN,1,2011,10/7/2011,Measles,NA,Canada,CAN,Quebec,NA,NA,NA,yes,NA,NA,NA,NA,NA,NA,NA,742,NA,NA,NA,NA,NA,NA,linked to Europe,https://www.who.int/csr/don/2011_10_07/en/,DON-2011-10-07
2011-Measles-USA,1,2011,10/7/2011,Measles,NA,United States of America,USA,NA,NA,NA,NA,yes,NA,NA,NA,NA,NA,NA,NA,213,NA,NA,NA,NA,NA,NA,linked to Malaysia,https://www.who.int/csr/don/2011_10_07/en/,DON-2011-10-07
2011-Measles-ECU,1,2011,10/7/2011,Measles,NA,Ecuador,ECU,NA,NA,NA,NA,yes,NA,NA,NA,NA,NA,NA,NA,41,NA,NA,NA,NA,NA,NA,linked to Kenya,https://www.who.int/csr/don/2011_10_07/en/,DON-2011-10-07
2011-Measles-BRA,1,2011,10/7/2011,Measles,NA,Brazil,BRA,NA,NA,NA,NA,yes,NA,NA,NA,NA,NA,NA,NA,18,NA,NA,NA,NA,NA,NA,linked to Europe,https://www.who.int/csr/don/2011_10_07/en/,DON-2011-10-07
2011-Measles-COL,1,2011,10/7/2011,Measles,NA,Colombia,COL,NA,NA,NA,NA,yes,NA,NA,NA,NA,NA,NA,NA,7,NA,NA,NA,NA,NA,NA,linked to Europe,https://www.who.int/csr/don/2011_10_07/en/,DON-2011-10-07
2011-Measles-MEX,1,2011,10/7/2011,Measles,NA,Mexico,MEX,NA,NA,NA,NA,yes,NA,NA,NA,NA,NA,NA,NA,3,NA,NA,NA,NA,NA,NA,linked to Europe,https://www.who.int/csr/don/2011_10_07/en/,DON-2011-10-07
2011-Measles-CHL,1,2011,10/7/2011,Measles,NA,Chile,CHL,NA,NA,NA,NA,yes,NA,NA,NA,NA,NA,NA,NA,6,NA,NA,NA,NA,NA,NA,linked to Malaysia,https://www.who.int/csr/don/2011_10_07/en/,DON-2011-10-07
2011-H5 Influenza-IDN,3,2011,10/10/2011,H5N1,NA,Indonesia,IDN,West Jakarta,10/8/2011,10/8/2011,NA,NA,NA,yes,NA,NA,179,NA,NA,NA,147,NA,NA,NA,NA,NA,NA,https://www.who.int/csr/don/2011_10_10/en/,DON-2011-10-10
2011-H5 Influenza-IDN,3,2011,10/26/2011,H5N1,NA,Indonesia,IDN,Bangli,9/27/2011,10/5/2011,NA,NA,NA,yes,NA,NA,181,NA,NA,NA,149,NA,yes,NA,NA,NA,NA,https://www.who.int/csr/don/2011_10_26/en/,DON-2011-10-26
2011-H5 Influenza-EGY,3,2011,11/2/2011,H5N1,NA,Egypt,EGY,Mahala,9/17/2011,9/21/2011,NA,yes,NA,yes,NA,NA,152,NA,NA,NA,52,NA,yes,NA,NA,NA,NA,https://www.who.int/csr/don/2011_11_02/en/,DON-2011-11-02
2011-Lead Poisoning-NGA,7,2011,11/11/2011,Lead poisoning,NA,Nigeria,NGA,"Zamfara state: Anka, Bukuyum, Maru",NA,03/??/2010,NA,NA,NA,NA,NA,NA,NA,NA,NA,NA,NA,1,yes,yes,NA,NA,"mass lead poisoning related to mining, esp in children",https://www.who.int/csr/don/2011_11_11/en/,DON-2011-11-11
2011-H5 Influenza-IDN,3,2011,11/15/2011,H5N1,NA,Indonesia,IDN,Bangli,10/10/2011,NA,NA,NA,NA,yes,NA,NA,182,NA,NA,NA,150,NA,yes,NA,NA,NA,NA,https://www.who.int/csr/don/2011_11_15/en/,DON-2011-11-15
2011-H3 Influenza-USA,3,2011,11/24/2011,S-OtrH3N2,NA,United States of America,USA,Iowa,11/10/2011,NA,NA,yes,11/20/2011,11/18/2011,NA,NA,3,NA,NA,NA,0,NA,yes,NA,NA,NA,NA,https://www.who.int/csr/don/2011_11_24/en/,DON-2011-11-24
2011-H5 Influenza-EGY,3,2011,11/29/2011,H5N1,NA,Egypt,EGY,Met Salseel,11/10/2011,11/16/2011,NA,yes,NA,11/21/2011,NA,NA,153,NA,NA,NA,52,NA,yes,NA,NA,NA,NA,https://www.who.int/csr/don/2011_11_29/en/,DON-2011-11-29
2011-Yellow Fever-SEN,6,2011,12/1/2011,Yellow fever,NA,Senegal,SEN,Kédougou and Saraya Health districts,NA,7/23/2011,NA,10/26/2011,NA,10/10/2011,NA,NA,3,NA,NA,NA,0,NA,yes,NA,NA,NA,NA,https://www.who.int/csr/don/2011_12_01/en/,DON-2011-12-01
2011-H5 Influenza-EGY,3,2011,12/15/2011,H5N1,NA,Egypt,EGY,Dakahlia,11/26/2011,12/1/2011,NA,yes,NA,12/3/2011,NA,NA,155,NA,NA,NA,53,NA,yes,NA,NA,NA,NA,https://www.who.int/csr/don/2011_12_15/en/,DON-2011-12-15
2011-H5 Influenza-EGY,3,2011,12/21/2011,H5N1,NA,Egypt,EGY,Dakahlia,12/8/2011,12/15/2011,NA,yes,NA,12/18/2011,NA,NA,156,NA,NA,NA,54,NA,yes,NA,NA,NA,NA,https://www.who.int/csr/don/2011_12_21/en/,DON-2011-12-21
2012-H5 Influenza-CHN,3,2012,1/5/2012,H5N1,NA,China,CHN,Shenzhen,12/21/2011,12/25/2011,NA,yes,12/31/2011,12/30/2011,NA,NA,41,NA,NA,NA,27,NA,yes,NA,NA,NA,NA,https://www.who.int/csr/don/2012_01_05b/en/,DON-2012-01-05b
2012-H5 Influenza-EGY,3,2012,1/5/2012,H5N1,NA,Egypt,EGY,Menofia,12/16/2011,12/21/2011,NA,yes,NA,12/24/2011,NA,NA,157,NA,NA,NA,55,NA,yes,NA,NA,NA,NA,https://www.who.int/csr/don/2012_01_05/en/,DON-2012-01-05
2012-H5 Influenza-IDN,3,2012,1/11/2012,H5N1,NA,Indonesia,IDN,Jakarta,12/31/2011,1/6/2012,NA,NA,NA,yes,NA,NA,183,NA,NA,NA,151,NA,yes,NA,NA,NA,NA,https://www.who.int/csr/don/2012_01_11/en/,DON-2012-01-11
2012-H5 Influenza-KHM,3,2012,1/16/2012,H5N1,NA,Cambodia,KHM,Banteay Meanchey,1/3/2012,1/9/2012,NA,NA,NA,yes,NA,NA,NA,NA,NA,19,16,NA,yes,NA,NA,NA,NA,https://www.who.int/csr/don/2012_01_16/en/,DON-2012-01-16
2012-Silicon Implants-Europe,7,2012,1/17/2012,Silicon implants,NA,European Union,NA,NA,NA,NA,NA,NA,NA,NA,NA,NA,NA,NA,NA,NA,NA,NA,03/??/2010,NA,NA,NA,implant ruptures; PIP implants taken off the market,https://www.who.int/csr/don/2012_01_17/en/,DON-2012-01-17
2012-H5 Influenza-KHM,3,2012,1/18/2012,H5N1,NA,Cambodia,KHM,NA,NA,NA,NA,NA,NA,NA,NA,NA,NA,NA,NA,19,17,NA,NA,NA,NA,NA,death update (from 1/16),https://www.who.int/csr/don/2012_01_18/en/,DON-2012-01-18
2012-H5 Influenza-EGY,3,2012,1/19/2012,H5N1,NA,Egypt,EGY,"Cairo, Fayium",NA,10/30/2011,NA,yes,NA,yes,NA,NA,159,NA,NA,NA,55,NA,yes,NA,NA,NA,NA,https://www.who.int/csr/don/2012_01_19b/en/,DON-2012-01-19b
2012-H5 Influenza-IDN,3,2012,1/19/2012,H5N1,NA,Indonesia,IDN,Jakarta,1/13/2012,1/7/2011,NA,NA,NA,yes,NA,NA,184,NA,NA,NA,152,NA,yes,NA,NA,NA,NA,https://www.who.int/csr/don/2012_01_19/en/,DON-2012-01-19
2012-H5 Influenza-VNM,3,2012,1/20/2012,H5N1,NA,Vietnam,VNM,Kien Giang,1/10/2012,1/14/2012,NA,NA,NA,1/17/2012,NA,NA,NA,NA,NA,120,60,NA,yes,NA,NA,NA,NA,https://www.who.int/csr/don/2012_01_20/en/,DON-2012-01-20
2012-H5 Influenza-CHN,3,2012,1/24/2012,H5N1,NA,China,CHN,Guiyan,1/6/2012,NA,NA,yes,NA,1/22/2012,NA,NA,1,NA,NA,NA,1,NA,yes,NA,NA,NA,new case,https://www.who.int/csr/don/2012_01_24/en/,DON-2012-01-24
2012-Yellow Fever-GHA,6,2012,2/3/2012,Yellow fever,NA,Ghana,GHA,"Builsa, Kassena-Nankana-West, Kitampo-South",10/11/2011,NA,NA,12/20/2011,NA,yes,NA,NA,3,NA,NA,NA,2,NA,11/??/2011,NA,NA,NA,NA,https://www.who.int/csr/don/2012_02_03b/en/,DON-2012-02-03b
2012-Yellow Fever-CMR,6,2012,2/3/2012,Yellow fever,NA,Cameroon,CMR,"Guider, Bibemi, Gaschiga, Lagdo, Mayo Oulo and Golombe districts",10/??/2011,NA,NA,12/??/2011,yes,yes,NA,NA,13,NA,NA,23,7,NA,yes,NA,NA,NA,NA,https://www.who.int/csr/don/2012_02_03/en/,DON-2012-02-03
2012-H5 Influenza-VNM,3,2012,2/8/2012,H5N1,NA,Vietnam,VNM,Soc Trang,1/23/2012,1/25/2012,NA,NA,NA,yes,NA,NA,NA,NA,NA,121,61,NA,yes,NA,NA,NA,NA,https://www.who.int/csr/don/2012_02_08/en/,DON-2012-02-08
2012-H5 Influenza-IDN,3,2012,2/21/2012,H5N1,NA,Indonesia,IDN,Banten,1/8/2012,2/12/2012,NA,NA,NA,yes,NA,NA,185,NA,NA,NA,153,NA,yes,NA,NA,NA,NA,https://www.who.int/csr/don/2012_02_21/en/,DON-2012-02-21
2012-H5 Influenza-EGY,3,2012,2/22/2012,H5N1,NA,Egypt,EGY,Menofia,2/12/2012,NA,NA,yes,NA,yes,NA,NA,160,NA,NA,NA,55,NA,yes,NA,NA,NA,NA,https://www.who.int/csr/don/2012_02_22/en/,DON-2012-02-22
2012-H5 Influenza-EGY,3,2012,2/24/2012,H5N1,NA,Egypt,EGY,Gharbeia,2/14/2012,2/15/2012,NA,yes,NA,yes,NA,NA,161,NA,NA,NA,55,NA,yes,NA,NA,NA,NA,https://www.who.int/csr/don/2012_02_24/en/,DON-2012-02-24
2012-H5 Influenza-EGY,3,2012,2/28/2012,H5N1,NA,Egypt,EGY,Behira,2/16/2012,2/21/2012,NA,NA,NA,yes,NA,NA,163,NA,NA,NA,57,NA,yes,NA,NA,NA,NA,https://www.who.int/csr/don/2012_02_28/en/,DON-2012-02-28
2012-H5 Influenza-IDN,3,2012,3/1/2012,H5N1,NA,Indonesia,IDN,Badung,2/11/2012,2/16/2012,NA,yes,NA,yes,NA,NA,186,NA,NA,NA,154,NA,yes,NA,NA,NA,NA,https://www.who.int/csr/don/2012_03_01/en/,DON-2012-03-01
2012-H5 Influenza-BGD,3,2012,3/2/2012,H5N1,NA,Bangladesh,BGD,Dhaka,NA,2/26/2012,NA,NA,yes,yes,NA,NA,4,NA,NA,NA,NA,NA,yes,NA,NA,NA,NA,https://www.who.int/csr/don/2012_03_02/en/,DON-2012-03-02
2012-H5 Influenza-VNM,3,2012,3/5/2012,H5N1,NA,Vietnam,VNM,Binh Duong,2/17/2012,2/21/2012,NA,yes,NA,2/25/2012,NA,NA,122,NA,NA,NA,61,NA,yes,NA,NA,NA,NA,https://www.who.int/csr/don/2012_03_05/en/,DON-2012-03-05
2012-H5 Influenza-BGD,3,2012,3/7/2012,H5N1,NA,Bangladesh,BGD,Dhaka,NA,NA,NA,NA,NA,yes,NA,NA,6,NA,NA,NA,NA,NA,yes,NA,NA,NA,NA,https://www.who.int/csr/don/2012_03_07/en/,DON-2012-03-07
2012-H5 Influenza-VNM,3,2012,3/12/2012,H5N1,NA,Vietnam,VNM,Dak Lak,2/29/2012,2/29/2012,NA,NA,NA,yes,NA,NA,123,NA,NA,NA,61,NA,yes,NA,NA,NA,NA,https://www.who.int/csr/don/2012_03_12/en/,DON-2012-03-12
2012-H5 Influenza-IDN,3,2012,3/12/2012,H5N1,NA,Indonesia,IDN,Bengkulu,2/23/2012,2/24/2012,NA,yes,NA,yes,NA,NA,NA,NA,NA,187,155,NA,yes,NA,NA,NA,NA,https://www.who.int/csr/don/2012_03_12b/en/,DON-2012-03-12b
2012-H5 Influenza-EGY,3,2012,3/19/2012,H5N1,NA,Egypt,EGY,Dakahlia,3/6/2012,6/12/2012,NA,yes,NA,yes,NA,NA,164,NA,NA,NA,58,NA,yes,NA,NA,NA,NA,https://www.who.int/csr/don/2012_03_19/en/,DON-2012-03-19
2012-Meningococcal Disease-BEN,1,2012,3/23/2012,Meningococcal disease,NA,Benin,BEN,NA,NA,NA,1/1/2012,NA,NA,NA,NA,NA,NA,NA,381,NA,38,10,yes,NA,NA,NA,NA,https://www.who.int/csr/don/2012_03_23/en/,DON-2012-03-23
2012-Meningococcal Disease-BFA,1,2012,3/23/2012,Meningococcal disease,NA,Burkina Faso,BFA,NA,NA,NA,1/1/2012,NA,NA,NA,NA,NA,NA,NA,1966,NA,212,10.8,yes,NA,NA,NA,NA,https://www.who.int/csr/don/2012_03_23/en/,DON-2012-03-23
2012-Meningococcal Disease-TCD,1,2012,3/23/2012,Meningococcal disease,NA,Chad,TCD,NA,NA,NA,1/1/2012,NA,NA,NA,NA,NA,NA,NA,1043,NA,67,6.4,yes,NA,NA,NA,NA,https://www.who.int/csr/don/2012_03_23/en/,DON-2012-03-23
2012-Meningococcal Disease-CIV,1,2012,3/23/2012,Meningococcal disease,NA,Cote d'Ivoire,CIV,NA,NA,NA,1/1/2012,NA,NA,NA,NA,NA,NA,NA,281,NA,39,13.9,yes,NA,NA,NA,NA,https://www.who.int/csr/don/2012_03_23/en/,DON-2012-03-23
2012-Meningococcal Disease-GHA,1,2012,3/23/2012,Meningococcal disease,NA,Ghana,GHA,NA,NA,NA,1/1/2012,NA,NA,NA,NA,NA,NA,NA,369,NA,37,10,yes,NA,NA,NA,NA,https://www.who.int/csr/don/2012_03_23/en/,DON-2012-03-23
2012-H5 Influenza-IDN,3,2012,3/26/2012,H5N1,NA,Indonesia,IDN,Nusa Tenggara Barat,2/28/2012,3/1/2012,NA,yes,NA,NA,NA,NA,NA,NA,NA,188,156,NA,yes,NA,NA,NA,NA,https://www.who.int/csr/don/2012_03_26/en/,DON-2012-03-26
2012-H5 Influenza-EGY,3,2012,4/2/2012,H5N1,NA,Egypt,EGY,Demiatta,3/19/2012,3/20/2012,NA,yes,NA,3/22/2012,NA,NA,166,NA,NA,NA,59,NA,yes,NA,NA,NA,NA,https://www.who.int/csr/don/2012_04_02/en/,DON-2012-04-02
2012-Lassa Fever-NGA,2,2012,4/4/2012,Lassa Fever,NA,Nigeria,NGA,NA,NA,NA,NA,Beginning 2012,NA,yes,NA,NA,NA,NA,623,NA,70,NA,yes,yes,NA,NA,NA,https://www.who.int/csr/don/2012_04_04/en/,DON-2012-04-04
2012-H5 Influenza-KHM,3,2012,4/5/2012,H5N1,NA,Cambodia,KHM,Kampong Chhnang,3/22/2012,3/28/2012,NA,NA,NA,3/30/2012,NA,NA,NA,NA,NA,20,18,NA,yes,yes,NA,NA,NA,https://www.who.int/csr/don/2012_04_05/en/,DON-2012-04-05
2012-H5 Influenza-EGY,3,2012,4/12/2012,H5N1,NA,Egypt,EGY,Giza,4/1/2012,4/7/2012,NA,yes,NA,yes,NA,NA,167,NA,NA,NA,60,NA,yes,NA,NA,NA,NA,https://www.who.int/csr/don/2012_04_12/en/,DON-2012-04-12
2012-H5 Influenza-IDN,3,2012,5/2/2012,H5N1,NA,Indonesia,IDN,Riau,4/17/2012,4/21/2012,NA,yes,NA,yes,NA,NA,NA,NA,NA,189,157,NA,yes,NA,NA,NA,NA,https://www.who.int/csr/don/2012_05_02/en/,DON-2012-05-02
2012-Meningococcal Disease-African Meningitis Belt,1,2012,5/24/2012,Meningococcal disease,NA,African Meningitis Belt,NA,"Benin, Burkina Faso, Chad, Central African Republic, Côte d'Ivoire, Gambia, Ghana, Mali, Nigeria and Sudan",NA,NA,1/1/2012,NA,NA,NA,NA,NA,NA,NA,NA,11647,960,8.2,yes,NA,NA,NA,NA,https://www.who.int/csr/don/2012_05_24/en/,DON-2012-05-24
2012-H5 Influenza-KHM,3,2012,5/29/2012,H5N1,NA,Cambodia,KHM,Kampong Speu,5/20/2012,5/25/2012,NA,NA,NA,5/26/2012,NA,NA,NA,NA,NA,21,19,NA,yes,yes,NA,NA,NA,https://www.who.int/csr/don/2012_05_29/en/,DON-2012-05-29
2012-H5 Influenza-CHN,3,2012,6/5/2012,H5N1,NA,China,CHN,Guangzhou,5/23/2012,5/26/2012,NA,yes,NA,6/2/2012,NA,NA,1,NA,NA,NA,0,NA,NA,NA,NA,NA,*reported by Hong Kong,https://www.who.int/csr/don/2012_06_05/en/,DON-2012-06-05
2012-H5 Influenza-EGY,3,2012,6/7/2012,H5N1,NA,Egypt,EGY,Kfr-Elsheikh,4/25/2012,4/26/2012,NA,yes,yes,yes,NA,NA,168,NA,NA,NA,60,NA,yes,NA,NA,NA,NA,https://www.who.int/csr/don/2012_06_07/en/,DON-2012-06-07
2012-HFMD-KHM,1,2012,7/4/2012,Undiagnosed illness,NA,Cambodia,KHM,Southern part of country,04/??/2012,NA,NA,yes,NA,NA,NA,NA,NA,NA,NA,62,61,NA,yes,NA,NA,NA,NA,https://www.who.int/csr/don/2012_07_04/en/,DON-2012-07-04
2012-HFMD-KHM,1,2012,7/6/2012,Undiagnosed illness,NA,Cambodia,KHM,Southern and central parts of the country,NA,04/??/2012,yes,yes,NA,yes,NA,NA,NA,NA,NA,74,56,NA,NA,NA,NA,NA,"all these samples were found negative for H5N1 and other influenza viruses, SARS, and Nipah",https://www.who.int/csr/don/2012_07_06a/en/,DON-2012-07-06a
2012-H5 Influenza-IDN,3,2012,7/6/2012,H5N1,NA,Indonesia,IDN,West Java,6/18/2012,6/20/2012,NA,yes,NA,yes,NA,NA,NA,NA,NA,190,158,NA,yes,NA,NA,NA,NA,https://www.who.int/csr/don/2012_07_06/en/,DON-2012-07-06
2012-HFMD-KHM,1,2012,7/9/2012,Undiagnosed illness,NA,Cambodia,KHM,NA,NA,NA,NA,NA,NA,yes,NA,NA,NA,NA,NA,59,52,NA,yes,NA,NA,NA,"a significant proportion of the samples tested positive for enterovirus 71 (EV-71)//Additionally, a number of other pathogens, including dengue and streptococcus suis were identified in some of the samples. The samples were found to be negative for H5N1 and other influenza viruses, SARS and Nipah.",https://www.who.int/csr/don/2012_07_09/en/,DON-2012-07-09
2012-HFMD-KHM,1,2012,7/13/2012,HFMD,NA,Cambodia,KHM,NA,NA,NA,04/??2012,NA,NA,yes,NA,NA,NA,NA,NA,78,54,NA,yes,NA,NA,NA,NA,https://www.who.int/csr/don/2012_07_13/en/,DON-2012-07-13
2012-Cholera-COD,5,2012,7/23/2012,Cholera,NA,Democratic Republic of the Congo,COD,"North Kivu: Birambizo, Goma, Karisimbi, Kiroshe, Mutwanga, Mweso and Rwanguba",NA,NA,6/11/2012,yes,NA,yes,NA,NA,NA,NA,NA,368,NA,NA,yes,yes,NA,NA,NA,https://www.who.int/csr/don/2012_07_23/en/,DON-2012-07-23
2012-Ebola-UGA,2,2012,7/29/2012,Ebola,NA,Uganda,UGA,"Nyanswiga, Kibaale",NA,NA,beginning July,yes,NA,yes,NA,NA,NA,NA,NA,20,14,NA,yes,NA,NA,NA,NA,https://www.who.int/csr/don/2012_07_29/en/,DON-2012-07-29
2012-Ebola-UGA,2,2012,8/3/2012,Ebola,NA,Uganda,UGA,"Kagadi hospital, Kibaale district",NA,NA,NA,yes,NA,yes,NA,NA,5,NA,53,NA,16,NA,yes,yes,NA,NA,NA,https://www.who.int/csr/don/2012_08_03/en/,DON-2012-08-03
2012-Ebola-UGA,2,2012,8/10/2012,Ebola,NA,Uganda,UGA,"Kagadi hospital, Kibaale district",NA,NA,NA,8/8/2012,NA,yes,NA,NA,10,NA,NA,23,16,NA,yes,yes,NA,NA,NA,https://www.who.int/csr/don/2012_08_10/en/,DON-2012-08-10
2012-H5 Influenza-IDN,3,2012,8/10/2012,H5N1,NA,Indonesia,IDN,Yogyakarta,7/24/2012,7/27/2012,NA,yes,NA,yes,NA,NA,NA,NA,NA,191,159,NA,NA,NA,NA,NA,NA,https://www.who.int/csr/don/2012_08_10b/en/,DON-2012-08-10b
2012-Ebola-UGA,2,2012,8/14/2012,Ebola,NA,Uganda,UGA,Kibaale,NA,NA,NA,NA,NA,yes,NA,NA,10,NA,NA,24,16,NA,yes,yes,NA,NA,NA,https://www.who.int/csr/don/2012_08_14/en/,DON-2012-08-14
2012-Ebola-UGA,2,2012,8/17/2012,Ebola,NA,Uganda,UGA,Kibaale,NA,NA,NA,NA,NA,yes,NA,NA,11,NA,NA,24,16,NA,yes,yes,NA,NA,NA,https://www.who.int/csr/don/2012_08_17/en/,DON-2012-08-17
2012-Ebola-COD,2,2012,8/17/2012,Ebola,NA,Democratic Republic of the Congo,COD,"Isiro, Dungu",NA,NA,NA,8/17/2012,NA,yes,NA,NA,2,NA,10,NA,6,NA,yes,yes,NA,NA,NA,https://www.who.int/csr/don/2012_08_18/en/,DON-2012-08-18
2012-Ebola-COD,2,2012,8/21/2012,Ebola,NA,Democratic Republic of the Congo,COD,"Isiro, Pawa, Dungu",NA,NA,8/20/2012,NA,NA,yes,NA,NA,2,13,NA,15,10,NA,yes,yes,NA,NA,NA,https://www.who.int/csr/don/2012_08_21/en/,DON-2012-08-21
2012-Cholera-SLE,5,2012,8/22/2012,Cholera,NA,Sierra Leone,SLE,"Bonthe, Kono, Western Area, Tonkolili",NA,NA,1/1/2012,NA,NA,NA,NA,NA,NA,NA,NA,11653,216,1.9,yes,yes,NA,NA,numbers since beginning of the year; there have been 5706 since the beginning of august alone,https://www.who.int/csr/don/2012_08_22/en/,DON-2012-08-22
2012-Cholera-SLE,5,2012,8/30/2012,Cholera,NA,Sierra Leone,SLE,"Western Area, Port Loko, Kenema District",NA,NA,1/1/2012,NA,NA,NA,NA,NA,NA,NA,NA,13934,232,1.7,yes,yes,NA,NA,NA,https://www.who.int/csr/don/2012_08_30a/en/,DON-2012-08-30a
2012-Ebola-COD,2,2012,8/30/2012,Ebola,NA,Democratic Republic of the Congo,COD,"Isiro, Viadana, Dungu",NA,NA,8/28/2012,NA,NA,yes,NA,NA,6,6,12,24,11,NA,yes,yes,NA,NA,NA,https://www.who.int/csr/don/2012_08_30/en/,DON-2012-08-30
2012-Ebola-UGA,2,2012,9/3/2012,Ebola,NA,Uganda,UGA,Kibaale,NA,NA,NA,yes,NA,yes,NA,NA,11,NA,NA,24,17,NA,yes,NA,NA,NA,no new cases--> near end of outbreak,https://www.who.int/csr/don/2012_09_03/en/,DON-2012-09-03
2012-HPS-USA,4,2012,9/4/2012,HPS,NA,United States of America,USA,"Yosemite: ""Signature Tent Cabins"" in Curry Village",06/??/2012,NA,NA,yes,NA,NA,NA,NA,NA,NA,NA,6,2,NA,yes,yes,NA,NA,NA,https://www.who.int/csr/don/2012_09_04/en/,DON-2012-09-04
2012-Ebola-COD,2,2012,9/5/2012,Ebola,NA,Democratic Republic of the Congo,COD,"Isiro, Viadana, Dungu",NA,NA,9/3/2012,NA,yes,yes,NA,NA,8,6,14,28,14,NA,yes,yes,NA,NA,NA,https://www.who.int/csr/don/2012_09_05/en/,DON-2012-09-05
2012-Cholera-SLE,5,2012,9/8/2012,Cholera,NA,Sierra Leone,SLE,Western area of country,NA,NA,9/5/2012,NA,NA,NA,NA,NA,NA,NA,NA,16360,255,1.6,yes,yes,NA,NA,as of notification date,https://www.who.int/csr/don/2012_09_08/en/,DON-2012-09-08
2012-HPS-USA,4,2012,9/12/2012,HPS,NA,United States of America,USA,"Yosemite: ""Signature Tent Cabins"" in Curry Village. ""High Sierra Camps""",6/10/2012,NA,9/7/2012,NA,NA,NA,NA,NA,NA,NA,NA,8,3,NA,yes,yes,NA,NA,NA,https://www.who.int/csr/don/2012_09_12/en/,DON-2012-09-12
2012-Ebola-COD,2,2012,9/14/2012,Ebola,NA,Democratic Republic of the Congo,COD,"Isiro, Viadana",NA,NA,9/12/2012,NA,yes,yes,NA,NA,9,32,28,41,18,NA,yes,yes,NA,NA,NA,https://www.who.int/csr/don/2012_09_14/en/,DON-2012-09-14
2012-Ebola-COD,2,2012,9/18/2012,Ebola,NA,Democratic Republic of the Congo,COD,"Isiro, Viadana",NA,NA,9/15/2012,NA,NA,yes,NA,NA,14,32,26,46,19,NA,yes,NA,NA,NA,NA,https://www.who.int/csr/don/2012_09_18/en/,DON-2012-09-18
2012-Cholera-SLE,5,2012,9/18/2012,Cholera,NA,Sierra Leone,SLE,Western area of country,NA,NA,1/1/2012,NA,NA,NA,NA,NA,NA,NA,NA,18508,271,1.5,yes,yes,NA,NA,NA,https://www.who.int/csr/don/2012_09_18b/en/,DON-2012-09-18b
2012-MERS-CoV-SAU,2,2012,9/23/2012,nCoV,NA,United Kingdom,GBR,Saudi Arabia*,9/3/2012,NA,NA,9/22/2013,NA,yes,NA,NA,1,NA,NA,NA,NA,NA,NA,NA,NA,NA,matched other nCoV of Saudi national,https://www.who.int/csr/don/2012_09_23/en/,DON-2012-09-23
2012-MERS-CoV-SAU,2,2012,9/25/2012,nCoV,NA,NA,NA,NA,NA,NA,NA,no,NA,NA,NA,NA,0,NA,NA,0,0,NA,NA,NA,NA,NA,no new cases reported//also repeated info from previous report,https://www.who.int/csr/don/2012_09_25/en/,DON-2012-09-25
2012-Ebola-COD,2,2012,9/27/2012,Ebola,NA,Democratic Republic of the Congo,COD,"Isiro, Viadan",NA,NA,NA,9/24/2012,NA,yes,NA,NA,19,32,28,51,20,NA,yes,yes,NA,NA,NA,https://www.who.int/csr/don/2012_09_27/en/,DON-2012-09-27
2012-MERS-CoV-SAU,2,2012,9/28/2012,nCoV,NA,NA,NA,NA,NA,NA,NA,no,NA,NA,NA,NA,NA,NA,NA,NA,NA,NA,yes,NA,NA,NA,no new cases; progress in characterization,https://www.who.int/csr/don/2012_09_28/en/,DON-2012-09-28
2012-MERS-CoV-SAU,2,2012,9/29/2012,nCoV,NA,NA,NA,NA,NA,NA,NA,no,NA,yes,NA,NA,NA,NA,NA,NA,NA,NA,yes,NA,NA,NA,no new cases//laboratory diagnostics now available,https://www.who.int/csr/don/2012_09_29/en/,DON-2012-09-29
2012-Ebola-UGA,2,2012,10/4/2012,Ebola,NA,Uganda,UGA,Kibaale,NA,NA,NA,NA,NA,yes,10/4/2012,NA,11,NA,NA,24,17,NA,yes,yes,NA,NA,end of outbreak,https://www.who.int/csr/don/2012_10_04/en/,DON-2012-10-04
2012-Cholera-SLE,5,2012,10/8/2012,Cholera,NA,Sierra Leone,SLE,NA,NA,NA,NA,10/2/2012,NA,NA,NA,NA,NA,NA,NA,20736,280,1.35,yes,NA,NA,NA,steady decline in past 2 months,https://www.who.int/csr/don/2012_10_08/en/,DON-2012-10-08
2012-Ebola-COD,2,2012,10/8/2012,Ebola,NA,Democratic Republic of the Congo,COD,"Isiro, Viadana",NA,NA,10/7/2012,NA,NA,yes,NA,NA,31,18,NA,49,24,NA,yes,NA,NA,NA,NA,https://www.who.int/csr/don/2012_10_08a/en/,DON-2012-10-08a
2012-MERS-CoV-SAU,2,2012,10/10/2012,nCoV,NA,Saudi Arabia,SAU,NA,NA,NA,no,no,NA,NA,NA,NA,NA,NA,NA,NA,NA,NA,yes,NA,NA,NA,no new cases since 9/22,https://www.who.int/csr/don/2012_10_10/en/,DON-2012-10-10
2012-MERS-CoV-QAT,2,2012,10/10/2012,nCoV,NA,Qatar,QAT,NA,NA,NA,no,no,NA,NA,NA,NA,NA,NA,NA,NA,NA,NA,yes,NA,NA,NA,no new cases since 9/22,https://www.who.int/csr/don/2012_10_10/en/,DON-2012-10-10
2012-MERS-CoV-GBR,2,2012,10/10/2012,nCoV,NA,United Kingdom,GBR,NA,NA,NA,no,no,NA,NA,NA,NA,NA,NA,NA,NA,NA,NA,yes,NA,NA,NA,no new cases since 9/22,https://www.who.int/csr/don/2012_10_10/en/,DON-2012-10-10
2012-Dengue-PRT,6,2012,10/17/2012,Dengue fever,NA,Portugal,PRT,Madeira,NA,NA,yes,10/17/2012,NA,yes,NA,NA,18,191,NA,NA,NA,NA,yes,NA,NA,NA,NA,https://www.who.int/csr/don/2012_10_17/en/,DON-2012-10-17
2012-Marburg haemorrhagic fever-UGA,2,2012,10/21/2012,Marburg haemorrhagic fever,NA,Uganda,UGA,Kabale,NA,NA,NA,NA,NA,yes,NA,NA,3,NA,NA,NA,NA,NA,yes,NA,NA,NA,NA,https://www.who.int/csr/don/2012_10_21/en/,DON-2012-10-21
2012-Marburg haemorrhagic fever-UGA,2,2012,10/22/2012,Marburg haemorrhagic fever,NA,Uganda,UGA,Kitumba,NA,NA,NA,10/21/2012,NA,yes,NA,NA,3,NA,NA,9,5,NA,yes,NA,NA,NA,NA,https://www.who.int/csr/don/2012_10_22/en/,DON-2012-10-22
2012-Ebola-COD,2,2012,10/26/2012,Ebola,NA,Democratic Republic of the Congo,COD,"Isiro, Viadana",NA,NA,10/24/2012,NA,NA,yes,NA,NA,35,17,NA,52,25,NA,yes,yes,NA,NA,NA,https://www.who.int/csr/don/2012_10_26/en/,DON-2012-10-26
2012-Marburg haemorrhagic fever-UGA,2,2012,10/31/2012,Marburg haemorrhagic fever,NA,Uganda,UGA,"Kabale, Kampala, Ibanda, Mbarara, Kabarole",NA,NA,NA,10/28/2012,NA,yes,NA,NA,NA,NA,NA,18,9,50,yes,yes,NA,NA,NA,https://www.who.int/csr/don/2012_10_31/en/,DON-2012-10-31
2012-Rift Valley Fever-MRT,6,2012,11/1/2012,Rift Valley fever,NA,Mauritania,MRT,"Assaba, Brakna, Hodh Chagui, Hodh Gharbi, Tagant, Trarza",9/16/2012,NA,10/27/2012,10/30/2012,yes,yes,NA,NA,25,NA,NA,34,17,NA,yes,yes,NA,NA,NA,https://www.who.int/csr/don/2012_11_01/en/,DON-2012-11-01
2012-Yellow Fever-SDN,6,2012,11/13/2012,Yellow fever,NA,Sudan,SDN,Greater Darfur,NA,NA,NA,yes,NA,yes,NA,NA,2,NA,329,NA,97,NA,yes,NA,NA,NA,NA,https://www.who.int/csr/don/2012_11_13/en/,DON-2012-11-13
2012-Ebola-UGA,2,2012,11/17/2012,Ebola,NA,Uganda,UGA,Luweero,NA,NA,NA,yes,NA,yes,NA,NA,2,NA,NA,4,3,NA,yes,NA,NA,NA,NA,https://www.who.int/csr/don/2012_11_17/en/,DON-2012-11-17
2012-Yellow Fever-SDN,6,2012,11/22/2012,Yellow fever,NA,Sudan,SDN,Darfur,NA,NA,NA,NA,NA,yes,NA,NA,2,NA,459,NA,116,NA,11/20/2012,NA,NA,NA,mass vaccination campaign,https://www.who.int/csr/don/2012_11_22/en/,DON-2012-11-22
2012-Marburg haemorrhagic fever-UGA,2,2012,11/23/2012,Marburg haemorrhagic fever,NA,Uganda,UGA,"Kabale, Ibanda, Mbarara, Kampala",NA,NA,11/23/2012,NA,NA,yes,NA,NA,NA,NA,NA,20,9,NA,yes,yes,NA,NA,NA,https://www.who.int/csr/don/2012_11_23_update/en/,DON-2012-11-23-update
2012-MERS-CoV-SAU,2,2012,11/23/2012,nCoV,NA,Saudi Arabia,SAU,NA,NA,NA,NA,yes,NA,yes,NA,NA,3,NA,NA,3,1,NA,yes,NA,NA,NA,new cases,https://www.who.int/csr/don/2012_11_23/en/,DON-2012-11-23
2012-MERS-CoV-QAT,2,2012,11/23/2012,nCoV,NA,Qatar,QAT,NA,NA,NA,NA,yes,NA,yes,NA,NA,1,NA,NA,1,0,NA,yes,NA,NA,NA,new cases,https://www.who.int/csr/don/2012_11_23/en/,DON-2012-11-23
2012-Ebola-UGA,2,2012,11/23/2012,Ebola,NA,Uganda,UGA,"Luweero, Kampala",NA,NA,NA,11/23/2012,NA,yes,NA,NA,6,4,NA,10,5,NA,yes,NA,NA,NA,NA,https://www.who.int/csr/don/2012_11_23_ebola/en/,DON-2012-11-23-ebola
2012-MERS-CoV-JOR,2,2012,11/30/2012,nCoV,NA,Jordan,JOR,NA,04/??/2012,NA,NA,11/30/2012,NA,11/??/2012,NA,NA,2,NA,NA,NA,2,NA,yes,NA,NA,NA,retested samples from April and found positive for nCoV,https://www.who.int/csr/don/2012_11_30/en/,DON-2012-11-30
2012-MERS-CoV-SAU,2,2012,11/30/2012,nCoV,NA,Saudi Arabia,SAU,NA,NA,NA,NA,11/28/2012,NA,NA,NA,NA,5,NA,NA,NA,3,NA,NA,NA,NA,NA,NA,https://www.who.int/csr/don/2012_11_30/en/,DON-2012-11-30
2012-Ebola-UGA,2,2012,11/30/2012,Ebola,NA,Uganda,UGA,"Luweero, Kampala",NA,NA,NA,11/28/2012,NA,yes,NA,NA,6,1,NA,7,4,NA,yes,yes,NA,NA,NA,https://www.who.int/csr/don/2012_11_30_ebola/en/,DON-2012-11-30-ebola
2012-Yellow Fever-SDN,6,2012,12/6/2012,Yellow fever,NA,Sudan,SDN,NA,NA,NA,12/4/2012,NA,NA,yes,NA,NA,40,NA,732,NA,165,NA,11/21/2012,NA,NA,NA,NA,https://www.who.int/csr/don/2012_12_06/en/,DON-2012-12-06
2012-Yellow Fever-COG,6,2012,12/12/2012,Yellow fever,NA,Republic of Congo,COG,"Mbama, Ewo, Okoyo",NA,NA,NA,NA,yes,10/??/2012,NA,NA,1,NA,NA,NA,NA,NA,yes,NA,NA,NA,mass vaccination next week,https://www.who.int/csr/don/2012_12_12/en/,DON-2012-12-12
2013-H5 Influenza-KHM,3,2013,2/1/2013,H5N1,NA,Cambodia,KHM,"Phnom Penh, Takeo, Kong Pisey",1/8/2013,NA,NA,yes,yes,1/??/2013,NA,NA,NA,NA,NA,5,4,NA,yes,yes,NA,NA,NA,https://www.who.int/csr/don/2013_02_01/en/,DON-2013-02-01
2013-WPV-EGY,5,2013,2/11/2013,WPV1,NA,Egypt,EGY,Cairo,no,NA,NA,NA,NA,NA,NA,NA,NA,NA,NA,0,NA,NA,yes,NA,NA,NA,detected in soil samples on dec 2,https://www.who.int/csr/don/2013_02_11/en/,DON-2013-02-11
2013-MERS-CoV-GBR,2,2013,2/11/2013,nCoV,NA,The United Kingdom,GBR,NA,1/26/2013,NA,NA,2/11/2013,NA,yes,NA,NA,10,NA,NA,10,NA,NA,yes,NA,NA,NA,global total,https://www.who.int/csr/don/2013_02_11b/en/,DON-2013-02-11b
2013-WPV-NER,5,2013,2/12/2013,WPV1,NA,Niger,NER,Kaduna,11/15/2012,NA,NA,1/3/2013,NA,yes,NA,NA,1,NA,NA,NA,NA,NA,yes,NA,NA,NA,NA,https://www.who.int/csr/don/2013_02_12/en/,DON-2013-02-12
2013-MERS-CoV-GBR,2,2013,2/13/2013,nCoV,NA,The United Kingdom,GBR,NA,NA,NA,NA,2/11/2013,NA,yes,NA,NA,11,NA,NA,11,5,NA,yes,NA,NA,NA,global total,https://www.who.int/csr/don/2013_02_13/en/,DON-2013-02-13
2013-Yellow Fever-TCD,6,2013,2/14/2013,Yellow fever,NA,Chad,TCD,"Goz Beida, Guereda",NA,NA,NA,NA,NA,12/??/2012,NA,NA,2,NA,139,NA,9,NA,yes,NA,NA,NA,NA,https://www.who.int/csr/don/2013_02_14/en/,DON-2013-02-14
2013-MERS-CoV-GBR,2,2013,2/16/2013,nCoV,NA,The United Kingdom,GBR,NA,NA,NA,NA,2/16/2013,NA,yes,NA,NA,12,NA,NA,12,5,NA,yes,NA,NA,NA,global total,https://www.who.int/csr/don/2013_02_16/en/,DON-2013-02-16
2013-MERS-CoV-SAU,2,2013,2/21/2013,nCoV,NA,Saudi Arabia,SAU,NA,NA,1/29/2013,NA,yes,NA,2/18/2013,NA,NA,13,NA,NA,13,7,NA,NA,NA,NA,NA,global total,https://www.who.int/csr/don/2013_02_21/en/,DON-2013-02-21
2013-MERS-CoV-SAU,2,2013,3/6/2013,nCoV,NA,Saudi Arabia,SAU,NA,NA,2/10/2013,NA,yes,NA,yes,NA,NA,14,NA,NA,14,8,NA,NA,NA,NA,NA,global total,https://www.who.int/csr/don/2013_03_06/en/,DON-2013-03-06
2013-MERS-CoV-SAU,2,2013,3/12/2013,nCoV,NA,Saudi Arabia,SAU,NA,2/24/2013,2/28/2013,NA,3/12/2013,NA,yes,NA,NA,15,NA,NA,15,9,NA,NA,NA,NA,NA,global total,https://www.who.int/csr/don/2013_03_12/en/,DON-2013-03-12
2013-MERS-CoV-SAU,2,2013,3/23/2013,nCoV,NA,Saudi Arabia,SAU,NA,NA,NA,NA,3/23/2013,NA,yes,NA,NA,16,NA,NA,16,9,NA,NA,NA,NA,NA,global total,https://www.who.int/csr/don/2013_03_23/en/,DON-2013-03-23
2013-MERS-CoV-UAE,2,2013,3/26/2013,nCoV,NA,Germany,DEU,Munich,NA,NA,NA,3/26/2013,NA,yes,NA,NA,17,NA,NA,17,11,NA,yes,NA,NA,NA,global total,https://www.who.int/csr/don/2013_03_26/en/,DON-2013-03-26
2013-H7 Influenza-CHN,3,2013,4/1/2013,H7N9,NA,China,CHN,"Shanghai, Anhui",2/19/2013,NA,NA,3/31/2013,NA,3/29/2013,NA,NA,3,NA,NA,3,2,NA,yes,NA,NA,NA,NA,https://www.who.int/csr/don/2013_04_01/en/,DON-2013-04-01
2013-H7 Influenza-CHN,3,2013,4/3/2013,H7N9,NA,China,CHN,Jiangsu,3/19/2013,NA,NA,3/3/2013,NA,yes,NA,NA,7,NA,NA,7,2,NA,yes,NA,NA,NA,NA,https://www.who.int/csr/don/2013_04_03/en/,DON-2013-04-03
2013-H7 Influenza-CHN,3,2013,4/4/2013,H7N9,NA,China,CHN,"Zhejiang, Shanghai",3/7/2013,NA,NA,4/4/2013,NA,yes,NA,NA,11,NA,NA,11,5,NA,yes,NA,NA,NA,NA,https://www.who.int/csr/don/2013_04_04/en/,DON-2013-04-04
2013-H7 Influenza-CHN,3,2013,4/5/2013,H7N9,NA,China,CHN,"Shanghai, Jiangsu",3/27/2013,NA,NA,4/5/2013,NA,yes,NA,NA,16,NA,NA,16,6,NA,yes,NA,NA,NA,NA,https://www.who.int/csr/don/2013_04_05/en/,DON-2013-04-05
2013-H7 Influenza-CHN,3,2013,4/6/2013,H7N9,NA,China,CHN,Jiangsu,3/28/2013,NA,NA,4/6/2013,NA,yes,NA,NA,18,NA,NA,18,6,NA,yes,NA,NA,NA,NA,https://www.who.int/csr/don/2013_04_09/en/,DON-2013-04-09
2013-H7 Influenza-CHN,3,2013,4/7/2013,H7N9,NA,China,CHN,Shanghai,3/28/2013,NA,NA,4/7/2013,NA,yes,NA,NA,21,NA,NA,21,6,NA,yes,NA,NA,NA,NA,https://www.who.int/csr/don/2013_04_07/en/,DON-2013-04-07
2013-H7 Influenza-CHN,3,2013,4/9/2013,H7N9,NA,China,CHN,Shanghai,3/28/2013,NA,NA,4/9/2013,NA,yes,NA,NA,24,NA,NA,24,7,NA,yes,NA,NA,NA,NA,https://www.who.int/csr/don/2013_04_09/en/,DON-2013-04-09
2013-H7 Influenza-CHN,3,2013,4/10/2013,H7N9,NA,China,CHN,"Shanghai, Zhejiang, Jiangsu",4/1/2013,NA,NA,4/10/2013,NA,yes,NA,NA,28,NA,NA,28,9,NA,yes,NA,NA,NA,NA,https://www.who.int/csr/don/2013_04_10/en/,DON-2013-04-10
2013-H7 Influenza-CHN,3,2013,4/11/2013,H7N9,NA,China,CHN,"Jiangsu, Shanghai, Zhejiang",3/29/2013,NA,NA,4/11/2013,NA,yes,NA,NA,38,NA,NA,38,10,NA,yes,NA,NA,NA,NA,https://www.who.int/csr/don/2013_04_11/en/,DON-2013-04-11
2013-H7 Influenza-CHN,3,2013,4/12/2013,H7N9,NA,China,CHN,"Zhejiang, Shanghai",4/3/2013,NA,NA,4/12/2013,NA,yes,NA,NA,43,NA,NA,43,11,NA,yes,NA,NA,NA,NA,https://www.who.int/csr/don/2013_04_12/en/,DON-2013-04-12
2013-H7 Influenza-CHN,3,2013,4/13/2013,H7N9,NA,China,CHN,"Beijing, Shanghai, Jiangsu",4/1/2013,NA,NA,4/13/2013,NA,yes,NA,NA,49,NA,NA,NA,11,NA,yes,NA,NA,NA,states that future updates will be less number-centric and more focused on epidimiologic trends,https://www.who.int/csr/don/2013_04_13/en/,DON-2013-04-13
2013-H7 Influenza-CHN,3,2013,4/14/2013,H7N9,NA,China,CHN,Henan,4/6/2013,NA,NA,4/14/2013,NA,yes,NA,NA,51,NA,NA,NA,11,NA,yes,NA,NA,NA,NA,https://www.who.int/csr/don/2013_04_14/en/,DON-2013-04-14
2013-H7 Influenza-CHN,3,2013,4/15/2013,H7N9,NA,China,CHN,"Zhejiang, Shanghai, Jiangsu",3/29/2013,NA,NA,4/15/2013,NA,yes,NA,NA,60,NA,NA,NA,13,NA,yes,NA,NA,NA,NA,https://www.who.int/csr/don/2013_04_15/en/,DON-2013-04-15
2013-H7 Influenza-CHN,3,2013,4/16/2013,H7N9,NA,China,CHN,"Jiangsu, Zhejiang, Anhui",4/3/2013,NA,NA,4/16/2013,NA,yes,NA,NA,63,NA,NA,NA,14,NA,yes,NA,NA,NA,NA,https://www.who.int/csr/don/2013_04_16/en/,DON-2013-04-16
2013-H7 Influenza-CHN,3,2013,4/17/2013,H7N9,NA,China,CHN,"Zhejiang, Shanghai, Jiangsu",NA,NA,NA,4/17/2013,NA,yes,NA,NA,82,NA,NA,NA,17,NA,yes,NA,NA,NA,NA,https://www.who.int/csr/don/2013_04_17/en/,DON-2013-04-17
2013-H7 Influenza-CHN,3,2013,4/18/2013,H7N9,NA,China,CHN,"Anhui, Henan, Jiangsu, Zhejiang, Beijing, Shanghai",NA,NA,NA,4/18/2013,NA,yes,NA,NA,87,NA,NA,NA,17,NA,yes,NA,NA,NA,NA,https://www.who.int/csr/don/2013_04_18/en/,DON-2013-04-18
2013-H7 Influenza-CHN,3,2013,4/19/2013,H7N9,NA,China,CHN,"Jiangsu, Zhejiang",NA,NA,NA,4/19/2013,NA,yes,NA,NA,91,NA,NA,NA,17,NA,yes,NA,NA,NA,NA,https://www.who.int/csr/don/2013_04_19/en/,DON-2013-04-19
2013-H7 Influenza-CHN,3,2013,4/20/2013,H7N9,NA,China,CHN,"Shanghai, Jiangsu, Zhejiang",NA,NA,NA,4/20/2013,NA,yes,NA,NA,96,NA,NA,NA,18,NA,yes,NA,NA,NA,NA,https://www.who.int/csr/don/2013_04_20/en/,DON-2013-04-20
2013-H7 Influenza-CHN,3,2013,4/21/2013,H7N9,NA,China,CHN,"Shanghai, Zhejiang",NA,NA,NA,4/21/2013,NA,yes,NA,NA,102,NA,NA,NA,20,NA,yes,NA,NA,NA,NA,https://www.who.int/csr/don/2013_04_21/en/,DON-2013-04-21
2013-H7 Influenza-CHN,3,2013,4/22/2013,H7N9,NA,China,CHN,Zhejiang,4/14/2013,NA,NA,4/22/2013,NA,yes,NA,NA,104,NA,NA,NA,21,NA,yes,NA,NA,NA,NA,https://www.who.int/csr/don/2013_04_22/en/,DON-2013-04-22
2013-H7 Influenza-CHN,3,2013,4/23/2013,H7N9,NA,China,CHN,"Zhejiang, Anhui, Shandong",4/14/2013,NA,NA,4/23/2013,NA,yes,NA,NA,108,NA,NA,NA,22,NA,yes,NA,NA,NA,NA,https://www.who.int/csr/don/2013_04_23/en/,DON-2013-04-23
2013-H7 Influenza-CHN,3,2013,4/25/2013,H7N9,NA,China,CHN,Jiangsu,4/12/2013,NA,NA,4/25/2013,NA,4/24/2013,NA,NA,109,NA,NA,NA,22,NA,yes,NA,NA,NA,NA,https://www.who.int/csr/don/2013_04_25/en/,DON-2013-04-25
2013-H7 Influenza-CHN,3,2013,4/29/2013,H7N9,NA,China,CHN,"Zhejiang, Fujian, Jiangxi, Shandong, Hunan, Jiangsu, Henan",3/8/2013,NA,NA,4/29/2013,NA,yes,NA,NA,126,NA,NA,NA,24,NA,yes,NA,NA,NA,NA,https://www.who.int/csr/don/2013_04_29/en/,DON-2013-04-29
2013-H7 Influenza-CHN,3,2013,5/2/2013,H7N9,NA,China,CHN,Fujian,4/21/2013,NA,NA,5/2/2013,NA,yes,NA,NA,128,NA,NA,NA,26,NA,yes,NA,NA,NA,NA,https://www.who.int/csr/don/2013_05_02/en/,DON-2013-05-02
2013-MERS-CoV-SAU,2,2013,5/2/2013,nCoV,NA,Saudi Arabia,SAU,NA,NA,NA,NA,5/2/2013,NA,yes,NA,NA,24,NA,NA,24,16,NA,NA,NA,NA,NA,global total,https://www.who.int/csr/don/2013_05_02_ncov/en/,DON-2013-05-02-ncov
2013-MERS-CoV-SAU,2,2013,5/3/2013,nCoV,NA,Saudi Arabia,SAU,NA,NA,NA,NA,5/3/2013,NA,yes,NA,NA,27,NA,NA,27,16,NA,NA,NA,NA,NA,global total,https://www.who.int/csr/don/2013_05_03_ncov/en/,DON-2013-05-03-ncov
2013-MERS-CoV-SAU,2,2013,5/6/2013,nCoV,NA,Saudi Arabia,SAU,NA,NA,NA,NA,5/6/2013,NA,yes,NA,NA,30,NA,NA,30,18,NA,NA,NA,NA,NA,global total,https://www.who.int/csr/don/2013_05_06_ncov/en/,DON-2013-05-06-ncov
2013-H7 Influenza-CHN,3,2013,5/7/2013,H7N9,NA,China,CHN,Fujian,4/26/2013,NA,NA,5/7/2013,NA,yes,NA,NA,130,NA,NA,NA,31,NA,yes,NA,NA,NA,NA,https://www.who.int/csr/don/2013_05_07/en/,DON-2013-05-07
2013-H7 Influenza-CHN,3,2013,5/8/2013,H7N9,NA,China,CHN,Jiangxi,5/3/2013,NA,NA,5/8/2013,NA,yes,NA,NA,131,NA,NA,NA,32,NA,yes,NA,NA,NA,NA,https://www.who.int/csr/don/2013_05_08/en/,DON-2013-05-08
